dataHoraInicio;keywords;tipoDiscurso;transcricao
2013-11-26T19:34;LEGISLAÇÃO, DOAÇÃO, FUNDO DA INFANCIA E  ADOLESCENCIA, SOLICITAÇÃO, DIVULGAÇAO;PELA ORDEM;"O SR. EDMAR ARRUDA (PSC-PR. Pela ordem. Sem revisão do orador.) - Sr. Presidente, enquanto não se inicia a votação do Código de Processo Civil, gostaria de aproveitar este momento para conclamar as Deputadas e os Deputados para, neste final de ano, nos Estados e nos Municípios, divulgarem a lei que permite a doação ao Fundo da Infância e Adolescência.
	Nós fizemos uma alteração na lei. Hoje, o cidadão pode fazer a sua doação até o dia 30 de abril. No entanto, a contribuição de 6% ficará limitada a 3% se ela não for feita - parte dela pelo menos - até o dia 31 de dezembro.
	Portanto, nós precisamos conscientizar as nossas Lideranças porque esse recurso fica diretamente no Município, a favor das nossas crianças e dos nossos adolescentes. E precisamos conscientizar a população como um todo, em especial os contadores, muito importantes nesse processo, para que, na hora em que o cidadão fizer a sua declaração, no dia 30 de abril, ele possa indicar a contribuição para o Fundo da Infância e Adolescência. Na hora da declaração, vai ser impresso um DARF referente à parte do imposto e outro DARF referente à parte da doação direta para o Fundo da Infância e Adolescência do seu Município.
	Então, é muito importante. Só para que V.Exas. tenham uma ideia, de um ano para o outro, de 2012 para 2013, ano-base 2011/2012, houve um aumento de mais de 20 milhões de reais na arrecadação, e já ficaram nos Municípios para atender às nossas crianças.
	O SR. PRESIDENTE (Simão Sessim) - Para concluir, Deputado. Nós já estamos iniciando a Ordem do Dia.
	O SR. EDMAR ARRUDA - Então, Sr. Presidente, é um desafio.
Era esse o lembrete que queria fazer aos nobres Deputados.
	Muito obrigado."
2013-11-27T18:54;PEC 353/2013, PROPOSTA, EMENDA CONSTITUCIONAL, OBRIGATORIEDADE, EXECUÇÃO ORÇAMENTÁRIA, EMENDA INDIVIDUAL,  ORÇAMENTO, UNIÃO FEDERAL, SENADO,  COMENTÁRIO.;BREVES COMUNICAÇÕES;"O SR. EDMAR ARRUDA (PSC-PR. Sem revisão do orador.) - Sr. Presidente, aproveito para falar um pouquinho do nosso prazo para apresentar as emendas individuais.
	Pela primeira vez, nós estamos aprovando emendas já impositivas ao Orçamento. Eu espero que nós possamos, realmente, fazer com que as nossas emendas sejam impositivas, o que obrigaria o Governo a empenhar as nossas emendas. 
Nós temos que ficar atentos - e faço aqui um alerta aos nossos Deputados, já que nós vamos avaliar essa PEC novamente -, porque ela não estabelece prazo para pagamento. E nós sabemos que empenhar é uma coisa, pagar é outra. De repente, nós estamos achando aqui que estamos fazendo um grande negócio, fazendo as emendas impositivas, passando isso para os nossos Prefeitos e, depois, nós vamos ficar com uma bucha maior do que a que existe hoje.
	O SR. PRESIDENTE (Simão Sessim) - Para encerrar, Deputado, para começarmos a Ordem do Dia.
	O SR. EDMAR ARRUDA - Eu vou encerrar, Sr. Presidente. Se V. Exa. puder me dar 30 segundos, eu encerro. Por favor.
	Estou dizendo aos Deputados que nós precisamos analisar melhor essa PEC. A nossa assessoria apontou vários problemas na PEC que nós aprovamos aqui, e nós podemos ficar sem nenhum instrumento para que o Governo, para que o Executivo pague as nossas emendas.
	Empenhar é tranquilo. Agora, pagar é outra coisa.
	Obrigado, Sr. Presidente.
	O SR. PRESIDENTE (Simão Sessim) - De nada."
2013-12-04T19:52;"PEC 90/2011, PROPOSTA, EMENDA CONSTITUCIONAL, SEGUNDO TURNO, VOTAÇÃO, CONVOCAÇÃO, BANCADA, PARTIDO POLÍTICO, PSC, COMPARECIMENTO, PLENÁRIO.
HABITAÇÃO COLETIVA, SINDICATO DA HABITAÇÃO E CONDOMÍNIOS DO PARANÁ, SECOVI-PR, ANIVERSÁRIO DE FUNDAÇÃO, CONGRATULAÇÕES.";PELA ORDEM;"O SR. EDMAR ARRUDA (PSC-PR. Pela ordem. Sem revisão do orador.) - Sr. Presidente, nós queremos solicitar aos Deputados do Partido Social Cristão que venham ao plenário votar - a votação é nominal -, para que possamos aprovar em segundo turno esta PEC e, com isso, fazer justiça a um projeto da nossa Deputada Luiza Erundina, permitindo que termine hoje o processo de votação.
	Eu gostaria também de registrar, nos Anais desta Casa, os meus cumprimentos ao Sindicato da Habitação e Condomínios do Paraná - SECOVI-PR pelos 30 anos de serviços prestados à Nação brasileira.
	O SECOVI-PR tem feito um grande trabalho não só no Estado, mas também no Brasil. Nós implantamos um projeto de atendimento na área médica para os trabalhadores dos condomínios, das incorporadoras, das imobiliárias, gratuitamente, pago pelos empregadores, dando dignidade e qualidade de vida aos nossos trabalhadores.
	Eu parabenizo, portanto, o SECOVI-PR."
2013-12-11T18:04;"PEC 55/2011, PROPOSTA, EMENDA CONSTITUCIONAL, APROVAÇÃO, CÂMARA DOS DEPUTADOS, CONGRATULAÇÕES.
GOVERNO FEDERAL, LIDERANÇA, ATUAÇÃO, DISCRIMINAÇÃO, PARTIDO POLÍTICO, PSC, RECLAMAÇÃO.
ROBSON RAMOS, PREFEITO, AILTON PEREIRA LOIOLA, JOSÉ LAURINDO DA SILVA, VEREADOR, MUNICÍPIO, IVATUBA, PR, PRESENÇA, DISTRITO FEDERAL, AGRADECIMENTO.";;"O SR. EDMAR ARRUDA (PSC-PR. Pela ordem. Sem revisão do orador.) - Vou requerer um seguro para as costas, por ficar de pé. 
	Sr. Presidente, primeiro quero, em nome dos Deputados do PSC, parabenizar  V.Exa. pela aprovação dessa PEC. É uma PEC importante para os nossos agentes de trânsito. Todos nós, Deputados do PSC, votamos favoravelmente. Parabenizarmos todos os agentes de trânsito. 
	Registro também o nosso repúdio a este último episódio do Governo com relação às bancadas dos nossos partidos que fazem parte da base e foram, de certa forma, colocados como que em segunda linha, vamos chamar assim. 
	Eu espero que os nossos Líderes possam, na próxima segunda-feira, ter uma reunião com o Governo, e que isso fique esclarecido, porque não é justo com esta Casa nem com os partidos da base serem tratados da forma como estão sendo. 
	Eu quero agradecer a visita ao Prefeito de Ivatuba, do Paraná, Dr. Robson, nosso companheiro, que esteve acompanhado dos Vereadores Ailton, do PT, e José, do PTB. Eles visitaram Brasília. Quero agradecer a presença deles e, mais uma vez, parabenizar esta Casa pela aprovação dessa PEC. 
	Muito obrigado. Sr. Presidente."
2013-12-17T00:00;MEMBROS, COMISSÃO MISTA DE PLANOS ORÇAMENTOS PÚBLICOS E FISCALIZAÇÃO, ATUAÇÃO, ELOGIO.;PELA ORDEM;"O SR. EDMAR ARRUDA (PSC - PR) - Sr. Presidente, enquanto a Mesa resolve a parte da documentação, eu queria aproveitar para parabenizar o Senador Lobão pela Presidência da Comissão Mista de Orçamento e também o nosso Relator, Deputado Miguel, e estender este cumprimento a todos os Deputados e Deputadas, Senadores e Senadoras que juntos construíram esta peça do Orçamento. 
Quero deixar registrados os nossos parabéns, porque estamos encerrando o ano aprovando um Orçamento equilibrado. Com certeza, este Orçamento vai trazer um grande benefício a toda a população brasileira. Parabéns a todos. Espero que o Governo Federal possa, em 2014, realmente executar todo este Orçamento, inclusive as nossas emendas de Bancada, para que os nossos Estados brasileiros possam fazer os investimentos. 
Houve aqui um trabalho incansável dos Deputados de cada Estado brasileiro, ajudando na composição do Orçamento e procurando colocar as obras necessárias na área da saúde, na área da educação, na área do transporte, na área da infraestrutura, para que os Estados tenham, em 2014, a possibilidade de implementar essas obras. 
Então, fica já o desafio para que o Governo Federal possa aplicar todas essas emendas de Bancada nos Estados, para que nós possamos, em benefício do povo brasileiro, trazer esse retorno."
2014-02-05T17:06;MPV 625/2013, MEDIDA PROVISÓRIA, CRÉDITO EXTRAORDINÁRIO, MINISTÉRIO DE MINAS E ENERGIA, MME, RECUPERAÇÃO, EQUIPAMENTO ELÉTRICO, CESSÃO, PAÍS ESTRANGEIRO, BOLÍVIA, REQUERIMENTO, RETIRADA, PAUTA, ORDEM DO DIA, VOTO FAVORÁVEL, PARTIDO POLÍTICO, PSC.;ORIENTAÇÃO DE BANCADA;"O SR. EDMAR ARRUDA (PSC-PR. Pela ordem. Sem revisão do orador.) - Sr. Presidente, o PSC vai votar ""sim"" à retirada de pauta da medida provisória.
Como Deputado deste País, eu fico indignado de receber uma medida provisória como esta, considerando que o Governo brasileiro, em dezembro, deixou de cumprir com as suas obrigações com as empresas prestadoras de serviços deste País: não repassou 1,5 bilhão de reais do Tesouro para a Caixa Econômica, para honrar os seus compromissos com as empresas que estão fazendo o Programa Minha Casa, Minha Vida. 
	Hoje mesmo eu recebi um telefonema de um Prefeito, liguei para a FUNASA, que tem uma enorme quantidade de compromissos atrasados, porque o Tesouro ainda não repassou os recursos para que se pague. 
	Então, eu acho que o Governo, primeiro, deveria fazer o dever de casa, pagar as suas contas e não ficar fazendo o que foi feito em dezembro para apresentar um superávit em que nem ele mesmo acredita, porque sabe que não foi verdadeiro.
	Sr. Presidente, concluindo, quero dizer que o Governo brasileiro precisa, primeiro, fazer o dever de casa, para depois, se sobrar dinheiro da saúde e da educação, fazer média com a Bolívia.
	Fica, portanto, o nosso posicionamento a favor da retirada e contra a medida provisória."
2014-02-11T19:34;DEPUTADO FEDERAL, PARTIDO POLÍTICO, PSC, COMPARECIMENTO, PLENÁRIO, VOTAÇAO, APOIO, PL 6025/2005, PROJETO DE LEI, REFORMULAÇAO, CÓDIGO DE PROCESSO CIVIL, EMENDA AGLUTINATIVA DE PLENÁRIO, PROIBIÇÃO, PENHORA, BLOQUEIO, DINHEIRO, APLICAÇÃO FINANCEIRA, ATIVO FINANCEIRO, TUTELA ANTECIPADA,;PELA ORDEM;"O SR. EDMAR ARRUDA (PSC-PR. Pela ordem. Sem revisão do orador.) - Sr. Presidente, quero pedir aos companheiros do PSC que venham ao plenário votar ""sim"" a esta emenda, para que nós possamos manter a justiça de forma qualificada e não com a penhora on-line da forma como está sendo proposta. 
	Vamos votar ""sim"" e manter o setor produtivo funcionando."
2014-03-26T17:04;PL 6655/2013, PROJETO DE LEI, CONCESSÃO, CRIAÇÃO, CARGO EM COMISSÃO, DIREÇÃO E ASSESSORAMENTO SUPERIOR (DAS), MINISTÉRIO DA CULTURA, ORIENTAÇÃO DE BANCADA, VOTO FAVORAVEL, PSC.;ORIENTAÇÃO DE BANCADA;"O SR. EDMAR ARRUDA (PSC-PR. Pela ordem. Sem revisão do orador.) - Sr. Presidente, o PSC vota ""sim"" nesta matéria, uma vez que nós estamos falando de oito cargos para a cultura. Nós apoiamos a cultura.
	Mas eu queria aproveitar esse tempo para pedir ao Governo, em especial ao Tesouro do Governo Federal, que repasse os recursos para a Caixa Econômica e o Banco do Brasil, a fim de que paguem em dia as medições das empresas que estão fazendo o Programa Minha Casa, Minha Vida. Não tem cabimento essas empresas não estarem recebendo, assim como as empresas que prestaram serviços para as Prefeituras, inclusive com recursos de emendas dos Parlamentares desta Casa, mas não estão recebendo. 
	O Governo precisa levar isso a sério. Nós precisamos fazer com que este País seja um país sério, porque todas as empresas têm os seus compromissos com os seus trabalhadores e com os seus fornecedores. 
	O PSC vota ""sim"" nesta matéria, Sr. Presidente.
	O SR. PRESIDENTE (Simão Sessim) - Vota ""sim""."
2014-04-01T20:02;MPV 627/2013, MEDIDA PROVISÓRIA, ALTERAÇÃO, LEGISLAÇÃO TRIBUTARIA FEDERAL, ORIENTAÇÃO DE BANCADA, VOTO FAVORÁVEL, PSC.;ORIENTAÇÃO DE BANCADA;"O SR. EDMAR ARRUDA (PSC-PR. Pela ordem. Sem revisão do orador.) - Sr. Presidente, o PSC vota ""sim"" a essa matéria, ressalvando os nossos destaques apresentados. 
	Queria aproveitar rapidamente este tempo para dizer que o Governo continua atrasando o pagamento do programa Minha Casa, Minha Vida. Eu recebi um ofício da CBIC - Câmara Brasileira da Indústria da Construção, que foi encaminhado à Presidente da República, Dilma Rousseff, solicitando providências. Então, nós queremos aqui reforçar o pedido. É um programa do Governo Federal que gera centenas de milhares de empregos, mas o Governo tem que respeitar e pagar a conta. Portanto, nós precisamos que o Governo Federal pague as faturas do programa Minha Casa, Minha Vida."
2014-04-02T16:22;MPV 627/2013, MEDIDA PROVISÓRIA, PLV 2/2014, PROJETO DE LEI DE CONVERSÃO, EMENDA AGLUTINATIVA, INCLUSÃO, DISPOSITIVO, AUSÊNCIA, TRIBUTAÇÃO, IMPOSTO DE RENDA, CONTRIBUIÇÃO SOCIAL, EMPRESA, CONTRATO, CONSTRUÇÃO CIVIL,  VIGÊNCIA, PAÍS ESTRANGEIRO, ENCAMINHAMENTO DE VOTAÇÃO, FAVORÁVEL.;ENCAMINHAMENTO DE VOTAÇÃO;"O SR. EDMAR ARRUDA (PSC-PR. Sem revisão do orador.) - Sr. Presidente, nobres Deputados, nós, do PSC, apresentamos a Emenda Aglutinativa nº 179, fazendo justiça às empresas que hoje estão com contratos vigentes no exterior. 
	Portanto, nós estamos propondo aqui tirar o benefício do inciso X do art. 83. Em compensação, nós não tributamos com Imposto e Renda e Contribuição Social os contratos em andamento, para manter o equilíbrio econômico-financeiro dos contratos. 
	Também gostaria, nesta oportunidade, aproveitando aqui este tempo, de dizer que - em um acordo que foi feito com o PDT e o PSD - o PSC estava apresentando a Emenda nº 251, com relação ao Programa de Recuperação Fiscal - REFIS das empresas. Então, nós também estaremos apoiando a Emenda nº 251, que foi proposta pelo PDT e PSD, porque entendemos ser necessário dar às empresas do Brasil - pequenas, médias e grandes empresas -, que têm dívida com o Governo Federal, a oportunidade de fazer o seu REFIS, o seu parcelamento, nos moldes que foram concedidos para os bancos. 
Por isso nós defendemos a Emenda nº 251.
	Tenho certeza absoluta de que os Deputados e Deputadas desta Câmara estarão aprovando essa emenda, permitindo a reabertura do REFIS, como diz aqui no texto, com o objetivo de facilitar para que as empresas possam pagar os seus débitos. E, ao mesmo tempo, fazer com que haja um aumento da arrecadação, como foi comprovado no ano passado com o REFIS.
	Então, poderão ser pagas ou parceladas as dívidas vencidas até 30 de junho de 2013, de pessoas físicas ou jurídicas, consolidadas pelo sujeito passivo, com exigibilidade suspensa ou não, inscritas ou não em dívida ativa, consideradas isoladamente, mesmo em fase de execução fiscal já ajuizada ou que tenham sido objeto de parcelamento anterior, não integralmente quitado, ainda que cancelado por falta de pagamento. Ou seja, nós abrimos aqui a possibilidade para que as empresas possam participar novamente do REFIS, trazendo os seus débitos vencidos até junho de 2013.
	Então, peço o apoio dos Srs. Deputados para a Emenda Aglutinativa nº 1, à Emenda nº 179, e também, posteriormente, à Emeda nº 251, que abre o REFIS para todas as empresas.
	Muito obrigado, Sr. Presidente, Sras. e Srs. Deputados."
2014-04-02T16:22;MPV 627/2013, MEDIDA PROVISÓRIA, PLV 2/2014, PROJETO DE LEI DE CONVERSÃO, EMENDA, INCIDÊNCIA, IMPOSTO DE RENDA, LUCRO, EMPRESA NACIONAL, FILIAL, PAIS ESTRANGEIRO, COBRANÇA, REMESSA, BRASIL, INVESTIMENTO, ATIVIDADE PRODUTIVA, ORIENTAÇÃO DE BANCADA, PSC, CONTRÁRIO.;ORIENTAÇÃO DE BANCADA;"O SR. EDMAR ARRUDA (PSC-PR. Pela ordem. Sem revisão do orador.) - Sr. Presidente, o PSC vota ""não"", entendendo que, neste momento, se nós votarmos favoravelmente a essa matéria, nós comprometeremos toda a medida provisória.
	Por isso, o PSC cumpre o acordo que foi feito com as Lideranças, votando ""não""."
2014-04-02T18:36;MPV 627/2013, MEDIDA PROVISÓRIA, PLV 2/2014, PROJETO DE LEI DE CONVERSÃO, EMENDA, AMPLIAÇÃO, PRAZO, ADESÃO, PROGRAMA DE RECUPERAÇÃO FISCAL (REFIS), ORIENTAÇÃO DE BANCADA, PSC, FAVORÁVEL.;ORIENTAÇÃO DE BANCADA;"O SR. EDMAR ARRUDA (PSC-PR. Sem revisão do orador.) - Sr. Presidente, o PSC vai votar ""sim"".
	Nós temos trabalhado e defendido uma isonomia entre o setor produtivo e aquilo que foi dado para o setor financeiro, para os bancos. Não é justo nós fazermos um REFIS para os bancos, para as seguradoras, e não darmos esse mesmo benefício para as empresas, em especial as pequenas, as médias, que produzem, que geram emprego, que geram renda neste País.
	Portanto, nós cremos que a Presidente Dilma, após analisar, não vai vetar este artigo, porque é de muita importância para que nossas empresas continuem produzindo. Além do mais, nós precisamos da arrecadação, e, se não for concedido este REFIS que a Câmara está aprovando hoje, não teremos a arrecadação dessas empresas.
	Por isso, nós apelamos para que não seja vetado este artigo, Sr. Presidente."
2014-04-08T21:00;MPV 628/2013, MEDIDA PROVISÓRIA, EMENDA, DESTAQUE PARA VOTAÇÃO EM SEPARADO (DVS),  UNIÃO FEDERAL, AUTORIZAÇÃO, PARTICIPAÇÃO, PERCENTUAL, CAPITAL SOCIAL, BANCO REGIONAL DE DESENVOLVIMENTO DO EXTREMO SUL  (BRDE), ORIENTAÇÃO DE BANCADA, PSC, FAVORÁVEL.;ORIENTAÇÃO DE BANCADA;"O SR. EDMAR ARRUDA (PSC-PR. Pela ordem. Sem revisão do orador.) - Sr. Presidente, primeiro, queremos parabenizar o Deputado Alfredo Kaefer, do Paraná.
	O PSC vota ""sim"" porque fortalece o BRDE, de forma que vem a permitir que se faça investimento também em outras regiões, e não só no Sul.
	Então, quero parabenizar o Deputado Alfredo Kaefer. 
O PSC vota ""sim""."
2014-04-08T21:00;PDC 1123/2013, PROJETO DE DECRETO LEGISLATIVO, SUSTAÇÃO, RESOLUÇÃO, AGÊNCIA NACIONAL DE VIGILÂNCIA SANITÁRIA (ANVISA), PROIBIÇÃO, UTILIZAÇÃO, MEDICAMENTO ANOREXÍGENO, PRESCRIÇÃO, DISPENSAÇÃO DE MEDICAMENTO, OBESIDADE, ORIENTAÇÃO DE BANCADA, PSC, LIBERAÇÃO, VOTAÇÃO.;ORIENTAÇÃO DE BANCADA;"O SR. EDMAR ARRUDA (PSC-PR. Pela ordem. Sem revisão do orador.) - Sr. Presidente, o PSC vai liberar a bancada. Trata-se de um assunto muito difícil de se discutir, porque nós estamos legislando de forma a invadir uma normativa da ANVISA.
	Concordo com os argumentos de que nós não estamos fazendo isso, porque na verdade nós continuamos dando liberdade aos médicos. Mas, de qualquer maneira, é necessário o aprofundamento do debate, porque eu penso que, fora aqueles que são médicos e que estão aqui no plenário, nós que não somos não temos conhecimento suficiente para lidar com essa área.
	Então, eu libero a bancada do PSC: os Deputados que entenderem que devem votar ""sim"" votam ""sim"" e os que acharem que devem votar ""não"" votam ""não""."
2014-04-08T21:00;MPV 628/2013, MEDIDA PROVISÓRIA, CRIAÇÃO, FONTE DE RECURSOS, BANCO NACIONAL DE DESENVOLVIMENTO ECONÔMICO E SOCIAL (BNDES), ALTERAÇÃO, ENCERRAMENTO, FUNDO DE RECUPERAÇÃO ECONÔMICA DO ESTADO DO ESPÍRTIO SANTO (FUNRES), GRUPO EXECUTIVO PARA RECUPERAÇÃO ECONÔMICA DO ESTADO DO ESPÍRITO SANTO, ORIENTAÇÃO DE BANCADA, PSC, FAVORÁVEL.;ORIENTAÇÃO DE BANCADA;"O SR. EDMAR ARRUDA (PSC-PR. Pela ordem. Sem revisão do orador.) - Sr. Presidente, o PSC vota ""sim"" e entende que seria muito interessante nesta discussão, quando se trouxessem números, que se trouxesse também sua complementação.
	É claro que o BNDES tem financiado pequenas e médias empresas, e foi até dito aqui que foram mais de 1 milhão de empresas. Mas seria interessante que fosse explicitado o volume de recursos, porque muitas vezes o número de empresas não tem significado em relação ao volume aplicado. Seria muito importante que se apresentassem esses números, para que nós os soubéssemos. Eu vou fazer um levantamento e mostrar quantos bilhões foram aplicados nesse 1 milhão de empresas e quantos bilhões dos financiamentos concedidos foram aplicados nos 10%.
	Muito obrigado, Sr. Presidente."
2014-04-09T16:18;PLV 1/2014, PROJETO DE LEI DE CONVERSÃO, MPV 630/2013, MEDIDA PROVISÓRIA, ALTERAÇÃO, REGIME DIFERENCIADO DE CONTRATAÇÕES PÚBLICAS (RDC), DIRETRIZES, LICITAÇÃO, DESTAQUE, SUBSTITUIÇÃO, ARTIGO, ORIENTAÇÃO DE BANCADA, VOTO FAVORAVEL, PSC.;ORIENTAÇÃO DE BANCADA;"O SR. EDMAR ARRUDA (PSC-PR. Pela ordem. Sem revisão do orador.) - Sr. Presidente, creio que esta Casa estará incorrendo num erro se aprovar esse RDC ampliado, conforme o relatório da Senadora Gleisi Hoffmann, da Comissão Mista. Um Deputado da base do Governo veio ao microfone dizer que a Lei 8.666 permite mais desvios de recurso público do que o RDC. Só quem não entende de licitação faz esse tipo de afirmação. Hoje a Lei 8.666 estabelece o teto do preço. Há um limite máximo de preço, enquanto no RDC é o concorrente que vai estabelecer o preço. Pior ainda: vai fazer o projeto, vai fazer o quantitativo, vai estabelecer o memorial descritivo, vai estabelecer o preço e vai estabelecer a propina que vai ser devolvida, principalmente para aqueles que estão contratando!
	Então, Sr. Presidente, nós votamos ""sim"" ao destaque, para que o mal seja menor."
2014-04-09T16:18;PLV 1/2014, PROJETO DE LEI DE CONVERSÃO, MPV 630/2013, MEDIDA PROVISÓRIA, ALTERAÇÃO, REGIME DIFERENCIADO DE CONTRATAÇÕES PÚBLICAS (RDC), DIRETRIZES, LICITAÇÃO,  ORIENTAÇÃO DE BANCADA, VOTO FAVORAVEL, PSC.;ORIENTAÇÃO DE BANCADA;"O SR. EDMAR ARRUDA (PSC-PR. Pela ordem. Sem revisão do orador.) - Sr. Presidente, nós entendemos que é necessária, sim, a atualização da Lei nº 8.666. Agora, vir aqui ao plenário e dizer que ela é a mazela deste País? Não é verdade! Não é verdade! 
	E a pressa em votar o RDC, que começou com as obras da Copa e das Olimpíadas por incompetência de gestão, e vir dizer agora que ele é a solução para todos os problemas? Não é verdade! Não é verdade! 
	Eu acho que nós precisamos fazer uma atualização da Lei nº 8.666. E nós precisamos analisar o que o RDC traz de bom. É verdade! Mas e o que ele traz de ruim? Será que ele não tem nenhuma mazela? Será que o superfaturamento dos estádios não tem a ver com o RDC? Será que não tem a ver com a licitação sem projeto básico, sem projeto executivo? Como é que se estabelece um preço, como aconteceu com a Copa, sem ter os projetos? 
	Então, nós precisamos aprofundar essa discussão. O PSC vai votar ""sim"" a esta matéria, mas nós temos que deixar isso registrado. Eu, em especial, sou contra e vou votar ""não"", porque acho que nós precisamos de uma discussão mais aprofundada sobre a Lei nº 8.666. 
	Muito obrigado, Sr. Presidente."
2014-04-09T19:32;PLV 01/2014, PROJETO DE LEI DE CONVERSÃO, MPV 630/2013, MEDIDA PROVISÓRA, DISPOSTIVO, DESTAQUE PARA VOTAÇÃO EM SEPARADO (DVS), ALTERAÇÃO, LEI FEDERAL, CRIAÇÃO, REGIME DIFERENCIADO DE CONTRATAÇÕES PÚBLICAS (RDC), APLICAÇÃO, UNIÃO FEDERAL, ESTADOS, MUNICÍPIOS, DF, ORIENTAÇÃO DE BANCADA, PSC, FAVORÁVEL.;ORIENTAÇÃO DE BANCADA;"O SR. EDMAR ARRUDA (PSC-PR. Pela ordem. Sem revisão do orador.) - Sr. Presidente, o PSC vota ""não"". E peço aos nobres Deputados e Deputadas que nós possamos ainda recuperar - na votação passada, nós deixamos de recuperar - e não colocar em risco essa mudança, sem nenhum critério, transportando todas as licitações para o RDC.
Então, deixo aqui um apelo aos nobres Deputados: vamos fazer RDC apenas para aquilo que o Governo pediu que fosse feito. Nós estamos votando a favor do texto do Governo e não ao texto da Senadora Gleisi. Entendemos que já foi amplamente debatido. Nós temos um projeto de lei em andamento, pegando aquilo que é bom da Lei nº 8.666, junto com aquilo que é bom do RDC; vamos ter uma lei, um projeto de lei, e não através de uma medida provisória simplesmente arquivar, acabar com a lei que veio moralizar o processo de licitação no Brasil.
Muito obrigado, Sr. Presidente."
