dataHoraInicio;keywords;tipoDiscurso;transcricao
2012-05-09T20:54;PEC 438/2001, PROPOSTA, EMENDA CONSTITUCIONAL, PENA DE PERDIMENTO, DESAPROPRIAÇÃO, GLEBA, PROPRIEDADE RURAL, TRABALHO ESCRAVO, REVERSÃO, ASSENTAMENTO RURAL, PROPRIEDADE URBANA,  PROGRAMA, HABITAÇÃO POPULAR, SEGUNDO TURNO,   PROPOSTA, ADIAMENTO, APOIO, PARTIDO POLÍTICO, PSC, DEFESA,   DEFINIÇÃO, TRABALHO ESCRAVO, LEI FEDERAL, SEGURANÇA JURÍDICA, MATÉRIA.;PELA ORDEM;"O SR. EDMAR ARRUDA (PSC-PR. Pela ordem. Sem revisão do orador.) - Sr. Presidente, vou falar, só preciso de tempo.
O PSC se reuniu hoje. Eu acho que seria injusto algum Deputado acusar um colega ou uma colega Deputada de ser contra esse projeto, no sentido de ser a favor do trabalho escravo. É o contrário.
Eu acho que esta Casa tem a unanimidade de posicionamento contrário ao trabalho escravo, e a bancada do PSC é contrária ao trabalho escravo. Agora, por outro lado, esta Casa tem responsabilidade. Mesmo com a argumentação de que essa matéria está aqui há 7 anos, eu gostaria também de lembrar que nesta última legislatura houve renovação de 45% dos seus Deputados. Então, nós estamos discutindo, de fato, com todos os Parlamentares, inclusive aqueles de primeiro mandato, essa matéria nos últimos dias.
E acho que postergar essa decisão para o dia 22, como foi proposto pelo Deputado Henrique Eduardo Alves, do PMDB, não vai, de forma alguma, prejudicar; muito pelo contrário, nós vamos ganhar tempo para construir um acordo que venha regulamentar, de fato, o que é o trabalho escravo, não dando ainda mais insegurança jurídica para aquele que está no campo e para aquele que está na cidade.
Portanto, o PSC é radicalmente contra o trabalho escravo, mas nós queremos produzir e aprovar uma lei que venha pacificar e punir aqueles que promovem o trabalho escravo e não criar insegurança jurídica e mais uma indústria de ações nos tribunais do nosso Brasil.
Portanto, Sr. Presidente, o PSC concorda com a prorrogação da votação para o dia 22."
2012-07-04T17:08;"MPV 567/2012, MEDIDA PROVISÓRIA, ALTERAÇÃO, LEI FEDERAL, NORMAS, DESINDEXAÇÃO, ECONOMIA, ALTERAÇÃO, CÁLCULO, REMUNERAÇÃO, RENDIMENTO, CADERNETA DE POUPANÇA, PLV 17/2012, PROJETO DE LEI DE CONVERSÃO.
EMENDA, DESTAQUE, INCLUSÃO, CONTAS, FUNDO DE GARANTIA POR TEMPO DE SERVIÇO, FGTS, CRITÉRIOS, REMUNERAÇÃO, CADERNETA DE POUPANÇA,  VOTO FAVORÁVEL,    PARTIDO POLÍTICO, PSC.";ORIENTAÇÃO DE BANCADA;"O SR. EDMAR ARRUDA (PSC-PR. Pela ordem. Sem revisão do orador.) - Sr. Presidente, o PSC encaminha ""sim"", entende que é justo corrigir o saldo do Fundo de Garantia pelo mesmo índice da caderneta de poupança, uma vez que os recursos do Fundo, que é patrimônio do trabalhador, são aplicados em financiamentos que têm a obrigação de remunerar os recursos com, no mínimo, o rendimento da caderneta de poupança. Se a aplicação desses recursos não está auferindo uma correção igual à da caderneta de poupança, é melhor colocarmos esse dinheiro na caderneta de poupança e garantirmos essa remuneração ao patrimônio do trabalhador.
	Por isso defendemos que esta não é uma questão de Oposição ou Situação, mas sim de justiça aos trabalhadores deste País com a correção adequada do patrimônio que é deles, qual seja, o Fundo de Garantia do Tempo de Serviço.
	Muito obrigado, Sr. Presidente."
2012-07-04T17:08;"MPV 567/2012, MEDIDA PROVISÓRIA, ALTERAÇÃO, LEI FEDERAL, NORMAS, DESINDEXAÇÃO, ECONOMIA, ALTERAÇÃO, CÁLCULO, REMUNERAÇÃO, RENDIMENTO, CADERNETA DE POUPANÇA, PLV 17/2012, PROJETO DE LEI DE CONVERSÃO.
EMENDA, DESTAQUE, AUMENTO, REMUNERAÇÃO, CADERNETA DE POUPANÇA, SALDO, MANUTENÇÃO, LONGO PRAZO, VOTO CONTRÁRIO, PARTIDO POLÍTICO, PSC.";ORIENTAÇÃO DE BANCADA;"O SR. EDMAR ARRUDA (PSC-PR. Pela ordem. Sem revisão do orador.) - Sra. Presidenta, o PSC encaminha ""não"", mesmo entendendo ser uma proposta inteligente, mas que precisa ser tratada individualmente, como um produto para os poupadores deste País.
Então, entendemos que nesta matéria de hoje não caberia fazer essa alteração. Por isso, o PSC encaminha ""não"", Sra. Presidente."
2012-07-04T17:08;"MPV 567/2012, MEDIDA PROVISÓRIA, ALTERAÇÃO, LEI FEDERAL, NORMAS, DESINDEXAÇÃO, ECONOMIA, ALTERAÇÃO, CÁLCULO, REMUNERAÇÃO, RENDIMENTO, CADERNETA DE POUPANÇA, PLV 17/2012, PROJETO DE LEI DE CONVERSÃO.
EMENDA, DESTAQUE, CRIAÇÃO, CADERNETA DE POUPANÇA DE LONGO PRAZO, VOTO FAVORÁVEL, PARTIDO POLÍTICO, PSC.";ORIENTAÇÃO DE BANCADA;"O SR. EDMAR ARRUDA (PSC-PR. Pela ordem. Sem revisão do orador.) - O PSC vota ""sim"", Sra. Presidente, porque entendemos que é uma grande oportunidade de criarmos uma poupança de longo prazo e de incentivarmos os poupadores desta Nação. 
	Por isso, mantendo a coerência do voto anterior, nós votamos ""sim""."
2012-07-04T20:14;PL 2057/2007, PROJETO DE LEI, DISCIPLINAMENTO, PROCESSO, JULGAMENTO, ÓRGÃO COLEGIADO, JUIZ, CRIME, ORGANIZAÇÃO CRIMINOSA, CRIME ORGANIZADO, PROTEÇÃO, INTEGRIDADE FÍSICA, MAGISTRADO, SUBSTITUTIVO, SENADO, VOTO FAVORÁVEL, PARTIDO POLÍTICO, PSC.;ORIENTAÇÃO DE BANCADA;"O SR. EDMAR ARRUDA (PSC-PR. Pela ordem. Sem revisão do orador.) - Sr. Presidente, o PSC encaminha o voto ""sim"", entendendo a importância deste projeto, por meio do qual passamos a dar condições aos juízes de julgarem, em primeira instância, em colegiado, os crimes que são cometidos por organizações criminosas. O objetivo da proposição é preservar a integridade dos nossos juízes.
	 Não podemos deixar que esses criminosos, que essas organizações criminosas coajam as pessoas e coloquem em risco a integridade física ou até mesmo a vida dos nossos juízes.
	Portanto, o PSC é favorável à matéria, para preservar a integridade física dos juízes e fazer justiça, a fim de que esses criminosos, depois de condenados, possam, de fato, ir para a cadeia.
	O PSC vota ""sim"", Sr. Presidente.
O SR. PRESIDENTE (Marco Maia) - Muito bem."
2012-07-11T10:58;DOENÇA, GRIPE H1N1, AUMENTO, INCIDÊNCIA, MORTE, PRECARIEDADE, VACINAÇÃO, APREENSÃO.;PELA ORDEM;"O SR. EDMAR ARRUDA (PSC-PR. Pela ordem. Sem revisão do orador.) - Presidente, enquanto o orador não chega à tribuna, digo a V.Exa. e a estes nobres Deputados da nossa preocupação relativa à gripe A no Sul, no sentido de que o Governo Federal possa agilizar o processo de importação das vacinas, uma vez que a campanha deste ano ficou muito abaixo do esperado.
	Estamos vendo, Sr. Presidente, várias crianças, vários idosos morrendo na nossa região por falta da vacina.
Estamos oficiando ao Governo, ao Ministério da Saúde, para que nos informe se é verdade que só há 100 mil vacinas para chegar ao Brasil para atender à demanda do País todo. É muito pouca vacina.
	Muito obrigado, Sr. Presidente."
2012-08-21T17:28;COMISSÃO DE FISCALIZAÇÃO FINANCEIRA E CONTROLE, REALIZAÇÃO, SEMINÁRIO, POLÍTICAS PÚBLICAS DE ESTÍMULO AO CONSUMO E SEUS REFLEXOS NA ECONOMIA DO BRASIL.;PELA ORDEM;"O SR. EDMAR ARRUDA (PSC-PR. Pela ordem. Sem revisão do orador.) - Sr. Presidente, nobres Deputados e Deputadas, na condição de Presidente da Comissão de Fiscalização Financeira e Controle, aprovamos a realização do Seminário Políticas Públicas de Estímulo ao Consumo e seus Reflexos na Economia do Brasil. Pretendemos, juntamente com economistas de várias correntes do País, com o Ministério da Fazenda e o Banco Central, discutir os reflexos das políticas públicas que estão sendo adotadas pelo Governo para estimular o consumo.
	Temos uma preocupação muito grande ao ver, de um lado, o índice de inadimplência aumentando de forma significativa e, de outro, o incentivo à obtenção do crédito, fazendo com que as famílias brasileiras tenham hoje um índice de endividamento muito alto.
	Já vimos esse filme antes. Vimos isso acontecendo na economia americana e na Europa. Estamos vendo agora o que está acontecendo. Por isso, é muito importante que esta Casa, através desta Comissão de Fiscalização Financeira e Controle, discuta esses temas, traga algumas medidas que estão sendo adotadas pelo Governo. Infelizmente, temos visto várias medidas sendo adotadas, projetos e medidas provisórias vindo para cá e serem aprovadas sem que possamos participar da discussão.
	Portanto, convido os Deputados e as Deputadas, em especial os membros da nossa Comissão, para participarem, amanhã, às 14 horas, no auditório Nereu Ramos, juntamente conosco, desse grande debate para a economia da Nação.
	Muito obrigado."
2012-11-13T10:20;;HOMENAGEM;"Ata da 304ª (tricentésima quarta) Sessão da Câmara dos Deputados, Não Deliberativa Solene, Matutina, da 2ª Sessão Legislativa Ordinária, da 54ª Legislatura, em 13 de novembro de 2012. Às 10h32, o Sr. Mauro Benevides, nos termos do § 2º do artigo 18 do Regimento Interno, no exercício da Presidência, declarou aberta a sessão e deu por dispensada a leitura da ata da sessão anterior. O Sr. Presidente informou que a sessão destinou-se à entrega do Prêmio Transparência e Fiscalização Pública; saudou convidados presentes; prestou as devidas homenagens; e convidou para compor a Mesa os Srs. Ministro Benjamin Zylmer, Presidente do Tribunal de Contas da União - TCU; Ministra Eliana Calmon Alves, Ministra do Superior Tribunal de Justiça - STJ; Deputado Edmar Arruda (PSC/PR), Presidente da Comissão de Fiscalização Financeira e Controle - CFFC; Gilberto Kassab, Prefeito da cidade de São Paulo; e Marcel Henrique Michelleto, filho do homenageado, Sr. Moacir Michelleto. O Sr. Presidente convidou a todos a ouvirem o Hino Nacional, executado pela Banda de Grupamento de Fuzileiros Navais de Brasília, regida pelo Suboficial Fuzileiro Naval Luiz Carlos Gomes Barbosa.  Após assistir ao vídeo institucional e proferir parcialmente o discurso do Sr. Marco Maia, Presidente da Câmara dos Deputados, o Sr. Presidente concedeu a palavra ao Sr. Edmar Arruda, autor do requerimento. Nos termos do § 2º do artigo 18 do Regimento Interno, assumiu a Presidência o Sr. Edmar Arruda. O Sr. Jilmar Tatto, Líder do PT, concedeu o título de Oradora de Honra da Sessão Solene à Sra. Eliana Calmon Alves, Ministra do Superior Tribunal de Justiça, em reconhecimento da sua atuação como Corregedora do Conselho Nacional de Justiça. O Sr. Edmar Arruda, autor da indicação, entregou ao Sr. Marcel Henrique Micheletto, filho do homenageado, Diploma que concede ao Sr. Moacir Micheletto, in memoriam, o título de Patrono do Prêmio Transparência e Fiscalização Pública, na categoria Governamental, por sua atuação como homem público de maior valor em importantes posições, principalmente na área de agricultura, assegurando a milhares de trabalhadores rurais condições que permitiram ao Brasil tornar-se um dos países mais dinâmicos no setor. O Sr. Guilherme Campos, autor da indicação, entregou o Prêmio Moacir Micheletto, categoria Governamental, ao Sr. Gilberto Kassab, Prefeito da cidade de São Paulo, pela prática de transparência dos dados públicos da cidade de São Paulo. O Sr. Carlos Magno, autor da indicação, entregou à Sra. Maria Zoraida Parra Motta, mãe do homenageado, Diploma que concede ao Sr. Jonathas Hugo Parra Motta, in memoriam, ex-Conselheiro do Tribunal de Contas do Estado de Rondônia, o título de Patrono do Prêmio Transparência e Fiscalização Pública, na categoria Sociedade Civil, pela ação de instituir sistema de dados e informações que devem integrar o processo de planejamento das receitas públicas nas propostas orçamentárias do Estado de Rondônia e dos municípios, regulamentados por meio da Instrução Normativa nº 1/TCER-99. O Sr. Edmar Arruda, autor da indicação, entregou à Sra. Fábia dos Santos Sacco, Presidente da Sociedade Eticamente Responsável, o Prêmio Jonathas Hugo Parra Motta, categoria Sociedade Civil, conferido à Sociedade Eticamente Responsável pela instituição do Projeto de Observatório Social de Maringá, criado com o intuito de proporcionar à sociedade oportunidades que promovam a coesão social por meio da transparência e zelo na gestão dos recursos públicos. Usaram da palavra as Sras. e os Srs. homenageados, Eliana Calmon Alves, Marcel Henrique Micheletto, Gilberto Kassab, Maria Zoraida Parra Motta e Fábia dos Santos Sacco. O Sr. Presidente concedeu a palavra aos Srs. Sérgio Brito, pelo PSD; Carlos Magno, pelo PP; André Moura, Líder do PSC; Roberto de Lucena, pelo PV; Rubens Bueno, Líder do Bloco Parlamentar PV/PPS; e Edson Santos, pelo PT. Usaram da palavra pela ordem os Srs. Luiz Carlos Heinze e Walter Feldman. O Sr. Presidente registrou a presença de convidados, reiterou as homenagens prestadas, agradeceu a presença de todos e, às 12h27, encerrou a sessão.

Mauro Benevides
Presidente

Raimundo Gomes de Matos
Secretário
As notas taquigráficas desta sessão solene poderão ser solicitadas ao Departamento de Taquigrafia, Revisão e Redação - DETAQ."
2012-11-13T10:20;;FALA DO PRESIDENTE OU NO EXERCÍCIO DA PRESIDÊNCIA;"Ata da 304ª (tricentésima quarta) Sessão da Câmara dos Deputados, Não Deliberativa Solene, Matutina, da 2ª Sessão Legislativa Ordinária, da 54ª Legislatura, em 13 de novembro de 2012. Às 10h32, o Sr. Mauro Benevides, nos termos do § 2º do artigo 18 do Regimento Interno, no exercício da Presidência, declarou aberta a sessão e deu por dispensada a leitura da ata da sessão anterior. O Sr. Presidente informou que a sessão destinou-se à entrega do Prêmio Transparência e Fiscalização Pública; saudou convidados presentes; prestou as devidas homenagens; e convidou para compor a Mesa os Srs. Ministro Benjamin Zylmer, Presidente do Tribunal de Contas da União - TCU; Ministra Eliana Calmon Alves, Ministra do Superior Tribunal de Justiça - STJ; Deputado Edmar Arruda (PSC/PR), Presidente da Comissão de Fiscalização Financeira e Controle - CFFC; Gilberto Kassab, Prefeito da cidade de São Paulo; e Marcel Henrique Michelleto, filho do homenageado, Sr. Moacir Michelleto. O Sr. Presidente convidou a todos a ouvirem o Hino Nacional, executado pela Banda de Grupamento de Fuzileiros Navais de Brasília, regida pelo Suboficial Fuzileiro Naval Luiz Carlos Gomes Barbosa.  Após assistir ao vídeo institucional e proferir parcialmente o discurso do Sr. Marco Maia, Presidente da Câmara dos Deputados, o Sr. Presidente concedeu a palavra ao Sr. Edmar Arruda, autor do requerimento. Nos termos do § 2º do artigo 18 do Regimento Interno, assumiu a Presidência o Sr. Edmar Arruda. O Sr. Jilmar Tatto, Líder do PT, concedeu o título de Oradora de Honra da Sessão Solene à Sra. Eliana Calmon Alves, Ministra do Superior Tribunal de Justiça, em reconhecimento da sua atuação como Corregedora do Conselho Nacional de Justiça. O Sr. Edmar Arruda, autor da indicação, entregou ao Sr. Marcel Henrique Micheletto, filho do homenageado, Diploma que concede ao Sr. Moacir Micheletto, in memoriam, o título de Patrono do Prêmio Transparência e Fiscalização Pública, na categoria Governamental, por sua atuação como homem público de maior valor em importantes posições, principalmente na área de agricultura, assegurando a milhares de trabalhadores rurais condições que permitiram ao Brasil tornar-se um dos países mais dinâmicos no setor. O Sr. Guilherme Campos, autor da indicação, entregou o Prêmio Moacir Micheletto, categoria Governamental, ao Sr. Gilberto Kassab, Prefeito da cidade de São Paulo, pela prática de transparência dos dados públicos da cidade de São Paulo. O Sr. Carlos Magno, autor da indicação, entregou à Sra. Maria Zoraida Parra Motta, mãe do homenageado, Diploma que concede ao Sr. Jonathas Hugo Parra Motta, in memoriam, ex-Conselheiro do Tribunal de Contas do Estado de Rondônia, o título de Patrono do Prêmio Transparência e Fiscalização Pública, na categoria Sociedade Civil, pela ação de instituir sistema de dados e informações que devem integrar o processo de planejamento das receitas públicas nas propostas orçamentárias do Estado de Rondônia e dos municípios, regulamentados por meio da Instrução Normativa nº 1/TCER-99. O Sr. Edmar Arruda, autor da indicação, entregou à Sra. Fábia dos Santos Sacco, Presidente da Sociedade Eticamente Responsável, o Prêmio Jonathas Hugo Parra Motta, categoria Sociedade Civil, conferido à Sociedade Eticamente Responsável pela instituição do Projeto de Observatório Social de Maringá, criado com o intuito de proporcionar à sociedade oportunidades que promovam a coesão social por meio da transparência e zelo na gestão dos recursos públicos. Usaram da palavra as Sras. e os Srs. homenageados, Eliana Calmon Alves, Marcel Henrique Micheletto, Gilberto Kassab, Maria Zoraida Parra Motta e Fábia dos Santos Sacco. O Sr. Presidente concedeu a palavra aos Srs. Sérgio Brito, pelo PSD; Carlos Magno, pelo PP; André Moura, Líder do PSC; Roberto de Lucena, pelo PV; Rubens Bueno, Líder do Bloco Parlamentar PV/PPS; e Edson Santos, pelo PT. Usaram da palavra pela ordem os Srs. Luiz Carlos Heinze e Walter Feldman. O Sr. Presidente registrou a presença de convidados, reiterou as homenagens prestadas, agradeceu a presença de todos e, às 12h27, encerrou a sessão.

Mauro Benevides
Presidente

Raimundo Gomes de Matos
Secretário
As notas taquigráficas desta sessão solene poderão ser solicitadas ao Departamento de Taquigrafia, Revisão e Redação - DETAQ."
2012-11-13T10:20;;FALA DO PRESIDENTE OU NO EXERCÍCIO DA PRESIDÊNCIA;"Ata da 304ª (tricentésima quarta) Sessão da Câmara dos Deputados, Não Deliberativa Solene, Matutina, da 2ª Sessão Legislativa Ordinária, da 54ª Legislatura, em 13 de novembro de 2012. Às 10h32, o Sr. Mauro Benevides, nos termos do § 2º do artigo 18 do Regimento Interno, no exercício da Presidência, declarou aberta a sessão e deu por dispensada a leitura da ata da sessão anterior. O Sr. Presidente informou que a sessão destinou-se à entrega do Prêmio Transparência e Fiscalização Pública; saudou convidados presentes; prestou as devidas homenagens; e convidou para compor a Mesa os Srs. Ministro Benjamin Zylmer, Presidente do Tribunal de Contas da União - TCU; Ministra Eliana Calmon Alves, Ministra do Superior Tribunal de Justiça - STJ; Deputado Edmar Arruda (PSC/PR), Presidente da Comissão de Fiscalização Financeira e Controle - CFFC; Gilberto Kassab, Prefeito da cidade de São Paulo; e Marcel Henrique Michelleto, filho do homenageado, Sr. Moacir Michelleto. O Sr. Presidente convidou a todos a ouvirem o Hino Nacional, executado pela Banda de Grupamento de Fuzileiros Navais de Brasília, regida pelo Suboficial Fuzileiro Naval Luiz Carlos Gomes Barbosa.  Após assistir ao vídeo institucional e proferir parcialmente o discurso do Sr. Marco Maia, Presidente da Câmara dos Deputados, o Sr. Presidente concedeu a palavra ao Sr. Edmar Arruda, autor do requerimento. Nos termos do § 2º do artigo 18 do Regimento Interno, assumiu a Presidência o Sr. Edmar Arruda. O Sr. Jilmar Tatto, Líder do PT, concedeu o título de Oradora de Honra da Sessão Solene à Sra. Eliana Calmon Alves, Ministra do Superior Tribunal de Justiça, em reconhecimento da sua atuação como Corregedora do Conselho Nacional de Justiça. O Sr. Edmar Arruda, autor da indicação, entregou ao Sr. Marcel Henrique Micheletto, filho do homenageado, Diploma que concede ao Sr. Moacir Micheletto, in memoriam, o título de Patrono do Prêmio Transparência e Fiscalização Pública, na categoria Governamental, por sua atuação como homem público de maior valor em importantes posições, principalmente na área de agricultura, assegurando a milhares de trabalhadores rurais condições que permitiram ao Brasil tornar-se um dos países mais dinâmicos no setor. O Sr. Guilherme Campos, autor da indicação, entregou o Prêmio Moacir Micheletto, categoria Governamental, ao Sr. Gilberto Kassab, Prefeito da cidade de São Paulo, pela prática de transparência dos dados públicos da cidade de São Paulo. O Sr. Carlos Magno, autor da indicação, entregou à Sra. Maria Zoraida Parra Motta, mãe do homenageado, Diploma que concede ao Sr. Jonathas Hugo Parra Motta, in memoriam, ex-Conselheiro do Tribunal de Contas do Estado de Rondônia, o título de Patrono do Prêmio Transparência e Fiscalização Pública, na categoria Sociedade Civil, pela ação de instituir sistema de dados e informações que devem integrar o processo de planejamento das receitas públicas nas propostas orçamentárias do Estado de Rondônia e dos municípios, regulamentados por meio da Instrução Normativa nº 1/TCER-99. O Sr. Edmar Arruda, autor da indicação, entregou à Sra. Fábia dos Santos Sacco, Presidente da Sociedade Eticamente Responsável, o Prêmio Jonathas Hugo Parra Motta, categoria Sociedade Civil, conferido à Sociedade Eticamente Responsável pela instituição do Projeto de Observatório Social de Maringá, criado com o intuito de proporcionar à sociedade oportunidades que promovam a coesão social por meio da transparência e zelo na gestão dos recursos públicos. Usaram da palavra as Sras. e os Srs. homenageados, Eliana Calmon Alves, Marcel Henrique Micheletto, Gilberto Kassab, Maria Zoraida Parra Motta e Fábia dos Santos Sacco. O Sr. Presidente concedeu a palavra aos Srs. Sérgio Brito, pelo PSD; Carlos Magno, pelo PP; André Moura, Líder do PSC; Roberto de Lucena, pelo PV; Rubens Bueno, Líder do Bloco Parlamentar PV/PPS; e Edson Santos, pelo PT. Usaram da palavra pela ordem os Srs. Luiz Carlos Heinze e Walter Feldman. O Sr. Presidente registrou a presença de convidados, reiterou as homenagens prestadas, agradeceu a presença de todos e, às 12h27, encerrou a sessão.

Mauro Benevides
Presidente

Raimundo Gomes de Matos
Secretário
As notas taquigráficas desta sessão solene poderão ser solicitadas ao Departamento de Taquigrafia, Revisão e Redação - DETAQ."
