dataHoraInicio;keywords;tipoDiscurso;transcricao
2011-06-14T18:06;"MPV 526/2011, MEDIDA PROVISÓRIA, CRIAÇÃO, FONTE, RECURSOS, BANCO NACIONAL DE DESENVOLVIMENTO ECONÔMICO E SOCIAL, BNDES,  FINANCIADORA DE ESTUDOS E PROJETOS, FINEP, AMPLIAÇÃO, SUBVENÇÃO ECONÔMICA, EQUALIZAÇÃO DE TAXA DE JUROS, PRORROGAÇÃO, PRAZO, FINANCIAMENTO, INCLUSÃO, PRODUTOR RURAL, SUSPENSÃO, EXIGÊNCIA, REGULARIDADE, NATUREZA FISCAL, OPERAÇÃO FINANCEIRA,  RENEGOCIAÇÃO, DÍVIDA, MUTUÁRIO, MUNICÍPIOS, VÍTIMA, DESASTRES NATURAIS, PROJETO DE LE DE CONVERSÃO.
EMENDA, DESTAQUE,  SUBORDINAÇÃO, APROVAÇÃO, RESOLUÇÃO, SENADO,  CONCESSÃO, CRÉDITOS, BNDES, UNIÃO FEDERAL, ENCAMINHAMENTO DE VOTAÇÃO, APOIAMENTO.";ENCAMINHAMENTO DE VOTAÇÃO;"O SR. REINALDO AZAMBUJA (PSDB-MS. Sem revisão do orador.) - Sra. Presidenta, Srs. Deputados, o PSDB apresenta este destaque porque entendemos que, sendo o BNDES um banco público, que contrai esses empréstimos, e o povo brasileiro é quem paga esses juros, nós precisamos realmente ter controle sobre esses empréstimos. A proposta do PSDB é justamente para que haja um controle do Senado Federal nesses empréstimos realizados pelo BNDES a diversas empresas do País.
	Temos visto diversos empréstimos do BNDES, que são pagos pela sociedade brasileira. Sra. Presidente, demais Deputados, nós, na Câmara dos Deputados, temos uma responsabilidade muito grande, porque esses empréstimos estão criando grandes grupos e grandes monopólios, que, muitas vezes, estão trabalhando contra a população brasileira.
	É por isso que o PSDB apresenta este destaque. Não podemos, de forma alguma, aceitar isso. É um banco público, que capta dinheiro pago pela sociedade brasileira. Hoje, vemos muitas fusões desses grandes conglomerados formados com financiamentos públicos do BNDES transformando-se em verdadeiros monopólios que trabalham contra a própria livre iniciativa, que sempre defendemos nesta Casa.
	Por isso, o PSDB apresentou esta emenda ao projeto, determinando que, quando contratados os empréstimos, só sejam autorizados se aprovada resolução no Senado Federal. Acho que isso é para criar realmente uma segurança no tocante a essas pessoas e a esses grandes conglomerados que são criados com dinheiro público, Sra. Presidente.
	Nós, do PSDB, de forma alguma, podemos aceitar isso. Esse banco capta recursos subsidiados, empresta a empresas, e muitas vezes esses empréstimos estão sendo colocados em dúvida. Não podemos, de forma alguma, aceitar que o Parlamento brasileiro fique alheio a isso.
	Por isso o PSDB, com a responsabilidade que tem, apresentou emenda no sentido de que uma resolução seja aprovada pelo Senado Federal. 
Não podemos, de forma alguma, aceitar que os grandes monopólios criados com dinheiro público e pagos pela sociedade brasileira fiquem alheios de passar pelo Congresso Nacional.
	Por essa razão, Sra. Presidente, fazemos a defesa da emenda apresentada.
	Muito obrigado."
2011-09-14T16:42;MUNICÍPIO, SINOP, MT, ANIVERSÁRIO DE FUNDAÇÃO, HOMENAGEM.;PELA ORDEM;"O SR. REINALDO AZAMBUJA (PSDB-MT. Pela ordem. Sem revisão do orador.) - Sra. Presidenta, Sras. e Srs. Deputados, sou do Mato Grosso e fui Prefeito por 8 anos, Vereador e Deputado Estadual de uma bela cidade chamada Sinop, no coração da Amazônia mato-grossense. Hoje ela completa 37 anos.
	É uma cidade de origem madeireira, que nasceu do extrativismo vegetal e hoje tem 120 mil habitantes, oito faculdades, universidade federal e universidade estadual. Sinop cresce 10% ao ano, praticamente 90% dela está pavimentada e 95% da água é tratada. É uma cidade que olha para frente, uma cidade sem retrovisor.
	Quero aqui, nesta oportunidade, parabenizar todas as autoridades e toda a população da minha querida cidade de Sinop, registrando a minha alegria em ver o desenvolvimento acontecendo todos os dias, empresas chegando e gerando empregos. 
O Índice de Desenvolvimento Humano - IDH de Sinop é praticamente o dobro da média nacional. Acima de tudo, trata-se de uma cidade estruturada, com aeroporto e três voos diários. Hoje, existe o voo Sinop-Brasília. Há o voo direto, com duração de uma hora e meia, e mais dois voos alternativos, via Cuiabá, distribuindo-se para o resto do Brasil. 
A EMBRAPA está se instalando no Município. A única EMBRAPA da Amazônia brasileira está na nossa cidade de Sinop.
	Tudo isso ocorre na cidade, que é porta da Amazônia. Sinop está-se desenvolvendo com qualidade de vida. A educação do Município já foi premiada com  nota 10 do Instituto Ayrton Senna e houve vários prêmios do Conselho Federal de Contabilidade... 
(O microfone é desligado.)
O SR. NILSON LEITÃO - ...pelas boas gestões. Mas, acima de tudo, Sinop é uma cidade criada por pioneiros, por colonizadores do noroeste do Paraná, e atendeu tanta gente.	Era um Brasil a ser ocupado, para não entregarmos a nossa Amazônia. 
Hoje, Sinop conseguiu romper barreiras, venceu os obstáculos e é uma bela cidade, com uma população oriunda de todas as regiões do Brasil. Praticamente 70% de sulistas, mas é uma cidade de todos os brasileiros.
	Parabéns à querida cidade de Sinop."
2012-04-17T10:00;;HOMENAGEM;"Ata da 83ª (octogésima terceira) Sessão da Câmara dos Deputados, Solene, Matutina, da 2ª Sessão Legislativa Ordinária, da 54ª Legislatura, em 17 de abril de 2012. Às 10h13min, o Sr. Eduardo Gomes, 1º Secretário, no exercício da Presidência, declarou aberta a sessão e deu por dispensada a leitura da ata da sessão anterior. O Sr. Presidente informou que a sessão destinou-se à homenagem póstuma ao ex-Deputado Nelson Trad; saudou convidados presentes; prestou as devidas homenagens, e convidou para compor a Mesa os Srs. Waldemir Moka, Senador da República; Terezinha Trad, viúva do homenageado; Norma Trad, irmã do homenageado; os filhos do homenageado, os Srs. Fábio Trad, Marquinhos Trad e Nelson Trad Filho; e o Sr. Nelson Cintra Ribeiro, Prefeito de Porto Murtinho - MS. O Sr. Presidente convidou todos a ouvirem o Hino Nacional, cantado pelo Coral Meninas Cantoras de Porto Murtinho - MS; e a assistirem ao vídeo institucional. Após proferir o discurso do Sr. Marco Maia, Presidente da Câmara dos Deputados, o Sr. Presidente concedeu a palavra ao Sr. Mauro Benevides, autor do requerimento. Assumiram sucessivamente a Presidência o Sr. Geraldo Resende, 1º Suplente de Secretário; e a Sra. Rose de Freitas, 1ª Vice-Presidente.  Após convidar todos a ouvirem o Coral Meninas Cantoras de Porto Murtinho, sob a regência de Luiz Quirino, com apresentação das músicas Chalana, Sobre o Arco Íris, Tudo que se quer e Ave Maria, a Sra. Presidente concedeu a palavra aos Srs. Ricardo Izar, Giroto, autores do requerimento; Waldemir Moka, Senador da República; Paulo Teixeira, pelo PT; e Geraldo Resende, pelo PMDB. Ao assumir a Presidência, o Sr. Júlio Delgado, 4º Secretário, concedeu a palavra aos Srs. Reinaldo Azambuja, pelo PSDB; Simão Sessim, pelo PP; e Lincoln Portela, pelo PR. Nos termos do § 2º do artigo 18 do Regimento Interno, assumiu a Presidência o Sr. Luiz Couto e concedeu a palavra aos Srs. Júlio Delgado, pelo PSB, e Mandetta, pelo Democratas. Reassumiu a Presidência o Sr. Júlio Delgado, 4º Secretário, e concedeu a palavra aos Srs. Félix Mendonça Júnior, pelo PDT; Paes Landim, pelo PTB; e Chico Alencar, pelo PSOL. Usaram ainda da palavra os Srs. Nelson Marquezelli, Edinho Bez, Vicente Arruda, Edinho Araújo, Francisco Escórcio, Osmar Serraglio, Luiz Couto, Júnior Coimbra, Delegado Protógenes, Lourival Mendes, Amauri Teixeira e o Sr. Carlos Marun, Deputado Estadual doeMato Grosso do Sul. Prestou as devidas homenagens o Sr. Fábio Trad, filho do homenageado. O Sr. Presidente registrou a presença de convidados, reiterou as homenagens prestadas, agradeceu a presença de todos e, às 13h27min, encerrou a sessão.

Jorge Tadeu Mudalen
Presidente

Geraldo Resende
Secretário
As notas taquigráficas desta sessão solene poderão ser solicitadas ao Departamento de Taquigrafia, Revisão e Redação - DETAQ."
2013-04-10T15:48;AKIRA OTSUBO, DEPUTADO FEDERAL, POSSE, COMPROMISSO.;FALA DO PRESIDENTE OU NO EXERCÍCIO DA PRESIDÊNCIA;"O SR. PRESIDENTE (Reinaldo Azambuja) - Encontra-se presente o Sr. Akira Otsubo, representante do Estado de Mato Grosso do Sul, eleito pela Coligação PRB/PMDB/PR/DEM/PMN/PSB/PSDB, que tomará posse em virtude do afastamento do titular.
	Convido S.Exa. a prestar o compromisso regimental, com o Plenário e as galerias de pé.
	(Comparece à Mesa o Sr. Akira Otsubo e presta o seguinte compromisso):
	""PROMETO MANTER, DEFENDER E CUMPRIR A CONSTITUIÇÃO, OBSERVAR AS LEIS, PROMOVER O BEM GERAL DO POVO BRASILEIRO E SUSTENTAR A UNIÃO, A INTEGRIDADE E A INDEPENDÊNCIA DO BRASIL"".
	O SR. PRESIDENTE (Reinaldo Azambuja) - Declaro empossado o Sr. Akira Otsubo. (Palmas.)"
