0;1
PELA ORDEM;"O SR. ASSIS CARVALHO (PT - PI. Pela ordem. Sem revisão do orador.) - Sr. Presidente, ninguém sabe se o pecado é do Lobo Mau ou dos Três Porquinhos, mas que está na mídia está. E aqui não cabe a nós dizermos se é verdade ou mentira. Agora, se não é verdade, quem está no comando deste País deve ter a simplicidade e a humildade de apresentar a verdade ao povo brasileiro, e não ir para mídia babar, expor ódio e atacar a imprensa, porque essa mesma imprensa que ora ataca foi a mesma que beneficiou esta maldade que hoje nós estamos vivendo neste País. 
Mas matéria publicado na revista Forum diz o seguinte: ""Tecnologia permite atendimento à distância, pelo celular, de serviços de portaria"". Isso não quer dizer que se a pessoa está na China, em Brasília, em Teresina, não possa atender um telefonema do interfone do Rio de Janeiro. Esse argumento não tem fundamento.
Também eu não estou dizendo que isso é verdade. Quem diz isso é o Governador do Estado do Rio de Janeiro. Se for, o Governo acabou. É o mínimo que esta Casa tem que compreender.
Mas, Sr. Presidente, faço essas palavras aqui, primeiro, para dizer que não é com gritaria, com xingamentos, que nós vamos esclarecer a verdade. O papel deste Parlamento é analisar os números e investigar, e não intimidar o porteiro. Nós já tivemos situação em que o motorista derrubou Collor, situação em que o garçom derrubou Palocci. Eu acredito que, se isso se confirmar como verdade, é o porteiro que vai derrubar o Governo mais desastrado da história da República brasileira, porque, independentemente disso, o Brasil está um caos, a saúde sofre, a educação sofre, o meio ambiente sofre, e o povo nordestino sofre ainda mais.
Mas quero, apenas para expressar a minha posição, falar sobre a decisão da ANEEL de taxar a placas fotovoltaicas.
Eu acho isso um atraso absurdo, depois de tudo o que está acontecendo. Nós lutamos para ter energia limpa, o mundo inteiro faz a opção de reduzir o CO2. E aqui, agora, nós passamos a criar dificuldade para aqueles que podem melhorar a qualidade do ar no nosso País. 
Eu espero que pelo menos nesse ponto este Parlamento se una, que trabalhemos independentemente de partido e não permitamos que haja quebra de contrato. Se alguém colocou pequenas produtoras de energia sobre o teto da casa, é porque havia uma resolução, e nós esperamos que essa resolução seja respeitada.
Estamos aqui para nos unir em defesa das energias alternativas, tanto da eólica, como da solar, assim como das demais alternativas que temos hoje, nas quais podemos avançar, como a biomassa e outras, e não para criar obstáculos com altas taxações e trazer dificuldades para as pessoas que produzem energia limpa, numa época em que o nosso meio ambiente é tão agredido.
Então eu espero que pelo menos nesse ponto não tenhamos conflitos ideológicos, que possamos nos unir e permitir o incentivo à produção de energia limpa, e não a sua destruição ou taxação.
Sr. Presidente, eu solicito a divulgação nos meios de comunicação desta Casa e no programa A Voz do Brasil desta manifestação, em especial a nossa manifestação contrária a essa resolução da ANEEL. 
Era isso o que eu tinha a dizer."
RECLAMAÇÃO;"O SR. ASSIS CARVALHO (PT - PI. Para uma reclamação. Sem revisão do orador.) - Sr. Presidente, permita-me fazer uma reclamação, porque, depois de eu falar, realmente falaria o Deputado que V.Exa. está chamando agora. Eu não sei por que V.Exa. abriu o precedente e concedeu 3 minutos para um Deputado que não estava na relação para falar apenas para me contrapor.
Quero deixar claro que a revista Veja não só foi desmentida pelo Ministério Público, como também essa é uma denúncia de 2018 que já foi negada por Marcos Valério.
Espero que este Parlamento seja minimamente honesto para não reproduzir mentiras que já foram desmentidas, porque isso é ruim para o povo brasileiro. Independentemente do ódio doentio de alguns Parlamentares descontrolados, deve-se reproduzir a verdade. Essa mentira da revista Veja já foi desmentida pelo próprio Marcos Valério, e quem está se pronunciando neste Parlamento sabe disso.
Eu gostaria que a ordem de inscrição fosse considerada. Eu espero pacientemente chegar o meu horário. É muito ruim alguém furar a fila apenas para me contrapor, e isso não é justo.
O SR. REINHOLD STEPHANES JUNIOR (PSD - PR) - Eu não furei fila.
O SR. PRESIDENTE (Bibo Nunes. PSL - RS) - Deputado Assis Carvalho, só para explicar a V.Exa. que não houve furo de fila. O que aconteceu - e este Presidente tem o poder para fazer isso - é que S.Exa. já estava inscrito e se atrasou. Eu, como Presidente... 
(Tumulto no plenário.)
Deputado, por gentileza, V.Exa. quer me ouvir?
Nobre Deputado, por gentileza, V.Exa. quer me ouvir? V.Exa. pode prestar atenção em mim, Deputado?
(Tumulto no plenário.)
O Deputado está um pouco alterado. Eu só quero explicar o seguinte: aqui não se fura fila. 
Deputado, por favor, fique menos alterado, por gentileza. 
Aqui ninguém fura a fila. O que aconteceu foi que o Deputado que seguidamente preside a sessão estava inscrito. Como eu tenho o poder para isso, achei por bem dar espaço ao Deputado que se atrasou um pouco. Não vi problema algum nisso. Eu também estou inscrito e continuo esperando.
Concedo a palavra ao Deputado Charles Fernandes, que disporá de 3 minutos."
BREVES COMUNICAÇÕES;"O SR. ASSIS CARVALHO (PT - PI. Sem revisão do orador.) - Sr. Presidente, primeiro, quero agradecer aos Parlamentares desta Casa, pois nós apresentamos uma emenda à PEC 45, que trata da reforma tributária, e obtivemos apoio de 209 Deputados. Sou muito grato pela compreensão desta Casa em acolher a nossa emenda.
A nossa emenda trata exatamente da tributação dos veículos automotores aéreos e aquáticos. A Constituição de 1988 estabeleceu a tributação desses veículos com o IPVA, mas uma decisão do STF, em 2007, terminou por considerar que a intenção dos legisladores da época, dos Constituintes, era a continuação da taxa rodoviária única, então extinguiu esse imposto exatamente dos helicópteros, dos jatinhos de luxo, de todos os veículos automotores aquáticos, o que é uma insensatez.
Então, eu agradeço o apoio a minha emenda e espero que isso seja reincluído na Constituição brasileira, porque é uma proposta justa. Hoje, tributa-se um carro popular ou uma moto pequena, mas os veículos aquáticos e aéreos não são tributados. Eu sou grato pelo apoio em razão da possibilidade de corrigirmos isso.
Por fim, Sr. Presidente, retomando a polêmica já comentada aqui, quero dizer que o que incomoda o povo brasileiro é exatamente o fato de o Presidente deste País, contra quem, neste momento, surge uma denúncia pública, em vez de mandar investigar com isenção, de forma republicana, começa a ameaçar a imprensa, que, há pouco tempo, era aplaudida quando denunciava a Dilma, quando denunciava, sem provas, o Presidente Lula, essa mesma imprensa e essa mesma Rede Globo que tanto fizeram para que o golpe acontecesse no nosso País. Mas vejam que o pau que dá em Chico dá em Francisco, não é? Não pode haver dois pesos e duas medidas. Nós dizíamos isto: ""Aqueles que estão aplaudindo hoje poderão chorar amanhã"". E é o que está acontecendo. Aplaudiram tanto as injustiças, então, caso isso seja uma injustiça, que se investigue. Mas, se for verdade, lamentavelmente, a República estará ferida mais uma vez, e não haverá razão para este Governo continuar, porque Marielle foi assassinada, e hoje praticamente não há dúvida de que foi a milícia que a assassinou.
Quem protegeu os autores? Por que não se divulga? É isso que nós queremos saber, apenas isso. O Brasil quer saber disso. Não é atacando a imprensa, não é atacando as pessoas, não é ameaçando um porteiro que se vai resolver uma situação como essa. O Brasil quer uma resposta. E este Parlamento precisa estar muito sereno, unido, para não mascarar a verdade, que, infelizmente, parece estar vindo à tona.
Esta é a nossa palavra. Solicito, Sr. Presidente, que ela seja divulgada nos meios de comunicação desta Casa e no programa A Voz do Brasil."
PELA ORDEM;"O SR. ASSIS CARVALHO (PT - PI. Pela ordem. Sem revisão do orador.) - Sr. Presidente, eu fico pasmado quando alguém que se diz religioso, evangélico, solicita que a Esquerda deixe a alma de Marielle em paz. Eu fico pensando se Marielle fosse irmã, fosse filha, fosse alguém da família, se ele faria o mesmo pedido enquanto os assassinos de Marielle não fossem identificados e presos.
O que nós estamos pedindo aqui não é uma questão de esquerda contra direita, o que nós estamos pedindo é justiça. Eu não estou compreendendo por que tanto nervosismo. Se não tem culpa, por que esse desespero, por que esse ataque, por que essa loucura? Seria mais conveniente se juntar a nós e mandar investigar, descobrir a verdade e mostrar para o povo brasileiro qual é a verdade. O que está nos deixando cada vez mais desconfiados é o desespero, neste momento, desses que podem ser os assassinos de Marielle."
PEQUENO EXPEDIENTE;O SR. ASSIS CARVALHO (PT - PI. Sem revisão do orador.) - Rapidamente, quero informar que esse Queiroz de que o Deputado fala, quando trabalhou com Lindbergh, ninguém tinha conhecimento de que era criminoso. O crime foi praticado de acordo com a instrução do seu chefe, que agora é outro. Mas não há novidade. É só dar uma olhada e Bolsonaro foi aliado de Lula, hoje é adversário. Vamos deixar de bobagem! Eu quero saber, quando ele praticou o crime, estava ligado a quem? Ele não está ligado a Lindbergh, está ligado a outras forças. É bom que isso fique bem claro. E deixem de brincadeirinha porque o criminoso, quando estava com Lindbergh, nunca recebeu ordem para matar ninguém.
PELA ORDEM;"O SR. ASSIS CARVALHO (PT - PI. Pela ordem. Sem revisão do orador.) - Sra. Presidente, na manhã de ontem, infelizmente houve uma interrupção na sessão solene em homenagem ao Dia do Nordestino. Bolsonaro, perdido, sem agenda nenhuma, adentrou este plenário e, mais uma vez, virou as costas aos nordestinos.
Ao ser convidado para compor a Mesa, já que se trata da maior autoridade do País, o Presidente da República se retirou sem fazer ao menos uma saudação ao Governador Wellington Dias, que aqui se encontrava, e a quem presidia a sessão, a Deputada Rejane Dias. O que esperar desse homem, que nos chama de paraíbas de forma pejorativa - tenho orgulho de ser chamado de paraíba - e não mostra o menor respeito à nossa região, meu querido Deputado Frei Anastacio?
Mas eu gostaria de tratar aqui hoje, Sra. Presidenta, das medidas apresentadas ao Congresso Nacional por este desgoverno. O chamado Plano Mais Brasil é mais uma das medidas de desmonte do Estado brasileiro. Inclui redução de salários, comprometimento de recursos obrigatórios para educação e saúde, demissão de servidores, extinção de Municípios, e por aí vai.
A vida de milhões de brasileiros e brasileiras pode ser afetada por essas medidas autoritárias. Propõe-se o absurdo de incorporar a Município vizinho aqueles Municípios que têm menos de 5 mil habitantes e possuem arrecadação própria menor que 10% da receita total. No Estado do Piauí, 78 Municípios seriam atingidos por essa proposta maluca deste Governo desorientado.
O plano propõe, por exemplo, a possibilidade de redução salarial de até 25% para o funcionalismo público. E o arrocho salarial não diferencia aqueles que ganham 2 mil reais daqueles que ganham até 40 mil reais.
O que vemos, Sra. Presidente, é mais um pacote de maldades que vem atingir o povo brasileiro, especialmente a classe trabalhadora deste País.
Este Parlamento tem que dizer, em voz bem alta, não ao AI-5 econômico de Paulo Guedes! Temos que dizer não a este desgoverno, que, infelizmente, como bem disse o Deputado Marcelo Nilo há pouco, agride todos os dias o povo brasileiro, não traz uma única proposta que possa beneficiar o povo deste País!
Aonde vai chegar o Brasil, se o seu povo é agredido todos os dias pelo próprio Presidente da República? Lamentamos profundamente.
Queremos aqui reafirmar o nosso compromisso com o povo brasileiro e com todos os Municípios, inclusive os que têm menos de 5 mil habitantes, que merecem ser respeitados também, assim como os demais.
Sra. Presidente, peço que este pronunciamento seja divulgado pelos meios de comunicação desta Casa e no programa A Voz do Brasil."
BREVES COMUNICAÇÕES;"O SR. ASSIS CARVALHO (PT - PI. Sem revisão do orador.) - Sr. Presidente, quero manifestar nosso apoio à MP 890. Compreendemos que esta proposição precisa ser aprovada nesta Casa, para ampliar o período do REVALIDA e dar mais condições aos estudantes que se formam em outros países terem a oportunidade de trabalhar no nosso País. Portanto, fica nosso apoio.
Aproveito o momento para manifestar nosso repúdio à medida provisória que trata da ampliação das horas de trabalho dos bancários deste País. Trata-se de uma tradição histórica. Agora, exceto para os caixas, a MP estabelece a jornada de trabalho dos bancários de 6 horas para 8 horas, com trabalho inclusive aos sábados. Que tristeza!
Meu querido Deputado Ivan Valente, enquanto lutamos para gerar mais empregos, o Governo amplia a hora de trabalho para reduzir os campos de trabalho exatamente para quem não está trabalhando. É um equívoco muito grande! Nós vamos continuar lutando para evitar que este absurdo seja aprovado.
Todo o nosso apoio aos bancários do nosso País, de cuja categoria faço parte!
Sr. Presidente, registro que estive no último sábado em São Bernardo, levando meu abraço ao Presidente Lula, maior líder popular deste País, um dos maiores do mundo, um preso político que foi liberado recentemente.
O Presidente Lula passou 580 dias preso, sem provas, diante de uma situação que agora o próprio Presidente Bolsonaro veio a público e assumiu no Twitter, dizendo que, não fossem as ações de Sergio Moro, ele jamais seria Presidente do Brasil. Isso todo mundo sabe! Se Sergio Moro não tivesse fraudado aquele processo, mentindo e prendendo sem provas, este Governo, no um a um, em igualdade de condições, jamais teria ganhado a eleição neste País.
No entanto, apenas a liberação do nosso líder não nos contempla. Neste momento, ele pode falar ao povo brasileiro. Nós queremos que o processo, que foi fraudado, seja anulado. O processo foi montado tão somente para evitar que o Presidente Lula pudesse concorrer às eleições de 2018. Este processo tem que ser anulado, para podermos restabelecer o mínimo de democracia neste País. 
Eu sei que, por conta desta situação, existe todo um movimento aqui para rediscutir a prisão em segunda instância. Há pouco ouvi o Deputado Fábio Trad, que, com muita sabedoria, explicou este processo. Se querem confrontar o STF, vamos direto ao assunto: vamos falar de morosidade. Por que a Justiça não é mais célere? Como não querem fazer isso, querem montar um atalho mexendo exatamente no art. 5º da Constituição brasileira, nas cláusulas pétreas.
Eu faço minhas as palavras do Presidente do Senado. Renunciem, portanto, e convoquem uma nova Constituinte. Se não querem respeitar a Constituição vigente, se não querem respeitar a Constituição que temos neste País, vamos convocar uma Constituinte e elaborar uma nova Constituição neste País. Um país que não respeita sua Carta Magna não se dá ao respeito. 
Este processo nem deveria ter sido julgado no STF, em momento algum, porque este tema está claro no art. 5º da Constituição brasileira - ninguém pode questioná-lo. Tanto é verdade que agora estão querendo fazer uma PEC, porque não consta na nossa Constituição o dispositivo da prisão em segunda instância.
Portanto, este processo foi feito apenas para tirar o Presidente Lula da disputa eleitoral de 2018.
Parabéns, povo brasileiro! 
Parabéns, Presidente Lula! Que você possa conduzir este País e devolver aos brasileiros e às brasileiras a soberania nacional, que lamentavelmente está sendo ferida neste momento!
Sr. Presidente, peço a V.Exa. que meu pronunciamento seja divulgado pelos meios de comunicação desta Casa e pelo programa A Voz do Brasil. 
Muito obrigado."
PELA ORDEM;"O SR. ASSIS CARVALHO (PT - PI. Pela ordem. Sem revisão do orador.) - Sra. Presidente, quero aproveitar a oportunidade e deixar aqui o meu abraço a V.Exa., que é uma grande Deputada do Piauí.
Quero agradecer ao Presidente Rodrigo Maia pela sensibilidade de conduzir esse mérito tão difícil.
Minha querida Deputada Margarete Coelho, ex-Vice-Governadora do Governador Wellington Dias, V.Exa. tem uma grande sensibilidade. Não tenho dúvida de que a leveza de V.Exa. fez com que se produzisse esse substitutivo, que tira do projeto praticamente tudo o que pudesse proteger a milícia. V.Exa. teve habilidade e cuidado de não permitir que o comitê do ódio imperasse e fez um substantivo que deveria ser chamado, neste momento, de Lei Margarete Coelho. V.Exa. conseguiu elaborar um projeto como esse, aprovado quase por unanimidade, ao lado dos Parlamentares. Isso é um orgulho para o Parlamento e para todos nós do Estado do Piauí, que conhecemos o brilhantismo de V.Exa.
Parabéns, Deputada Margarete Coelho! Tenho muito orgulho de V.Exa."
BREVES COMUNICAÇÕES;"O SR. ASSIS CARVALHO (PT - PI. Sem revisão do orador.) - Sr. Presidente, Sras. e Srs. Deputados, na semana passada, nós aprovamos aqui um projeto relatado pela Deputada Federal piauiense Margarete Coelho, que trata da situação dos crimes neste País. E tivemos a triste notícia - e o Brasil acompanha pasmado - do absurdo que houve na comunidade de Paraisópolis, em São Paulo, onde vários jovens foram brutalmente assassinados pela polícia.
Imaginem que, se não fosse a coragem da Deputada Margarete Coelho de ter rasgado o crime apresentado aqui por meio daquele projeto de Moro, esses policiais nem investigados seriam. Na verdade, aquele projeto era uma autorização para os policiais matarem e não serem investigados. 
Crimes como esses nós queremos condenar veementemente. A sociedade não pode pagar a polícia para matar jovens negros, jovens pobres, jovens favelados, jovens, como eles dizem, que não foram ""bem nascidos"" - entre aspas -, dentro da lógica de que ter nascido na favela é como se já tivesse nascido condenado.
Então, quero aqui me solidarizar com aquelas famílias, famílias sofridas, simples, que já estão condenadas pela pobreza e, agora, infelizmente, veem policiais matando os seus filhos. Os policiais que assassinam os filhos dessas famílias são pagos pela própria sociedade. Nós não poderemos aceitar que essa violência continue acontecendo em todas regiões do País - aconteceu recentemente em Recife, acontece no Rio de Janeiro, acontece em São Paulo -, porque, lamentavelmente, o Poder central estimula o crime contra os pobres.
Quero aqui externar a minha solidariedade aos jovens pobres do meu País. 
Sr. Presidente, solicito a divulgação deste pronunciamento nos meios de comunicação desta Casa."
