0;1
PELA ORDEM;"O SR. ASSIS CARVALHO (PT - PI. Pela ordem. Sem revisão do orador.) - Sra. Presidente, o que a princípio foi apresentado como represália às universidades federais se revelou, em seguida, como um desmonte geral da educação pública. O Governo Bolsonaro cortou 2 bilhões e 200 milhões de reais das universidades e dos institutos federais sob o pretexto de investir na educação básica. No entanto, cortou 2 bilhões e 400 milhões de reais da educação infantil ao ensino médio, segundo publicou a revista Exame do dia 6 de maio de 2019.
Se fosse uma escolha, seria do tipo feita pelos reacionários e sem visão de futuro, mas não foi uma escolha. Na educação básica, o MEC bloqueou 146 milhões de reais dos 265 milhões de reais destinados a obras em escolas e creches e recursos para móveis e equipamentos para as escolas, capacitação de servidores, educação de jovens e adultos, ensino em tempo integral. Parte dos recursos, na ordem de 19,7 milhões de reais, seria destinada para merenda e transporte escolar, além de todo o recurso previsto para o PRONATEC - Programa Nacional de Acesso ao Ensino Técnico e Emprego.
Para o ensino superior, o objetivo foi o mesmo: arrebentar. Um governo que abomina a diversidade e tem medo da pluralidade age assim, asfixiando o centro de produção e o compartilhamento do saber, promovendo um blackout que bloqueia a evolução do País. Os bloqueios nas universidades e nos institutos federais, cujo piso é de 30%, é praticamente uma sentença de morte para as instituições públicas que não poderão sobreviver, o que significa que o sonho da formação superior acaba aqui para quase todos os jovens brasileiros. Fazer um curso superior volta a ser coisa de quem tem dinheiro: só filho de doutor será doutor. Este é o grande desejo da elite preconceituosa e atrasada, que não quer ver gente pobre na universidade, que não quer ver filho de empregada e de pedreiro estudando ao lado do filho dos ricos.
Esta queda nos recursos não é de hoje, é óbvio. O congelamento dos valores de custeio vem desde 2016, além da queda brutal nos investimentos. Para se ter uma ideia, a Universidade Federal do Piauí recebeu 60 milhões de reais para investimentos em 2014, no Governo Dilma; já no ano passado, no Governo Temer, foram somente 3,5 milhões de reais. Em 2019, no Governo Bolsonaro, o que seriam novamente os 3,5 milhões de reais até agora está contingenciado e bloqueado, o equivalente a 90%. Isso significa que a universidade só tem garantidos até agora 350 mil reais para a área de investimentos. Estas informações nos foram dadas pelo Reitor Arimatéia Dantas Lopes.
Já a informação da Universidade Federal do Rio de Janeiro, publicada no El País, é a de que, em valores corrigidos, a diferença entre o orçamento de 2014 e o de 2019 é superior a 200 milhões de reais nas universidades. O fato é que as instituições já estão vivendo no limite, com constantes contingenciamentos. Não há gordura para cortar, nem mesmo carne: já chegaram ao osso. A decisão do ""desgoverno"" Bolsonaro é mesmo para quebrar as instituições de ensino superior, as públicas federais. 
Os reitores do Instituto Federal do Piauí e da Universidade Federal do Piauí já anunciaram que, mantidos estes cortes brutais, as instituições só poderão funcionar até setembro. Esta é a data da morte anunciada das duas escolas superiores e de muitas outras no Brasil. Na Universidade Federal do Piauí, o bloqueio do MEC é de 33 milhões, representa quase 50% do orçamento para o período de maio a dezembro, segundo nosso querido Reitor Arimatéia Dantas. Vai afetar programas de ensino, pesquisa e extensão.
O Instituto Federal do Piauí está presente em 18 cidades, em 20 campi, e chega a atender mais de 25 mil alunos em cursos técnicos, superiores e de pós-graduação. Já a Universidade Federal do Piauí, com 48 anos de existência, tem uma comunidade acadêmica de cerca de 45 mil pessoas. São 5 campi, 84 cursos presenciais, 15 de ensino a distância, 46 pós-graduações de mestrado e 19 de doutorado, 22 residências médicas e 11 residências multiprofissionais. Nos últimos 10 anos, a Universidade Federal do Piauí formou mais de 30 mil profissionais em diversas áreas. Entre as explicações esfarrapadas para o bloqueio, o Ministro da Educação chegou a falar que ele afetaria as universidades que promovem balbúrdia - as que se manifestam contra ideologias do Governo - e as que apresentam fraco desempenho acadêmico.
O Ministro logo foi desmentido pelos fatos. As universidades acusadas de queda de desempenho - a UnB, a UFF e a UFBA - são destaques em avaliações internacionais. Na classificação dos melhores da América Latina, a UnB é a 16ª colocada; a Universidade Federal da Bahia é a 30ª; e a Universidade Federal Fluminense é a 45ª. A UnB e a Universidade Federal da Bahia se apresentam sempre entre as 400 melhores instituições do mundo em cursos da área da saúde.
Sra. Presidente, solicito que meu pronunciamento seja divulgado pelos meios de comunicação desta Casa e, especialmente, pelo programa A Voz do Brasil.
Muito obrigado."
PELA ORDEM;"O SR. ASSIS CARVALHO (PT - PI. Pela ordem. Sem revisão do orador.) - Sra. Presidente, o PT reafirma a sua posição diante do absurdo que acontece neste País. Quando a intelectualidade está sendo agredida, nós não temos outro caminho senão nos mantermos em obstrução, até que as universidades, os institutos federais e o povo brasileiro sejam respeitados.
Diante disso, Sra. Presidente, nós orientamos pela ""obstrução"".
Aproveito também para saudar as Margaridas, que foram às ruas na segunda-feira no Piauí. Lá elas apresentaram um documento ao Presidente Rodrigo Maia, tratando da Previdência. Espero que S.Exa. considere as reivindicações das Margaridas!
Parabenizo ainda os Prefeitos Veríssimo Siqueira, Carlos Monte e Professor Ribinha, que receberam no fim de semana o prêmio Prefeito Empreendedor, no Congresso das Cidades, realizado na Capital do Piauí.
Peço para dar os meus discursos como lidos.
Essa é a nossa posição, Sra. Presidente.

DISCURSOS NA ÍNTEGRA ENCAMINHADOS PELO SR. DEPUTADO ASSIS CARVALHO.

Sra. Presidente, Sras. e Srs. Deputados, a Marcha das Margaridas levou nesta segunda-feira, dia 6 de maio, para as ruas de Teresina, a luta das agricultoras familiares do Piauí por terra, água, agroecologia e direitos das mulheres, cada vez mais violados nestes tempos em que o fascismo e o machismo tentam imperar em nosso País.
Mulheres de Municípios de todo o Estado participaram da manifestação nas ruas e de audiência pública realizada pela Assembleia Legislativa do Estado sobre a reforma da Previdência. Elas também entregaram ao Presidente desta Casa, Rodrigo Maia, um documento com as reivindicações para a manutenção da aposentadoria pública e das regras atuais, que asseguram a aposentadoria dos trabalhadores e trabalhadoras rurais. O documento pede ainda a manutenção dos direitos já assegurados do Benefício da Prestação Continuada - BPC para os idosos e deficientes mais pobres deste País. 
Nestes tempos de retrocesso, em que a violência no campo aumenta, junto com a fome e a extrema pobreza, esse movimento é essencial para chamar a atenção dos brasileiros para a devastação dos bens comuns e dos direitos dos brasileiros. 
As caminhadas das Margaridas, que agora acontecem nos Estados, são prévias para a Marcha que acontece em agosto, aqui em Brasília. É a maior ação latino-americana protagonizado pelas mulheres do campo, das águas e das florestas. Neste ano, o tema é Margaridas na luta por soberania popular, democracia, justiça, igualdade e livre da violência.
É admirável a resistência dessas mulheres corajosas, as quais não se curvam ao conservadorismo que destrói as políticas públicas voltadas para mulheres.
Esse é o nosso registro por agora, Sr. Presidente.
Sr. Presidente, Sras. e Srs. Deputados, parabenizo os Prefeitos Veríssimo Siqueira, de Santa Rosa do Piauí, Carlos Monte, de Barras, e Professor Ribinha, de Campo Maior. Eles receberam o prêmio Prefeito Empreendedor, de iniciativa do SEBRAE - Serviço Brasileiro de Apoio às Micro e Pequenas Empresas, um reconhecimento aos gestores que implantaram projetos que contribuíram para o desenvolvimento de pequenos negócios nas cidades que administram.
Oito Prefeitos foram premiados, dentre 60 projetos inscritos. Os escolhidos irão representar o Piauí na fase nacional. 
O Prefeito Ribinha, de Campo Maior, ganhou o prêmio na categoria ""Políticas Públicas para o desenvolvimento dos pequenos negócios"". Já o Prefeito Veríssimo Siqueira, de Santa Rosa do Piauí, foi premiado na categoria ""Cooperação intermunicipal para o desenvolvimento econômico"". E Carlos Monte, Prefeito de Barras, levou o prêmio na categoria ""Inclusão produtiva e apoio ao microempreendedor individual"".
Os projetos escolhidos foram anunciados no Congresso das Cidades 2019, realizado em Teresina, Piauí, nesta semana, de 5 a 8 de maio, reunindo gestores públicos e empreendedores, para conhecer e compartilhar projetos que colaboram para o desenvolvimento dos Municípios. 
Parabenizo também todos os Prefeitos e Prefeitas que realizam projetos que estimulam o empreendedorismo nas cidades como forma de melhorar a renda e a qualidade de vida dos moradores.
Era este o meu registro por agora, Sr. Presidente."
PELA ORDEM;"O SR. ASSIS CARVALHO (PT - PI. Pela ordem. Sem revisão do orador.) - Sra. Presidenta, quero apenas registrar que no Auditório 12, neste momento, está sendo instalada a Comissão em Defesa dos Institutos Federais, iniciativa do Deputado Reginaldo Lopes, de Minas Gerais. E nós queremos aqui reafirmar o nosso apoio para combater esse ataque leviano á intelectualidade do nosso País. 
No Auditório Nereu Ramos está sendo instalada a Frente Parlamentar em Defesa dos Bancos Públicos, que também vem recebendo um ataque sem precedentes. Este Governo, que agride de forma impiedosa a soberania nacional, não tem nenhum poder em atacar, de um lado a educação e de outro lado os bancos públicos. São exatamente os bancos que conseguem vestir o desenvolvimento deste País, porque o seu olhar é só e tão-somente beneficiar o rentismo, beneficiar o sistema financeiro privado. 
Que este Parlamento e todos Deputados possam compreender o que nós estamos passando nesta Nação: uma agressão impiedosa à intelectualidade. Agridem agora também as universidades, agridem os institutos federais, agridem os bancos públicos, agridem as igrejas, agridem a todos que estão do lado dos mais humildes.
Portanto, estamos aqui para reafirmar o nosso apoio à Frente Parlamentar em Defesa dos Institutos Federais, à Frente Parlamentar em Defesa das Universidades Públicas Federais, à Frente Parlamentar em Defesa dos Bancos Públicos. Estamos aqui para defender aqueles que estão ao lado dos mais pobres, dos mais humildes, que, lamentavelmente estão sendo perseguidos por este Governo, que tão-somente tem compromisso com os interesses internacionais e agride a soberania nacional. 
Sra. Presidente, peço a V.Exa. a divulgação do nosso pronunciamento pelos meios de comunicação desta Casa."
BREVES COMUNICAÇÕES;"O SR. ASSIS CARVALHO (PT - PI. Sem revisão do orador.) - Sra. Presidente, quero falar sobre os ataques que a educação vem sofrendo.
Desde 1997, quando foi criado o FUNDEF, em 2007 transformado em FUNDEB, esse fundo para o desenvolvimento da educação básica vem contribuindo fortemente para incluir crianças em creches e incluir crianças em escolas. Infelizmente, nestes dias, ele vem sofrendo uma agressão sem limites.
O jornal O Globo, em reportagem de ontem, aponta os níveis absurdos de recursos que foram retirados da atenção básica.
O mais grave é que o Governo diz que corta recursos das universidades federais, dos Institutos Federais, para beneficiar a educação básica. Mas o que percebemos é que acontece exatamente o contrário, porque essa também é uma área que está sendo muito agredida.
Portanto, queremos fazer aqui, nobre Presidente, o nosso protesto.
A SRA. PRESIDENTE (Geovania de Sá. PSDB - SC) - Peço que conclua, Deputado.
O SR. ASSIS CARVALHO (PT - PI) - É inaceitável, no século XXI, vermos a educação pública sofrendo tamanhos cortes, tanto em nível superior quanto em nível básico, o do FUNDEB.
Nós queremos conclamar os Parlamentares desta Casa a darmos as mãos. Agredir a educação é colocar toda uma Nação a serviço, lamentavelmente, da exploração por parte dos mais ricos, porque não se consegue libertar as pessoas que precisam.
Sra. Presidente, peço a V.Exa. que o nosso protesto e a nossa inquietação sejam divulgados pelos meios de comunicação desta Casa e no programa A Voz do Brasil, porque agredir a educação é agredir a soberania nacional.
Lamentamos profundamente que o Brasil passe por um momento tão difícil como este, quando a educação do povo brasileiro está sendo agredida."
FALA DO PRESIDENTE OU NO EXERCÍCIO DA PRESIDÊNCIA;"O SR. PRESIDENTE (Assis Carvalho. PT - PI) - O outro orador do Grande Expediente sorteado para hoje é o Deputado João Campos, mas fui informado de que S.Exa. não se encontra no plenário. Então, vamos chamar os inscritos para breves comunicações, considerando que não temos outro orador do Grande Expediente. Depois, também chamaremos os Líderes que vierem a se inscrever.
Antes, eu quero aqui fazer o meu desagravo diante de todos os Parlamentares, homens e mulheres deste Parlamento, que contribuem fortemente para construir uma democracia. Acho extremamente triste qualquer Parlamentar desta Casa ser tratado como ""canalha"", porque não o somos. Todos os partidos aqui lutam, cada qual a seu modo, para construir uma democracia que, muitas vezes, está sendo ameaçada e prejudicada, inclusive com agressão à educação. Eu quero louvar como o maior valor da humanidade a educação. Quando se agride a educação, se agride o povo brasileiro. Então, queria manifestar isso."
PELA ORDEM;"O SR. ASSIS CARVALHO (PT - PI. Pela ordem. Sem revisão do orador.) - Sr. Presidente, primeiro, eu quero dizer que compreendo que esta Casa tem um papel fundamental em relação à democracia deste País e que tenho profunda discordância daqueles que tentam usar o argumento da força, porque lhes falta a força do argumento. O argumento da força recorre à bala, ao soco, ao tapa, ao xingamento. Este não é o caminho correto. Recorro à maioria do Parlamento do meu País. Nós sempre temos que acreditar na força do argumento. Por isso condeno veementemente os palavrões e os xingamentos, porque isso não constrói democracia.
Aproveito a oportunidade, Sr. Presidente, para condenar também, de forma veemente, aqueles que agridem a educação do nosso País. Nós compreendemos que não há outro investimento a favor da segurança e contra a violência que não seja exatamente o investimento na educação. Neste momento, quando universidades públicas e institutos federais do meu País sofrem uma agressão tão forte, eu venho aqui exatamente para dizer que vamos lutar. 
Eu espero que amanhã, dia 15 de maio, o povo brasileiro ocupe as ruas, em defesa da educação e em defesa da soberania nacional, porque agredir a educação é agredir a própria soberania nacional. 
Dizer que estão sendo contingenciados 30% das verbas da educação, tenha paciência, é achar que o povo brasileiro não tem inteligência, que o povo brasileiro acredita em qualquer loucura que se coloque dos microfones. Vamos defender da educação!
Também quero dizer, com todas as letras, que a proposta de reforma da Previdência Social aí colocada só tira direitos de quem já não tem, dos pobres. Mostram, na televisão, aquilo que não está no projeto. É mentirosa a afirmação de que a proposta só mexe em privilégios. Ela mexe exatamente no Regime Geral de Previdência Social, cujos benefícios têm teto máximo de 5.800 reais. Quando ela mexe no Regime Próprio de Previdência Social, mexe com o professor e a professora, Deputada Lídice da Mata, mexe com o enfermeiro e a enfermeira, mexe com o pobre coitado, mas não mexe com privilégios, porque quem está aí não tem coragem de enfrentar privilégios.
Quero dizer que o Presidente Lula defendeu, sim, uma reforma e a fez, mas sem agredir os pobres. A Presidente Dilma, em 2013, fez uma reforma, mas sem agredir os pobres. O Governo de agora, que não tem coragem de enfrentar os poderosos, agride exatamente os mais humildes.
Sr. Presidente, solicito que autorize a publicação do nosso pronunciamento nos meios de comunicação desta Casa, em especial no programa A Voz do Brasil.
Muito obrigado."
PELA ORDEM;"O SR. ASSIS CARVALHO (PT - PI. Pela ordem. Sem revisão do orador.) - Sr. Presidente, peço que me conceda 1 minuto apenas para declarar que o meu voto foi ""sim"", a favor da vaquejada. Eu sou do Nordeste e não poderia, de forma nenhuma, ficar contra o meu querido Estado do Piauí. Hoje, se nós temos um Estado, isso é graças às fazendas de gado da época de Domingos Afonso Mafrense.
Então, o meu voto foi ""sim"", a favor da vaquejada.
Um abraço a todos os vaqueiros do meu querido Estado do Piauí e do Nordeste.
Aproveito, Sr. Presidente, para reafirmar meu voto ""não"" à reforma da Previdência, reforma que só prejudica os mais pobres. Eu duvido que esses que defendem essa reforma citem um único artigo que mexa com privilégios. Esta reforma agride quem ganha dois, três salários mínimos. O Governo quer economizar 1 trilhão de reais para ajudar o rentismo.
Meu voto é ""não"" à reforma da Previdência!"
PELA ORDEM;"O SR. ASSIS CARVALHO (PT - PI. Pela ordem. Sem revisão do orador.) - Sr. Presidente, em 2003, este Brasil estava sem qualquer crédito internacional, e o Lula pegou um País com a 12ª economia do mundo e deixou como a 6ª maior economia do mundo. A Fundação Getulio Vargas diz que foi no Governo do PT que a economia mais se desenvolveu neste País.
No entanto, Sr. Presidente, hoje nós vemos a reinstalação do modelo ultraliberal piorado de Fernando Henrique Cardoso, que prejudica os mais pobres, os mais humildes. Assim, Sr. Presidente, a insensibilidade deste Parlamento haverá de ser cobrada nas ruas, porque o que se está fazendo aqui é um crime contra os pobres, dando privilégio a quem já é tão privilegiado.
Portanto, queremos aqui reafirmar o nosso descontentamento e o nosso protesto contra essa reforma imoral."
