0;1
PEQUENO EXPEDIENTE;"O SR. ASSIS CARVALHO (PT - PI. Sem revisão do orador.) - Sra. Presidenta, primeiro, eu quero registrar, com muita alegria, a presença neste plenário da querida Prefeita Mercia Abreu, de São João da Canabrava, que se reuniu com várias Lideranças para defender os interesses do seu Município.
Sra. Presidente, um trecho da música Súplica Cearense diz o seguinte:
Pedi pro sol se esconder um pouquinho 
Pedi pra chover, mas chover de mansinho
Pra ver se nascia uma planta, uma planta no chão 
As chuvas são bem-vindas lá no Piauí. Quando está nublado, nós dizemos: ""Está bonito para chover"". Numa região seca em que falta água para a produção, é uma oportunidade generosa quando a água cai das nuvens. Mas também torna-se um tormento nos dias de grandes volumes pluviométricos. Como tudo nesta vida, ao cair toda a chuva que há, pagamos o preço pelos excessos e pedimos que pare.
Segundo dados da imprensa, há 1.040 famílias desabrigadas em Parnaíba, e mais 600 lugares alagados. Há outras notícias, com menor número de pessoas em situação de risco. O trecho da BR-366 entre as cidades de José de Freitas e Lagoa Alegre foi rompido, e há alagamentos em Piripiri, Teresina, Bom Jesus e outros Municípios.
O que me preocupa é o alerta de fortes precipitações previstas para o Estado. O que resulta disso são famílias indefesas diante de fenômenos naturais que arrastam seus poucos bens e põem em risco sua vida. As chuvas são fenômenos que independem de nossas decisões e, em alguns momentos e em alguns lugares, são recebidas como oportunidade, e não como ameaça.
Nós precisamos assumir a nossa culpa pela intensificação das chuvas causadas pelo aquecimento global. A emissão de gases de efeito estufa, causada por atividades como transporte e desmatamento, tem causado alterações climáticas em todo o nosso planeta. Somos nós mesmos que estamos sofrendo as consequências."
PEQUENO EXPEDIENTE;"O SR. ASSIS CARVALHO (PT - PI. Sem revisão do orador.) - Sr. Presidente, o Conselho Nacional do Laicato do Brasil - CNLB, Regional Nordeste IV, em sua XXVIII Assembleia Geral Ordinária, realizada no período de 15 a 17 de março de 2019, na cidade de Oeiras, no Piauí, com a participação da Arquidiocese de Teresina, de Picos, de Paranaíba, de Floriano e de São Raimundo Nonato, através de uma nota, declarou apoio às manifestações contra a reforma da Previdência apresentada pelo Governo Federal e em tramitação no Congresso Nacional.
Diante do contexto que vivemos, as propostas pautadas da reforma mostram-se agressivas e danosas aos trabalhadores e trabalhadoras, sobretudo às mulheres idosas e à juventude, principalmente aos mais empobrecidos.
Nessa oportunidade, o CNLB, Regional Nordeste IV, organiza uma eclesial da Igreja Católica do Brasil e vem a público manifestar preocupação com os prejuízos que a proposta de reforma da Previdência pode trazer à sociedade brasileira, de forma a retirar direitos conquistados com muitas lutas.
É importante destacar que a reforma privilegia Parlamentares, mandatários e militares e aumenta a injustiça com os mais pobres. Tendo em vista que o nos diz o Evangelho, ""serás libertado pelo direito e pela justiça"" (Is 1, 27), isso nos motiva a conquistar e garantir direitos em busca de igualdade social.
Sr. Presidente, dou como lida a íntegra de meu pronunciamento, incorporando-me a essa manifestação do Conselho Nacional do Laicato do Brasil, ligado à CNBB.
Quero reafirmar minha posição: não podemos fazer uma reforma que prejudique os mais pobres e privilegie os mais ricos. Os ricos já têm privilégios demais! Se queremos igualdade para todos, devemos combater os privilégios.
Peço ainda, Sr. Presidente, que meu discurso seja divulgado no programa A Voz do Brasil.

DISCURSO NA ÍNTEGRA ENCAMINHADO PELO SR. DEPUTADO ASSIS CARVALHO.

Sr. Presidente, gostaria de deixar registrada nesta Casa a nota da 28ª Assembleia Geral Ordinária do Conselho Nacional do Laicato do Brasil, Regional do meu Estado do Piauí, que se manifesta contrariamente ao pacote de maldades apresentado pelo Governo Bolsonaro,
Essa é, Sr. Presidente, mais uma posição contrária à essa reforma da Previdência que só tira direitos dos trabalhadores e das classes mais pobres da nossa população para beneficiar banqueiros e elites. A nota é mais uma manifestação de apoio às manifestações contrárias à reforma.
Assinam a nota a Sra. Maria Aurenir da Silva Paiva e o Sr. Gil Ferreira da Silva Neto, Presidente e Vice-Presidente da Regional Piauí do Conselho Nacional do Laicato do Brasil.
Eram essas as minhas palavras por hoje, Sr. Presidente.
Obrigado.
DOCUMENTO ENCAMINHADO PELO SR. DEPUTADO
ASSIS CARVALHO.
Nota da XXVIII Assembleia Geral Ordinária do Conselho Nacional do Laicato do Brasil Regional Nordeste 04 Piauí, em apoio  às manifestações contra a reforma da Previdência.
O Conselho Nacional do Laicato do Brasil CNLB - Regional Nordeste 4 - Piauí, em sua 28ª Assembleia Geral Ordinária realizada no período de 15 a 17 de março de 2019, na Diocese de Oeiras - PI, com participação da Arquidiocese de Teresina e das Dioceses de Picos, Parnaíba, Floriano e São Raimundo Nonato, vem através desta nota manifestar apoio às manifestações contra a Reforma da Previdência, apresentada pelo governo federal em tramitação no Congresso Nacional. Considerando que diante do contexto que vivemos, as propostas pautadas na reforma, mostram-se agressivas e danosas aos trabalhadores, sobretudo às mulheres, idosos, e a juventude principalmente os mais empobrecidos.
Nesta oportunidade o CNLB NE4, Organismo eclesial da Igreja Católica no Brasil, vem a público manifestar preocupação com os rumos que a proposta da Reforma da Previdência possa trazer a sociedade brasileira, de forma a retirar direitos conquistados com muitas lutas. É importante destacar que a Reforma privilegia parlamentares, mandatários e militares, e aumenta a injustiça com os mais pobres, tendo em vista que a proposta do Evangelho nos diz que ""serás libertado pelo direito e pela justiça"" (Is 1,27), e isso nos motiva a buscar a conquista e a garantia de direitos por igualdade social.
A PEC n° 6/2019 apresentada pelo governo Bolsonaro mostra muitas discordâncias diante de seus objetivos apresentados, uma vez que diante de muitas análises e averiguações constata-se que a previdência não é deficitária e o seu maior objetivo é fortalecer o capital financeiro prejudicando os trabalhadores (as) com diminuição de ganhos, aumento da idade e do tempo de contribuição, abertura para privatização da oferta de serviços públicos, ataque aos direitos das mulheres, dentre outros fatores que promovem a flexibilização de direitos, constituindo retrocesso e destruição dos conceitos mais bem construídos e formulados na Constituição Federal de 1988.
Contudo convocamos todos os Cristãos leigos e leigas na Igreja e na sociedade, a se unirem-se e caminhar juntos e juntas a todos os movimentos e manifestações contra a Reforma da Previdência, em comunhão com nossos pastores em defesa dos direitos e da cidadania."
PELA ORDEM;"O SR. ASSIS CARVALHO (PT - PI. Pela ordem. Sem revisão do orador.) - Sr. Presidente, eu queria agradecer este minuto que me foi concedido para que eu falasse antes da minha querida Deputada Alice.
Quero apenas registrar que o Ministro Paulo Guedes está obcecado em captar 1 trilhão de reais dos pobres, dos trabalhadores rurais, dos idosos. E nós queremos dialogar sobre isso.
Os dados do Governo Federal dizem que a dívida ativa da União hoje é de 2 trilhões de reais, a serem arrecadados. O Governo deveria securitizar esse valor e designar para essa finalidade o trilhão que ele quer captar. Nós poderíamos ter uma contribuição sobre as grandes fortunas. Coloque o trilhão em cima das grandes fortunas! 
Sr. Presidente, aqui nós precisamos trabalhar em um projeto, que inclusive é de minha autoria, para tributar o licenciamento e a renovação de licenciamento de aeronaves e iates. E temos a questão social, com a finalidade...
(Desligamento automático do microfone.)"
PELA ORDEM;"O SR. ASSIS CARVALHO (PT - PI. Pela ordem. Sem revisão do orador.) - Sra. Presidenta, nós queremos lembrar que o Presidente Michel Temer, que assumiu o poder por meio de um golpe, com o apoio de Jair Bolsonaro, apresentou aqui um regime especial de tributação para a Shell que significa uma renúncia fiscal de 1 trilhão de reais. Imagino que Jair Bolsonaro, que recebeu o apoio de Temer e indicou os Deputados Carlos Marun e Osmar Terra para o seu Governo, poderia ter agora a coragem de anular essa imoralidade de beneficiar a Shell em 1 trilhão de reais e destinar esses recursos à Previdência. 
Sra. Presidenta, o Governo Federal tem de receber 2 trilhões de reais de ativos. Ele poderia simplesmente se aliar aos bancos, securitizar e, através de uma medida social, colocá-los para a Previdência. Mas este Governo não tem coragem de enfrentar poderosos, só quer enfrentar os humildes. Mas nós vamos derrotar essa proposta imoral aqui no Parlamento."
PEQUENO EXPEDIENTE;"O SR. ASSIS CARVALHO (PT - PI. Sem revisão do orador.) - Sra. Presidenta, a tarde de ontem foi um momento triste para a história mundial.
Assistimos, sem que nada pudéssemos fazer, à Catedral de Notre-Dame ser parcialmente destruída pelas chamas. Símbolo da França, da cultura europeia e memória da história do mundo, a igreja começou a ser construída em 1163 e levou 180 anos para ficar pronta. As chamas levaram parte dos mais de 850 anos de história de um Patrimônio da Humanidade, declarado pela UNESCO em 1991. Perdemos uma página da cultura mundial. Perdemos parte da história da arquitetura e das obras de arte. Apesar dos estragos causados pelas chamas, a estrutura foi salva. Assim, acreditamos na reconstrução desse grande símbolo da história mundial.
Manifesto a minha solidariedade aos parisienses, aos católicos e a todos nós, que sofremos com essa perda irreparável.
Sra. Presidente, peço que o meu discurso seja divulgado no programa A Voz do Brasil."
PELA ORDEM;"O SR. ASSIS CARVALHO (PT - PI. Pela ordem. Sem revisão do orador.) - Sra. Presidenta, a Semana Santa é um tempo sagrado para os católicos. Em Oeiras, Piauí, minha cidade natal, as celebrações desse período sagrado são bastante especiais.
Na sexta-feira passada, dia 12 de abril, participei da Procissão de Bom Jesus dos Passos, que reuniu milhares de fiéis, lotando as ruas de Oeiras, considerada a Capital da Fé.
Esse foi o segundo evento da Semana Santa, que tem como tema Com Bom Jesus dos Passos, pela Justiça e pela Paz, relacionado à Campanha da Fraternidade deste ano, que traz o tema Fraternidade e Políticas Públicas. 
O primeiro evento sagrado foi a missa na catedral e a Procissão da Fugida de Bom Jesus até a Igreja do Rosário.
O sábado, dia 13, prosseguiu com muitos rituais católicos, destacando-se a Cantata ao Bom Jesus dos Passos, na Igreja Catedral.
No domingo, dia 14, a Procissão e a Missa de Ramos.
Na segunda-feira, ontem, ocorreu a Bênção dos Santos Óleos e, hoje, terça-feira, a Missa da Unção dos Enfermos. 
Amanhã, na chamada Quarta-feira de Trevas, haverá a Via Sacra da Juventude, que percorre as ruas da cidade. Em seguida, haverá a Missa e a Solenidade das Trevas.
Na quinta-feira, dia 18, os pontos altos são a Cerimônia do Lava-pés e a Procissão do Fogaréu.
O Descimento da Cruz e a Procissão do Senhor Morto são as cerimônias abençoadas da Sexta-feira da Paixão.
No Sábado de Aleluia, tem Cantoria ao Ressuscitado no Adro da Igreja Catedral, Vigília Pascal, com a Bênção do Fogo Novo e a Renovação das Promessas do Batismo.
No Domingo da Ressurreição, teremos a Procissão do Senhor Ressuscitado e Missa Solene.
O lema da Semana Santa de Oeiras deste ano é Serás libertado pelo direito e pela justiça, conforme está em Isaías, Capítulo 1, Versículo 27, numa mensagem sugestiva e sempre atual.
Os tradicionais rituais da Igreja Católica alimentam a alma e nos preparam para a jornada diária, em que Jesus Cristo, presente nos irmãos e irmãs, segue massacrado, injustiçado e sempre em busca da justiça e da paz.
Sra. Presidente, eu queria aproveitar este tempo para registrar os meus agradecimentos à cidade de Paulistana, da qual recebi oficialmente o título de cidadania, no último sábado, dia 13.
O Título de Cidadão Paulistanense foi uma proposição de iniciativa do então Vereador Adalberto Sousa, o querido Betinho, que foi aprovada pelos Vereadores da Câmara Municipal.
Tenho muitos amigos e amigas naquela cidade que, a partir de agora, passam a ser meus conterrâneos e conterrâneas também. Esse é um elo a mais que nos une nessa caminhada pelo desenvolvimento do Município.
Sempre tive um carinho imenso por Paulistana e agora esse afeto passa ser um laço oficial, com o título de cidadania. Minha responsabilidade de trabalhar pela cidade aumenta ainda mais.
Agradeço ao Líder Betinho e ao Vereador Valdeci Arrais, Vice-Presidente da Câmara, que presidiu a sessão. Também agradeço aos Vereadores Zé de Dodô e Elias de Liberato, à Dona Helena, ao Dr. Crisóstomo e a todas as lideranças dos 21 Municípios que foram me prestigiar naquela solenidade.
Paulistana fica localizada no território do Vale do Itaim, no Piauí. Vive da ovinocultura, da agricultura familiar e do comércio. A Transnordestina, que está sendo construída, passa por lá, e há um potencial para a mineração e para produtos de energia solar. Mas esses investimentos não chegaram ainda ao Município, que hoje depende muito dos repasses federais, dos recursos do Bolsa Família e da aposentadoria. Por isso, é mais um dos Municípios que será muito prejudicado caso a reforma da Previdência proposta por Bolsonaro seja aprovada aqui no Congresso.
Lá encontrei cidadãos e cidadãs muito preocupados com as decisões desta Câmara, visto que os efeitos, se essa reforma for aprovada, seriam bastante significativos na vida de cada um, fazendo-os mais pobres.
Na palestra que fiz lá sobre a proposta de reforma que tramita nesta Casa, ressaltei as razões pelas quais voto contra as propostas que aqui estão, tais como o sistema de capitalização, as normas para a aposentadoria das mulheres e de trabalhadores rurais, o benefício da prestação continuada, além da regra que desconstitucionaliza a Previdência. 
E é assim, de cidade em cidade, que nós construímos a resistência contra essa reforma de Bolsonaro, que acaba com a aposentadoria, sacrifica os brasileiros e brasileiras e entrega a Previdência aos bancos, tornando os ricos mais ricos e jogando os pobres na miséria.
Sra. Presidente, solicito a divulgação do meu pronunciamento nos meios de comunicação desta Casa."
PELA ORDEM;"O SR. ASSIS CARVALHO (PT - PI. Pela ordem. Sem revisão do orador.) - Sra. Presidenta, eu quero prestar aqui a minha solidariedade ao povo do Rio de Janeiro, mais especificamente às famílias do Condomínio Figueiras do Itanhangá, na comunidade de Muzema. Na última sexta-feira, a comunidade foi palco de uma tragédia, quando dois edifícios caíram. Já passa de 15 o número de mortos e ainda há 9 pessoas desaparecidas. Grávidas, mães e crianças estão entre os mortos. 
É importante que todos saibam que os imóveis que desabaram tinham sido construídos pela milícia. As notícias apontam que, segundo a Prefeitura da cidade, os criminosos dominam a venda de imóveis irregulares na região, além de praticar agiotagem e venda ilegal de serviços como luz, gás e TV a cabo. O que não me surpreende é saber que o chefe da milícia da região, o Major Ronald Paulo Alves Pereira, foi homenageado pelo então Deputado Estadual Flávio Bolsonaro, filho do hoje Presidente da República. Em 2004, o atual Senador propôs uma moção de louvor ao miliciano na Assembleia Legislativa do Rio de Janeiro. Mais uma vez, vemos o clã Bolsonaro envolvido com a milícia. Infelizmente, vemos a população brasileira pagar com as próprias vidas.
Até quando, Sra. Presidenta? Até quando nós vamos viver essa tristeza de ver instalado no poder central alguém que está matando os nossos irmãos com um crime como esse? 
Deixo toda a minha solidariedade ao povo do Rio de Janeiro."
PEQUENO EXPEDIENTE;"O SR. ASSIS CARVALHO (PT - PI. Sem revisão do orador.) - Sra. Presidenta, no dia 1º de maio, o Hospital Regional Deolindo Couto, da minha querida cidade de Oeiras, completou 50 anos de fundação. Comemoramos as ""bodas de ouro"" com uma grande festa.
Aquele hospital, Deputado Padre João, faz em torno de 30 mil atendimentos por mês, entre consultas, exames, internações, partos, cirurgias, suturas, imobilizações ortopédicas, diálises, sessões de fisioterapia, medicações, dentre outros.
Com emenda de nossa iniciativa e com a nossa luta como Deputado Federal, abrimos uma Unidade de Pronto Atendimento, que vem qualificando bastante essa assistência.
Lá nós trabalhamos com neurocirurgia, neurologia, ortopedia, pediatria, obstetrícia, ginecologia, nefrologia, cardiologia, infectologia, oftalmologia, clínica médica, fisioterapia, psicologia. Além disso, são feitos exames de radiologia, patologia clínica, ultrassonografia, eletrocardiograma, dentre muitos outros atendimentos.
Aproveito a oportunidade para agradecer ao time coordenado pelo grande Diretor Alípio Sady, meu amigo, que tem feito um trabalho extraordinário à frente daquela casa. Na pessoa do Diretor Alípio, agradeço a toda a equipe de médicos, enfermeiros, técnicos de enfermagem, bioquímicos, psicólogos, fisioterapeutas, fonoaudiólogos, nutricionistas, oftalmologistas, técnicos de laboratório, técnicos de radiologia, assistentes sociais, auxiliares de serviços gerais, motoristas e auxiliares administrativos que constroem essa história de sucesso e resolutividade da saúde na minha cidade de Oeiras.
Sra. Presidente, peço a V.Exa. que o meu pronunciamento seja dado como lido e divulgado nos meios de comunicação da Casa, em especial no programa A Voz do Brasil. 
Muito obrigado. 
A SRA. PRESIDENTE (Geovania de Sá. PSDB - SC) - Obrigada, Deputado. 
Está deferido o seu pedido.

DISCURSO NA ÍNTEGRA ENCAMINHADO PELO SR. DEPUTADO ASSIS CARVALHO.

Sra. Presidente, Sras. e Srs. Deputados, registro aqui que foram comemoradas as ""bodas de ouro"" do Hospital Regional Deolindo Couto.
Ao completar 50 anos, a unidade de saúde comemora o fato de ter se tornado referência em resolutividade, pois está preparada para oferecer saúde pública a 120 mil pessoas que vivem em Oeiras, cidade onde nasci, e em mais 16 Municípios do território do Vale do Canindé. 
O hospital realiza mais de 30 mil atendimentos por mês. Lá são realizados exames, consultas, internações, partos, cirurgias, suturas, imobilizações ortopédicas, diálises, sessões de fisioterapia, medicações, dentre outros procedimentos.
Essa quantidade de atendimentos com qualidade foi possível após a implantação de uma Unidade de Pronto Atendimento - UPA, que permitiu a estruturação de um complexo hospitalar: o Complexo HRDC/UPA 24 horas.
O complexo realiza atendimentos ambulatoriais, atendimentos de urgência, cirurgias, sessões de fisioterapia, sessões de psicologia, além de pronto atendimento obstétrico e até internação em UTI. 
Tenho a felicidade de ter contribuído para essa evolução com emendas parlamentares e com a articulação de recursos que permitiram a ampliação e a renovação do parque tecnológico e capacitaram o complexo hospitalar para aumentar a quantidade de cirurgias eletivas, receber mutirões de cirurgias e implantar novos serviços, como internações em UTI, cirurgias bucomaxilofaciais e técnicas cirúrgicas menos invasivas e mais seguras, como a videolaparoscopia.
Hoje os usuários do SUS recebem atendimento nas seguintes especialidades: neurologia, ortopedia, pediatria, obstetrícia, ginecologia, nefrologia, cardiologia, infectologia, oftalmologia, clínica médica, fisioterapia, psicologia. Além disso, são realizados exames de radiologia, patologia clínica, ultrassonografia, eletrocardiograma.
Antes, muitos desses atendimentos eram centralizados em Teresina, Capital do Estado.
Na urgência, o complexo recebe uma média de 120 pessoas por dia. Nos 10 leitos de UTI, instalados há pouco mais de 1 ano, são tratados pacientes da região. Isso evita a transferência para hospitais da Capital, a menos que sejam casos bem específicos, que só possam ser tratados em hospitais de referência estadual.
Também destaco um serviço de prevenção ao suicídio, realizado através de um núcleo formado por psicólogos e por um médico neuropsiquiatra. Além disso, há um serviço de escuta, que funciona como porta de entrada para os serviços de saúde mental, realizados na Rede de Atenção Psicossocial, que já atendeu mais de 600 casos em 1 ano de funcionamento. 
Por tudo isso, afirmo que esse complexo hospitalar tem salvado muitas vidas na região de Oeiras. Parabenizo toda a população da região por poder contar com serviços de tanta qualidade. Parabenizo também o Diretor-Geral do complexo hospitalar, Sr. Alípio Sady, e toda sua equipe de médicos, enfermeiros, técnicos em enfermagem, bioquímicos, psicólogos, fisioterapeutas, fonoaudiólogos, nutricionistas, oftalmologistas, técnicos em laboratório, técnicos em radiologia, assistentes sociais, auxiliares de serviços gerais, motoristas e auxiliares administrativos, que constroem essa história de sucesso, de resolutividade, de saúde.
Peço licença para anexar a este discurso mais informações veiculadas em meios de comunicação locais.
Muito obrigado."
