0;1
COMO LÍDER;"A SRA. TIA ERON (REPUBLICANOS - BA. Como Líder. Sem revisão da oradora.) - Obrigada, Sra. Presidente, Deputada Greyce Elias, em nome de quem eu quero cumprimentar todas as demais Deputadas. Vejo aqui a Deputada Carla, uma querida, que já está fazendo os devidos anúncios das entregas e dos feitos do Governo Federal, pois a grande espera, a grande ansiedade nossa é ver de fato o Governo fazer intervenções, sobretudo, na escalada da violência contra a mulher. Agradeço às demais Deputadas e cumprimento cada um dos Deputados. 
Quero aqui fazer referência especial à coordenadora da bancada feminina, a Deputada Celina Leão, que é de fato uma leoa. Eu gostaria de modificar o seu nome, pedindo maxima venia a sua ilustre mãe, e leve a ela o meu respeito e o carinho que sempre trago comigo. V.Exa. hoje foi brilhante: abriu a pauta para que, mais uma vez, pudéssemos desengavetar tantos PLs que temos produzido. São PLs de grande contribuição a esta Nação. Deputada Celina, eu peço a Deus todos os dias pela sua vida, pelas suas mãos nessa bancada de mulheres. Vemos hoje que, no início, éramos tão pífias, tão pequenas, tão inexpressivas. Mas, hoje, percebemos que as mulheres já estão à frente de Comissões importantes, transformando a vida de cada brasileira. Parabéns pela condução do trabalho de V.Exa. e pela relatoria da minha grande e querida correligionária, a Deputada Rosangela Gomes, no texto aqui já aprovado sob a Presidência da Deputada Tereza Nelma. Obrigada, Deputada Celina. 
Agradeço ainda ao Presidente Marcos Pereira, bem como ao Líder do grupo do Republicanos, o Deputado Vinicius Carvalho, que me concedeu a honra de falar hoje sobre as mulheres republicanas. 
Deputada Greyce Elias, não é fácil ser mulher, diferentemente do que o ""Mamãe Falei"" declarou para o mundo - e a mãe dele não tem nada a ver com isso. Esse é um fato. Mas eu não quero relembrar aquilo que se diz no privado e que chega ao público. Muito pelo contrário, os homens precisam de fato reaprender essa pauta e se reabilitar. A bancada tem um compromisso muito sério e maior, que é criar a consciência de que não apenas na lei fria, em pé de igualdade, somos iguais. Nós o somos, mas, sobretudo, nos espaços de poder, onde não haverá democracia se não houver também a participação feminina. Então, que cada partido, dentro de suas estruturas, principalmente neste ano eleitoral, possa ter essa consciência, esse cuidado, essa devoção em fazer valer cada participação feminina, inclusive daquelas que já estão mostrando resultado.
Sra. Presidente, eu quero aqui lembrar o nosso trabalho com o Estatuto das Vítimas, grupo que V.Exa. já integra. Amanhã, às 10 horas, no Plenário 9, a Deputada Celina Leão vai entregar um rol de projetos, que serão como notas complementares ao Estatuto das Vítimas. Será uma das últimas reuniões de palestra magna que haveremos de fazer. Tivemos ali a participação do Ministro Anderson Torres, que se comprometeu per se dizendo que essa é uma bandeira do Governo Bolsonaro. O Governo Bolsonaro não defende bandido. O Governo Bolsonaro busca defender aquele que sofreu dano, aquele que foi prejudicado, aquele que foi sacrificado. E V.Exa. tem conhecimento dos fatos supervenientes que aconteceram em Minas Gerais, em Brumadinho. Portanto, há uma pertinência e uma legitimidade na sua participação em referência ao Estatuto das Vítimas para discutir. 
Amanhã, inclusive, Sra. Presidente - e peço que isso seja divulgado em A Voz do Brasil -, o Ministro Benedito Gonçalves, que instituiu nesta Casa a Comissão de Juristas, sobretudo na questão da discriminação que hoje ocorre no País, estará fazendo ali um levantamento e apresentando dados. O Ministro Anderson Torres também já confirmou presença para revalidar a questão do compromisso de uso do recurso do Fundo Penitenciário para fazer a reparação de danos a essas vítimas. E, quando olhamos essas vítimas, não são apenas os homens, não são apenas as crianças, mas são, especialmente, essas mulheres. 
No dia de hoje, eu quero aqui, com todas vocês, mulheres, Deputadas, com esta Nação, dizer que o Estatuto das Vítimas é um código que está sendo elaborado com vistas a pensar exatamente em mudança de patamar, porque não é o que está em voga hoje, ou seja, a vitimização ou o mi-mi-mi daquele que sofre, mas a garantia de direitos. O Estado precisa assegurar, quer seja homem, quer seja mulher, e aqui eu reafirmo isso, que esses e essas possam ter de fato segurança de fazer suas denúncias. Uma das primeiras portas são as delegacias. Mas, ao chegar a essas delegacias, essas vítimas carregam com elas uma questão de culpa. Elas não têm um amparo, não têm uma informação, não têm nem o sigilo. Os seus dados chegam, inclusive, àqueles que são os seus algozes. E aí elas sofrem todo tipo de ameaça, têm todo um medo. Mas, principalmente, a reparação de danos daquilo que lhe foi violado elas não têm de volta.
Então, esse é um código, como marco regulatório, que está sendo instituído com um pensar, inclusive, do Presidente Arthur Lira, que, de forma suprapartidária, mesmo tendo a autoria de um Deputado Federal do quilate do Deputado Rui Falcão, que já foi por 20 anos Presidente do PT, não considerou isso. S.Exa. olhou a questão que realmente necessita desse fazer, que é levar para esse novo patamar a condição de vítima.
Portanto, nós temos ali a responsabilidade de fazer valer, junto ao Ministério Público e às demais instituições, esse novo marco regulatório, que mudará, seguramente, a vida e a condição dessas mulheres vítimas e de todos os demais.
Sra. Presidente, eu quero aqui agradecer e parabenizar a Sra. Tiana, Chefe de Gabinete da Liderança do meu partido, mulher que V.Exa. conhece bem. E eu vejo os demais balançando a cabeça. Faço ainda um cumprimento especial aos homens, que, como dizia o meu professor, Hélio Santos, têm uma alma lésbica, têm uma alma feminina. E eu olho nos olhos desse senhor, o Dr. Ruthier, que nos presenteou com um grupo especial, porque é um grupo competente, é um grupo de escol, que está trabalhando no Estatuto das Vítimas de forma devotada. Na pessoa de Lucas Quintella, eu agradeço muitíssimo ao senhor, Dr. Ruthier, pela recomendação desse excelente funcionário, que honra esta Casa, mas é um homem, sobretudo, que pôde se apropriar e entender o que é essa pauta, que nós estamos chamando de Estatuto das Vítimas, o qual não deixa de personificar a questão dessas mulheres, com dados e estudos em maior número no Brasil.
Sra. Presidente, meu muito obrigada. Parabéns! Boa luta a cada mulher."
DISCUSSÃO;"A SRA. TIA ERON (REPUBLICANOS - BA. Para discutir. Sem revisão da oradora.) - Sr. Presidente, quero cumprimentá-lo de forma respeitosa, porque sei quanto V.Exa. é coerente à frente das sessões da Casa. 
Eu ouvi atentamente as colegas que falaram anteriormente. Quero dizer, Deputada Sâmia Bomfim, que foi o bom senso que imperou. A justiça foi a que melhor levou aqui, Sr. Presidente.
As mulheres são fortes por natureza, elas geram naturalmente.
Eu lembro o dia em que estávamos fazendo a última reunião magna do nosso grupo de trabalho. Estamos dando vida ao código, ao marco regulatório do estatuto das vítimas. Tivemos todo um cuidado lá. Como membro do grupo está a Deputada Jaqueline Cassol, que fez uma fala muito emocionante. Fez também um apelo ao Governo para que ele saiba tratar aqueles que são da situação e aqueles que são base. Ali, nós tivemos a representação do Ministro da Justiça Anderson Torres e a presença da Secretária Nacional de Proteção Global Mariana Neris. Vejam, senhores e senhoras, que a discussão no trato daquelas que são vítimas... 
Aqui não vou entrar no mérito de quem tem ou não condição de comprar um absorvente ou de quem deixe de comprar um absorvente para comprar um celular, para fazer uso de um cigarro, para usar um copo de cachaça. Não interessa: é direito! Direito não é benesse, direito não é favor. Direito é direito, precisa ser assegurado e garantido, independentemente de qualquer coisa. E esta Casa fez seu dever de casa.
Destaco mais uma vez o Partido Republicano Brasileiro, Sr. Presidente e demais colegas. Deputada Celina Leão, V.Exa. me citou. Como coordenadora, V.Exa. também esteve no nosso grupo de trabalho e viu a nossa luta, o nosso empenho. Ninguém vai poder desdenhar do esforço que é feito aqui.
Quero chamar atenção para o fato de que o nosso Presidente Nacional, o nosso Líder Vinicius Carvalho, teve o bom senso de entender que o veto devia ser derrubado. Por isso, eu faço essa fala no tempo da Liderança. Por isso, eu levanto a voz em nome das mulheres, não apenas da Bahia, mas de todo o Brasil, e não apenas das mulheres pobres.
Sr. Presidente, ouvimos a Luíza Brunet, que é ativista, atriz e modelo, trazer sua história. Ao mostrar sua história, ela também disse como essa história se conecta com as de tantas outras mulheres. O que são essas mulheres? Começaram na pobreza, como domésticas, como foi o caso dela, e sofreram abuso no ambiente de trabalho. Na casa dela havia cinco mulheres, com a mãe, e não tinham acesso à dignidade menstrual.
Parece uma coisa fora da realidade, mas desde que eu era menina - já sou tia, Sr. Presidente - ouço dizer que o País é subdesenvolvido. 
Precisamos considerar todos esses dados dessa questão. De fato, não se estava onerando nem criando uma fonte maior de despesa. Houve um equívoco muito grande do trato da equipe quando veio tratar disso com o Sr. Presidente. Houve um equívoco. Hoje, eu penso que, pelo bom senso, o Presidente Jair Bolsonaro teve o cuidado de declinar. 
E o meu partido fez o encaminhamento, o que me dá muito orgulho, ao vir hoje fazer esta fala no tempo de Liderança, para dizer que votamos ""sim"", pela derrubada do veto.
Obrigada, Sr. Presidente."
ENCAMINHAMENTO DE VOTAÇÃO;"A SRA. TIA ERON (REPUBLICANOS - BA. Sem revisão da oradora.) - Sr. Presidente, eu prezo esse destaque e considero que foi apresentado de forma muito inteligente e precisa. 
É importante lembramos que a guerra talvez nos tenha levado, Deputado Reginaldo Lopes, a um aumento dos preços e à discussão que travamos até este momento. Mas precisamos também considerar alguns pontos importantes quanto à aviação regional. Não ouvi aqui ninguém tocar neste ponto, Deputado Glauber Braga e Deputada Sâmia Bomfim. 
O Estado da Bahia tem 417 Municípios e uma área territorial enorme. Em viagens de carro, há Municípios mais próximos do Espírito Santo do que da Bahia propriamente dita. Há viagens de carro pelo Estado que duram 18 horas, 19 horas. Então, é para a importância da aviação regional que esse destaque chama a atenção.
E quero fazer um apelo ao Plenário, porque o Republicanos teve o cuidado de assegurar, inclusive, a retirada do querosene, uma vez que no projeto principal não existia essa possibilidade. O Senado, como Casa revisora, foi quem o inseriu.
O Republicanos encaminha a votação no sentido da manutenção do texto original.
Obrigada."
PELA ORDEM;"A SRA. TIA ERON (REPUBLICANOS - BA. Pela ordem. Sem revisão da oradora.) - Sr. Presidente, eu acabei de receber a informação de que o PP está mudando sua orientação, por entender que esse destaque quebra o monopólio e, mais do que isso, favorece a livre concorrência. 
O PP muda sua orientação para ""não""."
PELA ORDEM;"A SRA. TIA ERON (REPUBLICANOS - BA. Pela ordem. Sem revisão da oradora.) - Sr. Presidente General Peternelli, o dia 21 de março é voltado ao combate de todas as formas de discriminação racial.
Quero aproveitar a oportunidade para fazer um agradecimento à Câmara dos Deputados, que encampou o Projeto de Lei nº 1.749, de 2015, de minha autoria, que também fortalece o enfrentamento da injúria racial.
Sr. Presidente, há necessidade de termos aqui um aparelho permanente, uma Comissão Mista que venha a fazer o combate e o enfrentamento de todas as formas de injúria racial.
O dia 21 de março é importante porque ressalta a necessidade de se tratar desse tema, até porque, seguramente, há um negão na árvore genealógica de cada família brasileira.
Sr. Presidente, peço que este pronunciamento seja divulgado no programa A Voz do Brasil.
Obrigada."
PELA ORDEM;"A SRA. TIA ERON (REPUBLICANOS - BA. Pela ordem. Sem revisão da oradora.) - Sr. Presidente, o Republicanos orienta ""sim"".
Antes eu quero fazer um encaminhamento e um registro importante ao Deputado Antonio Brito.
Mais cedo, Deputado Antonio Brito, a Deputada Margarete Coelho já estava relatando no GT do Estatuto das Vítimas que o maior índice dessas vítimas são as nossas mulheres brasileiras. Ela já dizia assim: ""Deputada Tia Eron, a PEC 18 será pautada porque o Deputado Antonio Brito disse, e assim o será"" . V.Exa., juntamente com o Presidente Marcelo Ramos, tem uma alma feminina.
Eu quero aproveitar, Sr. Presidente, com a sua permissão, para cumprimentar o Dr. Ruthier, que teve também uma participação importante na criação desse grupo de trabalho, no qual encerramos as nossas atividades. Conseguimos, por fim, aprovar o relatório, na pessoa do Deputado Gilberto Nascimento, um Deputado de notório saber, o vetusto do nosso grupo de trabalho. Quero dizer que esse é um marco regulatório importante, que mudará de patamar as vítimas do nosso País. 
Cumprimento, Sr. Presidente, todos os demais membros desse GT e dou as boas-vindas, por fim, à PEC 18.
Obrigada, Presidente."
