dataHoraInicio;keywords;tipoDiscurso;transcricao
2019-05-28T18:56;ORIENTAÇÃO DE BANCADA, REQUERIMENTO DE VOTAÇÃO NOMINAL, REQUERIMENTO DE RETIRADA DE PROPOSIÇÃO DA ORDEM DO DIA, MPV 867/2018, MEDIDA PROVISÓRIA, CIDADANIA (PARTIDO POLÍTICO), OBSTRUÇÃO PARLAMENTAR.;PELA ORDEM;"O SR. DANIEL COELHO (CIDADANIA - PE. Pela ordem. Sem revisão do orador.) - Presidente, aproveitando a colocação da Deputada, quero dizer que a obstrução está se dando porque nós não temos aqui um jabuti, mas a selva inteira em cima do poste. Foi mandada uma medida provisória prorrogando o prazo para a adequação dos Municípios, mas o que estamos vendo aqui no PLV é a tentativa de se reescrever todo o Código Florestal brasileiro sem fazer um debate adequado com a sociedade. 
Então, é um exagero imenso esse PLV. Nós não teremos problema nenhum em votar o texto original. Na verdade, nós aqui fazemos um apelo ao Governo para que apoie o texto original e não o PLV. Não há problema se quiserem discutir o novo Código Florestal. Mandem um projeto de lei para cá, abriremos uma Comissão e faremos o debate.
Agora, mais do que um jabuti, colocar uma selva inteira em cima do poste para aprovarmos, isso é um assunto diferente.
O texto original tem o apoio do Cidadania. Da maneira como está colocado, o Cidadania orienta a obstrução."
2019-05-28T19:28;ORIENTAÇÃO DE BANCADA, REQUERIMENTO DE RETIRADA DE PROPOSIÇÃO DA ORDEM DO DIA, MPV 867/2018, MEDIDA PROVISÓRIA, CIDADANIA (PARTIDO POLÍTICO), LIBERAÇÃO.;PELA ORDEM;"O SR. DANIEL COELHO (CIDADANIA - PE. Pela ordem. Sem revisão do orador.) - Sr. Presidente, o Cidadania, em respeito à posição do Deputado Arnaldo, que já esteve aqui - nós estávamos num movimento de obstrução -, vai liberar a bancada.
Mas reitero a nossa posição a favor de se votar o texto original. Algumas coisas desse texto aqui não são razoáveis. Está se falando em alterar as multas já transitadas em julgado em âmbito administrativo e judicial. Nós vamos fazer isso agora aqui numa MP que visava apenas prorrogar data? É muita mudança! O texto original era adequado e teria o apoio da unanimidade, mas há a insistência em, mais uma vez, legislar em cima de medida provisória com um texto que não tem nada a ver com a intenção original. 
Inclusive, temos um debate democrático neste Parlamento, levantado por V.Exa., para limitarmos as ações das MPs. Nós mesmos aqui estamos dando mau exemplo: usando uma medida provisória para fazer outras coisas que não são a sua intenção original.
Nós vamos liberar a bancada, em respeito ao Deputado Arnaldo, mas defendemos o texto original."
2019-05-29T14:04;"ORIENTAÇÃO DE BANCADA, PARECER, COMISSÃO MISTA, MPV 867/2018, MEDIDA PROVISORIA, CIDADANIA (PARTIDO POLÍTICO), LIBERAÇÃO.
MISOGINIA, GEOVANIA DE SÁ , DEPUTADO FEDERAL.";PELA ORDEM;"O SR. DANIEL COELHO (CIDADANIA - PE. Pela ordem. Sem revisão do orador.) - Sr. Presidente, nós insistimos na tese de que a MP original atendia ao objetivo de prorrogar os prazos sem alterar o nosso Código Florestal.
A bancada libera as votações até que se chegue ao mérito da nossa emenda, em respeito à posição do Deputado Arnaldo Jardim, mas reitero a importância de votarmos a MP original.
Aproveito esta oportunidade para manifestar o nosso apoio à Deputada Geovania de Sá, que estava na Presidência desta sessão.(Palmas.)
É inadmissível falta de respeito entre os pares.
Ontem inclusive a Deputada, na Presidência, tomou uma decisão contrária à posição que eu defendia, não permitiu que aqui fosse feita verificação nominal. Isso faz parte do convívio parlamentar e não é por isso que vamos agir com desrespeito, elevar a voz ou ir até a cadeira da Presidência para tentar intimidar uma Parlamentar que é exemplo de mulher nesta Casa.
Fica registrado então o nosso apoio à Deputada Geovania. S.Exa. tem o respeito da bancada do Cidadania."
2019-05-29T14:28;ENCAMINHAMENTO DE VOTAÇÃO, REQUERIMENTO DE DESTAQUE DE PREFERÊNCIA, MPV 867/2018, MEDIDA PROVISORIA, FAVORAVEL.;ENCAMINHAMENTO DE VOTAÇÃO;"O SR. DANIEL COELHO (CIDADANIA - PE. Sem revisão do orador.) - Sra. Presidente, Sras. e Srs. Deputados, esse nosso destaque visa preservar a votação do texto original da medida provisória. O Presidente da sessão acabou de ler, inclusive, o que falava a medida provisória sobre prorrogar o prazo para o Programa de Regularização Ambiental. É disso o que trata a medida. O PLV é uma coisa completamente diferente, não há como negar que não estamos entrando aí em modificações do nosso Código Florestal. Há partes desse PLV que são inaceitáveis. Há um trecho do PLV, Sras. e Srs. Parlamentares, que está dizendo o seguinte: aquele que faz a produção rural não precisará se adequar ao PRA - e quanto à prorrogação não tem problema -, até que ele seja notificado. Então, se ele não for notificado, ele não precisa se regularizar nunca.
Isso não é prorrogação de prazo. Isso na prática - e sabendo da posição que tem o Governo - é dizer que nos próximos 4 anos ninguém irá se regularizar. É isto o que está sendo colocado: uma prorrogação de forma ilimitada. Digo isso porque sabemos a posição do Governo, sabemos que o Governo não vai notificar ninguém. É inaceitável que aprovemos esse PLV dessa maneira.
Fazemos, mais uma vez, um apelo ao bom senso. A medida provisória é razoável, Srs. Parlamentares, está-se prorrogando o prazo, dando condição àqueles que até agora não conseguiram regularizar as suas propriedades de fazê-lo. Agora, dizer que não precisa fazer mais até ser notificado, qual é a sustentação para uma medida como essa? Isso é uma péssima sinalização para o Brasil, é um sinal de que o País aponta para um completo desrespeito à proteção ambiental. Uma coisa é considerarmos a importância da produção rural, do agronegócio; outra é dizer que não precisa ter equilíbrio ambiental, sustentabilidade.
É extremamente preocupante esse PLV. Repito as palavras que disse ontem: é mais do que um jabuti, é muita mudança para uma medida provisória tão simples, inclusive do ponto de vista democrático.
Eu sou um daqueles que acham que o Presidente não deveria legislar, de forma constante, por medidas provisórias. Mas esta Casa não tem moral para contestar o Presidente, quando usa das medidas provisórias para construir legislação, sem que o debate seja feito de forma democrática dentro das Comissões, no Plenário, convidando a sociedade. Não é dessa forma que nós devemos revisar o nosso Código Florestal.
Então, peço apoio ao nosso destaque, para a votação do texto original da medida provisória."
2019-05-29T14:48;ORIENTAÇÃO DE BANCADA, REQUERIMENTO DE DESTAQUE DE PREFERÊNCIA, MPV 867/2018, MEDIDA PROVISORIA, CIDADANIA (PARTIDO POLÍTICO).;PELA ORDEM;"O SR. DANIEL COELHO (CIDADANIA - PE. Pela ordem. Sem revisão do orador.) - O PLV está mexendo em questões essenciais para as futuras gerações brasileiras. Estamos falando aqui de áreas de reserva legal dos Pampas, do Cerrado, da Caatinga. Não dá para se fazer isso num PLV.
Nisso há uma questão de princípio democrático. Nós não podemos continuar insistindo em usar as medidas provisórias para legislar dessa maneira. Esta Casa - repito - está na pauta com um debate sobre a importância das medidas provisórias. Nós estamos hoje aqui perdendo a moral para fazer essa discussão com o próprio Poder Executivo e com o Presidente da República.
Esse debate vai chegar aqui nas próximas semanas. Eu já estou vendo as Lideranças que hoje apoiam essa maneira de legislar quererem limitar as medidas provisórias do Governo. Não vai haver moral para esse debate. Vamos votar o texto original. Essa é a maneira adequada.
Mandem para cá um projeto de lei, que vai para as Comissões, onde será feito esse debate e as modificações.
O Cidadania orienta...
(Desligamento automático do microfone.)"
2019-05-29T21:36;ORIENTAÇÃO DE BANCADA, REQUERIMENTO DE DESTAQUE DE VOTAÇÃO EM SEPARADO, INCISO V, INCISO (TEXTO LEGISLATIVO), ART 8º, ARTIGO (TEXTO LEGISLATIVO), PLV 11/2019, PROJETO DE LEI DE CONVERSÃO, MPV 871/2019, MEDIDA PROVISÓRIA, CIDADANIA (PARTIDO POLÍTICO), VOTO FAVORÁVEL.;PELA ORDEM;"O SR. DANIEL COELHO (CIDADANIA - PE. Pela ordem. Sem revisão do orador.) - Sr. Presidente, esse destaque mata a essência do projeto. Não é verdade quando se diz que investigar fraudes no BPC é perseguir o mais pobre. Pelo contrário, a nossa Previdência é deficitária em parte por conta das fraudes. Seja a fraude pequena, seja a fraude grande, ela é fraude, ela está lesando a população mais carente do nosso País, e cabe ao Governo, às instituições fiscalizar. Nós queremos a garantia de que o trabalhador rural e aqueles pessoas com deficiência tenham o seu benefício, mas isso não pode ser confundido com dar esse benefício a quem não merece, a quem não tem o direito. 
Então, não dá para aprovar de forma nenhuma esse destaque, porque ele mata exatamente o combate à irregularidade e às fraudes.
O Cidadania orienta ""sim""."
2019-05-29T22:00;ORIENTAÇÃO DE BANCADA, REQUERIMENTO DE DESTAQUE DE VOTAÇÃO EM SEPARADO, DISPOSITIVO LEGAL, PLV 11/2019, PROJETO DE LEI DE CONVERSÃO, MPV 871/2019, MEDIDA PROVISÓRIA, CIDADANIA (PARTIDO POLÍTICO).;PELA ORDEM;"O SR. DANIEL COELHO (CIDADANIA - PE. Pela ordem. Sem revisão do orador.) - Então, a orientação do Cidadania... Achamos que o texto está confuso, e não está nítido, não está claro, se se está tratando do bem adquirido de forma irregular, não está claro se se está tratando só de família, do advogado, do vizinho. O texto é muito confuso. Então, o PDT está correto, a orientação é ""sim""."
2019-05-29T22:36;ORIENTAÇÃO DE BANCADA, EMC 92/2019, EMENDA DE COMISSÃO, MPV 871/2019, MEDIDA PROVISORIA, CIDADANIA (PARTIDO POLÍTICO), VOTO CONTRARIO.;PELA ORDEM;"O SR. DANIEL COELHO (CIDADANIA - PE. Pela ordem. Sem revisão do orador.) - Sr. Presidente, esta emenda é extremamente complexa. Nós até concordaríamos com a primeira parte dela, mas, no final, ela fala da revogação do art. 59. Eu vou ler aqui no plenário o que diz o art. 59. Eu estou até achando que há um erro na redação e na intenção do PSB, porque o que eles estão falando aqui é da revogação:
 Art. 59...................................................................................................................................................................
Parágrafo único. Não será devido o auxílio-doença ao segurado que se filiar ao Regime Geral de Previdência Social já portador da doença ou da lesão invocada como causa do benefício (...). 
Trata-se aqui da impossibilidade de beneficiar alguém que tenha o auxílio-doença.
Não estão entendendo aqui a lógica desse processo. Está revogando diversos artigos, quando, na primeira parte, fala em algumas questões relacionadas aos sindicados. Então, é de uma confusão imensa, parecida inclusive com uma anterior que nós tivemos. Está muito mal redigido o texto.
O Cidadania orienta o voto ""não""."
2019-05-29T23:20;PLV 11/2019, PROJETO DE LEI DE CONVERSÃO, MPV 871/2019, MEDIDA PROVISÓRIA, DISPOSTIVO LEGAL, EXPRESSÃO TEXTUAL, GÊNERO, IDEOLOGIA.;PELA ORDEM;"O SR. DANIEL COELHO (CIDADANIA - PE. Pela ordem. Sem revisão do orador.) - Esse não é um debate ideológico, Srs. Deputados. Pelo amor de Deus! Nós estamos falando aqui de uma informação. Esse não é um debate ideológico. Vamos escutar o que o Presidente está falando. Não é um debate sobre ideologia de gênero ou não. É uma informação importante que precisa constar. Vamos resolver. Não vamos entrar nesse debate. Isso não vai tirar dos conservadores desta Casa a sua posição sobre esse assunto. Queria fazer um apelo aqui para que se chegue ao bom senso.
O SR. LAFAYETTE DE ANDRADA (PRB - MG) - O apelo é trocar a palavra ""gênero"" pela palavra ""sexo"". Isso resolve o problema.
O SR. DANIEL COELHO (CIDADANIA - PE) - Se nós tivermos o apoio dos maiores partidos, podemos vencer no simbólico e tirar esse debate. Não está fazendo sentido isso."
2019-06-04T18:20;"IBANEIS ROCHA, GOVERNADOR, DISTRITO FEDERAL (BRASIL), OFENSA, PAULA BELMONTE, DEPUTADO.
PEC 6/2019, PROPOSTA DE EMENDA À CONSTITUIÇÃO, REFORMA PREVIDENCIÁRIA (2019), SAIDA, ESTADO (ENTE FEDERADO), MUNICIPIO.";COMO LÍDER;"O SR. DANIEL COELHO (CIDADANIA - PE. Como Líder. Sem revisão do orador.) - Sra. Presidente, Deputada Geovania de Sá, antes de falar um pouco de Previdência, quero fazer uma defesa e um desagravo à Deputada Paula Belmonte, da nossa bancada do Distrito Federal, que recentemente, de forma lamentável, foi destratada verbalmente pelo Governador do Distrito Federal, Ibaneis Rocha.
É inaceitável, no momento em que o Brasil vive tantas dificuldades e em que recebemos, com muita alegria, a boa renovação da política, como é o caso da Deputada Paula Belmonte, que o Governador, que não resolve os problemas do Distrito Federal, destrate, agrida, eleve a voz com a Parlamentar em um evento direcionado à primeira infância, tema central da atuação da Deputada.
Esperamos que o Governador tenha um pouco mais de equilíbrio. Vimos que hoje, inclusive, ele também destratou o Governador do Estado de Goiás, Ronaldo Caiado, mostrando um completo despreparo emocional para o desafio que é governar o Distrito Federal.
Fica aqui o nosso registro à defesa da Deputada Paula Belmonte e até um apelo para que o Governador consiga botar a cabeça no lugar e vá enfrentar os problemas do Distrito Federal e de Brasília.
Quero também falar um pouco da questão da Previdência.
Estamos com um debate, Deputado Domingos Sávio, extremamente importante sobre a questão dos Estados e Municípios.
Esse é um debate que precisa ser travado com seriedade, principalmente entre aqueles partidos e Parlamentares que reconhecem, Deputado Kim, a necessidade de fazermos a reforma. Reconhecemos e apoiamos. O Brasil precisa fazer a reforma da Previdência. O que não podemos é entrar no jogo daqueles partidos que querem derrotar a reforma. Os Governadores do PT, do PSB, do PCdoB fazem jogo duplo, suas bancadas são evidentemente contra a reforma. Não quero mudar a opinião de ninguém, eles têm direito legítimo de ser contra a reforma, mas os Governadores fazem trabalho de bastidores para que a reforma inclua os servidores dos seus Estados.
Nós precisamos fazer esse debate com seriedade. Quem apoia a reforma apoia através de votos no Parlamento, com os seus Deputados. Não existe apoio de Governador, quando o seu próprio partido e os Parlamentares eleitos nos seus Estados contam mentiras o tempo todo sobre a reforma da Previdência. Há problema na reforma? Vamos consertar. Há uma Comissão Especial montada, mais de 200 emendas propostas para que o projeto seja justo, combata privilégios e recupere a nossa economia. O que não dá é para fazer choro de jacaré. O que não dá é para fazer jogo duplo, como estão fazendo os nove Governadores da Região Nordeste - populismo, demagogia -, os Estados quebrados jogando os Parlamentares aqui contra a reforma, mas nos bastidores querendo manter os servidores estaduais.
Espero que o Relator e a Comissão Especial tratem esse tema com o carinho necessário. Se formos enfrentar uma discussão...
Sra. Presidente, peço 1 minuto para concluir o meu pronunciamento.
A SRA. PRESIDENTE (Geovania de Sá. PSDB - SC) - Deputado Daniel Coelho, peço a V.Exa. que conclua, porque quero passar à votação.
O SR. DANIEL COELHO (CIDADANIA - PE) - Muito obrigado, Sra. Presidente.
Para podermos fazer essa discussão, precisamos perceber, de fato, que a aprovação da reforma estará concreta e será possível se separarmos as realidades municipais, federais e estaduais.
A quantidade de emendas que são colocadas para a Guarda Municipal... Eu vi um Deputado agora aqui do PDT do Ceará que falava dos professores, tema extremamente importante. Tudo isso estará eliminado se deixarmos e respeitarmos o pacto federativo, que os Estados façam suas reformas, que os Municípios façam suas reformas. Nós simplificamos o debate, deixamos que as Assembleias façam o seu papel. Essa é a maneira correta para aprovarmos a reforma da Previdência, sem que nos matemos num ambiente de conflito sem fim.
Vamos garantir a autonomia federativa de Estados e Municípios. Apenas assim conseguiremos formar maioria e não ficaremos brigando por questões laterais, porque é evidente que nove Governadores estão trabalhando contra a reforma da Previdência."
2019-06-05T11:44;PEC 6/2019, PROPOSTA DE EMENDA À CONSTITUIÇÃO, REFORMA PREVIDENCIÁRIA (2019), BENEFÍCIO DE PRESTAÇÃO CONTINUADA (BPC), APOSENTADORIA RURAL.;BREVES COMUNICAÇÕES;"O SR. DANIEL COELHO (CIDADANIA - PE. Sem revisão do orador.) - Sr. Presidente, complementando o debate iniciado pelos Deputados Paulo Azi e Afonso Florence, é importante o aprofundarmos. Algumas críticas que faz o Deputado do PT são críticas que hoje são daqueles que apoiam a reforma.
A questão do trabalhador rural vai sair da reforma da Previdência, todos sabem disso. A demagogia em relação a este assunto reside no seguinte: quando estes tópicos forem retirados, o Governador da Bahia e a bancada do PT vão apoiar a reforma da Previdência? Não vão! Eles não vão apoiar porque são contra o Brasil, são contra tudo. Quando estes temas forem retirados e o bode sair da sala...
Ontem eu disse ao Relator Samuel Moreira que não entendo por que ele ainda não declarou que já estão fora o BPC e o trabalhador rural, por que ainda não declarou que está fora o regime de capitalização. Isso não passa no plenário. Ele tem que declarar logo, para irmos para o debate sério. Assim, nós vamos separar quem está fazendo crítica porque é contra o Brasil de quem, de verdade, quer aperfeiçoar o projeto e quer a aprovação de uma reforma da Previdência justa, que salve a economia brasileira.
Muito obrigado."
2019-06-11T18:56;"ENCAMINHAMENTO DE VOTAÇÃO, SUBSTITUTIVO, PLN 4/2019, PROJETO DE LEI DO CONGRESSO NACIONAL, CIDADANIA (PARTIDO POLÍTICO), FAVORÁVEL.
CIDADANIA (PARTIDO POLÍTICO), DEFESA, APROVAÇÃO, PEC 6/2019, PROPOSTA DE EMENDA À CONSTITUIÇÃO, REFORMA PREVIDENCIÁRIA (2019), RESPONSABILIDADE FISCAL.";ENCAMINHAMENTO DE VOTAÇÃO;"O SR. DANIEL COELHO (CIDADANIA - PE. Para encaminhar. Sem revisão do orador.) - Sr. Presidente, o Cidadania orienta ""sim"", para que o Governo tenha recursos para pagar o Bolsa Família e os seus programas, mas também com responsabilidade desde o início do ano. 
O Cidadania defende a necessidade de uma reforma da Previdência equilibrada, um texto justo que combata privilégios, mas que cuide da responsabilidade fiscal, para que o Brasil volte a investir. Não dá para defendermos educação pública de qualidade enquanto há um déficit, um rombo imenso na Previdência.
O Cidadania tem responsabilidade com o Brasil, vota ""sim"" a essa matéria e irá ajudar na construção de um texto consensual, para que aprovemos em breve, ainda no primeiro semestre, na Câmara dos Deputados, a reforma da Previdência."
2019-06-12T20:00;PEC 6/2019, PROPOSTA DE EMENDA À CONSTITUIÇÃO, REFORMA PREVIDENCIÁRIA (2019), DEFESA.;COMO LÍDER;"O SR. DANIEL COELHO (CIDADANIA - PE. Como Líder. Sem revisão do orador.) - Sra. Presidente Deputada Geovania, Sra. e Srs. Deputados, conforme já anunciado, muito tempo atrás, há algumas semanas, partidos, Líderes e Deputados hoje confirmaram uma posição de entendimento nesta Casa para a aprovação da reforma da Previdência.
Nós sabíamos, Deputado Arnaldo - V.Exa. tem sido extremamente importante na bancada do Cidadania para que aprovemos essa reforma -, que o BPC e o trabalhador rural estariam fora do texto. A Oposição insistiu, ao longo do tempo, em fazer esse debate. Não tem problema, realmente a estava no texto. Hoje, na coletiva feita com os partidos que apoiam a reforma, ficou claro que esses assuntos não tinham consenso na Casa, não tinham votos para ser aprovados, por isso foram retirados, assim como o regime de capitalização, que eu até acho que é um debate válido a se fazer no Brasil. Mas também não havia consenso, não havia votos necessários para aprovarmos a matéria toda de uma vez.
Calcula-se hoje, após a coletiva, que nós estamos atingindo a meta de uma economia que chega perto, se não chegar de fato, a 1 trilhão de reais para os cofres públicos, uma grande economia para o País. Alguns debates precisarão continuar a ser feitos por esta Casa, sim, mas nós não podemos deixar de reconhecer que estamos fazendo nesta Legislatura, em 1 semestre, mais do que foi feito talvez em décadas neste Parlamento. 
Não há motivo para olhar eu não diria nem que a metade vazia do copo, mas aquele golinho que está sendo dado, 5%, 10%, num processo normal de ajuste de texto para a aprovação da reforma. Nós estamos conquistando 95% daquilo que era pleiteado pelo Ministro Paulo Guedes, e sem nenhum tipo de barganha não republicana, apenas com o debate com a sociedade sobre qual é o texto adequado, qual é o texto justo, de que maneira a reforma pode quebrar privilégios e fazer com que o Brasil volte a ter capacidade de investimento.
Nós do Cidadania, desde o primeiro momento, apoiamos a reforma porque entendemos que, para o Estado ter capacidade de investir, para o Estado poder dar educação pública de qualidade, é necessário que ele tenha recursos, e nós não teremos recursos com uma Previdência deficitária, com um buraco sem fim que nos obriga a joga dinheiro que deveria ser investido na educação, na saúde, na segurança em um sistema deficitário de previdência.
Vamos agora ao debate na Comissão e vamos aprovar neste Plenário, queiram ou não queiram aqueles que jogam contra o Brasil, a reforma da Previdência na Câmara dos Deputados ainda no primeiro semestre."
2019-06-17T19:12;"ORIENTAÇÃO DE BANCADA,  REQUERIMENTO DE RETIRADA DE PROPOSIÇÃO DA ORDEM DO DIA, PL 1292/1995, PROJETO DE LEI ORDINÁRIA, CIDADANIA (PARTIDO POLÍTICO),  VOTO CONTRÁRIO.
PAULO GUEDES, MINISTRO DE ESTADO DA ECONOMIA, CRÍTICA, ATUAÇÃO, CÂMARA DOS DEPUTADOS, CONTESTAÇÃO.";PELA ORDEM;"O SR. DANIEL COELHO (CIDADANIA - PE. Pela ordem. Sem revisão do orador.) - Sra. Presidente, o Cidadania orienta não à retirada de pauta e parabeniza o Relator, Deputado Augusto Coutinho, por ter ouvido os diversos segmentos deste Parlamento para a construção de um texto.
No entanto, não posso deixar de criticar a infeliz entrevista, no fim da semana passada, do Ministro Paulo Guedes. Ele deveria reconhecer o esforço dos partidos e dos Parlamentares desta Casa em aprovar uma reforma da Previdência que é de extrema dificuldade de convencimento, tanto aqui quanto lá fora.
Na entrevista, o Ministro Paulo Guedes foi mentiroso ao dizer que esta Casa está cedendo a corporativismos. Se alguém cedeu a corporativismos, foi o Ministro Paulo Guedes, quando enviou para cá uma reforma dando 17% de transição para os militares e zero para o restante da sociedade. Ali, sim, houve corporativismo.
Esta Casa está tratando o tema com seriedade. Fica difícil aprovar a matéria com o principal Ministro jogando contra. Esperamos uma retratação e um tratamento educado com aqueles que estão tentando aprovar a reforma."
2019-07-09T14:04;ORIENTAÇÃO DE BANCADA, REQUERIMENTO DE URGÊNCIA, PL 8240/2017, PROJETO DE LEI ORDINÁRIA, CIDADANIA (PARTIDO POLÍTICO), LIBERAÇÃO.;PELA ORDEM;"O SR. DANIEL COELHO (CIDADANIA - PE. Pela ordem. Sem revisão do orador.) - Sra. Presidente, primeiro, como orientação, vamos liberar a bancada, já que há divergência interna. Contudo, eu queria registrar a minha posição pessoal, como Parlamentar.
Já votei contra a inclusão da vaquejada na Constituição. É um exagero sem tamanho dizer que a vaquejada faz parte, culturalmente, da Constituição Federal, enquanto o futebol, a feijoada ou o samba não. Não há nenhum tipo de justificativa para isso. É uma forçada de barra imensa!
Em nome de todos aqueles que defendem a proteção animal e de forma alguma querem estimular um esporte que só gera maus-tratos aos animais em um evento público, eu registro aqui a minha posição contrária. 
A bancada fica liberada, como eu disse, por haver divergência."
2019-07-09T17:36;"ORIENTAÇÃO DE BANCADA, REQUERIMENTO DE RETIRADA DE PROPOSIÇÃO DA ORDEM DO DIA, PL 8240/2017, PROJETO DE LEI ORDINÁRIA, CIDADANIA (PARTIDO POLÍTICO), LIBERAÇÃO.
PEC 6/2019, PROPOSTA DE EMENDA À CONSTITUIÇÃO, REFORMA PREVIDENCIÁRIA (2019), VOTAÇÃO, FAVORÁVEL.";PELA ORDEM;"O SR. DANIEL COELHO (CIDADANIA - PE. Pela ordem. Sem revisão do orador.) - Sr. Presidente, temos divergências na bancada. Eu pediria que fosse marcado que nós a liberamos. 
Mas reitero minha posição contrária a esse projeto. Não podemos estimular uma atividade como essa, que causa maus-tratos nos animais. Isso não é esporte, e não podemos de forma alguma estimular isso.
Reitero também, Presidente Rodrigo Maia, que o Cidadania está no plenário pronto para votar a reforma da Previdência. Essa é a prioridade do Brasil e tem que ser a prioridade da Câmara dos Deputados. Esta matéria que estamos apreciando, sem nenhuma dúvida, não é a matéria de maior relevância neste momento para o País. Espero que esta etapa seja concluída em breve e que possamos hoje nos debruçar sobre aquilo que é importante para o Brasil: a votação da reforma da Previdência."
