dataHoraInicio;keywords;tipoDiscurso;transcricao
2020-06-23T18:52;PL 3267/2019, PROJETO DE LEI ORDINÁRIA, ALTERAÇÃO, CÓDIGO DE TRÂNSITO BRASILEIRO, COMPETÊNCIA, DEPARTAMENTO NACIONAL DE TRÂNSITO (DENATRAN), ANÁLISE, COMISSÃO ESPECIAL, LUIZ CARLOS MOTTA, DEPUTADO FEDERAL, ORADOR, ATUAÇÃO PARLAMENTAR.;COMO LÍDER;"O SR. LUIZ CARLOS MOTTA (Bloco/PL - SP. Como Líder. Sem revisão do orador.) - Obrigado, Sr. Presidente.
Sras. e Srs. Parlamentares, fui designado Presidente desta Comissão Especial que analisou essa proposta do Executivo para modificar o Código de Trânsito Brasileiro. Quero fazer um agradecimento especial ao Presidente Rodrigo Maia. Quero fazer também um agradecimento muito especial ao nosso partido PL, por intermédio do Líder Wellington Roberto, que me indicou para fazer parte desta Comissão tão especial, neste momento que estamos vivendo em nosso País.
Nessa Comissão, nós estivemos com o Relator, o Deputado Juscelino Filho. Gostaria de saudá-lo e cumprimentá-lo pelo excelente trabalho, pela paciência e também pela competência que desenvolveu durante os trabalhos da Comissão. Foram 11 reuniões ao todo. Debatemos a proposta apresentada pelo Governo Federal, que buscava afrouxar as regras para o trânsito brasileiro.
O PL 3.267, de 2019, entregue à Câmara dos Deputados pelo Presidente Jair Bolsonaro, fez diversas alterações na Lei nº 9.503, de 1997, do Código de Trânsito Brasileiro. A proposta atacou itens polêmicos, como o aumento do número de pontos para a suspensão da Carteira Nacional de Habilitação, elevando o limite de 20 para 40 pontos, propôs o fim das multas para quem transporta crianças de até 7 anos, sem cadeirinha, além da exclusão da exigência de exame toxicológico para motoristas profissionais.
Além das emendas que foram analisadas pelo Relator do texto, ouvimos muitas contribuições importantes dos Parlamentares. Após seis audiências públicas temáticas com a participação de especialistas de trânsito dos setores público e privado e de representantes da sociedade civil e intensos e acalorados debates na Comissão, foram oferecidos subsídios, informações e dados importantes sobre a matéria.
A primeira audiência pública teve como tema O Trânsito Brasileiro, Desafios da Redução de Acidentes, com representantes do DENATRAN, da Polícia Rodoviária Federal, do Ministério da Saúde e entidades ligadas ao trânsito.
Debatemos também as penalidades e infrações de trânsito, quando especialistas convidados apresentaram dados, estatísticas e sugestões para promover a cultura de paz no trânsito. 
Outro tema discutido na Comissão foi a habilitação e o exame de aptidão física e mental, sobre a importância da exigência de aptidão física e mental para a obtenção da carteira de motorista. O exame psicológico para motorista de veículos pesados foi outro assunto que teve muita repercussão e movimentou a Comissão. Pela proposta original, o teste deixa de ser exigido sob o argumento de alto custo dos exames. Para debater o assunto, convidamos diversas autoridades do trânsito e da sociedade civil. 
A Comissão promoveu ainda audiência pública para discutir registro, licenciamento e identificação de veículo. 
Por fim, a Comissão aportou o tema relacionado às atribuições e competência do Sistema Nacional de Trânsito.
Com o apoio dos nobres Parlamentares que integraram o colegiado, busquei sempre conduzir os trabalhos com responsabilidade, visando o aperfeiçoamento do Código de Trânsito Brasileiro, que já tem mais de 20 anos de existência. 
No entanto, Sr. Presidente, Sras. e Srs. Deputados, modernizar o Código de Trânsito Brasileiro deve perseguir a redução de acidentes e a proteção da vida. A defesa da vida deve sempre estar e prevalecer.
Neste sentido, quero registrar aqui os meus agradecimentos aos Deputados que integraram a Comissão Especial e enriqueceram o debate trazendo valiosas contribuições. 
Agradeço e parabenizo as autoridades, especialistas e palestrantes convidados pelo tempo disponibilizado e elevado empenho na preparação das temáticas apresentadas.
O meu agradecimento pelo esforço e trabalho de todos os funcionários que apoiaram a Comissão. Em especial, destaco a parceria cordial, exitosa do Relator e amigo Deputado Juscelino Filho, que envidou todos os esforços para a elaboração e apresentação do relatório submetido ao Plenário desta Casa.
Parabéns, Deputado Juscelino!
O nosso voto é ""sim"".
Sr. Presidente, gostaria que a Deputada Christiane de Souza Yared utilizasse o restante deste tempo de Liderança."
2021-04-07T16:24;ENCAMINHAMENTO DE VOTAÇÃO, REQUERIMENTO DE DESTAQUE DE VOTAÇÃO EM SEPARADO, EMENDA DE PLENÁRIO, PL 948/2021, PROJETO DE LEI ORDINÁRIA, FAVORÁVEL.;ENCAMINHAMENTO DE VOTAÇÃO;"O SR. LUIZ CARLOS MOTTA (Bloco/PL - SP. Sem revisão do orador.) - Sr. Presidente, agradeço a V.Exa. e cumprimento os demais colegas.
É justamente sabendo que o Congresso Nacional possui integral compromisso com tais pautas, ainda mais no cenário em que nos encontramos de uma retração econômica agravada pela pandemia, e certos de que o caminho a ser trilhado é a imunização célere e universal que apresentamos o presente projeto, que preverá, sem custos adicionais, alternativa de designação de recursos do Sistema S para a ampliação da vacinação em massa em nosso País.
O Sistema S é formado por organizações e instituições, todas referentes ao setor produtivo, tais como as indústrias, comércio, agricultura, transportes e cooperativas, que têm como objetivo melhorar e promover o bem estar de seus funcionários na saúde e no lazer, como por exemplo disponibilizar uma boa educação profissional.
Atualmente, fazem parte do Sistema S o Serviço Nacional de Aprendizagem em Indústria, o SENAI, o Serviço Social do Comércio, o SESC, o Serviço Social da Indústria, o SESI, o Serviço Nacional de Aprendizagem Comercial, o SENAC, enfim, outros serviços S que estão em atividade e que estão sendo contemplados.
Pois bem, as atividades econômicas definidas são do CNAE 2.0. Desde o início da pandemia da COVID-19, as autoridades públicas têm buscado alternativas viáveis para minimizar os efeitos nefastos dessa doença. A alternativa apontada pelas autoridades internacionais e pela comunidade científica é a conjugação de medidas preventivas, como o uso de máscaras, a higienização com álcool, o distanciamento e o isolamento social e a imunização coletiva.
Ocorre, no entanto, que o isolamento social, além de não se caracterizar como uma medida resolutiva e definitiva para o problema, acarreta em impactos vultosos na economia, impedindo o desenvolvimento do setor produtivo e o pleno desempenho das atividades laborais, o que, por sua vez, fomenta crises de relações de trabalho, aumentando os índices de desemprego, e, portanto, implicando em intensificação de quadros de miséria e vulnerabilidade.
Em consideração às problemáticas expostas, a vacinação se constitui, por enquanto, a principal ferramenta para debelar a crise econômica e sanitária ocasionada pela COVID-19. Nesse sentido, é imprescindível e urgente a viabilização de medidas que permitam a imunização do maior número de pessoas no menor espaço de tempo, a fim de evitar o aumento no contágio, o colapso no sistema de saúde e o agravamento da crise econômica e trabalhista decorrente da pandemia.
Nesse sentido, com vistas a possibilitar de maneira tempestiva a vacinação das categorias do setor produtivo e retomar o crescimento econômico sem impactar o orçamento do Estado, objetiva-se, através...
(Desligamento automático do microfone.)"
2021-04-07T16:28;ORIENTAÇÃO DE BANCADA, REQUERIMENTO DE DESTAQUE DE VOTAÇÃO EM SEPARADO, EMENDA DE PLENÁRIO, PL 948/2021, PROJETO DE LEI ORDINÁRIA, PARTIDO LIBERAL (PL), VOTO FAVORÁVEL.;PELA ORDEM;"O SR. LUIZ CARLOS MOTTA (Bloco/PL - SP. Pela ordem. Sem revisão do orador.) - Sr. Presidente, o PL orienta ""sim"". 
Ao contrário do que disse o colega que usou a palavra anteriormente, o Sistema S é do setor do comércio e serviços. Nossa proposta é que se use o dinheiro da contribuição social dos empresários para vacinar os seus próprios empregados. Logicamente, 50% a mais, como nós aprovamos ontem no PL 948. Sim, vacinar os empregados que estão na linha de frente, os funcionários de supermercados, de açougues, os frentistas, sem custo nenhum para o Estado e sem custo nenhum para os empresários que fazem parte do Sistema S. 
Não se trata de fura-fila, simplesmente de vacinar os funcionários que estão na linha de frente, neste momento da pandemia.
O PL orienta ""sim"", Sr. Presidente."
2021-10-27T20:24;ORIENTAÇÃO DE BANCADA, REQUERIMENTO DE DESTAQUE DE VOTAÇÃO EM SEPARADO, DISPOSITIVO LEGAL, EMENDA, SENADO FEDERAL, PL 1605/2019, PROJETO DE LEI ORDINARIA, PARTIDO LIBERAL (PL).;PELA ORDEM;"O SR. LUIZ CARLOS MOTTA (PL - SP. Pela ordem. Sem revisão do orador.) - Sr. Presidente, o PL orienta ""não"".
Aproveito a oportunidade, com muito orgulho de ser comerciário, para ocupar este espaço e parabenizar todos os comerciários e comerciárias em função da celebração do dia 30 de outubro, quando se comemora o Dia do Comerciário.
Em nome de todas as lideranças sindicais comerciárias de todo o Brasil, rendo minhas homenagens a essa aguerrida categoria, que, mesmo nos períodos mais críticos da pandemia, seguiu trabalhando e, assim, atendeu as necessidades de consumo da população, fazendo girar a nossa economia.
Então, nesta data presto a minha homenagem a todos os comerciários do Brasil, dando os cumprimentos a essa maior categoria de trabalhadores.
Parabéns aos comerciários pelo Dia do Comerciário, no dia 30 de outubro!"
2021-11-09T21:04;"ORIENTAÇÃO DE BANCADA, REQUERIMENTO DE ENCERRAMENTO DE DISCUSSÃO, SEGUNDO TURNO, PEC 23/2021, PROPOSTA DE EMENDA À CONSTITUIÇÃO, PARTIDO LIBERAL (PL), VOTO FAVORÁVEL.
HOMENAGEM PÓSTUMA, GUMERCINDO DE SETA, OFICIAL DE REGISTRO DE IMÓVEIS, SÃO JOSÉ DO RIO PRETO (SP).";PELA ORDEM;"O SR. LUIZ CARLOS MOTTA (PL - SP. Pela ordem. Sem revisão do orador.) - O PL orienta o voto ""sim"".
Sr. Presidente, aproveito para comunicar, com muita tristeza, que hoje, na cidade de São José do Rio Preto, perdemos uma grande pessoa. Refiro-me ao Sr. Gumercindo de Seta, Oficial do Cartório de 1º Ofício de Registro de Imóveis de São José do Rio Preto, uma pessoa histórica e respeitada na cidade.
Deixo as nossas condolências à família.
Muito obrigado, Sr. Presidente."
2022-03-08T17:52;"DIA INTERNACIONAL DA MULHER, HOMENAGEM.
MULHER, DIREITOS, DEFESA, 
DISCRIMINAÇÃO DE GÊNERO, COMBATE.";PELA ORDEM;"O SR. LUIZ CARLOS MOTTA (PL - SP. Pela ordem. Sem revisão do orador.) - Sra. Presidente, Sras. e Srs. Deputados, é com muito orgulho que ocupo este honroso espaço da Câmara dos Deputados para render minhas homenagens a todas as brasileiras neste dia 8 de março, Dia Internacional da Mulher. 
Ao me dirigir às Parlamentares presentes neste plenário, abraço todas as trabalhadoras do Brasil, as comerciárias, as profissionais da saúde, as mulheres que trabalham na área de bens e serviços, as policiais e as professoras, entre outras categorias igualmente importantes para o desenvolvimento do nosso Brasil. 
Sigamos trabalhando juntos, para que as mulheres deixem de ser vítimas de toda e qualquer forma de preconceito e discriminação! Lutemos por respeito e dignidade para todas as mulheres brasileiras!
A todas, meu honroso abraço."
2022-04-06T14:12;ANIVERSÁRIO DE FUNDAÇÃO, FEDERAÇÃO, COMERCIÁRIO, SÃO PAULO (ESTADO), HOMENAGEM.;BREVES COMUNICAÇÕES;"O SR. LUIZ CARLOS MOTTA (PL - SP. Sem revisão do orador.) - Sr. Presidente, Sras. e Srs. Deputados, é um orgulho ser o primeiro comerciário eleito Deputado Federal pelo Estado de São Paulo. Registro os 83 anos de fundação da Federação dos Comerciários do Estado de São Paulo, entidade por mim presidida, que serão celebrados agora no dia 9 de abril.
A história da federação traz lutas e vitórias conquistadas para os comerciários paulistas ao lado dos seus 71 sindicatos filiados, que representam mais de 2,5 milhões de trabalhadores. A maior federação de trabalhadores da América Latina pratica o chamado sindicalismo cidadão, que atende comerciários com ações que melhoram as condições de vida e de trabalho da maior categoria de trabalhadores urbanos do Brasil, os comerciários.
Parabéns à Federação dos Comerciários do Estado de São Paulo!
Muito obrigado, Sr. Presidente."
2022-04-27T19:44;ORIENTAÇÃO DE BANCADA, PL 4576/2021, PROJETO DE LEI ORDINÁRIA, PARTIDO LIBERAL (PL), VOTO FAVORÁVEL.;PELA ORDEM;"O SR. LUIZ CARLOS MOTTA (PL - SP. Pela ordem. Sem revisão do orador.) - O PL orienta ""sim"", Sr. Presidente, pela importância desse projeto. Eu acho que a transformação, a representação dos Municípios em forma de associação deixa mais forte a representação aqui dentro do Congresso Nacional.
Então, o PL orienta ""sim""."
