dataHoraInicio;keywords;tipoDiscurso;transcricao
2019-03-27T14:00;LUIZ CARLOS MOTTA, DEPUTADO FEDERAL, ATUAÇÃO PARLAMENTAR.;PEQUENO EXPEDIENTE;"O SR. LUIZ CARLOS MOTTA (Bloco/PR - SP. Sem revisão do orador.) - Sra. Presidente, Sras. e Srs. Deputados, pela primeira vez ocupo esta histórica tribuna. Aqui chego respaldado por mais de 75 mil votos, a mim confiados pelo povo paulista.
A melhor forma de agradecer esta confiança é transformar cada um desses votos em realizações que contribuam para melhorar a qualidade de vida das pessoas.
Atuarei nesta Casa de Leis para ver meus 4 anos de mandato serem lembrados como o mandato da geração de empregos, da defesa dos direitos trabalhistas e previdenciários.
Conheço bem o interior paulista. Por isso acredito na retomada do crescimento econômico brasileiro através do incentivo e do apoio aos Municípios.
Como este meu primeiro pronunciamento nesta Casa de Leis ocorre em março, mês das mulheres, sublinho a minha disposição para lutar com elas pelo fim de toda e qualquer forma de desigualdade, discriminação e violência.
Sou comerciário e presido a Federação dos Comerciários do Estado de São Paulo, entidade que representa mais de 2 milhões de trabalhadores por meio de 71 sindicatos filiados, entre eles o Sindicato dos Comerciários de São Paulo, que acaba de promover uma ação acima de tudo humanitária. Refiro-me ao terceiro mutirão do emprego, que levou mais de 15 mil pessoas à sede do sindicato na Capital paulista, no dia de ontem. O mutirão do emprego promovido pelo Sindicato dos Comerciários também ofereceu cursos de capacitação profissional, a fim de aumentar a empregabilidade. 
Esse sindicato, assim como todo o sindicalismo brasileiro, está sofrendo as maiores ofensivas, mas, mesmo assim, desenvolve um papel que deveria ser do Estado, ou seja, viabiliza empregos e resgata a dignidade humana. É o sindicato presente onde o Estado deveria estar.  
Os sindicatos também preenchem lacunas deixadas abertas pelo Estado com as melhores assistências nas áreas de saúde, educação, lazer e qualificação profissional.
Maus exemplos existem em todos os campos da sociedade e devem ser punidos, mas não se pode generalizar. O sindicato é uma das poucas instituições próximas... 
(Desligamento automático do microfone.)

DISCURSO NA ÍNTEGRA ENCAMINHADO PELO SR. DEPUTADO LUIZ CARLOS MOTTA.

Sra. Presidente, Sras. e Srs. Deputados, pela primeira vez ocupo esta histórica tribuna. Aqui chego respaldado por mais de 75 mil votos, a mim confiados pelo povo paulista.
A melhor forma de agradecer esta confiança é transformar cada um destes votos em realizações que contribuam para melhorar a vida das pessoas.
É meu objetivo exercer um mandato marcado pelo diálogo e coerente com as orientações do meu partido, o PR.
Atuarei nesta Casa de Leis para ver meus 4 anos de mandato serem lembrados como o mandato da geração de empregos, principalmente o primeiro emprego, da defesa dos direitos trabalhistas e previdenciários e da valorização dos Municípios.
Conheço bem o interior paulista. Por isso, acredito que a retomada do crescimento econômico brasileiro virá do incentivo e do apoio que dermos aos Municípios.
Como este meu primeiro pronunciamento nesta Casa de Leis ocorre em março, mês das mulheres, sublinho a minha disposição para lutar com elas pelo fim de toda e qualquer forma de desigualdade, discriminação e violência.
Sou comerciário e presido a Federação dos Comerciários do Estado de São Paulo, entidade que representa 2,7 milhões trabalhadores por meio de 71 sindicatos filiados. Entre eles está o Sindicato dos Comerciários de São Paulo, presidido por Ricardo Patah, que acaba de promover uma ação acima de tudo humanitária. Refiro-me ao terceiro mutirão do emprego, que levou mais de 15 mil pessoas à sede do sindicato na Capital paulista, dia 26 de março. 
O mutirão do emprego promovido pelo Sindicato dos Comerciários também ofereceu cursos de capacitação profissional, a fim de aumentar a empregabilidade.
Sim, este sindicato, filiado à União Geral dos Trabalhadores, a UGT, assim como todo o sindicalismo brasileiro, está sofrendo as piores ofensivas, mas, mesmo assim, está desenvolvendo um papel que deveria ser do Estado, ou seja, está viabilizando empregos e resgatando a dignidade humana. É o sindicato presente onde o Estado deveria estar.
Os sindicatos também preenchem lacunas deixadas abertas pelo Estado com as melhores assistências nas áreas de saúde, educação, lazer e qualificação profissional, entre outras.
Maus exemplos existem em todos os campos da nossa sociedade e devem ser punidos, mas não se pode generalizar.
O sindicato é uma das poucas instituições próximas à população. Ao agir assim, também traz o trabalhador para dentro das suas entidades representativas, atende as suas demandas e pratica o legítimo sindicalismo social, quando faz a intermediação de empregos num país com 12 milhões de desempregados.
Nós estamos dando um exemplo de sindicalismo.
Muito obrigado pela atenção e que Deus abençoe esta legislatura."
2019-04-24T14:16;DIA DO TRABALHO, CONSCIENTIZAÇÃO, ATUAÇÃO, TRABALHADOR, DEFESA, DIREITOS DO TRABALHADOR.;PEQUENO EXPEDIENTE;"O SR. LUIZ CARLOS MOTTA (PR - SP. Sem revisão do orador.) - Sra. Presidente, Sras. e Srs. Deputados, volto a esta tribuna para registrar com muita honra que celebraremos no dia 1º maio, próxima quarta-feira, o Dia do Trabalhador. Trata-se de um momento de reafirmação das nossas lutas por emprego, pela manutenção dos direitos trabalhistas e previdenciários, com a preservação da dignidade dos trabalhadores da ativa e dos aposentados do nosso País.
O caminho certo para atingirmos este objetivo é resistir aos retrocessos na relação capital e trabalho, inclusive nesta Casa. 
Que este 1º de Maio sirva de reflexão sobre o papel das entidades representativas e da consciência política e participativa do trabalhador.
Sras. e Srs. Parlamentares, façamos deste 1º de Maio uma data de conscientização sobre as lutas históricas da classe trabalhadora que garantiram avanços significativos e continuemos na trajetória de luta e resistência para reivindicar e conquistar novos direitos.
Feliz 1º de Maio para todos os trabalhadores do Brasil!
Sra. Presidente, solicito que este pronunciamento seja veiculado pelos meios de comunicação desta Casa.
Muito obrigado."
2019-10-30T13:40;"CONGRESSO SINDICAL COMERCIÁRIO (27; 2019, AVARE (SP)).";BREVES COMUNICAÇÕES;"O SR. LUIZ CARLOS MOTTA (PL - SP. Sem revisão do orador.) - Sr. Presidente, Sras. e Srs. Deputados, brasileiros e brasileiras que nos acompanham pelas redes de comunicação desta Casa, ocupo esta honrosa tribuna para transmitir uma mensagem de respeito e admiração a uma categoria especialista na arte de vender: os comerciários.
Faço este registro porque hoje, dia 30 de outubro, comemora-se o Dia Nacional do Comerciário.
Os comerciários são profissionais que estão em lojas, shoppings, supermercados, micro, pequenas, médias e grandes empresas de nossas cidades, realizando sonhos e desejos. Atendem todas as classes, homens e mulheres, crianças e idosos. São a ligação entre o consumidor e a comercialização de bens e serviços. Do seu valorizado trabalho resultam o lucro do capital e a satisfação de um sonho de consumo realizado. Ser comerciário é a síntese das profissões, é ser universal na individualidade, é ser humano com labor mitológico.
Sou comerciário e trago comigo o orgulho de ser o primeiro comerciário eleito Deputado Federal pelo Estado de São Paulo. No Brasil, somos 12 milhões de comerciários representados pela CNTC - Confederação Nacional dos Trabalhadores no Comércio. No Estado de São Paulo, somos 2 milhões e 700 mil comerciários atuantes, representados por 71 sindicatos filiados à nossa Federação, a FECOMERCIÁRIOS, entidade por mim presidida.
Em comemoração ao Dia do Comerciário, acabamos de realizar o nosso 27º Congresso Sindical, sobre o tema Sindicalismo Reorganizado, com mais de 3 mil participantes oriundos da Capital, do interior e da Baixada Santista. Nele aprovamos a Jornada Comerciária: Sindicatos Fortes, Direitos Protegidos! Ela tem o objetivo de valorizar os sindicatos e os comerciários, categoria responsável pela movimentação da nossa economia e fundamental para o crescimento do Brasil.
Parabéns, comerciários e comerciárias! Recebam os meus sinceros cumprimentos e contem sempre comigo na defesa dos empregos, dos salários e dos direitos.
Gostaria, Sr. Presidente, que este discurso fosse registrado nos Anais da Casa e veiculado no programa A Voz do Brasil.
O SR. PRESIDENTE (Charles Fernandes. PSD - BA) - Obrigado, nobre Deputado Luiz Carlos Motta. O pedido de V.Exa. será atendido.
O SR. LUIZ CARLOS MOTTA (PL - SP) - Muito obrigado, Presidente."
2020-02-19T15:44;LUIZ CARLOS MOTTA, DEPUTADO FEDERAL, ORADOR, PARTIDO LIBERAL (PL), ATUAÇÃO PARLAMENTAR.;GRANDE EXPEDIENTE;"O SR. LUIZ CARLOS MOTTA (PL - SP. Sem revisão do orador.) - Obrigado, Sra. Presidente, Deputada Erika Kokay.
Sras. e Srs. Parlamentares, brasileiros e brasileiras que nos acompanham por meio dos veículos de comunicação desta Casa, respaldado pelos votos de mais de 75 mil eleitores paulistanos e com a missão de conduzir um mandato transparente, ético e realizador, atuando pela geração de empregos, distribuição de renda e preservação dos direitos dos trabalhadores, cumpro o meu mandato nesta Casa de Leis.
Com a participação efetiva do povo paulista na construção de um mandato democrático, posso garantir que muito fizemos num curto espaço de tempo.
Neste meu breve balanço, constam realizações relacionadas ao meu primeiro ano de mandato.
São atuações como: participações em seis Comissões e um Conselho desta Casa; apresentação de várias emendas a medidas provisórias; atendimento a centenas de demandas dos Municípios paulistas.
Com o apoio integral do meu partido, integro a Comissão de Trabalho, de Administração e Serviço Público e fui eleito Presidente da Subcomissão Permanente para debater prevenção de acidentes e doenças no trabalho, instalada no dia 23 de outubro.
Fui designado Presidente da Comissão Especial que analisou a proposta do Executivo para modificar o Código de Trânsito Brasileiro, o CTB. O PL 3.267/19, entregue à Câmara dos Deputados pelo Presidente Jair Bolsonaro, fez diversas alterações na Lei 9.503/97, que criou o Código de Trânsito Brasileiro. 
A proposta do Governo atacou itens polêmicos, como o aumento do número de pontos para a suspensão da Carteira Nacional de Habilitação, elevando o limite de 20 para 40 pontos. Propôs o fim das multas para quem transporta crianças de até 7 anos sem cadeirinha, além da exclusão da exigência de exame toxicológico para motoristas profissionais. Estamos com uma grande responsabilidade pela frente, pois estamos tratando do nosso bem maior: a proteção da vida.
Mais de 300 emendas foram apresentadas ao projeto de lei; seis audiências públicas temáticas foram realizadas, com a participação de especialistas de trânsito dos setores público e privado e de representantes da sociedade civil; e intensos debates foram feitos na Comissão, para colhermos subsídios, informações e dados importantes que contribuíram sobremaneira para a elaboração do parecer, apresentado ontem pelo Relator, o Deputado Juscelino Filho. Após a leitura do parecer, foi feito um pedido de vista coletivo. Com isso, o debate sobre o relatório fica suspenso por duas sessões no plenário desta Câmara.
Com o apoio dos nobres Parlamentares que integram o nosso colegiado, busquei sempre conduzir os trabalhos com responsabilidade, visando ao aperfeiçoamento do Código de Trânsito Brasileiro, que já tem mais de 20 anos de vigência. Em caráter conclusivo na Comissão, o texto, após aprovado, seguirá para o Senado Federal.
Também fui eleito 3º Vice-Presidente da Comissão Especial do Projeto de Lei nº 1.646, de 2019, que estabelece medidas para o combate ao devedor contumaz e de fortalecimento da cobrança da dívida ativa; sou membro titular da Comissão Especial do Projeto de Lei nº 10.887, de 2018, que dispõe sobre improbidade administrativa; e integro o Conselho de Ética e Decoro Parlamentar, órgão encarregado de zelar pela observância dos preceitos éticos, atuando na preservação da dignidade parlamentar. Além disso, fui designado pelo Presidente da Câmara para fazer parte da Comissão Especial de Documentos Sigilosos.
Nesse primeiro ano de mandato, apresentei diversas emendas a medidas provisórias, mantendo-me fiel ao compromisso de defender os interesses dos trabalhadores e da população brasileira.
Quanto à MP 889/19, que estabelece novas regras para liberação do Fundo de Garantia do Tempo de Serviço - FGTS, apresentei emenda prevendo uma nova modalidade de saque do FGTS, para permitir que o recém-formado quite ou amortize o financiamento do FIES - Fundo de Financiamento Estudantil, empréstimo que é contraído para custear os estudos do titular da conta ou de seus dependentes.
Minhas preocupações com as ameaças de novas perdas de direitos, iniciadas com a reforma trabalhista, fizeram-me apresentar duas emendas modificativas à MP 881/19, a MP da Liberdade Econômica. Apresentei essas duas emendas com o objetivo de salvaguardar os direitos trabalhistas, ao não concordar, por exemplo, com a liberação do trabalho aos domingos e feriados sem negociações prévias, além de zelar por normas reguladoras e de prevenção à saúde e à segurança no trabalho.
Sim, todos nós concordamos com a geração de incentivos às micro e pequenas empresas, mas não a custo de mais retirada de direitos, como já fez a Lei nº 13.467, de 2017, que ensejou a Reforma Trabalhista.
Quanto às emendas de inclusão de metas na LDO, apresentei três. Essas minhas três emendas preveem o acréscimo de metas para fortalecer o trabalho de instituições de segurança pública, incrementar a construção de habitações ou aquisição de lotes urbanizados e promover a inclusão social por meio do esporte.
No início deste ano, apresentei duas emendas à MP 919/20, que fixa o valor do salário mínimo em 1.045 reais. A minha proposta tem como objetivo recuperar a política de valorização do salário mínimo, que permite ganhos reais ao trabalhador. A valorização do salário mínimo é fundamental para que haja melhoria da condição de vida dos trabalhadores, com a recuperação do poder de compra do piso nacional, beneficiando trabalhadores da ativa, aposentados e pensionistas.
Sendo eu um Deputado de forte caráter municipalista, por meio de emendas impositivas da bancada paulista e focado na melhoria da segurança pública contemplamos 17 corporações da Polícia Militar do Estado de São Paulo. Foram destinadas verbas ao reaparelhamento, à reestruturação e à modernização dessas corporações. 
A bancada paulista tem atuado fortemente para buscar medidas mitigadoras e de apoio do Governo Federal, a fim de reparar os danos causados pela intensa chuva que atingiu a cidade de São Paulo e algumas cidades do interior paulista nos últimos dias, provocando alagamentos, desabamentos e caos no trânsito da cidade e entorno.
Em caráter extraordinário, o Coordenador da nossa bancada, Deputado Herculano Passos, convocou uma reunião na semana passada para juntos elegermos ações para evitar novas tragédias. Solidários às vítimas das chuvas, solicitamos audiência com os Ministros da Secretaria Geral de Governo e do Desenvolvimento Regional com o objetivo de demonstrar a gravidade dos desastres e dos prejuízos sofridos por cada região do nosso Estado de São Paulo.
Temos atuado fortemente também para garantir recursos e emendas contemplando diversas unidades de saúde, Santas Casas e hospitais. Apoiamos a destinação de recursos para o Hospital de Base de São José do Rio Preto, o maior complexo de saúde do interior de São Paulo, cujos Diretores, a Dra. Amália e o Dr. Robson, encontram-se aqui no plenário desta Casa nos prestigiando; o Hospital do Amor de Barretos; o Hospital de Clínicas de Campinas; o Hospital de Clínicas de Ribeirão Preto; e hospitais especializados, como o Hospital do Rim, o Hospital GRAACC, o Hospital de Reabilitação de Anomalias de Bauru, o Hospital de Oftalmologia de Sorocaba, a Santa Casa de Votuporanga e a Santa Casa de Tupã.
Defendi também a destinação de verba para impulsionar o ensino no campus da Unesp. Por meio de uma emenda impositiva da bancada paulista, o campus da Unesp em Tupã deverá receber mais de 1 milhão de reais, investimento que terá impacto direto no desenvolvimento dos estudantes, com reflexos também na economia regional, possibilitando que empresas desenvolvam pesquisas junto com os docentes e alunos.
Além de contemplar as áreas de saúde e educação, a bancada paulista destinou recursos para a segurança pública e, ainda, para a agricultura. Essa área receberá 22 milhões de reais por meio de investimentos na Empresa Brasileira de Pesquisa Agropecuária - EMBRAPA, que desenvolve tecnologias, conhecimentos e informações técnico-científicas voltadas para a agricultura e a pecuária brasileiras.
Contemplei também 115 Municípios paulistas, destinando-lhes recursos para serem investidos nas áreas de saúde, infraestrutura urbana, assistência social, cultura e agricultura, além de atender outros pleitos municipais ligados ao esporte e à manutenção do atendimento das perícias médicas no INSS.
Destinei 3 milhões de reais provenientes do Governo do Estado para atender mais de 20 Municípios na manutenção das unidades de saúde básica que integram o SUS, para a aquisição de materiais e a compra de medicamentos, e, também, para as áreas de infraestrutura urbana e esportes.
É com atenção redobrada à questão dos Municípios que agora faço uso da palavra para discutir um tema ainda desconhecido pelo povo brasileiro, mas fundamental para o futuro do Brasil: a urgente necessidade de revisão do nosso pacto federativo.
O Brasil está vivendo um momento de forte transformação social e política, com a reforma da Previdência, promulgada pelo Congresso no dia 12 de novembro. Contudo, de nada adiantará reformar a Previdência e continuar negando aos Estados e aos Municípios os meios necessários para estes cumprirem as funções que a Constituição Federal lhes delegou.
O pacto federativo é o arcabouço legal que estabelece as obrigações financeiras, a arrecadação de recursos e os campos de atuação dos entes federados. Em outras palavras, é o conjunto de dispositivos constitucionais que determina o que cada ente federativo pode arrecadar e quais serviços tem competência para custear.
Nesse contexto, a Constituição de 1988 representou um avanço sem precedentes em nossa História. Lembro-me das sábias palavras de um dos maiores estadistas que o Brasil já teve e que batizou este Plenário, o saudoso e inesquecível Deputado Ulysses Guimarães. No início do segundo turno das votações do projeto que viria a se tornar a Constituição de 1988, Dr. Ulysses disse: ""As urnas dão votos para os Governadores e Prefeitos administrarem"". Mas só a autêntica Federação que estamos organizando dá o dinheiro para que tais Governos respondam as necessidades localizadas.
""Federação é governo junto com o homem. Não homem correndo atrás do Governo Estadual ou de Brasília, frequentemente longínquo e indiferente"".
Desde a Constituinte, os tributos federais e a arrecadação do Governo central cresceram.
Por outro lado, enquanto as arrecadações dos Estados e dos Municípios mantiveram-se estagnadas, as obrigações daqueles entes federativos para com áreas essenciais, como saúde, segurança e educação, só aumentaram, sem qualquer compensação fiscal. É simplesmente insustentável, senhoras e senhores.
Verdadeiramente, o pacto federativo poderá estimular o crescimento dos Estados e dos Municípios. A tão sonhada geração de emprego e renda depende diretamente dessa importante medida.
Temos, também, de repensar o atual sistema tributário, a redução dos impostos sobre o consumo. Considero a reforma tributária a mais importante das reformas. É preciso ampliar a base de arrecadação tributária para desonerar as atividades que promovem o crescimento econômico.
O sistema tributário não deve ser apenas simplificado, mas também racionalizado e modernizado. Por isso, defendo a reforma tributária solidária. Entendo que, com essa proposta, teremos um sistema com mais justiça fiscal, visando a reduzir a desigualdade social.
Como Deputado Federal, tenho redobrado minha atenção à criação de incentivos aos Municípios e à formulação de parcerias. Foco o exercício do meu mandato na promoção de iniciativas que, infelizmente, não são cumpridas pelo Estado. Fiel ao que anunciei em minha campanha eleitoral considero fundamental manter proximidade com as lideranças políticas e sociais, e aliado ao bom relacionamento que mantenho com os meus pares nesta Casa.
O resultado positivo, obtido por meio desse contato direto mantido com as autoridades e instituições, pode ser exemplificado em duas atividades cidadãs muito expressivas, por mim praticada: primeira, a construção de casas atendendo mais de 14 mil famílias por meio de parcerias, entre elas, a Caixa Econômica Federal e as Prefeituras; segunda, a conquista de terrenos para a construção de casas por meio do Construindo Cidadania, um idôneo programa de loteamento popular.
O exercício de um mandato democrático que conta, a cada dia, com as participações de Prefeitos, Vereadores, Secretários e Deputados Estaduais, faz com que sigamos contribuindo para tirar milhares de famílias do aluguel.
Enfim, parceria para mim significa compromisso com a promoção do bem-estar do próximo. Parceria é compromisso com o cumprimento de um mandato que contribua com ações que melhore a vida das pessoas.
Por fim, quero aqui registrar o orgulho e satisfação com o Partido Liberal - PL, que, sob a liderança do Deputado Wellington Roberto, tem crescido muito e é cada vez mais respeitado, um partido que tem compromisso e comprometimento com nosso Brasil. Hoje, o partido conta com 43 Deputados Federais, sendo 7 Deputados Federais do Estado de São Paulo,  e 6 Deputados Estaduais do Estado de São Paulo. O PL está organizado em quase 500 cidades do Estado de São Paulo. É um partido que está cada vez mais forte e que zela pela unidade partidária. Não tenho dúvida de que tem muito ainda a contribuir para um Brasil melhor, trabalhando na construção de políticas públicas e com uma agenda que estimule a geração de emprego e renda e coloque o Brasil rumo ao crescimento econômico. 
É com esta colocação que encerro meu pronunciamento, acreditando ser possível e necessário exercer um mandato a serviço do povo brasileiro, com geração de emprego, renda e promoção de uma vida digna.
Sra. Presidente, solicito a V.Exa. que autorize a reprodução das minhas palavras nos veículos de comunicação desta Casa e no programa A Voz do Brasil.
Muito obrigado."
2020-05-05T18:24;DIA DO ENFERMEIRO, PROFISSIONAL DE SAUDE, HOMENAGEM.;PELA ORDEM;"O SR. LUIZ CARLOS MOTTA (Bloco/PL - SP. Pela ordem. Sem revisão do orador.) - Sr. Presidente, Sras. e Srs. Parlamentares, quero prestar a minha homenagem àqueles que realizam a sua vocação de cuidar do próximo e que, diante do olhar de sofrimento do outro, atuam para aliviar as dores e se arriscam para exercer a sua função social de promover a cura e salvar vidas. No dia 12 de maio, celebramos o Dia do Trabalhador da Saúde no Estado de São Paulo, uma conquista da categoria garantida por lei estadual e comemorada desde 2004. Nessa mesma data, comemora-se mundialmente o Dia do Enfermeiro, profissão de origem milenar, comprometida com a saúde e o bem-estar do ser humano.
Nestes tempos de pandemia, quando valorizamos ainda mais o nobre ofício desses profissionais que estão na linha de frente contra o coronavírus, é imprescindível respeitar os seus conhecimentos e incentivar o seu trabalho, pois enfrentam grandes desafios. São médicos, enfermeiros, biomédicos, nutricionistas, odontólogos, técnicos em radiologia, fisioterapeutas, enfim, todos os trabalhadores da área da saúde, cada um em sua especialidade, que atuam com um objetivo comum: o restabelecimento da saúde dos pacientes.
Cumprimentamos a todos esses profissionais, que, apesar de todos os riscos, continuam exercendo o seu ofício com respeito e dedicação.
Considerando a importância da data, Sr. Presidente, solicito que esta homenagem seja transcrita nos Anais e divulgada nos meios de comunicação da Câmara dos Deputados.
O PL vota ""sim""."
