dataHoraInicio;keywords;tipoDiscurso;transcricao
2000-06-19T00:00;"DEFESA, IMPLANTAÇÃO,  ZONEAMENTO ECOLÓGICO ECONÔMICO, ZONEAMENTO AGROECOLÓGICO, MT.
INVESTIMENTO, RECURSOS ORÇAMENTÁRIOS, SAÚDE, OBRA PÚBLICA, MT.";PEQUENO EXPEDIENTE;
2000-06-19T00:00;II;PEQUENO EXPEDIENTE;
2000-06-29T00:00;OFÍCIO, COMISSÃO, HIDROVIA, RIO TELES PIRES, RIO JURENA, RIO TAPAJÓS, AGRADECIMENTO, DEFESA, OCUPAÇÃO, TERRAS, MT.;PEQUENO EXPEDIENTE;
2000-08-08T00:00;APRESENTAÇÃO, PROJETO DE DECRETO LEGISLATIVO, PLEBISCITO, CRIAÇÃO, ESTADO.;PEQUENO EXPEDIENTE;
