dataHoraInicio;keywords;tipoDiscurso;transcricao
1999-02-24T00:00;"DESEMPREGO, DIFICIT, HABITAÇÃO, INVESTIMENTO, CONSTRUÇÃO CIVIL, 
CRIAÇÃO, EMPREGO. 
GOVERNO FEDERAL, SECRETARIA NACIONAL DE HABITAÇÃO, POLITICA URBANA, 
HABITAÇÃO, SANEAMENTO BASICO. 
PROPOSTA, EMENDA CONSTITUCIONAL, PERDA, MANDATO PARLAMENTAR, FALTA, 
FIDELIDADE PARTIDARIA. 
LEI FEDERAL, ELEIÇÕES. 
REFORMA POLITICA.";GRANDE EXPEDIENTE;
1999-05-26T00:00;ENCAMINHAMENTO, REQUERIMENTO DE INFORMAÇÕES, CEF, INVESTIMENTO, HABITAÇÃO.;PELA ORDEM;
1999-08-25T00:00;NECESSIDADE, REFORMULAÇÃO, SISTEMA  ELEITORAL. CRÍTICA, VOTAÇÃO, COMISSÃO DE CONSTITUIÇÃO E JUSTIÇA E DE REDAÇÃO, PROJETO DE LEI COMPLEMENTAR, DESINCOMPATIBILIZAÇÃO, PREFEITO, GOVERNADOR, PRESIDENTE DA REPÚBLICA, CANDIDATO, REELEIÇÃO.;PELA ORDEM;
1999-08-25T00:00;DISCORDÂNCIA, NOTÍCIA, IMPRENSA, CLASSIFICAÇÃO, POBREZA, MAIORIA, PESSOAS, MA, COMPARAÇÃO, ESTADOS.;COMUNICAÇÃO PARLAMENTAR;
2000-04-18T00:00;II;PELA ORDEM;
2000-05-09T00:00;NARCOTRÁFICO, CPI, ATUAÇÃO, PRORROGAÇÃO, CONCLUSÃO, INQUÉRITO, INVESTIGAÇÃO, JUSTIÇA, MA,;COMUNICAÇÃO PARLAMENTAR;
2000-05-09T00:00;"REQUERIMENTO, PRORROGAÇÃO, TRABALHO, (CPI), TRAFICO, DROGA, 
APRESENTAÇÃO, RELATORIO FINAL. 
VOTO FAVORAVEL, PARTIDO POLITICO, (PFL). 
SUGESTÃO, CRIAÇÃO, SUBCOMISSÃO, ACOMPANHAMENTO, RESULTADO, 
APURAÇÃO, (CPI).";LÍDER;
2000-06-14T00:00;RECLAMAÇÃO, MINISTÉRIO DOS TRANSPORTES, DNER, REIVINDICAÇÃO, RECUPERAÇÃO, RODOVIA, MA.;PELA ORDEM;
2000-10-05T00:00;II;PEQUENO EXPEDIENTE;
2000-12-05T16:14;PROTESTO, INEFICÁCIA, MINISTÉRIO PÚBLICO FEDERAL, INDÍCIO, CRIME, PREFEITO, CIDADÃO, (MA), ARTIGO DE IMPRENSA,JORNAL DO BRASIL, JORNAL,  REELEIÇÃO, (CPI), TRÁFICO, DROGA, CRIME ORGANIZADO, COMISSÃO PARLAMENTAR MISTA DE INQUÉRITO, ROUBO, CARGA, TRANSPORTE DE CARGA, TRANSPORTE RODOVIÁRIO, TRANSPORTE FERROVIÁRIO, TRANSPORTE AQUÁTICO.;PELA ORDEM;"O SR. CESAR BANDEIRA (PFL-MA. Pela ordem. Sem revisão do orador.) - Sr. Presidente, Sras. e Srs. Deputados, hoje está sendo concluído o relatório da CPI do Narcotráfico, uma das Comissões mais importantes já instaladas nesta Casa.
	Durante mais de um ano, a CPI mostrou as irregularidades existentes em vários Estados, principalmente no Maranhão, São Paulo e Amapá. No meu Estado, o Maranhão, ela deu substancial ajuda no combate não só ao narcotráfico, como também ao crime organizado e ao roubo de cargas. Quanto ao crime organizado, ainda hoje vêm aguardando julgamento Deputados Estaduais, delegados e outros segmentos do Estado do Maranhão.
Sr. Presidente, o mais gritante é que nenhuma providência foi tomada em relação aos que, na época, foram investigados pela Comissão, para que  pudessem ser responsabilizados na Justiça e, com isso, serem impedidos de se candidatarem a cargos eletivos. Nenhum pedido de punição partiu do Ministério Público, nem a Justiça tomou qualquer decisão a respeito. Com isso, três Prefeitos do Maranhão, bastante envolvidos não só com o crime organizado como também com roubo de cargas, foram eleitos e reeleitos. Isso decepcionou muito a população maranhense, que tinha a expectativa de punição imediata, uma vez que o envolvimento estava mais do que comprovado.
Esperava-se que, com a criação da CPI do Roubo de Cargas, esses Prefeitos e outros envolvidos tivessem uma punição mais severa e mais rápida. A Comissão, por três vezes, marcou sua ida ao Maranhão. Mas todos se perguntam: por que a transferência de datas? Por que não foram ouvidos, já que todos foram apontados, alguns com inquéritos em andamento e outros com inquéritos concluídos?
Há quem diga, no Estado do Maranhão, que isso aconteceu devido a alguma força oculta que transita não no Salão Verde, mas no Salão Azul de uma Casa vizinha a nossa. Não podemos aceitar isso sob hipótese alguma. Nenhum cidadão ou cidadã maranhense acredita mais que essa Comissão possa chegar lá, apontar ou continuar o grande trabalho que a CPI do Narcotráfico iniciou, mas que não chegou a ser concluído.
	Hoje, vejo matéria no Jornal do Brasil em que o nobre Relator,  Deputado Moroni Torgan, do PFL — meu partido —, aponta para serem indiciadas pela CPI do Roubo de Cargas pessoas de fato envolvidas, principalmente no Estado do Maranhão. Quando digo principalmente no Estado do Maranhão é porque essas pessoas foram presas e estão com processos em andamento, mas ainda não foram julgadas.
	Sr. Presidente, acreditamos no nosso Estado. Se tiver que sair uma punição que seja a pedido da CPI do Narcotráfico. Esperamos que a CPI do Roubo de Cargas não vá mais ao Maranhão, porque o nosso Estado não acredita mais que, com essas forças ocultas que estão impedindo o deslocamento dessa Comissão, ela seja capaz de pedir a punição  daqueles que merecem e, com isso, dar a tranqüilidade que a família maranhense necessita.
	Muito obrigado, Sr. Presidente."
2001-02-13T14:52;"RESPOSTA, CONSULTA, RELATOR, MAURÍCIO CORREIA, MINISTRO, (TSE), REELEIÇÃO, GOVERNADOR.
 JOSÉ REINALDO TAVARES, VICE GOVERNADOR, (MA), GERALDO ALKMIN, (SP), SUCESSÃO, GOVERNADOR, GARANTIA, CANDIDATURA, REELEIÇÃO.
TORQUATO JARDIM, PRESIDENTE, (TSE), NELSON JOBIM, MINISTRO, (TSE).";PEQUENO EXPEDIENTE;"O SR. CESAR BANDEIRA (PFL-MA. Sem revisão do orador.) – Sr. Presidente, Sras. e Srs. Deputados, muito se tem falado não só em âmbito nacional, mas também em âmbito estadual — no caso, o Maranhão — a respeito da elegibilidade dos Vice-Governadores que assumiram temporariamente a governança dos Estados.
	Gostaria que fosse transcrito nos Anais trecho de  consulta que fiz ao TSE no ano passado sobre o tema.
	É o seguinte: ""Consulta ao Tribunal Superior Eleitoral sobre elegibilidade do Vice-Governador para o cargo de Governador no mesmo Estado quando venha a substituir ou a suceder os titulares nos seis meses anteriores ao pleito no período subseqüente"".
	 O Tribunal Superior Eleitoral, em resposta à minha consulta, fez a seguinte comunicação:
	Comunico a V.Exa. que este tribunal, em sessão do dia 31/08/99, julgando a Consulta nº 537, Protocolo nº 4.270/99 - TSE, Relator Ministro Maurício Corrêa, formulada sobre elegibilidade para o cargo de Governador do Estado de Vice-Governador que houver sucedido ou substituído o titular nos seis meses anteriores ao pleito, respondeu afirmativamente à indagação, nos termos do voto do Ministro Relator, no sentido de que, em caso de sucessão do cargo de Governador, o Vice-Governador que tiver sucedido poderá reeleger-se para o cargo de Governador por um período subseqüente.

	Sr. Presidente, Sras. e Srs. Deputados, com essa decisão, foi assegurado, como já estava na Constituição, no art. 14º, § 5º, aos Vices que  assumiram definitivamente o cargo do titular, no caso da renúncia deste, nos seis meses anteriores ao pleito, o direito de serem candidatos ao cargo para um período subseqüente.
	Fiz questão de ler da tribuna desta Casa a resposta do TSE porque, no meu Estado, o Maranhão, o atual Vice-Governador, Dr. José Reinaldo Tavares, tem sido alvo, por parte dos seus adversários e mesmo de correligionários, de campanha com notícias plantadas em jornais e  também as que correm no seio da classe política. Aqui estão as provas. 
Não temos nenhuma dúvida, Sr. Presidente, de que tanto o Vice-Governador Jose Reinaldo Tavares quanto o Vice-Governador Geraldo Alkmin, de São Paulo, têm condições de ser candidatos ao cargo de Governador. Resta que se busque apoio para viabilizar a candidatura.
	 Eu, que pertenço a um grupo majoritário no meu Estado, acredito que esse grupo não promoverá divisões sob nenhum aspecto, tampouco continuará essa campanha, que não é feita às claras. Trata-se de  campanha com notícias plantadas nos jornais, para que o grupo sofra divisões. 
Todas as vezes que essas notícias aparecem, vou à imprensa para rebatê-las, já que não têm autor ou têm autoria desconhecida para alguns, mas  conhecida para muitos. 
Queremos dizer que essas notícias não vão, de maneira alguma, abalar o grupo ao qual o Vice-Governador José Reinaldo pertence. 
Temos certeza de que a Justiça não será desviada para beneficiar aqueles que desejam o poder a qualquer custo. Todas essas informações vieram à tona por um comentário no julgamento de um caso do Amazonas. O Ministro Nelson Jobim, nosso ex-companheiro nesta Casa, num voto, fez um comentário que foi notícia em todos os jornais do País, mesmo tendo consulta no TSE e não tendo sido alterado o art. 14 da Constituição. 
O comentário do Ministro Nelson Jobim foi também veementemente contestado pelo ex-Ministro do Tribunal Superior Eleitoral Torquato Jardim, em parecer elaborado a pedido de meu partido, o PFL, em  que reafirma a elegibilidade dos Vices. 
Era o que tinha a dizer."
2001-02-20T17:06;DEFESA, LEI COMPLEMENTAR, REGULAMENTAÇÃO, CRIAÇÃO, MUNICÍPIOS.;PELA ORDEM;"O SR. CESAR BANDEIRA (Bloco/PFL-MA. Sem revisão do orador.) - Sr. Presidente, fui o autor da emenda constitucional que estancou a farra de criação de Municípios no Brasil. Lutei durante cinco anos nesta Casa para que essa emenda constitucional fosse votada. Infelizmente, ela não está sendo respeitada em alguns Estados do Brasil.
	Quanto ao projeto ora em votação, trata-se de paliativo, porque a criação indiscriminada de Municípios no Brasil fez com que outros perdessem receitas, e, por isso, temos de votar urgentemente uma lei complementar que regulamente a criação de novos Municípios, tendo em vista que já há emenda constitucional em vigor, mesmo não sendo respeitada."
2001-04-17T12:02;ELOGIO, ATUAÇÃO, (CNPQ), PROMOÇÃO, DESENVOLVIMENTO CIENTÍFICO, DESENVOLVIMENTO TECNOLÓGICO, BENEFÍCIO, DESENVOLVIMENTO ECONÔMICO, DESENVOLVIMENTO SOCIAL, DESENVOLVIMENTO CULTURAL.;FALA DO PRESIDENTE OU NO EXERCÍCIO DA PRESIDÊNCIA;"O SR. PRESIDENTE (Cesar Bandeira) - Exmo. Sr. Ministro Ronaldo Sardenberg, Ministro de Estado da Ciência e Tecnologia, Exmo. Dr. Evandro Mirra de Paula e Silva, Presidente do CNPq, Exma. Dra. Glaci Zacan, Presidente da SBPC, meu companheiro de bancada do Maranhão Deputado Gastão Vieira, senhoras e senhores presentes, se os grandes países do mundo já mediram forças cotejando armamento bélico e a pujança industrial, hoje a divisão de poder se faz pelo domínio do conhecimento, pelo progresso da ciência, pela evolução da tecnologia. Governos que não investem na formação dos estudantes e na preparação de pesquisadores se condenam irremediavelmente ao atraso econômico e à pobreza social.
	Valioso, portanto, é o papel cumprido pelo CNPq — Conselho Nacional de Desenvolvimento Científico e Tecnológico. Criado em 1951, o então Conselho Nacional de Pesquisas vem dando importante contribuição ao esforço em prol da ciência e dos cientistas brasileiros. Justa, pois, a homenagem com que a Câmara dos Deputados comemora o meio século de trabalho e de conquistas dessa relevante instituição.
	Promover o desenvolvimento científico e tecnológico e efetuar pesquisas que concorram para a prosperidade econômica, social e cultural do Brasil, essa é a missão que o CNPq cumpre há cinqüenta anos. Para bem realizá-la, devota-se a três atividades precípuas: o fomento, a execução de pesquisas — dando a conhecer as informações que delas resultam — e a difusão de ciência e tecnologia.
Já na primeira década de atuação, motivou o CNPq o surgimento de institutos a que se devem importantes trabalhos de investigação científica e tecnológica, merecedores da confiança e do respeito da comunidade acadêmica internacional. Avultam, entre eles, o Instituto de Matemática Pura e Aplicada, o Instituto Nacional de Pesquisas da Amazônia, o Instituto Nacional de Pesquisas Espaciais e o Instituto de Bibliografia e Documentação, a que sucedeu o Instituto Brasileiro de Informação em Ciência e Tecnologia.
Assim, o Conselho Nacional de Desenvolvimento Científico e Tecnológico é, ao mesmo tempo, herdeiro e continuador da admirável obra com que inventores e pesquisadores brasileiros subiram ao panteão dos beneméritos da humanidade. Gênios como Santos Dumont e Osvaldo Cruz, César Lattes e Vital Brasil, Carlos Chagas — o pai e o filho — e Augusto Ruschi.
Na reclusão dos laboratórios e no silêncio dos institutos de pesquisa, homens assim estudam e investigam, descobrem e inventam para que possamos viver em um mundo melhor, mais digno e mais justo. Esse é o sentimento de orgulho e de respeito com que a Câmara dos Deputados comemora os 50 anos do Conselho Nacional de Desenvolvimento Científico e Tecnológico, instituição que abrilhanta a nossa história e engrandece a ciência brasileira.
Sr. Ministro, em nome da Comissão de Ciência e Tecnologia, Comunicação e Informática e de todos os Deputados que a compõem, desejamos que o CNPq continue sendo o grande baluarte da pesquisa para o desenvolvimento do nosso País.
Agradeço a todos a presença."
2001-05-09T17:26;TRANSCRIÇÃO, DOCUMENTO, DECISÃO, COMISSÃO DE CIÊNCIA E TECNOLOGIA COMUNICAÇÃO E INFORMÁTICA, IMPETRAÇÃO, AÇÃO DE INCONSTITUCIONALIDADE, MEDIDA PROVISÓRIA, AUTORIZAÇÃO, FUNCIONAMENTO, RÁDIO COMUNITÁRIA, CARÁTER PROVISÓRIO, EMENDA, SUPRESSÃO, DISPOSITIVOS.;PELA ORDEM;"O SR. CESAR BANDEIRA (Bloco/PFL-MA. Pela ordem. Sem revisão do orador.) - Sr. Presidente, na qualidade de Presidente da Comissão de Ciência e Tecnologia, passo a ler documento aprovado por aquele órgão e dirigido ao Presidente Aécio Neves:
Por meio do art. 30 da Medida Provisória nº 2.143/32, de 2 de maio de 2001, o Exmo. Sr. Presidente da República alterou o art. 2º da Lei nº 9.612, de 19 de fevereiro de 1998, que instituiu o serviço de radiodifusão comunitário. Com o novo dispositivo, o Poder Executivo expedirá licença de funcionamento em caráter provisório, que perdurará até a apreciação do ato de outorga pelo Congresso Nacional.
Tal procedimento é flagrantemente inconstitucional à vista do prescrito no § 3º do art. 223 da Constituição Federal, que diz:
Art. 223. ....................
§ 3º - O ato de outorga ou renovação somente produzirá efeitos legais após deliberação do Congresso Nacional, na forma dos parágrafos anteriores.
Não vemos como citado dispositivo poderia ser mais cristalino ao estabelecer que o ato de outorga do Poder Executivo somente passa a ter validade após a aprovação do Congresso Nacional. Em conseqüência, uma emissora somente poderá iniciar suas transmissões, mesmo que sob licença provisória, após a deliberação final do Congresso Nacional. Proceder de outra maneira é burlar a Constituição.
Causa-nos estranheza que um assunto tão específico tenha sido incluído em uma medida provisória que trata da organização da Presidência da República e dos Ministérios. Afinal, a lei das rádios comunitárias originou-se de um projeto de lei que foi intensamente debatido na Comissão de Ciência e Tecnologia, bem como no plenário da Câmara dos Deputados. Alterá-la por medida provisória é, além disso, introduzir um dispositivo tão questionável e um desrespeito ao Congresso Nacional que não poderemos aceitar.
Queremos esclarecer, por oportuno, que não está havendo tanta demora na Câmara dos Deputados ou no Senado Federal na apreciação dos atos de outorga das rádios comunitárias. Cabe observar que há processos que chegam à Câmara dos Deputados depois de tramitar mais de um ano no Poder Executivo. Não há por que, portanto, o Governo alegar uma pretensa demora do Congresso Nacional para desrespeitar a Constituição. 
Além disso, não conseguimos ver no caso em exame a relevância e urgência que, de acordo com o art. 62 da Constituição Federal, são necessárias para editar medidas provisórias. Este é, com certeza, mais um uso abusivo da reedição  de medidas provisórias por parte do Poder Executivo.
Em conseqüência, desejo informar a V.Exa. e a todos os Pares que, com a aprovação unânime dos membros da Comissão de Ciência e Tecnologia, estou adotando as seguintes providências: 
- Apresentação de uma emenda para suprimir o art. 30 da medida provisória; 
- Apresentação de uma ação direta de inconstitucionalidade do art. 30 da medida provisória junto ao Supremo Federal. 
Assim sendo, solicito o apoio de V.Exa. e de todos os Srs. Deputados para a medida que estou adotando, que visa apenas resguardar o cumprimento da Constituição Federal.""
		Muito obrigado."
2001-09-04T16:38;CENTENÁRIO, ANIVERSÁRIO DE NASCIMENTO, EX DESEMBARGADOR, (MA).;PELA ORDEM;"O SR. CESAR BANDEIRA (Bloco/PFL-MA. Pela ordem. Sem revisão do orador.) – Sr. Presidente, Sras. e Srs. Deputados, hoje, no Maranhão, comemora-se o centenário do Desembargador Sarney de Araújo Costa, pai do ex-Presidente José Sarney e avô da Governadora Roseana Sarney.
O Desembargador Sarney de Araújo Costa marcou época na magistratura do Maranhão, onde exerceu com brilhantismo todos os cargos, até chegar a Desembargador e Presidente do Tribunal de Justiça e do Tribunal Eleitoral do nosso Estado.
Parabenizo não só a família do Desembargador, mas também as cidades de São Bento e Pinheiro, que deram origem àquele grande homem público e magistrado de que o Maranhão hoje sente saudade.
Muito obrigado, Sr. Presidente."
2001-09-05T16:02;CRÍTICA, DEPUTADO FEDERAL, DIVERGÊNCIA, DEMORA, RATIFICAÇÃO, ACORDO INTERNACIONAL, UTILIZAÇÃO, (CLA), LANÇAMENTO AEROESPACIAL, MUNICÍPIO, (MA).;PELA ORDEM;"O SR. CESAR BANDEIRA (PFL-MA. Pela ordem. Sem revisão do orador.) - Sr. Presidente, Sras. e Srs. Deputados, o problema do acordo entre Brasil e  Estados Unidos referente a Alcântara deixou de ser operacional para ser político. 
	Eu, como Presidente da Comissão de Ciência e Tecnologia, Comunicação e Informática, que está ligada diretamente ao problema de Alcântara, não poderia deixar de usar a tribuna desta Casa para falar não só como Presidente da Comissão, mas também como Deputado do Maranhão.
	Logo que esse acordo chegou ao Congresso, nós da Comissão de Ciência e Tecnologia fizemos uma visita a Alcântara e tivemos discussões com a Agência Espacial Brasileira, com o Ministério da Ciência e Tecnologia e com aqueles que são encarregados do problema de lançamento de foguetes no Brasil. Também mandamos uma Subcomissão, presidida pela Deputada Luiza Erundina, de São Paulo, para que pudesse também fazer um levantamento dos problemas sociais, que são muito graves, em função da construção daquele centro de lançamento de foguetes em Alcântara. Tivemos várias reuniões com o Ministro da Ciência e Tecnologia, já nos antecipando à chegada do acordo, para que pudéssemos analisar o seu mérito, e o projeto ainda se encontra na Comissão de Relações Exteriores, servindo de palanque para alguns, em prejuízo do povo do Maranhão, para não dizer do Brasil.
	Ora, Sr. Presidente, se existem divergências, se existe um acordo mal elaborado, isso tem que ser solucionado, porque acordo não pode receber emendas. Ele é aprovado ou rejeitado. Agora, não podemos ficar com um acordo servindo de palanque. 
Hoje, há mais de seis horas, discute-se na Comissão de Relações Exteriores essa questão. 
Ora, para se resolver os problemas contidos naquele acordo, não é preciso  tantas horas de discussão. É preciso, sim, responsabilidade, bom senso e vontade  de resolver. 
Sr. Presidente, não aceitamos, nem como maranhense, nem como Parlamentar do Maranhão, nem como Presidente da Comissão de Ciência e Tecnologia, que vai julgar o mérito, que este acordo seja inviabilizado em função de posição geográfica e das condições que oferece o Centro de Lançamento de Alcântara. 
	Sou contra alguns artigos do acordo, mas também sou contra a maneira como está sendo conduzida essa questão. Não vemos vontade alguma daquela Comissão de resolver o problema. 
Se tivesse, em vez de intermináveis audiências públicas, deveria ter realizado reuniões com quem pode resolver o grande problema criado com aquele acordo, que pode abrir as portas para a tecnologia brasileira por meio do lançamento de foguetes no País.
	A solução seria o entendimento com as autoridades do setor, e não usar o acordo para voltar ao tempo de O petróleo é Nosso, do muro de Berlim. Temos que oferecer uma solução sem permitir que nossa soberania seja atingida."
2001-11-06T13:44;"SEGURANÇA PÚBLICA, MA.
VIOLÊNCIA CONTRA MENOR, HOMICÍDIO, MA.";PEQUENO EXPEDIENTE;"O SR. CESAR BANDEIRA (Bloco/PFL-MA. Sem revisão do orador.) - Sr. Presidente, Sras. e Srs. Deputados, ocupo a tribuna para contestar insinuações e acusações feitas ao Governo do Maranhão, na pessoa da Governadora Roseana Sarney, referentes à segurança pública do Estado.
	Na história do Maranhão nunca se investiu tanto em segurança e nunca houve ação tão eficaz, tanto da Polícia Civil quanto da Polícia Militar.
Ultimamente, têm-se visto na imprensa nacional — acreditamos que isso seja fruto de partidos ou de pessoas interessadas em atingir a imagem da Governadora, devido ao crescimento de seu nome na opinião pública nacional, na sua caminhada rumo, possivelmente, ao Palácio do Planalto — calúnias, sendo que a mais recente é uma mentira de infelicidade sem limites. Refiro-me aos menores atingidos no Maranhão nos últimos dez anos. O Estado, o Governo e a população do Maranhão jamais apoiariam crimes tão terríveis ocorridos em diversas partes daquele Estado. 
Foi divulgado o relatório do Padre Marcos Passerini. Ora, isso vem desde 1991 e somente agora esse relatório, que cita treze casos, foi distribuído. A Governadora, de antemão, acionou o sistema de segurança, mandando realizar uma investigação profunda, para verificar as providências tomadas, não só naquele período mas também até à data de hoje. 
E não foram constatados só 13, mas, sim, 18 casos, com as providências tomadas no relatório que a Gerência de Estado da Justiça, Segurança Pública e Cidadania do Estado acaba de enviar à Governadora e à opinião pública maranhense.
	Ressalto que o Maranhão foi pioneiro. Aqui está como testemunha o Deputado Moroni Torgan, que foi o Relator da CPI do Narcotráfico. S.Exa. começou pelo Maranhão, uma das maiores, para não dizer a maior, caça a criminosos e a ladrões de cargas, enfim, à bandidagem organizada neste País.
	A coragem da Governadora Roseana foi elogiada em todo o Brasil, não só por essa operação mas também pelas suas conseqüências. Deputados foram cassados e presos; outros ainda estão sendo processados e segmentos de fora da lei ainda estão amargando na prisão. Foi preciso construir uma penitenciária e lá colocar esses fora da lei, para que a Justiça pudesse se manifestar, finalmente.
	Sr. Presidente, solicito a V.Exa., que autorize a transcrição nos Anais da Casa desse relatório, que também será entregue ao Ministro da Justiça. S.Exa. não pode fazer injustiça, como fez recentemente, com o telegrama totalmente desinformado e agressivo à Governadora. 
	A bancada do Maranhão solicita audiência ao Sr. Ministro para lhe entregar em mão o relatório, no sentido de que mande averiguar os fatos e tome as providências cabíveis. O Ministro da Justiça, representante da Justiça, não pode cometer essa injustiça. 
	Muito obrigado, Sr. Presidente.
RELATÓRIO A QUE SE REFERE O ORADOR"
