dataHoraInicio;keywords;tipoDiscurso;transcricao
2002-06-12T10:42;HOMENAGEM, CENTENÁRIO, FUNDAÇÃO, UNIVERSIDADE PARTICULAR.;HOMENAGEM;"O SR. CESAR BANDEIRA (PFL-MA. Sem revisão do orador.) – Exmo. Sr. Presidente da sessão; Exmo. Sr. Ministro Presidente do Supremo Tribunal Federal, Marco Aurélio Mendes de Farias Mello; Magnífico Reitor, Professor Dr. Candido Mendes de Almeida; Magnífico Vice-Reitor, Professor Antonio Luiz Mendes de Almeida; Professores Élcio Gadret e Alexandre Gazé; Srs. Diretores e Professores da Universidade Candido Mendes, Sras. e Srs. Parlamentares, não poderia deixar passar a data de hoje sem a necessária e obrigatória homenagem ao Conjunto Universitário Candido Mendes pelo centenário de sua fundação.
	São cem anos de história, excelência e tradição. Um século de trabalho independente, comprometido com os anseios sociais, voltado para o ensino, a pesquisa, a extensão e, sobretudo, avesso ao proveito econômico decorrente da contraprestação pecuniária devida, porquanto simbólica. Trata-se da Sociedade Brasileira de Instrução — SBI e sua mantida Universidade Candido Mendes, venerável instituição de ensino, cujo centenário homenageio com grande honra. 
	Poucas instituições no Brasil conseguiram alcançar a solidez e o respeito atingidos pela Candido Mendes, que tem como modelo de rigidez e criatividade ""servir ao ensino com o empenho universal em todas as modalidades da sua excelência e no que fosse sinal dos tempos de novas demandas e especializações"", o que levou Rodrigues Alves à concessão de uma das primeiras outorgas do privilégio de utilidade pública.
	A Candido Mendes é um centro de produção de conhecimento; um centro de excelência que combina, de forma harmônica, o ensino, a pesquisa e a extensão, constituindo-se paradigma para as demais universidades, sejam públicas, sejam privadas.
	A sociedade brasileira está ciente da importância da Candido Mendes, responsável não só pelo incentivo à pesquisa, à pós-graduação, a publicações e à produção de conhecimento propriamente dito como pela formação de profissionais tecnicamente competentes e eticamente comprometidos com um exercício correto da profissão que abraçaram.
	Ao completar cem anos, a SBI está apta a demonstrar o que é a sua vida como instituição, o ponto crucial que a difere e indica o seu trabalho, a sua produção científica ou a sua imagem nessas dez décadas.
	Conforme acentua o Magnífico Reitor Candido Mendes, ""nasciam as duas entidades em 1902, ambas pioneiras. Uma, a desdobrar, pela primeira vez no País e para as classes médias em começo de expansão, a idéia de um curso profissional. Fugia-se ao padrão das clássicas carreiras liberais do amadorismo das atividades clássicas de balcão de mercancias no Rio de Janeiro ainda mofino, às vésperas da grande explosão urbana do Prefeito Passos"".
	Desde 1902 a SBI recusa-se a ser um empreendimento lucrativo. Organiza-se ""ao fio da prestação mais barata — senão simbólica — para atender à fome de ensino da baixa classe média, dos caixeiros e balconistas, que acorriam à carreira nova e à profissionalização capaz de levar-lhes a segurança do emprego e o melhor do seu conhecer. De logo, Candido Mendes Sênior, o Conde, advertia os seus de que educador não é vendedor de água. Ou seja, aproveitador da dramática escassez desses serviços nos países subdesenvolvidos, a transformá-lo sobrepreço possível, não sobrelucro acintoso à pobreza nacional"".
	A SBI demonstrou, na prática, desde o período compreendido entre as duas guerras mundiais, que a plena atividade de educação envolveria, ao mesmo tempo, ensino, pesquisa e extensão. Prova disso foi a criação do Museu Comercial, que difundiu amostras de novos artefatos da industrialização-menina e criou, com as montras, o serviço de disseminação das excelências no Prata. Ganhou o Museu Comercial o grande prêmio latino-americano de comércio exterior pela qualidade das vitrines que enviou a Montevidéu, às vésperas do primeiro centenário da independência.
	De outro lado, a Faculdade de Ciências Polícias e Econômicas, criada em 2 de junho de 1919, deu oportunidade à instalação do Instituto Universitário de Pesquisas do Rio de Janeiro. Segundo o Magnífico Reitor Candido Mendes: ""Plantava-se a semente de forma profética. Entendiam os fundadores que de nada adiantaria a formalidade da transmissão do conhecimento sem o choque da experimentação num país acostumado à exaustiva reprodução dos modelos de além-mar e ao disfarce apelintrado da realidade em que se apoiava. Insistimos na promessa e na teima do que veio a ser, em 1963, a concretização, sob a mesma sigla, da primeira organização privada de pesquisa em Ciências Sociais, que é a da nossa Casa das Excelências, hoje, na Rua da Matriz"".
Mais que os cursos múltiplos e discutíveis, busca a Candido Mendes ""o fio interno de confiança e aprendizado intergeracional, rebentando, inclusive, em outras Casas, em outras vocações, a desdobrar o pioneirismo inicial da SBI. Dessa vocação nasceram, por exemplo, através do horizonte do Ministro Gama Filho, ou de Moacyr Sreder Bastos, as universidades e os grandes centros que portam os seus nomes"", ao norte e na periferia do Rio de Janeiro.
Durante esses cem anos, a Candido Mendes atravessou vários momentos políticos, destacando-se o período pós-64, cujo autoritarismo marcante da época não conseguiu emudecer os intelectuais que a compunham. Também não silenciou quando da edição dos atos institucionais. Convidou diversos pensadores internacionais com o escopo de ""manter em dia a inquietação do conhecer brasileiro e rasgar-lhes a exigência do humanismo"".
Conforme narra o Magnífico Reitor Candido Mendes, ""na década que se inicia 64 recrutávamos, anualmente, maior número de vozes do mundo que todo conjunto dos demais campi brasileiros. Enfrentava-se a nacionalidade tecnocrática e suas sanções a bem das ideologias pasteurizadas. Não tínhamos verbas nem subsídios a receber dos orçamentos governamentais, tal como, neste mesmo limite, podíamos — Heleno Fragoso à frente — acolher nas nossas cátedras grandes vozes da universidade pública, cassados ou reduzidos ao silêncio nas suas matrizes de origem"". 
A paixão pela excelência manteve-se íntegra durante os cem anos da Candido Mendes, cujos intelectuais, que formam seu corpo de educadores, são por ela obstinados.
A Candido Mendes introduziu os primeiros cursos de Direito Público Econômico. Insistiu na Deontologia Jurídica e implantou o primeiro curso de Prática Forense — FUCAM, antes das práticas dos exames de ordem e ""das castrações uniformizadoras da OAB"".
	Por fim, cumpre trazer a lume, uma vez mais, o comentário do Magnífico Reitor Candido Mendes: ""Não temos um logotipo disseminado. Nem siglas descaracterizantes, nem relações públicas,  nem propaganda. Casa feroz na sua sede de liberdade; dos velhos, sem medo das aposentadorias compulsórias; da carreira didática, tratada com preferência e ineditismo, no Rio de Janeiro, à margem dos favores ou das benesses do dono. Casa da comunidade e não de ação-entre-amigos. Feroz nas suas crenças e na verdade intransitiva de uma paixão e de um donaire tão altivo como  pobre, no que damos, nesta faina e nesta obsessão, de Candido Mendes Sênior (1902-1939) e de Candido Mendes Júnior (1939-1962)"".
Esta Casa ouvirá ainda muitas homenagens à Candido Mendes, tanto deste orador quanto de Sua Magnificência o Reitor Candido Mendes. Verá os frutos da produção científica da instituição centenária que grandes homens tem ajudado a formar.
Muito obrigado. (Palmas)"
2002-06-12T11:36;ENCERRAMENTO, SESSÃO SOLENE, HOMENAGEM, CENTENÁRIO, UNIVERSIDADE PARTICULAR.;FALA DO PRESIDENTE OU NO EXERCÍCIO DA PRESIDÊNCIA;O SR. PRESIDENTE (Cesar Bandeira) – Antes de encerrar a sessão, quero agradecer a presença ao Reitor Candido Mendes, ao Presidente do Supremo Tribunal Federal, Ministro Marco Aurélio Mello, aos professores e aos demais convidados.
2002-08-27T19:26;"ANTHONY GAROTINHO, CANDIDATO, PRESIDÊNCIA DA REPÚBLICA, SUGESTÃO, PLEBISCITO, BASE MILITAR, MUNICÍPIO, ALCÂNTARA, MA, TRATADO, EUA, CRÍTICA.
CANDIDATURA, JOSÉ REINALDO, ELEIÇÕES, GOVERNO ESTADUAL, MA, APOIO.";COMUNICAÇÃO PARLAMENTAR;"O SR. CESAR BANDEIRA (PFL-MA. Sem revisão do orador.) - Sr. Presidente, Sras. e Srs. Deputados, assisti, recentemente, à entrevista do presidenciável Anthony Garotinho em que ele propunha um futuro plebiscito sobre o Centro de Lançamento de Alcântara, no Maranhão. Fiquei preocupado com a maneira pela qual o Sr. Anthony Garotinho quer obstruir a efetivação do CLA. Como Presidente da Comissão de Ciência e Tecnologia, no ano passado, lutei muito para aprimorar o primeiro acordo que chegou à Comissão, o Acordo Brasil/Estados Unidos, quando poderíamos melhorar com sugestões alguns artigos que podiam ferir a cidadania nacional. 
	Por situar-se em ponto estratégico, perto da linha do Equador, Alcântara tem fundamental importância para o lançamento de foguetes de alguns países que detêm tecnologia. 
	É claro que não podemos permitir o monopólio dos Estados Unidos no setor aeronáutico em nosso País e que a nossa soberania seja ferida. Não podemos aceitar, porém, que pessoas que não têm ligação com o Estado do Maranhão deturpem o grande projeto do Centro de Lançamento de Alcântara. 
	Quero fazer uma sugestão ao presidenciável Anthony Garotinho: em vez de preocupar-se com Alcântara, ele deveria preocupar-se com a violência no Rio de Janeiro, pois, na época em que foi Governador, não conseguiu sequer pôr as mãos no bandido Elias Maluco. E quantos Elias Malucos existem no Rio Janeiro?
	Deve haver um plebiscito? Sim, mas para que a população do Rio de Janeiro determine a necessidade de ajuda federal para extirpar de vez a violência naquele Estado. Isso, sim, seria um ponto fundamental na sua campanha presidencial, e não intrometer-se em assuntos que, primeiramente, não domina e, em segundo lugar, não lhe dizem respeito, porque ele nada tem a ver com o Maranhão.
Na segunda parte do meu discurso, Sr. Presidente, quero falar um pouco do meu Estado. O Maranhão, como todo o Brasil, está num processo de campanha eleitoral bem movimentado. Nós, da coligação O Maranhão Segue em Frente, estamos mostrando ao povo do Estado aquilo de que somos capazes e o que poderemos fazer para levá-lo ao grande destino de desenvolvimento e para apagar as lembranças das manchas que tentaram impor a grandes personagens da vida política do meu Estado.	
Temos como candidato ao Governo o Sr. José Reinaldo, ex-Ministro dos Transportes, ex-Parlamentar desta Casa, cidadão extremamente respeitado e competente, que tem levado à população esperança de melhores dias. 
	Antes de encerrar, quero registar que amanhã será feito grande comício no maior Município da região do Mearim, Bacabal, tão bem dirigido pelo grande Prefeito José Vieira. Lá estaremos juntamente com o Governador, pois temos eleitores em todos os vinte Municípios. Sendo Bacabal o maior Município da região, lá estaremos para dar a grande arrancada para chegarmos com José Reinaldo ao Governo. O Maranhão continuará sendo o grande Estado, não o dos sonhos, mas o da realidade, o da grande prosperidade.
	Era o que eu tinha a dizer."
2002-11-20T17:40;"LEGITIMIDADE, JOSÉ SARNEY,  SENADOR,  DISPUTA, INDICAÇÃO, CANDIDATO, PRESIDENTE, SENADO. 
GEDDEL VIEIRA LIMA, LÍDER, PARTIDO POLÍTICO, PMDB, CRÍTICA.";BREVES COMUNICAÇÕES;"O SR. CESAR BANDEIRA (PFL-MA. Sem revisão do orador.) - Sr. Presidente, Sras. e Srs. Deputados, venho a esta tribuna para protestar veementemente contra matéria atribuída ao Líder do PMDB nesta casa, Deputado Geddel Vieira Lima, publicada hoje pelo Correio Braziliense. São feitos ataques gratuitos à figura do ex-Presidente e atual Senador José Sarney, que atingem também toda a bancada do Maranhão. É um gesto mesquinho, impensado, próprio daqueles que não fazem política com responsabilidade.
No texto os fatos estão distorcidos. O Senador José Sarney, que também é do PMDB, está disputando legitimamente no partido sua indicação para concorrer à Presidência da Mesa do Senado.
Essa discussão é do âmbito do PMDB. Não cabem, em absoluto, agressões e reparos do Líder do PMDB. Isso jamais poderemos aceitar, ainda mais partindo desse Deputado, que não tem nenhuma condição de proferir essas acusações. O Deputado sabe perfeitamente por que estou dizendo isso.
Não vamos, Deputado, abrir polêmica com V.Exa., mas também não vamos correr se porventura isso acontecer. Temos representatividade nesta Casa pela bancada do Maranhão e sempre exercemos o mandato com lisura, com responsabilidade, nunca por meio das páginas de jornais. Ademais, acusações tão mesquinhas nunca foram atribuídas a qualquer um dos membros da bancada maranhense.
Sr. Presidente, deixo registrados os meus protestos. Vamos aguardar, porque nós da bancada do Maranhão não tememos agressões, principalmente vindas do Deputado Geddel Vieira Lima."
2002-12-18T10:26;"EFRAIM MORAIS, POSSE, PRESIDÊNCIA, MESA DIRETORA, CÂMARA DOS DEPUTADOS, CONGRATULAÇÕES.
MINISTRO DE ESTADO, MCT, DEFESA, REVISÃO, ACORDO DE INTERCÂMBIO CIENTÍFICO, BRASIL, EUA, UTILIZAÇÃO, CLA, CRÍTICA.";BREVES COMUNICAÇÕES;"O SR. CESAR BANDEIRA (PFL-MA. Sem revisão do orador.) – Sr. Presidente, antes de iniciar meu pronunciamento, parabenizo V.Exa. por ter assumido o cargo de Presidente desta Casa. Tenho certeza de que o desempenhará de maneira brilhante até o final desta Legislatura. 
	Sras. e Srs. Deputados, nós, do Maranhão, fomos surpreendidos por declaração atribuída ao Sr. Roberto Amaral, indicado para Ministro da Ciência e Tecnologia no Governo Lula. Na entrevista que concedeu à imprensa, o Sr. Roberto fez sérios reparos aos acordos em andamento, principalmente com os Estados Unidos, sobre o funcionamento do Centro de Lançamento de Alcântara — CLA.
	Como Presidente da Comissão de Ciência e Tecnologia, fizemos, no decorrer daquele exercício, várias audiências públicas e reuniões, em que ouvimos segmentos da sociedade, da área tecnológica e científica. Pois ficamos estarrecidos com o fato de esse cidadão, que não pertence à classe científica nem tecnológica, faz sérios reparos ao Centro de Lançamento de Alcântara, antes de tomar mais conhecimento e assumir o Ministério.
	O futuro Presidente tem dito que levará seu Ministério a diversas regiões do País. Aproveito para sugerir ao Presidente Lula que mande o Sr. Roberto Amaral visitar Alcântara, uma obra gigantesca, mas que se está transformando em elefante branco. Não podemos permitir que essa importante base de lançamento de foguetes deixe de funcionar.
	Tenho verificado, desde sua campanha, que o patrocinador do Sr. Roberto Amaral, o Governador Garotinho, faz restrições à base de Alcântara.
Fala-se também no relatório do eminente Deputado Waldir Pires, proferido na Comissão de Relações Exteriores. O referido trabalho, assim que chegou à Comissão de Ciência e Tecnologia, foi seguido da formação de uma comissão suprapartidária cujo objetivo era analisá-lo. Foi aproveitado quase na sua totalidade, votado e aprovado, e, no momento, encontra-se na Comissão de Constituição e Justiça e de Redação. Seria justo que esse relatório o mais rapidamente viesse ao plenário desta Casa, para que a maioria dos Srs. Parlamentares pudesse opinar a respeito. 
Nós, do Maranhão, não aceitaremos que um cidadão que vai assumir um cargo tão importante, como é o de Ministro da Ciência e Tecnologia deste País, antecipe reparos a uma base moderna de lançamento de foguetes como é a de Alcântara. A natureza  proporcionou condições favoráveis à região de Alcântara, para que os lançamentos de lá feitos sejam econômicos e tecnicamente adequados.
	Deixo aqui, Sr. Presidente, os nossos protestos. 
Esperamos, Dr. Hélio, que tais notícias não sejam verdadeiras. V.Exa. certamente compreende minha posição, pois muito me ajudou na Comissão de Ciência e Tecnologia em prol da adequação daquele importante acordo. Este trato abriu uma ampla porta, e já temos contatos para assinatura de outros acordos com a Austrália, a Ucrânia e outros países. 
Esperamos que novo Governo ajuste esse acordo com os Estados Unidos, assim como esteja atento às sugestões das Comissões de Relações Exteriores e de Ciência e Tecnologia, desta Casa, pois todas visam melhorá-lo. A nossa soberania deve ser preservada. 
Antes de encerrar o meu pronunciamento, solicito ao Presidente eleito que, após anunciar o futuro Ministro, sugira que ele visite a base de lançamento de foguetes de Alcântara, cujo objetivo é contribuir para o avanço tecnológico do Brasil."
