dataHoraInicio;keywords;tipoDiscurso;transcricao
2001-12-11T16:44;"ACORDO INTERNACIONAL, BRASIL, EUA, UTILIZAÇÃO, CLA.
PROJETO DE LEI, CRIAÇÃO, FDS, DESENVOLVIMENTO CIENTÍFICO, DESENVOLVIMENTO TECNOLÓGICO, ESTADO, MA, CONSELHO GESTOR, FISCALIZAÇÃO, EXECUÇÃO, PLANO DE APLICAÇÃO, RECURSOS, RECEITA, ARRECADAÇÃO, PRESTAÇÃO DE SERVIÇO, CLA.";PELA ORDEM;"O SR. CESAR BANDEIRA (Bloco/PFL-MA. Pela ordem. Sem revisão do orador.) - Sr. Presidente, Sras .e Srs. Deputados, em primeiro lugar, registro que hoje se comemora o Dia do Engenheiro, classe a que pertenço.
Presto minha homenagem aos engenheiros pelo seu dia e à turma de Engenharia de 1972 da Universidade Federal do Pará, da qual fiz parte.
Ocupo hoje a tribuna para dar conhecimento ao Plenário e ao Brasil do problema relacionado ao acordo assinado entre o Brasil e o Estados Unidos a respeito da utilização do Centro de Lançamento de Alcântara. Esse acordo tem causado grandes polêmicas nesta Casa e no País, principalmente no meu Estado, o Maranhão. 
Após ter sido aprovado com restrições pela Comissão de Relações Exteriores e de Defesa Nacional, o texto do acordo tramita agora na Comissão de Ciência e Tecnologia, Comunicação e Informática, da qual sou Presidente. 
Tomei a decisão de somente colocá-lo em apreciação após a votação de projeto de lei, de minha autoria, que cria o Fundo de Desenvolvimento Social, Científico e Tecnológico do Estado do Maranhão. Para que servirá esse fundo? Para geração de recursos para a pesquisa, a ciência, a tecnologia e a área social do meu Estado. 
	O meu Estado não pode mais assistir passivamente ao que vem ocorrendo nas últimas décadas: o trem da Companhia Vale do Rio Doce transporta minérios, álcool ou alumínio e a fumaça dos foguetes corta a Baia de São Marcos, mas os empreendimentos não geram recursos ao Maranhão. Isso muito nos preocupa, Sr. Presidente. Mas com o apoio que temos dos membros da Comissão, vamos votar, no próximo dia 19, a criação desse fundo de grande importância para a área social, Deputado Paulo Paim.
A comunidade do Município de Alcântara, há alguns anos, foi praticamente arrasada quando da implantação da base de lançamento de foguetes naquela localidade. As autoridades não tiveram o cuidado de fazer o deslocamento correto dos assentamentos daqueles brasileiros de cultura secular. Apenas foram transferidos para agrovilas, sem nenhuma preparação, o que acarretou grande problema social. Agora, o problema está sendo reparado, em parte, pelo Governo, após longa discussão travada em Comissão da Câmara dos Deputados e no âmbito do Governo do Estado. 
	Vamos colocar esse acordo em votação no dia 19 de dezembro. O Relator, Deputado José Rocha, do meu partido, o PFL, está produzindo o relatório, que será amplamente discutido. Não quero fazer prejulgamento, mas acredito na sensibilidade, na ética e na competência do Deputado José Rocha.
Deputado Neuton Lima, ilustre membro da nossa Comissão, creio que faremos modificações para que a soberania do País não seja usurpada e não sejamos coniventes com essas atitudes.
Pela minha ótica, o acordo não foi bem redigido e negociado; a Câmara dos Deputados e o Congresso Nacional não podem deixar de produzir um documento que vá ao encontro do desenvolvimento tecnológico do País e da soberania nacional. A Comissão de Ciência e Tecnologia, Comunicação e Informática e o Plenário têm essa responsabilidade.
Sr. Presidente, o projeto que cria o fundo tramita apenas nas Comissões de Ciência e Tecnologia, Comunicação e Informática e de Relações Exteriores e de Defesa Nacional. Penso que nem o Ministério nem o Governo serão contra o projeto; se forem, virei à tribuna, em uma, duas ou várias oportunidades, para denunciar e mostrar à população brasileira que o Maranhão está sendo discriminado.
Muito obrigado."
2001-12-18T16:36;PROJETO DE DECRETO LEGISLATIVO, SUSTAÇÃO, ACORDO INTERNACIONAL, PAÍS, BRASIL, PAÍS ESTRANGEIRO, EUA, SALVAGUARDA, PESQUISA TECNOLÓGICA, BASE, CLA, MUNICÍPIO, ALCÂNTARA, MA, PROIBIÇÃO, EXECUÇÃO ORÇAMENTÁRIA, PROJETO, PROGRAMA, LANÇAMENTO AEROESPACIAL, SATÉLITE, CRÍTICA.;COMUNICAÇÃO PARLAMENTAR;"O SR. CESAR BANDEIRA (Bloco/PFL-MA. Como Líder. Sem revisão do orador.) - Sr. Presidente, depois de longa espera, ocupo a tribuna da Câmara dos Deputados para, em nome da Comissão de Ciência e Tecnologia, Comunicação e Informática, da qual sou Presidente, protestar veementemente contra o que se propõe no Projeto de Decreto Legislativo nº 1.572, de 2001, do eminente Deputado Waldir Pires, do PT da Bahia.
	Foi enviado a esta Casa o acordo celebrado entre o Brasil e os Estados Unidos para lançamento de foguetes no Centro de Lançamento de Alcântara. O texto do acordo chegou à Comissão de Relações Exteriores em 8 de maio de 2001, e no mesmo dia foi distribuído ao Deputado Waldir Pires, Relator da matéria. Em 20 de agosto, o primeiro parecer do Relator foi apresentado, e houve pedidos de vista por parte de diversos Parlamentares. No dia 30 de outubro foi apresentado o novo parecer do Relator, parecer esse que foi votado e aprovado. Com isso, Sr. Presidente, passaram-se seis meses desde a chegada da matéria à Casa. 
	Em 6 de novembro o projeto foi enviado à Comissão de Ciência e Tecnologia. Imediatamente constituí Subcomissão para examiná-lo, e no dia 21 de novembro designei um Relator para emitir parecer sobre ele. No dia 12 de dezembro já estava pronto o relatório. 
	Sr. Presidente, o Projeto de Lei nº 5.808, que elaborei, propõe a criação do Fundo do Desenvolvimento Social, Científico e Tecnológico do Estado do Maranhão. Com isso, efetivamente, abrem-se não só as portas do Centro de Lançamento de Alcântara, mas acima de tudo a perspectiva de crescimento tecnológico e científico do Estado do Maranhão. 
O Deputado José Rocha, do PFL da Bahia, passou menos de doze dias para proferir seu relatório, mas o outro Relator, infelizmente, levou seis meses. Acredito que ambos tenham enfrentado dificuldades, por questões regimentais, mas não se justifica essa demora. Se existe culpa, é da Comissão de Relações Exteriores e do Relator, e não do Maranhão, que não pode pagar por isso. 
Não acredito que a Casa aprove projeto de decreto legislativo proibindo a destinação de recursos para o Centro de Lançamento de Alcântara. Ora, Alcântara, como todos sabem, é um privilégio da natureza, passa perto da linha do Equador e deve ser a única base no mundo a oferecer condições excepcionais para lançamento de foguetes.
	O Sr. Benito Gama - Deputado Cesar Bandeira, permite-me V.Exa. um aparte?
	O SR. CESAR BANDEIRA - Com todo o prazer.
	O Sr. Benito Gama - Deputado Cesar Bandeira, ouço-o com muita atenção, e quero dar o testemunho de que V.Exa., na Presidência da Comissão de Ciência e Tecnologia, Comunicação e Informática da Câmara dos Deputados, tem sido um defensor intransigente dos interesses do País, sobretudo do Nordeste e do Maranhão. V.Exa., um dos Deputados mais experientes do Congresso Nacional, com atuação exemplar e permanente, é um guerreiro. Sou membro da Comissão de Ciência e Tecnologia, Comunicação e Informática, presidida por V.Exa. com tanta competência e dedicação.	O Brasil está no radar do mundo, evidentemente, por vários fatos positivos. Felizmente, já se foi o tempo em que só eram apresentadas as questões negativas do Brasil. Todos os países, é claro, têm pontos positivos e negativos, mas se o Brasil tem pontos positivos para mostrar ao mundo, sem dúvida alguma o mais significativo deles é a base de Alcântara, no Maranhão, sua terra natal. Realmente, todos os países, quando vão discutir tecnologia, citam sempre o Centro de Lançamentos de Alcântara. Quero, Deputado Cesar Bandeira, congratular-me com V.Exa. pela defesa intransigente dos interesses não somente de seu Estado, porque, ao defender esse projeto, V.Exa. defende também o País. O Ministro Ronaldo Sardenberg também tem feito um trabalho fantástico para que realmente as coisas aconteçam com a velocidade necessária. Deputado Cesar Bandeira, sou testemunha, na Comissão de Ciência e Tecnologia, da sua luta. Evidentemente, V.Exa. pode contar com o PMDB do Estado da Bahia para ajudar nesse projeto que ora implementa.
	O SR. CESAR BANDEIRA - Agradeço ao Deputado Benito Gama as palavras, que muito engrandecem meu pronunciamento. Aproveitando seu aparte, gostaria de fazer-lhe uma pergunta. A Ford, uma empresa americana, foi para a Bahia, onde gerou emprego e renda. V.Exa. era Secretário de Indústria e Comércio do Estado à época e deve ter conhecimento dos fatos. Pergunto: houve algum decreto legislativo impedindo a construção da Ford na Bahia? 
	O Sr. Benito Gama - Com a aquiescência do Sr. Presidente, respondo a V.Exa. que a Ford, localizada na Bahia, sem dúvida alguma é hoje o maior projeto industrial do Nordeste. E V.Exa. acompanhou bem de perto a nossa luta como Secretário da Indústria e do Comércio.
	O SR. CESAR BANDEIRA - Com o apoio de toda esta Casa, principalmente da bancada do Maranhão.
	O Sr. Benito Gama - Com o apoio da Casa e da bancada do Nordeste. E é o momento de nos unirmos também em prol do Maranhão e do projeto de Alcântara, para que ele se realize com maior velocidade e beneficie o Estado do Maranhão, o Nordeste e o Brasil. Evidentemente, não houve realmente nenhuma tentativa de, por decreto, barrar ou atrapalhar a Ford, que felizmente está funcionando na Bahia, fabricando novos automóveis.
	O SR. CESAR BANDEIRA - Agradeço a V.Exa. 
Ouço com prazer o aparte do Deputado Márcio Reinaldo Moreira.
	O Sr. Márcio Reinaldo Moreira - Deputado Cesar Bandeira, também quero externar minha solidariedade a V.Exa. Sou testemunha do trabalho forte, concreto e decidido de V.Exa. à frente da Comissão de Ciência e Tecnologia, inclusive na busca da solução desse problema que está sendo tão bem descrito, o problema da divisão das tarefas, do efetivo atropelamento na tramitação dos projetos. V.Exa. merece todo o nosso respeito. Como membro daquela Comissão, quero hipotecar-lhe, em nome do Partido Progressista Brasileiro, total apoio e solidariedade.
	O SR. CESAR BANDEIRA - Agradeço a V.Exa., nobre Deputado. Fico muito satisfeito ao ver que o Estado de Minas Gerais apóia o Maranhão, um Estado bastante pobre, que ainda precisa crescer muito.
	Ouço o nobre Deputado Marcelo Barbieri.
	O Sr. Marcelo Barbieri - Nobre Deputado Cesar Bandeira, aproveito a oportunidade para registrar a alta produtividade da Comissão de Ciência e Tecnologia, Comunicação e Informática da Câmara dos Deputados, conduzida por V.Exa. com absoluta correção, total transparência e evidente boa vontade na defesa dos interesses maiores da comunicação brasileira e do povo deste País. V.Exa. trata hoje de uma matéria que lhe é muito cara, pois diz respeito aos interesses do seu Estado: a base de Alcântara, que é sobremaneira importante para o desenvolvimento do Maranhão. V.Exa. conduziu-se à frente daquela Comissão sempre pensando alto, sempre transcendendo as questões regionais, sempre cuidando, sim, dos interesses maiores da Nação, sem abrir mão da defesa do Estado que há tantos anos representa nesta Casa com dignidade e altivez. Congratulo-me com V.Exa. e cumprimento-o pela feliz gestão que realiza à frente da Comissão de Ciência e Tecnologia, Comunicação e Informática. Parabéns.
	O SR. CESAR BANDEIRA - Nobre Deputado Marcelo Barbieri, agradeço-lhe o aparte. V.Exa. é testemunha de que, quando assumi a Presidência daquela Comissão, o primeiro ato que realizei foi abolir o partidarismo que então reinava ali. Nela não existem mais partidos políticos, mas sim Deputados com vontade de trabalhar pelo País e de acertar. Fui feliz, Deputado Marcelo Barbieri, naquela decisão, que se tornou o grande trunfo para realizarmos o trabalho em conjunto. E V.Exa., que também faz parte da Comissão, também nunca se valeu de discriminações. Se assim tivesse agido, talvez não tivéssemos alcançado tanto êxito.
	O Sr. Dr. Hélio - Nobre Deputado Cesar Bandeira, concede-me V.Exa. um aparte?
	O SR. PRESIDENTE (Themístocles Sampaio) - Deputado Cesar Bandeira, V.Exa. já concedeu apartes por dois minutos. Sei que ainda há Deputados solicitando apartes, mas V.Exa. já não dispõe de tempo.
	O SR. CESAR BANDEIRA - Sr. Presidente, gostaria que V.Exa. me devolvesse o tempo que esperei para falar.
	O SR. PRESIDENTE (Themístocles Sampaio) - Deputado, V.Exa. insiste nesse ponto, mas o fato é que V.Exa. não estava em plenário e fizemos um arranjo para que pudesse falar. Portanto, não reclame; fale comigo em particular e vou explicar-lhe o que for necessário.
	V.Exa. tem um minuto para concluir sua fala.
	O SR. CESAR BANDEIRA - Sr. Presidente, peço um minuto para o Deputado Dr. Hélio e dois minutos para mim.
	Ouço com prazer o nobre Deputado Dr. Hélio.
	O Sr. Dr. Hélio - Deputado Cesar Bandeira, trinta segundos bastam para dizer que V.Exa presidiu de forma altiva a Comissão de Ciência e Tecnologia, sem se importar com partidos de situação ou de oposição, elevando todos os trabalhos lá desenvolvidos. V.Exa. levou para aquela Comissão o exame e a aprovação das rádios comunitárias quando sabia que, naquela ocasião, a matéria estava passando para o Ministério das Comunicações, o que esvaziava a nossa competência. V.Exa. tomou essa grande iniciativa e muitas outras. Quero, portanto, deixar aqui registrado que V.Exa. soube honrar o papel de Presidente, desempenhando-o suprapartidariamente.
	O SR. CESAR BANDEIRA - Agradeço ao Deputado Dr. Hélio o aparte e ao Presidente da Mesa a benevolência. 
	Quero dizer aos Srs. Deputados, ao Maranhão e ao Brasil que não poderemos de maneira alguma aceitar discriminações partidárias. 
Não acredito que esse projeto tenha o apoio do partido do autor. Acredito, sim, que o autor não quer ver o Maranhão na era espacial.
Agradeço a todos a atenção."
2002-02-19T16:26;ACORDO INTERNACIONAL, EUA, UTILIZAÇÃO, CLA, MA, CRÍTICA.;PELA ORDEM;"O SR. CESAR BANDEIRA (Bloco/PFL-MA. Pela ordem. Sem revisão do orador.) -  Sr. Presidente, Sras. e Srs. Deputados, assomo mais vez à tribuna desta Casa para falar sobre o acordo Brasil-Estados Unidos, referente ao uso do Centro de Lançamento de Alcântara.
	Durante o tempo em que fui Presidente da Comissão de Ciência e Tecnologia, procurei dignificar o cargo que exercia com independência, mostrando acima de tudo que o Parlamentar, mesmo partidário, tem de ter independência nas ações desta Casa. 
	Recentemente o Governo Fernando Henrique viajou ao Leste Europeu, visitando a Rússia e Ucrânia. Na ocasião — sabe-se através da imprensa — foram assinadas com a Ucrânia intenções ou acordos para o uso da Base de Alcântara. Tenho vários questionamentos a fazer. 
Não fui convidado, como Presidente da Comissão, e nenhum membro da Comissão o foi, para acompanhar a delegação a Alcântara. Considerei que o Ministro da Ciência e Tecnologia deve ter influenciado o Sr. Presidente da República, atitude mesquinha em relação a um Parlamentar aliado. 
Deselegância maior, Sr. Presidente, foi o fato de eu ser Parlamentar do Maranhão e Presidente da Comissão. Acredito ter sido uma represália em função de eu não haver concordado com a mudança do relatório do Deputado José Rocha quando fui chamado ao gabinete do Ministro Arthur Virgílio. Naquela ocasião, encontrei o Sr. Ministro Sardenberg e sua equipe e senti que queriam que eu fosse traidor da minha Comissão. Reagi, e por causa dessa reação veio esse acontecimento desagradável que chocou não só o Deputado, mas o Estado do Maranhão. Essa discriminação acredito partir também da conjuntura política nacional em que a candidata Roseana Sarney, do meu Estado e do meu partido, desponta nas pesquisas e ameaça grandemente as pretensões da continuidade do Governo. 
Sr. Presidente, nem eu nem meu Estado serviremos de pretexto para retaliações. Basta a que sofremos quando nenhuma emenda do Maranhão foi liberada pelo Ministério da Saúde. 
	Por falar em Ministério da Saúde, o Brasil inteiro está assistindo à epidemia que se está alastrando pelos Estados, preocupando o povo brasileiro. Quanto a isso, sim, deveriam ser tomadas providências.
	Deixarei a Presidência da Comissão porque o mandato está terminando, mas saio com a consciência tranqüila do dever cumprido, com a consciência de quem, mesmo fazendo parte da base do Governo, no seu currículo não tem as palavras traição, subserviência e vontade de adular o poder.
	 Vou continuar minha trajetória política de cinco mandatos, sendo três de Deputado Federal e dois de Deputado Estadual, com votações crescentes no meu Estado. Acredito que aqui estarei na próxima Legislatura, porque essa é a vontade do povo do Maranhão, e com muito mais votos do que na Legislatura passada.
Não só aqui como no meu Estado, minha posição tem sido de lealdade, de responsabilidade e não de subserviência e de covardia.
Deixo registrado meu protesto. Saiba, Sr. Ministro Sardenberg, que V.Exa. não encontrou no Presidente da Comissão um subserviente, e sim um Parlamentar voltado para os grandes interesses desta Nação, necessários ao desenvolvimento do povo brasileiro.
Meu muito obrigado e até outra oportunidade, Sr. Presidente!
O SR. PRESIDENTE (Aécio Neves) – É um prazer ouvir V.Exa., Deputado Cesar Bandeira."
2002-02-27T15:46;ROSEANA SARNEY, INOCÊNCIO OLIVEIRA, PARTIDO POLÍTICO, PFL, CRÍTICA, DECISÃO, TSE, CONDICIONAMENTO, COLIGAÇÃO PARTIDÁRIA, ELEIÇÕES, ÂMBITO ESTADUAL, ÂMBITO NACIONAL, AGÊNCIA DE NOTÍCIAS.;PELA ORDEM;"O SR. CESAR BANDEIRA (PFL-MA. Pela ordem. Sem revisão do orador.) – Sr. Presidente, trago à Casa nota divulgada pela Agência Estado a respeito da decisão do Tribunal Superior Eleitoral sobre a verticalização das coligações.
	Diz a nota:
A Governadora Roseana Sarney, pré-candidata do PFL à sucessão presidencial, reagiu com indignação à decisão do TSE que vinculou as coligações estaduais à federal. Segundo sua assessoria de imprensa, Roseana considerou a decisão  um 'casuísmo inadmissível, só comparado ao voto vinculado de 1982 e ao Pacote de Abril (de 1978, quando foi criada a figura do senador biônico para impedir a derrota do Governo para a oposição)"". O Líder do PFL, Inocêncio Oliveira, disse que a decisão agride a democracia, pois atropela o processo eleitoral em curso. Ele reafirmou que o PFL não pensa em tomar qualquer atitude contra decisão do tribunal. 
	Era o que tinha a dizer, Sr. Presidente."
