dataHoraInicio;keywords;tipoDiscurso;transcricao
1999-03-10T00:00;"CURSO DE FORMAÇÃO, FORMAÇÃO PROFISSIONAL, DESENHO INDUSTRIAL, 
INDUSTRIA AUTOMOBILISTICA, (MG). 
HOMENAGEM, MEDICO, (MG), OFTALMOLOGIA, CIRURGIA, REABILITAÇÃO, 
VISÃO.";PEQUENO EXPEDIENTE;
1999-06-10T00:00;ELOGIO, RELATÓRIO DE ATIVIDADES, ENSINO, PESQUISA, ASSISTÊNCIA, EXTENSÃO UNIVERSITÁRIA, UNIVERSIDADE ESTADUAL, MONTES CLARO, MG.;PEQUENO EXPEDIENTE;
2000-12-12T15:08;"ANIVERSÁRIO DE FUNDAÇÃO, (CODEVASF), ERASMO JOSÉ DE ALMEIDA, ELISEU ROBERTO ANDRADE ALVES, EX PRESIDENTE, AIRSON BEZERRA LÓCIO, PRESIDENTE, ELOGIO, ADMINISTRAÇÃO,  DESENVOLVIMENTO ECONOMICO, REGIÃO SEMI ARIDA, FRUTICULTURA, TECNOLOGIA, IRRIGAÇÃO, APOIO, EXPORTAÇÃO. 

CLEMENTINO COELHO, DEPUTADO FEDERAL, ,";PEQUENO EXPEDIENTE;"O SR. FERNANDO DINIZ (PMDB-MG. Pronuncia o seguinte discurso.) - Sr. Presidente, Sras. e Srs. Deputados, em agosto do último ano, esta Câmara realizou sessão para prestar justa homenagem aos 25 anos de criação da Companhia de Desenvolvimento do Vale do São Francisco — CODEVASF, atendendo a requerimento de autoria do nobre Deputado José Rocha.
Digo justa porque, melhor que qualquer outra instituição que atua no Nordeste, a CODEVASF, com a implantação de seus projetos de irrigação, mostrou o caminho do desenvolvimento do semi-árido brasileiro, tornando prósperas muitas áreas até então desérticas, incapazes de proporcionar razoável colheita mesmo de feijão e milho quando plantados em regime de sequeiro. 
Gerando riqueza, sem abandonar o social, a CODEVASF vem dando exemplo de como devem ser aplicados os recursos públicos.
Durante seus 27 anos de existência, essa empresa tem proporcionado oportunidades de mudanças no quadro de subdesenvolvimento daquela região, com alterações significativas no perfil socioeconômico, gerando emprego e renda, possibilitando o acesso da população a novas tecnologias, estimulando investimentos da iniciativa privada, enfim, promovendo o desenvolvimento.
O Deputado Clementino Coelho, representante nesta Casa do próspero Município de Petrolina e outros adjacentes, foi muito feliz em sua fala naquela sessão quando disse: 
A CODEVASF continua transformando, via treinamento e extensão rural, homens descrentes, batidos por seguidas secas, em agricultores profissionais, presos à terra que lhes dá o sustento com dignidade. A CODEVASF introduziu no semi-árido brasileiro o conceito e a prática da agricultura de mercado, competitiva, com elevada incorporação tecnológica e com alto valor agregado dos seus produtos, em boa parte destinados à exportação.
A fruticultura irrigada no Vale do São Francisco já é uma realidade e tem sido tão importante para o País que mereceu lugar de relevo no ""Avança Brasil"" sob a forma do Programa de Apoio ao Desenvolvimento da Fruticultura Irrigada do Nordeste e do Programa Especial de Exportação — PEE.
A CODEVASF tem levado a tecnologia da irrigação a todo o Vale do São Francisco, principalmente à porção mais árida, onde não é possível praticar, com eficiência, agricultura de sequeiro.
Entre as áreas irrigadas mais desenvolvidas, apresenta-se o pólo Petrolina/Juazeiro, com uma área irrigada de cerca de 100 mil hectares. Trata-se de área pioneira no desenvolvimento da irrigação e, em particular, da fruticultura irrigada — uva, manga, goiaba, melão, melancia, todas essas frutas excepcionalmente saborosas. 
Além dos seis projetos de irrigação implantados na área mencionada, a  CODEVASF está construindo o Salitre (29 mil hectares), em Juazeiro, e o Pontal (8 mil hectares), em Petrolina. 
Em seguida, vem o pólo Norte de Minas, com os projetos Pirapora, Gurutuba e Jaíba. Este último, quando todos os 60 mil hectares estiverem implantados, vai abrigar população estimada em mais de 150 mil pessoas. Na área em questão, predominam as culturas de banana, uva, manga e outras frutas de clima tropical.
O Município de Barreiras, Bahia, vem se transformando em importante pólo de irrigação com os projetos Rio Grande, Nupeba e Barreiras Norte, com cerca de 8 mil hectares no total. O mesmo acontece no Rio Corrente, com os projetos Formoso A e H.
No Baixo São Francisco, nos Estados de Alagoas e Sergipe, o aproveitamento das várzeas foi feito com a cultura do arroz e a piscicultura. A CODEVASF tem também apoiado financeiramente a irrigação das terras altas implementada pelo Governo do Estado de Sergipe.
Todo esse sucesso alcançado pela CODEVASF deve ser debitado, em primeiro lugar, à dedicação dos seus empregados, profissionais capacitados e com alto espírito público, e, em segundo lugar, às administrações que se sucederam no comando da empresa. Em 27 anos, a CODEVASF teve apenas cinco presidentes e continuidade administrativa. Destes, cabe enaltecer: o Dr. Erasmo José de Almeida, que impulsionou as obras de irrigação; o Dr. Eliseu Roberto Andrade Alves, que deu prioridade ao aumento da produtividade das culturas e negociou recursos externos que permitiram a implantação de cerca de 60 mil hectares irrigados nos últimos dez anos; e o Presidente atual, Dr. Airson Bezerra Lócio, sertanejo de origem, estudioso do semi-árido e que teve o grande mérito de consolidar a privatização dos projetos, acabando com o paternalismo público então existente. É bom que se saiba que todos os projetos de irrigação da CODEVASF são administrados pelos próprios usuários das áreas irrigadas. 
Para concluir, Sr. Presidente, Sras. e Srs. Deputados,  vale observar que a CODEVASF tem sido feliz também pela localização de sua sede: em Brasília, perto do poder decisório, perto desta Casa, perto do Ministério da Integração, perto do Ministério do Planejamento e de outros órgãos igualmente fundamentais para a solução das questões de seu interesse.
Cogita-se hoje a transferência da sede da empresa para Petrolina, em Pernambuco, ou Juazeiro, na Bahia. Quero registrar o meu repúdio a tal idéia. A sede da CODEVASF deve continuar no Distrito Federal, território politicamente neutro, sob pena de, uma vez localizado em qualquer Município do Vale, vir a se transformar em órgão municipal, mero departamento das Prefeituras desses Municípios.
Era o que tinha a dizer. Muito obrigado, Sr. Presidente."
2002-02-20T17:50;RIO SÃO FRANCISCO, HIDROVIA, PRECARIEDADE, PRODUÇÃO, ESCOAMENTO, REGIÃO NORDESTE, REDUÇÃO, TRANSPORTE RODOVIÁRIO, PRIORIDADE, CRÍTICA, FRANAVE, PRIVATIZAÇÃO, INEFICÁCIA, CRÍTICA.;BREVES COMUNICAÇÕES;"O SR. FERNANDO DINIZ (PMDB-MG. Pronuncia o seguinte discurso.) - Sr. Presidente, Sras. e Srs. Deputados, até meados da década de 50, a navegação pelo Médio Rio São Francisco constituiu-se no principal, às vezes único, meio de ligação entre as Regiões Sudeste e Nordeste do Brasil.
Porém, com a ênfase dada, a partir de então, ao transporte rodoviário e sem a manutenção de condições operacionais para embarcações de maior porte, iniciou-se um processo de decadência progressiva. Como resultado, nosso País está perdendo uma hidrovia de quase 1.400 quilômetros de extensão, que vai de Pirapora, em Minas Gerais, até Juazeiro, na Bahia.
Atualmente, quando estamos reavaliando profundamente nossas políticas de transportes, buscando combinar os vários modais de forma mais econômica, de acordo com o desenvolvimento e a produção de cada região, está ocorrendo processo inverso com a navegação do São Francisco.
A degradação da Hidrovia do São Francisco é incoerente com o forte crescimento da demanda por transportes de regiões como o oeste da Bahia, que vêm-se transformando rapidamente em alguns dos maiores celeiros do País.
Quase toda a produção de grãos dessas regiões, como soja, milho e seus derivados, é destinada ao mercado nordestino, principalmente da Bahia, Pernambuco, Ceará, Sergipe e Alagoas. A via natural de escoamento dessa produção, já em torno de 2,5 milhões de toneladas por ano, é o Rio São Francisco.
Atualmente, a capacidade nominal de transporte de granéis pela Hidrovia do São Francisco é da ordem de 250 mil toneladas por ano, limitada pela frota útil da Companhia de Navegação do São Francisco — FRANAVE , com seis empurradores e sessenta chatas operando no percurso entre Ibotirama e Juazeiro. Além de poucas, essas embarcações estão com idade média de trinta anos, período em que não houve novas aquisições, nem melhoramentos para torná-las mais eficientes.
Há, portanto, uma demanda reprimida de pelo menos 2 milhões de toneladas por ano, que vem sendo transportada em caminhões, destruindo as rodovias, incrementando os acidentes rodoviários, impactando o meio ambiente e tomando os produtos transportados muito mais caros ao consumidor final e à exportação. São fatores importantes de aumento do Custo Brasil.
Dos vários problemas que impedem a utilização de todo o potencial da Hidrovia do São Francisco, destacamos:
- o tamanho reduzido e o envelhecimento da frota de embarcações;
- a situação da calha do rio, que, devido ao assoreamento, à redução da vazão mínima e à inexistência de trabalhos contínuos e sistemáticos de dragagem e sinalização, não oferece condições de segurança e confiabilidade capazes de atrair investimentos de armadores privados;
- a precariedade da infra-estrutura portuária, que impede a integração da hidrovia com os modais rodoviário e ferroviário de transporte.
Atualmente, apenas os portos de Ibotirama, na Bahia, e de Pirapora, em Minas Gerais, possuem instalações apropriadas para a movimentação de grãos. No caso de Ibotirama, graças a investimentos privados realizados a partir do ano 2000.
Os portos de Juazeiro e Petrolina, justamente no final da hidrovia, onde é feita a conexão com os modos rodoviário e ferroviário, não têm infra-estrutura,  nem equipamentos adequados à movimentação graneleira, gerando tempos de espera excessivos para os comboios e, em conseqüência, anulando os benefícios da redução dos custos de transporte proporcionados pela hidrovia.
Nos últimos tempos, a gestão da FRANAVE dedicou-se integralmente à sua desestatização ou à transferência de suas atividades operacionais para empresas privadas.
Para isso, foram tomadas medidas de curto prazo, visando reduzir custos administrativos. Foram implementados dois programas de demissão voluntária de funcionários e a passagem de parte da mão-de-obra operacional para a iniciativa privada. Foi desativado o porto fluvial de Juazeiro e, conseqüentemente, foram cortados os custos de administração da gerência da empresa naquela cidade.
Para incrementar sua receita, a FRANAVE retomou as operações de transporte, conquistando novos clientes, entre os quais alguns dos maiores compradores de grãos do País, como Cargill, Ceval, Serrote Redondo e Caramuru Alimentos, este último quase que usuário cativo da hidrovia.
Mesmo sem aumentar ou modernizar seus equipamentos, a FRANAVE melhorou significativamente seu desempenho financeiro. Todavia, não obteve balanços positivos, pois as condições de sua frota e da hidrovia em que opera, aliadas às imposições da política econômica adotada pelo Governo Federal, não têm permitido que ela avance em termos de eficácia e eficiência.
Ressalte-se que, desde 1992, quando a empresa foi incluída no processo de privatização, nenhum investimento novo foi realizado, mantendo-se obsoleta e em precárias condições operacionais toda a sua frota e a maior parte das instalações portuárias.
Recentemente, foi elaborada a modelagem para alienação do controle acionário da FRANAVE, mediante a venda de suas ações em bolsa de valores. No entanto, o processo de venda frustrou-se, em decorrência do seu elevado passivo trabalhista. Em seguida, por determinação do Conselho Nacional de Desestatização — CND, foi tentada a venda, por meio de licitação, de suas embarcações, também sem sucesso, dadas as más condições destas e da hidrovia.
Apesar de todas essas frustrações, a diretoria da FRANAVE tem feito o possível para manter a prestação de seus serviços. Atendendo às diretrizes de transferência de suas atividades à iniciativa privada, a empresa afretou quatro de seus comboios à empresa Caramuru Alimentos, a qual passou, a partir de maio de 2001, a assumir toda a operação dos mesmos.
Esses fatos mostram claramente que estamos deixando morrer a Hidrovia do São Francisco, justo no momento em que o vertiginoso crescimento da produção agrícola da bacia desse grande rio, especialmente do oeste baiano, mais precisa dela.
Lembramos que o Governo do Presidente Fernando Henrique Cardoso colocou a Hidrovia do São Francisco, integrada a outros meios de transportes, formando o ""Corredor São Francisco"", no Programa Avança Brasil, ou seja, no conjunto de prioridades de investimentos considerados essenciais para todo o País. No entanto, essa prioridade não se fez ainda sentir por atos concretos.
E necessário que a Hidrovia do São Francisco receba investimentos para melhoria em toda sua infra-estrutura, desde a manutenção de seu canal navegável, passando pela ampliação e modernização das instalações portuárias, até o incentivo à modernização das frotas que nela operam.
Para se tornar realmente competitiva, a hidrovia deve permitir a navegação com calado mínimo de dois metros e meio no trecho entre Ibotirama e Juazeiro, admitindo comboios com até 4 mil toneladas por viagem.
O trecho restante, entre Pirapora e lbotirama, poderá continuar com o calado atual, de até 1,2 metro, até que o incremento da demanda de carga justifique seu aprofundamento. No entanto, todo o trecho navegável deve ser mantido em condições adequadas de tráfego, por meio de operações de dragagem para remoção de bancos de areia e de entulhos.
Os portos de Pirapora e de Juazeiro—Petrolina necessitam de investimentos em equipamentos para movimentação de grãos e em silos, para que haja a eficiente e rápida integração com os modais rodoviário e ferroviário de transporte.
A atual frota da FRANAVE necessita de investimentos para sua modernização e ampliação. De imediato, é necessária a substituição dos motores dos empurrados por outros mais potentes e a construção de chatas com maior capacidade de carga, mais adequadas à demanda de transporte graneleiro.
Para estimular a participação de capital privado, o Ministério dos Transportes precisa iniciar o processo de outorga de autorizações para operação de novas empresas de navegação na Hidrovia do São Francisco, estimulando a concorrência e, conseqüentemente, a melhoria da qualidade, a expansão e o barateamento dos custos de transporte.
É necessária a ação do Poder Público, em especial do Ministério dos Transportes, para criar condições efetivas de integração dos modais rodoviário, hidroviário e ferroviário de transporte, valorizando a logística do sistema multimodal, especialmente nos portos de Juazeiro—Petrolina, de Ibotirama e Pirapora.
Para que essas condições ocorram, é fundamental a soma e compatibilização dos esforços do Governo Federal com os dos Governos dos Estados de Minas Gerais, Pernambuco e Bahia, de forma a levar em conta programas de expansão da produção agrícola e industrial e integrar os planos de melhoria da hidrovia com os projetos de implantação da Ferrovia Transnordestina e Unaí—Pirapora, entre outros.
Sem um esforço do Poder Público, sem o empenho efetivo do Ministério dos Transportes, com o total apoio do Presidente da República, corremos o sério risco de a navegação pelo Rio São Francisco virar apenas fato histórico, coisa do passado, sem que possamos usufruir de todo o seu potencial para o desenvolvimento e a melhoria da qualidade de vida da população de uma vasta região deste nosso Brasil."
