dataHoraInicio;keywords;tipoDiscurso;transcricao
2002-05-20T15:26;"GDF, FINANÇAS PÚBLICAS, FINANCIAMENTO EXTERNO, BID, SANEAMENTO, BRB, METRÔ, OBRA PÚBLICA, INFRA ESTRUTURA, POLÍTICA SOCIAL, SAÚDE PÚBLICA, EDUCAÇÃO, PROGRAMA, ASSISTÊNCIA SOCIAL, COMBATE, FOME, CRIAÇÃO, EMPREGO, INCENTIVO, INSTALAÇÃO, EMPRESA, PRODUÇÃO, EXPORTAÇÃO, MEIO AMBIENTE, TRÂNSITO, TURISMO, CULTURA, SEGURANÇA PÚBLICA, EFICÁCIA.
PARTIDO POLÍTICO, PT, CRÍTICA.";GRANDE EXPEDIENTE;"O SR. TADEU FILIPPELLI (PMDB-DF. Pronuncia o seguinte discurso.) - Sr. Presidente, Sras. e Srs. Deputados, em primeiro lugar, gostaria de agradecer a oportunidade que estou tendo neste dia de dirigir-me aos nobres colegas e, ao mesmo tempo, ao povo de Brasília e à Nação. Falar da tribuna desta Casa é sempre uma honra e uma emoção muito grande e, também, uma oportunidade a mais para prestarmos contas de nossas realizações à sociedade e ao povo que nos elegeu.
	Dois eventos importantes, cada um a seu modo e na sua dimensão própria, vão marcar este ano de 2002: os jogos da Copa do Mundo da Coréia e do Japão, onde teremos mais uma participação de nosso escrete, e as eleições, em diversos níveis, no dia 6 de outubro, quando todos nós estaremos ou disputando algum cargo, ou apoiando candidatos, ou defendendo nosso partido político, princípios e idéias.
	No Distrito Federal não é nem poderia ser diferente. Os torcedores mais entusiasmados já se apresentam com a camisa da Seleção Brasileira e bandeiras nacionais. Ao mesmo tempo, políticos pré-candidatos às eleições de outubro já esquentam seus discursos e começam a apresentar armas. Muitos desses pré-candidatos, políticos de oposição ao atual Governo do Distrito Federal, estiveram ausentes, reclusos e silenciosos durante o período de três anos e quatro meses, provavelmente porque não tinham propostas concretas e viáveis para apresentar à sociedade brasiliense ou, talvez ainda, porque foram Governo no quadriênio anterior e não souberam ou não tiveram capacidade para apresentar soluções para os problemas que afligem a sociedade moderna.
Agora, sim, é o momento ideal para que eles se apresentem com soluções mirabolantes e com críticas, na maioria das vezes, irresponsáveis e fantasiosas ao Governo local, provavelmente, por acreditarem que o povo brasiliense, imbuído pelo espírito de campeonato mundial, estará suscetível a digerir as falsidades que estão sendo proferidas em discursos e entrevistas a jornais, rádios e televisões.
	Sr. Presidente, Sras. e Srs. Deputados, as diferenças entre a atual administração do Governador Roriz e a do PT, que governou Brasília de 1995 a 1998, são gritantes e facilmente perceptíveis para todos os moradores do Distrito Federal, e podem ser constatadas nos altos índices de aprovação do atual Governo, em avaliações de desempenho feitas pelos mais diversos institutos de pesquisas de opinião pública. Mas esqueçamos as pesquisas, até porque, como dizem os analistas da matéria, elas refletem apenas determinado momento, embora esse instante, essa fotografia, digamos assim, tenha sido registrada em diversas ocasiões do Governo Roriz, desde o seu primeiro ano.
Passemos aos fatos, porque são eles que importam. Quando recebemos o Governo, em janeiro de 1999, deparamo-nos com situação extremamente delicada. Herdamos uma dívida de 350 milhões de reais com fornecedores e de mais de 1 bilhão de reais com o Governo Federal. Como se recusava a fazer acordo com a União, o então ""governo"" do PT estava pagando, só de juros, 18 milhões de reais por mês.
	Por se encontrar inadimplente, o Distrito Federal não tinha acesso aos organismos internacionais de financiamento e estava impedido de dar continuidade às negociações com o Banco Interamericano de Desenvolvimento — BID, iniciadas com sucesso em 1993, no Governo anterior de Joaquim Roriz. Tais negociações visavam à obtenção de financiamento de 130 milhões de dólares para obras de saneamento básico em várias regiões administrativas.
	Renegociada a dívida com a União, recuperada a credibilidade do DF, passamos a ter condição de retomar as negociações com o BID. Tive a honra de ter sido designado coordenador desses trabalhos, pelo Governador Roriz. Essas negociações chegaram a bom termo, em junho do ano passado, com a assinatura do contrato em Washington.
	Para se ter idéia da dimensão e da importância desse contrato, que envolve recursos da ordem de 260 milhões de dólares — 130 milhões de dólares do BID e contrapartida do GDF, de igual valor — basta mencionar que até o final de abril passado já havíamos executado quase 350 quilômetros de asfalto, mais de 165 quilômetros de redes de águas pluviais e cerca de 250 quilômetros de meios-fios, nas cidades de Samambaia, Santa Maria, São Sebastião, Recanto das Emas e Riacho Fundo II.
	Porém, as dificuldades de ordens financeira e administrativa não se limitavam ao calote dado à União e aos fornecedores locais. Diversas empresas do Governo do Distrito Federal enfrentavam dificuldades de caixa, algumas delas estavam, inclusive, sob ameaça de privatização.
	O Banco de Brasília (BRB), só para citar um exemplo, acumulou prejuízos de 26 milhões de reais, no período de 1995 a 1998. Sob nova administração e orientação, o BRB já apresentou, no ano passado, lucro líquido de 34 milhões de reais, acumulando lucro de 57 milhões de reais no triênio da atual gestão. 
Podemos dizer que, literalmente — sem risco de sermos acusados de fazer propaganda eleitoral antecipada —, podemos afirmar, sim, que o Governador Roriz tirou o BRB do vermelho e o resgatou definitivamente para o azul. Salvou a instituição do prejuízo, das ameaças de federalização, da bancarrota. O nosso Governo resgatou o BRB para o lucro e para o respeito aos clientes, aos acionistas e aos servidores.
	A questão da dívida e da inadimplência teve repercussão muito forte também na obra do metrô. No início do Governo do Prof. Cristovam Buarque, do PT, a obra lançada em 1992, por Roriz, foi paralisada para que fosse submetida a profunda auditoria. Depois de mais de dois anos, a ""profunda auditoria"" concluiu que não existiam irregularidades na obra, que, portanto, deveria ser retomada.
	Foi retomada, mas para nossa surpresa, quando assumimos o Governo, em janeiro de 1999, estava novamente paralisada. Desta vez, com dívida de quase 48 milhões de reais. O metrô não estava nos trilhos, como chegou a sugerir a propaganda petista nas eleições de 1998, embora Roriz, em 1994, segundo dados do BNDES, tenha entregado a obra com 75% dos serviços executados. Roriz cumpriu os compromissos assumidos, pagou as dívidas, retomou a obra do metrô e, em março do ano passado, entregou à população o primeiro trecho pronto e funcionando comercialmente. Na mesma ocasião, retomou a construção do segundo trecho e o metrô deverá chegar a Ceilândia ainda este ano.
O prejuízo, neste caso, não se deu apenas no âmbito financeiro, mas principalmente na qualidade de vida da população, no dia-a-dia dos trabalhadores. Esses, somente neste Governo, puderam contar com esse transporte seguro, confortável e barato. 
	Mas, Sr. Presidente, vamos deixar de lado as dificuldades financeiras e falar um pouco sobre questões sociais. Parece que esse é um tema muito caro ao PT apenas nos discursos, nas entrevistas e nos programas pré-eleitorais, principalmente durante as campanhas eleitorais do partido. No entanto, no Distrito Federal, ele sempre esteve muito distante da realidade.
	Quantos hospitais o Governo anterior construiu? Nenhum. Muito pelo contrário, o Hospital do Paranoá, que já estava em construção, foi abandonado sob falsa e demagógica alegação de que a obra estava superfaturada. O Tribunal de Contas da União pronunciou-se contrário à denúncia e autorizou a retomada das obras. O Governador Roriz buscou verbas na área federal e concluiu o hospital, o que beneficiou população de 400 mil pessoas e ajudou a desafogar o atendimento médico-hospitalar do Plano Piloto.
No entanto, o Governo do Distrito Federal, tendo à frente da Secretaria de Saúde o nobre colega, Deputado Jofran Frejat, não se limitou à construção do Hospital do Paranoá. Foram ainda entregues à comunidade seis centros de saúde, quatro postos urbanos de saúde, uma inspetoria, um novo pronto-socorro, uma cozinha industrial, nova pediatria, banco de sangue, laboratório, UTI, maternidade totalmente reformada, uma unidade de reabilitação, entre outras tantas obras menores, mas, nem por isso, de menor importância para a sociedade.
	Essas e diversas outras ações deram ao Distrito Federal destaque nacional. Temos hoje o menor índice de mortalidade infantil do País, com 14,4 por mil crianças nascidas vivas, contra a média do Brasil de 32,7 por mil. O DF ostenta o menor índice de mortalidade infantil, o maior na área de assistência pré-natal e prevenção de câncer na mulher e a maior cobertura vacinal do Brasil. Poderíamos citar outros índices, como, por exemplo, a liderança na cura de câncer infantil em mais de 70% dos casos, entre tantos outros.
	Na área de educação, Sras. e Srs. Deputados, Brasília voltou a ser referência nacional. Criamos diversos programas e nenhum programa do Governo anterior deixou de ter continuidade. Pelo contrário, o Programa Bolsa-Escola foi ampliado, aperfeiçoado e valorizado. Não foi extinto, como dizem pessoas mal-intencionadas ou mal-informadas. Antes, atendia cerca de 40 mil crianças e, atualmente, com o nome de Renda Minha, atende mais de 72 mil crianças. Além do auxílio em dinheiro, previsto no Programa Bolsa-Escola, do Governo Federal, o Renda Minha oferece à criança material escolar, atendimento médico e odontológico e, principalmente, reforço escolar. 
	Com a Deputada Eurides Brito à frente da Secretaria de Educação, o GDF implantou outros programas importantes, tais como: Professor Nota 10, A Escola Bate à Sua Porta, Visitador Escolar, Quanto Mais Cedo, Melhor e tantos outros. Além disso, ampliou o horário escolar em mais de uma hora por dia, o que representa 20% de carga horária superior à dos demais Estados. Todas essas ações e programas valorizaram, não apenas o ensino, mas também os professores, categoria que teve, nos últimos três anos, ganhos salariais com a retomada do pagamento do auxílio-alimentação, suspenso no Governo do PT. No último acordo salarial, todos os servidores da Secretaria de Educação — professores ou não — receberam reajuste de 10%.
As conquistas na área educacional não ficaram restritas aos programas de melhorias salariais. Graças ao espírito empreendedor do Governador Roriz, em menos de três anos e meio de Governo, foram construídas 363 novas salas de aulas no Distrito Federal. Construímos, nesse mesmo período, 16 novas escolas, ampliamos 14, reformamos 22 e reconstruímos outras 5. E, pasmem, ainda tentam nos acusar de não investir em obras sociais.
	Todas essas ações acabaram repercutindo de forma positiva na qualidade de vida do brasiliense. Com certeza, elas tiveram influência na decisão do Fundo das Nações Unidas para o Desenvolvimento da Educação, que considerou Brasília a melhor cidade do Brasil para uma criança nascer e crescer.
	Ainda na área dos programas sociais, devemos ressaltar a importância do PRÓ-FAMÍLIA, criado no início do Governo Roriz, que está atendendo a cerca de 130 mil famílias, beneficiando aproximadamente 500 mil pessoas — um número que significa 25% da população do Distrito Federal. O PRÓ-FAMÍLIA está distribuindo, mensalmente, 130 mil cestas de alimentos, 2,2 milhões de litros de leite e 4,5 milhões de pães vitaminados.
	Nossos adversários costumam considerar essas ações paliativas e demagógicas. Paliativas, realmente, elas são. Isso porque têm o objetivo de apenas evitar que as pessoas passem fome enquanto não encontram um posto de trabalho ou enquanto não conseguem sair da condição de subempregados para a de empregados em uma função digna e justa. 
No entanto, só a consideram uma ação demagógica enquanto ela está sendo executada por um governo não-petista. Tanto é assim que o programa de governo do pré-candidato Luís Inácio Lula da Silva prevê a implantação do projeto Fome Zero, que estabelece distribuição de cupons de alimentos para família carentes.
	A principal diferença é que estamos zerando a fome, no Distrito Federal, na prática e não apenas em planos de governo. A questão é que o PT, no âmbito nacional, coloca em seu programa de governo uma ação que o partido, no Distrito Federal, não teve capacidade, nem mesmo disposição, para executar em quatro anos de uma administração que se dizia democrática e popular.
	Na área da geração de empregos, dos incentivos à produção local e ao escoamento e exportação de produtos do Distrito Federal, diversas ações foram tomadas de forma coordenada e integrada. Criamos, em 1999, o PRÓ-RURAL, concedendo incentivos a dezesseis segmentos do setor agrícola e, posteriormente, financiamento às atividades de micro e pequenos produtores rurais. Com isso, os postos de trabalhos passaram de 26.629, em 1998, para 35.317, no ano passado.
	Para facilitar o escoamento da produção crescente do Distrito Federal neste Governo foram executados cerca de 70 quilômetros de asfalto somente em rodovias da zona rural. Atualmente, a título de exemplo, apenas a avicultura do DF movimenta 100 milhões de reais e garante 14 mil empregos. Essas rodovias pavimentadas, com certeza, estão ajudando no escoamento mais seguro e mais econômico desses produtos, gerando renda e empregos.
	Na área urbana, criamos o PRÓ-DF, um programa que facilita a aquisição de lotes para instalação de empresas, em áreas de desenvolvimento econômico, que recebem encascalhamento de ruas e a implantação de redes de energia e água potável, numa primeira etapa; asfalto, drenagem e redes de esgoto, num segundo momento.
A adesão dos empresários ao PRÓ-DF tem sido surpreendente. Mais de 3.700 projetos já foram aprovados pela Secretaria de Desenvolvimento Econômico, centenas de empresas já se instalaram e já estão produzindo nessas áreas recentemente criadas. A previsão é a de que esses empreendimentos mobilizem investimentos da ordem de 780 milhões de reais e gerem 72 mil empregos diretos nas linhas de produção das empresas.
	Dados divulgados pelo Ministério das Relações Exteriores indicam que 16 empresas do Distrito Federal estão exportando para 26 países. Só no primeiro trimestre deste ano as empresas locais faturaram 6,6 milhões de dólares com exportação, o que representa aumento de 58% em relação a todo o ano de 2001.
	Nos últimos anos, em todo o mundo, tem-se debatido bastante sobre o meio ambiente e sua importância para a humanidade, mas muito pouco tem sido feito além de discursos. 
Quando assumimos o Governo, em janeiro de 1999, encontramos, por exemplo, o Parque da Cidade, um patrimônio de todo o povo do Distrito Federal, completamente degradado, sucateado e abandonado. Fizemos ali uma ampla reforma que recebeu aplausos de todos os setores da sociedade. Hoje, o parque é um lugar agradável, seguro e que passou a ter freqüência, nos fins de semana, de até 160 mil pessoas contra uma freqüência de cerca de 60 mil pessoas antes da reforma. 
Ao mesmo tempo, tiramos do papel e implantamos definitivamente os Parques Olhos D'Água, Ermida Dom Bosco, Paranoá e Águas Claras. Estamos também realizando obras no Parque Canjerana e Copaíba e outros dezoito estão sendo cercados com alambrados metálicos, conforme determinação do Governador Roriz. Em outras palavras, estamos tornando realidade um projeto que há poucos anos só existia no texto da lei. 
Uma outra grande obra, do ponto de vista ambiental, está sendo levada adiante na região entre o Aeroporto de Brasília e o braço sul do Lago Paranoá. Uma extensa galeria vem sendo construída para canalizar as águas das chuvas, que estavam assoreando o Lago naquele local, obra que exige volume muito grande de recursos, não salta aos olhos da população, mas tem imensurável significado sob a ótica ambiental.
O PT não fez obra alguma para melhorar o trânsito de Brasília, que estava se tornando um caos. A frota do Distrito Federal ganha 40 mil novos carros a cada ano. O Governador Roriz determinou o alargamento de pistas e pontes, a execução de terceiras faixas, duplicação das principais avenidas, construção de passarelas e de passagens subterrâneas para pedestres.
Dentro do programa Trânsito Inteligente mereceu destaque a construção de 23 viadutos em pontos estratégicos, onde engarrafamentos e acidentes com vítimas fatais eram constantes. Ao mesmo tempo, o Governador autorizou o início da construção da terceira ponte do Lago Sul, que vai receber o nome de Ponte JK, projeto belíssimo aprovado em concurso público no Governo passado, mas que o PT não teve coragem nem competência para tirá-lo da prancheta.
Atualmente a obra se encontra em estágio adiantado de construção, com todos os tabuleiros da ponte em seus locais definitivos e ligando as duas margens do Lago Paranoá. Uma obra que é um grande desafio do ponto de vista da engenharia construtiva e que, por isso mesmo, já recebeu visitas de engenheiros, arquitetos e estudantes de todos os Estados brasileiros e de diversos países.
	Para incentivar o turismo local, o Governador Roriz autorizou o início das obras de ampliação e reforma do Centro de Convenções, que receberá investimentos da ordem de 40 milhões de reais, com aumento da sua área total em quase quatro vezes. O novo Centro de Convenções terá capacidade para 7.127 lugares. Só o Auditório Master terá capacidade para 4 mil lugares. O público e os expositores terão à sua disposição mais oito auditórios menores e outros dois auditórios intermediários, quatro camarins coletivos, quatro banheiros e três balcões de recepção com 215 lugares, uma obra gigantesca que vai preservar o projeto arquitetônico de Sérgio Bernardes.
	Recentemente, o Governador Roriz, com a presença do arquiteto Oscar Niemeyer, determinou o início do processo de licitação para a construção da Biblioteca e do Museu Nacional no Complexo Cultural da República. Desta forma, foi dado um importante passo para a conclusão da Brasília Monumental, dentro da concepção arquitetônica de Niemeyer.
	Diversas ações foram realizadas na área de segurança pública. O PT aumentou o efetivo policial em apenas algumas centenas de pessoas. O Governo Roriz colocou mais de 5 mil homens nas ruas, reequipou as polícias e dobrou o número de viaturas. Uma ampla reforma criou mais 240 vagas no Complexo Penitenciário da Papuda, com celas divididas em quatro áreas independentes. Diversos programas, como o Esporte à Meia-Noite e o Oficina de Costura Industrial da Fundação de Amparo ao Trabalhador Preso passaram a ser referências para todo o País.
	Enfim, Sr. Presidente, foram diversas ações, realizações, obras e programas que mudaram radicalmente a vida do Distrito Federal em pouco mais de três anos. Poderíamos citar inúmeras outras entre as 1.033 obras que foram concluídas e entregues à população nesse período, mas seria exaustivo e desnecessário.
	O importante é que levamos adiante um programa de governo inteligente, planejado e que não pára de render frutos para o Distrito Federal. Preferimos as ações às palavras. E essa sempre foi uma marca do Governador Roriz em todas as três vezes em que esteve à frente do Executivo local.	
	Nossos adversários, ao contrário, preferem o discurso fácil, a demagogia barata e a propagação de denúncias e escândalos infundados, para que produzam manchetes e possam, no período eleitoral, ser utilizadas como campanha.
	A população não se ilude mais por essas ações típicas de período eleitoral. Mesmo entusiasmado pelos jogos da Copa do Mundo, o torcedor e eleitor brasiliense conhece o Distrito Federal, seus problemas, suas dificuldades e as soluções que foram encontradas e executadas nos últimos anos. Ele sabe muito bem distinguir uma administração da outra, até porque não existe dificuldade alguma em realizar essa tarefa.
Daqui para a frente, nós estaremos torcendo por uma boa campanha da seleção brasileira nos campos da Coréia do Sul e do Japão e trabalhando diariamente para que a população do Distrito Federal não seja ludibriada pelo discurso demagógico que certamente marcará a campanha eleitoral dos adversários de Roriz este ano.
	Muito obrigado."
2002-11-06T17:58;"MEDIDA PROVISÓRIA, ALTERAÇÃO, LEI FEDERAL, VALE PEDÁGIO, TRANSPORTE RODOVIÁRIO,  TRANSPORTE DE CARGA, PAGAMENTO, ANTT , IMPLANTAÇÃO. 
PARECER FAVORÁVEL.";PARECER;"O SR. TADEU FILIPPELLI (PMDB-DF. Para emitir parecer. Sem revisão do orador.) – Sr. Presidente, Srs. Deputados, a Medida Provisória nº 68, de 4 de setembro de 2002, que altera as Leis nºs 10.209, de 23 de março de 2001, e 10.233, de 5 de junho de 2001, e dá outras providências, atende aos pressupostos constitucionais de relevância e urgência.
	Com relação ao mérito da proposição em tela, apresentam-se as seguintes alterações: na Lei nº 10.209, que institui o Vale-Pedágio Obrigatório sobre o transporte rodoviário de carga, e dá outras providências; e na Lei nº 10.233, de 2001, que dispõe sobre a reestruturação dos transportes aquaviário e terrestre, cria a Agência Nacional de Transporte Terrestre, e dá outras providências. 
	À medida provisória foi apresentada uma emenda, de autoria do Deputado José Antonio Almeida, do PSB, que objetiva, na redação proposta para o § 3º do art. 82 da Lei nº 10.233 pelo art. 2º da Medida Provisória nº 68, excetuar da competência do órgão executivo rodoviário da União (DNIT) as competências expressas nos incisos V, VI e VII do art. 21 da Lei nº 9.503, de 1997, exercidas pela autoridade de trânsito da União e suas congêneres.
	Sr. Presidente, nosso parecer quanto ao mérito é pela aprovação da presente medida provisória, na sua forma original, com a rejeição da Emenda nº 1, apresentada pelo Deputado José Antonio Almeida. 
PARECER ESCRITO ENCAMINHADO À MESA"
