dataHoraInicio;keywords;tipoDiscurso;transcricao
2002-04-10T11:45;"SESSÃO SOLENE, HOMENAGEM, ANIVERSÁRIO DE FUNDAÇÃO, BRASÍLIA, CAPITAL FEDERAL, DF.
HOMENAGEM, CENTENÁRIO, ARQUITETO, LÚCIO COSTA.";HOMENAGEM;"O SR. PRESIDENTE (Paulo Octávio) – Antes de conceder a palavra ao nobre Deputado Tadeu Filippelli, pelo PMDB do Distrito Federal, a Presidência aproveita a oportunidade para cumprimentar sua senhora, D. Célia Filippelli, que nos honra com sua presença, e também D. Vilma Pereira, D. Cláudia, o Deputado Ricardo Noronha, o Bispo Robson Rodovalho, o Sr. João Jacques Cavalcanti, Ouvidor-Geral do DF, o Dr. Afrânio Rodrigues da Cunha, Diretor dos Correios e Telégrafos, o Sr. Jarbas Silva Marques, Diretor do Patrimônio Histórico e Artístico, o Deputado Joãozinho Araújo, do PFL, o Dr. Heitor Reis, Presidente do Instituto Tancredo Neves, e o Sr. Jota Alcides, Diretor do jornal Fatorama.
	O SR. PRESIDENTE (Paulo Octávio) - Com a palavra o nobre Deputado Tadeu Filippelli, que estréia nesta tribuna ao retornar à Casa depois dos ótimos serviços prestados a Brasília na Secretaria de Obras da Capital da República.
O SR. TADEU FILIPPELLI (PMDB-DF. Sem revisão do orador.) – Muito obrigado, Exmo. Deputado Paulo Octávio, nosso companheiro de lutas políticas que preside esta sessão. Parabenizo V.Exa. e o Deputado Eduardo Campos pela iniciativa de tão justa homenagem.
	Cara Anna Christina Kubitschek, que nos traz a memória do maior estadista brasileiro, nosso grande fundador e inspirador de Brasília, caro Secretário Carlos Edil Fortes, que representa nesta cerimônia o nosso Governador Joaquim Roriz, cara Maria Elisa Costa, filha do urbanista Lúcio Costa, nosso homenageado nesta sessão, Sras. e Srs. Deputados, demais presentes, sinto-me profundamente emocionado neste momento em que, pela primeira vez, subo à tribuna desta Casa.
Não acho dispensável justificar minha ausência ao longo desse tempo. Estava licenciado desta Casa para desempenhar a função de Secretário de Infra-Estrutura e Obras do Governo Roriz, função de que muito me orgulho e que muito me honrou, principalmente por ter a convicção de acreditar em Roriz como homem público e ter a certeza de contribuir para a consolidação desta cidade que tanto amamos. (Palmas.)
	Minha estréia não poderia ser mais oportuna ao falar de dois temas tão caros a todos nós, moradores do Distrito Federal: Lúcio Costa, o criador, e Brasília, a obra de arte. É, para nós, motivo sempre de muito orgulho e plena satisfação falar desses dois temas.
	Lúcio Costa teria feito 100 anos no último dia 27 de fevereiro e Brasília completará 42 anos no próximo 21 de abril. Um século para o artista e menos de meio século para a obra de arte. Brasília segue pujante sua história, sua missão de alargar as fronteiras de um país que, em plena efervescência dos anos 60, voltava-se exclusivamente para o litoral. O arquiteto Lúcio Costa, que nos deixou no dia 13 de junho de 1998, segue em nossa memória, perpetuado pela sua genialidade e pela sensibilidade do seu espírito criador. 
	O que falar de Lúcio Costa sem ser repetitivo? E o que dizer de Brasília sem cair na pieguice de defender a cidade que amamos e adotamos como nossa e pela qual lutamos no nosso dia-a-dia, seja no trabalho, nas escolas ou mesmo nos locais de diversão? Ou melhor: como falar de Lúcio Costa sem relacioná-lo a Brasília? Ou como homenagear a Capital da República sem estabelecer vínculos aos traços e ao traçado do genial urbanista?
	A verdade é que se Lúcio Costa não se tivesse dedicado ao projeto urbanístico de Brasília, mesmo assim ele estaria no rol dos maiores arquitetos brasileiros, pelo conjunto da sua obra e pelo talento demonstrado em todos os projetos dos quais participou. Difícil é imaginar como seria Brasília sem que ela tivesse sido projetada a partir de ""dois eixos cruzando-se em ângulo reto"".
	Só a imaginação genial de um artista poderia, num gesto simples de duas linhas, estabelecer a grandeza e o futuro de uma cidade. Aqui viriam se encontrar e se cruzar os sonhos e as esperanças de milhares e milhares de brasileiros, vindos de todos os recantos, embalados pelos mesmos ideais de construir o seu próprio futuro, de suas famílias e desta Nação brasileira.
	Brasília, com a grandeza de seus eixos, a amplidão de suas áreas e a beleza das cores, foi-se construindo e se constituindo em um símbolo brasileiro, em uma fonte de esperança e de sonhos para todos os migrantes e para as gerações que aqui foram surgindo durante os 42 anos de sua existência. (Palmas.)
Cumpriu sua missão primeira de se tornar o pólo de desenvolvimento para toda a Região do Centro-Oeste brasileiro.
	Para sermos sinceros, Brasília traz em sua áurea a feliz coincidência de diversos fatores. Foi construída graças ao espírito empreendedor e à dinâmica de homens como Juscelino Kubitscheck e Israel Pinheiro. Teve, na sua concepção, o talento e a genialidade de Lúcio Costa e Oscar Niemeyer. Cresceu na efervescência dos anos 60 e, durante os tristes anos da ditadura militar, viveu sua adolescência sonhando com as liberdades democráticas e eleições diretas em todos os níveis, inclusive para eleger seus representantes no Executivo e no Legislativo.
	Hoje, em sua fase adulta, Brasília vive a plenitude das liberdades democráticas, convive com seus erros e seus acertos, discute o seu papel dentro da sociedade brasileira e os seus caminhos para o futuro. Tudo isso sob o título de Patrimônio Histórico da Humanidade, recebido da UNESCO aos 27 anos de idade. Três anos depois, a balzaquiana cidade seria tombada pelo Ministério da Cultura. Era muito jovem para tantas honrarias e estava sendo agraciada justamente por aquilo que ela tinha de novo, a sua modernidade.
	Sr. Presidente, Sras. e Srs. Deputados, senhores pioneiros e todos os que nos honram com suas presenças aqui, Brasília, tão jovem, às vésperas de fazer 42 anos de sua fundação, já carrega consigo uma história invejável e digna da mais profunda admiração. A cidade deve muito de tudo isso a Lúcio Costa, ao talento e à  sensibilidade que ele depositou em seu projeto urbanístico. O arquiteto, ao imaginar duas linhas se encontrando na imensidão do Planalto Central do Brasil, na realidade, estava prevendo o encontro de ideais e a realização de um futuro, mesmo que, em sua modéstia e simplicidade, tivesse escrito que seu projeto ""nasceu do gesto primário de quem assinala um lugar ou dele toma posse"".
	Era muito mais que um gesto primário, e hoje todos nós sabemos disso. Na verdade, temos muito que agradecer a Lúcio Costa e precisamos fazer muito mais ainda por Brasília.
	Muito obrigado. (Palmas.)"
