dataHoraInicio;keywords;tipoDiscurso;transcricao
2007-06-13T15:48;"PROJETO DE LEI, REFORMA POLÍTICA, ALTERAÇÃO, CÓDIGO ELEITORAL, LEI ORGÂNICA DOS PARTIDOS POLÍTICOS, LEI DAS ELEIÇÕES, PESQUISA ELEITORAL, VOTO DE LEGENDA, LISTA FECHADA, CRIAÇÃO, FEDERAÇÃO, FUNCIONAMENTO PARLAMENTAR, PROPAGANDA ELEITORAL, FINANCIAMENTO, RECURSOS PÚBLICOS, CAMPANHA ELEITORAL, COLIGAÇÃO PARTIDÁRIA, AVALIAÇÃO.
SISTEMA DISTRITAL MISTO, VOTO DISTRITAL, ELEIÇÕES, DEFESA.";DISCUSSÃO;"O SR. JOSÉ ANÍBAL (PSDB-SP. Sem revisão do orador.) - Sr. Presidente, Sras. e Srs. Deputados, algumas quartas-feiras atrás, houve, ao final da sessão, uma reunião de exaltação entre os Líderes partidários e o Presidente da Casa a respeito da firme decisão de melhorar nossa pauta, de nos fazer trilhar o melhor caminho.
	O momento é agora. Ao longo desta jornada, que se mostra muito produtiva e racional, afirma-se neste plenário o reencontro da representação política parlamentar com a população, com a idéia de que todo o poder deriva do voto popular. Enfatizo que não serão soluções arranjadas, diante de resistências que procuram encontrar um atalho para o mesmo propósito, que nos vão levar a esse reencontro.
	Percebo, em razão da última votação, a reanimação de uma postura de convergência entre todas as forças políticas da Casa, para que se busque realmente uma reforma mais profunda do modo de constituição de nossa representação política. 
O caminho é o voto distrital misto. Essa idéia começa a percorrer o Plenário, está presente nos pronunciamentos das Lideranças. Trata-se de uma idéia que responde amplamente tanto àqueles, como eu e a maioria do meu partido, que têm uma postura contrária à lista preordenada quanto aos que querem o voto distrital puro.
	Sr. Presidente, este é o momento para que V.Exa. assuma, de algum modo, a condução desse diálogo entre os Líderes da Casa, e para que possamos, em função da situação criada hoje, dar um passo mais vigoroso e mais satisfação à sociedade."
2007-06-18T15:36;"GOVERNO, ITAMAR FRANCO, FERNANDO HENRIQUE CARDOSO, EX PRESIDENTE DA REPÚBLICA, GOVERNO LUIZ INÁCIO LULA DA SILVA, AVALIAÇÃO, CRÍTICA.
LEGISLATIVO, CORRUPÇÃO, IMAGEM, OPINIÃO PÚBLICA, COMPROMETIMENTO, CONGRESSO NACIONAL, FUNÇÃO LEGISLATIVA, PARALISAÇÃO, CRÍTICA.
REFORMA LEGISLATIVA, LISTA FECHADA, SISTEMA PROPORCIONAL, ELEIÇÕES, CRÍTICA, FIDELIDADE PARTIDÁRIA, VOTO DISTRITAL, AVALIAÇÃO, DEFESA.";GRANDE EXPEDIENTE;"O SR. JOSÉ ANÍBAL (PSDB-SP. Sem revisão do orador.) - Sr. Presidente, Sras. e Srs. Deputados, é com grande satisfação que volto a esta tribuna, depois de uma estréia há exatamente 13 anos e meio, quando assumi, pela primeira vez, mandato de Deputado Federal, em janeiro de 1993.
	Naquele momento, o Brasil havia concluído o extraordinário movimento cívico que levou ao impedimento de um Presidente da República. E também naquele momento, de grande vitalidade da sociedade, de mobilização, de desejo de ir adiante, tivemos, neste Parlamento, um grande contraponto, que foi a conhecida CPI dos Anões do Orçamento. Mas o Parlamento soube reagir, reuniu energias, puniu, alguns renunciaram aos mandatos, e, ao mesmo tempo, com estímulo do então Presidente Itamar Franco, foi possível pensar um programa para que o Brasil não continuasse à deriva, com inflação incontrolável, contas públicas desorganizadas, sem esperança para a economia e o emprego no País.
	Falo de 1993, quando o então Presidente Itamar Franco teve a clarividência de estimular e respaldar um programa econômico que finalmente nos redimiu e eu tive aqui o meu primeiro ano parlamentar. O ano terminou, e o Plano Real começava a ser votado nesta Casa. Foi uma votação vitoriosa tanto quanto foi o plano e que tem muito a ver - muito a ver - com o programa do meu partido, formulado quando da constituição do PSDB.
Esse programa tinha como pontos centrais alguns desafios, alguns deles já vencidos pelo Governo Fernando Henrique Cardoso, outros ainda por vencer. Quero destacar alguns desses pontos constantes desse programa apresentado há 19 anos: a democracia como valor fundamental; a justiça social como meta do desenvolvimento; a educação, por cuja universalização muito fizemos; a seguridade social; o crescimento econômico com distribuição de renda, de maneira que iniciamos os programas sociais de combate à pobreza, os programas Bolsa-Alimentação, Bolsa-Educação, de combate ao trabalho infantil, de vale-gás, beneficiando 6 milhões de pessoas; fim dos desafios da inflação e da dívida externa, pois acabamos com a inflação, e a dívida externa hoje já não é problema para o Brasil; a reforma do Estado, que iniciamos e que ainda resta por fazer; a reforma agrária e a política agrícola, responsável pelo que o Brasil é hoje no setor da agricultura e do agronegócio; a reforma do sistema financeiro, que fizemos por inteiro e que resultou em um sistema confiável, apesar de ainda prevalecer hoje na economia brasileira, infelizmente, não a bolsa-família, mas a ""bolsa-banca"", porque ali se ganha muito; a preservação dos recursos naturais; a presença ativa no cenário internacional. Também chegamos a isso. 
	Tratou-se de um processo. Foi um programa usado não apenas para se ganhar a eleição, mas para se governar. Esse programa teve como inspiradores Mário Covas, que fez o mais ciclópico ajuste de contas públicas do Brasil, no Estado de São Paulo; Franco Montoro; Sérgio Motta, que dirigiu o mais bem-sucedido processo de desestatização da nossa história recente no setor de telecomunicações.
	O Sr. Mauro Benevides - V.Exa. me permite um aparte, Deputado José Aníbal?
	O SR. JOSÉ ANÍBAL - Pois não.
	O Sr. Mauro Benevides - No momento em que V.Exa. exalta a grande e extraordinária figura do Governador Franco Montoro, da mesma forma como fez em relação a Mário Covas, eu desejo também juntar a minha homenagem a esses 2 ilustres homens públicos, com os quais tive o privilégio de conviver no Senado Federal. Muito grato a V.Exa.
	O SR. JOSÉ ANÍBAL - Muito obrigado.
	Sr. Presidente, Sras. e Srs. Deputados, nesta semana, a imprensa noticia que, com o Dia das Mães, são 105 milhões de telefones celulares no Brasil - 105 milhões de telefones celulares! -, que ajudam as pessoas nos seus negócios, nos seus serviços, na sua vida pessoal, em todas as atividades humanas. O Brasil hoje está no estado da arte em matéria de telecomunicações; o Brasil hoje não deve nada a ninguém em matéria de telecomunicações. Isso é resultado de um processo muito bem construído de desestatização desse setor, como de outros que lançaram as bases para o que temos e vamos tendo gradativamente como mudança na economia brasileira.
	O que tenho a lamentar, Sr. Presidente, Sras. Deputados, Srs. Deputados, é que mais uma vez, coincidentemente no dia de hoje, o Presidente da República usa seus programas de rádio e televisão para fazer um trabalho de autopromoção, e não se enrubesce. Ele diz hoje que estamos crescendo, com controle da inflação. Conversa fiada! O fim da inflação, como nós a conhecíamos, é de 1995, época do Governo Fernando Henrique Cardoso. O País tem história e tem memória.
O crescimento que temos hoje é, infelizmente, reativo, deve-se principalmente à vitalidade da economia mundial, especialmente da economia chinesa. O nosso dever de casa, a nossa parte - e aí uma surpresa - o conservadorismo do Governo Lula não nos permite fazer. Aquelas mudanças de 1995, 1996 nos permitiram ter hoje o País que temos, em condições de se inserir na economia mundial, com uma agricultura pujante. As mudanças que deveríamos estar fazendo hoje serão aquelas absolutamente necessárias em poucos anos mais.
Por que nosso crescimento é reativo? Vejam como está a nossa infra-estrutura: aos pedaços. A logística do Brasil tira a produtividade dos produtos brasileiros e os encarece. A soja do Centro-Oeste, a do meu Estado de origem, Rondônia, têm um custo de transporte cada vez menos capaz de dar competitividade aos nossos produtos e retorno ao nosso produtor rural. Então, temos um problema grave de logística de transporte.
Temos um problema grave, que alguém já mencionou aqui hoje, de marco regulatório. As agências estão cada vez mais desprezadas, a exemplo da Agência Nacional de Energia Elétrica - ANEEL, cujo Presidente, há 3 semanas, veio a público dizer que não tinha recursos para a diária dos funcionários. Como é que os funcionários da agência podem viajar, constatar, in loco, os problemas, ver os desafios? As agências estão sendo depauperadas, enfraquecidas, fragilizadas, o que tira a credibilidade dos marcos regulatórios e da fiscalização que lhes competem fazer. 
Além disso, há outros problemas graves, como a PEC da Previdência, que, votada aqui em 2004, até hoje sequer foi regulamentada.
No que se refere à questão tributária, o problema não é só a carga tributária, mas a irracionalidade do sistema tributário. A irracionalidade absoluta do sistema tributário leva as empresas a terem um custo adicional pela mera manutenção de suas obrigações tributárias razoavelmente em ordem, tal a grandeza, a quantidade de tributos, de encavalamentos, de deduções, de acréscimos, sem que se tenha o bom senso da simplificação.
Há o problema da gestão. Aliás, falta gestão a este Governo em várias áreas. E surpreende que o Presidente da República, toda vez que se dirige ao País, faça isso para se exaltar, para se promover. Não convida o País a uma reflexão, não convida o Parlamento a uma parceria, a uma discussão que produza melhores resultados à sociedade. Opta pela auto-exaltação. Enxerga ali na frente, não lá adiante.
O Brasil precisa de estadistas que enxerguem lá adiante e que se utilizem da situação presente, que é favorável, insisto - não há crise na economia mundial -, para dar os passos necessários a crescermos tão rapidamente como crescem outros países que conosco concorrem. A questão para nós não é só saber que estamos um pouco melhores, mas se vamos ter energia suficiente para continuar competindo com todos aqueles que também querem chegar lá.
Sr. Presidente, Sras. e Srs. Deputados, comecei nesta Casa em 1993. Já mencionei aqui a CPI dos Anões do Orçamento. Em 2002, não voltei a esta Casa, porque me candidatei ao Senado. Não me elegi, apesar de ter obtido 5 milhões de votos. Em 2004, fui o Vereador mais votado do Brasil por minha cidade, São Paulo, onde obtive em torno de 165 mil votos. Agora, volto para este Parlamento como Deputado Federal. Agradeço aos eleitores e às eleitoras de São Paulo, aos companheiros do partido, aos amigos que me estimularam e me ajudaram a voltar à Casa. Contudo, de novo, volto em momento de grave crise no Parlamento.
Esta Legislatura mal começou e parece envelhecida. A impunidade corrói a nossa democracia. O que se vê é a tentativa de negar aquilo que é óbvio. Nossos usos e costumes, nossas práticas, muitas delas completamente vencidas pelo tempo, já encontram na sociedade grande resistência. A sociedade quer mudanças e quer se mobilizar por boas causas.
Vejam, no mesmo momento em que falo aqui, no Senado fala um lobista. E a atenção da mídia é para esse lobista e não para o Parlamento. A atenção não é para aquilo que aqui propomos à reflexão, mas para o que diz um lobista. Não desqualifico o cidadão como tal, mas é um lobista, não é um Parlamentar.
O Parlamento vem sendo invadido por essas pessoas, também por Comissões Parlamentares de Inquérito, que são necessárias, sim, têm de ser criadas e produzir resultados, mas o Parlamento precisa ter sua agenda, ter capacidade de iniciativa que vá ao encontro daquilo que deseja a nossa sociedade. Ela quer um Parlamento menos batido, ou nada batido, um Parlamento altivo, capaz de estabelecer boa relação com o Executivo e que, principalmente, dê satisfações à sociedade.
	Temos agora o desafio da reforma política, um belo desafio, que não ficar restrito a um cálculo político pessoal de cada Parlamentar, para que este saiba se, com uma nova regra, será bem atendido ou não.
Aliás, é importante e curioso observar que, desde que vim para cá pela primeira vez, em 1993, do total daqueles Parlamentares, sobrevivem hoje nesta Casa  35, cerca de 7%. Quer dizer, em 14 anos, 470 Parlamentares que passaram por esta Casa, muito mais até, não estão mais aqui. O processo hoje existente de constituição da representação parlamentar promove uma inovação rápida e não permite que se consolide uma relação de maior confiança entre sua excelência o eleitor, como dizia Ulysses Guimarães, e o eleito. Passa-se ao largo disso. Basta se verificar o resultado das urnas.
Devemos ficar atentos a essa rotatividade, que nem sempre significa renovação, avanço e melhoria. Aliás, Ulysses Guimarães dizia, e previu, que a tendência era de piora a cada Legislatura. Sou otimista, quero crer que podemos melhorar. Para isso devemos votar uma reforma política não de modo enviesado, por meio de lista fechada, a qual, mais uma vez, fechará a porta ao eleitor, que, ao votar numa lista, deixa de votar no cidadão.
Hoje, o eleitor vota num candidato vindo de um colégio eleitoral, onde mal se consegue diferenciar quem é quem. Exemplo mais absurdo disso ocorre no Estado de São Paulo: 70 eleitos no colégio eleitoral, num distrito de 30 milhões eleitores. O candidato a Deputado Federal em São Paulo, em tese, disputa voto em colégio eleitoral de 30 milhões de eleitores, o que é uma irracionalidade completa. Mesmo em outros Estados, disputa-se voto em todo o Estado, quando tal disputa deveria acontecer em regiões delimitadas. Dizem então que vamos criar um parlamento de vereadores federais. Se for um parlamento de vereadores federais - e não o será com o voto distrital, apesar de o distrital misto ser a melhor alternativa -, que consiga resolver as demandas, os anseios, os desejos, a vontade de uma vida melhor das suas comunidades. Seja bem-vindo.
Não será assim, até porque o voto distrital puro no Brasil seria mudança drástica demais. Podemos estabelecer o misto. O que significa o sistema distrital misto? Respondo para quem está nos ouvindo. Metade dos Deputados Federais de cada Estado seria eleito por distritos. Em cada distrito, cada partido poderia apresentar 1 candidato. Se em São Paulo, por exemplo, houvesse 35 distritos, cada partido apresentaria 1 candidato em cada distrito, e não essa multidão de candidatos. Os outros continuariam sendo eleitos pelo voto proporcional ou pelo voto em uma lista aberta, o que, no final, é a mesma coisa.
	O Sr. Ernandes Amorim - Deputado José Aníbal, permite-me um aparte?
	O SR. JOSÉ ANÍBAL - Vou concluir o raciocínio e, em seguida, ouço V.Exa.
	O que eu desejava provocar, e muito, desta tribuna, na linha do que escrevi em artigo no jornal Folha de S.Paulo do último sábado, é que, em se tratando de reforma política, devemos ficar muito atentos para o fato de estarmos construindo na reforma política um modo de constituição da representação parlamentar com um propósito maior, o de dar mais confiança ao cidadão, criar mais credibilidade quanto à representação política. Essa não é a questão menor, é a questão maior, que merece mais tempo de reflexão e de conversa com a sociedade. 
Ao final do texto que escrevi, digo até da possibilidade de se fazer desse processo de discussão da reforma política um movimento cívico: o de dizer à sociedade que reforma política não é algo que interessa apenas aos Deputados Federais, aos Deputados Estaduais, aos Vereadores, interessa muito à sociedade. Debater com a sociedade - estou convencido disto - poderá ajudar-nos muito a banir da nossa vida pública parte dessas mazelas que ocorrem com muita freqüência aqui dentro.
E não é só isso, a reforma política mexe com a Comissão de Orçamento, que, a meu ver, deveria terminar. Nossa função aqui é fiscalizar, acompanhar o Orçamento e a execução orçamentária. Quando cheguei a esta Casa, a Comissão do Orçamento era a CPI dos Anões do Orçamento. De lá para cá, sempre acontece alguma coisa, como denúncias que desabonam o Parlamento.
Enfatizo que muitas matérias podem ser votadas imediatamente, como a da fidelidade partidária. Em seguida, o fim das coligações proporcionais. Depois, então, numa grande convergência entre Parlamento e sociedade, seria implantado um novo modelo de constituição da representação parlamentar, com o voto distrital misto.
	Ouço, com prazer, o Deputado Ernandes Amorim.
	O Sr. Ernandes Amorim - Deputado José Aníbal, V.Exa. é da Região Norte?
	O SR. JOSÉ ANÍBAL - Nasci em Guajará-Mirim, em Rondônia, fronteira com a Bolívia. 
	O Sr. Ernandes Amorim - Deputado José Aníbal, há hoje em Rondônia o Movimento Pró-Usinas. Sabe V.Exa. que toda a riqueza gerada em energia no Estado é direcionada para a região centro-sul, para São Paulo, para o desenvolvimento do País.
	O SR. JOSÉ ANÍBAL - Espero que fique um pouco em Rondônia, para se desenvolver o Estado.
	O Sr. Ernandes Amorim - Não vamos consumir tudo. Trata-se de meia Itaipu. Porém, o Estado de Rondônia seria muito beneficiado. Por isso, peço a V.Exa., que representa São Paulo e Rondônia, que solicite ao Presidente da República a disponibilização, o mais rápido possível, dos prometidos recursos. A população de Rondônia está com medo de que isso não venha a acontecer. Por isso, solicito o seu empenho para nos ajudar em Rondônia.
	O SR. JOSÉ ANÍBAL - Ouço o aparte do Deputado Domingos Dutra - concordo plenamente com o conselho do Senador Sibá Machado.
	O Sr. Domingos Dutra - Agradeço a V.Exa. Tenho a maior admiração por V.Exa. Estive aqui há 10 anos, e durante 2 anos convivi com V.Exa. Tenho respeito por sua biografia. Fico honrado com a concessão do aparte. Quero referir-me à primeira parte do discurso de V.Exa. Primeiro, os instrumentos utilizados hoje pelo Presidente Lula para se comunicar com a sociedade, em nome da República, são os mesmos utilizados pelo ex-Presidente Fernando Henrique Cardoso. Segundo, as coisas boas realizadas no Governo Fernando Henrique Cardoso foram conservadas pelo Presidente Lula. Durante a campanha, o PSDB disse que, se Lula fosse eleito Presidente, o País viraria de cabeça para baixo. Assim, àquela época, o Risco Brasil cresceu, o dólar subiu, diante das incertezas. De sua parte, o Presidente Lula resolveu manter muitos aspectos bons do Governo passado.
	O SR. JOSÉ ANÍBAL - Na economia, tudo.
	O Sr. Domingos Dutra - Como o Governo Fernando Henrique Cardoso manteve algo do Governo Collor, e este, do Governo Sarney, porque é natural a continuidade. Por último, quero dizer que a economia está bem, o Risco Brasil e o dólar estão baixos, a exportação cresceu, o salário mínimo aumentou. A moeda brasileira nunca esteve tão valorizada como agora. Portanto, nosso Presidente conservou o que é bom e promoveu também ótimas inovações. Espero que V.Exa. reconheça os avanços do Governo Lula, que são muitos, em várias áreas.
	O SR. JOSÉ ANÍBAL - Deputado Domingos Dutra, é na hora do sol que cuidamos do telhado. Quando há bonança na economia mundial, temos de fazer as urgentes e necessárias reformas, principalmente as de iniciativa do Poder Executivo.
	Ouço o aparte da nobre Deputada Rita Camata.
	A Sra. Rita Camata - Deputado José Aníbal, é uma alegria vê-lo na tribuna. V.Exa. é um Parlamentar que tem uma grande trajetória e, nesta tarde, revela todo esse acúmulo. Manifesta a importância do que já se fez, mas também daquilo que precisa ser feito, planejado. E traz essa reflexão para dentro do Congresso também. Comungo com V.Exa. quanto à necessidade de discussões profundas, sérias, que tenham como meta melhorar a vida da população brasileira. Na reforma política, que estamos discutindo esta semana, temos de nos despojar do mandato. Não quero, em momento algum, discuti-la para saber o que vai me garantir qualquer possibilidade de voltar para o Parlamento. Estou no quinto mandato. Devo dizer que vou pensar em fazer outra coisa da vida se o processo continuar da forma como está. Temos a obrigação de fazer com que esse debate traga luz para toda a Nação brasileira, traga o sentimento e a vontade de participar da vida política e partidária do País para essa juventude que está aí. V.Exa. abordou bem a questão dos partidos fortes, ao dizer qual era o programa do PSDB. Este é o grande objetivo: fortalecimento dos partidos, fim da reeleição. Fui favorável à campanha de 2 em 2 anos. Chego à conclusão de que essa falta de coincidência de eleições é perversa demais para o Brasil. A reeleição é outro instrumento que não é democrático, que inviabiliza a democracia e o seu fortalecimento. Venha mais à tribuna, Deputado José Aníbal. Vejo que há companheiros que podem muito contribuir com o Parlamento brasileiro e que têm, de certa forma, se inibido, neste início de Legislatura. Que S.Exas. tragam suas contribuições para debate, para que possamos construir a sociedade que queremos, pensando não só no hoje, mas na situação daqui a 10, 15, 20 anos, nas outras gerações.
	O SR. JOSÉ ANÍBAL - Muito obrigado, Deputada Rita Camata, pelo aparte.
Sr. Presidente, Sras. e Srs. Deputados, teria ainda algumas considerações a fazer. Se ouso participar de uma fala mais interativa, dialogando com Deputados - não tive nenhuma preocupação em evitar apartes -, foi exatamente para que pudéssemos debater.
	Espero que consigamos, depois da semana que passou, quando a reforma política começou a ser discutida de maneira mais deliberativa no plenário, avançar para uma discussão mais abrangente.
	Defendo, atualmente meu partido tem essa posição, o voto distrital, provavelmente na sua variação de voto distrital misto. Nesta minha visão de País, o Brasil é um processo sucessivo de acumulações - espero que seja sempre assim, daqui por diante - que precisam também de mudanças.
	Estarei empenhado nessas reformas, ao longo do meu mandato, porque é no momento da bonança, de uma situação internacional como a que temos, que nos devemos empenhar para que as políticas públicas produzam resultados mais fortes, principalmente na área de educação, meio ambiente e segurança pública. Espero que não tenhamos mais outra oportunidade em que o nosso Presidente diga que segurança pública não é foco do Governo Federal, quando 40 mil pessoas são mortas por arma de fogo no Brasil. É sim foco de todos nós, também deste Parlamento.
	Muito obrigado."
