dataHoraInicio;keywords;tipoDiscurso;transcricao
2009-03-25T15:30;"POLÍTICA ECONÔMICO FINANCEIRA, GOVERNO, LUIZ INÁCIO LULA DA SILVA, PRESIDENTE DA REPÚBLICA, PRECARIEDADE, COMBATE, CRISE, NATUREZA FINANCEIRA, ÂMBITO INTERNACIONAL, CRÍTICA.
CRISE ECONÔMICA, MERCADO FINANCEIRO, MERCADO INTERNACIONAL, AVALIAÇÃO.";PEQUENO EXPEDIENTE;"O SR. JORGE TADEU MUDALEN (DEM-SP. Pronuncia o seguinte discurso.) - Sr. Presidente, Sras. e Srs. Deputados, muito tem-se falado sobre a atual crise econômica que assola o País e o mundo. Uma crise com efeitos mais psicológicos do que verdadeiramente econômicos. Empresas demitindo, pessoas deixando de investir e empreender e o Estado brasileiro unindo esses 2 problemas e colocando num liquidificador de más intenções. Digo más porque desde o início deste processo que se iniciou no final de 2008, reformas substanciais não foram aplicadas pela equipe econômica da Fazenda. Alguns ajustes pontuais, como a queda do imposto cobrando sobre a venda de veículos novos e usados e a tarifa cobrada por bancos para empréstimos pessoais. Aliás, devemos observar aqui que nem todos os bancos seguiram essa medida e ainda aplicam taxas abusivas - sem contabilizarmos um spread avolumado que faz apenas com que banqueiros enriqueçam cada vez mais. 
Contudo, devemos pensar quais seriam os principais agravantes desse processo. O desemprego, a perda de capital e a falta de previsibilidade da economia? Não. Todos esses ingredientes são apenas complementos de um mal pior. A sensação de desamparo e desatenção que os nossos empresários têm sentido e vivido nos últimos meses é o maior agravante de toda a crise - a crise de confiança num sistema político inoperante. O pior é que isso não depende do mercado, mas sim de quem foi eleito pela maioria dos brasileiros. 
Sras. e Srs. Deputados, se colocarmos nossas mentes num passado aparentemente distante, no início do século passado, enxergaríamos um cenário de grande desolação e angústia. A chamada crise dos anos 30, fruto da quebra da bolsa americana, produziu efeitos terríveis, sem precedentes. O resultado foi a quebradeira generalizada e a depressão econômica. O desemprego nos Estados Unidos chegou ao patamar de 25% dos mais de 1 década e 4 mil bancos quebraram.
Todavia, atualmente, existem organismos como o Fundo Monetário Internacional preparados para atuar em situações de emergência e que já estão atuando. Isso não existia na década de 1930. Em segundo lugar, há uma grande diferença entre a atuação dos governos da atualidade e os daquela época. Nos Estados Unidos dos anos 30, seguindo os princípios clássicos do liberalismo, preferiu deixar que os problemas do mercado fossem resolvidos pelo próprio mercado, sem que houvesse qualquer intervenção do Estado. Hoje, ao contrário, o Governo Obama já empenhou vultosos recursos para evitar a quebra ou falência de instituições financeiras. A atuação do Governo americano rapidamente encontrou eco nos governos da União Européia, que também passaram a intervir no mercado de modo a impedir quebradeiras.
No Reino Unido, o berço do liberalismo, o Primeiro-Ministro Gordon Brown não hesitou em apelar para a estatização de bancos, o que contraria frontalmente os princípios do pensamento econômico liberal. Outro ponto a ser levantado é que, naquela época, havia quase que uma hegemonia econômica na figura de um país: os Estados Unidos da América. No cenário atual, os chamados países emergentes, como a Rússia, a Índia e o Brasil, também podem contribuir para a atividade econômica mundial não sofrer uma contração tão grande que passe do patamar de uma recessão para o da depressão, muito mais graves. Aí reside a verdadeira oportunidade que existe neste mar de obscuridade: fazer justamente o contrário do que pensam os analistas, projetando o Brasil como um dos principais líderes emergentes. 
Sras. e Srs. Deputados, nós já enfrentamos muitas crises e sobrevivemos. Talvez já tenhamos perdido as contas do número e da origem delas. Algumas foram provocadas pelo petróleo, outras, pela Rússia ou pela China, a maioria, gerada internamente, já que em matéria de crise o Brasil sempre foi autossuficiente. A tal ponto que, se não chegamos a ser fraternos amigos - nós e a crise - também não podemos negar que tenhamos nos tornado íntimos conhecidos. O País está no seu melhor momento, economicamente falando. Nunca esteve tão em dia com as suas obrigações - o dever de casa feito, o mercado interno tão forte, empresas tão sólidas, modernas e competitivas e as instituições tão garantidas - para encará-la. Mas ainda padecemos de alguns males que emperram nosso crescimento e o consequente distanciamento da crise e de todas suas mazelas: altas taxas de juros e atraso nas reformas. Um Estado grande e doente. 
Sras. e Srs. Deputados, esses são os verdadeiros entraves do crescimento. Nos primeiros 4 anos do Governo Lula, o País  cresceu menos do que a média da América Latina. Só crescemos mais do que o Haiti. Crescemos menos do que todos os outros países. Agora, nos últimos 2 anos, começamos a crescer um pouco mais. 
Por que o Brasil cresce tão pouco? Por que não crescemos como a Índia, o México, a China? Por que não crescemos 8%, 9%, 10% e nos contentamos, ficamos felizes quando crescemos 4% do PIB ao ano?
Tudo isso se deve a apenas uma coisa: um olhar febril e paralisado nas grandes empresas, nas multinacionais e no capital financeiro.
Até quando teremos que ver um governo socorrer instituições financeiras em detrimento das pequenas e médias empresas brasileiras que empregam mais de 65% da população economicamente ativa? Esse é o pensamento que infelizmente não sentimos presente nas decisões macroeconômicas. Se pensarmos no segundo aspecto - a taxa de juros -, cairemos num mal-estar maior ainda, pois são os pequenos empreendedores que mais dependem do empréstimo direto para compra de insumos e máquinas. Dessa forma, só podemos enxergar um aumento do endividamento e um atraso no desenvolvimento da economia - paralisa o dono da padaria, da lavanderia, da pequena fábrica de roupas, o artesão, a revendedora de veículos, todos os que são mais vulneráveis a uma mudança de rumo da economia. Pensando justamente nisso, era de se esperar que o primeiro socorro fosse a essas pessoas e não a quem, ano após ano, bate recordes de lucro líquido: os nossos bancos privados. 
Sras. e Srs. Deputados, trata-se portanto de uma crise que tem um aspecto mais profundo - uma segunda crise interna, de gestão e planejamento. Enquanto vimos os países europeus terem subsídios claros e concretos para seus empreendedores, no Brasil, ser proprietário de uma pequena empresa é uma aventura que muitas vezes não tem fim. Ou quando há, ele é negro. 
Estamos aqui para mostrar o que precisa ser feito. Não queremos jogar no quanto pior melhor. Queremos alertar o Governo para que tome as medidas corretas. O papel da Oposição é mostrar o que precisa ser feito, mostrar o que não está sendo feito, o que está sendo feito de forma incompleta, para que o setor produtivo brasileiro sofra o mínimo possível com essa crise e possa resguardar, acima de tudo, o emprego, que é o de que o País mais necessita. 
Sr. Presidente, solicito a V.Exa. que autorize a divulgação deste discurso pelo programa A Voz do Brasil e pelos demais órgãos de comunicação da Casa.
Muito obrigado."
2009-04-01T15:24;MUNICÍPIO, MAIRIPORÃ, SP, ANIVERSÁRIO DE FUNDAÇÃO, HISTÓRIA, CONGRATULAÇÕES.;PEQUENO EXPEDIENTE;"O SR. JORGE TADEU MUDALEN (DEM-SP. Pronuncia o seguinte discurso.) - Sr. Presidente, Sras. e Srs. Deputados, na última semana comemoramos com muita alegria o aniversário de 120 anos do Município de Mairiporã.
Mairi, bonita, porã, cidade - definição que caracteriza plenamente o relevo montanhoso e bucólico da bela cidade paulista. Pelos limites físicos com as cidades de São Paulo, Atibaia, Nazaré Paulista, Guarulhos, Caieiras, Franco da Rocha e Francisco Morato, o Município constitui importante ponto de acesso rodoviário, entrecortado pelas Rodovias Fernão Dias e D. Pedro I. A sua proximidade com a Região Metropolitana de São Paulo dá destaque especial à economia e ao desenvolvimento social do Município.
Na qualidade de cidadão que vive na região e de Parlamentar federal que representa o Estado de São Paulo, sempre tive atenção e apreço pelas pessoas que compõem esta magnífica localidade.
Em sua evolução, a área de Mairiporã, inicialmente Juqueri, se configurou à maneira de outros núcleos de povoamento ao redor da Vila de São Paulo, servindo como proteção desta e de ponto de apoio às rotas de ligação com o sertão interior. O povoado surgiu em fins do século XVI ou meados do século XVII, em torno da Capela de Nossa Senhora do Desterro, erguida por Antonio de Souza Del Mundo. Ao redor da capela, e funcionando como apoio elementar de serviço às atividades rurais, originalmente exclusivas na área, surgiu um núcleo dotado de interessante traçado e capacidade de adaptação ao sítio pouco favorável de sua implantação. Inseriu-se inicialmente na área de domínio administrativo de São Paulo e posteriormente na de Guarulhos.
Em 1696 o povoado foi elevado à categoria de Vila de Nossa Senhora do Desterro de Juqueri, palavra tupi que designa uma planta leguminosa conhecida também como dormideira. No ano de 1783 passou a ser paróquia; a capela transformou-se em igreja e passou por diversas modificações (em 1841; na década de 40; e em 1982). A última reforma descaracterizou o antigo templo, conservando apenas a torre. A Vila de Juqueri adentrou o século XVIII como fonte de produtos agrícolas para São Paulo, chegando a produzir algodão e vinho para exportação. Não prosperou como outras localidades inseridas nas regiões das lavras de ouro e pedras preciosas, caracterizando-se como pouso de tropeiros que faziam o abastecimento das Gerais.
Em 1769, a Câmara paulistana determinou a abertura de uma estrada entre Juqueri e São Paulo. O Caminho de Juqueri transformou-se mais tarde na Estrada Velha de Bragança.
Antes Distrito da Capital (1874 a 1880) e de Nossa Senhora da Conceição de Guarulhos (1881 a 1888), Juqueri passou a ser município por meio da Lei Provincial nº 67, de 27 de março de 1889. Um ano antes da emancipação, a São Paulo Railway (Estrada de Ferro Santos-Jundiaí) construiu a Estação do Juqueri. Em 1898, o Governo do Estado inaugurou o Hospital-Colônia de Juqueri para doentes mentais, dirigido pelo médico Franco da Rocha.
A associação do nome de Juqueri ao hospital, causando confusão na entrega de correspondências e desconforto entre os juquerienses, criou um movimento para mudar o nome do município. Em 1948, o Prefeito Bento de Oliveira solicitou à Assembleia Legislativa autorização para a mudança. Na ocasião, o Deputado Ulysses Guimarães apoiou o pedido e pronunciou a célebre frase: ""Juqueri, terra de loucos. Loucos por cidadania"".
No dia 24 de dezembro daquele ano foi aprovada a Lei nº 233, permitindo a mudança do nome do município. O nome Mairiporã, entre outros de origem tupi-guarani, foi sugerido pelo jornalista e poeta Araújo Jorge, significando precisamente cidade (mairi) bonita (porã). Assim, a cidade é conhecida como Aldeia Pitoresca.
Sras. e Srs. Deputados, na década de 50, Mairiporã foi marcada pela vinda da Companhia Cinematográfica Multifilmes, dirigida pelo cineasta Mário Civelli. Hoje ainda existem os barracões da companhia onde foi rodado o primeiro filme colorido no Brasil.
Com a implantação da Rodovia Fernão Dias, ligação de São Paulo a Minas Gerais, houve a redescoberta e a valorização intensa de Mairiporã, em razão dos atributos naturais da região para abrigar residências secundárias de alto padrão e, posteriormente, para moradia fixa. Em 1992, a região da Cantareira foi reconhecida como Patrimônio da Humanidade pela UNESCO.
Hoje, ao comemorar seus 120 anos de idade, a bela e jovem Mairiporã recebe o apreço de todos aqueles lutam por um país melhor e pela qualidade de vida das pessoas que lá vivem.
Parabéns, Mairiporã! Parabéns, população que faz desta cidade um local gostoso e harmonioso para se viver! 
Sr. Presidente, solicito a V.Exa. que autorize a divulgação deste discurso pelo Programa A Voz do Brasil e pelos demais órgãos de comunicação da Casa.
Muito obrigado."
2009-04-07T15:20;"CRISE ECONÔMICA, ÂMBITO INTERNACIONAL, AVALIAÇÃO.
QUALIFICAÇÃO PROFISSIONAL, INVESTIMENTO EM EDUCAÇÃO, EDUCAÇÃO PROFISSIONAL, EDUCAÇÃO TECNOLÓGICA, BENEFÍCIO, CRESCIMENTO ECONÔMICO, AVALIAÇÃO, DEFESA.";PEQUENO EXPEDIENTE;"O SR. JORGE TADEU MUDALEN (DEM-SP. Pronuncia o seguinte discurso.) - Sr. Presidente, Sras. e Srs. Deputados, muito se tem discutido nas últimas semanas acerca da crise econômica e seus efeitos. Inflação, queda na produtividade das empresas, falta de crédito no mercado e desemprego são algumas das muitas versões para um horizonte que se vislumbra no futuro. Por crise, entende-se flagelamento de economias, que são totalmente conectadas umas às outras pelo sistema capitalista e pela ação de especuladores nas Bolsas mundiais. Advém daí, certamente, a fina consistência de todas as outras marés de terror que vivenciamos no último século - México, 1994; Tigres Asiáticos, 1997; e o ataque ao dólar em 1999. 
É certo que a nossa marola não é tão grande quanto se pensava; os novos números da economia nos mostram isso e suavizam o temor de todos. Há esperança, sim, de sairmos desse cenário sem tantas escoriações. 
No entanto, além de propiciarmos uma reflexão em conjunto sobre o atual sistema de desenvolvimento econômico - como fez o grupo dos países mais ricos semana passada, o G20 -, é preciso entender que um país só é soberano quando existe massa produtiva capacitada, massa de pessoas que reinventa o trabalho e produz com poucos recursos. Gerar empregos não mais pode ser atividade exclusiva do Estado, mas de ação conjunta entre a iniciativa privada, Governos Estaduais e a sociedade. E o caminho é um só: educação como qualificação. 
Sr. Presidente, o crescimento do número de universidades é algo inconteste e já provoca mudanças significativas, na medida em que há inclusão de pessoas carentes, de uma fatia de grupos antes excluídos como os negros e indígenas, e também quando o Governo cria centros de ensino no interior do País - um movimento salutar que advém de uma política educacional afirmativa adotada na gestão do ex-Ministro Paulo Renato Souza. 
Contudo, ainda há uma lacuna densa que urge ser preenchida - os cursos de ensino profissionalizantes. O Censo Escolar, divulgado no mês de fevereiro deste ano, apontou que este foi um dos segmentos que mais cresceu na Educação Básica em 2008. Os cursos técnicos de todo o País tiveram crescimento de 14,7% no número de matrículas. Houve acréscimo significativo nos 2 módulos de ensino técnico. Na educação técnica, oferecida aos alunos que já concluíram o ensino médio, o aumento foi de 10,5%. Já no ensino técnico realizado junto com o médio, o acréscimo foi ainda maior: atingiu a casa dos 19,6%. Evidentemente, o aumento na procura se deve à exigência do mercado de trabalho em querer profissionais qualificados. 
A vantagem do aluno que faz curso técnico é que ele sai pronto para atuar em apenas 2 anos, enquanto no ensino superior a duração pode chegar a 5 anos.  E este é um benefício que não pode ser esquecido ou trancafiado pelas políticas públicas do Governo. 
É preciso que a SETEC - Secretaria de Educação Profissional e Tecnológica do Ministério da Educação - amplie o processo de implementação da política da educação profissional e tecnológica, bem como os Governos Estaduais recebam recursos necessários para aproximar os estudantes das empresas, numa parceria que traga mais emprego e perspectivas para esse conjunto grandioso de jovens desempregados e com dificuldades tácitas de conseguir o primeiro emprego. 
Sras. e Srs. Deputados, há inúmeros benefícios que podemos disponibilizar para a sociedade com a ampliação dessa atividade educacional. Cito apenas alguns que ilustram a questão. 
Primeiramente, a possibilidade de empreender. Com o conhecimento nas mãos, novos cabeleireiros, padeiros, carpinteiros, desenhistas, cozinheiros podem fazer da profissão um negócio, criando-se, assim, vagas de trabalho ativando a cadeira de consumo. Se pensarmos que os maiores empregadores deste País são micro e pequenos empresários, teremos a certeza imediata de que existe coerência entre o discurso e a prática. 
Além disso, podemos somar o próprio momento que o País vive. E aí, remeto-me novamente à crise. Num país onde há expressiva massa de pequenos empresários, que gerenciam seu próprio negócio, o temor do desemprego passa um pouco distante. A possibilidade de freio na atividade produtiva é menor se comparado com grandes empresas, que são invariavelmente mais dependentes de insumos, transporte e encargos trabalhistas - salário e tributos. 
Dessa forma, não há como se pensar num futuro saudável sem enxergarmos um Brasil onde as pessoas possam ter mais independência econômico-produtiva, sem pensarmos que o Estado deva ter menos interferência nos rumos da microeconomia e sem pensarmos que a qualificação é um diferencial para os jovens que batem às portas, todos os dias, à procura de emprego. 
Com muito orgulho, recordo-me do início da Escola Técnica na Vila Rio, em Guarulhos, dos esforços que engendramos para sua existência, para o início de suas atividades e o quanto esta representa hoje para o Município. 
Tenho certeza de que a revolução não é de sangue, mas de livros. E as armas não mais são de pólvora, mas, sim, de bytes.
Sr. Presidente, solicito a V.Exa. a divulgação deste discurso no programa A Voz do Brasil e demais órgãos de comunicação da Casa
Muito obrigado."
2009-04-15T11:28;JORGE TADEU MUDALEN, DEPUTADO FEDERAL, NOMEAÇÃO, SECRETARIA MUNICIPAL DE ARTICULAÇÃO METROPOLITANA, CIDADE, SÃO PAULO, SP, ATUAÇÃO, DESENVOLVIMENTO, REGIÃO METROPOLITANA, AVALIAÇÃO.;BREVES COMUNICAÇÕES;"O SR. JORGE TADEU MUDALEN (DEM-SP. Pronuncia o seguinte discurso.) - Sr. Presidente, Sras. e Srs. Deputados, na semana passada recebi com muita satisfação, do Prefeito da cidade de São Paulo, Gilberto Kassab, o convite para assumir a recém-criada Secretaria de Articulação Metropolitana, uma das tarefas mais importantes para a cidade e para os 38 municípios de seu entorno: aproximar projetos e ideais afins, trabalhando pelo desenvolvimento da macrorregião. 
O Brasil possui 26 regiões metropolitanas, congregando 68 milhões de pessoas, o equivalente a 40% da população brasileira. São 413 dos 5.561 municípios existentes no País. Com população aproximada de 20 milhões de habitantes, representando 3,24% do total do território do Estado, a Região Metropolitana de São Paulo convive com problemas diversos. Alguns de ordem estrutural, decorrentes do aumento do número de veículos e do uso de recursos renováveis como água; outros pontuais e críticos, oriundos do crescimento urbano desordenado ocorrido sobretudo nos anos 70, quando houve significativo crescimento econômico devido ao surgimento de uma indústria automobilística.
Acrescentam-se também as questões de fronteira. E há discussões constantes sobre a origem da responsabilidade administrativa legal das áreas. 
Sras. e Srs. Deputados, algumas experiências políticas em discussão servirão de norteamento para o enfrentamento destas questões. Na Comissão de Desenvolvimento Urbano da Câmara há uma subcomissão para tratar exatamente dos assuntos metropolitanos.
O nosso objetivo é o de levar esse fórum para São Paulo, ampliando a participação dos Prefeitos, dos gestores públicos, na decisão sobre as ações que vamos engendrar na Secretaria. Como guarulhense, tratarei firmemente das questões pendentes, como a inclusão do município a um sistema interligado de bilhete único e o tratamento de esgoto, conhecimento que tenho desde a época em que tive o prazer de ser Superintendente do SAAE, autarquia pública daquele município. Hoje, 34 Municípios da Grande São Paulo poluem o Rio Tietê, e essa gestão única trabalhará para termos a nossa água limpa. 
Sr. Presidente, no nosso pensamento não há espaço para visões políticas. A própria Constituição brasileira de 1967 colocava a União como responsável pela criação das regiões metropolitanas. Felizmente, no ano de 1973, a partir de lei complementar, foram implantadas 8 delas junto às principais cidades do País. Com a Constituição de 1988, os Estados passaram a ter essa atribuição. Todavia, ainda há problemas centrais, devido à falta do estabelecimento de diretrizes por parte da União.
E este será um papel fundamental que desempenharei na Secretaria: trabalhar para que as políticas públicas do Município de São Paulo estejam alinhadas com as do Governo Federal e tenham também o respaldo do mesmo. Para tanto, é necessária a criação de um fundo de compensação para que os grandes municípios, para que estas regiões metropolitanas, tenham a sua administração pública qualificada e não sofram com problemas orçamentários. 
Todas as cidades terão prioridade, sem preferência partidária. Se conseguirmos fazer a integração do transporte coletivo, será bom também para a metrópole, uma vez que o fluxo de veículos que adentram nela diminuirá, e daremos uma alternativa economicamente mais viável à população. 
Dessa forma, tenho certeza de que o meu afastamento temporário desta Casa será benéfico para todos os paulistas e paulistanos que necessitam de ação participativa para a solução de problemas vitais, sensíveis à qualidade de vida de todos. 
 Sr. Presidente, solicito a V.Exa. que autorize a divulgação deste discurso pelo Programa A Voz do Brasil e pelos demais órgãos de comunicação da Casa.
Muito obrigado."
2009-04-15T11:28;JORGE TADEU MUDALEN, DEPUTADO FEDERAL, NOMEAÇÃO, SECRETARIA MUNICIPAL DE ARTICULAÇÃO METROPOLITANA, CIDADE, SÃO PAULO, SP, ATUAÇÃO, DESENVOLVIMENTO, REGIÃO METROPOLITANA, AVALIAÇÃO.;PELA ORDEM;"O  SR. JORGE TADEU MUDALEN (DEM-SP. Pela ordem. Sem revisão do orador.) - Sr. Presidente, Sras. e Srs. Deputados, com muita satisfação, venho à tribuna desta Casa agradecer o tratamento que recebi, ao longo desses 2 primeiros anos de mandato, por parte dos funcionários e dos pares.
Na semana passada, recebi um convite do Prefeito Gilberto Kassab para assumir a Secretaria de Articulação Metropolitana, a qual deverei assumir na semana que vem.
	É uma Secretaria importante. O Brasil possui 26 regiões metropolitanas, e esta Casa, na semana que vem, começa a discutir os problemas dessas regiões, nas quais cerca de 68 milhões de pessoas vivem. Em São Paulo, elas são formadas por 38 municípios, em que hoje vivem aproximadamente 19 milhões de pessoas.
	É um desafio. Muitos problemas conflitam com a cidade de São Paulo, e essas 38 cidades se confrontam. Nós aceitamos o desafio. Espero desenvolver um trabalho que propicie transporte coletivo melhor e fazer uma gestão única na Região Metropolitana de São Paulo.
	Agradeço a oportunidade que o Presidente nos dá. Cumprimento todos os funcionários e Deputados e Deputadas com quem convivi nesses anos de mandato.
	Muito obrigado, Sr. Presidente."
2010-04-14T14:10;RODOVIA FERNÃO DIAS, TRECHO, MUNICÍPIO, MAIRIPORÃ, ATIBAIA, BRAGANÇA PAULISTA, DESABAMENTO.;PEQUENO EXPEDIENTE;O SR. JORGE TADEU MUDALEN (DEM-SP. Sem revisão do orador.) - Sr. Presidente, Sras. e Srs. Deputados, quero falar a respeito de matéria publicada hoje no jornal O Estado de S.Paulo a respeito de concessão federal que é apenas um tapa-buraco. A população de Atibaia e Mairiporã vive já há 3 meses sem poder trafegar na Rodovia Fernão Dias. Depois de 2 anos de a concessão ter sido passada a uma empresa privada, aconteceu um acidente: a estrada ruiu. Já faz 3 meses que a população não consegue acessar as cidades Mairiporã, Atibaia e Bragança Paulista, causando grande transtorno à população que vive na região de Guarulhos, obrigada a conviver com um tráfego intenso.
2010-05-13T09:24;RODOVIA, FERNÃO DIAS, TRECHO, MUNICÍPIO, MAIRIPORÃ, ATIBAIA, SP, RECUPERAÇÃO, OBRA PÚBLICA, CONCLUSÃO, SOLICITAÇÃO.;BREVES COMUNICAÇÕES;"O SR. JORGE TADEU MUDALEN (DEM-SP. Sem revisão do orador.) - Sr. Presidente, Sras. e Srs. Deputados, venho a esta tribuna mais uma vez fazer um apelo em relação à Rodovia Fernão Dias, que foi privatizada.
Há 5 meses, houve um recalque em uma das pontes que liga São Paulo à região de Mairiporã e Atibaia, e aquela população, hoje, vive ilhada. Para se ter acesso a Mairiporã, Franco da Rocha, Caieiras, Atibaia, tem-se que dar a volta e pegar a Dutra ou a Bandeirantes. A empresa concessionária está fazendo um trabalho muito lento e sem previsão de entrega.
	Faço, portanto, esse apelo à Agência - já estivemos no DNIT - para que fiscalize essa obra, a fim de que a Rodovia Fernão Dias seja reaberta à população que por lá transita.
	Muito obrigado."
