dataHoraInicio;keywords;tipoDiscurso;transcricao
2007-10-31T16:22;PROJETO DE LEI COMPLEMENTAR, REGULAMENTAÇÃO, CONSTITUIÇÃO FEDERAL, EMENDA CONSTITUCIONAL, FIXAÇÃO, PERCENTAGEM, APLICAÇÃO DE RECURSOS, UNIÃO FEDERAL, ESTADOS, DF, MUNICÍPIOS, FINANCIAMENTO, SERVIÇOS PÚBLICOS, SAÚDE PÚBLICA, REQUERIMENTO, DESTAQUE,  VOTAÇÃO, SUBSTITUTIVO, PREFERÊNCIA, SUBEMENDA SUBSTITUTIVA, APOIAMENTO, PARTIDO POLÍTICO, DEM, DARCÍSIO PERONDI, PRESIDENTE, FRENTE PARLAMENTAR DA SAÚDE, MANIFESTAÇÃO,  DEFESA.;PELA ORDEM;"O SR. JORGE TADEU MUDALEN (DEM-SP. Pela ordem. Sem revisão do orador.) - Sr. Presidente, o DEM encaminha o voto ""sim"" e faz um apelo ao Presidente da Frente Parlamentar da Saúde no sentido de que faça sua argumentação aqui também, que tem sido brilhante na defesa da Emenda nº 29. Em todas as nossas reuniões na Comissão de Seguridade Social e Família e ontem com o Presidente da República o assunto foi muito bem encaminhado. Então, fazemos um apelo para que encaminhe o voto ""sim"". Vamos diminuir a mortalidade infantil pela metade com a aplicação dos 20 bilhões que exigimos do Governo"
2008-03-05T14:52;JORNAL, GARULHOS HOJE, LANÇAMENTO, DIVULGAÇÃO, PESQUISA DE OPINIÃO, JORGE TADEU MUDALEN, DEPUTADO FEDERAL.;BREVES COMUNICAÇÕES;"O SR. JORGE TADEU MUDALEN (DEM-SP. Pronuncia o seguinte discurso.) - Sr. Presidente, Sras. e Srs. Deputados, nesta oportunidade, quero parabenizar Luciano Maciel, presidente do jornal Guarulhos Hoje, que marcou nossa cidade no  dia 4 de março, com  a nova edição do jornal, que será de grande importância para contribuir na construção de nossa cidade.
Para dar início a essa nova fase da imprensa guarulhense, o Guarulhos Hoje traz, já em sua primeira edição, um pouco do que pretende mostrar daqui para frente. Como manchete principal, o resultado da primeira pesquisa de intenção de votos contratada pelo jornal a um instituto profissional e sem vínculos partidários. O Guarulhos Hoje entende que as pesquisas devem servir para os leitores terem uma noção sobre a preferência do eleitorado guarulhense, sem a intenção de direcionar ou influenciar em futuras tendências. Ou seja, vem cumprir o papel de imprensa independente e comprometida com seu bem maior, que é seu eleitor.
Quero, portanto Sr. Presidente, agradecer ao povo guarulhense os 12% de intenção de votos a mim creditados.
Era o que tinha a dizer.
Muito obrigado."
2008-03-13T16:27;"COMISSÃO DE SEGURIDADE SOCIAL E FAMÍLIA, PRESIDENTE, JORGE TADEU MUDALEN, ATUAÇÃO, DESEMPENHO DO TRABALHO, APROVAÇÃO, MATÉRIA, INTERESSE NACIONAL. 
ORÇAMENTO, UNIÃO FEDERAL, EMENDA, OBRA PÚBLICA, MUNICÍPIO, GUARULHOS, SP, APROVAÇÃO.";GRANDE EXPEDIENTE;"O SR. JORGE TADEU MUDALEN (DEM-SP. Pronuncia o seguinte discurso.) - Sr. Presidente, Sras. e Srs. Deputados, antes de mais nada, quero agradecer a Deus a oportunidade de estar aqui nesta tarde; ao Deputado André de Paula, querido amigo e Presidente da Comissão de Meio Ambiente, que gentilmente trocou comigo a ordem de inscrição no Grande Expediente; e, principalmente, aos companheiros da Comissão de Seguridade Social da Câmara dos Deputados. 
 Sr. Presidente, Sras. e Srs. Deputados, inicio este discurso cumprimentando o Missionário RR Soares, da Igreja Internacional da Graça de Deus, pelo evento realizado no Rio de Janeiro recentemente. Gostaria também de convidá-lo para 2 eventos a serem realizados em 22 de maio, um em São Paulo, pela manhã, e outro em Belo Horizonte, às 17h.
Tenho a honra de estar cumprindo o quinto mandato representando o povo de São Paulo. Nos 12 meses que se encerram agora, pude honrar este mandato de uma forma especial, pois tive a valiosa oportunidade de presidir a Comissão de Seguridade Social e Família.
No âmbito maior, a Câmara dos Deputados não teve um bom um ano. Fomos esmagados pelo desrespeito do Presidente da República, que se excedeu em muito na edição de medidas provisórias e dominou a pauta desta Casa. Temas como a reforma política não avançaram, e deixamos ao Poder Judiciário a possibilidade de regular importantes questões políticas que seriam mais afeitas à discussão própria do Poder Legislativo. Assistimos também a vários momentos de paralisia, sobretudo devido a crises políticas e denúncias recorrentes de escândalos que imobilizaram, por exemplo, a outra Casa legislativa, o Senado Federal.
A Comissão de Seguridade Social e Família, contudo, nos felicitou com uma claro contraste em termos de eficiência, desembaraço e decisão política. Lá fui honrado com o convívio de colegas que gozam do mais alto respeito neste Parlamento. Pude caminhar lado a lado com Parlamentares incansáveis nas lutas meritórias que são as demandas na saúde, na assistência e na previdência social, e pude aprender com aqueles mais experientes que formam o esteio permanente daquele colegiado.
Posso afirmar que a Comissão de Seguridade Social e Família é uma das mais importantes Comissões desta Casa, tanto pela preeminência dos assuntos lá tratados como pela sua produção abundante e de altíssima qualidade. Sob minha presidência, a Comissão realizou 44 reuniões deliberativas, 32 audiências públicas e 7 seminários. Foi apreciado o inédito número de 424 proposições e 117 requerimentos. A produção da Comissão, que vem numa tendência crescente há anos, atingiu no ano que encerrou um recorde.
Não sou capaz de pontuar qual dessas reuniões ou audiências foram mais importantes, porque sobretudo o que me impressionou e marcou minha opinião sobre a Comissão foi que ela é composta por um time de Parlamentares de alto nível. Lá atuam ex-Ministros, ex-Secretários Estaduais de Saúde e profissionais da área médica proficientes em muitas especialidades. 
E aqui aproveito para cumprimentar os Deputados Germano Bonow e Dr. Nechar, que sempre estiveram ao meu lado nas atividades desenvolvidas pela Comissão, assim como o atual Presidente da Comissão, Deputado Jofran Frejat, representante do Distrito Federal. Quero também, Sr. Presidente, fazer especial menção ao meu amigo, companheiro e conselheiro Deputado Alceni Guerra, 1° Vice-Presidente da Comissão, figura sempre presente e essencial para o bom andamento dos trabalhos. Não poderia também deixar de considerar e referir-me a todo seu corpo técnico funcional, que viabilizou o encaminhamento dos trabalhos no melhor nível possível. 
No ano de 2007, a Comissão de Seguridade Social e Família enfrentou temas como a expansão do número de casos de dengue no País, a queda no número de cirurgias de catarata, o novo modelo de assistência à saúde mental desenvolvido pelo Ministério da Saúde, as políticas sociais do Governo, com destaque para a análise e acompanhamento do Programa Bolsa Família. Em todos essas ocasiões buscamos valorizar as informações técnicas, estimular o debate construtivo e encetar ações objetivas voltadas à resolução dos problemas. Um dos momentos de maior sucesso da Comissão foi o esforço bem-sucedido do nosso grupo de Parlamentares, e também da Frente Parlamentar de Saúde, na aprovação do Projeto de Lei Complementar n° 1, de 2003, que regulamenta a Emenda Constitucional n° 29. Tivemos uma vitória importante, que firmou o compromisso legal de se carrear mais recursos financeiros para as ações de saúde do Governo Federal, dos Estados e dos municípios. Contamos nessa luta com a postura lúcida e sólida do Ministro da Saúde, Sr. José Gomes Temporão, parceiro na busca desse incremento orçamentário e batalhador pela boa aplicação dos recursos públicos na área da saúde.
Na condição de Presidente da Comissão de Seguridade Social e Família, pude aprender mais sobre o setor e suas necessidades e conviver com Parlamentares motivados, atuantes e comprometidos com o povo brasileiro.
É importante também que eu preste contas ao eleitorado paulista de minhas ações individuais, pois 2007 foi também um ano de muita luta e atuação do Parlamentar Jorge Tadeu Mudalen. Na qualidade de Relator, ressalto a satisfação de aprovar 2 projetos importantes para a população brasileira.
O primeiro foi o Projeto de Lei n° 7.130, de 2006, de autoria do Sr. Fernando Coruja. Esse projeto trata do limite de juros e taxas nos empréstimos consignados feitos a aposentados e pensionistas. Sob minha relatoria, com o apoio dos Deputados Germano Bonow e Dr. Nechar, pudemos aprovar, depois de certa resistência, a fixação dos juros em 6% ao ano. E, ainda, diminuímos para 20% a parcela das aposentadorias e pensões que podem fazer frente aos empréstimos. Em parte, o Governo já acatou essas regras por ações administrativas, mas, principalmente no que se refere aos juros, a luta continua. Consideramos que um empréstimo feito praticamente sem risco para a instituição financeira não pode onerar os beneficiários do Regime Geral de Previdência Social em demasia. E é ao excesso que temos assistido actualmente, com juros anuais que passam da casa dos 30%. Esperamos que o projeto tenha êxito nas etapas seguintes da tramitação, para que esse sonho com o qual tive a honra de contribuir possa ser vitorioso em nosso Parlamento.
Outro projeto que tive a honra de relatar foi o de n° 2.604, de 1996. Nele aprovamos incentivos fiscais para a aquisição de equipamentos médico-hospitalares, inclusive ambulâncias, por instituições sem fins lucrativos. Nesse projeto novamente constatamos que a justiça em relação à saúde ainda está distante, sobretudo pela carga tributária e financeira que se impõe sobre os insumos e investimentos do setor, o que acaba por onerar os serviços de saúde destinados a todos, mas sobretudo aos mais pobres. Com o apoio da Comissão de Seguridade Social e Família, atuamos para retirar para longe dos ombros do cidadão necessitado uma parte dessa abjeta carga tributária.
O Sr. Dr. Nechar - Permite-me V.Exa. um aparte?
	O SR. JORGE TADEU MUDALEN - Pois não.
 	O Sr. Dr. Nechar - Querido amigo e colega Deputado Jorge Tadeu Mudalen, quero testemunhar que V.Exa. dirigiu muito bem a Comissão de Seguridade Social e Família. Atingimos recordes no ano passado: 424 proposições e 117 requerimentos apreciados e votados, 44 reuniões deliberativas, 32 audiências públicas e 7 seminários realizados. Na qualidade de membro daquele órgão técnico, agradeço a V.Exa. a forma superior como dirigiu os seus trabalhos. Espero que o querido amigo Deputado Jofran Frejat consiga exercer com mais galhardia ainda a presidência daquele órgão neste ano de 2008. V.Exa. está de parabéns pelos trabalhos realizados na Comissão.
	O SR. JORGE TADEU MUDALEN - Obrigado.
	Ouço o Deputado Germano Bonow.
	O Sr. Germano Bonow - Deputado Jorge Tadeu Mudalen, em nome dos democratas membros da Comissão de Seguridade Social e Família, em especial do Deputado André de Paula, aqui presente, também quero deixar registrado o excelente trabalho daquele órgão sob a sua presidência, os importantíssimos projetos que ali foram relatados, aprovados ou rejeitados, sem falar nos seminários que foram realizados, como aquele sobre medicamentos, que julgo de suma importância. Aliás, espero que ele seja repetido este ano, de modo que possamos nos atualizar com novos os dados e informações. Parabéns, Deputado Jorge Tadeu Mudalen. E continue nesse mister e nessa luta em prol da nossa democracia.
O SR. JORGE TADEU MUDALEN - Ao agradecer aos Deputado Germano Bonow e Dr. Nechar os apartes, quero dizer que só foi possível imprimir aquele ritmo de trabalho graças a V.Exas., que enriqueceram a Comissão.
Prossigo, Sr. Presidente.
Embora a Comissão de Seguridade Social e Família ainda não tenha se manifestado sobre meu parecer, destaco pela sobranceira importância o Projeto de Lei 1.135, de 1991, que descriminaliza a prática do aborto no Brasil. Esse projeto tramita há 16 anos nesta Casa, e enfeixa em si uma das questões públicas mais candentes. Trata-se de complexa discussão que envolve saúde pública, ética, filosofia, religião e políticas públicas.
Quando assumi a relatoria do projeto, comprometi-me em ter uma posição concreta sobre o tema e a pautar-me todo o tempo pela democracia e o respeito a todas opiniões. Realizamos 3 audiência públicas com pesquisadores e atores de destaque no tema, contrários e favoráveis à descriminalização; convidamos - sem sucesso infelizmente - o Sr. Ministro da Saúde para participar de debates em nossa Comissão; buscamos com afinco o maior número de informações sobre a questão e, por fim, ao completarmos 6 meses de trabalho intenso, apresentamos nosso parecer à Comissão. E, baseados em dados colhidos no 13º Encontro realizado aqui em Brasília, com a presença de mais de 5 mil pessoas vinculadas ao setor saúde - 70% delas se posicionaram contrárias ao aborto -, defendemos que o aborto não deve ser descriminalizado no Brasil, que as regras atuais devem ser mantidas. 
Por outro lado, enfatizamos em nossa manifestação a necessidade do Poder Público cumprir com suas obrigações constitucionais de defender a vida integralmente, provendo bons serviços de saúde, de assistência social, de garantia de emprego, moradia, segurança e educação às mães, aos filhos e às famílias como um todo. Neste ano que agora se inicia esperamos que a coragem e a sabedoria do colegiado possam se debruçar sobre esse projeto para que tenhamos, afinal, um desfecho nessa questão.
Se até agora discuti questões ligadas a políticas públicas nacionais no Parlamento, volto minha atenção para o município. Município é onde se concentram as demandas do povo na proporção direta da escassez das verbas. Enquanto a União fica com a parte do leão e os Estados garantem o seu quinhão, os municípios dependem de repasses, sempre escassos para suas responsabilidades nas áreas da saúde, educação, assistência, cultura e serviços públicos urbanos. Sobre meus compromissos específicos com a população da região de Guarulhos, ressalto minha atuação em defesa dos seus interesses no que diz respeito à saúde, à moradia e à lisura dos gastos públicos.
Se voltamos então nossos olhos para o futuro, gostaria de falar sobre como cuidar de nossas cidades, sobre como, na condição de Parlamentar, atender de forma mais próxima o cidadão. Em primeiro lugar, desejo falar dos jovens. O Brasil tem enorme massa de jovens em situação de risco, pois são vítimas do analfabetismo, estão desempregados e têm famílias desestruturadas. Colocamos como proposta para esses problemas a vinculação de qualquer repasse de verba pública à obrigação de prestação de serviços sociais voltados aos jovens. Mais que isso, propomos ainda que a cada real investido em repressão a crimes invistamos ao menos quantia igual na promoção de oportunidades para os jovens.
Sobre a segurança pública, essa deve ser tratada no âmbito das discussões políticas, dada sua importância para os valores mais fundamentais da mulher e do homem brasileiros. Proponho que invistamos mais em sistemas de informação, pois só com ações de inteligência poderemos quebrar a espinha dorsal do crime, que é o tráfico de armas e de drogas e a corrupção pesada. É preciso ainda que a Polícia atue de forma mais ostensiva, fazendo-se presente ao lado da população em todos os momentos de necessidade.
Em relação à saúde, é preciso ir direto à causa de maioria dos problemas, é preciso investir em saneamento básico, pois temos atualmente no Brasil 43 milhões de habitantes sem serviços adequados. Outra proposta é que todo serviço de saúde, e os respectivos recursos, seja centralizados nos municípios, cabendo à União e Estados outras atribuições, como pesquisas e coordenação.
Sobre a educação, que é, sim, a verdadeira revolução de que o País necessita, precisamos, em primeiro lugar, valorizar o professor, e fazer isso por meio de melhores salários e formação continuada. Precisamos ainda elevar a carga diária de permanência na escola ao mínimo de 6 horas, devendo estender esse período tão logo a meta seja atingida.
Antes de encerrar, gostaria de prestar contas ao povo de Guarulhos, informando que envidei todos os esforços perante a bancada paulista para que fosse aprovada uma emenda coletiva que destina R$25 milhões às obras da Avenida Jacu Pêssego, ligando Guarulho ao Pólo da Baixada Santista, em especial ao Porto de Santos.
De forma individual, aprovei emendas no valor de R$1,1 milhão destinadas à saúde e infra-estrutura urbana, como forma de fazer nossa cidade melhor e mais atenciosa às necessidades de seu povo. E aqui convém referir a pavimentação da Rua Jamil João Zarif, a duplicação da Avenida Santos Dumont e a implantação do Hospital Geral. 
Ao concluir, Sr. Presidente, Sras. e Srs. Deputados, agradeço aos companheiros do Democratas, em especial ao Líder da nossa bancada e ao Presidente do partido, que me deram todo o apoio necessário e me prestigiaram com o privilégio de presidir a Comissão de Seguridade Social e de Família, onde convivi com pessoas do mais alto quilate. A produtividade que aquela Comissão alcançou sob a minha presidência deste modesto engenheiro não se deveu a possíveis méritos meus, mas, sim, à competência e dedicação dos seus funcionários e, principalmente, a Deus, que me iluminou na sua direção. 
Senhoras e senhores, meu trabalho é uma obra em andamento, em busca de avanço e melhorias, feitas sempre por meio de contato com a população e de respeito aos seus anseios e interesses."
