dataHoraInicio;keywords;tipoDiscurso;transcricao
2009-02-17T16:36;"AGÊNCIA NACIONAL DE TELECOMUNICAÇÕES , ANATEL, OMISSÃO, ESTABELECIMENTO, NORMAS, PROTEÇÃO, CONSUMIDOR, ILEGALIDADE, QUEBRA DE SIGILO, SIGILO TELEFÔNICO, PROTESTO.
SINDICATO, PROFESSOR, AGRESSÃO, GESTÃO, YEDA CRUSIUS, GOVERNADOR, RS, PROTESTO.
YEDA CRUSIUS, GOVERNADOR, RS, ATUAÇÃO, ELOGIO.";LÍDER;"O SR. JOSÉ ANÍBAL (PSDB-SP. Como Líder. Sem revisão do orador.) - Sr. Presidente, vou recuperá-lo.
Sr. Presidente, Sras. e Srs. Deputados, em razão de uma fortuita investigação patrocinada por uma detetive privada a serviço de situações familiares, contratada por pessoas que se sentiam traídas e a ela recorriam, tive o telefone no meu nome, de uso da minha secretária, interceptado. 
	Sr. Presidente, quero trazer uma preocupação com essa situação que está se tornando incontrolável, dando lugar a verdadeiras organizações criminosas. 
O mais grave - e é para este ponto que quero chamar a atenção da Casa - é que a Agência Nacional de Telecomunicações, agência à qual cabe estabelecer as normas de segurança a serem observadas pelas empresas concessionárias da telefonia, móvel e fixa, tem-se omitido sistematicamente. E a ANATEL não só não estabelece as normas de segurança como também não estabelece, em consequência, um padrão de fiscalização para saber se essas normas estão sendo efetivamente adotadas. 
	É grave, Sr. Presidente, porque tal omissão deixa antever que a referida Agência - assim como, pelo que sabemos, praticamente todas as demais que foram criadas com o propósito de regulação, criação de marcos regulatórios adequados a estimular o investimento em energia, em petróleo, em telecomunicações, em transportes -, neste Governo Lula, está capturada e foi transformada em moeda de troca no balcão do jogo político. 
	Sr. Presidente, no caso da ANATEL, o que ouvimos sobre a ação dessa Agência foi no sentido da certificação de negócios na área de telefonia fixa e móvel; nada com relação à segurança dos milhões e milhões de usuários que têm garantia constitucional do sigilo de sua comunicação, salvo quando alguma suspeita acolhida por juiz ou juíza determine a quebra de sigilo telefônico.
	Sr. Presidente, isso é gravíssimo! São quadrilhas que se beneficiam e se desenvolvem em função da inação de uma agência que não toma qualquer providência. Nesse caso específico, a Polícia de São Paulo fez um trabalho da maior competência e conseguiu identificar os integrantes quadrilha. A Polícia Federal me procurou para se colocar à disposição. A Receita Federal também. Agora, essa Agência de certificação de negócios - e de grandes negócios - na área da telefonia fixa e móvel não deu uma palavra.
	Vejo aqui o Deputado Marcelo Itagiba, que preside a CPI das Escutas Telefônicas Clandestinas, que vai instar os diretores da ANATEL a que venham a esta Casa explicar por que a garantia e a fiscalização do sigilo é prioridade última ou nenhuma dessa Agência de telecomunicação.
	Por último, Sr. Presidente, neste escasso minuto que me resta, quero falar de decisão da Justiça do Rio Grande do Sul em relação a essa ação tresloucada, antidemocrática, absurda de sindicatos de professores que, se representam professores, representam e educam muito mal. Semana passada, inconformados com o jogo democrático e com a recuperação financeira do Rio Grande do Sul feita pela Governadora Yeda Crusius, fizeram uma ação que beira as práticas fascistas. 
	Espero que, com esse episódio gaúcho, com os resultados da administração, o povo do Rio Grande do Sul saiba cada vez mais o valor da gestão que está sendo feita pela Governadora Yeda Crusius - o déficit zerou, o Estado é investidor -  e que o desespero de quem perdeu e de quem está perdendo mordomias, de quem está perdendo privilégios, que custavam caro à administração sustentar, não se transforme em luta política selvagem.
	Muito obrigado."
2009-02-17T16:36;MEDIDA PROVISÓRIA, ALTERAÇÃO, LEIS, AMPLIAÇÃO, PRAZO, PAGAMENTO, PIS, PASEP, COFINS, IPI, IMPOSTO DE RENDA RETIDO NA FONTE, CONTRIBUIÇÃO PREVIDENCIÁRIA, DESTAQUE, VOTAÇÃO, EMENDA, VOTAÇÃO NOMINAL, APOIO.;PELA ORDEM;"O SR. JOSÉ ANÍBAL (PSDB-SP. Pela ordem. Sem revisão do orador.) - Sr. Presidente, primeiro estabelecemos que faríamos um acordo. Infelizmente, não deu acordo. Foi a primeira coisa que estabelecemos. Não tendo sido possível o acordo, vamos votar. Esse roteiro é bom. Esse é bom. Destaca as 3 matérias controversas. Vamos arbitrar a maioria. Agora, o que combinamos de votar em seguida foi o airbag, a urgência do projeto sobre os imigrantes, e votaríamos a proposta do cadastro positivo desde que apresentada 24h antes desta decisão. Como não foi apresentada, fica para amanhã. A colocação em votação da urgência ao projeto das filantrópicas é condicionada a 15 sessões posteriores a essa urgência.
	Proponho, então, que passemos para os 3 pontos sugeridos. Imagino que o Governo não tenha que objetar a isso, porque foi o que realmente nós tratamos, ontem, no Colégio de Líderes. Seria o melhor caminho, a meu ver."
2009-02-18T16:54;PROJETO DE LEI, CRIMINALIZAÇÃO, TROTE ESTUDANTIL, UNIVERSIDADE, TIPICIDADE, CONTRAVENÇÃO PENAL, SUBSTITUTIVO,  EMENDA  SUBSTITUTIVA DE PLENÁRIO, VOTO FAVORÁVEL, PARTIDO POLÍTICO, PSDB.;ORIENTAÇÃO DE BANCADA;"O SR. JOSÉ ANÍBAL (PSDB-SP. Pela ordem. Sem revisão do orador.) - Sr. Presidente, nesse final de semana, a imprensa publicou reportagem com a mãe do calouro da USP morto há 10 anos. O pai dele morreu, há alguns anos, de tristeza e por ver a impunidade dos 3 incriminados e identificados. Entre eles, há um principal identificado. Hoje, todos estão formados, são médicos, e nada aconteceu com eles.
	Foi uma reportagem forte que me motivou, junto com outros Parlamentares, a propor que a Câmara dos Deputados votasse esta matéria. O texto ideal nunca existirá, mas este texto testemunha um compromisso da instituição com o fim dessa prática, que está se tornando, em muitos casos, criminosa.
	PSDB vota a favor.
	O SR. PRESIDENTE (Michel Temer) - PSDB vota ""sim""."
2009-02-18T16:54;GILBERTO DUPAS, ECONOMISTA, MORTE, PÊSAMES, FAMÍLIA.;PELA ORDEM;"O SR. JOSÉ ANÍBAL (PSDB-SP. Pela ordem. Sem revisão do orador.) - Sr. Presidente, sei que V.Exa., que foi companheiro de governo de Gilberto Dupas, compartilha amplamente o profundo pesar pela morte desse grande economista, grande servidor público - serviu ao Governo do saudoso Governador Franco Montoro -, grande estudioso de temas contemporâneos na USP e fora da USP e de questões como meio ambiente, energia, desenvolvimento sustentável. 
Infelizmente, um câncer matou Dupas, que foi enterrado ontem. Era um homem que tinha um profundo compromisso com a democracia e com a reflexão aberta sobre as perspectivas do Brasil e do mundo. Foi também articulista dos mais importantes jornais.
	Sr. Presidente, sei que V.Exa. compartilha esse pesar muito pessoalmente, porque foi colega dele quando ele era Presidente da Nossa Caixa e V.Exa., Secretário de Estado de Segurança Pública. 
Quero deixar patentes a solidariedade de toda a Casa e a amizade à família de Gilberto Dupas, que tão jovem deixou o nosso convívio.
	O SR. PRESIDENTE (Michel Temer) - Fui realmente surpreendido pela notícia. Confesso que não sabia. A primeira surpresa foi pela juventude de Gilberto Dupas e depois pelo câncer que o vitimou.
	Associo-me às palavras de V.Exa. Quero que, deste plenário, a família receba o pronunciamento de V.Exa. e a tristeza da Casa. Que as lágrimas da família se incorporem às lágrimas deste Plenário, especialmente deste Presidente."
2009-02-18T16:54;"LUIZ INÁCIO LULA DA SILVA, PRESIDENTE DA REPÚBLICA, PROMOÇÃO, ENCONTRO NACIONAL COM NOVOS PREFEITOS E PREFEITAS, EXCESSO, GASTOS PÚBLICOS, PROTESTO. 
SUCESSÃO PRESIDENCIAL, ANTECIPAÇÃO, CAMPANHA ELEITORAL, LUIZ INÁCIO LULA DA SILVA, PRESIDENTE DA REPÚBLICA, PROMOÇÃO, DILMA ROUSSEF, MINISTRO CHEFE, CASA CIVIL, PRESIDÊNCIA DA REPÚBLICA, CRÍTICA, ATUAÇÃO.";LÍDER;"O SR. JOSÉ ANÍBAL (PSDB-SP. Como Líder. Sem revisão do orador.) - Sr. Presidente, Deputado Inocêncio Oliveira, Sras. e Srs. Deputados, quero, em primeiro lugar, saudar o nobre Líder do PT que foi eleito, o Deputado Cândido Vaccarezza.
Mas, Sr. Presidente, hoje venho a esta tribuna para contraditar o Deputado Cândido Vaccarezza. S.Exa., com muita eloquência, tentou passar gato por lebre. Estamos questionando o uso de dinheiro público para a promoção da candidata assumida do PT e do Presidente Lula à sua sucessão. O dinheiro público está sendo gasto de forma absolutamente licenciosa e imoral.
Sobre essa reunião de Prefeitos feita em Brasília, que eles disseram ter custado pouco mais de 200 ou 300 mil reais e que agora já admitem que foi 1,3 milhão de reais, na realidade custou 10 milhões de reais, pelo menos, pelos gastos todos que implicou, inclusive os gastos com publicidade que o Deputado Duarte Nogueira está solicitando que sejam discriminados, para que se possa saber exatamente o quanto se gastou. Foi uma vergonha.
A fala do Presidente criou expectativa de bonança nos Prefeitos, mas a única coisa que S.Exa. propôs aos Prefeitos foi ampliar o prazo das suas dívidas. Só isso. Nada mais; rigorosamente nada mais. E todo esse oba-oba para apresentar a sua candidata a milhares de Prefeitos e Vereadores do Brasil? Isso é uso de dinheiro público de forma licenciosa; e muito pior: de forma que não se recomenda a nenhum administrador público.
Os outros atos de campanha vão se sucedendo em lançamentos que se renovam sobre a mesma obra, mas que implicam o deslocamento do Presidente, da caravana, com a Ministra. Nada a ver com o desempenho administrativo, com o anúncio de novas políticas de governo. Conversa fiada!
O Governador de São Paulo, José Serra, pode atender a um convite de uma feira no Paraná. Nenhum problema. Pode atender a um convite para ir ao interior de Pernambuco. Nenhum problema. Não se está fazendo uso indevido do dinheiro público.
E, por essa razão, o DEM, do Deputado Ronaldo Caiado, que me antecedeu aqui hoje, já fez esse anúncio; e o PSDB - e tenho certeza de que, se tivéssemos dado atenção melhor e convidado, o PPS também se associaria - entraram com a ação para que o Governo se explique, para que o Governo tenha de devolver esse dinheiro usado de forma licenciosa, mais uma vez, margeando a corrupção para fazer ato de campanha a 20 meses das eleições.
O PSDB, se tiver de fazer prévia, vai fazer com recursos partidários e não com recursos públicos. Essa é a questão. É que no PT essa fronteira entre o público e o privado, entre os recursos partidários e os recursos públicos, já foi rompida há muito tempo. Isso é grave e merece toda a atenção dos brasileiros.
O debate político deve ter o tensionamento próprio dos regimes democráticos. Mas isso aí não é debate político. Esse debate que estamos provocando é sobre o mau uso do dinheiro público pelo Presidente Lula, pelo seu Governo, que transgrediu as normas de forma absolutamente licenciosa para lançar uma candidatura que hoje, diante da crise econômica que o mundo e o Brasil enfrentam, não passa da vontade imperial do Sr. Presidente da República, de tentar jogar areia nos olhos dos brasileiros para a grave crise que atravessamos, usando mais uma vez dinheiro público de forma licenciosa, desviando as funções da Presidência, da própria Ministra, o que explica por que do PAC, que tinha 19 bilhões no ano passado, conseguiu-se investir 4 bilhões ou 22%.
É o maior fiasco de todos os programas de investimento do Brasil. É a incapacidade deste Governo, que, no tempo da bonança, promoveu a gastança e, neste momento, é incapaz de investir em políticas anticíclicas, como faz o Governo de São Paulo, que anuncia as obras, os valores, os números de empregos a serem criados, e outros Governo do PSDB, como o de Minas Gerais. A Governadora Yeda Crusius zerou o déficit e gerou capacidade de investimento.
Esses fatos nós agora vamos trabalhar quotidianamente, desta tribuna, e junto à sociedade brasileira."
2009-03-03T16:56;"PROGRAMA DE ACELERAÇÃO DO CRESCIMENTO, PAC, GOVERNO FEDERAL, CRÍTICA.
LUCIANA GENRO, DEPUTADO FEDERAL, REPRESENTAÇÃO, CONSELHO DE ÉTICA E DECORO PARLAMENTAR, INVERSÃO, INFORMAÇÃO, MORTE, MARCELO CAVALCANTE, EX ASSESSOR PARLAMENTAR, YEDA CRUSIUS, GOVERNADOR, RS, ATUAÇÃO, ELOGIO.";LÍDER;"O SR. JOSÉ ANÍBAL (PSDB-SP. Como Líder. Sem revisão do orador. ) - Estão cortando 2 minutos, sistematicamente.
Sr. Presidente, Sras. e Srs. Deputados, tenho o propósito de assumir esta tribuna para falar mais uma vez sobre o PAC, que acho que começa a dar sinais crescentes de paralisia, o que é muito ruim, porque o País não pode prescindir de programas de investimento, sobretudo em momento de crise. Mas vamos aos dados do próprio Governo, SIAFI.
O percentual do PAC efetivamente pago em 2007 foi de 72,8% e em 2008, 24,7%. Para que daqui a pouco os governistas não se assanhem, falando que não estão sendo considerados os restos a pagar, em 2008, inclusive com os restos a pagar de 2007, a execução do PAC efetivamente pago foi de 24,7%! Apenas um quarto. É por isso que mineiros e aqueles que usam a rodovia que liga Belo Horizonte a Brasília - Deputados desta Casa que têm representação naquela região a conhecem - sabem que em certos trechos se levam 50 minutos para percorrer 10 quilômetros. Não existe investimento desse tal DNIT, departamento encarregado da infraestrutura de transporte no Brasil.
O que é surpreendente - estou mostrando o declínio do PAC - é que em 2 de março, dos 20 bilhões previstos para o PAC deste ano, foram pagos 0,6%, 132 milhões de reais. Já se passaram 2 meses de 2009.
O Governo Lula gastou todo o dinheiro! Não sobrou nada! Não há recursos para fazer política de investimentos e de sustentação do emprego! Nós voltaremos muitas vezes a esse assunto ao longo dos próximos dias.
Sr. Presidente, infelizmente, farei uma consideração sobre o discurso da Deputada Luciana Genro a propósito do Governo do Rio Grande do Sul.
	S.Exa. diz uma mentira realmente grave: o cidadão chamado Marcelo Cavalcanti, que, tudo indica, se suicidou há 15 dias, em Brasília, já estava com delação premiada negociada. É mentira, Deputada! Mostre um documento, uma gravação que comprove essa sua mentira. Não há! É que V.Exas. operam com a mentira, quando se trata de externar o inconformismo com os resultados do desempenho da Governadora Yeda Crusius.
Depois fala de Lair Fest. Segundo ele próprio, está nos jornais do Rio Grande do Sul, não há nada que diga respeito à delação premiada envolvendo esse cidadão.
	O que é mais grave e sintomático do inconformismo de todos aqueles derrotados pela Governadora não só no voto, mas na postura de governar, na irresponsabilidade com que governaram o Rio Grande do Sul, que fez com que o Estado vivesse permanentemente em situação de déficit, coisa que acabou e agora está investindo, é que a Deputada Luciana Genro disse que ontem a Governadora fez anúncios de investimentos requentados.
	Ora, vamos admitir que sejam requentados. São investimentos, Deputada! Coisa que o Governo do partido da qual V.Exa. é originária não fez e o Governo seguinte também não. Administrou a folha, entupiu o Estado de penduricalhos, levou-o a uma situação deficitária e inviabilizou o investimento estatal público no Rio Grande do Sul.
Agora não! Esse investimento voltou. Não temos nenhuma preocupação com procedimentos investigatórios, desde que não sejam baseados na mentira, na calúnia e na difamação.
Exatamente por isso, Deputado Chico Alencar, do PSOL, vou entrar amanhã, no Conselho de Ética da Casa, com representação contra a Deputada Luciana Genro, o que não é prazeroso para mim.
	É isso, Sr. Presidente.
	Muito obrigado."
2009-03-04T16:32;"MEDIDA PROVISÓRIA, SOBRESTAMENTO, PAUTA, ORDEM DO DIA, IMPEDIMENTO, VOTAÇÃO, MATÉRIA, INICIATIVA, CONGRESSISTA, REUNIÃO, DEFINIÇÃO, PAUTA, PROPOSTA.
MEDIDA PROVISÓRIA, ALTERAÇÃO, LEGISLAÇÃO TRIBUTÁRIA, PARCELAMENTO, DÍVIDA, CRIAÇÃO, CONSELHO ADMINISTRATIVO DE RECURSOS FISCAIS, AUTORIZAÇÃO, RECONHECIMENTO EX OFFICIO, PRESCRIÇÃO, CRÉDITO TRIBUTÁRIO, CRIAÇÃO, REGIME TRIBUTÁRIO DE TRANSIÇÃO, RTT, AUTORIZAÇÃO, UNIÃO FEDERAL, CONCESSÃO, SUBVENÇÃO, PRODUTOR, CANA DE AÇÚCAR, REGIÃO NORDESTE, AQUISIÇÃO, AÇÚCAR, USINA AÇUCAREIRA, REQUERIMENTO, RETIRADA, PAUTA, ORDEM DO DIA, APOIAMENTO.";PELA ORDEM;"O SR. JOSÉ ANÍBAL (PSDB-SP. Pela ordem. Sem revisão do orador.) - Sr. Presidente, nós conseguimos, nas 3 primeiras semanas do ano legislativo, uma ação muito eficiente na Câmara dos Deputados. Constituímos a Mesa, houve as indicações e escolhas das Comissões, em seguida, votamos uma medida provisória importante e 3 projetos relevantes. Isso criou uma certa repercussão, inclusive, e um contraponto com o desempenho no Senado, que infelizmente, naquele momento, não conseguiu obter a mesma produtividade da Câmara. 
Mas, enfim, esta semana, Sr. Presidente, vemos que já estamos com 10 medidas provisórias na Casa. Uma delas é esta, a Medida Provisória nº 449, e mais outras 8 ou 9, que começam a trancar a pauta sucessivamente e que apontam na direção de uma pauta constituída fundamentalmente por medidas provisórias. 
Se nós tivéssemos, por hipótese, esse relatório pronto na segunda-feira passada, e ontem tivéssemos tido a possibilidade de leitura e início da votação, já teríamos, provavelmente - concluída essa votação, ou em vias de concluí-la -, criado um espaço para a votação de novos projetos. A pauta volta a ser trancada no dia 6.
Mas do modo como estamos indo, Sr. Presidente - esta é minha preocupação, e quero ponderar com V.Exa. -, vamos acabar num procedimento sem muita assertividade, perdendo oportunidades de, no meio desse cipoal de medidas provisórias, votar matérias muito relevantes que estão na nossa pauta, como agências reguladoras; Código Florestal; mão-de-obra terceirizada; mão-de-obra escrava - um tema muito caro ao PT; cadastro positivo.
Eu quero apoiar aqui a proposta do Deputado Ronaldo Caiado, não para que apenas suspendamos a reunião. Eu sugeriria ao Presidente que chamasse para uma conversa os Líderes, para que pudéssemos ir formatando uma pauta, admitindo que a Medida Provisória nº 449 ainda vai nos absorver algum tempo para entendimento e posterior votação.
Era essa a sugestão.
	O SR. PRESIDENTE (Michel Temer) - Quero fazer uma pergunta aos Srs. Líderes. Peço atenção dos Srs. Líderes e de todos, naturalmente. Se nós votarmos esse requerimento e ele for aprovado, naturalmente não podemos prosseguir, dado que essa medida provisória tranca a pauta. 
Eu sei que ainda estão conversando sobre o conteúdo da medida provisória. Seria possível nós convocarmos uma sessão extraordinária para as 19h e verificar se, até lá, nós já teríamos feito uma composição em torno dessa medida provisória? 
Faço essa pergunta pela razão seguinte: nós temos muitas matérias para votar de interesse do Poder Legislativo. E o Líder José Aníbal lembrou bem, as medidas provisórias que trancam a pauta, nesse ritmo, não impedirão apenas a votação no mês de março, mas praticamente jogarão abril também por água abaixo. Nós não vamos conseguir votar absolutamente nada em março e abril.
	Então, quero ponderar com os Líderes se seria possível insistir nessa composição até as 19h. E, às 19h, voltaríamos para, pelo menos, a leitura do relatório."
2009-03-04T16:32;MEDIDA PROVISÓRIA, ALTERAÇÃO, LEGISLAÇÃO TRIBUTÁRIA, PARCELAMENTO, DÍVIDA, CRIAÇÃO, CONSELHO ADMINISTRATIVO DE RECURSOS FISCAIS, AUTORIZAÇÃO, RECONHECIMENTO EX OFFICIO, PRESCRIÇÃO, CRÉDITO TRIBUTÁRIO, CRIAÇÃO, REGIME TRIBUTÁRIO DE TRANSIÇÃO, RTT, AUTORIZAÇÃO, UNIÃO FEDERAL, CONCESSÃO, SUBVENÇÃO, PRODUTOR, CANA DE AÇÚCAR, REGIÃO NORDESTE, AQUISIÇÃO, AÇÚCAR, USINA AÇUCAREIRA, PROJETO DE LEI DE CONVERSÃO,  REQUERIMENTO, RETIRADA, PAUTA, ORDEM DO DIA, VOTO FAVORÁVEL, PARTIDO POLÍTICO, PSDB.;PELA ORDEM;"O SR. JOSÉ ANÍBAL (PSDB-SP. Pela ordem. Sem revisão do orador.) - Sim, retira da pauta, Sr. Presidente, mas fazendo uma observação: a negociação, a conversa entre os Líderes sobre a Medida Provisória nº 449 não avança em razão de um destaque específico, que oferece uma dificuldade adicional a qualquer entendimento.
Que, no limite, seja feito um apelo, até pelo Presidente, para que se retire esse destaque e ele seja trabalhado numa medida provisória seguinte - há várias aqui que podem acolher esse destaque -, para que nós possamos vencer essa matéria, porque, depois dela, já há a Medida Provisória nº 450, também trancando a pauta. Na Medida Provisória nº 451, como está me dizendo o Deputado Paulo Abi-Ackel, pode ser discutido esse destaque, que é o que emperra, digamos assim, o avanço na MP nº 449.
Encaminho favoravelmente pela suspensão. Que o Presidente tome essa iniciativa de sugerir, e nós mesmos - os partidos, as Lideranças que estão aqui -, à Comissão que está reunida na Liderança do Governo.
O SR. PRESIDENTE (Michel Temer) - O PSDB vota ""sim"" ao requerimento."
2009-03-10T18:46;PROGRAMA DE ACELERAÇÃO DO CRESCIMENTO, PAC, AVALIAÇÃO, CRÍTICA.;LÍDER;"O SR. JOSÉ ANÍBAL (PSDB-SP. Como Líder. Sem revisão do orador.) - Sr. Presidente, Sras. e Srs. Deputados, no final de semana, andando por São Paulo, visitei uma senhora que está desempregada há 1 mês. Ela me disse do constrangimento de estar desempregada, porque foi algo que não estava no horizonte dela, da sua família, mas é resultado da situação de crise que estamos vivendo hoje. Mais forte lá fora, menos forte aqui, mas por igual uma crise que impacta o emprego.
	Esse seria um grande momento, Sr. Presidente, Srs. Deputados, para que o Governo fizesse uma política mais eficiente e de mais resultados em matéria de investimento.
	Eu já tive várias oportunidades de falar sobre o PAC. Inclusive, no ano passado, num debate com o Deputado Maurício Rands, quando apontei a insuficiência de execução do PAC, o Deputado disse que eu não computava nos números os Restos a Pagar. Agora, nós temos dados consolidados de 2008. Dos Restos a Pagar de 2007, de 7,5 bilhões de reais, o PAC pagou no ano passado 860 milhões de reais. 
	Portanto, mesmo incluindo os Restos a Pagar, pagos no ano passado, o grau de execução do PAC no ano passado — a notícia é do SIAFI, sistema de informação do Governo — foi de 24,7%, um quarto dos recursos orçados. Eram 19 bilhões de reais orçados, e foram efetivamente pagos 4,7 bilhões.
	Podemos dizer: Mas, neste ano, em função da crise, o Governo começou o PAC com força total. Sr. Presidente, o PAC neste ano efetivamente pago é de 0,6%, menos de 1% do orçado para este ano, 20,5 bilhões. De Restos a Pagar — eles estão acumulando os Restos a Pagar, virou uma ficção —, existem 17 bilhões de reais, mas zero pago. Nem obra deve estar sendo realizada, porque, se estivesse, em 2 meses alguma coisa teria sido paga. 
A grande realidade é que esse programa, cuja mãe é a Ministra Dilma Rousseff, vai tornando-se um programa de fantasia, num momento em que seria importantíssimo para contribuir para a preservação de emprego ou para a criação de empregos alternativos nos setores em que o PAC supostamente estaria investindo.
Digo isso desta tribuna com lamento. O número de desempregados cresce a cada dia. A queda do PIB, como já disse hoje o Deputado Duarte Nogueira, não é um episódio meramente conjuntural. E aí se agrava o eleitoralismo da ação da Ministra, ação marcada e quotidianamente eleitoral, porque S.Exa. deveria gerir o programa. O risco que a Ministra corre não é só de deixar de ser a mãe e ser a madrasta do PAC, mas também de passar com nitidez — em vez de, num momento desafiador como este, agir para que o País obtenha investimento que, de algum modo, se contraponha a esse ambiente de desinvestimento, de desemprego — e definitivamente a ideia de que, neste Governo, vale mais a propaganda do que o resultado efetivo, que vem desempregando milhões de brasileiros."
2009-03-11T11:48;"PEDRO HENRY, DEPUTADO FEDERAL, CRÍTICA, COMPORTAMENTO, JOSÉ ANIBAL, LÍDER, PARTIDO POLÍTICO, PSDB.
MEDIDA PROVISÓRIA, ALTERAÇÃO, LEGISLAÇÃO TRIBUTÁRIA, PARCELAMENTO, DÍVIDA, CRIAÇÃO, CONSELHO ADMINISTRATIVO DE RECURSOS FISCAIS, AUTORIZAÇÃO, RECONHECIMENTO EX OFFICIO, PRESCRIÇÃO, CRÉDITO TRIBUTÁRIO, CRIAÇÃO, REGIME TRIBUTÁRIO DE TRANSIÇÃO, RTT, AUTORIZAÇÃO, UNIÃO FEDERAL, CONCESSÃO, SUBVENÇÃO, PRODUTOR, CANA DE AÇÚCAR, REGIÃO NORDESTE, AQUISIÇÃO, AÇÚCAR, USINA AÇUCAREIRA, DISCUSSÃO, ACORDO, TEXTO, PROJETO DE LEI DE CONVERSÃO, LÍDER, GOVERNO FEDERAL, BASE DE APOIO, CRÍTICA, MATÉRIA, DEBATE, PLENÁRIO, DEFESA.";PELA ORDEM;"O SR. JOSÉ ANÍBAL (PSDB-SP. Pela ordem. Sem revisão do orador.) - Sr. Presidente, apenas dizer que eu, pessoalmente, com relação ao Deputado Pedro Henry, fui até elogioso, fiz uma referência elogiosa e positiva ao Deputado.
	No mérito, Sr. Presidente, o grupo que se reuniu não é Colégio de Líderes coisa nenhuma. Colégio de Líderes é o colégio de todos os Líderes da Casa e não o colégio dos líderes que apoia o Governo. Isso eu disse aqui, enfaticamente. Segundo, mais importante que essa conversa paralela é a conversa aqui, e a conversa com a sociedade. E quero insistir nisso.
	É por isso mesmo que somos contra a leitura desse relatório, antes que ele seja dado ao conhecimento de toda a Casa."
