dataHoraInicio;keywords;tipoDiscurso;transcricao
2009-08-19T16:22;"MEDIDA PROVISÓRIA, REPASSE, RECURSOS, UNIÃO FEDERAL, MUNICÍPIOS, APOIO FINANCEIRO, COMPENSAÇÃO FINANCEIRA, PERDA, RECEITA, FPM, ALTERAÇÃO, LEI FEDERAL, CRIAÇÃO, FUNDO DE GARANTIA PARA A CONSTRUÇÃO NAVAL, FGCN, REGULAÇÃO, OPERAÇÃO FINANCEIRA, REDESCONTO, BANCO CENTRAL DO BRASIL, NORMAS, TRANSFERÊNCIA,  RECURSOS FINANCEIROS, PROGRAMA BOLSA FAMÍLIA, CRIAÇÃO, ÍNDICE DE GESTÃO DESCENTRALIZADA,  PROJETO DE LEI DE CONVERSÃO.
DISPOSITIVOS, DISPENSA, LICENÇA PRÉVIA, LICENCIAMENTO AMBIENTAL, ESTUDO PRÉVIO DE IMPACTO AMBIENTAL, OBRA PÚBLICA, PAVIMENTAÇÃO, MELHORAMENTO, FAIXA , DOMÍNIO, RODOVIA, BR, DESTAQUE, VOTAÇÃO EM SEPARADO, SUPRESSÃO, DEFESA, CONVOCAÇÃO, BANCADA, PARTIDO POLÍTICO, PSDB, PLENÁRIO, VOTAÇÃO.";PELA ORDEM;"O SR. JOSÉ ANÍBAL (PSDB-SP. Pela ordem. Sem revisão do orador.) - Sr. Presidente, a palavra está sendo pedida aqui não para conclamar os Parlamentares a virem votar, mas para discursos inflamados, principalmente a favor da emenda. 
Nós que nos posicionamos contrariamente à emenda já tivemos a oportunidade de argumentar aqui inúmeras vezes.
Reitero, Sr. Presidente, que se as estradas brasileiras estão no estado em que estão, não é por causa dos órgãos do meio ambiente. Vão lá ver os dados objetivos do PAC. É incompetência administrativa, gerencial! Não sai! Não é por problema de licenciamento ambiental.
	O Parlamento brasileiro tem que parar de tratar de questão ambiental com rancor. Ela está posta para o mundo inteiro. Parem de rancor, de assumir posição muito agressiva, como se querer preservar o meio ambiente estigmatizasse alguém contra o desenvolvimento. Isso é tão velho, tão ultrapassado, que faz mal ao Parlamento brasileiro assistir a manifestações dessa natureza.
	Querem votar a favor, votem a favor, mas apresentando argumentos convincentes, não aos berros, com imposição rancorosa com relação a uma questão que preocupa toda a humanidade, inclusive o Brasil, e que já é corrente na sociedade brasileira.
	Peço aos Deputados do PSDB que venham ao plenário e votem ""não""."
2009-08-19T16:22;"MEDIDA PROVISÓRIA, EMENDA, IMPERTINÊNCIA, ASSUNTO, TEXTO, INADMISSIBILIDADE, MICHEL TEMER, PRESIDENTE, CÂMARA DOS DEPUTADOS, REJEIÇÃO,  CONGRATULAÇÕES. 
LDO, VETO, DISPOSITIVOS,  PRESIDENTE DA REPÚBLICA, AVALIAÇÃO, CRÍTICA. 
TRIBUTOS, COMPOSIÇÃO, FUNDO DE PARTICIPAÇÃO DOS MUNICÍPIOS, FPM, GOVERNO FEDERAL, REDUÇÃO, ISENÇÃO FISCAL, COMPENSAÇÃO FINANCEIRA, MUNICÍPIOS.";LÍDER;"O SR. JOSÉ ANÍBAL (PSDB-SP. Como Líder. Sem revisão do orador.) - Sr. Presidente, esta fala que faço aqui como Líder tem como propósito inicial elogiar e destacar sua manifestação quanto à Medida Provisória nº 464. É importante a Casa ter conhecimento disso.
O Presidente da Casa, Deputado Michel Temer, já rejeitou 4 emendas à Medida Provisória nº 464. Foram indeferidas, liminarmente, por versarem sobre matérias estranhas ao que é o essencial desta Medida Provisória nº 464.
É um passo importantíssimo. Nós estamos enterrando, com esta Medida Provisória nº 462, a feitura de verdadeiros penduricalhos. E vejam que alguns penduricalhos não são leves, são pesados, e sem nenhuma insinuação, mas que têm custos para as finanças públicas, direta ou indiretamente, como essa emenda à medida provisória que estamos votando agora em relação às entidades sem fins lucrativos.
Sr. Presidente, se, por um lado, ganhamos na sua decisão de não admitir trancamento de pauta em face das medidas provisórias e abrir sessões extraordinárias para que o processo parlamentar possa andar, por outro lado, com este rito que prevalece até essa medida provisória, estávamos criando uma situação que nos obriga, desde ontem, depois de já termos votado o fundamental dessa medida provisória, que eram recursos para os municípios que já foram, inclusive, supostamente destinados aos municípios, recursos compensatórios... E agora estamos diante de mais 15, 18 emendas a essa medida provisória, aliás, artigos dessa medida provisória, que são objetos de emenda para serem consideradas aqui no plenário.
Já consideramos algumas e vencemos: a dos portos ontem, que era inaceitável, porque criava limitações claras à competitividade do País e podia induzir a privilégios; do mesmo modo, a que votamos e derrotamos hoje, com relação ao licenciamento ambiental; essa com relação à taxa média, SELIC e TJLP; esta agora, tenho certeza, pelo que indica o painel e as manifestações partidárias, também será derrotada.
Portanto, destaco mais uma vez o acerto da sua decisão de não permitir mais que se acrescentem às medidas provisórias penduricalhos que nada têm a ver com o seu mérito ou com o seu tema central.
Em segundo lugar, Sr. Presidente, faço uma ponderação a todos os companheiros Deputados e Deputadas sobre o significado do veto feito pelo Presidente da República na LDO. 
S.Exa. vetou 2 dispositivos que foram objeto de acordo de todos os partidos e lideranças políticas desta Casa: um com respeito à Lei Kandir, de 2007, a restituição de 1 bilhão e 300 milhões de reais; e outro para o orçamento de 2010, 5 bilhões e 200 milhões de reais. São 6 bilhões e 200 milhões de reais. 
Nós, do PSDB, até tivemos oportunidade de dizer e já conversamos com outras lideranças políticas da Casa, Parlamentares e partidárias, que não vamos admitir que o processo parlamentar prossiga normalmente sem que se estabeleça uma clara negociação para que o Governo reponha o que tirou nesses 2 vetos. 
Finalmente, Sr. Presidente, já deixo dito que é inaceitável que também se tenha vetado o 0,05% do superávit primário destinado à recomposição de receitas de Estados e Municípios. É outra emenda que vamos votar aqui no plenário hoje ou numa outra ocasião nessa medida provisória - aliás, isso é veto na LDO. Melhor dizendo, o Governo não poderá mais reduzir tributos que compõem o Fundo de Participação de Estados e Municípios. 
É nos municípios que as pessoas procuram o remédio, que as crianças têm a comida na escola, alimentação na creche. 
Aqui estamos propondo que, numa emenda do Deputado Alfredo Kaefer, qualquer redução de tributos que o Governo faça, basicamente de impostos que compõem o Fundo de Participação, o Governo terá de fazer automaticamente a compensação. O Governo pode abrir mão de sua parte do imposto, mas não pode abrir mão da parte que compete aos municípios.
Nós temos muitos municípios no Brasil, neste momento, com graves dificuldades de sustentar seus compromissos, suas responsabilidades na área de saúde, na área de educação e na alimentação das crianças em face da redução do Fundo de Participação dos Municípios, embora o Deputado Cândido Vaccarezza, com esse otimismo invulgar que o caracteriza, tenha decretado agora há pouco o fim de qualquer problema na economia. Infelizmente, isso ainda não se refletiu na receita dos impostos, que tem sido decadente, que tem caído a cada mês e que, portanto, incide negativamente na composição do Fundo de Participação dos Municípios.
Muito obrigado."
2009-08-25T17:00;"LUIZ INÁCIO LULA DA SILVA, PRESIDENTE DA REPÚBLICA, DECLARAÇÃO, INVESTIMENTO PÚBLICO, MUNICÍPIO, SÃO PAULO, SP, CONSTRUÇÃO, ANEL RODOVIÁRIO, RODOANEL, CRÍTICA.
RECEITA FEDERAL, CRISE, AVALIAÇÃO, PERDA, ARRECADAÇÃO TRIBUTÁRIA.
LUIZ INÁCIO LULA DA SILVA, PRESIDENTE DA REPÚBLICA, ATUAÇÃO, CRÍTICA.";LÍDER;"O SR. JOSÉ ANÍBAL (PSDB-SP. Como Líder. Sem revisão do orador.) - Sr. Presidente, Sras. e Srs. Deputados, na semana passada tivemos oportunidade de conversar sobre a possibilidade de fazermos bons debates no plenário da Câmara dos Deputados. Nós, da Oposição, achamos essa ideia muito interessante.
	Tive a oportunidade de reiterar que, sempre que o Governo ou os representantes dele nesta Casa usassem da mentira para se vangloriar dos seus feitos, para questionar atitudes de seus adversários políticos, que são em número cada vez maior, teríamos de vir a esta tribuna repor a verdade.
	O Presidente Lula, hoje, chegou a ser um pouco cômico, quando disse o seguinte em São Bernardo, Estado de São Paulo: ""Este que vos fala - está ficando cada vez mais imperial, napoleônico - quer que o pré-sal seja a redenção do Brasil"". Em síntese foi isso. E reclamou muito da omissão quanto aos investimentos do Governo Federal em São Paulo. Entre esses investimentos, citou o Rodoanel.
	É uma mentira deslavada! Tive oportunidade de dizer aqui, na semana passada, que o Rodoanel é uma grande obra de engenharia - a maior que se faz neste momento, no Brasil -, que começou com o Governo Covas, em São Paulo, e com Fernando Henrique. Setenta e cinco por cento dessa obra são financiados pelo Governo do Estado e 25%, pelo Governo Federal. Isso foi acordado lá atrás, no Governo Fernando Henrique. Foi construída a asa oeste do Rodoanel, interligando 5 autopistas, que chegam a São Paulo. Agora, está sendo construída a asa sul. É uma obra redentora, que vai dar amplo acesso ao Porto de Santos.
Nessa obra, que vale mais de 3 bilhões de reais, tirando desapropriações e recuperação ambiental - cerca de 2 bilhões de reais -, o Governo Federal participa com 25% e o Governo de São Paulo, com 75%. A cada 3 reais que o Governo Estadual coloca na obra, o Governo Federal coloca 1 real. E o nosso Presidente imperial, napoleônico reclama que não se dá o crédito da obra ao seu Governo.
A reiteração da mentira não vai transformá-la em verdade. E nós não vamos deixar que isso aconteça aqui de modo algum! Há participação do Governo Federal por uma razão muito objetiva, da qual, nesse caso, ele não pôde fugir: sem o Rodoanel, as exportações brasileiras poderão ser estranguladas pelo Porto de Santos, o mais importante do Brasil. Este Governo não conseguiu tocar todas as outras obras rodoviárias do País. O PAC está empacado. O Governo saiu fora, não investe. Mas naquela obra ele tem de investir. Pegaria muito mal se o Governo Federal não cumprisse a sua parte, que são os 25%, aplicando 1 real a cada 3 reais aplicados pelo Governo de São Paulo, de José Serra, para a conclusão da asa sul do Rodoanel.
Mais uma vez, Sr. Presidente, eu tenho de vir a esta tribuna gastar parte do meu tempo - mais de 3 minutos - para repor a verdade sobre uma mentira agora dita pelo imperial, pelo napoleônico Lula da Silva.
Hoje, quero me concentrar nessa questão da Receita Federal. O caso é gravíssimo! Provavelmente não tenha ocorrido, na história do Brasil, a demissão de uma dúzia de altos funcionários da Receita Federal por discordarem dos procedimentos adotados pelo Governo Lula. São acertos de contas e ajustes inaceitáveis.
O impacto disso para o cidadão e para a cidadã é muito objetivo. A Receita Federal perde vitalidade, como principal instrumento da arrecadação de tributos no Brasil. ""A queda da arrecadação"" - diz o Sindicato Nacional, que era tão querido pelo PT de antes - foi motivada por problemas de fiscalização, que têm facilitado a sonegação nos procedimentos de cobrança e análise de processo"".
Isso é gravíssimo! O Governo está estropiando uma das grandes instituições do Estado. A Receita Federal não é uma instituição de governo, mas do Estado brasileiro, como o são o Banco Central, o Tesouro Nacional, o Itamaraty, a Polícia Federal, manipulada por esse ""sinistro"" da Justiça, direta ou indiretamente. Estão brincando com fogo. É uma brincadeira que custa caro ao País, porque a Receita está perdendo vitalidade.
O resultado disso, embora já haja sinais de recuperação da atividade econômica, é este: no mês de julho tivemos a maior queda de arrecadação - 9,4%, quase 10% -, em relação ao mesmo mês do ano passado.
O resultado disso, Sr. Presidente, é que o Governo corta na LDO a reposição da Lei Kandir (6,5 bilhões de reais); o Governo corta na LDO 0,05% do superávit para Estados e Municípios (mais de 2 bilhões de reais). O Governo está tentando fazer dinheiro de qualquer jeito para prosseguir na gastança.
O Presidente começa a dar sinais de que há um certo desconforto no ar. Faltando 10 meses para o encerramento do seu Governo - não do mandato -, ou seja, a partir de junho do ano que vem, tem início a campanha eleitoral. O Presidente Lula dá mostras de crescente nervosismo, de irritação. Com quê? Com a verdade? Se é irritação com a verdade, esse mal não tem cura. No caso do Presidente Lula, parece que a falta de compromisso com a verdade é uma enfermidade incurável. E não é só dele, não. Mas o exemplo é dele.
Dizem alguns que a Oposição não tem cura. Tem sim, Lula! Nós já governamos o Brasil, governamos São Paulo, Minas Gerais, Rio Grande, vamos voltar a governar o País e queremos que V.Exa. aprenda de novo a ser oposição. Uma oposição como esta que nós fazemos, sem aquilo que V.Exa. fez para demonizar as ações do Governo com insinuações. Eu não fiz nenhuma insinuação sobre o porquê de estarem facilitando as coisas na Receita Federal.
(O microfone é desligado.)"
2009-09-01T16:42;"PARTIDO POLÍTICO, OPOSIÇÃO, OBSTRUÇÃO PARLAMENTAR, PROTESTO , TRAMITAÇÃO, REGIME DE URGÊNCIA CONSTITUCIONAL, PROJETO DE LEI, REGULAMENTAÇÃO,  EXPLORAÇÃO, PETRÓLEO, CAMADA GEOLÓGICA, PRÉ-SAL, DEFESA. 
OBSTRUÇÃO PARLAMENTAR, PARTIDO POLÍTICO, OPOSIÇÃO, LEGITIMIDADE, AVALIAÇÃO.";PELA ORDEM;"O SR. JOSÉ ANÍBAL (PSDB-SP. Pela ordem. Sem revisão do orador.) - Sr. Presidente, na realidade, o Deputado Ricardo Barros, tão cioso, tão zeloso, está imaginando que será uma reunião de Líderes que resolverá o problema da urgência. Não será, Deputado Ricardo. Quem vai resolver o problema da urgência é o Governo, ou não.
A nossa posição é militantemente a favor da obstrução, porque essa urgência é inaceitável.
E mais, Sr. Presidente, se a linguagem continuar de tipo chantagem, como me disseram que usaram aqui, é de uma baixeza, de uma falta de ideia e de disposição para o exercício da democracia própria de quem nunca lutou por ela, nunca, não fez nada por ela, beneficia-se dela. Nesse caso, vai ser pior ainda.
O Parlamento é uma casa de discussão, e tem posições, tem motivações, todas elas supostamente legítimas, a favor, contra. Nós entendemos que essa urgência é absolutamente desnecessária, extemporânea e argumentamos. Não quero tomar tempo aqui e agora, depois irei à tribuna argumentar de forma mais extensa, mas a posição é absolutamente legítima, e vamos mantê-la até que tenhamos alguma indicação mais firme de que esse posicionamento poderá ser revisto.
Ouvi atentamente os argumentos do Deputado Miro Teixeira, pertinentes e óbvios. Óbvios não no sentido de que não devessem ser ditos; foram ditos porque ele tem razão. Se estamos em obstrução e o Governo mantém a urgência, vamos diminuir, 1 por 1, cada dia dos 45 que temos para votar.
Mas nós esperamos que isso mude. O Brasil não é algo estático. Há a opinião pública, a mídia, o Parlamento, a sensibilidade de cada um dos Parlamentares, não só da Oposição, mas também da Situação.
Portanto, no momento, é obstrução."
2009-09-01T16:42;"MEDIDA PROVISÓRIA, TRAMITAÇÃO, ALTERAÇÃO, AVALIAÇÃO. 
PROJETO DE LEI, REGULAMENTAÇÃO, EXPLORAÇÃO, PETRÓLEO, CAMADA GEOLÓGICA, PRÉ-SAL, TRAMITAÇÃO, REGIME DE URGÊNCIA CONSTITUCIONAL, AVALIAÇÃO, IMPROPRIEDADE. 
COMISSÃO GERAL, DISCUSSÃO, REGULAMENTAÇÃO, EXPLORAÇÃO, PETRÓLEO, CAMADA GEOLÓGICA, PRÉ-SAL, DEFESA.";LÍDER;"O SR. JOSÉ ANÍBAL (PSDB-SP. Como Líder. Sem revisão do orador.)  - Sr. Presidente, espero que V.Exa. conceda a palavra ao Líder como obrigação, como V.Exa. disse, mas também com alguma satisfação, porque o suposto é que as Lideranças promovem aqui um saudável debate democrático.
Em primeiro lugar, elogio o trabalho do Relator Zarattini. Infelizmente, não tivemos oportunidade de ler o texto antes. Talvez se S.Exa. tivesse feito um pouco mais de esforço já desse para cumprir aquela determinação de entregar relatórios das medidas provisórias 5 dias antes da leitura do texto no plenário da Câmara dos Deputados.
O Presidente Michel Temer já tomou algumas medidas que melhoraram o desempenho da instituição, a interpretação em relação à medida provisória, a interpretação com o fato de que não mais serão permitidos contrabandos nas medidas provisórias. Ficam faltando, Presidente Michel Temer, esses 5 dias de antecedência do relatório para que possamos, de forma mais objetiva, logo após a leitura, passar ao processo de discussão e de aprovação ou não da medida provisória.
	Sr. Presidente, eu quero ponderar a V.Exa., que tem autoridade na condição de Presidente da instituição, e a todos os Parlamentares, sobre a relevância de realizarmos uma discussão adequada, trazendo a contribuição da sociedade e daqueles que conhecem mais profundamente o tema, com respeito ao pré-sal.
	Esse açodamento, essa pressa não vai servir a ninguém. Rigorosamente, a ninguém, nem àqueles que querem promovê-la. É importante que retiremos a urgência desse projeto, para que a discussão, na Câmara, nas Comissões, possa ter o tempo necessário ao aperfeiçoamento de que é capaz a instituição, sempre que acionada a se posicionar sobre as grandes questões nacionais. Foi assim com a atual Lei do Petróleo, que ficou nesta Casa durante 1 ano e 9 dias, nos anos de 1996 e 1997 - a lei que permitiu que o setor do petróleo no Brasil, que correspondia a 2% do PIB, do conjunto de todas as riquezas produzidas no Brasil, em 1997, subisse para 10%, em 2009. Doze anos. Novos investimentos, novos negócios.
	A produção de petróleo dobrou efetivamente. Não adianta tentar demonizar o que deu certo. Nós queremos - coisa que se quer fazer agora - que novas legislações também deem certo. E nós sabemos que esta nova legislação só terá incidência ou resultados efetivos sobre a produção de petróleo daqui a 10 ou 12 anos, e quem disser que não se dará assim está mal-informado. 
	Por que essa urgência? Por que esse açodamento? Não é necessário. Nós confiamos em que o Presidente Michel Temer mostre, amanhã, ao Governo e ao próprio Líder do PT, Deputado Cândido Vaccarezza, que não esteve favorável a esta urgência, pelo que acompanhamos nos jornais de hoje, que ela será retirada; e a Câmara, responsavelmente, como sempre faz quando é acionada aos grandes temas do País, discuta e faça o melhor.
	A título de exemplo, Sr. Presidente, eu acabei de solicitar uma Comissão Geral, pedido para o qual tive o apoio de todos os Líderes da Casa e agradeço, para discutir esses projetos. Hoje, nós fizemos na Liderança todos os exercícios para simular os convites, os profissionais que possam nos ajudar a fazer uma grande reflexão sobre o tema. Não é possível fazê-la antes do dia 22 de setembro, portanto, antes da metade do tempo que nós teríamos, caso permaneça essa urgência. 
Quarenta e cinco dias é um tempo exíguo e absolutamente insuficiente, e a Câmara realizou, há pouco tempo, uma Comissão Geral para debater sobre a gripe A, gerando as melhores consequências para o País. Ajudou o Governo, inclusive, a ficar mais atento e a conhecer melhor as questões apresentadas pelos grandes infectologistas, pelos pesquisadores e pelos Secretários Estaduais e Municipais de Saúde. A Câmara deu uma contribuição importante. Embora seja preocupante essa pandemia, sem dúvida nenhuma, a Comissão Geral que fizemos ajudou na ação preventiva.
	Logo, a nova Comissão sobre esses projetos que dizem respeito ao pré-sal precisa ser muito bem construída e, para isso, precisa de tempo, e com essa urgência estaríamos penalizando e cerceando a possibilidade de a Câmara dar uma grande contribuição.
	Finalmente, Sr. Presidente, uma observação para aqueles que defendem a aprovação do regime de urgência. O Governo, neste ano de 2009 - quem nos assiste precisa saber disso -, vai receber 10 bilhões de reais de royalties e participações. Desses 10 bilhões, o Governo está gastando 2,1 bilhões; 8 bilhões estão sendo contingenciados para o superávit. Por que não usar esses 8 bilhões já agora, e não esperar 2020, para a saúde, educação, ciência e tecnologia?
	Essa é uma questão singela para os que defendem a urgência urgentíssima, Sr. Presidente. Poderiam respondê-la aqui e contrapor a isso, a essa urgência, que, a meu ver, é absolutamente temerária."
2009-09-01T16:42;LEI FEDERAL, POLÍTICA ENERGÉTICA, ATIVIDADE, MONOPÓLIO, PETRÓLEO, AUSÊNCIA, TRAMITAÇÃO, REGIME DE URGÊNCIA CONSTITUCIONAL, DESMENTIDO, AFIRMAÇÃO, JOSÉ GENOÍNO, DEPUTADO FEDERAL.;PELA ORDEM;"O SR. JOSÉ ANÍBAL (PSDB-SP. Pela ordem. Sem revisão do orador.) - Sr. Presidente, apenas um esclarecimento e até uma boa informação para a Casa, considerando que o Deputado José Genoíno foi tão atento com relação à Lei do Petróleo. A proposição que originou a Lei do Petróleo (Lei nº 9.478) chegou à Câmara no dia 8 de julho de 1996. Saiu no dia 19 de março de 1997. Ficou na Câmara 8 meses. Depois, foi para o Senado, no dia 20 de março de 1997; saiu no dia 17 de julho, ficou mais 4 meses no Senado, sendo sancionada no dia 6 de agosto de 1997. Ou seja, 1 ano e 9 dias - na Câmara, 8 meses, no Senado, 4 meses.
Não houve urgência constitucional, Deputado Genoíno, ao contrário do que V.Exa. declarou há pouco."
2009-09-02T17:08;MEDIDA PROVISÓRIA, AUTORIZAÇÃO, CONCESSÃO, SUBVENÇÃO ECONÔMICA, BANCO NACIONAL DE DESENVOLVIMENTO ECONÔMICO E SOCIAL, BNDES, OPERAÇÃO FINANCEIRA, FINANCIAMENTO, AQUISIÇÃO, PRODUÇÃO, BENS DE CAPITAL, INOVAÇÃO TECNOLÓGICA, REQUERIMENTO, RETIRADA, PAUTA, ORDEM DO DIA, VOTO FAVORÁVEL,  PARTIDO POLÍTICO, PSDB.;ORIENTAÇÃO DE BANCADA;"O SR. JOSÉ ANÍBAL (PSDB-SP. Pela ordem. Sem revisão do orador.) - Sr. Presidente, Sras. e Srs. Deputados, o processo de obstrução continua, ele não é impeditivo de que se continue a discutir as matérias, no caso essa medida provisória.
	Vi aqui o Deputado Rodrigo Rollemberg e até me certifiquei de que o PSB assinou o pedido de realização de Comissão Geral sobre o pré-sal feito por nós. Vamos fazê-lo. Certamente será um grande debate no plenário da Câmara. Estávamos conversando agora há pouco sobre isso com o Presidente e os Líderes de outros partidos.
	Portanto, que o Deputado se poupe desse jogo de cena de quem que está obstruindo não quer discutir. Quem está obstruindo, Deputado, quer que prevaleça um ambiente mais propício para a discussão. Se o Deputado não aceita isso, também não precisa S.Exa. desmerecer a Casa a qual pertence, ao tentar desmerecer a Oposição. Nós não nos sentiremos desmerecidos em hipótese alguma. Nós queremos conversar. Acham que esse novo modelo pode ter mais sucesso. Nós precisamos nos certificar disso.
	Com relação a esse requerimento, nosso voto é ""sim"".
	O SR. PRESIDENTE (Michel Temer) - Vota ""sim"" o PSDB."
