dataHoraInicio;keywords;tipoDiscurso;transcricao
2008-04-01T15:12;PASCHOAL THOMEU, EX PREFEITO, EX DEPUTADO ESTADUAL, MUNICÍPIO, GUARULHOS, SP, HOMENAGEM PÓSTUMA.;PEQUENO EXPEDIENTE;"O SR. JORGE TADEU MUDALEN (DEM-SP. Pronuncia o seguinte discurso.) - Sr. Presidente, Sras. e Srs. Deputados, na data de hoje, quero prestar uma homenagem ao Sr. Paschoal Thomeu que nos deixou há 2 anos e ontem, 31 de março, completaria 82 anos.
No fim do século XVIII e início do século XIX, a velha Itália experimentava dias sombrios. A história, o romantismo, a tradição das grandes conquistas davam lugar à desesperança, à incerteza e à desilusão. A soma do desencanto gerava o êxodo de famílias inteiras que, visionárias, viam na América o aceno de futuro risonho. Essas famílias juntavam seu sonho ao sonho de milhares de outras famílias que descobriam no Brasil, o País do futuro! O destino? Certo ou incerto: São Paulo! A Capital dos imigrantes, hoje também a Capital dos migrantes! Migrantes e imigrantes se juntaram para escrever uma história, construir uma nação, perpetuar uma raça e deixar de forma indelével, a marca de um povo.
O futuro estava na lavoura! A América era uma terra abençoada! Não se tinha, até então, notícia de imigrantes que retornaram à terra de origem. Embora a saudade da pátria distante machucava o peito, sangrava a alma, os italianos resistiam. Avantes, sempre vieram para fazer a América!
Instalados nos campos do interior paulista, a prosperidade não se fazia esperar. 
A primeira geração preferia a cidade ao campo! Zona leste da Capital paulista! O bairro da Penha foi o escolhido. Ao acaso, diriam os descendentes, mais tarde! Ali, realmente fariam a América!
Fatos, imagens, história, tudo se funde e se confunde para alinhavar a tecido de uma vida inteira! A vida da família Thomeu!
A segunda geração dessa família em terras brasileiras gerou um varão, cujo escopo dessa homenagem são seus feitos e seus fatos. O novo ser gerado no seio da família Thomeu, recebeu na pia batismal o nome de Paschoal, homenagem ao avô paterno. Corria o ano de 1926 - mais precisamente dia 31 de março. Nesse dia, a fada benfazeja que cuida de crianças, com dotes extraordinários, reuniu porções generosas de bondade, humildade, amor ao próximo, altruísmo, desprendimento e predicados outros que se tornariam visíveis ao longo de sua vida.
Da mãe herdou o caráter que norteou a retidão que o acompanharia vida afora e do pai, além do caráter, o amor pelo trabalho. A combinação do caráter associado à dedicação ao trabalho transformaria Paschoal Thomeu, ao longo dos anos, em uma verdadeira lenda.
Paschoal Thomeu teria sido um jovem semelhante a milhões de outros jovens não fosse os diferenciais que marcariam sua vida. 
Contabilista de formação acadêmica, cursou contabilidade na escola Álvares Penteado. Nunca exerceu a profissão. No Liceu Coração de Jesus freqüentou os bancos escolares com muita dedicação, fato que contribuiu decisivamente para forjá-lo como se forja a têmpera do mais puro aço. 
Precoce! Não tinha completado 16 anos quando, em parceria com o tio, montou uma serralheria em fundo de quintal. Futurista e com fantástico senso de observação, voou alto, muito alto! Da modesta serralheria a uma das maiores industrias metalúrgicas do País, restou apenas a certeza de que é possível tornar o sonho em realidade. Basta adicionar apenas uma palavrinha mágica: querer. Uma longa e dura caminhada, confidenciaria mais tarde a amigos próximos. Mas valeu a pena, acrescentaria com orgulho. Visionário! Enquanto todas as serralherias do planeta se limitavam a produzir portões, grades e afins, Paschoal Thomeu produzia caixas para fiação elétrica. O produto similar era caro, muito caro. Importado da Bélgica, chegava ao Brasil a custo proibitivo. Recuperando tubulações de demolições que, acopladas às latinhas de óleo usadas, eram colocadas no mercado a preços superatraentes. Foi só o começo. Hoje as caixas de luz Thomeu são referência, padrão nacional. O País inteiro conhece os produtos da metalúrgica Paschoal Thomeu. Do Oiapoque ao Chuí, em todos os quadrantes, os postes de iluminação ostentam as caixas de luz Thomeu. Metalúrgica Paschoal Thomeu e INAL - Indústria Nacional de Aço Laminado, duas potências do ramo metalúrgico que durante anos a fio foi o sustentáculo de milhares de famílias. O então jovem Paschoal Thomeu queria e esperava mais. Muito mais. Fundou e fez prosperar 28 empresas, algumas de grande porte como a empresa de ônibus Guarulhos, o jornal Folha Metropolitana, AGG - Artes Gráficas Guarulhos, jornal MetrôNews, distribuído graciosamente nas estações do Metrô de São Paulo. Grandes geradoras de empregos diretos e indiretos. Durante décadas, as empresas de Paschoal Thomeu proporcionaram o sustento de milhares de famílias. A lenda se justificava. Se os milhares de funcionários não se surpreendiam ao vê-lo diariamente às 5 horas na portaria de suas fábricas. Mito? Lenda? Realidade! Inverno ou Verão? Não importa. Às 5 horas, Seu Paschoal estava a postos. Junte fatos e feitos extraordinários e se terá um homem extraordinário. O crescimento do conglomerado Thomeu atravessou o Rio Tietê e com ele os limites da Capital paulista. Em Guarulhos, tinha todo o espaço que precisava para expandir. O sucesso lhe sorria. 
Política? Não obrigado! Dizia enfático. De um jeito ou de outro, sempre esteve ligado à política de Guarulhos. Como empresário bem-sucedido era natural ouvi-lo falar sobre as necessidades do município. 
Durante anos resistiu à idéia de integrar-se a um partido, sair candidato ou fazer política partidária. 
Ano de 1987 - um fato marcaria para sempre a vida de Paschoal Thomeu. Um grupo de amigos, cansado de tentar convencê-lo a ser candidato a Prefeito, promoveram, numa atitude radical, um apelo que emocionou todos. Os muros da cidade, todos os muros, cada espacinho livre, recebeu uma mensagem: ""Paschoal, aceite, por favor"". Era o start que faltava. E o Paschoal aceitou. Era o início de uma brilhante carreira política. Entrava em cena um competente político. O tempo se encarregou de mostrar, sem que o grande empresário deixasse o palco. Nascia ali o político que revolucionaria a história de uma cidade.
Eleito por conta de uma proposta inovadora, fez um governo arrojado. Vida nova. Mais que um mote de campanha. Uma promessa. Cumprida, diga-se de passagem. Em pouco tempo transformaria Guarulhos em um gigantesco canteiro de obras. Cada palmo do município receberia sua atenção, contudo foi na periferia que Paschoal Thomeu concentrou seus esforços. Bairros inteiros que antes eram apenas amontoados de casas se tornaram, de repente, bairros urbanizados. Asfalto, água, escolas, unidades básicas de saúde. Linhas de ônibus e tantos outros benefícios passaram a fazer parte do cotidiano de um povo que vivia à margem do conforto do centro. Paschoal Thomeu deu vida nova ao povo, devolveu a dignidade e reascendeu as esperanças de uma população sofrida. Também ali, na Prefeitura, estava a postos às 5 horas. Governava de portas abertas, recebendo o povo, despachando, fiscalizando, trabalhando.
Juntos, conseguimos recursos para a pavimentação da Marginal do Rio Baquirivu, pavimentação para a Estrada do Cabuçu que liga a Vila Galvão ao Taboão, e não medimos esforços para fazer a duplicação da Av. Santos Dumont, em Cumbica, e Av. Jamil João Zarif, que liga a Praça 8 de Dezembro, no Taboão, ao Conjunto Habitacional Haroldo Veloso.
Entre tantas obras, lutamos por recursos para o Hospital Geral, no CECAP, colocamos caixa d'água no Jardim Angélica, no Bairro dos Pimentas, Estação de Tratamento de Água do Jardim São João, enfim, foram tantas benfeitorias   que fica difícil relacioná-las aqui.
A saga da lenda estava se tornando palpável. Terminou seu irrepreensível mandato com o invejável índice de 93%. Fato inédito. Elegeu seu sucessor em primeiro turno. Façanha repetida somente em Fortaleza, Capital do Ceará, por Antonio Cambraia. A rápida passagem na presidência da ELETROPAULO foi suficiente para deixar também ali sua marca registrada. Na Assembléia Legislativa cumpriu 3 mandatos consecutivos. Em 2006, com o espírito da missão cumprida, recusou mais uma reeleição. Já tinha feito muito. Não tudo que sonhara para a cidade, confessaria mais tarde aos amigos. Já não tinha mais a cabeça povoada de sonhos, já não tinha mais o coração cheio de esperança.
Tudo que se pode dizer de Paschoal Thomeu é pouco diante do que representou e representa a figura desse homem na história contemporânea de um povo.
Os olhos marejam, a alma sangra, a voz embarga quando tentamos reproduzir os passos do amigo, do pai, do companheiro Paschoal Thomeu. Embora a história tem-lhe feito justiça, a lacuna deixada por esse gigante dificilmente será preenchida, tal o montante de feitos.
Dia 9 de agosto de 2006, Paschoal Thomeu nos deixou. Saudade? Muito mais que saudade. Uma dor doida invade o peito quando lembramos desse homem que dividiu a historia de uma cidade. Tocador de obras, pai exemplar, patrão inigualável, político singular. Todos os adjetivos do dicionário, certamente não bastariam para descrever essa figura humana que um dia tivemos a sorte de conhecer, amar e respeitar.
Casado com dona Marina, com quem teve 2 filhos: Rafael e Roseli. Rafael, o filho querido que a vida insistiu em lhe pregar uma peça: levou-o ainda muito jovem. Roseli, então herdeira natural, conduz de forma magistral o jornal Folha Metropolitana, criação do velho lutador.
Deixou, além da imorredoura saudade, os netos Andréia, Daniel, Carolina, Bruno e André.
Amigos? Milhares. Inimigos? Nenhum. Admiradores? Todos os que tiveram o privilégio de conhecê-lo.
A Paschoal Thomeu, nosso eterno respeito."
2008-05-07T15:12;"DIA INTERNACIONAL DO TRABALHO, COMEMORAÇÃO.
SERVIDOR PÚBLICO MUNICIPAL, MUNICÍPIO, GUARULHOS, SP, VALORIZAÇÃO, CORREÇÃO SALARIAL, DEFESA.";PEQUENO EXPEDIENTE;"O SR. JORGE TADEU MUDALEN (DEM-SP. Pronuncia o seguinte discurso.) - Sr. Presidente, Sras. e Srs. Deputados, no último dia 1º de maio, transcorreu o dia do trabalhador. Quero saudar todos os trabalhadores brasileiros, principalmente os funcionários públicos da minha querida cidade de Guarulhos.
Esses nossos companheiros vêm passando por momentos difíceis nos últimos anos, com salários achatados pelo atual Governo Municipal.
No início da atual administração, no ano de 2001, a cidade arrecadou em impostos R$584.692.420,00 (quinhentos e oitenta e quatro milhões, seiscentos e noventa e dois mil e quatrocentos e vinte reais). 
Em 2007, a arrecadação foi de R$1.009.710.342,09 (um bilhão, nove milhões, setecentos e dez mil, trezentos e quarenta e dois reais e nove centavos).
Para o ano de 2008, a previsão orçamentária é de R$1.751.702.849,50 (um bilhão, setecentos e cinqüenta e um milhões, setecentos e dois mil, oitocentos e quarenta e nove reais e cinqüenta centavos).
Ou seja, em 8 anos do governo petista, a arrecadação de Guarulhos cresceu muito mais de 100%, e o que foi repassado para o funcionário público em reajuste salarial foram somente 23,82%.
Segundo estimativas do sindicato dos trabalhadores na administração pública municipal de Guarulhos, as perdas salariais do funcionalismo nesses anos foram em média cerca de 25%, e o reajuste necessário e possível hoje seria em média 33%.
Alem das perdas salariais, os trabalhadores da Prefeitura, SAAE, PROGUARU e Previdência, lutam por um justo plano de carreira, cargos e salários, como foi prometido no passado, quando o atual partido fazia campanha eleitoral.
Concluindo, Sr. Presidente, eu venho a esta tribuna solidarizar-me com os nossos queridos funcionários públicos do Município de Guarulhos, categoria de que, com orgulho, fiz parte quando iniciei minha carreira profissional, em 1980, atuando como engenheiro no Serviço Autônomo de Água e Esgoto - SAEE.
Espero que o atual Governo e os próximos possam olhar com mais carinho e respeito e valorizem essa classe trabalhadora que colabora e muito para o crescimento e o progresso da cidade de Guarulhos.
Era o que tinha a dizer.
Muito obrigado."
2008-05-07T16:16;PROJETO DE LEI, ALTERAÇÃO, CODIGO PENAL, SUPRESSÃO, DISPOSITIVOS, CARACTERIZAÇÃO, CRIME, DESCRIMINALIZAÇÃO, ABORTO, COMISSÃO DE SEGURIDADE SOCIAL E FAMÍLIA, REJEIÇÃO, ELOGIO.;PELA ORDEM;"O SR. JORGE TADEU MUDALEN (DEM-SP. Pela ordem. Sem revisão do orador.) - Sr. Presidente, quero comunicar à Presidência que hoje nós votamos, na Comissão de Seguridade Social, o Projeto nº 1.135, que tramitava há mais de 16 anos nesta Casa. 
E aqui agradeço ao Presidente Jofran Frejat, que, brilhantemente, conduziu a votação na qual nosso relatório foi aprovado por 33 votos.
De público, agradeço também a todos os Parlamentares que participaram, também a V.Exa., ao Presidente Frejat, que conduziu com muita maestria a reunião, pois esse projeto era polêmico, projeto do aborto, e conseguimos a unanimidade dos presentes, 33 votos contra o aborto.
	Muito obrigado, Sr. Presidente."
2008-05-14T15:14;"CONVÊNIO, PREFEITURA MUNICIPAL, MUNICÍPIO, GARULHOS, SP, MINISTÉRIO DOS ESPORTES, IRREGULARIDADE, APLICAÇÃO DE RECURSOS, PROGRAMA SEGUNDO TEMPO, DEMOCRATIZAÇÃO, ACESSO, CRIANÇA, ADOLESCENTE, JOVEM, PRÁTICA ESPORTIVA, INCLUSÃO SOCIAL,DENÚNCIA, APURAÇÃO, COMISSÃO ESPECIAL, CÂMARA MUNICIPAL, AVALIAÇÃO.
PREFEITURA MUNICIPAL, MUNICÍPIO, GARULHOS, SP, FRAUDE, LIGA, FUTEBOL, CRÍTICA.
ASSOCIAÇÃO ATLÉTICA FLAMENGO DE GUARULHOS, TIME, FUTEBOL, ATUAÇÃO, ELOGIO.
ASSOCIAÇÃO ATLÉTICA MACEDO, TIME, FUTEBOL, ANIVERSÁRIO DE FUNDAÇÃO, CONGRATULAÇÕES.";PEQUENO EXPEDIENTE;"O SR. JORGE TADEU MUDALEN (DEM-SP. Pronuncia o seguinte discurso.) - Sr. Presidente, Sras. e Srs. Deputados, subo à tribuna desta Casa para mostrar minha preocupação com as denúncias que estão sendo apuradas por uma Comissão Especial de Inquérito, na Câmara Municipal de Guarulhos, que investiga possíveis irregularidades em um convênio firmado entre o Ministério do Esporte e a Prefeitura de Guarulhos, sob o nº 279/2005, com verba repassada à municipalidade no total de R$4.994.000,00 (4 milhões, 994 mil reais).
O objetivo do convênio foi o fornecimento de alimentos para as crianças do Projeto Segundo Tempo, do Governo Federal.
Segundo o relatório parcial da Comissão Especial de Inquérito, existem várias irregularidades nesse fornecimento, que envolve a Secretaria Municipal de Esportes de Guarulhos (contratante) e a empresa contratada para fornecer e entregar os chamados kits lanche.
Estou acompanhando o trabalho realizado por essa Comissão de Inquérito da Câmara de Guarulhos e, após o relatório final, constatando irregularidades, vou denunciar à Justiça os culpados, que provocaram prejuízos ao Erário. 
Sr. Presidente, na última semana, outra denúncia foi publicada em um jornal local, com a seguinte manchete: ""Prefeitura dá calote nas ligas de futebol"". Na reportagem, os presidentes das ligas de futebol amador da cidade denunciam a prefeitura por não honrar o compromisso firmado através de um convênio com as entidades para o pagamento de despesas com taxas de arbitragem dos campeonatos de futebol amador. Além disso, o último campeão de futebol ainda não recebeu a taxa de premiação ofertada pela conquista do título. Conforme o convênio, o pagamento é de responsabilidade da Secretaria de Esportes.
Segundo o presidente das ligas, ""o calote"" vem prejudicando todas as equipes, que a cada ano que passa vão-se enfraquecendo em sua estruturação, mesmo com os grandes talentos que existem na cidade.
Mas, Sr. Deputados, não é só de tristeza que vive o futebol de Guarulhos. Existem na cidade abnegados do esporte que nos causam orgulho. Por isso, quero parabenizar todos os atletas, dirigentes e a grande torcida da Associação Atlética Flamengo de Guarulhos, que disputa a série A-3 do campeonato paulista de profissionais, promovido pela Federação Paulista de Futebol. A equipe, bem dirigida pelo técnico Wagner dos Anjos e pelo Presidente Edson David, classificou-se para a fase final da competição e na tarde desta quarta-feira conquistou a segunda vitória em 2 jogos nesta fase. Os 2 primeiros colocados disputarão a série A-2 do campeonato do próximo ano.
Quero também desta tribuna prestar homenagens a outra equipe de Guarulhos, a Associação Atlética Macedo, que no último dia 1º de maio completou 80 anos de existência.
Parabenizo toda a diretoria, atletas e simpatizantes, através do grande Presidente Lamartine Zanzini, que ao lado da sua diretoria vem realizando um excelente trabalho a frente do querido clube guarulhense.
Era o que eu tinha a dizer.
Muito obrigado."
2008-05-29T10:46;PROJETO DE LEI, DISCIPLINAMENTO, EXERCÍCIO PROFISSIONAL, OCEANÓGRAFO, EMENDA SUBSTITUTIVA GLOBAL DE  PLENÁRIO, VOTO FAVORÁVEL, PARTIDO POLÍTICO, DEM;ORIENTAÇÃO DE BANCADA;"O SR. JORGE TADEU MUDALEN (DEM-SP. Pela ordem. Sem revisão do orador.) - Sr. Presidente, o Democratas orienta o voto ""sim"". 
Nós queríamos fazer uma observação sobre o parágrafo único, no qual o curso de Oceanografia fica expedido somente pela Universidade do Rio Grande. Olhando para a frente, seria bom que ficasse aberto para outras universidades. Não é agora, neste momento, mas o Brasil está crescendo e temos de ter uma visão com amplitude para que, no futuro, outras universidades também possam regulamentar o registro desse curso. 
Parabenizamos o Relator e encaminhamos o voto ""sim"".
O SR. PRESIDENTE (Arlindo Chinaglia) - Sim."
2008-05-29T10:46;GOVERNO FEDERAL, ECT, COMPROMISSO, FEDERAÇÃO NACIONAL DOS TRABALHADORES EM EMPRESAS DE CORREIOS E TELÉGRAFO E SIMILARES, FENTEC, ADICIONAL DE RISCOS, CARTEIRO, REFORMULAÇÃO, PLANO DE CARGOS, EXPECTATIVA, IMPLANTAÇÃO.;BREVES COMUNICAÇÕES;"O SR. JORGE TADEU MUDALEN (DEM-SP. Pronuncia o seguinte discurso.) - Sr. Presidente, Sras. e Srs. Deputados, subo à tribuna desta Casa, para solidarizar-me com os carteiros de todo o Brasil, em especial os de Guarulhos, minha terra natal. 
Em novembro de 2007, o Governo Lula e os dirigentes da Empresa Brasileira de Correios e Telégrafos firmaram termo de compromisso com a Federação Nacional dos Trabalhadores em Empresas de Correios e Telégrafos e Similares - FENTEC que definiu o pagamento de adicional de risco aos carteiros. Um dos fatores que motivou essa negociação foi o veto presidencial à lei que garantia a periculosidade aos trabalhadores, aprovada pelo Congresso Nacional, e também a reformulação do Plano de Carreiras, Cargos e Salários da empresa.
Os trabalhadores dos Correios esperam o cumprimento do acordo firmado com a implantação de um Plano de Carreira, Cargos e Salários que garanta a existência da Carreira de Correios e Telégrafos e um piso salarial condizente com a importância desses profissionais que, sob sol, chuva e toda adversidade climática e topográfica, atendem a 40 milhões de domicílios dos 5.700 municípios do País.
Fica aqui registrado o meu apelo às autoridades competentes para que cumpram o acordo firmado com os trabalhadores dos Correios.
Era o que tinha a dizer."
2008-10-14T15:06;IGREJA CRISTÃ PENTECOSTAL DA BÍBLIA NO BRASIL, FUNDAÇÃO, CINQÜENTENÁRIO, HOMENAGEM.;PEQUENO EXPEDIENTE;"O SR. JORGE TADEU MUDALEN (DEM-SP. Pronuncia o seguinte discurso.) - Sr. Presidente, Sras. e Srs. Deputados, criada na década de 1950, tendo como fundadores o pastor Epaminondas Silveira Lima e sua esposa, Ada Silveira Lima, a Igreja Cristã Pentecostal da Bíblia no Brasil nos felicita com seus 50 anos de existência no País. Um tempo de muitas alegrias, conquistas importantes, em que muitas pessoas puderam conhecer a Palavra de Deus e os ensinamentos que a Bíblia proporciona àqueles que se aproximam da palavra sagrada. E tudo isso foi possível graças ao trabalho permanente de pessoas que acreditam na vida, no ser humano e numa sociedade melhor. Neste ínterim, cumprimento sobremaneira o Presidente Nacional da ICPBB, Bispo Natalino de Jesus Bisagati, pela sua perseverança e dedicação à frente desta instituição.
Sr. Presidente, num mundo onde a ciência quer provar que Deus não existe, este Parlamento constitui-se como espaço essencial para reafirmar que ele existe. E mais do que isso: o propagar a compreensão de que a tolerância religiosa e o respeito perante a todas as instituições religiosas que compõem o Brasil são pressupostos básicos para uma democracia plena. Tenho a convicção de que devemos estar sempre presente nas discussões que são importantes à sociedade. E essas discussões nos trazem reflexões sobre quais caminhos devemos escolher. Como Parlamentar, sei da importância de levarmos à sociedade respostas aos questionamentos, eis que somos colocados como representantes legais constituídos - direcionamento como cidadãos, brasileiros, frente às novas tecnologias e apreensões científicas, ao uso que fazemos do corpo humano e das possibilidades que Deus nos conduz. 
Tenho a convicção de que, em tudo isso, deve ser preservada sempre a condição do respeito à vida e do amor pela existência do homem. E é neste trilho que certamente percorrem as ações e os sentimentos da Igreja Cristã Pentecostal da Bíblia no Brasil.
Sr. Presidente, solicito que este discurso seja divulgado pelo programa A Voz do Brasil e pelos demais órgãos de comunicação da Casa. 
Muito obrigado."
2008-10-15T15:18;"CÂMARA DE COMÉRCIO BRASIL-LÍBANO, CCBL, CINQÜENTENÁRIO, ANIVERSÁRIO DE FUNDAÇÃO, ATUAÇÃO, IMIGRAÇÃO LIBANESA, HOMENAGEM.
REFORMA TRIBUTÁRIA, BENEFÍCIO, ECONOMIA NACIONAL, EMPRESÁRIO, DEFESA.";BREVES COMUNICAÇÕES;"O SR. JORGE TADEU MUDALEN (DEM-SP. Pronuncia o seguinte discurso.) - Sr. Presidente, Sras. e Srs. Deputados, a comemoração do cinqüentenário da Câmara de Comércio Brasil-Líbano (CCBL) é um momento de muito orgulho não só para aqueles que têm ascendência e naturalidade árabe, mas também para todos os brasileiros que conhecem a saga histórica de um povo que ajudou muito na construção desta Nação plural e trabalhadora. 
São Paulo é a maior cidade libanesa fora do Líbano. Dos 6 milhões de libaneses e descendentes que vivem no Brasil, quase 2 milhões vivem nessa cidade. Esse é um número eloqüente da enorme importância que a presença libanesa tem no desenvolvimento dessa metrópole e também do espaço simbólico que São Paulo representa para o Líbano. Nós só temos a agradecer aos libaneses sua incalculável contribuição ao Brasil nos últimos 125 anos. 
O Líbano nos mandou jovens ousados, corajosos, muito trabalhadores e com enorme facilidade de adaptação. Eles percorreram mais de 10 mil quilômetros para chegar aqui. Não é fácil hoje, mas deve ter sido muito mais difícil naquela época, pois o mundo, na verdade, era então muito maior: transportes e comunicações eram muito mais difíceis, o desconhecido muito mais assustador.
No ano em que vivemos uma verdadeira turbulência econômica internacional, devemos refletir sobre o quanto é importante para o nosso País estreitar cada vez mais os laços comerciais com povos amigos que acreditam que somente com trabalho compartilhado e cooperado é possível constituir um mundo mais democrático e soberano.
Sr. Presidente, venho aqui publicamente agradecer o convite recebido para o Jubileu de Ouro da Câmara de Comércio Brasil-Líbano, que ocorrerá neste dia 16 de outubro. O evento também será marcado pela instituição do Prêmio da Cooperação Líbano-Brasileira. Serão reciprocamente agraciados um brasileiro e um libanês, figuras que no ano se tenham destacado tanto pelo êxito empreendedor quanto pela atuação no desenvolvimento da integração bilateral. E, nesse contexto, chamo a atenção de todos os Parlamentares para observar os anseios dos brasileiros empresários, que querem um País com mais oportunidades para quem deseja iniciar um novo empreendimento. 
O Governo Federal tem o dever e a missão de ofertar melhores condições aos empresários, com uma reforma tributária que facilite os novos negócios e traga dinamismo à economia. Aqui coloco como exemplo minha querida Guarulhos, que sofre com a concorrência de cidades vizinhas, que cobram alíquotas menores de ISS e produzem assim fuga das empresas. E isso se estende a muitas cidades do Estado de São Paulo. O cooperativismo e o associativismo são ferramentas importantes para a discussão desses temas e devem ser inseridos também na pauta das políticas públicas.
Sr. Presidente, para finalizar, cumprimento o Sr. Alfredo Cotait Neto, Presidente da CCBL, e toda a diretoria da entidade, pelas ações desenvolvidas para o intercâmbio cultural e social entre nossas nações e pela organização desse grandioso evento.
Solicito que este discurso seja divulgado pelo programa A Voz do Brasil e pelos demais órgãos de comunicação da Casa.
Muito obrigado."
