dataHoraInicio;keywords;tipoDiscurso;transcricao
2008-08-12T20:14;"PROJETO DE LEI, CRIAÇÃO, CARREIRA DE DESENVOLVIMENTO DE POLÍTICAS SOCIAIS, CARGO PÚBLICO,  ANALISTA TÉCNICO , AGENTE EXECUTIVO, SUPERINTENDÊNCIA DE SEGUROS PRIVADOS, SUSEP, TRANSFORMAÇÃO, CARGO PÚBLICO, AGÊNCIA NACIONAL DE VIGILÂNCIA SANITÁRIA, ANVISA, ALTERAÇÃO, LEI FEDERAL, CARREIRA, ANALISTA DE INFRA ESTRUTURA,  CARGO ISOLADO, ESPECIALISTA EM INFRA ESTRUTURA SÊNIOR, PREVISÃO, FÓRMULA, PAGAMENTO, CARGO EM COMISSÃO, MILITAR.
DISPOSITIVOS,  CRIAÇÃO, CARGO PÚBLICO, CARGO EFETIVO, ANALISTA TÉCNICO DE POLÍTICAS SOCIAIS, AVALIAÇÃO, CRÍTICA,  DESTAQUE, VOTAÇÃO EM SEPARADO, SUPRESSÃO, VOTO FAVORÁVEL, PARTIDO POLÍTICO, PSDB. 
CARGO PÚBLICO, CRIAÇÃO, GOVERNO, LUIZ INÁCIO LULA DA SILVA, PRESIDENTE DA REPÚBLICA, ATENDIMENTO, INTERESSE, NATUREZA POLÍTICA, AVALIAÇÃO, CRÍTICA.";LÍDER;"O SR. JOSÉ ANÍBAL (PSDB-SP. Como Líder. Sem revisão do orador.) - Sr. Presidente, Sras. e Srs. Deputados, hoje, por volta das 15h, tive a oportunidade de falar, com muita satisfação, no Grande Expediente. Enfatizei muito, no início do meu pronunciamento, em tempo de recordes, como estamos vivendo o período de Olimpíadas, que o Governo Lula é o campeão mundial de gastança, o que está nos levando a uma situação de prioridades invertidas em matéria de gastos públicos.
	Se formos ver aqui o que diz o texto serem as atribuições do cargo de Analista Técnico de Políticas Sociais, vamos ver que novamente é o Governo criando cargos para manipulação política. Quais são essas atribuições? Executar atividades de assistência técnica em projetos e programas nas áreas de saúde, previdência, emprego e renda, segurança pública, desenvolvimento urbano, segurança alimentar, assistência social, educação, cultura, cidadania, direitos humanos e proteção à infância, à juventude, ao portador de necessidades especiais, ao idoso e ao indígena que não sejam privativas de outras carreiras ou cargos isolados no âmbito do Poder Executivo.
 	Sr. Presidente, isso aqui não quer dizer praticamente nada, porque quer dizer tudo. Não tem foco, não tem propósito específico. Sim, propósito específico de contratar mais gente, incorporar mais custeio à máquina pública, sem que se tenha uma preocupação acentuada com a qualidade das políticas públicas, da fiscalização, do acompanhamento. É generalidade. Nós somos contra. Apresentamos esse destaque supressivo.
	Sempre que houver necessidade de novos quadros na Administração Pública, com funções muito bem caracterizadas, e não essa generalidade que está aqui, reveladora do propósito que, a nosso ver, é o que anima esse projeto, o propósito de acrescentar mais possibilidades em termos de máquina pública àqueles que estão no poder hoje e aos seus aliados, quando não for desse modo, nós estaremos dispostos a discutir.
	O Ministro da Previdência esteve aqui hoje para propor uma discussão sobre as competências para a concessão de condição de utilidade pública às entidades, às ONGs. E veio aqui propor exatamente que àquelas que têm a ver com educação, o Ministério da Educação; saúde, Ministério da Saúde; esporte, Ministério do Esporte. Está tentando criar um procedimento mais adequado, que, segundo ele, vai dar mais segurança sobre o credenciamento ou não dessas entidades.
	O Governo vem no mesmo dia com um projeto que cria 2.400 cargos, sob o pretexto de que os analistas de políticas sociais serão diferentes dos analistas de políticas públicas, que já existem, e, por isso mesmo, porque são distintos os de políticas sociais dos de políticas públicas, é necessário que se criem os cargos de analistas de políticas sociais.
	O que está aqui enunciado como competência para esses profissionais, novos cargos, são exatamente todas as áreas de políticas públicas. Ou seja, é uma confusão infernal, para tentar passar um contrabando, a meu ver, inaceitável, tendo em vista a gastança, a licenciosidade do atual Governo com o dinheiro público.
	É inaceitável que concedamos essa legislação promotora da criação de 2.400 cargos sem finalidade específica. Uma generalidade, um jogo de palavras que só vai servir ao atendimento político, ao atendimento da boquinha. É inaceitável.
	Por isso estamos encaminhando esse destaque supressivo e vamos encaminhar também verificação de voto nesta matéria.
	A desculpa de que vários Parlamentares foram prestigiar uma reunião da CNI não se justifica. Tenho certeza de que a Confederação Nacional da Indústria, que defende tão arduamente a redução dos impostos, tem compromisso também com a redução do gasto público, sobretudo licencioso, e vai liberar todos os Deputados da base do Governo que estão lá para que venham aqui se expor, se for o caso, votando a favor dessa medida que tem toda improcedência.
	Por isso mesmo estamos requerendo a sua supressão."
2008-08-20T14:14;CAMADA GEOLÓGICA, PRÉ-SAL, NOTA OFICIAL, PSDB, PARTIDO POLÍTICO, REGULAMENTAÇÃO, EXPLORAÇÃO, DECRETO, PRESIDENTE DA REPÚBLICA, NORMAS COMPLEMENTARES, AGÊNCIA NACIONAL DO PETRÓLEO, ANP, DISTRIBUIÇÃO, ROYALTIES, INVESTIMENTO, UNIÃO FEDERAL.;LÍDER;"O SR. JOSÉ ANÍBAL (PSDB-SP. Como Líder. Sem revisão do orador.) - Sr. Presidente, Sras. e Srs. Deputados, o que me traz à tribuna é, em primeiro lugar, para referendar a posição há pouco manifestada pelo Deputado Duarte Nogueira sobre a matéria que está sendo analisada pela Câmara. 
	Em segundo lugar, a leitura de uma nota oficial do PSDB ao final da qual fazemos uma sugestão que gostaríamos de ver considerada pelo Presidente da Câmara e pelo Presidente do Senado em vista da relevância do tema.
	Diz a nota:
	""O PSDB e o pré-sal
	Já pertencem ao povo brasileiro as jazidas de petróleo e gás, inclusive as contidas na camada pré-sal. 
A Constituição brasileira e a Lei do Petróleo assim nos garantem: as afirmativas de que é preciso recuperá-las para o povo brasileiro são destituídas de sentido verdadeiro, confundem a opinião pública e servem apenas a propósitos eleitoreiros. 
		O modelo regulatório atual, instituído pela Lei n.º 9.478/1997, responsável pelas novas descobertas, pelo crescimento do setor e pelo fortalecimento da PETROBRAS, é o mais adequado à exploração e produção das jazidas do pré-sal. 
		Os ajustes necessários ao aumento da participação do povo nos resultados da exploração e produção de petróleo e gás nas camadas do pré-sal, tendo em vista as perspectivas de gigantismo das suas reservas, a redução do risco exploratório e o alto preço internacional do petróleo, já podem, nos termos da Lei n.º 9.478/97, ser efetuados por decreto presidencial e normas complementares da Agência Nacional de Petróleo - ANP. 
	As descobertas do pré-sal e os resultados financeiros decorrentes de sua exploração nos obrigam a enfrentar o debate e tomada de decisão madura pelo Congresso Nacional sobre a partilha dos royalties entre os entes da Federação e o uso da parcela que couber à União. 
		O PSDB, além de instituir comissão interna para estudar e participar desse debate, com a responsabilidade que o assunto requer, propõe a criação de Comissão Especial Mista, representativa do Congresso Nacional, com o mesmo propósito. 
	A nota é assinada pelo Senador Sérgio Guerra, Presidente Nacional do partido.
	Pela oportunidade, quero instar a Presidência a considerar a possibilidade de na terceira semana de setembro realizar uma reunião geral na Câmara dos Deputados para debater esse mesmo tema. Na ocasião poderá ser  instalada a Comissão Mista da Câmara e do Senado.
	Muito obrigado.
	O SR. PRESIDENTE (Arlindo Chinaglia) - Analisarei brevemente a sugestão de V.Exa. e a responderei oportunamente."
2008-09-02T16:58;PROJETO DE LEI, CRIAÇÃO, FUNDO SOBERANO DO BRASIL, FINANCIAMENTO PÚBLICO, OPERAÇÃO FINANCEIRA, EMPRESA NACIONAL, EXTERIOR, UTILIZAÇÃO, RESERVAS CAMBIAIS, REGIME DE URGÊNCIA CONSTITUCIONAL, AMPLIAÇÃO, DISCUSSÃO, AUSÊNCIA, COMPROMISSO, DATA, VOTAÇÃO, DEFESA.;PELA ORDEM;"O SR. JOSÉ ANÍBAL (PSDB-SP. Pela ordem. Sem revisão do orador.) - Sr. Presidente, eu fui muito claro na minha fala anterior. Aliás, posso não ter sido tão claro. Essa matéria do Fundo Soberano nós estamos estudando. Até mencionei aspectos da matéria que merecem nossa atenção especial. E disse que, a meu ver, o Ministro da Fazenda não conseguiu ainda explicar em toda a sua inteireza, e por falta de oportunidade - por falta de uma reunião de trabalho, não de uma reunião formal -, o verdadeiro propósito do Governo com esse fundo soberano. Tive oportunidade de dizer também que, se isso é algum prenúncio com relação ao pré-sal, não há urgência nenhuma, zero. Temos tempo para aprofundar, para aprimorar essa discussão.
	Noto, no entanto, que a Liderança do Governo está muito enfática ao defender que saiamos daqui com um acordo para a votação do Fundo Soberano. Não posso assumir esse acordo. O que posso assumir, como sugeri na minha fala anterior, é uma conversa, que podemos fazer nesta semana ou na semana que vem, com o Ministro da Fazenda e com o nosso pessoal da assessoria técnica, para irmos aprimorando a nossa reflexão sobre o Fundo Soberano e para que ele possa então voltar ao plenário depois das eleições. Mas sem data cravada. Ao contrário. Do que vejo hoje, há entre os interlocutores com os quais tenho falado sobre o Fundo Soberano uma tendência à não-urgência. Vejo o Governo dar à matéria uma importância muito grande, que não consigo perceber em toda a sua dimensão.
	Portanto, o que é possível como acordo é votarmos as 2 medidas provisórias que vieram do Senado, e as outras duas mediante uma boa negociação na Casa. Noto também que a Medida Provisória nº 436 de 2008 é objeto de questionamentos de Parlamentares tanto do Governo quanto da Oposição. Eu gostaria de saber como se processaria uma convergência para a votação da MP nº 436, se isso for possível. De concreto, Sr. Presidente, podemos votar as 2 MPs que estão voltando do Senado. As outras duas são passíveis de entendimento no plenário.
	E depois das eleições é outra a história. O Presidente até pode, por intermédio da Liderança da Maioria, pedir em plenário a urgência urgentíssima para o Fundo Soberano."
2008-09-02T16:58;PROJETO DE LEI, CRIAÇÃO, FUNDO SOBERANO DO BRASIL, FINANCIAMENTO PÚBLICO, OPERAÇÃO FINANCEIRA, EMPRESA NACIONAL, EXTERIOR, UTILIZAÇÃO, RESERVAS CAMBIAIS, REGIME DE URGÊNCIA CONSTITUCIONAL, AUSÊNCIA, CONSENSO, VOTAÇÃO.;PELA ORDEM;"O SR. JOSÉ ANÍBAL (PSDB-SP. Pela ordem. Sem revisão do orador.) - Sr. Presidente, primeiro essa sua bandeira é em homenagem à Semana da Pátria?
	O SR. PRESIDENTE (Arlindo Chinaglia) - Segundo o Deputado do PSDB que me passou, é. 
	O SR. JOSÉ ANÍBAL - O Deputado do PSDB passou só para o Presidente da Casa? Precisava divulgar um pouco mais, compartilhar mais. 
	Mas, enfim, Sr. Presidente, de fato, quanto à questão relativa ao Fundo Soberano,
há uma percepção clara na Casa, na nossa bancada, de que é precipitado trazer esta matéria, nesta semana, para votação, sob todos os pontos de vista. Não há nenhuma urgência, pelo menos não conseguimos perceber, em relação à gestão da política econômico-financeira do Governo. Queremos entender melhor a constituição, destinação e gestão desse fundo.
	Hoje, propus a outros Líderes dos partidos de oposição e também a Líderes de partido que apóiam o Governo que, posteriormente, fizéssemos uma reunião com o Ministro da Fazenda para trocar idéias, para que S.Exa. argumentasse, com a consistência que lhe é peculiar, sobre a premência, urgência e relevância do Fundo Soberano. De qualquer maneira, é uma decisão que fica para adiante.
	Existem, no entanto, 2 medidas provisórias que serão encaminhadas pelo Senado Federal e, conforme me disse o Deputado Arnaldo Faria de Sá, embora não tenham chegado até agora, se houver sessão extraordinária poderão ser consideradas. Portanto, poderíamos na sessão extraordinária votar as 2 medidas provisórias. E, amanhã, poderíamos discutir as outras 2 remanescentes. Essa é a proposta dos partidos de oposição ao Presidente da Casa."
2008-09-02T16:58;"LUIZ INÁCIO LULA DA SILVA, PRESIDENTE DA REPÚBLICA, PARTICIPAÇÃO, PROPAGANDA ELEITORAL, CAMPANHA ELEITORAL,PREFEITURA MUNICIPAL, CIDADE, SÃO PAULO, MUNICÍPIO, SÃO BERNARDO DO CAMPO, SP, CRÍTICA.
MARTA SUPLICY, CANDIDATO, PREFEITO, CIDADE, SÃO PAULO, SP, PLANO, EXTENSÃO, METRÔ, AUSÊNCIA, RECURSOS ORÇAMENTÁRIOS, UNIÃO FEDERAL, CRÍTICA.";LÍDER;"O SR. JOSÉ ANÍBAL (PSDB-SP. Como Líder. Sem revisão do orador.) - Sr. Presidente, pela oportunidade de ouvir o pronunciamento do ex-Ministro Paulo Renato Souza, nosso companheiro de bancada, e o contraponto feito por S.Exa. - ainda que tardio, porque naquele dia finalmente não lhe foi concedida a palavra -, faço 2 observações sobre uma questão que não está na ordem do dia da nossa sessão, mas na agenda política do País. 
	Essas observações têm a ver com as eleições em São Paulo, mais particularmente no Estado de São Paulo, onde o Presidente da República esteve no último final de semana para fazer propaganda eleitoral para candidatos do seu partido. 
	Sr. Presidente, eu sou daqueles que acham que o Presidente da República tem todo o direito, como cidadão, de fazer a campanha que julgar necessária, tomando, entretanto, os cuidados e o recato que o cargo exige, sem que isso signifique ônus suplementar para a população a favor de uma disputa eleitoral. 
	O Presidente esteve em São Bernardo do Campo e fez discurso a favor de seu candidato. Na última eleição em São Bernardo do Campo, o candidato do Partido dos Trabalhadores teve desempenho muito escasso - perdeu no primeiro turno. A eleição foi vencida no primeiro turno, e o vencedor auferiu algo entre 65% e 70% dos votos. É o atual Prefeito, do PSB, partido que em Brasília faz parte da base de sustentação do Governo, mas no ABC, em São Bernardo, faz oposição ao Governo Federal. Desta vez, temos um candidato do PSDB, um jovem Deputado Estadual. 
Surpreende, Sr. Presidente, que o Presidente Lula, em seu discurso em São Bernardo, tenha dito que a vitória naquele Município é uma vingança pessoal para ele. 
O Presidente da República vai a uma cidade referência para o Brasil, São Bernardo do Campo, fazer campanha eleitoral e ainda diz que ganhar eleição lá é um ato de vingança pessoal dele! É lamentável! Perdeu a oportunidade de dizer à população de São Bernardo do Campo o que eventualmente seu candidato poderia fazer de melhor em relação a nosso candidato, que, por sinal, está à frente nas pesquisas.
	A segunda coisa, Sr. Presidente, é com relação às eleições na Capital. Mentira tem pernas curtas. A candidata do PT apresentou um plano de construção de linhas do metrô que, segundo ela, receberá um apoio entusiástico do Presidente da República. Na realidade, é um plano sem nenhum conceito, é um improviso, que mereceu a alcunha de Plano Puxadinho para o Metrô de São Paulo, ou seja, coisa para inglês ver, semelhante àquele Fura-Fila do Pitta, que serviu para ganhar eleição, mas, principalmente, para destruir as finanças públicas de São Paulo. Esses puxadinhos da candidata do PT não têm nenhuma viabilidade.
O atual Governador tem já em curso um projeto de investimento de 18 bilhões de reais, até o final de seu mandato, no metrô e na CPTM, o que atinge a cidade de São Paulo e a Grande São Paulo.
	A mentira de perna curta da atual candidata a Prefeita, Marta Suplicy, é que ela disse que terá o apoio do Presidente da República para fazer seus puxadinhos do metrô. Ora, quando foi Prefeita, não conseguiu recurso algum para o metrô de São Paulo, muito menos para a CPTM. Agora diz que vai receber esses recursos, mas o jornal Folha de S.Paulo de hoje mostra que não há um tostão na proposta de Orçamento enviada pelo Governo Federal para o metrô de São Paulo. Um tostão sequer, Sr. Presidente! É conversa dizer que isso vai ser adicionado ao longo da discussão da peça na Câmara dos Deputados. Pode até ser, nada muito expressivo. 
Com relação a outros metrôs com os quais o Presidente Lula se comprometeu, os recursos estão colocados no Orçamento. Para o de São Paulo, nenhum tostão. Mentira de perna curta. Os puxadinhos de metrô da candidata Marta Suplicy lembram o Fura-Fila do candidato Pitta, que nada acrescentou para São Paulo. A duras penas, o Fura-Fila foi concluído pelo Prefeito José Serra e dada uma destinação nobre a ele, que é estar integrado ao Corredor Leste. Este, sim, melhorou a qualidade do transporte na região mais populosa da Capital.
	Portanto, Sr. Presidente, pela oportunidade que esta tribuna oferece, num dia em que não estamos tratando ainda de nenhuma matéria de mérito, vim aqui, como Líder do meu partido, mas também como eleitor de São Paulo, fazer essas observações que julgo muito pertinentes. 
Muito obrigado."
2008-09-17T16:30;OTÁVIO LEITE, DEPUTADO FEDERAL, PRONUNCIAMENTO, VETO PRESIDENCIAL, LUIZ INÁCIO LULA DA SILVA, PRESIDENTE DA REPÚBLICA, LEI GERAL DO TURISMO, DISPOSITIVOS, CRÍTICA, SOLIDARIEDADE.;LÍDER;"O SR. JOSÉ ANÍBAL (PSDB-SP. Como Líder. Sem revisão do orador.) - Sr. Presidente, apenas quero registrar minha solidariedade ao Deputado Otavio Leite, que tanto trabalhou pela Lei Geral de Turismo, e associar-me a seu protesto e indignação. O acordo em torno dessa matéria se deu em momento de convergência, quando questões de natureza político-partidária foram abandonadas.
Como a ex-Ministra do Turismo é candidata à Prefeitura de São Paulo, havia a suposição de que nós do PSDB não aprovaríamos a proposta porque isso poderia beneficiar S.Exa. Isso, porém, não era problema. Havendo entendimento entre as forças políticas da Casa em relação ao parecer final do projeto da Lei Geral de Turismo, nós o votamos e aprovamos.
	Um ponto central desse acordo, como foi realçado expressamente por mim e pelo Deputado Otavio Leite ao Presidente da Casa, era a posição favorável do Governo. Aliás, acabo de dizer ao Presidente Arlindo Chinaglia que é lamentável o fato de, agora, o Governo vetar a lei!
	Estamos em período eleitoral, mas, no dia 6 ou 7 de outubro, estaremos novamente nesta Casa encarando nossa agenda de final de ano. E temos de ter um ambiente o mais convergente e saudável possível entre as forças políticas. Será muito ruim se tivermos um ambiente envenenado pelo não-cumprimento de acordo feito na Casa entre Parlamento e Governo.
Fica o nosso apoio ao Deputado Otavio Leite. Estamos dispostos a aceitar todas iniciativas que possam resolver essa situação. E o procedimento mais objetivo será trazer esse veto a plenário e derrubá-lo, porque ele é um desafio ao entendimento produzido dentro da Casa.
	De qualquer forma, registro de maneira veemente o fato de que realmente houve o descumprimento de um acordo, e acordo é a regra de ouro do Parlamento em sua relação com o Executivo.
	Era o que tinha a dizer, Sr. Presidente. 
Muito obrigado.
	O SR. PRESIDENTE (Marcio Junqueira) - Registramos a legitimidade da preocupação do Líder José Aníbal em relação à produção da Casa. Quando fatos como esse acontecem, preocupamo-nos. Juntamo-nos, portanto, à preocupação de S.Exa."
2008-10-07T16:22;"CRISE FINANCEIRA, AMBITO INTERNACIONAL, DISCUSSÃO, CÂMARA DOS DEPUTADOS, DEFESA.
MEDIDA PROVISÓRIA, SUPERAVIT PRIMÁRIO, TÍTULO DA DÍVIDA PÚBLICA, TESOURO NACIONAL, RETIRADA, PAUTA, DEFESA.
PROJETO DE LEI, FUNDO SOBERANO DO BRASIL, CRÍTICA.";LÍDER;"O SR. JOSÉ ANÍBAL (PSDB-SP. Como Líder. Sem revisão do orador.) - Sr. Presidente, Sras. e Srs. Deputados, nossa expectativa na retomada da atividade parlamentar - e creio que é compartilhada por todas as forças políticas desta Casa, inclusive pelo Sr. Presidente - é de que a Câmara dos Deputados atue sobre a relevante e preocupante questão do momento, não apenas nacional, mas também internacional.
	No mundo, vive-se uma situação de crise, sobretudo financeira e bancária, que hoje não se circunscreve apenas aos Estados Unidos, mas envolve também a Europa e logo envolverá todos os países. Aliás, de certa forma, já envolve.
	Nessas circunstâncias, de forma muito responsável, o PSDB quer trazer a discussão ao plenário da Câmara dos Deputados. Devemos sair da mesmice das votações recorrentes de medidas provisórias. A primeira que teremos de votar é a Medida Provisória nº 435, absolutamente inócua e que, diante do agravamento da crise internacional e da desvalorização do real perante o dólar, se torna absolutamente irrelevante. Portanto, para nós, é de bom senso a retirada imediata dessa medida provisória.
Sr. Presidente, fui chamado agora há pouco pelo Deputado Henrique Fontana para discutir a possibilidade de trazermos à votação, o quanto antes possível, o Fundo Soberano, outra proposta absolutamente desnecessária, inócua e inoportuna no momento que estamos vivendo. 
Relevância e reconhecimento da gravidade da crise estão na medida provisória que o Governo fez - que autoriza bancos maiores a comprar carteiras de bancos menores e autoriza recursos adicionais para financiamento de nossas exportações -, que, eventualmente, pode ser e será melhorada na Câmara, muito provavelmente adicionando mais recursos ainda, porque a violência da crise se torna patente a cada dia. Essa medida provisória, sim, tem relevância. Há disposição nossa de fazer o que for necessário para que possamos chegar a ela o quanto antes. 
Também quero registrar a postura do Sr. Presidente da República, que, desde o início, tenta tratar os brasileiros como gente desinformada, inepta, incapaz de entender a dimensão da crise. O Presidente Lula, que se autodenomina metamorfose ambulante - e está abusando da metamorfose ambulante -, começa por dizer que a crise não tem nada a ver com o Brasil, que a crise não atravessou o Atlântico, que a crise não sei o quê. Conversa fiada!
Ainda bem que existem o Banco Central e a Fazenda, que, no mínimo, têm a responsabilidade pública de reconhecer que as dificuldades para os exportadores brasileiros hoje são crescentes, que a intermediação financeira está cada vez mais escassa internamente. Portanto, propõe essa medida provisória.
O Presidente e o PT tinham de vir a público fazer um desagravo ao Presidente Fernando Henrique Cardoso, que fez o PROER e impediu a quebra do sistema bancário do Brasil. Irresponsavelmente, Lula e o PT foram contra e tentaram achincalhar-nos, inclusive com ironias sobre os propósitos que nos motivavam. Agora, sorrateira e envergonhadamente, o Presidente Lula assina essa medida provisória, um PROER envergonhado. Nós, aqui na Casa, ainda vamos ter de melhorá-la e deixar ainda mais patente a irresponsabilidade da metamorfose ambulante e do seu partido, quando o Brasil tem grandes desafios a enfrentar.
Não adiantou nada, naquele momento, dizermos que a quebra do sistema bancário no Chile, poucos anos antes, tinha implicado em 18% a menos do crescimento do PIB. Nada disso resolveu. Agora estão fazendo envergonhados, dissimulados, sorrateiros, sem assumir que tinham de fazer um desagravo. 
O País espera por isso. É medida de justiça. Isso aqui não é jogo de futebol, um time contra o outro. É uma nação, é um país que se constrói a cada dia. Melhor ou pior, mas sempre adiante. O papel que as crises sucessivas lá atrás tiveram não foi suficiente para impedir o Brasil de adquirir rumo naqueles Governos do Presidente Fernando Henrique, inclusive no que se refere ao sistema bancário, à solidez fundamental que ele tem hoje.
	Há de se reconhecer que pequenas instituições precisam de auxílio. Aquilo que está proposto nessa medida provisória é um bom começo. Certamente, vamos melhorá-la e aperfeiçoá-la aqui. Esse é o desafio da instituição, senão ficaremos nessa agenda modorrenta, ineficiente, que nada tem a ver com o grande desafio do momento. Vamos ficar aqui nos perdendo: vota essa MP, aquele projeto de urgência, aquela outra. Sobre essa MP nº 435, se o Governo, com bom senso, tivesse falado com técnicos do Banco Central, ele a teria retirado, até por vergonha, porque o conteúdo dela está completamente vencido.
	Sr. Presidente, nossa posição é a favor da retirada da MP nº 435, de esquecer o Fundo Soberano e de fazer um acordo com as forças políticas para chegar a essa medida provisória que o Governo emitiu agora e que queremos aperfeiçoar e melhorar."
