dataHoraInicio;keywords;tipoDiscurso;transcricao
2009-12-07T16:18;GOVENO ESTADUAL, GO, ALCIDES RODRIGUES, GOVERNADOR, INDICADOR ECONÔMICO, AGRONEGÓCIO, BALANÇA COMERCIAL, DADOS, IBGE,  ADMINISTRAÇÃO PÚBLICA, RESPONSABILIDADE FISCAL, PROGRAMA SOCIAL, AVALIAÇÃO.;GRANDE EXPEDIENTE;"O SR. ROBERTO BALESTRA (PP-GO. Sem revisão do orador.) - Sr. Presidente, Sras. e Srs. Deputados, ocupo a tribuna para celebrar uma profissão de fé do futuro Brasil e também dar um testemunho da participação do meu querido Estado de Goiás nesse processo.
	Devo dizer, Sr. Presidente, da minha alegria em retornar à Casa depois de 2 anos afastado, cumprindo uma missão como Secretário de Estado. Mesmo lá, com saudade do Parlamento, para cá vínhamos de quando em vez participar, sobretudo nos finais de ano, da votação do Orçamento Geral da União. E hoje aqui estamos novamente para permanecermos até o final do mandato, em 15 de fevereiro de 2011. 
	No Estado, tivemos a oportunidade, no convívio com o Sr. Governador Alcides Rodrigues e toda a sua equipe, de ser testemunha e também de participar de um trabalho magnífico que entendemos merecer destaque aqui desta tribuna, até porque não temos notícias de qualquer outro Estado que tenha adotado, na sua administração, o comportamento que o Governador Alcides tem para com o Estado de Goiás. 
	Eleito pelo PP numa coligação com o PSDB, PTB, PR, PSB e mais alguns outros pequenos partidos, o Governador adotou como sendo fundamental para o sucesso de sua administração uma postura de isenção quanto ao aspecto político-partidário. 
Todos os seus programas e ações sempre foram desenvolvidos em favor do povo goiano, nunca considerando o município que tivesse um Prefeito de partido contrário ao da coligação do Governador como adversário, tampouco os Parlamentares estaduais ou federais. 
Essa postura permitiu ao Governador trabalhar de forma isenta em favor do povo goiano, o que tem trazido resultados palpáveis e até reconhecidos pelo povo brasileiro. Falo reconhecidos porque hoje dados fornecidos pelo IBGE trazem números para nós muito importantes e que, ao longo desses anos, foram consequência exatamente desse trabalho de isenção política que o Governador exerce no seu mandato. 
Aproveito esta ocasião para fazer duas abordagens mais pontuais: uma, econômica; outra, administrativa. Do ponto de vista econômico, permita-me dizer que o Produto Interno Bruto - PIB de Goiás atingiu, em 2007, o valor de R$65,210 bilhões, com acréscimo de mais de R$8 bilhões naquele ano, sendo o maior desde o início da série, em 2002. Sua participação no PIB nacional, de 2,41%, em 2006, passou para 2,45%, em 2007. Como disse, isso é resultado de um trabalho a 4 mãos que o Governador desenvolve com todo o povo goiano.
Esses são apenas números expressivos da situação nova de Goiás em relação ao Brasil. A verdade é que, há algumas décadas, éramos parte de uma região de fronteira agrícola, vivíamos uma espécie de novo desbravamento após a colonização inicial com os bandeirantes.
Região de produção primária, tipicamente agropecuária, depois do ciclo do ouro, estamos nos transformando rapidamente em Estado industrializado, sobretudo pela força do agronegócio, mas também pela industrialização dele advinda e do incremento dos setores de comércio e serviço.
Para se ter uma ideia melhor, basta que se diga que, do ano de 2000 para 2008, pulamos do sexto para o quarto lugar na produção de álcool no Brasil, com quase 2 milhões de metros cúbicos. Hoje, podemos afirmar desta tribuna, embora a safra 2008/ 2009 não tenha terminado, que o Estado já ocupa o segundo lugar na produção de álcool no Brasil. A produção de grãos saltou de 8,727 milhões de toneladas, em 2000, para 13,295 milhões, em 2008. 	Em 2006, segundo o IBGE, tínhamos o rebanho bovino em crescimento, com mais de 771 mil cabeças. Disso me parece que o Deputado José Genoíno conhece um pouco.
	Por essa atividade básica, que incrementou também a produção secundária e terciária, Goiás gerou um saldo de nível de emprego de 47.347 postos de trabalho a mais, em 2008, e já elevou esse número para 55.891, em balanço parcial de outubro de 2009; ostentou um estoque de emprego, em 2008, de 1.135.046 empregos formais, com participação de 2,88% do emprego nacional, com incremento de 70,97%, entre os anos de 2000 e 2008.
	O resultado dessa atividade também é o saldo da balança comercial de Goiás, com o crescimento dos 180 milhões de dólares, gerados em 2000, para mais de 1 bilhão de dólares, em 2008. Com quase 3 bilhões de dólares em exportações, hoje já não exportamos apenas produtos primários. O chamado complexo soja e o complexo carne, junto com produtos minerais, compõem o forte de nossa balança. Cada vez mais saem de Goiás com valor agregado, processados industrialmente.
Enfim, Sras. e Srs. Deputados, penso ter ilustrado com números a efetiva participação de Goiás no desenvolvimento da nossa Nação brasileira.
Peço vênia, assim, para outra abordagem pontual: administração pública. É certo que ficou no passado o conceito de Estado como agente econômico. Mas isso nem de longe invalida o papel que o Governo de Goiás vem desempenhando no desenvolvimento econômico, de um lado, não sendo o carrasco na arrecadação de tributos que elevam os custos da atividade empresarial e, de outro, cumprindo com rigor sua responsabilidade como equalizador do bem-estar social.
Como integrante, até o mês passado, da sua estrutura de Governo e, mais ainda, como observador atento do cenário político e administrativo de Goiás, dou meu testemunho do muito que este Governo tem feito em prol do desenvolvimento do Estado.
Faz sua parte, primeiro, por extrema responsabilidade fiscal; arrecada o que pode sem terrorismo fiscal, mas com muito rigor; gasta o que arrecada com parcimônia e não faz compromissos além dos que têm condição de honrar. 
Aliás, essa, Sr. Presidente, é uma marca do Governo Alcides Rodrigues. Desde o início do seu mandato, S.Exa. a afirma e reafirma. Em alguns momentos, foi incompreendido por algumas camadas sociais de que não queria gastar, utilizar os recursos do Estado porque não fazia compromissos. Só começou a fazê-los depois de mais de ano no exercício do mandato, quando passou a ter segurança, controle absoluto das finanças do Estado. Foi assim que conseguiu, controlando as despesas, desenvolver um programa muito intenso de aplicação de recursos nas área de infraestrutura e social.
Também dá incentivos fiscais para manter a economia dinâmica e atrativa, sem abrir mão de recolher o necessário para manter uma plêiade de programas sociais. Alguns deles se tornaram referência nacional, como o Renda Cidadã, precursor do Bolsa Família, o maior programa social do Governo Federal. Ele começou em Goiás, com a mesma sistemática, mesmo trabalho, mesma forma de identificação dos mais necessitados, de distribuição de recurso por meio do cartão magnético, dando ao cidadão o direito a adquirir aquilo que mais lhe aprouvesse. Foi a grande mudança na aplicação de recursos na área social, nos últimos anos. Ele começou exatamente em Goiás.
	Há também o Cheque Moradia, outro exemplo na área habitacional, ou o Bolsa Universitária, criado pelo Governador Alcides Rodrigues, quando Prefeito da cidade de Santa Helena, em Goiás.
	Trata-se de um programa que tem complemento e, nesse aspecto, temos um trabalho muito grande desenvolvido, porque, até o Governo criar o Bolsa Universitária, o nível de alunos que alcançavam o curso universitário era muito baixo. Hoje, temos um nível elevadíssimo. Como se não bastasse, o Governo criou, ainda na gestão passada, a Universidade Estadual de Goiás, também gratuita.
	Como se a universidade e a Bolsa Universitária ainda não fossem suficientes para atender a toda a demanda do Estado, o Governo criou ainda um complemento com o estágio remunerado. O aluno que não frequenta a universidade estadual ou recebe a Bolsa Universitária mesmo estudando em colégios particulares, pode ter também ajuda com o estágio remunerado. Essa facilidade permitiu o avanço que tivemos na área da educação, sem contar as unidades do CEFET que já estão funcionando e as outras em fase de implantação.
	O Governo Alcides Rodrigues, para o bem do desenvolvimento de Goiás e do Brasil, não se descuida de investimentos em infraestrutura. Nesse aspecto, como falei no início, é um Governador que só gasta o que arrecada. Só dá ordens se o dinheiro estiver em caixa. Demorou 3 anos, mas, no final, apresentou um programa de asfalto nas cidades para cobrir os 246 municípios indistintamente. Não houve e não haverá, da parte do Governador, discriminação àqueles Prefeitos que pertencem a partidos diferentes ou considerados de oposição ao Governo Alcides Rodrigues.
	Então, esse é um avanço. O Governador tem responsabilidade anunciada no seu programa de Governo, confirmado agora no lançamento do Programa do Passe, que, ao final do seu mandato, em 31 de dezembro de 2010, terá oferecido a todos os 246 municípios o recurso necessário para asfaltamento das ruas em todos os municípios, não deixando uma rua sequer sem asfalto. Por isso, o nosso entusiasmo com esse programa e com o Governo. 
	O Governador, também, com uma preocupação muito grande com o Estado, por haver distâncias enormes, está desenvolvendo um programa aeroportuário. Em todo o Estado estão sendo construídos 30 pequenos aeroportos com balizamento noturno, etc., para facilitar a vida daqueles que transitam via aérea, permitindo ao Estado uma integração maior. É um programa ousado, tem a participação do Governo Federal, com recursos federais, o que vai dar ao Estado uma mobilidade muito grande.
	Estradas, energização e saneamento básico estão em suas prioridades de investimento. É claro que esses setores, principalmente, contam com a valiosa ajuda de recursos federais. Sem eles, nenhum Governo Estadual poderia pensar, por exemplo, em obra de vulto, como a da Ferrovia Norte-Sul, que é uma realidade. Alguns bilhões de reais lá estão sendo aplicados, e já com o anúncio da inauguração da ferrovia, feito pelo Presidente da VALEC, Juquinha das Neves, e pelo Presidente Lula quando esteve em Goiás, no mês de agosto, anunciando que, possivelmente, no mês de agosto de 2010, S.Exa. voltará a Goiás para inaugurar a Ferrovia Norte-Sul. Ela tem um sentido muito especial para Goiás porque vai integrar o Sul ao Norte, vai permitir um corredor de desenvolvimento que já se faz sentir à margem e ao lado, paralelamente à Rodovia Belém-Brasília, o que dará ao Estado mais uma oportunidade de desenvolvimento, além do que já falei. É com base nessas e em outras premissas que pregamos o caminho do agronegócio e, assim, o caminho de Goiás para a continuada aceleração do crescimento nacional.
	O Brasil entrou por último e saiu primeiro da crise econômico-financeira  internacional. Estamos saindo fortalecidos basicamente pela nossa capacidade de produzir e industrializar o alimento de que o mundo precisa para continuar existindo. O Governo de Goiás não tem deixado um instante sequer de fazer a sua parte. 
	Por isso, nós, goianos, queremos continuar dando a nossa contribuição ao desenvolvimento nacional. 
	O Governador Alcides, em todas as suas manifestações, em todos os discursos e em todos os seus pronunciamentos, não tem poupado elogios e agradecimentos ao Presidente Lula pelo apoio incondicional que tem dispensado ao seu Governo, e permitido que ele alcance esse nível de desenvolvimento. 
	Muito obrigado, Sr. Presidente."
2010-04-13T17:02;"MEDIDA PROVISÓRIA, CRÉDITO EXTRAORDINÁRIO, ÓRGÃOS, EXECUTIVO, REDUÇÃO, ORÇAMENTO DE INVESTIMENTO, EMPRESA ESTATAL.
DISPOSITIVOS, RECURSOS, MINISTÉRIO DO TURISMO, DESTAQUE, VOTAÇÃO EM SEPARADO, SUPRESSÃO, VOTO CONTRÁRIO, PARTIDO POLÍTICO, PP.";ORIENTAÇÃO DE BANCADA;"O SR. ROBERTO BALESTRA (PP-GO. Pela ordem. Sem revisão do orador.) - Sr. Presidente, apesar do descontentamento em relação ao tratamento que recebe do Governo, o PP encaminha favoravelmente. Nossa intenção era continuar na obstrução, mas vamos dar mais este voto de confiança ao Governo e votar ""sim""."
