dataHoraInicio;keywords;tipoDiscurso;transcricao
2007-03-22T14:42;"MUNICÍPIO, INHUMAS GO,  EMANCIPAÇÃO POLÍTICA, HOMENAGEM.
CEFET, GO, MUNICÍPIO, INHUMAS, INAUGURAÇÃO, PRESENÇA, LUIZ INÁCIO LULA DA SILVA, PRESIDENTE DA REPÚBLICA.";PELA ORDEM;"O SR. ROBERTO BALESTRA (PP-GO. Pela ordem. Sem revisão do orador.) - Sr. Presidente, Sras. e Srs. Deputados, registro que, no último dia 19, foi aniversário da minha cidade, Inhumas, que completou 76 anos de existência.
Na oportunidade, recebeu a visita do Sr. Governador Alcides Rodrigues Filho, que a presenteou com algumas obras. Felicidade maior veio exatamente no dia 20, quando o Presidente Luiz Inácio Lula da Silva lá inaugurou a unidade do CEFET. Foi a primeira vez que um Presidente da República visitou Inhumas. Esteve presente também o Ministro da Educação, para referendar todas as solicitações do Diretor do CEFET de Goiás de ampliar os cursos técnicos da unidade de Inhumas.
Sr. Presidente, aproveito a oportunidade para me somar aos demais Parlamentares com relação ao Deputado Roberto Magalhães."
2007-07-09T15:33;"GRANDE EXPEDIENTE, USO DA PALAVRA, ALTERAÇÃO, CRITÉRIOS. 
SANTA ALVES SOYER, PROFESSOR, ANIVERSÁRIO, HOMENAGEM. 
ALCIDES RODRIGUES FILHO, GOVERNADOR, GO, DESENVOLVIMENTO SOCIO ECONÔMICO, DESENVOLVIMENTO SUSTENTÁVEL, DIVERSIFICAÇÃO, PRODUÇÃO AGRÍCOLA, CANA DE AÇÚCAR, ÁLCOOL COMO COMBUSTÍVEL, PRODUÇÃO AGROPECUÁRIA, EXPORTAÇÃO, AGRONEGÓCIO, CRIAÇÃO, EMPREGO, REGIÃO CENTRO OESTE, MELHORIA, QUALIDADE DE VIDA, POPULAÇÃO, INVESTIMENTO PÚBLICO, EDUCAÇÃO, SAÚDE, DESENVOLVIMENTO INDUSTRIAL, RODOVIA, RECUPERAÇÃO, CUMPRIMENTO, LEI DE RESPONSABILIDADE FISCAL, ELOGIO, ATUAÇÃO.";GRANDE EXPEDIENTE;"O SR. ROBERTO BALESTRA (PP-GO. Sem revisão do orador.) - Sr. Presidente, Sras. Deputadas e Srs. Deputados, inicialmente, quero cumprimentar a Mesa Diretora da Câmara dos Deputados pela seriedade com que, a partir de agora, concede a todos os Parlamentares a oportunidade de falar no período do Grande Expediente. 
Explico: a panelinha funcionava, e só tinham direito a usar a tribuna no Grande Expediente os Parlamentares que se dispusessem a ficar em uma reunião fechada, que muitas vezes ninguém sabia onde era realizada, para fazer a escolha, o sorteio.
Apesar de já ter exercido 6 mandatos, devo ter usado esta tribuna no período do Grande Expediente 4 vezes. Esta é a quinta vez que a uso, em 21 anos, em função do critério absurdo anteriormente usado pela Mesa Diretora da Casa, que privilegiava uns em detrimento de outros. 
Gostaria até, Sr. Presidente, que a Mesa Diretora avançasse e, em vez de fazer o sorteio na ausência dos Parlamentares, fizesse no plenário, já que estamos todos aqui todos os dias. Não vejo razão alguma para não proceder assim.
Já melhoraram bastante os trabalhos com a adoção deste novo critério, mas poderíamos avançar ainda mais, o que tiraria toda a qualquer dúvida com relação à lisura do processo de sorteio dos Parlamentares para o uso da tribuna no horário do Grande Expediente.
Sr. Presidente, hoje, com muito prazer e com muita honra, saúdo desta tribuna uma pioneira do ensino em Brasília, a Profa. Santa Alves Soyer, que aqui chegou em 1957, juntamente com Juscelino Kubitschek, e o ajudou a implantar o ensino público no Distrito Federal. Juntamente com 5 outras professoras, instalou a primeira escola pública de Brasília, a Escola Classe Júlia Kubitschek, localizada no Núcleo NOVACAP, Candangolândia, que teve sua inauguração histórica em 12 de setembro de 1957.
O curioso é que naquela época já existia solidariedade, respeito mútuo e princípio democrático. Como havia 6 professoras e era preciso escolher a diretora da primeira escola pública de Brasília, ficou resolvido, entre as professoras, que cada uma ocuparia a função durante 1 mês. Ao final de 6 meses, seria escolhida, dentre elas, a diretora definitiva. Depois desse trabalho, coube a Santa Alves Soyer, que hoje completa 90 anos de idade, a indicação para ser a diretora da primeira escola classe de Brasília.
A ela os meus votos de felicidade. Para o meu orgulho, D. Santa Alves Soyer é irmã da minha mãe. Logicamente, é minha tia, e ainda vive na mesma casa que habitou depois de se mudar da Candangolândia para o Plano Piloto, localizada na 709 Sul.
Peço à Mesa Diretora da Casa que encaminhe a ela os votos de felicidades pelo transcurso dos 90 anos de idade, tão bem vividos e tão bem dedicados à população de Brasília, ao meu Estado de Goiás e à minha cidade de Inhumas, onde ela nasceu.
Sr. Presidente, Sras. e Srs. Deputados, também utilizo este espaço para reverenciar o Governador de Goiás, o médico Alcides Rodrigues Filho, meu correligionário de partido e pessoa dotada de grande espírito humano, com destacada capacidade administrativa pelas ações que vem implementando à frente do Governo de Goiás, respaldando o perfil de desenvolvimento que o nosso Estado experimenta. 
O Dr. Alcides distingue-se também por sua coerência nas posições políticas e por dinâmico e especial senso prático.
Neste espaço, pretendo apresentar um pouco do perfil administrativo, político e econômico do Estado de Goiás, especialmente no período administrado sob a responsabilidade do nosso partido, tendo à frente Dr. Alcides Rodrigues Filho, com ênfase no trabalho de destacar Goiás como um dos Estados que experimenta substancial nível de desenvolvimento.
Não sem motivo, o IBGE divulgou recentemente levantamento que põe o Centro-Oeste brasileiro em pé de igualdade com o Sul e o Sudeste no desenvolvimento social e econômico, caminho que, acredito - e todos os ""centro-oestinos"" de visão também -, não tem volta e se consolida a todo instante com as políticas desenvolvidas na região, em especial em Goiás.
Para se ter uma idéia desse contexto, o PIB de Goiás tem crescido o dobro da média nacional. Em 1998, o PIB goiano foi de 17,4 bilhões de reais; em 2005, atingiu mais de 45 bilhões de reais, devendo fechar 2006 com mais de 50 bilhões de reais. 
São dados que dão a visão global do nível de crescimento e desenvolvimento de Goiás nos últimos anos.
Nos últimos 3 anos, Goiás praticamente dobrou a sua capacidade de produção de açúcar e álcool. Só neste ano, o Governador Alcides Rodrigues participou do lançamento da pedra fundamental de mais 3 novas usinas para a produção de açúcar e etanol.
Goiás já ocupa a quarta colocação, em nível nacional, na produção de álcool hidratado. A tendência é a de crescer mais ainda. Contamos atualmente com 17 usinas.
É importante salientar que, dos 136 novos projetos de açúcar e álcool planejados no Brasil, 30 deles são para Goiás. Devem ser muito mais, na mesma medida em que a consciência mundial sobre energia limpa for crescendo.
É importante lembrar, Sras. e Srs. Deputados, que essa importância estratégica de Goiás não acontece por acaso. Nos últimos anos, a produção de cana-de-açúcar simplesmente dobrou. Em 1998, produzíamos 8 milhões de toneladas e passamos a 16 milhões de toneladas em 2006. A produção de álcool total saltou de 448 mil metros cúbicos, em 1998, para 820 mil metros cúbicos em 2006.
Estamos, portanto, na rota do futuro. O interesse demonstrado, por exemplo, pelos Estados Unidos da América do Norte para estabelecer parcerias com o Brasil é promissor. O mesmo interesse vêm demonstrando Europa e Ásia. Devem assegurar financiamentos e negócios no nível necessário para crescimento bastante acelerado, consistente e muito lucrativo para o Brasil. 
É fundamental, neste sentido, criarmos o nosso próprio alerta: o crescimento que queremos não deve se dar à custa de mais degradação ambiental. 
Há estudos recentes mostrando que o Centro-Oeste ainda detém 61% do cerrado que originou o nosso desenvolvimento.
Em Goiás, a área utilizada na produção agrícola é estimada em 4 milhões e 100 mil hectares: 62% de soja; 18% de milho; 6% de cana-de-açúcar; 6% de sorgo; e o restante de outras 14 culturas. 
Contabilizamos cerca de 5 milhões de hectares de áreas degradadas de pastagens, que podem servir para a expansão agrícola em Goiás, sem derrubar uma única árvore.
Sr. Presidente, nobres colegas, na esteira desse desenvolvimento com responsabilidade, nos últimos 8 anos e meio Goiás octuplicou as suas exportações, diversificando os produtos e a quantidade de parceiros comerciais.
Goiás é privilegiado por sua posição central e tem-se servido dessa estratégia para capitalizar mais investimentos produtivos.
Em 1999, vendia a 69 países; hoje, Goiás exporta para 137 nações. Exportávamos 275 produtos; e agora a nossa pauta de exportações é composta por 800 produtos.
A economia goiana se consolida, com foco na diversificação da produção. O resultado é uma pauta exportadora atraente aos mercados e rica de novos produtos, inclusive de alta tecnologia.
Pesquisa do Ministério do Trabalho e Emprego tem mostrado Goiás sempre nos primeiros postos da criação de empregos com carteira assinada no Centro-Oeste.
Pesquisa do Banco Mundial, divulgada recentemente, mostra que Goiás está entre os 3 melhores Estados em qualidade de vida para os jovens, com atenção especial para as oportunidades de educação e emprego.
Levantamento da Federação das Indústrias do Estado de Goiás - FIEG informou, na semana passada, que as vendas industriais goianas em abril tiveram incremento de 42%, o que caracteriza a pujança que o nosso Estado passou a ter no desenvolvimento do setor industrial.
Criamos e consolidamos a Universidade Estadual de Goiás, hoje a segunda no ranking das instituições públicas de ensino superior, com mais de 33 mil alunos matriculados, perdendo apenas para a USP. No ENADE - Exame Nacional de Desempenho de Estudantes, a UEG está em quarto lugar na classificação geral do País.
Outros dados consolidam a posição de Goiás no ranking do desenvolvimento nacional: temos proporcionalmente a maior frota de automóveis e de motocicletas do País; Goiás é o maior pólo de produção de medicamentos genéricos do Brasil e está entre os primeiros na produção de remédios.
Estão previstos para os próximos 3 anos investimentos de mais de 1 bilhão e 200 milhões de dólares em Goiás, no setor de expansão mineral, principalmente de ouro, cobalto, amianto crisotila, nióbio, cobre, níquel, vermiculita e fosfato.
O Estado de Goiás é o terceiro maior produtor de bens minerais do País, descartada a produção de petróleo. Está previsto faturamento dessa produção, em 2007, superior a 1,5 bilhão de dólares.
Sob os auspícios do Sr. Alcides Rodrigues, há mais de 1 ano Goiás conseguiu diminuir o índice de violência em cerca de 30%, com investimentos maciços na melhoria da segurança pública, produzindo reflexos altamente positivos na qualidade de vida da população. 
No setor de saúde, o Governo de Goiás conseguiu humanizar o atendimento, equipar hospitais e manter destacável nível de socorro aos mais necessitados com a melhoria da estrutura de hospitais, a contratação de mais médicos e pessoal da área médica.
Na educação, Goiás deu saltos significativos: mais de 90% dos professores da rede pública goiana hoje têm curso superior; as escolas estão em boas condições de uso, atendendo a mais de 1 milhão e 100 mil alunos; os professores nunca foram tão valorizados como agora, estando entre os 5 melhores níveis salariais do País; o Governo destina mensalmente mais de 2 milhões de reais para reformas e ampliação de escolas.
Numa aferição desse quadro, nos últimos 14 meses foram construídas 80 novas escolas e abertas mais 95 mil vagas, dentre inúmeras outras ações para a melhoria da educação.
No setor rodoviário, para se ter uma idéia, desde quando assumiu o Governo, em abril de 2006, o Governador Alcides Rodrigues inaugurou aproximadamente 200 novos quilômetros de rodovias pavimentadas, e mais de 100 quilômetros de vias foram revitalizadas. Recentemente, o Governo de Goiás consolidou, com o Banco Mundial, a segunda etapa de um financiamento para a pavimentação e a revitalização de rodovias no Estado.
No programa de asfaltamento municipal, milhares de metros quadrados de ruas e avenidas foram inaugurados. Esse é um serviço que melhora a qualidade de vida das pessoas que moram nas cidades, servindo também para evitar doenças.
Na área das finanças públicas, em 1998, eram necessárias 3,35 receitas anuais para pagar a nossa dívida. Essa relação, segundo levantamento da Secretaria do Tesouro Nacional, de agosto de 2006, é hoje de 1,88, o que significa diminuição de mais da metade da relação da dívida do Estado com a sua receita, melhorando em muito o seu perfil.
Goiás está conseguindo cumprir adequadamente a Lei de Responsabilidade Fiscal, em que pesem as dificuldades enfrentadas neste início de Governo, principalmente porque precisa despender mensalmente quase 100 milhões de reais para o pagamento de uma dívida feita há anos.
Em função disso, o Governador Alcides Rodrigues Filho tomou medidas duras para a contenção de despesas e que valerão para todo este primeiro ano de Governo. Goiás se comporta dentro de parâmetros orçamentários e financeiros rigorosos, para que se mantenha dentro de um nível aceitável de equilíbrio fiscal. 
Essa postura reclama ora a redução, ora a liberação de despesas a partir de uma perspectiva otimista. De tal forma, o Governo goiano permanece firme dentro do grupo seleto dos Estados brasileiros com nível de equilíbrio fiscal rígido e adequado.
Hoje, os salários do funcionalismo em Goiás são pagos no mês trabalhado, e o 13º salário é pago no mês do aniversário do servidor, o que garante considerável fluxo mensal de recursos para girar a economia. 
O Estado de Goiás consegue aumentar a arrecadação, diminuindo a carga tributária de mais de 140 itens de nossa malha fiscal. 
O PIB per capita do goiano, que era de 3.610 reais em 1998, passou para 8.500 reais em 2007. E, com o nível de crescimento e de desenvolvimento que experimentamos, a tendência é a de que esse número cresça cada vez mais. 
Em outras palavras, isso significa melhoria de vida e diminuição das desigualdades sociais, itens que têm elevado o status econômico de Goiás. No ranking da economia nacional, passamos do 11º para o 10º lugar e, no ranking da competitividade, saltamos da nona para a oitava colocação no cenário nacional nesse período. 
Obtivemos também saltos significativos no setor do agronegócio, com aumento de 57% na produção de grãos; de 120% na área irrigada; de 110% na produção de aves; e de 37% na produção de leite.
Goiás ocupa hoje a primeira colocação na produção de tomate, sorgo, girassol e feijão irrigado e ocupa ainda o 2º lugar na produção de leite, com mais de 2,6 bilhões de litros por ano. É o 3º colocado na produção de algodão e o 4º, na produção de bovinos, soja e milho.
Quanto à industrialização, em 1998, o valor de transformação em Goiás era de 2,17 bilhões de reais e, em 2007, passou para 9 bilhões de reais. De 1999 a junho de 2007, os Programas Fomentar e Produzir beneficiaram mais de 1.200 empresas com investimentos de 18 bilhões de reais. 
Na área mineral, criamos o FUNMINERAL. A nossa produção de calcário cresceu em 66%; a de fosfato aumentou 85%; e a de ouro dobrou.
Obtivemos avanços na área de Ciência e Tecnologia, inclusive com a criação da Fundação de Amparo à Pesquisa, com orçamento de 0,5% da receita tributária do Estado. 
Obtivemos ainda avanços consideráveis na preservação do meio ambiente, com o aumento da área protegida de 1,3% para 4,8% da área total do Estado. E conseguimos avanços significativos no desenvolvimento social, com mais de 20 programas de inclusão social, dentre os quais destaco Bolsa Universitária, Salário Escola, Banco do Povo, Renda Cidadã, Morada Nova, Cheque Moradia e kits sanitários. Todos esses programas estão sendo agora reestruturados e concatenados com os programas sociais do Governo Federal, para evitar duplicidade e melhorar o atendimento.
No plano cultural, Goiás experimenta autêntico florescer das artes e da criatividade, com iniciativas marcantes, como o FICA - recentemente foi realizada a 9ª edição -, o Canto da Primavera, o Festival Tempo de Teatro e outros festivais, além do apoio marcante às nossas manifestações artísticas e folclóricas.
Assim, Goiás aprofunda seus caminhos enquanto alternativa avançada de ação pública, em que todos colaboram e participam no mais elevado padrão de responsabilidade e de respeito mútuo.
É de acordo com essa perspectiva que o nosso Governo se propõe à colaboração num grau ainda mais amadurecido com os Parlamentos, com a sociedade organizada, com o fórum empresarial de Goiás, com o Poder Judiciário, com o Ministério Público, com os Tribunais de Contas e com as Prefeituras.
O Governo Alcides Rodrigues sabe também respeitar o legítimo papel desempenhado pelas Oposições, com ênfase evidente na gigantesca tarefa administrativa, tendo sempre como meta um salto de qualidade no processo de crescimento de Goiás. 
O Estado busca agora um novo choque de gestão para minimizar os problemas e maximizar as conquistas em todos os setores da economia e da sociedade. 
No que tange à administração, Goiás é hoje referência para todo o País no que se refere à correta aplicação dos recursos públicos. Alcançou as maiores taxas de crescimento do País e se inseriu de maneira definitiva no plano industrial. O agronegócio se expandiu com índices históricos, e as exportações alcançaram taxas recordes. O comércio e o setor de serviços foram dinamizados e ampliados. A infra-estrutura também se revigorou, com mais de 1 bilhão de reais de investimentos em pavimentação, duplicação e abertura de novas estradas. O servidor público obteve o reconhecimento e a inteira valorização. E, principalmente, praticamos o sentido maior de justiça, por meio da Rede de Programas de Proteção Social, proporcionando dignidade aos mais carentes.
O Governo de Goiás, com Alcides Rodrigues, busca promover o crescimento em todas as direções, dando seqüência à abertura de oportunidades para os trabalhadores e a juventude.
(O microfone é desligado.)
O SR. ROBERTO BALESTRA - Sr. Presidente, peço a V.Exa. um pouco de paciência porque já afirmei, no início do meu discurso, que o critério adotado nesta Casa para a escolha dos oradores do Grande Expediente é tendencioso, maldoso e exclui os Parlamentares. Estou no meu sexto mandato, e esta é a sexta vez que uso a tribuna para falar no Grande Expediente. Acho, portanto, que tenho até direito adquirido para tomar um pouco do tempo do meu colega Domingos Dutra, o próximo a se manifestar. 
Sr. Presidente, é intensa a luta para a atração de investimentos que fomentem a economia e fortaleçam os municípios. As ações pró-industrialização continuam, propondo incentivos ao capital produtivo que escolha Goiás para a instalação de novas indústrias. 
É visível e forte a luta para a descentralização do desenvolvimento em Goiás, com incentivos maiores aos investidores que queiram montar as suas indústrias nas regiões norte e nordeste do Estado, reconhecidamente as mais carentes.
Sr. Presidente, Sras. e Srs. Deputados, Goiás é hoje forte parceiro do Governo Federal, buscando a consecução de obras e investimentos que melhorem a infra-estrutura viária, aeroportuária e aduaneira, favorecendo ainda a indústria do turismo.
Precisamos do apoio definitivo do Governo Federal para melhorar a nossa plataforma logística na cidade de Anápolis, assim como o seu porto seco.
Precisamos desse apoio também para a revitalização da Ferrovia Centro-Atlântica, melhorando os nossos corredores de exportação pelos portos do Espírito Santo, para a concretização da Ferrovia Norte-Sul em Goiás e para a construção do alcoolduto até o Estado de São Paulo.
Essas obras garantirão novas e melhores perspectivas a Goiás na solidificação de seu crescimento e de seu desenvolvimento econômico, pois vão melhorar a competitividade dos produtos goianos e garantir novos mercados.
Em resumo, Sras. e Srs. Parlamentares, esse é o perfil do Governo de Goiás, hoje comandado por Alcides Rodrigues, único Governador representante do Partido Progressista em nosso País. 
Mostra, em suma, que o nosso partido é coerente com os seus princípios e demonstra refinada capacidade de bem governar, respeitando os parâmetros do equilíbrio fiscal concatenado com ações que viabilizam desenvolvimento com justiça social.
Encerro, Sr. Presidente, agradecendo a V.Exa. e aos nobres colegas a paciência e também convidando todos os que não o conhecem, em nome do Governo de Goiás, a conhecer o Estado, a sua pujança natural, as águas quentes de Caldas Novas, as belezas do Rio Araguaia - estamos em plena temporada - ou a Chapada dos Veadeiros, bem como a sua pujança comercial, industrial e agropecuária.
Muito obrigado.
O SR. PRESIDENTE (Uldurico Pinto) - Gostaria de parabenizar o Deputado Roberto Balestra por seu pronunciamento e dizer a S.Exa. que todos os sorteios dos oradores do Grande Expediente contam com a presença de pelo menos 1 membro da Mesa Diretora."
2008-11-20T09:42;ROBERTO BALESTRA, DEPUTADO FEDERAL, MANDATO PARLAMENTAR, REASSUNÇÃO.;BREVES COMUNICAÇÕES;"O SR. ROBERTO BALESTRA (PP-GO. Sem revisão do orador.) - Sr. Presidente, depois de um tempo fora da Casa, atendendo a convite do Governador Alcides Rodrigues para comandar a Secretaria de Assuntos políticos do Estado de Goiás, e depois de uma campanha bastante acirrada, retorno à Casa com saldo positivo: o Governador, com seu estafe, conseguiu eleger 180 Prefeitos, dentre 246 Municípios. E retorno no momento da apresentação das emendas ao Orçamento - e não só para defender as minhas, como também as da bancada do meu Estado, que é carente.
	Sr. Presidente, quero me colocar à disposição da Mesa para continuar aquele trabalho de 6 mandatos que exerci na Casa. Estou à disposição dos colegas, e continuo a trabalhar em favor do meu Estado de Goiás.
	O SR. PRESIDENTE (Osmar Serraglio) - Pois não. V.Exa. foi Conselheiro da República, o que orgulha a nossa Casa."
