dataHoraInicio;keywords;tipoDiscurso;transcricao
2007-05-29T16:08;SANDRO MATOS, DEPUTADO FEDERAL, RECEBIMENTO, PROPINA, PT, VOTAÇÃO, INTERESSE, GOVERNO FEDERAL, DENÚNCIA, ROBERTO JEFFERSON, CONGRESSISTA, INFORMAÇÃO, BOLETIM INFORMATIVO, DEPARTAMENTO INTERSINDICAL DE ASSESSORIA PARLAMENTAR, DIAP, CONTESTAÇÃO.;RECLAMAÇÃO;"O SR. SANDRO MATOS (PR-RJ. Questão de ordem. Sem revisão do orador.) - Sr. Presidente, o art. 21, § 2º, do Regimento Interno, dispõe:
		""Art. 21.......................................................................
		§ 2º A Procuradoria Parlamentar providenciará ampla publicidade reparadora, além da divulgação a que estiver sujeito, por força de lei ou de decisão judicial, o órgão de comunicação ou de imprensa que veicular a matéria ofensiva à Casa ou a seus membros.""
	Informo, Sr. Presidente, que recebi hoje, em meu gabinete, publicação do DIAP. Provavelmente, os demais Deputados também o receberam. Na página em que está a minha foto, o meu nome e o meu perfil, o DIAP informa: Em 2005, foi acusado de ser um dos beneficiários do mensalão. É mentira! Isso nunca aconteceu comigo. Não tive nenhum problema, ao contrário do que informa o DIAP. É uma irresponsabilidade muito grande desse departamento, que se diz capaz de avaliar a qualidade dos serviços que prestamos nesta Casa, quando nem mesmo o que ele publica tem qualidade.
	Além disso, diz a publicação que ""Sandro teria recebido 92 mil em dinheiro ilegal para cobrir gastos com a campanha eleitoral, em 2004, quando concorreu à Prefeitura de sua cidade natal. Absolvido no Conselho de Ética da Câmara, não chegou a ser indiciado pelo STF. Nesta legislatura, é titular da Comissão (...)"". 
	Sr. Presidente, não sei se os outros pares chegaram a analisar suas biografias publicadas nesta que é, com certeza, uma das bases de referência para vários jornalistas que estão hoje na Casa trabalhando e que passam informações não somente para a minha base eleitoral, no meu município, na minha região e no meu Estado, mas também para todo o Brasil. Acho que essa publicação é uma falta de responsabilidade muito grande.
	Sr. Presidente, tenho em minhas mãos documentos. Naquele período, quando houve o processo deflagrado pelo ex-Deputado Roberto Jefferson, eu era do PTB. O ex-Deputado Roberto Jefferson comentou no Conselho de Ética que teria recebido 4 milhões de reais. Recebi, sim, Sr. Presidente, documentação que dizia que, possivelmente, todos os candidatos a Prefeito que concorreram pelo PTB teriam recebido algum tipo de recurso na campanha. 
Isso, automaticamente, circulou pela Casa. Várias Lideranças, inclusive de todos os partidos da Esquerda, acharam um absurdo o que aconteceu naquele momento. Fizemos a defesa prévia, encaminhamos ao Presidente Severino Cavalcanti. Em seguida, chegou ao Conselho de Ética. Na época, o Relator, Deputado Nelson Trad, que é um brilhante Deputado e que tem feito brilhante trabalho no Conselho, retratou o absurdo que aquilo representava, tanto que encaminhou a representação para a  Comissão de Constituição e Justiça. 
Além disso, o próprio Presidente do Conselho de Ética emitiu um documento dizendo que achava um absurdo a forma como tinha sido apresentado o fato e a irresponsabilidade daquele ato.
	Na Comissão de Constituição e Justiça, foi declarado, por meio de documento, que a Representação nº 35, um processo de 2005, contra o Deputado Sandro Matos, por quebra de decoro Parlamentar, com base nos mesmos dispositivos constitucionais e regimentais citados na representação, pugnando pela aplicação da penalidade da cassação do mandato, foi arquivada pela improcedência, por inépcia da representação. E a apreciação do Plenário da Casa somente ocorreria se houvesse recurso com o quorum e nos prazos previstos. Ou seja, a representação sequer foi julgada pelo Conselho de Ética. Portanto, o DIAP comete um grande erro, um grande equívoco. E não somente isso. O DIAP comete uma irregularidade justo no momento que atravessamos. 
Apelo a V.Exa. e a todos os pares para que não deixemos mais esse tipo de coisa continuar acontecer. A mídia não pode pautar esta Casa, até porque quem me conhece sabe da minha integridade, da minha dignidade e da forma como conduzo, não só minha vida particular, mas principalmente minha vida pública. 
Não admito em nenhum momento que esse instituto, o DIAP, que se diz de tamanho respeito, venha declarar, por exemplo, que participei de mensalão. Que absurdo é esse?! 
Tenho aqui, inclusive, certidão da Mesa Diretora, assinada pelo Secretário Mozart, sobre essa questão. Em nenhum momento tive qualquer tipo de problema administrativo na Casa.
	Vejo isso simplesmente como um absurdo. Estou aqui querendo meus  direitos reparatórios diante do DIAP. Quero dizer que vou entrar com uma ação cível cobrando os meus direitos na Justiça. Não podemos mais admitir esse tipo de falta de qualidade. A imprensa é importante para divulgar, acionar a Polícia Federal quando tiver que ser acionada, mas não pode chegar ao ponto de querer pautar esta Casa e simplesmente denegrir a imagem das pessoas sérias que aqui trabalham.
	Muito obrigado.
	O SR. PRESIDENTE (Arlindo Chinaglia) - V.Exa. anunciou como uma questão de ordem e falou sobre as medidas que vai tomar. Naturalmente, eu recebo como uma reclamação.
	Creio que é nosso dever fazer contato com o DIAP, até porque isso precisa ser esclarecido o mais rápido possível. Vamos ver que medida o próprio DIAP, eventualmente, poderá tomar, sem prejuízo daquilo que V.Exa. julgar necessário fazer para a defesa da sua honra e do seu mandato.
	 Por parte da Mesa - V.Exa. fez referência a isto no início -, quero dizer que  a Procuradoria Parlamentar está aí para atender a todos os Deputados.  Portanto, V.Exa. já poderá ter a iniciativa de procurá-la. E aí creio que a Procuradoria tomará as providências cabíveis. 
	O SR. SANDRO MATOS - Sr. Presidente, gostaria de agradecer a V.Exa. a atenção, mas quero alertar para o fato de que o lançamento deste livro foi feito nesta Casa. Eles usam a estrutura da Casa para denegrir a imagem de um Parlamentar íntegro, trabalhador e que vem realmente lutando pelo povo brasileiro. Aqui 99% são pessoas sérias. Se 1% cria algum problema, a culpa, infelizmente, não é nossa.
	O SR. PRESIDENTE (Arlindo Chinaglia) - Pelo que me lembro, o lançamento foi feito pelo Congresso em Foco mais o DIAP. Prefiro neste momento trabalhar com a idéia de que é um erro. Até porque, no caso, o DIAP não é parte da mídia. O Congresso em Foco, eventualmente, pode ser assim entendido.
	Mas garanto a V.Exa. que vou entrar pessoalmente em contato com a DIAP e pedir para que verifiquem essa questão que diz respeito a V.Exa. E V.Exa. tome as medidas que julgar oportunas. 
	Dentro desses limites, vamos procurar corrigir o erro o mais breve possível, sem prejuízo, repito, de qualquer outra iniciativa de V.Exa.
	O SR. SANDRO MATOS - Agradeço a V.Exa. por ter acatado meu pedido."
