dataHoraInicio;keywords;tipoDiscurso;transcricao
2017-10-18T17:54;MUSEU DE ARTE MODERNA (MAM), SÃO PAULO (SP), EXPOSIÇÃO DE ARTE, NUDEZ, NUDISMO, CRIANÇA, EXPOSIÇÃO, PROTEÇÃO, NECESSIDADE, ESTATUTO DA CRIANÇA E DO ADOLESCENTE (ECA), RESPONSABILIDADE, APURAÇÃO.;DISCURSO ENCAMINHADO;"PRONUNCIAMENTO ENCAMINHADO À MESA PARA PUBLICAÇÃO

	O SR. ANTONIO BULHÕES (PRB-SP. Pronunciamento encaminhado pelo orador.) - Sr. Presidente, Sras. e Srs. Deputados, seria muito melhor se a presença de uma criança na performance de um artista nu, no Museu de Arte Moderna de São Paulo, nunca tivesse acontecido. Mas, já que ocorreu e gerou grande polêmica, creio que devemos aproveitar o episódio para avaliar o que diz a legislação a esse respeito e a responsabilidade de cada um na preservação das novas gerações.
	O Estatuto da Criança e do Adolescente - ECA é categórico ao dispor sobre a ""proteção integral"" às pessoas de até 18 anos. E essa proteção não é apenas nesse ou naquele aspecto, cabe frisar, mas uma proteção integral, como afirma a lei já em seu art. 1º, esclarecendo, logo adiante, que para seus efeitos considera-se criança a pessoa até 12 anos de idade incompletos e adolescente aquela entre 12 e 18 anos de idade.
	O art. 4º do ECA explicita os direitos abrangidos por essa proteção integral e a quem cabe garanti-los, nos seguintes termos:
Art. 4º É dever da família, da comunidade, da sociedade em geral e do poder público assegurar, com absoluta prioridade, a efetivação dos direitos referentes à vida, à saúde, à alimentação, à educação, ao esporte, ao lazer, à profissionalização, à cultura, à dignidade, ao respeito, à liberdade e à convivência familiar e comunitária.
	Vamos focar aqui os direitos à cultura, à dignidade e ao respeito, que interessam mais neste momento, mas antes convém relembrar rapidamente o caso.
	Conforme o noticiário, um vídeo publicado em rede social mostrou uma criança de aproximadamente 4 anos tocando o pé de um homem que fazia uma apresentação, nu, na abertura da mostra Panorama da Arte Brasileira.
	Assim que o assunto se tornou público, a reação foi muito forte: em uma semana, 157 mil pessoas comentaram a questão em diversos locais da Internet, dois terços delas manifestando-se contra a performance.
	Criticado, o Museu publicou nota afirmando que a sala estava devidamente sinalizada sobre o teor da apresentação, incluindo a nudez artística, segundo o procedimento adotado pela instituição de informar os visitantes quanto a temas sensíveis. Salientou, ainda, que o trabalho apresentado na ocasião não tem conteúdo erótico e que a criança estava acompanhada por sua mãe.
	Após esse breve relato, vale indagar: os direitos da criança terão sido de fato assegurados?
	O direito ao respeito, diz o Estatuto, consiste na inviolabilidade física, psíquica e moral da criança e do adolescente, abrangendo a preservação, entre outros, dos seus valores, ideias e crenças.
	Mais uma vez, é de perguntar: presenciar a mostra do homem nu em nada atingiu a inviolabilidade psíquica e moral da criança, nem tocou em seus valores, ideias e crenças?
	Nos termos do Estatuto, cultura, diversões e espetáculos são direitos da criança, mas devem respeitar sua condição peculiar de pessoa em desenvolvimento. Terá sido assim?
	O Museu afirma que a sala estava sinalizada sobre o teor da apresentação, mas não sabemos se a sinalização foi insuficiente ou se a mãe preferiu ignorar o aviso. De todo modo, pelo divulgado até agora, parece ter havido alguma falha, tanto que o Ministério Público de São Paulo decidiu investigar a suposta violação do Estatuto da Criança e do Adolescente.
	A par disso, na minha opinião, a indignação espontânea manifestada por grande número de pessoas, nas redes sociais e diante do Museu, não significa censura, como se está alegando. Trata-se do exercício legítimo de um direito, o de protestar contra algo que se julgue errado e até realizar um boicote pacífico, a exemplo do que alguns pretendem fazer.
	Cumprir a lei é sempre necessário; quando envolve menores de idade, é realmente imprescindível. E o Estatuto da Criança e do Adolescente não condiz com a ideia de uma criança de 4 ou 5 anos assistindo a performances de homens nus ou a exposições de quadros que retratam relações sexuais.
	Muito obrigado."
2017-10-18T19:48;"GOVERNO FEDERAL, MICHEL TEMER, PRESIDENTE DA REPÚBLICA, CENTRAIS ELÉTRICAS BRASILEIRAS (ELETROBRAS), PRIVATIZAÇÃO, ANÚNCIO, AVALIAÇÃO POSITIVA.
EMPRESA ESTATAL, CORRUPÇÃO.
DILMA ROUSSEFF, EX-PRESIDENTE DA REPÚBLICA, ATUAÇÃO, SETOR ENERGÉTICO, CRÍTICA.";DISCURSO ENCAMINHADO;"PRONUNCIAMENTO ENCAMINHADO À MESA PARA PUBLICAÇÃO
	O SR. ANTONIO BULHÕES (PRB-SP. Pronunciamento encaminhado pelo orador.) - Sr. Presidente, Sras. e Srs. Deputados, os antigos acreditavam que o câncer era causado pelo acúmulo de bílis negra em um ponto do corpo. Antes de Lavoisier, cria-se que a combustão era produzida por um fluido chamado ""flogístico"". E, até o século XIX, supunha-se que as ondas eletromagnéticas vibravam num ""éter luminífero"".
	Nas ciências naturais, as ideias preconcebidas que não correspondem à realidade vão sendo descartadas, dando lugar à luz do conhecimento verdadeiro. Infelizmente, na política e na economia, isso nem sempre acontece. Paixões e ideologias podem obscurecer o raciocínio e nos manter aferrados a ideias que a realidade já cansou de refutar.
	Quando o Governo Temer anunciou a privatização da ELETROBRAS e, no dia seguinte, de outros 57 ativos da União, incluindo a Casa da Moeda, algumas das reações nas redes sociais deram prova do que estou dizendo. Ouviram-se velhos vitupérios, catilinárias e diatribes contra as privatizações. Sim, ainda há quem as demonize, a despeito de todos os benefícios que elas já trouxeram ao nosso País e a outros.
	Causa alegria, ao menos, constatar que esse discurso convence cada vez menos. Os brasileiros estão mais céticos. São poucos os que defenderiam que as empresas estatais são mais eficientes ou mais éticas que as empresas privadas. Escândalos como os do mensalão e do petrolão, que fizeram uso de dinheiro do Banco do Brasil e da PETROBRAS, mostraram que as estatais vivem em risco de ser transformadas em ferramentas para a corrupção.
	Há poucas chances, então, de que alguém ainda se deixe enganar por manifestações como as da ex-Presidente Dilma Rousseff. Em 22 de agosto, ela tuitou, severa: ""Vender a ELETROBRAS é abrir mão da segurança energética"". É o caso de se perguntar qual era a segurança energética que havia no Governo dela, quando, por meio da Medida Provisória nº 579, de 2012, ela impôs prejuízos bilionários à empresa. O Brasil só não passou por racionamento porque a crise econômica em que seu Governo nos meteu fez diminuir a demanda de eletricidade.
	Ela também fez vaticínio: ""Privatização vai causar aumento de tarifas"". Será mesmo? Em 1998, linhas telefônicas eram privilégio de poucos: o Brasil tinha 24 milhões de linhas telefônicas, para 170 milhões de pessoas. Depois da privatização da TELEBRAS, ter um telefone ficou muito mais barato. Hoje, no Brasil, há mais celulares que gente.
	De todo modo, o papel de cassandra que a ex-Presidente assumiu perde todo o sentido ao se considerar que seu próprio Ministro da Fazenda, Nelson Barbosa, deu entrevista à revista Época afirmando-se favorável à privatização da ELETROBRAS e registrando que já havia um plano de privatização das distribuidoras da empresa no próprio Governo Dilma!
	Outro texto publicado na mesma revista, aliás, sintetizou a questão de forma magistral: ""Os governos no Brasil, nas três esferas, participam de muito mais negócios do que o razoável. Assim, expõem-se a prejuízos, criam brechas para corrupção, inibem a ação privada e deixam de cumprir missões fundamentais, como em educação, saúde e segurança"".
	Eis aí, em quatro pontos, uma lista perfeita dos problemas do Estado empresário: exposição a prejuízos, brechas para a corrupção, inibição da ação privada e perda de foco naquilo que é realmente função do Estado - educação, saúde, segurança, entre outras coisas. Só por eliminar esses quatro problemas, as privatizações já trazem muitas vantagens, às quais se soma o fato de que a competição vigente no setor privado tende a encolher custos e aumentar a qualidade dos bens e serviços ofertados à população.
	Os preconceitos contra as privatizações merecem figurar ao lado das teorias do flogístico e da atrabílis no museu das ideias já refutadas. A discussão sobre o papel do Estado na economia deve ser orientada pela experiência, sem preconceitos nem favoritismos injustificados.
	Muito obrigado."
2017-10-24T17:02;PL 5850/2016, PROJETO DE LEI ORDINÁRIA, ADOÇÃO(DIREITO CIVIL), PREVALÊNCIA, INTERESSE, CRIANÇA, ADOLESCENTE, CONFLITO, PROCEDIMENTO, AGILIZAÇÃO, AÇÃO JUDICIAL, DESTITUIÇÃO, PODER FAMILIAR, APROVAÇÃO, ELOGIO.;DISCURSO ENCAMINHADO;"PRONUNCIAMENTO ENCAMINHADO À MESA PARA PUBLICAÇÃO

	O SR. ANTONIO BULHÕES (PRB-SP. Pronunciamento encaminhado pelo orador.) - Sr. Presidente, Sras. e Srs. Deputados, acompanhei com muita alegria a aprovação do Projeto de Lei nº 5.850, de 2016, que facilita a adoção de crianças e adolescentes.
	Felicito o autor da proposta, o Deputado Augusto Coutinho, assim como o Deputado Sóstenes Cavalcante, responsável pelo substitutivo aprovado em plenário no início de setembro.
	Cumprimento, ainda, as Deputadas e os Deputados que votaram pela aprovação do projeto. Essa correta decisão será capaz de mudar o futuro de muitas crianças e adolescentes, assim como a vida de várias famílias, quando o projeto, que aguarda apreciação no Senado Federal, for finalmente transformado em lei. 
	O foco do PL aprovado é alterar o Estatuto da Criança e do Adolescente - ECA para tornar mais céleres os procedimentos relacionados à destituição de poder familiar e à adoção de crianças e adolescentes. É uma alteração de enorme importância, tendo em vista que a passagem do tempo diminui severamente as chances de adoção para as crianças e adolescentes que aguardam nos abrigos. A maioria das famílias prefere crianças pequenas, e, se o Estado demora a resolver os eventuais conflitos judiciais, algumas crianças podem acabar sendo preteridas.
	O substitutivo aprovado disciplina ainda diversos aspectos do processo de adoção, como os relacionados aos prazos do estágio de convivência e à adoção por estrangeiros.
	Além disso, estende para os adotantes direitos indispensáveis para garantir os cuidados iniciais com crianças e adolescentes, entre eles, a estabilidade temporária no emprego para quem obtiver guarda provisória de criança ou adolescente e a licença-maternidade para adotante de adolescente. Com a aprovação da lei, as mães adotantes de bebês passarão a ter direito a dois descansos especiais por dia, durante a jornada de trabalho, até que o filho complete 6 meses de idade.
	Trata-se, senhoras e senhores, de mudanças há tempos desejadas por milhares de pessoas que aguardam para adotar e, especialmente, pelas crianças e adolescentes que esperam por uma família. 
	Felizmente, a Câmara dos Deputados pôde oferecer a resposta que a sociedade pediu, em uma demonstração de união e de grandeza que muito nos orgulha.
	Como já afirmei anteriormente, tenho o privilégio de ter uma filha adotiva. E foi em homenagem a ela, Paloma Bulhões, que votei pela aprovação do projeto. 
	Agora, em homenagem a todas as novas famílias que ainda serão formadas pela adoção no Brasil, incito o Senado Federal a repetir o ato desta Casa, aprovando com rapidez o projeto de lei que facilita a adoção de crianças e adolescente, a fim de transformar a vida de muitos brasileiros.
	Muito obrigado."
2017-10-25T16:50;PARECER CONTRÁRIO, COMISSÃO DE CONSTITUIÇÃO E JUSTIÇA E DE CIDADANIA (CCJC), SIP 2/2017, SOLICITAÇÃO PARA INSTAURAÇÃO DE PROCESSO, AUTORIZAÇÃO, INVESTIGAÇÃO, SUPREMO TRIBUNAL FEDERAL (STF), DENÚNCIA, MINISTÉRIO PÚBLICO FEDERAL (MPF), MICHEL TEMER, PRESIDENTE DA REPÚBLICA, ELISEU LEMOS PADILHA, WELLINGTON MOREIRA FRANCO, MINISTRO DE ESTADO, VOTO FAVORÁVEL.;REGISTRO DE VOTO;"O SR. ANTONIO BULHÕES (PRB-SP.) - Sr. Presidente, eu voto a favor do relatório e contra a reforma da Previdência.
	O SR. GIACOBO - Deputado Antonio Bulhões: voto ""sim"". Total: 103 votos."
2017-10-31T13:48;IDENTIDADE DE GÊNERO, TEMA, ANTONIO BULHÕES, DEPUTADO FEDERAL, AUTORIA, PRONUNCIAMENTO PARLAMENTAR.;DISCURSO ENCAMINHADO;"PRONUNCIAMENTO ENCAMINHADO À MESA PARA PUBLICAÇÃO
	O SR. ANTONIO BULHÕES (PRB-SP. Pronunciamento encaminhado pelo orador.) - Sr. Presidente, Sras. e Srs. Deputados, a imprensa vai pautando um assunto como se fosse uma novidade pronta para o consumo de todos. O interessante do enfoque apresentado pelos jornalistas começa pela doutrinação de que a alteração da identidade de gênero é algo natural, chegando a quase criminalizar quem não concorda com a tese.
	Eles começam ensinando serem os transgêneros uma parte da realidade brasileira, porque são 0,5% da população; e terminam, aplaudindo a condenação pela Justiça de um shopping center por não permitir a um transgênero usar o banheiro feminino.
	A contradição da ideologia dos bem-pensantes é não perceberem que ideias têm consequências. Nos últimos dias, vimos a mesma imprensa criticando a própria Justiça, por não ter aplicado pena ao homem que ejaculou em uma passageira num ônibus. Queriam que o maníaco fosse condenado por estupro, mesmo que a norma jurídica não indicasse essa maneira.
	O erro dos bem-pensantes é não ver a própria ideologia como também uma premissa lógica. Se é legal e bacana um transgênero frequentar um ambiente exclusivo feminino, qual proteção a Justiça daria às mulheres, para preveni-las de encontrar um maníaco fantasiado de mulher no banheiro? Se no episódio do ônibus o louco teve a coragem de ejacular em público, por que não o faria em um ambiente restrito?
	Mandamos a indenização para a Justiça? Um dos argumentos da sentença que condenou o shopping center moralmente dizia que destratar uma pessoa por ser transexual - destratá-la por uma condição inata - é a mesma coisa que a discriminação de alguém por ser negro, judeu, etc.
	Uma mulher prudente teria segurança para frequentar um banheiro público, porque um juiz disse que a condição do transgênero é inata? Como ter certeza, na prática, se um indivíduo vestido como mulher num banheiro feminino não é um maníaco que se aproveita dessa sentença? A mulher prudente deve ceder a sua segurança para não ser chamada pela imprensa e pela Justiça de preconceituosa?
	A Justiça deve manifestar-se para garantir segurança ou para educar a sociedade com visões ideológicas? O argumento duvidoso divulgado pela imprensa, a respeito da condenação do shopping, é o fato de a sentença ter decretado que a situação da pessoa transgênero é inata.
	É surpreendente isso, porque a ciência ainda não confirmou se a disforia de gênero vem do nascimento. Como ainda não há confirmação científica, dizer que é inata é decretar pela retórica jurídica uma verdade ideológica, com ainda a semântica de superioridade moral.
	A ideologia dos bem-pensantes não traz apenas insegurança jurídica e real, é capaz de provocar injustiças também. Imaginemos um concurso para cargos, cujas regras exigem teste de aptidão física. Será justo um transgênero disputar uma vaga entre mulheres, quando a sua compleição física, além da aparência, é de homem? Ou se deve impor ao transgênero os mesmos parâmetros exigidos ao homem?
	Por exemplo, a comissão do concurso poderá ser acusada de preconceito contra os transgêneros por inclui-los entre os homens ou de parcialidade, se elaborar regras que privilegiam uma categoria de pessoas, ao incluí-los entre as mulheres.
	Como resolver esse problema se a lógica da Justiça diz que se deve tratar igualmente os iguais e desigualmente os desiguais na medida em que eles se desigualam. Em um teste de aptidão física, o transgênero será avaliado segundo a natureza do corpo físico de nascimento ou como decreta a Justiça? É o paradoxo da ideologia.
	Se concurso determinar ao transgênero competir entre os homens, poderá ocorrer a anulação, porque enfrentará acusações de discriminar alguém em função da sua condição. Se estipular que deve competir entre as mulheres, provocará uma injustiça, porque os hormônios masculinos existentes no corpo do transgênero proporcionam mais força.
	Com todos esses paradoxos, cabe uma pergunta: o que é a justiça? Com a velocidade pela qual a ideologia hoje acusa o bom senso de atrasado, chegará um momento em que não teremos mais a noção do que é certo. A modernidade do relativismo ideológico será a total insegurança.
	Muito obrigado."
2017-11-07T17:58;ANALFABETISMO, TEMA, ANTONIO BULHÕES, DEPUTADO FEDERAL, AUTORIA, PRONUNCIAMENTO PARLAMENTAR.;DISCURSO ENCAMINHADO;"PRONUNCIAMENTO ENCAMINHADO À MESA PARA PUBLICAÇÃO
	O SR. ANTONIO BULHÕES (PRB-SP. Pronunciamento encaminhado pelo orador.) - Sr. Presidente, Sras. e Srs. Deputados, as pesquisas nacionais realizadas no País sobre indicadores sociais explicitam, de forma muito clara, as nossas agudas disparidades regionais. Estudo recente da Fundação ABRINQ, baseado em números da Pesquisa Nacional por Amostra de Domicílios - PNAD, de 2015, revelou que o maior número de brasileiros analfabetos está nas Regiões Norte e Nordeste.
	A média nacional da taxa de analfabetismo de crianças e jovens brasileiros entre 5 e 17 anos é de 11,4%. Na Região Norte, no entanto, esse índice é bem superior, de 15,6%; no Nordeste, é de 13,9%. O mesmo acontece com a taxa de analfabetismo dos brasileiros acima de 15 anos: no Nordeste é de 16,2%, no Norte é de 9,1%, enquanto a média nacional não ultrapassa os 8%.
	Isso é motivo de grande desalento para nós, pois esse e outros números regionais da educação brasileira podem impedir que o País alcance as metas assumidas em 2015 nos Objetivos de Desenvolvimento Sustentável - ODS da Organização das Nações Unidas - ONU, firmados até 2030. Os objetivos traçados em 2014 no Plano Nacional de Educação - PNE, entre os quais está a erradicação do analfabetismo absoluto no Brasil até 2024, também serão dificilmente alcançados em razão dessas discrepâncias regionais.
	O indicador de analfabetismo entre a população maior de 15 anos aponta para o tamanho da nossa população adulta analfabeta, ou seja, aqueles que não foram alfabetizados nem enquanto estavam em idade escolar nem posteriormente. Segundo a última PNAD, 13 milhões de brasileiros se autodeclararam analfabetos em 2015.
	O mais grave e o que nos deixa mais consternados é saber que grande parcela dos que se declaram alfabetizados são, na verdade, analfabetos funcionais, ou seja, não dominam as habilidades básicas necessárias para interpretar o mundo à sua volta de maneira crítica e desenvolver, assim, a consciência de cidadania.
	Afinal, todos nós temos a percepção de que, entre escrever o próprio nome e interpretar textos minimamente complexos, existe um verdadeiro abismo. E, quando é feito algum estudo sobre o analfabetismo funcional no País, os números são estarrecedores.
	Recentemente foi produzido um levantamento deste tipo pela ONG Ação Educativa e pelo Instituto Paulo Montenegro. O estudo apontou que, no Brasil, 92% da população entre 15 e 64 anos não é proficiente em escrita, leitura e nas habilidades matemáticas. E não temos a menor dúvida de que a maior concentração desta parcela da população está nas Regiões Norte e Nordeste.
	A conclusão é muito triste, mas é preciso enunciá-la claramente: somos um país de analfabetos. Ter a plena consciência disso, ter a coragem de olhar para estes números e enxergar a realidade, é o primeiro passo para alterá-la.
	São muitas as consequências de tal estado de coisas. No plano individual, o analfabetismo representa a condenação a uma vida de sérias limitações, sem a possibilidade de usufruto dos bens culturais e com muitas restrições à expressão da subjetividade, seja escrita, seja oral.
	No plano social, isso impõe ao País graves ônus em termos de competitividade econômica, uma vez que, no mundo globalizado, cada trabalhador compete com outros trabalhadores do mundo inteiro. Assim sendo, vai nos restar, cada vez mais, o papel de mero exportador de commodities, uma vez que, quanto mais sofisticadas as atividades produtivas, mais são necessários trabalhadores bem educados para realizá-las.
	Sr. Presidente, nobres colegas, espero que este diagnóstico não seja motivo de desesperança para nós, mas, ao contrário, seja estímulo para que busquemos maneiras eficazes de melhorar a educação ofertada à nossa população, emancipando a legião de brasileiros que ainda se encontram privados desta competência essencial à vida em sociedade, que é saber ler, escrever e interpretar o mundo em que vivem.
	Nós legisladores temos uma enorme responsabilidade neste sentido.
	Obrigado."
2017-11-21T16:46;BEBIDA ENERGÉTICA, AUMENTO, CONSUMO, JOVEM, APREENSÃO.;DISCURSO ENCAMINHADO;"PRONUNCIAMENTO ENCAMINHADO À MESA PARA PUBLICAÇÃO
	O SR. ANTONIO BULHÕES (PRB-SP. Pronunciamento encaminhado pelo orador.) - Sr. Presidente, Sras. e Srs. Deputados, a preocupação que me faz ocupar a tribuna no dia de hoje é o uso indiscriminado de energéticos pelos jovens, que procuram o efeito estimulante principalmente durante eventos como festas ou shows.
	O consumo crescente entre os jovens levou a comunidade científica a buscar formas de avaliar a segurança de sua ingestão. 
	Extensa revisão de literatura, apoiada pela Organização Mundial da Saúde, aponta a necessidade de maior regulamentação das bebidas energéticas e seus ingredientes e a realização de estudos mais aprofundados para embasar as recomendações de segurança para os consumidores. 
	As bebidas energéticas são de introdução recente no mercado e procuradas em virtude de seu poder estimulante, que aumenta os níveis de energia e disposição e proporciona melhor desempenho. A cafeína é o componente de destaque.
	No mundo, estão sendo relatados números crescentes de efeitos adversos em virtude da ingestão exagerada de cafeína, como taquicardia, arritmias, convulsões, psicose, hipertensão arterial, náuseas e vômitos. Em gestantes, pode levar a parto prematuro ou abortamento.
	É contraindicado o uso para aumentar a performance em atividade física ou para atletas. Tem sido apontado que a combinação de energético com esforço físico intenso pode provocar vasoconstrição coronariana e isquemia do miocárdio.
	No entanto, o maior risco é a ingestão concomitante de energéticos com bebida alcoólica. O energético evita o surgimento de sinais de embriaguez como depressão, incoordenação motora e embotamento, o que prejudica que a pessoa julgue seu próprio estado. Assim, ela continua a ingerir álcool por muito mais tempo e em maior quantidade.
	Nessa circunstância, é claro que se tornam mais graves as consequências da intoxicação alcoólica e dos comportamentos de risco. Tem sido aventada até a possibilidade de a combinação acentuar o desenvolvimento de ideações ou atos suicidas.
	A Agência Nacional de Vigilância Sanitária disciplina, no que conceitua como bebida energética ou energy drink, as quantidades máximas permitidas de cafeína, taurina, inositol e glucoronolactona. À composição podem ser adicionadas vitaminas ou sais minerais, e ainda guaraná, ginseng ou açaí. 
	As normas brasileiras determinam a aposição de advertência a respeito do risco de ingestão por crianças, mulheres grávidas, nutrizes e portadores de enfermidades. A recomendação de não misturar energéticos e bebida alcoólica também deve ser enfatizada no rótulo.
	Muitas vezes surge o argumento de que a quantidade de cafeína em energéticos pode corresponder à de uma xícara de café. Entretanto, a ingestão da bebida quente é mais lenta, ao passo que o líquido frio introduz rapidamente uma quantidade grande no organismo. Outro ponto é que o teor de cafeína pode variar amplamente entre as diferentes marcas de energéticos. Pior, existem produtos clandestinos e é frequente ocorrer a ingestão de várias unidades em pouco tempo.
	Assim, vemos que é preciso precaução para que o consumo não traga risco. É indispensável definir limites seguros para o uso do produto e se proceder à ampla conscientização dos consumidores. Desse modo, teremos a tranquilidade de saber que nossos jovens poderão usufruir do produto de forma responsável, pois estarão apoiados por normas e iniciativas de um país cujo maior objetivo é lhes garantir efetiva proteção.
	Era o que tinha a dizer.
Muito obrigado, Sr. Presidente."
