dataHoraInicio;keywords;tipoDiscurso;transcricao
2015-11-24T17:54;REPORTAGEM, REVISTA, ÉPOCA, RISCOS (SEGURANÇA), CRIANÇA, ADOLESCENTE, INTERAÇÃO DIGITAL, REDE SOCIAL, APREENSÃO, LEI CAROLINA DIECKMANN, APLICAÇÃO, DIFICULDADE, COMISSÃO PARLAMENTAR DE INQUÉRITO (CPI), INVESTIGAÇÃO, CRIME CIBERNÉTICO, CRIAÇÃO, RELATORIA, CRIME, CONTRA, CRIANÇA, ADOLESCENTE, RELEVÂNCIA.;DISCURSO ENCAMINHADO;"PRONUNCIAMENTO ENCAMINHADO À MESA PARA PUBLICAÇÃO
	O SR. ANTONIO BULHÕES (Bloco/PRB-SP. Pronunciamento encaminhado pelo orador.) - Sr. Presidente, Sras. e Srs. Deputados, Rede Social Não É Lugar para Criança é o título da matéria publicada pela revista Época na edição de 26 de outubro último, a qual chama a atenção porque sabemos dos efeitos deletérios do uso de serviços como Facebook e WhatsApp no comportamento e na formação de nossas crianças e adolescentes.
	Pesquisas mostram o seu poder avassalador, para o bem e para o mal, tendo em vista o volume de acessos e a forma como o hábito está disseminado. Dados recentes revelam que mais de 60% do público infanto-juvenil no País, com idade de 7 a 12 anos, utilizam esses serviços.
	Dentro desse universo, crescem de forma quase incontrolável todas as modalidades de violência.
	Infelizmente, faltam dados precisos sobre o chamado assédio digital, seja porque a metodologia de coleta e análise é ainda precária, seja, principalmente, porque os responsáveis não costumam denunciar com medo de expor a vítima e prolongar o episódio, à custa de sofrimento e relembranças repetitivas.
	Os traumas advindos de determinados episódios, revestidos de verdadeira crueldade, são, muitas vezes, de difícil superação. As vítimas são manipuladas e não sabem como se defender. Seus algozes se valem dessa fragilidade. 
	Trata-se de fenômeno global, sem dúvida, mas, no Brasil, os criminosos amparam-se na falsa ideia de que a Internet é uma terra sem lei, e as redes são o meio propício para a disseminação de mensagens de cunho agressivo, sexual ou homofóbico.
	Não é bem assim. Apelidada de Lei Carolina Dieckmann, a Lei dos Crimes Cibernéticos - Lei n.º 12.737, de 30 de novembro de 2012 - tipifica como crimes infrações relacionadas ao meio eletrônico, como invadir computadores, violar dados de usuários ou derrubar sites. 
	O crime, no entanto, tem o condão de evoluir e se aperfeiçoar. A Central Nacional de Denúncias de Crimes Cibernéticos, só entre os anos de 2013 e 2014, apontou um crescimento de 192,93% em delitos graves, englobados na espécie prejuízos financeiros e tráfico de pessoas. 
	Para que o Legislativo possa continuar defendendo a sociedade dessas investidas, foi criada nesta Casa, em julho deste ano, a Comissão Parlamentar de Inquérito de Crimes Cibernéticos. As investigações tinham por alvo, inicialmente, os desvios de milhões de reais de correntistas bancários, para, segundo se suspeita, financiar armas e drogas. 
	Em princípio, portanto, não se contemplavam casos como molestamento sexual, mas, com o andamento dos trabalhos, o escopo foi ampliado. Em boa hora, criou-se a Sub-Relatoria de Crimes contra a Criança e o Adolescente, que vai tratar, certamente com o zelo que o tema merece, de casos como o relatado na mesma matéria da Época.
	Resumidamente, o que ocorreu foi que, em determinado programa de televisão, voltado para certame culinário, do qual participavam crianças entre 9 e 13 anos, uma menina de apenas 12 anos foi vítima de assédio explícito pelo Twitter. Meninos também foram alvo de violência, sobretudo com ataques de homofobia.
	A repercussão - não poderia ser de outra forma - foi de horror e repúdio pela emissora, pela mídia em geral e pela opinião pública. Mas nada impede que o fato se repita, a não ser que se passe a contar com a mão pesada da lei. Nesse sentido, a missão dos nobres colegas que integram a Comissão Parlamentar de Inquérito de Crimes Cibernéticos é por demais importante. 
	O apelo que aqui faço é no sentido de que tenham todos em mente a necessidade não apenas de aprofundar as investigações, mas de propor medidas legislativas duras e eficazes. Por outro lado, será igualmente tarefa da CPI buscar meios de implantar uma nova cultura, expondo menos e vigiando mais nossas crianças, restringindo o acesso, estabelecendo limites.
	Que episódios vergonhosos como o ocorrido possam ser evitados e, quando não evitados, que tenham sempre o nosso repúdio e recebam punição exemplar!
	Muito obrigado!"
2015-12-02T20:22;MEDICAMENTO DE USO CONTÍNUO, NARIZ, SISTEMA RESPIRATÓRIO, UTILIZAÇÃO, ABUSO, APREENSÃO.;DISCURSO ENCAMINHADO;"PRONUNCIAMENTO ENCAMINHADO À MESA PARA PUBLICAÇÃO
	O SR. ANTONIO BULHÕES (Bloco/PRB-SP. Pronunciamento encaminhado pelo orador.) - Sr. Presidente, Sras. e Srs. Deputados, muitos de nossos familiares ou conhecidos, ou nós mesmos, temos o hábito de usar descongestionantes nasais, aquelas gotas que desentopem as narinas e nos permitem um sono mais tranquilo, estejamos ou não com rinite ou sinusite. 
	Esses medicamentos são vendidos livremente nas farmácias, e acabamos nos esquecendo de que a bula, poucas vezes lida, alerta para o risco de o uso abusivo causar a arritmia, pressão alta e até trombose.
	A má alimentação e o estresse tornam nosso corpo menos resistente à poeira, ao pólen e à fumaça; esses elementos presentes no ar irritam a mucosa nasal, que reage inchando seus vasos sanguíneos e impedindo a boa respiração. 
	O efeito descongestionante dos medicamentos é obtido pela contração desses vasos nasais, mas o uso abusivo pode fazer com que as substâncias que miravam apenas o nariz entrem na corrente sanguínea, afetando a saúde de todo o sistema circulatório. 
	Quando o ar está mais frio ou mais seco, as impurezas do ar incomodam mais, e muitos usam esses medicamentos de forma irresponsável, inclusive em crianças. Mascarar os sintomas de qualquer doença, sem curar suas causas, leva ao descuido com a saúde, e à necessidade de doses cada vez maiores de remédios que, como os descongestionantes, aliviam apenas os sintomas. 
	O comodismo viciante dessas gotas nasais representa um enorme perigo para a formação de coágulos e consequentes danos à saúde de todo o corpo, pois a congestão nasal será trocada, mais cedo ou mais tarde, por uma congestão em qualquer veia ou artéria, inclusive as do cérebro. 
	O correto seria buscar ajuda médica para descobrir e tratar a causa do entupimento das narinas, que pode ser sinusite, desvio de septo ou pólipo nasal, entre outras. Sabemos, porém, que o Sistema Único de Saúde é de acesso difícil ou ineficaz. Para os casos mais leves, que são maioria, lavar as narinas com soro fisiológico ou água com sal e bicarbonato é alternativa para aliviar a congestão nasal sem causar congestões muito mais perigosas, no sistema circulatório. 
	Senhoras e senhores, também nesse caso de saúde pública a informação e a escolarização podem ser aliadas mais eficazes do que o tratamento médico ou farmacológico. Muitas das alergias, inclusive as que causam as rinites e sinusites, são causadas por hábitos inadequados de saúde, como o fumo ou o consumo de alimentos inadequados para determinadas pessoas. 
	É importante disseminar nas escolas a informação de que alimentos corriqueiros, como o leite, o açúcar, o trigo ou a margarina, entre outros, predispõem o organismo de muitas pessoas a reações alérgicas. Eliminar essas fontes de alergia pode significar, em muitos casos, eliminar incômodos digestivos e respiratórios pela raiz.
	Combater os sintomas é combater uma reação de defesa do organismo, mascarando as reais causas do incômodo. Soluções simples, como descongestionantes nasais, podem ser usadas eventualmente; mas não podemos nos iludir, pensando que esses e em outros remédios que tratam apenas dos sintomas estejam nos trazendo mais saúde. 
	Na maioria das vezes, ocorre o contrário: ao eliminarmos os sintomas que poderiam servir para nos direcionar para uma vida mais saudável, optamos pela progressiva deterioração de nossa saúde e por doenças cada vez mais graves. 
	Muito obrigado."
2016-02-03T17:36;BRASIL, EDUCAÇÃO, PLANO NACIONAL DE EDUCAÇÃO (PNE), FAMÍLIA, SEXUALIDADE, TEMA, ANTONIO BULHÕES, DEPUTADO FEDERAL, PRONUNCIAMENTO PARLAMENTAR.;DISCURSO ENCAMINHADO;"PRONUNCIAMENTO ENCAMINHADO À MESA PARA PUBLICAÇÃO
	O SR. ANTONIO BULHÕES (Bloco/PRB-SP. Pronunciamento encaminhado pelo orador.) - Sr. Presidente, Sras. e Srs. Deputados, o conceito mais literal de democracia é ""o governo do povo"". A vida moderna, com tantos compromissos e interesses, não permite que cada um do povo compareça a uma assembleia para deliberar as políticas de interesse da sociedade. Em função disso, a população escolhe os seus representantes para decidirem sobre as políticas públicas que expressam a vontade geral.
	O preço que a população paga para não ser surpreendida por uma decisão tomada solitariamente por um déspota é o tempo que se leva para a medida ser aprovada no Congresso. Alguns temas demoram a ser transformados em lei porque muitos debates ocorrem sem o consenso ser alcançado. Quando a lei é aprovada, vem com legitimidade, porque o povo espera que os Parlamentares decidam em nome dele.
	Nestes tempos de apoteose da militância progressista, surge o burocrata pretensioso, que se considera o interprete do espírito do tempo e resolve decidir sobre o que é melhor para nós. O tecnocrata não foi eleito, apenas detém um conhecimento técnico e ideológico que ousa impor a todos a partir do cargo que ocupa.
	Foi isso que aconteceu com a decisão de distribuir livros sobre sexualidade nas escolas de ensino fundamental. O tecnocrata, pretensioso de sua visão de mundo, não respeitou o Plano Nacional de Educação, aprovado pelo Congresso, que retirou o progressismo sexual das abordagens escolares.
	O perigo que se capta dessa ousadia da burocracia militante não é somente tomar o lugar do legislador para fazer a política pública, o perigo é que o progressista acredita que os valores formados pelo tempo podem ser descartados, mesmo sem conhecer o que substituirá. Além disso, é uma decisão tomada sem passar pelo contraditório. O máximo que se tem é uma conversa entre as pessoas que comungam com as mesmas ideias.
	Vejamos o que os burocratas fanáticos pelo progressismo e pelo multiculturalismo estão impondo às escolas com o objetivo de apagar a percepção lógica de que as pessoas também se diferenciam pelo sexo: agem sem respeito pela educação moral que as famílias dão aos seus filhos, consideram-se melhores educadores morais, e mandam editar livros que induzem os pequenos a experimentarem práticas heterossexuais e homossexuais.
	Nós, os conservadores, desconfiamos quando alguém não se importa de destruir tudo que séculos de moral cristã fez para organizar a nossa sociedade. Ao contrário deles, acreditamos que os valores não se fazem a partir de um escritório, mas sim a partir daqueles que resistiram ao teste do tempo.
	Será que em algum dia da história um professor ousou dizer para uma criança que ela tem direito ao prazer sexual? Ainda que dissesse, ensinaria que existe direito sem responsabilidade?
	Os progressistas acreditam que já conhecem, a priori, as consequências. Entretanto, apenas a imaginação nos traz a dúvida: ao estimular no livros a sexualidade precoce das crianças, os tecnocratas estão ensinando que as crianças podem sair por aí e escolher qualquer pessoa para fazer sexo. Será que esse burocrata, que não foi eleito para fazer as regras, acolheria a criança contaminada ou o filho não planejado que nasceu?
	Essas perguntas não são exageradas. Se fossem, os burocratas não cuidariam da própria proteção: em um dos livrinhos distribuídos aos alunos há uma recomendação às crianças para que guardem o livro fora do alcance dos pais. Ao fazerem isso, eles implicitamente assumiram que avançaram para além de sua autoridade; ao fazerem isso, eles praticamente confessaram a corrupção dos menores.
	Cético como um bom conservador, não acredito que essa orientação serve apenas para a proteção do burocrata progressista, desconfio que isso seja também uma estratégia. Como os ideólogos sabem que a proibição produz uma atitude de desafio nas crianças, ao dizerem para não mostrarem aos pais, esperam que isso possa estimular a prática sexual pelos filhos. A covardia dessa recomendação é que ela fará os pais demorarem a perceber a mudança de comportamento dos filhos.
	A infinita pretensão dos tecnocratas militantes precisa ser vigiada. Sabemos que o Ministério Público interveio para proibir a distribuição dos livros. Conhecendo a insistência dos ideólogos, devemos esperar que em outro momento eles voltem à carga.
	É preciso que as famílias compareçam à escola e perguntem que livros são distribuídos aos filhos, investiguem se os valores ensinados pelos livros ou na escola estão compatíveis com o que a família educa, denunciem quando algum professor pretender desviar o comportamento do seu filho.
	Muito obrigado."
2016-02-04T15:18;OS DEZ MANDAMENTOS, FILME, NOVELA, REDE RECORD, EMISSORA, AVALIAÇÃO POSITIVA.;COMO LÍDER;"O SR. ANTONIO BULHÕES (Bloco/PRB-SP. Como Líder. Sem revisão do orador.) - Sr. Presidente, Sras. e Srs. Deputados, venho a esta tribuna para comemorar, após 1 semana do seu lançamento, o grande sucesso do filme Os Dez Mandamentos. Isso já era esperado. Somente a pré-venda do filme quebrou recordes extraordinários, se comparada com a bilheteria de vários filmes das indústrias cinematográficas brasileira e internacional.
	O sucesso desse filme me leva também a parabenizar todos os que estiveram por detrás da novela exibida pela Rede Record de Televisão, a novela Os Dez Mandamentos. Quero, de forma especial e carinhosa, parabenizar a Diretora de Conteúdo, Cristiane Cardoso, que, num feito histórico, conseguiu condensar os mais de 170 capítulos da novela em um filme de 2 horas. De forma dinâmica e envolvente, o filme passou inúmeras mensagens aos seus espectadores.
	As salas estiveram lotadas. Acreditamos que também nos dias que estão por vir uma grande multidão assistirá ao filme.
	Embora não tenha caráter religioso, o filme Os Dez Mandamentos retrata a saga do povo hebreu. Esse povo, após 400 anos de escravidão - uma geração nascida com os pés na lama, que amassou o barro e o misturou à palha, para fazer os blocos que iriam construir os grandes monumentos faraônicos -, não suportando mais a tirania dos faraós, clamou ao Deus dos seus pais. E Deus prontamente levantou Moisés. E Moisés, com mão forte e o poder de Deus, fez com que o faraó se curvasse, após as dez pragas, e libertasse o povo da tirania egípcia.
	Conforme retrata o filme Os Dez Mandamentos, de forma maravilhosa e espetacular, esse povo passou a pés enxutos na abertura do Mar Vermelho, o mesmo mar onde pereceu o exército do faraó.
	O filme mostra que, 3 meses após a saída do Egito, Deus estabeleceu com seu povo uma aliança, em que Deus requeria do povo tão somente obediência. E o povo disse a Moisés: ""Tudo o que o Senhor mandar, nós faremos"". Deus, então, deu a Moisés as tábuas com os Dez Mandamentos, para que os repassasse ao povo. E assim, há inúmeras fases no filme. As pessoas, com certeza, entram e saem de forma diferente do cinema.
	Por isso, estou aqui nesta tribuna convidando todos os Deputados e Deputadas e seus assessores a assistirem ao filme, principalmente agora, neste feriado de carnaval. Levem sua família. Certamente, algo de extraordinário acontecerá, na esfera espiritual, no interior de cada pessoa.
	Eu, particularmente, que já assisti ao filme várias vezes - assisti não só na estreia, mas outras vezes -, fiquei impactado e gostaria de compartilhar com todos a mensagem que ficou gravada em meu interior. Eu pude constatar que Moisés, que durante 40 anos pensou ser alguém, por ser filho da filha do faraó, um Príncipe do Egito, quando teve que fugir do Egito, durante 40 anos, viu que não era ninguém. Ele se tornou tão somente pastor das cabras do seu sogro Jetro. E quando Deus apareceu para Moisés na sarça ardente, Moisés pôde ver o que Deus é capaz de fazer, durante 40 anos, através de um ninguém.
	Sr. Presidente, minhas amigas Deputadas, meus amigos Deputados, eu quero lhes fazer este convite para que todos assistam ao filme Os Dez Mandamentos já na sua primeira semana. Com certeza, ele há de ser um sucesso absoluto em todo o território brasileiro.
	Muito obrigado."
2016-02-16T18:10;EDUCAÇÃO FINANCEIRA, RELEVÂNCIA, DEFESA.;DISCURSO ENCAMINHADO;"O SR. ANTONIO BULHÕES (Bloco/PRB-SP. Pronunciamento encaminhado pelo orador.) - Sr. Presidente, Sras. e Srs. Deputados,  ""Tudo é vaidade! Que proveito tem o homem, de todo o seu trabalho, que faz debaixo do sol?"" São palavras de Eclesiastes, que, por sua verdade, permanecem eternas. Isto me veio à mente, quando li uma reportagem que indicava que não é só pela crise econômica que as pessoas estão endividadas.
Que proveito pode buscar o homem em um mundo de tantas mercadorias e oportunidade? A matéria destacava uma pesquisa do Serviço de Proteção ao Crédito, que impressiona o nível de irracionalidade das pessoas no mercado. Delas, 25% disseram que extrapolaram o orçamento apenas para impressionar os outros. Quem se torna escravo da vaidade perde o senso da razoabilidade.
Desde Aristóteles que se sabe estar a virtude no meio. A vaidade não seria um vício se as pessoas a usassem como agente para o aperfeiçoamento. Mas como buscar o proveito sem deixar o vício prevalecer? Devemos ter em mente que nem tudo convém.
A vaidade humana não está limitada apenas no aspecto beleza. A natureza humana parece querer completar-se com o elogio da inteligência e do talento. Não é ilegítimo buscar o sucesso. O homem não vai despender esforço e talento para perder. Entretanto, é preciso agir com racionalidade.
A ciência econômica já identificou que a psicologia do homem paga pela mercadoria para levar um produto. Um produto é um conjunto características de utilidade, beleza e prazer que dão valor às mercadorias no mercado.
Isso não é um pecado. Isso é a consequência da diferença entre os homens. Uma pessoa dá mais valor a uma joia, enquanto outra prefere um carro. Como se diz em economia, a pessoa paga por uma mercadoria, mas leva um produto. A pessoa paga por uma joia, mas está levando a satisfação da vaidade.
Deveria o mercado educar as pessoas para controlar a vaidade? O mercado não está vinculado à noção de moral ou de valores. Se assim fosse, não existiria comércio de drogas nem de peles de animais, porque droga é crime e matar animais para tirar a pele é imoral.
Se o mercado livre não pode orientar sobre o limite de cada um, é porque esse conhecimento é inerente a cada pessoa. Cada um sabe o que e quanto pode gastar. O que evita as pessoas de serem tragadas pelo consumismo é uma saudável moral individual. Se ninguém é obrigado a gastar metade do salário em uma roupa ou em festas com os amigos, então somente a moral pessoal pode limitar o desejo de consumir além das posses.
A moral de cada um não surge do nada. Os valores permanentes são formados por um conjunto de mensagens que se recebe, principalmente, da família. Esses valores formados no lar e na comunidade é que contêm a vaidade e a ambição excessiva. É preciso educar os filhos no sentido de que, mesmo quando muito se pode, nem tudo convém.
Esse grande valor é a prudência. O prudente sabe que nada está garantido, que é preciso preservar-se para os momentos de dificuldades, como o que agora o Brasil atravessa. Os pais devem ensinar os filhos, pequenos e adultos, que desequilíbrio financeiro é um problema não só para países com inflação alta. É um problema que afeta qualquer pessoa.
Vivemos um período de crise. É preciso que as famílias atentem para o fato de que o futuro nunca está garantido. O sentido moral de não sabermos a hora de Deus nos chamar é para que sejamos sempre prudentes.
No mundo material é o mesmo princípio. É preciso prudência; é preciso poupar; é preciso consumir com racionalidade, porque nós não estamos garantidos no nosso emprego, nem o nosso salário tem capacidade infinita. Temos que cultivar o limite moral da vida. É preciso cultivar o valor moral da prudência.
Muito obrigado."
2016-02-23T17:18;REVISTA VEJA, REPORTAGEM, QUESTÃO DE GÊNERO, IDENTIDADE DE GÊNERO, DIVERSIDADE SEXUAL, CRÍTICA.;DISCURSO ENCAMINHADO;"PRONUNCIAMENTOS ENCAMINHADOS À MESA PARA PUBLICAÇÃO
	O SR. ANTONIO BULHÕES (Bloco/PRB-SP. Pronunciamento encaminhado pelo orador.) - Sr. Presidente, Sras. e Srs. Deputados, vivemos um mundo em que quase todo dia surge uma novidade. Graças à velocidade da tecnologia, parece que as pessoas já não vivem no tempo presente. Tudo é mudança e expectativa de progresso, a ponto de não se perceberem os valores sociais que nos trouxeram até aqui.
	Os ""antenados"" do mundo moderno vivem a idealização de um tempo como o dos bons filmes de ficção. A diferença é que, quando assistimos a um filme, nós o fazemos por recreação. Já os antenados idealizam a imagem para nos incluir nela.
	Fico a pensar quão profetas eles se acham. Decretam novos comportamentos sociais como se tivessem a chave da porta do futuro que mostra as novidades ainda ocultas para os simples tocadores da vida.
	Não sei se é falta de modéstia ou de cuidadosa análise histórica. Como já disse um filósofo do século XX, não existe nada nos tempos modernos que já não tenha sido pensado pelos gregos antigos.
	Essa foi a primeira ideia que tive quando li a matéria da revista Veja intitulada Amigues para Sempre. Terminei a leitura sentindo que vivia em um mundo que não tem um passado, um mundo formado por uma mente moderna, que apaga o resultado da contínua interação ao longo da história.
	Nesse admirável mundo novo da matéria, que diz não existir mais os dois sexos, descobri a existência de uma geração Z, uma geração moderna, porque é formada por pessoas que não se importam de ter um sexo definido. Também aprendi que a matéria define como binários aqueles que ainda usam o termo ""masculino e feminino"" quando se referem às pessoas. Pelo menos isso me deixou aliviado, porque, se somos binários, temos maior propensão a ser bípedes.
	Fiquei sabendo que, no magnífico novo mundo da geração Z, serão ultrapassadas as desinências de gênero nas palavras, porque a natureza humana não mais precisará ser um sistema binário de homem e mulher. As pessoas da nova geração poderão sentir-se bissexuais, transexuais, homossexuais e até heterossexuais.
	A matéria apresenta o novo futuro pela decisão da direção do Colégio Pedro II, do Rio de Janeiro, de suprimir as desinências de masculino e feminino dos cabeçalhos das provas e substituir as palavras ""aluna"" e ""aluno"" por ""alunx"".
	O surpreendente na matéria é que ela afirma a chegada do novo mundo a partir do conceito de determinismo histórico. Quando ela diz que a novilíngua nas escolas pode não durar, mas o que sinaliza veio para ficar, o que faz é usar o velho e refutado determinismo para induzir a certeza do futuro que chega.
	Às vezes, a certeza é pouco cuidadosa. Como resgatar o determinismo ascético se há exemplos de videntes sociais que perderam a credibilidade quando o futuro idealizado não se provou? É o caso da emenda constitucional que reconhece a união estável. Os videntes da época alarmaram que a emenda iria destruir a instituição do casamento. Entretanto, o que se viu foi que os pedidos de registro de casamento não diminuíram. Em alguns lugares até aumentaram.
	São por esses questionamentos que um pensamento cuidadoso e conservador permanece atual. Os conservadores não acham producente contestar os valores que sobreviveram ao teste do tempo da civilização.
	Depois de ler esse libelo de um pensamento desejoso, surge-nos o ceticismo. Somos céticos a respeito de teses que não põem em dúvida mudanças de comportamento da natureza humana, como se isso fosse simples, como se fosse uma troca de roupa.
	A civilização que chegou até aqui também viu algumas teses pseudocientíficas que alegavam a superioridade de uma raça ou que pregavam a revolução de uma classe serem sepultadas. Elas foram derrotadas por não darem importância à tradição dos séculos.
	Se os brasileiros sensatos já viram todas aquelas ideologias florescer e decair, como podem acreditar que agora não mais haverá diferença sexual entre as pessoas? A partir dessas e outras teses, os conservadores alertam para que se preze a razoabilidade das ideias. Como disse aquele sábio daquela velha Grécia, a virtude está no meio.
	Muito obrigado."
