dataHoraInicio;keywords;tipoDiscurso;transcricao
2016-11-30T16:58;CONTESTAÇÃO, SUGESTÃO, CRIAÇÃO, BANHEIRO PÚBLICO, UTILIZAÇÃO, SIMULTANEIDADE, HOMEM, MULHER.;DISCURSO ENCAMINHADO;"PRONUNCIAMENTO ENCAMINHADO À MESA PARA PUBLICAÇÃO

	O SR. ANTONIO BULHÕES (PRB-SP. Pronunciamento encaminhado pelo orador.) - Sr. Presidente, Sras. e Srs. Deputados, a odisseia percorrida pela nossa civilização até os tempos atuais pode ser vista também como um caminho pelo qual o espaço de convívio entre as pessoas partiu do ambiente protegido pela família para as inter-relações sociais nas cidades.
	Nos tempos antigos, a relação familiar não estava vinculada ao ato do nascimento, mas ao culto aos antepassados que se professava nos lares. Para os antigos, lar não era a casa onde a família vivia, mas o local onde os deuses da família eram adorados. Numa época antes de Cristo, Platão dizia ser o parentesco a comunidade dos mesmos deuses domésticos.
	Expandindo-se as famílias, chegou-se às tribos e finalmente às cidades. Mesmo assim, as tradições formadas não foram abandonadas. A cidade era a associação religiosa e política das famílias e das tribos. A urbe era o lugar de reunião, o domicílio e também o santuário da cidade, como apresentado pela obra A Cidade Antiga, de Fustel de Coulanges.
	Isso nos dá uma ideia de que a noção de privacidade não é sinônimo de isolamento ou de um egoísmo medroso. A lógica da privacidade guarda um sentido de pertencimento religioso, que formaria os costumes da cidade. Existia também, como hoje, vida comum nas cidades, principalmente para discutir os problemas comuns de todos, como são exemplo os debates que ocorriam nas assembleias da Grécia antiga ou de Roma.
	Nem só para debates políticos as pessoas se encontravam nos espaços públicos das cidades romanas. Elas podiam encontrar-se nos locais de alívio. Embora Roma tivesse como trazer água até as cidades, o esgoto era despejado em qualquer lugar. Com a finalidade de tornar o ambiente da cidade mais higiênico, foram construídas latrinas públicas, onde as pessoas resolviam os apertos.
	Esse tipo de serviço público não era gratuito. Era cobrada uma taxa de quem usava a latrina. A resposta do Imperador Vespasiano à contestação moral do seu próprio filho pela cobrança da taxa é um brocado jurídico usado até hoje. O filho do Imperador questionou como era possível cobrar das pessoas pelo uso daquele lugar, quando compareciam em tão constrangedora situação. Vespasiano respondeu: pecunia non olet. Ou seja, dinheiro não tem cheiro.
	Foi a imagem da constrangida reclamação do filho de Vespasiano que me veio à mente quando vejo ser discutida a modernosa ideia de criar banheiros públicos que podem ser usados ao mesmo tempo por homens e mulheres.
	Não entro na ideia de que o homem nasce bom, a sociedade é que o corrompe, como justificativa para o uso comum dos banheiros públicos. Bastaria a ideologia de gênero e a tolerância ser ensinada nas escolas para que a violência se tornasse irrelevante.
	O que me impressiona é que esse ""muderno"" progressismo não é mesmo um progresso, é uma proposta regressista ao tempo da Roma antiga, e reacionária à privacidade que o contínuo progresso da civilização proporcionou às pessoas.
	Assusta-me a falta de bom senso desses ideólogos, que pretendem destruir o pudor das pessoas, formado com a educação que recebem das próprias famílias. Considerando-se que, naquela época de Roma, o Direito ainda tolerava a ideia do olho por olho, dente por dente, será que ainda assistiremos à defesa do linchamento como um meio de legítima defesa quando praticado por vítimas sociais?
	Essa é uma típica política destruidora, que os progressistas insistem em praticar, sem ter ideia do que fariam para não aumentar a insegurança das pessoas. O progressismo está sempre pronto a destruir o bom senso da tradição, formado ao longo do tempo de muitas idas e vindas de ideias.
	Como podem imaginar essa política se as famílias já não têm segurança, quando as filhas voltam sozinhas do trabalho ou escola para casa? Elas têm medo porque sabem que as filhas podem encontrar um delinquente muito mais forte na rua escura sem polícia. Será que o pai ficaria tranquilo se a esposa ou a filha entrassem em um banheiro de cinema ou de um centro comercial?
	Ideologia progressista quase nunca é progresso. Tornar os banheiros públicos de uso comum para homens e mulheres é um regressismo intelectual que o bom senso da mais humilde pessoa imagina ser piada. A pessoa humilde pode não ter estudo, mas sabe por instinto ou pelo bom senso da tradição o que é perigoso nas cidades.
	Muito obrigado."
2016-12-01T12:20;PL 4850/2016, PROJETO DE LEI ORDINÁRIA, INICIATIVA POPULAR, MEDIDA, CONTRA, CORRUPÇÃO, APROVAÇÃO, CAMARA DOS DEPUTADOS, ABUSO DE AUTORIDADE, AVALIAÇÃO.;DISCURSO ENCAMINHADO;"PRONUNCIAMENTO ENCAMINHADO À MESA PARA PUBLICAÇÃO

	O SR. ANTONIO BULHÕES (PRB-SP. Pronunciamento encaminhado pelo orador.) - Sr. Presidente, Sras. e Srs. Deputados, ao retornarmos a comentar sobre as medidas anticorrupção, apresentadas à Câmara dos Deputado pelo povo brasileiro, vale lembrar que nem todas parecem ser positivas para um país formado por cidadãos livres.
	Cidadãos livres não deve ser entendido como um reforço retórico da demagogia política, que estamos acostumados a ouvir e ler pelos jornais. Cidadãos livres tem uma dimensão conceitual que faz enobrecer a nossa sociedade entre as nações. Cidadão é aquela pessoa que não é submissa à vontade do governante; e livre é aquela pessoa que está prevenida do arbítrio dos mais fortes.
	Em um país democrático moderno, o que dá limite ao arbítrio são as leis. Dentre elas, a lei processual é a trilha da confiança de que tudo o que for levado à Justiça do Estado será decidido conforme a virtude. Como já ensinou um sábio antigo, toda a virtude passa pela temperança.
	É com foco na temperança que avalio positivamente a medida que propõe ajustes nas normas que tratam da prescrição do direito de o Estado punir alguém por ter cometido um crime. Prescrição é o encerramento do poder do Estado de punir alguém pelo crime cometido e também o tempo limite que o Estado tem para executar a punição do condenado, caso ele tenha fugido antes de ser preso.
	A virtude da temperança no ajuste proposto da nova norma processual está em corrigir o momento em que o tempo da prescrição da punição começa a contar.
	O tempo da prescrição da norma penal não se descobre com uma equação. É muito mais uma ponderação filosófica. Deverá ser ponderado o limite do poder do Estado para reprimir e o limite do indivíduo em exercer o direito de fazer o que quiser. Se o tempo da prescrição for muito grande, o Estado poderá perseguir o malfeitor indefinidamente. Se for muito curto, o criminoso poderá não cumprir a pena, porque muitos recursos poderão ser apresentados.
	A virtude estaria então no meio, entre um longo e um curto período prescricional. A virtude deve ser o parâmetro dessa medida anticorrupção.
	Embora a medida tenha chegado à Câmara dos Deputados envolta no brilho do combate a corrupção, o alcance dela extrapola as penas dos corruptos. Ela atingirá a execução de todas as sentenças.
	O projeto de lei das medidas anticorrupção propõe que o tempo permitido ao Estado, para levar o condenado até a penitenciária, começa a contar a partir da sentença final. No entendimento em vigor, a prescrição do tempo para encarcerar o condenado à prisão começa a contar a partir do início do processo.
	A virtude para alterar o entendimento em vigor se fundamenta pelo conhecimento da vida prática. Em geral, os criminosos do colarinho branco têm dinheiro disponível. Como podem contratar bons advogados, que usam todas suas habilidades técnicas, eles conseguem atrasar o trâmite do processo. Quando o processo chega ao fim, a Justiça já perdeu o poder de levar encarcerado o criminoso condenado. Isso é uma boa indicação do porquê a população acredita que a Justiça não pune os ricos.
	Tornando explícita a regra de que a prescrição começará a contar a partir da sentença condenatória, e não do início do processo, os recursos protelatórios perderão a eficácia. Não há aumento do tempo prescricional que sugira um Estado perseguidor. O que se modifica com a medida é o momento de início para contar o prazo da prescrição. O projeto propõe começar a partir da condenação final.
	Contra essa medida muitas vozes podem vir a levantar-se. Argumentariam que as prisões já estão abarrotadas e que o Brasil tem a quinta população carcerária do mundo, mas o Legislativo prossegue com a sanha condenatória no País.
	O fato real e sofrido é nós sermos conhecidos como o país da impunidade e como o país com níveis recordes de homicídios.
	Se temos riquezas para, em breve, sermos elevados à condição de país rico, precisamos de medidas que nos proporcione ingressar também no clube dos países civilizados. Países civilizados não permitem que criminosos caminhem pela rua.
	Os países civilizados, anteriormente, prenderam os criminosos do dinheiro público para hoje terem uma ética social que separa o público do privado e que também permite que os cidadãos andem com segurança pelas ruas das cidades.
	Muito obrigado."
2016-12-06T17:48;LEI DE COTAS, AVALIAÇÃO NEGATIVA, INVESTIMENTO EM EDUCAÇÃO, ENSINO DE PRIMEIRO GRAU, ENSINO DE SEGUNDO GRAU, DEFESA.;DISCURSO ENCAMINHADO;"PRONUNCIAMENTO ENCAMINHADO À MESA PARA PUBLICAÇÃO

	O SR. ANTONIO BULHÕES (PRB-SP. Pronunciamento encaminhado pelo orador.) - Sr. Presidente, Sras. e Srs. Deputados, enfatizo minha posição totalmente contrária às cotas raciais e de gênero. Nossa Constituição, em seu art. 5º, enuncia o direito de igualdade de todos perante a lei, sem distinção de qualquer natureza. 
	É a própria Constituição que veta a discriminação baseada em critérios raciais. Assim como não podemos condenar ninguém pelos crimes de um parente, correligionário, conterrâneo ou seguidor da mesma religião, também não podemos privilegiar ninguém por conta do grupo a que pertence. 
	O interesse público é ter as pessoas mais competentes nas universidades e nos cargos estatais. Se concedermos privilégios a certos grupos, estaremos perpetuando a errônea noção de raça e abrindo a perspectiva para que essa questão crie problemas insolúveis, agravando os conflitos em vez de amenizá-los.
	Nos Estados Unidos, todos nós poderíamos reivindicar nossa condição de ""hispânicos"". Mas os brasileiros não costumam fazer isso naquele país justamente porque tal critério é estranho a nós. Raça é um critério subjetivo, e não combateremos o racismo fortalecendo ideias equivocadas. O sistema de cotas força as pessoas a se classificarem como negras, pardas ou indígenas, criando categorias que são muito menos definidas na vida real. 
	Na vida real, o sistema de cotas para as universidades mostra-se uma experiência fracassada, pontilhada pelas fraudes, pelo populismo e pelo descuido com a solução mais correta, que seria investir nas escolas públicas de primeiro grau. 	Matéria do Fantástico do último dia 16 mostrou que o número de fraudes é tão grande que os próprios estudantes estão se organizando para denunciá-las. 
	Metade das mil vagas oferecidas pela Universidade Federal do Estado do Rio de Janeiro - UNIRIO, por exemplo, são reservadas a cotistas oriundos de escolas públicas, ou que tenham baixa renda, ou que se autoclassifiquem como pardos, pretos ou indígenas. Ora, a maioria dos brasileiros pode se autoqualificar como parda, preta ou indígena. 
	A Lei de Cotas não admite outro critério além da autoqualificação. Por causa disso, cotistas denunciados por estudantes da Universidade Federal da Bahia não foram investigados pelo Ministério Público daquele Estado. 
	Até a renda é falsificada para se obterem facilidades. O Fantástico mostrou a filha dos donos de um hotel em Teresópolis pleiteando a vaga pelo sistema de cotas, alegando ser pobre e apresentando os rendimentos da avó, com que supostamente moraria, como prova de sua pobreza. 
	Numa universidade federal da Bahia, 22 alunos, a metade dos matriculados no curso de Medicina, alegaram ser quilombolas e conseguiram as vagas. Além de não terem a pele negra, eles nunca moraram no quilombo. Mas, graças a declarações dos dirigentes da associação quilombola, conseguiram o privilégio. 
	Em 2013, o Brasil tinha 15 mil alunos cotistas, hoje tem 20 mil. Na prática, quem chega a terminar o segundo grau com chances de frequentar a universidade é, em sua maioria, oriundo das classes médias e altas. Assim, o dinheiro da educação, que deveria ser direcionado principalmente para o ensino básico, acaba financiando a universidade gratuita para integrantes das classes mais abastadas, quer fraudem ou não suas origens negras, pardas, indígenas ou pobres. Como o Brasil é um país mestiço, a cor da pele pode se somar, como um privilégio, ao fato de o candidato à vaga ser da classe alta. 
	Isso ocorre na melhor das hipóteses, pois, na pior das hipóteses, há fraudes. Repito: quando a fraude é denunciada, muitos Ministérios Públicos estaduais dizem que nada podem fazer, pois a lei estabelece como único critério a autodeclaração. A única exceção foi o Ministério Público do Rio Grande do Sul, que estabeleceu a necessidade de comprovação da etnia do candidato. 
	A preocupação que todos devemos ter é de evitar os ""tribunais raciais"" e o estabelecimento de critérios objetivos para definir a ""raça"" dos brasileiros. Esses critérios não existem, são arbitrários. 
	São esses critérios arbitrários que iremos adotar, dividindo a população brasileira em raças? Para mim, isso é um retrocesso. Para acabar com o racismo, o melhor caminho não é a racialização, mas uma escola pública de primeiro e segundo graus de boa qualidade. 
	O Presidente Obama poderia se declarar, como a maioria dos brasileiros, como afrodescendente ou eurodescendente. O pai de Obama era da elite africana, provavelmente descendente de traficantes de escravos. Faria sentido que Obama se valesse das cotas para estudar ou ser eleito Presidente dos Estados Unidos? Lá a discriminação foi muito mais forte do que no Brasil e a miscigenação foi muito menor. 
	No meu entendimento, as cotas são fruto de um entendimento racista e ultrapassado. 
	Abaixo o racismo, e abaixo também as medidas racialistas, como o sistema de cotas, que perpetuam a falsa ideia de que as raças são uma realidade objetiva! Precisamos garantir escolas públicas de primeiro e segundo grau com a mesma qualidade que garantimos às universidades públicas. Só assim conseguiremos a justiça social. 
	Muito obrigado."
2016-12-07T13:32;EDUCAÇÃO, QUESTÃO DE GÊNERO, TEMA, ANTONIO BULHÕES, DEPUTADO FEDERAL, PRONUNCIAMENTO PARLAMENTAR.;DISCURSO ENCAMINHADO;"PRONUNCIAMENTO ENCAMINHADO À MESA PARA PUBLICAÇÃO
	O SR. ANTONIO BULHÕES (PRB-SP. Pronunciamento encaminhado pelo orador.) - Sr. Presidente, Sras. e Srs. Deputados, eu, como a maioria das pessoas do mundo, acho um absurdo fingir ignorar o sexo de uma criança e criá-la sem deixar que os outros, ou a própria criança, assumam uma identidade masculina ou feminina. Mas alguns pais pretendem que as crianças assumam uma identidade neutra. É isso que algumas mães pretendem com o chamado ""nome neutro"", combinado com roupas neutras. 
	O Portal UOL, no dia 17 de outubro, relatou vários casos desse tipo de experiência. Por exemplo, um menino batizado com o nome de ""Mica"", para não ficar claro se ele é homem ou mulher. Os pais preferem ser tratados como ""cuidadores"". Num dia, Mica sai com um vestidinho rosa cheio de babados; no outro, com um bermudão azul.
	A mãe, uma educadora, faz esse tipo de experiência com seu filho na cidade de Campinas. Essa educadora, ela própria, não se identifica como mulher ou como homem, e não se importa de ser tratada no masculino. Quando descobriu a gravidez, resolveu impor suas ideias sobre um gênero neutro à criação de seu filho.
	As dificuldades são óbvias: nem a língua portuguesa tem o gênero neutro, mas apenas o masculino e o feminino. Nem menino, nem menina, Mica será tratado como?
	A educadora Mariana cuida de Mica com o psicólogo Raul. Segundo esse psicólogo, ""Mica"" é um nome que não causará constrangimento futuro, o que é duvidoso. Além disso, nomear uma criança com um termo dúbio e ignorar os códigos de vestimenta segundo o sexo pode até ajudar a criar uma pessoa mais livre dos estereótipos de gênero, mas não garante que a criança vá gostar de usar uma malha de balé num dia e um coturno no outro dia. O que está sendo respeitado aí não é a opção da criança, mas a experiência que os pais estão fazendo com a criança, reduzida à condição de cobaia.
	Mica tem apenas 2 anos. Apenas aos 5 anos as crianças já têm compreensão suficiente para se entenderem como homem ou mulher. Mas não se sabe o tipo de problema que uma criança terá ao se entender como homem e mulher, ou do gênero neutro.
	Ora, ninguém é melhor do que ninguém. Não é necessário criar crianças de gênero neutro para ensinar isso. É preciso ensinar o respeito, por si e pelos outros. Vivemos numa sociedade em que homens e mulheres têm banheiros separados, interesses separados, costumes separados. Por que forçar uma criança de 2 anos a viver o conflito de se impor como neutra para o mundo?
	Outro menino, de 3 anos, tem um nome adequado ao sexo: Bernardo. Felizmente, penso, os pais não o batizaram com um nome estranho. Esses pais são menos radicais, mas deixam Bernardo pintar as unhas da mão com esmalte. Será que Bernardo está sendo informado de que essa atitude causará estranhamento entre os colegas?
	É preciso ter consciência de que crianças, em sua fase de formação, devem ter conhecimento do que é visto como normal. Assim, se o pequeno Bernardo, aos 3 anos de idade, quiser pintar uma unha de cada cor e usar sapatinhos de salto ao ir para a escola, saberá que estará sendo exposto ao julgamento e à incompreensão dos demais.
	Segundo o professor e psicólogo Marcelo Moreira Neumann, um dos autores da pesquisa Bullying Homofóbico e Desempenho Escolar, a neutralidade no registro facilitaria de maneira prática a vida de uma pessoa que não se identificasse com o gênero de nascimento. Sim, é verdade. Mas no caso de quem se identifica com o sexo de nascimento, o que supostamente acontece com a maioria, usar vestidinhos rosas e unhas pintadas, quando se é homem, ou falar palavrões e se envolver em brigas de rua, quando se é mulher, será, certamente, motivo de estranhamento e bullying por parte dos colegas.
	Assim como uma minoria desinformada sobre uma PEC não tem direito de invadir a escola pública e prejudicar a maioria, acho que falta bom senso quando se expõe uma criança a situações socialmente desconfortáveis, que só serão convenientes se ela for candidata à transexualidade. Mas como definir isso, no caso de crianças de 2 ou 3 anos?
	De fato, Mica, caso se torne um transexual ou homossexual na vida adulta, passará menos constrangimentos com seu nome do que se fosse batizado como João. Mas Mica, quando se tornar adulto, e se for um heterossexual, gostará de ver suas fotos de infância com vestidinhos cor de rosa, trancinhas e sapatinhos de salto?
	Acho conveniente esses pais não fazerem experiências muito radicais com seus próprios filhos, senhores e senhoras, em nome de ideias exóticas, utópicas, que podem trazer sofrimentos para seus filhos e problemas maiores do que aqueles que supostamente estão resolvendo.
	Obrigado."
2016-12-07T18:00;AUTOMUTILAÇÃO, GRAVIDADE, SAÚDE, JOVEM, ADOLESCENTE.;DISCURSO ENCAMINHADO;"PRONUNCIAMENTO ENCAMINHADO À MESA PARA PUBLICAÇÃO

	O SR. ANTONIO BULHÕES (PRB-SP. Pronunciamento encaminhado pelo orador.) - Sr. Presidente, Sras. e Srs. Deputados, é impressionante a estimativa, feita por especialistas, de que 20% dos jovens praticam automutilação. Isso configura um grave problema de saúde pública que precisa ser considerado atentamente pelas autoridades do setor, pela sociedade e, em especial, pelas famílias com filhos adolescentes.
	Na edição de 20 de novembro passado, o programa Fantástico, da Rede Globo, abordou com propriedade esse assunto, entrevistou profissionais de saúde, ouviu depoimentos de jovens com história de automutilação e visitou ambulatórios de tratamento.
	O Brasil não tem estatísticas oficiais a esse respeito, mas, como informado na reportagem, os estudos feitos em diversos países coincidem na avaliação de que o problema afeta cerca de um quinto dos jovens, o que provavelmente ocorre também aqui.
	A mais recente classificação internacional de doenças mentais, divulgada em 2013, aponta a automutilação como autolesão não suicida, ou seja, quem se mutila não tem a intenção de acabar com a própria vida - na verdade, está tentando, ainda que de forma inadequada, pedir ajuda para resolver suas dificuldades emocionais.
	Em geral, os jovens procuram esconder da família a automutilação, embora às vezes a divulguem a seus grupos nas redes sociais. Em alguns casos, os pais desconfiam porque notam, por exemplo, que mesmo em dias quentes os filhos estão usando roupas de mangas longas para ocultar os braços. O mais comum, porém, é que só tomem conhecimento ao receber um aviso da escola.
	Sabe-se que a automutilação não é um fenômeno novo - há até uma música de Renato Russo, gravada nos anos 90, que trata do assunto. Contudo, parece estar se disseminando, tanto que o Ambulatório de Adolescentes do Hospital das Clínicas de São Paulo já atende mais pacientes com esse problema do que envolvidos com drogas.
	Os especialistas estabelecem um vínculo forte entre a automutilação e o bullying sofrido na escola. Adolescentes emocionalmente mais frágeis são muito sensíveis à reprovação social. Pressionados, perdem a autoestima e podem recorrer à mutilação como uma espécie de pedido de socorro. Se as famílias não percebem, ou percebem mas não os ajudam, a situação só tende a se agravar.
	Tudo isso reforça a necessidade do diálogo doméstico permanente, da boa relação entre pais e filhos e do cuidado constante para que a adolescência, uma fase quase sempre difícil, seja superada sem maiores traumas.
	Precisamos evitar esse sofrimento para os nossos jovens!
	Muito obrigado."
