dataHoraInicio;keywords;tipoDiscurso;transcricao
2015-02-03T19:00;PL 8224/2004, PROJETO DE LEI ORDINÁRIA, ALTERAÇÃO, CLT, AUTORIZAÇÃO, FALTA, SEMESTRE, EMPREGADO, PARTICIPAÇÃO, REUNIÃO, INSTITUIÇÃO DE ENSINO, EDUCAÇÃO BÁSICA, FILHO, CRIANÇA, GUARDA, AUTORIA.;DISCURSO ENCAMINHADO;"PRONUNCIAMENTO ENCAMINHADO À MESA PARA PUBLICAÇÃO

O SR. ANTONIO BULHÕES (PRB-SP - Pronunciamento encaminhado pelo orador.) - Sr. Presidente, Sras. e Srs. Deputados, apresentamos, no dia 10 de dezembro de 2014, o Projeto de Lei que recebeu o nº 8.224, acrescentando inciso ao art. 473 da Consolidação das Leis do Trabalho (CLT) para permitir a falta do empregado ao trabalho 1 dia a cada semestre, quando necessitar comparecer a reuniões na instituição de ensino básico de seus dependentes.
Conforme exposto em nossa justificação ao projeto, é inegável que a participação dos pais na vida escolar dos seus filhos influencia de modo efetivo o processo de desenvolvimento da aprendizagem dos educandos. Ao perceber que pais e família se interessam por seus estudos e por suas experiências escolares, a criança ou adolescente sente-se valorizada, desenvolvendo-se de forma segura e com boa autoestima.
Inúmeras pesquisas nos dão conta de que existe hoje um consenso entre educadores, professores e estudiosos sobre os efeitos da presença dos pais no desempenho dos alunos, pois ela legitima a educação que a escola oferece: quanto mais ativos os pais, maior a chance de o filho tirar boas notas no boletim e terminar uma faculdade.
""Nenhum outro fator tem tanto impacto para o progresso de um aluno quanto a interferência adequada da família. E isso se faz sentir, positivamente, por toda a vida adulta"", diz o economista Naércio Menezes, coordenador do Centro de Políticas Públicas do Instituto de Ensino e Pesquisa (INSPER) e autor de um recente trabalho sobre o assunto no Brasil.
O conjunto de medidas que surtem resultado, uma vez adotadas com persistência em casa, chama atenção pela simplicidade. Apenas incentivar o filho a fazer a lição de casa e a ir à escola todos os dias, providenciar um lugar tranquilo onde ele possa estudar e comparecer às reuniões de pais tem o efeito de elevar as notas em torno de 15%, segundo a pesquisa do INSPER.
Muitas escolas, em especial algumas instituições públicas, têm melhorado o índice de aprendizado de seus alunos quando podem contar com uma maior participação dos pais nas atividades sociais e pedagógicas, pois inúmeros problemas vivenciados pelos alunos e que vão surgindo ao longo de seu percurso escolar podem ser solucionados assim que vêm ao conhecimento dos educadores.
As reuniões pedagógicas proporcionam aos pais, no mínimo, uma chance de sentir o ambiente na escola, saber da experiência dos demais alunos e tomar contato com a visão de outros pais. A ida a esses encontros tem ainda um efeito colateral menos visível, mas já bastante estudado: a presença dos pais é uma demonstração de interesse que contribui para o envolvimento dos filhos com a escola.
Um estudo da Fundação Getúlio Vargas mostra que ""os efeitos da presença dos pais na vida escolar, ainda que mínima, se fazem notar por toda a vida adulta"". Na infância e na adolescência, a participação da família não está associada apenas às notas mais altas, mas também a uma considerável redução nos índices de evasão. Para se ter uma ideia, o risco de que crianças egressas de um ambiente favorável aos estudos abandonem a escola cai, em média, 64%. É uma diferença gritante e decisiva para o sucesso bem mais tarde, no mercado de trabalho. Basta dizer que cada ano a mais na escola faz subir o salário, em média, 15%. O impacto aumenta na medida em que se progride nos estudos. Um ano de pós-graduação, por exemplo, significa um ganho de quase 20% no salário. ""Quanto mais educação, maior será o retorno"", resume o economista Marcelo Neri, autor da pesquisa. ""É razão suficiente para que os pais brasileiros comecem a prestar mais atenção à rotina escolar.""
Porém, caros colegas Parlamentares, essa participação na vida escolar dos filhos é, muitas vezes, impossibilitada porque as reuniões escolares são marcadas no horário de trabalho dos pais, e muitos empregadores são insensíveis quanto à importância de liberarem seus empregados para estarem presentes nessas ocasiões.
Dessa forma, se pretendemos melhorar os nossos índices de aprendizagem e nosso compromisso com um ensino de qualidade, além de reduzir a evasão escolar, devemos, no mínimo, possibilitar uma maior participação dos pais no dia a dia de seus filhos nas escolas.
Foi, portanto, para minimizar os problemas dos pais que querem participar da vida escolar de seus filhos que apresentamos o Projeto de Lei nº 8.224/2014, certos de que a nossa iniciativa, se apoiada pelos nobres colegas, poderá melhorar significativamente o processo de aprendizagem brasileiro.
Muito obrigado!"
2015-02-10T16:56;CRISE, ABASTECIMENTO DE ÁGUA, RECURSOS HÍDRICOS, APREENSÃO.;DISCURSO ENCAMINHADO;"PRONUNCIAMENTO ENCAMINHADO À MESA PARA PUBLICAÇÃO
O SR. ANTONIO BULHÕES (Bloco/PRB-SP. Pronunciamento encaminhado pelo orador.) - Sr. Presidente, Sras. e Srs. Deputados, o ano começa com desafios imensos. O País tem à frente as suas dificuldades crônicas do ponto de vista estrutural, imperativos históricos, que mais uma vez desafiam os orçamentos, a criatividade e a boa gestão. E há também inúmeros problemas de outra ordem e outra etiologia que estão tirando o sono dos brasileiros. Entre eles, a crise hídrica, que não começou nesta estação, mas que no momento toma proporções assustadoras, especialmente no Sudeste. Engenheiros, ambientalistas, meteorologistas, governos e cidadãos estão perplexos.
Tomo o meu Estado por exemplo. São Paulo, Sr. Presidente, é hoje o emblema da perplexidade. Ao longo do último período chuvoso, compreendido entre outubro de 2013 e março de 2014, já se tinham sinais da catástrofe. Segundo dados do Instituto de Astronomia e Geofísica - IAG da Universidade de São Paulo - USP, aquela havia sido a temporada com menos chuvas desde a criação do Sistema Cantareira, em 1973. Mas ninguém imaginou que a atual temporada pudesse ser muito pior. Está sendo.
Agrava, no caso presente, que as chuvas, além de insuficientes, são sobremodo desiguais quanto à distribuição por áreas afetadas. A Região Metropolitana tende a receber mais chuva, em razão da ilha de calor formada pela grande densidade de núcleos urbanos. Aliás, fossem outras as condições da capital, a chuva que tem caído poderia ser aproveitada. Mas a poluição das superfícies causada pelo lixo, assim como a poluição de córregos e rios, muitos dos quais verdadeiros esgotos a céu aberto, inviabilizam qualquer iniciativa nesse sentido.
Enquanto isso, a situação nas áreas dos mananciais é dramática, com precipitações insuficientes. As previsões atestam que o Sistema Cantareira continuará a registrar chuvas abaixo da média pelo menos até abril, de acordo com o Grupo de Trabalho em Previsão Climática Sazonal, do Ministério de Ciência e Tecnologia.
Não chovendo o suficiente em todo o mês de fevereiro no Sudeste e no Centro-Oeste, o impacto sobre o fornecimento de energia será inevitável, porque água e energia são matérias indissociáveis quando se trata da matriz energética brasileira.
Em face disso, há uma pergunta que não quer calar: o Brasil vai parar? Ninguém sabe responder com precisão.
As perspectivas, obviamente, não são boas. A crise hídrica e, na sequência, a crise energética, terão impacto negativo no desempenho da economia em 2015. A mediana das projeções dos economistas ouvidos pelo Banco Central para o Relatório Focus da semana que passou foi de crescimento do Produto Interno Bruto - PIB deste ano de apenas 0,03%, algo bem próximo de zero. Na semana anterior, estava em 0,13%. Para 2016, a projeção também caiu, passou de 1,54% para 1,50%.
Sr. Presidente, não é verdade, em absoluto, que esta seja uma crise ""democrática"", uma vez que coloca todos os cidadãos face a face com as mesmas necessidades. Não! A falta de água vai apenar mais intensamente os mais necessitados, que não terão como absorver a elevação do preço dos alimentos, tampouco da conta de luz. Esses brasileiros passarão a ter dificuldade em dispor do conforto doméstico propiciado por aparelhos e equipamentos a que tiveram acesso nos últimos anos e cujo uso vai sobrecarregar ainda mais o consumo de energia. O custo humano e social da crise será enorme.
O poder público, a sociedade, a ciência e tecnologia precisam se colocar à altura do desafio. A realidade mudou. O clima no mundo mudou.
No Brasil, vergonha maior, a Floresta Amazônica não é mais a mesma do que era há pelo menos quatro, cinco décadas, devastada que tem sido pela cobiça e pela falta de fiscalização. O exército formado por IBAMA, FUNAI e Polícia Federal não consegue reprimir o desmatamento. Árvores que levam mais de cem anos para crescer são torradas e viram carvão da noite para o dia.
Menos árvores no coração da Amazônia, menos bombeamento para a atmosfera de umidade, que vai se transformar em chuva nas regiões Centro-Oeste, Sudeste e Sul do Brasil. Quanto maior o desmatamento, mais seca. Os reservatórios ficam vazios e não sai água das torneiras.
A guerra deve, assim, ser travada com várias armas: no caso do meio ambiente, com o rigor da lei e a punição; além disso, com bons projetos que otimizem os recursos hídricos, com racionalidade, com conscientização da população, que precisa ser efetivamente chamada a dar a sua contribuição. Mas, mais do que contribuir, a sociedade brasileira precisa dar a sua cota de sacrifício. Que seja, no entanto, uma cota também de caráter proativo, buscando soluções definitivas.
O sufoco de agora não pode se repetir.
Muito obrigado."
2015-02-24T17:18;CANCER, PELE, PREVENÇÃO, COMBATE, DEFESA.;DISCURSO ENCAMINHADO;"PRONUNCIAMENTO ENCAMINHADO À MESA PARA PUBLICAÇÃO
O SR. ANTONIO BULHÕES (PRB-SP. Pronunciamento encaminhado pelo orador) - Sr. Presidente, Sras. e Srs. Deputados, encareço o empenho dos órgãos e autoridades competentes na adoção de medidas de prevenção e combate ao câncer, inclusive com o desenvolvimento de campanhas destinadas a ampliar o conhecimento do público acerca da doença. 
Na oportunidade, desejo focalizar, em especial, o câncer de pele e ressaltar a importância das medidas preventivas. Há de se evitar a exposição excessiva aos raios ultravioleta, contando também com o uso constante de filtro solar, chapéus, viseiras e outras formas de proteção.  
O câncer de pele do tipo não melanoma aparece como a modalidade de câncer com maior incidência entre a população brasileira. São três os tipos mais comuns de câncer de pele. Com registro de 70% dos casos, o carcinoma basocelular é o mais frequente. Seu crescimento é lento. Muito raramente se dissemina à distância, mas pode destruir os tecidos a sua volta, atingindo até cartilagens e ossos. Já o carcinoma espinocelular, segundo tipo mais frequente de câncer de pele, tem crescimento mais rápido e pode enviar metástases à distância para gânglios linfáticos e outros órgãos. Por fim, o melanoma, que, embora menos frequente, é o tipo de câncer de pele mais perigoso, sendo fundamental que se efetue o diagnóstico precocemente para que se consiga a cura da doença.   
Além da ênfase às campanhas educativas e da contínua atenção aos fatores de risco, recomenda-se a realização de exames periódicos. Vale notar que o diagnóstico no estágio inicial dos casos de câncer amplia a possibilidade de cura em nove de cada dez casos.
Cabe, nesse sentido, enaltecer e apoiar as instituições da área de saúde dedicadas aos relevantes trabalhos de prevenção, pesquisa e tratamento. Portanto, defende-se a aprovação de proposições que criam entidades e fundos com essa finalidade, como o Fundo Nacional de Combate ao Câncer. A mesma atitude se justifica com relação às proposições que preveem a destinação de mais recursos para a área de saúde.
Devemos, na Câmara dos Deputados, proporcionar, sim, todo o suporte requerido para o melhor desempenho possível dos órgãos e profissionais responsáveis pelas políticas e ações de controle do câncer no Brasil. Para tanto, constituem fatores preponderantes a gestão eficiente, o correto uso dos recursos disponíveis, o planejamento e a avaliação isenta das estratégias adotadas e dos resultados alcançados no controle da doença.
Impõe-se, com efeito, reforçar o alerta não só contra o câncer de pele, mas contra todos os tipos de câncer e seus fatores de risco, bem como promover a prática de hábitos saudáveis e a realização de consultas e exames regulares, entre outras medidas preventivas. 
O elevado número de casos de câncer de pele no Brasil constitui, no entanto, motivo de especial preocupação. Esse tipo de doença, além de representar parcela significativa da demanda por serviços de saúde, responde ainda por grande quantidade de óbitos. 
Reitero, por conseguinte, a necessidade de intensificar as medidas preventivas, como as de proteção para a pele, e também proceder a exames periódicos, bem como estimular a pesquisa científica e garantir as demais condições para a competente atuação dos profissionais da área de saúde. Trata-se, em suma, de priorizar efetivamente a saúde e concorrer, de modo decisivo, para que se preste o atendimento adequado aos pacientes e às respectivas famílias. 
Tudo isso, evidentemente, depende do esforço conjunto e do firme compromisso de contribuir sempre para a desejada melhoria na qualidade dos serviços de saúde e para a crescente difusão das informações pertinentes, úteis e esclarecedoras, de modo a alcançar todo o território nacional e todos os segmentos da população. Urge capacitar, cada vez mais, o País e a sociedade na luta contra essa grave doença, cuja incidência e efeitos podem e devem ser reduzidos. Que se proceda, então, aos devidos cuidados em termos de prevenção, que os casos da doença possam ser diagnosticados com maior antecedência, que sejam obtidos melhores resultados nos tratamentos, para que mais vidas sejam preservadas. 
Pela dignidade do ser humano! Pela valorização da saúde e da vida!
Muito obrigado."
2015-03-03T16:52;"TROTE ESTUDANTIL, VÍTIMA, ESTUDANTE, ADAMANTINA, SÃO PAULO (ESTADO), REPÚDIO, PRÁTICA, VIOLÊNCIA. 
RESPONSABILIDADE, EDUCAÇÃO, COMPARTILHAMENTO, DEMARCAÇÃO, PAI, ESCOLA.";DISCURSO ENCAMINHADO;"PRONUNCIAMENTO ENCAMINHADO À MESA PARA PUBLICAÇÃO
O SR. ANTONIO BULHÕES (Bloco/PRB-SP. Pronunciamento encaminhado pelo orador.) - Sr. Presidente, Sras. e Srs. Deputados, famílias e jovens de todo o Brasil e, em especial, cidadãos do Estado de São Paulo, a quem tenho imenso orgulho de representar aqui nesta Casa, quero falar hoje sobre três assuntos: trote estudantil, educação e instrução.
 O trote estudantil é uma prática funesta que fomenta apavorantes notícias de lesão corporal ou até de morte de estudantes, vítimas desse tipo de violência gratuita.
 Muitas pessoas não sabem, mas um simples trote pode se tornar algo grave para quem o pratica e aterrorizante para quem dele é vítima. As consequências jurídicas desse ato podem levar seu autor a praticar, por dolo ou culpa, diversos crimes previstos no Código Penal, tais como, homicídio, lesão corporal, injúria grave, constrangimento ilegal, ameaça etc. 
 No início deste mês, como sói acontecer a cada começo de semestre, os noticiários registraram a prática de mais trotes violentos, desta vez ocorridos no Município de Adamantina, distante cerca de 500 quilômetros da cidade de São Paulo.
Um estudante de 18 anos corre o risco de perder a visão do olho esquerdo e outra aluna, de 17 anos, teve as pernas queimadas por causa dos trotes violentos ocorridos no interior paulista. 
Segundo consta nos noticiários, um grupo de alunos veteranos obrigou os novatos a organizarem-se em filas e jogou neles um líquido ácido, provocando-lhes diversas queimaduras.
Como pai de família, antes mesmo de falar como Parlamentar, registro aqui meu total repúdio a esta prática atroz que remonta à Idade Média. Trata-se de um ritual de passagem às avessas que se vale de atos de zombaria e de imposição de tarefas a que veteranos sujeitam os novatos nas universidades.
Não há razão para a prática de tais atos, senão a perpetração da violência gratuita e o desrespeito às leis. O indivíduo em multidão parece se comportar de modo covarde o suficiente para fazer coisas inimagináveis de serem feitas caso estivesse sozinho.
Ao analisar essa situação, é possível deduzir que fatos como esses ocorrem porque a sociedade está cometendo erros por não perceber a diferença entre instrução e educação. 
Muitos pais encaminham seus filhos para a escola, acreditando que essa instituição os educará. E é aí que eles se enganam gravemente, pois a missão da escola não é a de educar, mas, sim, a de instruir.
Educação, senhoras e senhores, aprendemos em casa e não podemos delegá-la à escola pela simples razão de que o aluno é transitório, mas o filho é para sempre. A educação de um indivíduo ocupa todo o tempo de sua vida e é resultado de um trabalho árduo, em conjunto com a família, a escola e a sociedade.
Não há razão, portanto, para ficar a cargo somente da escola a tarefa de educar a criança. Essa incumbência pertence à família, cuja obrigação é semear nos filhos os princípios da verdade, do respeito e do caráter. É essa educação, senhoras e senhores, que lança as boas sementes ao solo, que faz crescer a árvore sã, a qual dará, a seu tempo, os bons frutos. E são desses bons frutos de que a sociedade precisa.
O verbo instruir, por seu turno, parece-me parente do verbo construir. Quando se constrói, colocam-se, um a um, os tijolos necessários para a formação do edifício. Assim é que se faz com a instrução de uma criança, colocando-se, um por vez, cada tijolo do conhecimento, dos princípios da ciência, da informação e do saber. Esta, sim, é a tarefa da escola.
Por isso, uma vez entendidas as importantes diferenças entre educar e instruir e, bem assim, a quem incumbe cada uma dessas obrigações, fica claro que a sociedade precisa repensar a forma como cuida de nossas crianças.
E, repensando, é preciso que as famílias tomem para si, verdadeiramente, a tarefa de dar às crianças a educação que constrói o caráter e faz inexistirem atos de barbárie como esses trotes insanos que machucaram gravemente os jovens estudantes de São Paulo. 
Para encerrar, senhoras e senhores, deixo aqui registrada uma reflexão, inspirada na Bíblia Sagrada, que diz que, se ensinarmos a criança no caminho por onde deve andar, até quando for idosa, não se desviará dele.
Muito obrigado."
2015-03-04T19:06;LIBERDADE, CONDIÇÃO, FUNCIONAMENTO, DEMOCRACIA, DEFESA.;DISCURSO ENCAMINHADO;"PRONUNCIAMENTO ENCAMINHADO À MESA PARA PUBLICAÇÃO

O SR. 
	O SR. ANTONIO BULHÕES (Bloco/PRB-SP. Pronunciamento encaminhado pelo orador.) - Sr. Presidente, Sras. e Srs. Deputados,  ""todos os seres humanos nascem livres e iguais em dignidade e direitos"". Tais palavras introduzem o artigo primeiro da Declaração Universal dos Direitos Humanos (DUDH), assinada em 10 de dezembro de 1948.
	Na ocasião, a Assembleia Geral das Nações Unidas reunia o anseio dos povos em torno da proteção universal dos direitos humanos, certamente traumatizados todos pelo horror da Grande Guerra finda em 1945.
	Por meio desta minha referência a tão importante e histórico documento, Sr. Presidente, desejo chamar a atenção de todos para o conceito de liberdade, tão caro a quem quer que se posicione em defesa da vida em sua plenitude.
	Em princípio, ser livre implica fazer aquilo que se deseja, sem amarras, sem justificativas, sem cerceamento. Considerando que o ser humano é de caráter gregário, essa faculdade esbarra no direito de o outro exercer também a liberdade, chegando-se, assim, a denominador comum, abandonada a utopia de não submissão a nenhum limite.
	Nesse contexto, pavimenta-se o caminho para a construção do ambiente democrático, que pressupõe a participação de todos os cidadãos na busca por um regime de governo capaz de, efetivamente, atender aos anseios de todo o grupo social.
	Evidentemente, nobres colegas, são de considerar as peculiaridades dos diversos matizes que integram esse mesmo grupo social, contemplando os direitos das minorias, mas em nada prejudicando a conformação social como um todo, muito menos a contemplação dos direitos individuais.
	Essa é a razão pela qual desejo exaltar a consciência da liberdade que a democracia não apenas proporciona, mas sobretudo alcança.
	Em célebre discurso proferido na Casa dos Comuns, na Inglaterra, em 11 de novembro de 1947, Winston Churchill asseverou que ""a democracia é a pior forma de governo, salvo todas as demais formas que têm sido experimentadas de tempos em tempos"".
	Monstro sagrado da oratória, o estadista inglês reconhecia, de modo atilado, as limitações inerentes ao regime democrático, mas não podia deixar de reconhecer-lhe os méritos - em medida declaradamente muito superior aos defeitos -, em especial, dada a ambiência autoritária que culminara na sangrenta Segunda Guerra, ainda de fresca lembrança naquela ocasião.
	São passadas quase sete décadas desde a fala de Churchill, transcurso de tempo que apenas reforça a importância da democracia como resposta à altura ante a intransigência de regimes autoritários e ditatoriais.
	E a liberdade, a esse tema inerente, também ganha reforço, como alternativa à truculência das formas de governo que tem no cerceamento do cidadão seu modus operandi.
	Sras. e Srs. Deputados, temos o dever de reconhecer a existência de democracias e democracias ao redor do mundo, isto é, com diferentes práticas, o que reflete apenas os diversos níveis de desenvolvimento sociopolíticos, mas que nunca compromete os pilares do exercício do poder soberano pelo povo.
	Estabelece-se, então, o conceito de Estado Democrático de Direito, em que a lei deve ser respeitada por todos, inclusive pelos governantes, de modo a se garantir os direitos fundamentais do cidadão, independentemente da posição social que este ocupe.
	No dizer de Gandhi, ""a intolerância é em si uma forma de violência e um obstáculo ao desenvolvimento do verdadeiro espírito democrático"".
	Dessa ótica - com a qual concordamos -, não há espaço para a intolerância onde reina a liberdade, pois esta pressupõe o respeito ao outro. Semelhantemente, a intolerância também não prospera onde há democracia, pois esse regime pressupõe a cooperação.
	Estar, pois, conscientes de que a liberdade é valor inegociável deve ser nosso norte, não apenas em nossos dias, mas para o futuro das próximas gerações.
	Muito obrigado."
