dataHoraInicio;keywords;tipoDiscurso;transcricao
2015-08-06T12:40;"VIII CONFERÊNCIA MUNICIPAL DE ASSISTÊNCIA SOCIAL, MARACANAÚ (CE), PARTICIPAÇÃO.
PREFEITURA, MARACANAÚ (CE), ADESÃO, SISTEMA ÚNICO DE ASSISTÊNCIA SOCIAL (SUAS), ANIVERSÁRIO.";PELA ORDEM;"O SR. CHICO LOPES (PCdoB-CE. Pela ordem. Sem revisão do orador.) - Sr. Presidente, quero agradecer-lhe mais uma vez a sua bondade. Tive a honra de participar, terça-feira, da abertura da VIII Conferência Municipal de Assistência Social de Maracanaú, estando presentes Firmo Camurça, o Prefeito da cidade, a Secretária Nacional, Ieda Nobre, o Vereador Chico Barbeiro e a Secretária de Assistência Social e Cidadania, Glauciane Oliveira.
	Em 2015 comemoram-se os 10 anos de adesão ao Sistema Único da Assistência Social - SUAS pelo Governo municipal de Maracanaú, por intermédio da Secretaria de Assistência Social, e nestes 10 anos, Sr. Presidente, houve muitos avanços, muitos CRAS e muitos atendimentos.
	Quero pedir a V.Exa. que autorize a publicação do meu pronunciamento nos órgãos de imprensa, principalmente em A Voz do Brasil. 
Fico agradecido, e um bom fim de semana para V.Exa.
	O SR. PRESIDENTE (Carlos Henrique Gaguim) - Muito obrigado.

PRONUNCIAMENTO ENCAMINHADO PELO ORADOR
Sr. Presidente, Sras. e Srs. Deputados, tive a honra de participar da abertura da VIII Conferência Municipal da cidade de Maracanaú. Estavam presentes o Prefeito de Maracanaú, Firmo Camurça, a Secretária Nacional de Assistência Social, Ieda Nobre, o Vereador Chico Barbeiro e a Secretária de Assistência Social e Cidadania, Glauciane Oliveira.
Em 2015 comemoram-se os 10 anos do Sistema Único da Assistência Social - SUAS no Município, e o Governo de Maracanaú, por intermédio da Secretaria de Assistência Social e Cidadania, lança o selo 10 anos do SUAS em Maracanaú. 
Desde 2005 a Secretaria de Assistência Social e Cidadania de Maracanaú - SASC implementa o Sistema Único de Assistência Social, fazendo o caminho de ruptura com o modelo conservador de assistência. Uma rede completa de Proteção Social, reverenciada em 2014 com o Prêmio Objetivos de Desenvolvimento do Milênio - ODM Brasil, da ONU e da Presidência da República, foi implementada nestes 10 anos, contando hoje com 10 Centros de Referência da Assistência Social - CRAS, um Centro de Convivência do Idoso - CCI, dois Centros de Convivência Social, Centro de Referência Especializado da Assistência Social - CREAS, Centro POP, Advocacia do Povo, Casa dos Conselhos, Abrigo Domiciliar, cinco Cozinhas Comunitárias, um Restaurante Popular, um Banco de Alimentos, Hortas Comunitárias, Feiras Populares, Ônibus Itinerante da Agricultura Familiar e o Programa de Aquisição de Alimentos - PAA.
A Secretaria de Assistência Social e Cidadania de Maracanaú - SASC foi criada em 2005 com base no Sistema Único de Assistência Social - SUAS, tendo como objetivo garantir a todo cidadão de Maracanaú o direito à família, à infância, à adolescência, à velhice, à inserção no mercado de trabalho, à reabilitação profissional e à integração comunitária e social, conforme preconiza a Lei Orgânica da Assistência Social, Lei nº 8.742/93. Para isso, trabalha junto com a sociedade civil e organizações não governamentais no desenvolvimento de projetos e ações capazes de atender as necessidades básicas da população.
Os Conselhos Municipais de Assistência Social - CMAS, previstos na Lei nº 8.742, de 7 de dezembro de 1993 - LOAS, são definidos como instâncias deliberativas do sistema descentralizado e participativo de assistência social, conforme o art. 16 da LOAS. Eles orientam, fiscalizam e formulam a política pública junto com o Governo.
No Município de Maracanaú o CMAS foi instituído pela Lei nº 477, de 21 de dezembro de 1995, alterada pela Lei nº 628, de 30 de novembro de 1998, e pela Lei nº 1.849, de 8 de maio de 2012. É órgão colegiado de natureza deliberativa, com representação paritária entre Governo e sociedade civil, e fiscalizador das atividades de assistência social do Município, de caráter permanente, sendo seu funcionamento regulado pelo Regimento lnterno, Resolução nº 28, de 17 de outubro de 2013. 
O Município instituiu esses Conselhos por meio de lei específica que estabelece a composição, o conjunto de atribuições e o modo de exercer as competências."
2015-08-06T12:40;SATISFAÇÃO, NÚMERO, ESTUDANTE, CEARÁ, APROVAÇÃO, EXAME NACIONAL DO ENSINO MÉDIO (ENEM).;PELA ORDEM;"O SR. CHICO LOPES (PCdoB-CE. Pela ordem. Sem revisão do orador.) - Sr. Presidente, Sras. e Srs. Deputados, quero registrar que o maior número de aprovados pelo ENEM se deu exatamente no Ceará. E quero ressaltar Mauriti, uma cidade no sul do Ceará, onde meninos do interior, meninos sem condições foram os que se apresentaram com as melhores notas no ENEM. Esta é uma satisfação do sistema educacional cearense, que prima pela qualidade e pela promoção dos seus alunos.
	Portanto, eu queria parabenizar não só o Governo do Estado, mas os professores, secretários, pais de alunos. Estamos felizes em ter o maior número de estudantes aprovados pelo ENEM."
2015-08-12T15:16;SERVIDOR PÚBLICO, INSTITUTO NACIONAL DO SEGURO SOCIAL (INSS), GREVE, NEGOCIAÇÃO, DEFESA.;PEQUENO EXPEDIENTE;"O SR. CHICO LOPES (PCdoB-CE. Sem revisão do orador.) - Sr. Presidente, eu queria apelar para o Ministro do Planejamento, a fim de que resolva esta questão: desde o dia 7 de junho estão em greve funcionários do Instituto Nacional do Seguro Social - INSS, que estão pedindo a incorporação do plano de carreira, as 30 horas semanais e a reposição salarial, por causa da inflação, de aproximadamente 27%.
	Os servidores públicos federais já estão há 8, 9 anos sem um centavo de aumento. Eles apenas estão querendo que sejam incorporadas aquelas gratificações para terem maior segurança.
	É um apelo que nós fazemos ao Ministro no sentido de procurar uma solução rápida, sob pena de o serviço público, do qual o povo tanto precisa, parar.
	Obrigado, Sr. Presidente, pela oportunidade.
	O SR. PRESIDENTE (Delegado Edson Moreira) - O.k., nobre Deputado."
2015-08-19T15:20;CONGRATULAÇÃO, ROBERTO CLÁUDIO, PREFEITO, FORTALEZA (CE), LANÇAMENTO, PORTAL DO SERVIDOR, ASSINATURA, LEGISLAÇÃO, VALORIZAÇÃO, SERVIDOR PÚBLICO CIVIL MUNICIPAL.;PEQUENO EXPEDIENTE;"O SR. CHICO LOPES (PCdoB-CE. Sem revisão do orador.) - Sra. Presidente, quero parabenizar o Prefeito de Fortaleza, Roberto Cláudio, que ontem fez uma reunião com a maioria dos funcionários da Prefeitura em prol da valorização e do estímulo aos servidores públicos municipais, respeitando e ampliando direitos, estabelecendo novas medidas de apoio ao servidor e tornando mais prático e fácil ao servidor o acesso a programas de benefício. Também foi criado um portal, pelo qual vai ocorrer o relacionamento entre o Prefeito e os servidores.
	Sra. Presidente, peço que este pronunciamento seja publicado nos órgãos de comunicação da nossa Casa.

PRONUNCIAMENTO ENCAMINHADO PELO ORADOR
	Sra. Presidente, Sras. e Srs. Deputados, cumprimentando a todos, retorno a esta tribuna para registrar as ações que vêm sendo realizadas pela Prefeitura de Fortaleza, em prol da valorização e do estímulo aos servidores públicos municipais, respeitando e ampliando direitos, estabelecendo novas medidas de apoio ao servidor e tornando mais prático e fácil o acesso a programas de benefício ao servidor. São méritos da gestão do jovem Prefeito Roberto Cláudio, que nesta semana chegou aos 40 anos de idade e vem fazendo um trabalho reconhecido em diversas áreas, nesta missão tão nobre e ao mesmo tempo tão desafiadora, que é conduzir a gestão pública de uma das maiores e mais populosas capitais do nosso País.
	Tive a honra de participar, na manhã desta terça-feira, no auditório da Universidade do Parlamento Cearense (UNIPACE), na Assembleia Legislativa do Estado do Ceará, do lançamento, por parte do Prefeito Roberto Cláudio, do Portal do Servidor e da assinatura de diversas leis que beneficiam os servidores municipais.
	Entre essas leis, Sra. Presidente, está uma legislação específica para prevenção e combate ao assédio moral aos servidores, uma conquista importantíssima não só para os trabalhadores da municipalidade, mas para todos nós, que sempre lutamos por melhores condições de trabalho, por dignidade nos ambientes de trabalho e contra a prática de assédio moral, infelizmente ainda uma realidade nefasta, a ser combatida pelos órgãos de fiscalização do trabalho e por toda a sociedade, tanto na administração pública quanto na iniciativa privada. 
	O lançamento deste programa é, sem dúvida, um passo corajoso e ousado para o combate a essa prática que tanto nos envergonha. A partir de agora, o servidor municipal contará com mais e melhores condições para denunciar quem praticar assédio moral, tendo resguardado seu sigilo e contribuindo, de forma concreta, para termos um ambiente de respeito aos direitos e prerrogativas de cada um, principalmente de respeito ao ser humano, em todas as suas dimensões.
	Parabéns ao Prefeito Roberto Cláudio, parabéns aos servidores públicos municipais e a todos os cidadãos de Fortaleza, que passam a conquistar benefícios diretamente advindos dessas novas medidas de estímulo aos trabalhadores que têm por missão servir ao público.
	Muito obrigado.
	A SRA. PRESIDENTA (Raquel Muniz) - Tem a palavra o Deputado Daniel Almeida."
2015-08-20T09:20;"CHICO LOPES, DEPUTADO FEDERAL, PARTICIPAÇÃO, REUNIÃO, DISCUSSÃO, CONDUÇÃO, DEMOCRACIA.
PREOCUPAÇÃO, TRANSFORMAÇÃO, INSTITUIÇÃO NACIONAL, PARTIDO POLÍTICO.";BREVES COMUNICAÇÕES;"O SR. CHICO LOPES (PCdoB-CE. Sem revisão do orador.) - Sr. Presidente dos trabalhos, Deputado Manato, médico e militante da saúde, senhores e senhoras, ontem, nesta Casa, houve o encontro de vários institutos e de diversos partidos: PT, PMDB, PDT, PCdoB, Fundação Maurício Grabois, Fundação Perseu Abramo e outros. Fizemos, rapidamente, uma análise do que vem acontecendo no Brasil.
	O Deputado Wadih Damous, do PT do Rio de Janeiro, que me antecedeu, fez uma análise do comportamento jurídico de certas autoridades. O Prof. Schmidt, da Universidade de Brasília, o Presidente da OAB e todos nós estamos preocupados com a maneira como está sendo conduzida, aparentemente, a democracia brasileira.
	Todos os órgãos e instituições, como o Judiciário, pelos quais devemos ter respeito, e eu tenho, agora resolveram se tornar partidos políticos - se não todos, boa parte deles. 
	Outro companheiro que esteve aqui defendeu a Marcha dos Vereadores. 
	Os promotores, agora, por qualquer vontade individual, mandam prender vereador, mandam prender prefeito. Depois, o processo não dá em nada, mas já ficou a mancha na classe política.
	O SR. PRESIDENTE (Carlos Manato) - Muito obrigado, nobre Deputado."
2015-08-20T09:54;PREOCUPAÇÃO, DECISÃO, TRIBUNAL DE CONTAS DA UNIÃO (TCU), DETERMINAÇÃO, CAIXA ECONÔMICA FEDERAL (CEF), PRORROGAÇÃO, CONTRATO, LOTERIA.;PELA ORDEM;"O SR. CHICO LOPES (PCdoB-CE. Pela ordem. Pronuncia o seguinte discurso.) - Sr. Presidente, Sras. e Srs. Deputados, ocupo a tribuna para manifestar minha preocupação com a decisão do Tribunal de Contas da União (TCU) de determinar à Caixa Econômica Federal o cumprimento do acórdão formulado pelo Procurador-Geral do Ministério Público junto ao TCU contra a prorrogação de contratos de permissão lotérica pela Caixa Econômica Federal.
	Comunico a todos que solicitei hoje o reexame da matéria ao Tribunal de Contas da União e à Caixa Econômica Federal, uma análise cuidadosa, que leve em conta o que está escrito na Lei nº 12.869, de 15 de outubro de 2013, que ""dispõe sobre o exercício da atividade e a remuneração do permissionário lotérico e dá outras providências"". Segundo o que determina a Lei:
		""Art. 3º.............................................................
		VI - os contratos de permissão serão firmados pelo prazo de 20 anos, com renovação automática por idêntico período, ressalvadas a rescisão ou a declaração de caducidade fundada em comprovado descumprimento das cláusulas contratuais, ou a extinção, nas situações previstas em lei.
		Parágrafo único. Em caso de permissão de serviços lotéricos, o prazo de renovação referido no inciso VI deste artigo contar-se-á a partir do término do prazo de permissão, independentemente do termo inicial desta.""
	Portanto, considero justas as reivindicações da FEBRALOT (Federação Brasileira das Empresas Lotéricas) e do SINDILOCE (Sindicato das Empresas Lotéricas e Similares do Ceará).
	No Ceará, encontram-se nessa situação 159 unidades, de um universo de 385 existentes, ou seja, um percentual de 42%, e em Fortaleza essa cifra chega a 78%, sendo as maiores lotéricas.
	A decisão do Tribunal de Contas da União e da Caixa Econômica Federal afeta diretamente 6.104 casas lotéricas espalhadas no Brasil, causando incerteza, instabilidade e insegurança.
	Portanto, fica o apelo para que a Caixa e o TCU reexaminem a decisão e cumpram o que determina a lei. Nós temos mais de 40 mil pessoas envolvidas diretamente nessa medida.
	Sr. Presidente, peço a publicação do meu pronunciamento na imprensa da nossa Casa. Agradeço. 
Bom final de semana a todos.
	O SR. PRESIDENTE (Carlos Manato) - Muito obrigado, nobre Deputado."
2015-08-25T14:24;"DÉCIMO TERCEIRO SALÁRIO, APOSENTADO, PENSIONISTA, PREVIDÊNCIA SOCIAL, ANTECIPAÇÃO, DILMA ROUSSEFF, PRESIDENTE DA REPÚBLICA, PAGAMENTO, GARANTIA.
SEMANA, ANISTIA, MINISTÉRIO DA JUSTIÇA, REALIZAÇÃO.
GUERRILHA DO ARAGUAIA (1972-1974), ARTIGO DE IMPRENSA, INTERNET, SEZOSTRYS ALVES DA COSTA, AUTOR.";PEQUENO EXPEDIENTE;"O SR. CHICO LOPES (PCdoB-CE. Sem revisão do orador.) - Sr. Presidente, Sras. e Srs. Parlamentares, registro a decisão firme da Presidenta Dilma em garantir o pagamento da antecipação do décimo terceiro salário aos aposentados e pensionistas no tempo correto e de direito.
	A Presidenta Dilma Rousseff decidiu ontem que o adiantamento de 50% do décimo terceiro salário dos benefícios de aposentados e pensionistas da Previdência Social será pago integralmente na folha de setembro. Os outros 50% da gratificação natalina serão pagos na folha de novembro, conforme a rotina tradicional.
	Quero também registrar que a Semana da Anistia deste ano promove mais de 50 atividades em todo o País. De 24 a 30 de agosto, as ações relembram os 36 anos da Lei de Anistia e inclui eventos organizados tanto pela Comissão de Anistia do Ministério da Justiça quanto por órgãos, entidades e organizações parceiras. 
	Estive na manhã desta terça-feira no Ministério da Justiça para acompanhar o julgamento do requerimento de anistia política de mais de 180 camponeses que sofreram violações no contexto da Guerrilha do Araguaia, de 1967 a 1974.
Solicito a inclusão dos Anais da Câmara dos Deputados de artigo de autoria de Sezostrys Alves da Costa, Presidente da Associação dos Torturados do Araguaia (ATGA) e Secretário de Saúde da Palestina do Pará, que tem como titulo: Camponeses do Araguaia - Centenas de camponeses se reúnem e debatem sobre anistia, memória e democracia.
	Tenho certeza de que os companheiros que sofreram perseguição pelo regime militar naquela época serão anistiados e recompensados pela sua luta para que o País chegasse à democracia. 
	Muito obrigado, Sr. Presidente.
ARTIGO A QUE SE REFERE O ORADOR
Camponeses do Araguaia - centenas de camponeses se reúnem e debatem sobre anistia, memória e democracia.
Por Sezostrys Alves da Costa
Em Assembleia Geral convocada pela Associação dos Torturados na Guerrilha do Araguaia - ATGA e Associação dos Ex-Combatentes da Guerrilha do Araguaia, centenas de camponeses e ex-soldados estiveram reunidos neste domingo, 16 de agosto, no Auditório da Escola José Mendonça Virgulino, em Marabá (PA), para debater pautas acerca de políticas reparatórias e as questões relacionadas à luta pela Anistia, Memória e Democracia.
No que tange a Anistia, tratamos das questões relacionadas à retomada de julgamentos de processos de camponeses perseguidos durante a Guerrilha do Araguaia e que estão tramitando na Comissão de Anistia do Ministério da Justiça. Apresentamos as últimas informações oriundas do referido órgão, enfatizando sobre a necessidade estarem todos recadastrados por conta das recomendações dos órgãos de controle.
Renovamos nossas expectativas e esperanças na retomada imediata de julgamentos, tendo em vista o tempo e o perigo da demora, pois são 4 décadas do episódio, e a média de idade dos camponeses é de 70 anos, o que torna o reconhecimento do Estado Brasileiro às perseguições impetradas aos camponeses é uma questão mais que urgente.
Por outro lado, no curso das intervenções dos participantes, ficou clara a visão comum de que a Ditadura Militar promoveu os piores dias na história da região Araguaia-Tocantins, com torturas, mortes e desaparecimentos forçados. 
Não podemos aceitar qualquer tipo de tentativa para subverter o mandato presidencial de Dilma Rousseff. Retroceder Jamais!
A democracia foi uma dura conquista, que custou milhares de vidas, dentre elas de centenas de camponeses. Segundo a CPT, nos últimos quarenta anos quase mil trabalhadores rurais foram assassinados no Pará pela estrutura que combinou repressão política, latifúndio e impunidade. Não deixaremos que as oligarquias sufoquem as liberdades públicas e entreguem nossas riquezas ao capital estrangeiro.
O combate à corrupção não justifica entregar nosso país, como é o caso do pré-sal.
Informo, ainda, que os camponeses do Araguaia e os ex-soldados manifestam irrestrito apoio à presidente Dilma e ao seu governo. O resultado das urnas deve ser respeitado!
Não passarão!
*Sezostrys Alves da Costa é Presidente da Associação dos Torturados do Araguaia (ATGA) e Secretário de Saúde da Palestina do Pará."
2015-08-25T15:04;"PREOCUPAÇÃO, DECISÃO, TRIBUNAL DE CONTAS DA UNIÃO (TCU), DETERMINAÇÃO, CAIXA ECONÔMICA FEDERAL (CEF), PRORROGAÇÃO, CONTRATO, LOTERIA. 
PUBLICAÇÃO, ANAIS DA CÂMARA DOS DEPUTADOS, ARTIGO, FALTA, CONVENIÊNCIA, TEMA, PALESTRA, JAIR BOLSONARO, DEPUTADO FEDERAL, FORTALEZA (CE).";PELA ORDEM;"O SR. CHICO LOPES (PCdoB-CE. Pela ordem. Sem revisão do orador.) - Deputado Alberto Fraga, Sras. e Srs. Deputados, antes de começar o meu discurso, quero parabenizar o Deputado Afonso Motta, pois tenho a impressão de que a proposta dele cala fundo em todo político que não quer ver o circo pegar fogo. Eu e minha família sempre fomos admiradores do grande Getúlio Vargas, que inclusive mandou arrancar unha de comunista. Mas nós não somos pistoleiros, somos políticos. E o que Getúlio fez por este País, criando a lei trabalhista, etc., merece o nosso respeito.
	Sr. Presidente, antes de entrar no meu discurso, eu gostaria de pedir a publicação nos Anais e a divulgação no programa A Voz do Brasil de  artigo da Profa. de Filosofia da UNIFOR Sandra Helena de Souza, membro do Instituto Latino-Americano de Estudos. A UNIFOR é uma das melhores universidades privadas do Ceará e tem em seu quadro professores, professoras, filósofos, pessoas que pensam e falam na hora certa.
	Sr. Presidente, Sras. e Srs. Deputados, ocupo esta tribuna novamente para alertar esta Casa sobre a decisão do Tribunal de Contas da União que determinou à Caixa Econômica Federal o cumprimento de acórdão decorrente de representação formulada pelo Procurador-Geral do Ministério Público junto ao TCU, contra a prorrogação dos contratos de permissão lotérica da Caixa Econômica Federal. 
	Recebi, na semana passada, em meu escritório no Ceará, representantes do Sindicato das Empresas Lotéricas e Similares do Estado do Ceará - SINDILOCE, que solicitaram a nossa intervenção junto à Caixa e ao TCU para que se cumpra o que determina a Lei nº 12.869, de 2013, aprovada neste Congresso Nacional, em outubro de 2013, portanto, após a emissão do acórdão do TCU, em abril de 2013. 
Não tenho dúvida de que a lei garante que os permissionários lotéricos da Caixa tenham seus contratos prorrogados por mais 20 anos. 
	Na quinta-feira passada, solicitei o reexame da matéria ao Tribunal de Contas da União e à Caixa Econômica Federal, para que, com cuidado e rigor, levem em conta o que está escrito na Lei nº 12.869, de 15 de outubro de 2013, que ""dispõe sobre o exercício da atividade e a remuneração do permissionário lotérico e dá outras providências"". 
	Segundo o que determina a lei:
""Art. 3º.......................................................
VI - os contratos de permissão serão firmados pelo prazo de 20 anos, com renovação automática por idêntico período, ressalvadas a rescisão ou a declaração de caducidade fundada em comprovado descumprimento das cláusulas contratuais, ou a extinção, nas situações previstas em lei.""
	E ainda: 
	""Parágrafo único. Em caso de permissão de serviços lotéricos, o prazo de renovação referido no inciso VI deste artigo contar-se-á a partir do término do prazo de permissão, independentemente do termo inicial desta."" 
	Portanto, considero justa a indicação da Federação Brasileira das Empresas Lotéricas  - FEBRALOT e do Sindicato lá do Ceará. A decisão do TCU e da Caixa Econômica afeta diretamente 6.104 casas lotéricas espalhadas no Brasil, causando profunda preocupação nos trabalhadores do setor. 
	Portanto, aqui fica um pedido à Caixa e ao TCU para que reexaminem a decisão e cumpram o determinado na Lei nº 12.869. 
	Sr. Presidente, muitos trabalhadores sairão prejudicados com o desemprego, o que trará dificuldades para as famílias. Nós apelamos para que o Tribunal não esqueça que é órgão auxiliar desta Casa e não pode determinar o que lhe vem à telha, de uma hora para outra, conforme a vontade de alguns que lá militam, de funcionários ou mesmo de Ministros.  
	A Câmara não aceita esse tipo de comportamento de se criar desemprego e desrespeitar, acima de tudo, uma lei que protege os donos das casas lotéricas e aqueles que trabalham nessa atividade. 
	Muito obrigado, Sr. Presidente.

ARTIGO A QUE SE REFERE O ORADOR
Fortaleza envergonhada.
Mas momentos políticos conturbados como o que vivemos promovem provas a céu aberto onde todos somos testados.
Imaginei esses dias a principal associação empresarial de qualquer cidade alemã recebendo um palestrante deputado que desembarcado no aeroporto local dissesse publicamente: ""nós já vencemos uma vez, fomos derrotados, mas voltaremos"" referindo-se ao 3º Reich. Soa absurdo, eu sei. Se mudarmos de continente e colocarmos a sandice no Chile, Uruguai ou mesmo Argentina, países que enfrentaram seus passados de ditadura como recomenda a internacional ""Justiça de Transição"" para consolidar consensos democráticos nacionais, haverá enorme dificuldade de crer razoavelmente em acontecimento dessa espécie. Mas a realidade costuma superar nossas piores distopias.
O protagonismo político do CIC colocou o Ceará na primeira página do País, o que se costuma chamar ""A Era Tasso"", dos empresários ""esclarecidos"" no poder. Inúmeros trabalhos acadêmicos se referem a uma revolução burguesa tardia entre nós, uma ""modernização conservadora"" que, não obstante, representou avanços em setores diversos, da economia aos direitos humanos, como de resto em todo o País, desde o período da redemocratização. Os avanços, sociais e político-institucionais, ficaram bem aquém das promessas; negá-los, entretanto, é equívoco crasso.
Mas momentos políticos conturbados como o que vivemos promovem provas a céu aberto onde todos somos testados. E a pergunta fundamental é: o que entendemos por democracia? Ao desembarcar em Fortaleza, depois de proferir as bizarrices de praxe, Jair Bolsonaro bradou: ""nós os derrotamos em 64 e vamos derrotá-los de novo"", ovacionado por uma ruidosa claque. Fiquei estupefata ao saber que ele daria uma palestra no CIC sobre ""Ética na Política"". Compromissos não me permitiram comparecer. Procurei e soube que não há registro audiovisual algum desse sinistro.
O epíteto de ""polêmico"" hoje encobre discursos tenebrosos, assim como a ideia mal concebida entre nós de ""liberdade de expressão"". Não há pactos consensuais sobre o que significa ao menos Estado de Direito, não só entre manifestantes ignorantes, mas entre uma entidade que já teve peso político determinante. Eu gostaria imensamente de ver a entrevista a que o deputado foi submetido na ocasião. As perguntas da imprensa são todas sobre corrupção, esse nosso encobrimento preferido. Queria ter podido entrevistá-lo. Meu aluno mais negligente faria perguntas consistentes sobre golpe de Estado, torturas e desaparecidos políticos. Sobre misoginia, homofobia e racismo, não seria necessário. Já conhecemos amplamente sua posição.
Esse acontecimento fala mais alto do que os cartazes infames perguntando por que a presidente não foi enforcada no Doi-Codi. Não se trata apenas de malucos nas ruas, mas de uma instituição respeitável que acolhe, a título de ""democracia"", a palavra de alguém que estaria disposto, sem reservas, a defender isso hoje mesmo. Com convicção e aplausos. Alguém duvida?
Ética na Política? Bolsonaro? Façam-me o favor. Nada mais que um acinte. Vergonha moral, para nós e para o mundo civilizado."
