dataHoraInicio;keywords;tipoDiscurso;transcricao
2017-03-29T14:38;REGISTRO, INSTITUIÇÃO, SEMANA NACIONAL PELA NÃO VIOLÊNCIA CONTRA A MULHER, CAMPANHA EDUCATIVA, CONSCIENTIZAÇÃO, VIOLAÇÃO, DIREITOS HUMANOS, MULHER.;PELA ORDEM;"O SR. CHICO LOPES (PCdoB-CE. Pela ordem. Sem revisão do orador.) - Sr. Presidente, eu queria que fosse divulgado pelo programa A Voz do Brasil que foi instituída a Semana Nacional pela Não Violência contra a Mulher.
	Michel Temer sancionou no dia 27 a lei, aprovada pelo Congresso na ocasião do Dia Internacional da Mulher, que cria a Semana Nacional pela Não Violência contra a Mulher. A lei estabelece que a campanha de conscientização ocorra todos os anos durante a última semana de novembro.
	Na ocasião serão desenvolvidas atividades como palestras, debates e seminários sobre violação dos direitos das mulheres. Os eventos deverão ser promovidos pelo Governo, em pareceria com organizações da sociedade do País.
	Nós sabemos que no Ceará matam muitas mulheres - não tanto como em lugares mais povoados. Mas nós queremos reeducar o homem de lá para acabar contra essa violência contra a mulher.
	Muito obrigado, Sr. Presidente."
2017-03-30T10:14;"GRATUIDADE, ENSINO PÚBLICO, EDUCAÇÃO SUPERIOR, MESTRADO, DOUTORADO, DEFESA.  
EMPRESA BRASILEIRA DE CORREIOS E TELÉGRAFOS (ECT), PRIVATIZAÇÃO, APREENSÃO.";BREVES COMUNICAÇÕES;"O SR. CHICO LOPES (PCdoB-CE. Sem revisão do orador.) - Sr. Presidente, Sras. e Srs. Deputados, funcionários, eu ocupo esta tribuna, mas digo que não estou entendendo nada do que acontece neste País. Infelizmente, é um samba do crioulo doido.
	Um professor da Universidade de Brasília reclamou porque esta Casa não havia aprovado que as pessoas pagassem para fazer mestrados. Digo a ele: ""Monte uma universidade privada e cobre, rapaz! Mas abrir mão do direito da universidade pública, nós os comunistas, nós os progressistas, nós os bem-intencionados não vamos fazer nunca"".
	Fala-se que, para que um país possa avançar, é preciso investir na educação. Mas educação é um direito e um dever do Estado para com o povo. Portanto, quanto mais o povo tiver acesso à educação gratuita, melhor para este País.
	Nesse sentido, não podemos fazer coro com aqueles que estão criticando os Deputados que votaram a favor dessa matéria, inclusive os da base do Governo, que queremos parabenizar, porque a educação é um direito universal. Às vezes, o povo não tem nem condição de comprar um livro. Aí, como ele vai poder fazer especialização tendo que pagar?
	Portanto, registro a nossa indignação. Quanto mais educação pública e gratuita de qualidade houver, melhor para o povo e bem melhor para o País.
	Mas, Sr. Presidente, quero me congratular com aqueles que se colocam contra a privatização dos Correios. Sou originário de família de funcionários dos Correios desde o tempo em que se passava telegrama, do tempo em que os Correios entregavam embrulho ou qualquer coisa de casa em casa. Nos Correios, existiam mensageiros e carteiros, que exerciam as duas funções mais importantes, além dos telegrafistas.
	Hoje os Correios são uma potência, uma das entidades públicas mais antigas, mas que, no Governo atual, vêm sendo engolidos aos poucos com essa história de privatização. Mas isso não é só no Governo, porque o Presidente é apenas um cidadão que administra o furor das classes dominantes nesse sentido.
	Os Correios não podem e não devem ser privatizados, porque fazem parte da história do País principalmente nos longínquos locais, onde os carteiros puxavam jumentos para levar cartas e telegramas aos lugares mais difíceis.
	Portanto, nossos parabéns aos que estão lutando contra a privatização dos Correios. 
	Bom fim de semana, Sr. Presidente e demais colegas."
2017-04-04T14:18;GOVERNO, MICHEL TEMER, PRESIDENTE DA REPÚBLICA, GESTÃO, EDUCAÇÃO, EXTINÇÃO, PROGRAMA CIÊNCIA SEM FRONTEIRAS, CRÍTICA.;PEQUENO EXPEDIENTE;"O SR. CHICO LOPES (PCdoB-CE. Sem revisão do orador.) - Sr. Presidente, Sras. e Srs. Deputados, eu estou impressionado com a maneira como o Governo golpista está atacando todas as atividades, todas as áreas. Agora atinge a educação.
	A educação sempre teve dificuldade neste País, mas este Governo conseguiu agora um feito inédito. O Ciência sem Fronteiras é um programa que favorece o relacionamento entre países. Alunos do nosso País vão para a Europa, por exemplo, para conhecerem outros tipos de comportamento, adquirirem conhecimento, e nós recebemos alunos de fora para mostrar a eles o nosso sistema educacional, a forma como nós tratamos os estudantes.
	Infelizmente, o Sr. Temer, ou o Temerário, que está no poder, não tem o menor respeito. Se ele tivesse colocado no Ministério da Educação um carpinteiro, eu acredito que esse teria sensibilidade, até porque o carpinteiro passa por uma escola profissional e sabe da importância que tem a educação para a transformação da sociedade.
	Portanto, Sr. Presidente, é algo lamentável. Eu, com mais de 70 anos, a maior parte deles vividos em salas de aula, vejo a educação ser tratada de forma miserável por falta de comportamento adequado. Menciono o piso salarial, que nós alcançamos com muito sacrifício.
	Entre em campo, Confederação Nacional dos Trabalhadores em Educação - CNTE, mobilize este País! Nós temos certeza de que vamos dar uma resposta a esse malandro que está no poder!"
2017-04-05T09:24;AGÊNCIA LOTÉRICA, DEFESA.;BREVES COMUNICAÇÕES;"O SR. CHICO LOPES (PCdoB-CE. Sem revisão do orador.) - Sr. Presidente, quero ressaltar que, neste momento, no restaurante do 10º andar, está havendo uma reunião da Frente Parlamentar em Defesa das Casas Lotéricas. Em Fortaleza, no Ceará, tem melhorado muito esse serviço. A oficialização desse serviço prestado pela Caixa Econômica Federal é repassado às pessoas que se comprometem a fazer um trabalho sério.
	Hoje, no interior e nos grandes subúrbios, é o banco que o povo tem. Lá se paga conta de energia e qualquer outro tipo de conta. Muita gente de periferia ou mesmo do interior tem medo de entrar num banco, principalmente naqueles que têm porta de vidro. Numa casa lotérica, essas pessoas compram jogam no bicho, compram bilhete; enfim, as casas lotéricas prestam um grande serviço no interior, principalmente nos bairros periféricos.
	Muito obrigado."
2017-04-05T09:48;PROGRAMA CIÊNCIA SEM FRONTEIRAS, FIM, APREENSÃO.;PELA ORDEM;"O SR. CHICO LOPES (PCdoB-CE. Pela ordem. Sem revisão do orador.) - Muito obrigado. Espero que Deus te leve também até lá, porque é ótimo ser velho.
	Sr. Presidente, eu fiz a opção na minha vida para ser contador e professor e me preocupo com as duas funções, porque, se não houver uma boa contabilidade não se descobre a corrupção, e a educação é a base do desenvolvimento de qualquer país.
	Eu entrei mesmo na educação por ouvir dizer que a educação é palco de desenvolvimento, a educação é questão familiar. Mas eu queria fazer um apelo ao Ministro da Educação, porque eu não vejo sentido nenhum em cortar esse convênio, Ciência sem Fronteiras, em que nós mandamos os brasileiros para o exterior e eles mandam jovens do exterior para o Brasil e há, então, uma troca de conhecimento, uma troca de experiência positiva, tanto de lá, seja na Europa, seja na Ásia, quanto de cá. O País precisa disso. E nós temos grandes universidades, nós temos vários cientistas, bons técnicos, não devemos nada ao exterior.
Agora, não pode ser vista a educação como a vemos no Brasil, como despesa. A educação é investimento, a educação é pesquisa. Veja no campo da medicina, que é o de V.Exa., o avanço que houve nos últimos tempos, houve avanço na tecnologia de construção pesada, tudo isso passa pela educação, passa pelo investimento na educação.
	Portanto, estou triste que o Ministro da Educação, em vez de aumentar cada vez mais o nosso relacionamento com outros países, acabe com o convênio.
	Ministro, por gentileza, faça uma reflexão e volte este relacionamento, que é muito bom.
	Eu gostaria que o meu discurso fosse divulgado pelo programa A Voz do Brasil.
	Obrigado.
	O SR. PRESIDENTE (Carlos Manato) -  Muito obrigado, nobre Deputado Chico Lopes."
2017-04-05T15:22;GOVERNO, MICHEL TEMER, PRESIDENTE DA REPÚBLICA, EXTINÇÃO, PISO SALARIAL, PROFESSOR, CRÍTICA.;BREVES COMUNICAÇÕES;"O SR. CHICO LOPES (PCdoB-CE. Sem revisão do orador.) - Sr. Presidente, Sras. e Srs. Deputados, nós achamos que a educação no Brasil passa por um problema, que é a visão do atual Governo sobre a educação.
	Nós sabemos que no período Lula os Ministros da Educação deram continuidade às escolas técnicas, que foram criadas mais ou menos no tempo de Getúlio. O tempo foi passando. Eram escolas simplesmente profissionalizantes. Mas o ensino profissionalizante daquela época era para formar carpinteiro, mecânico, profissões que não exigiam o ginásio nem o científico. Eram profissões primárias, como auxiliar de sapateiro, enfim.
'	Houve evolução. O regime militar transformou todos os colégios em colégios profissionais. No nível médio havia curso para técnico em Administração, Contabilidade, Mercadologia.
	E Lula, quando entra, cria condições de termos mais universidades. Posso lhes dizer, Sr. Presidente, Sras. e Srs. Deputados, que o Ceará só tinha uma universidade federal. A concorrência para entrar nessa universidade era enorme, dada a quantidade de jovens que terminavam o segundo grau, ou o científico. Para Medicina, naquela época, havia 30 vagas e concorriam cem pessoas. Daí por que raspavam a cabeça, para dizer aos outros quem tinha entrado na universidade. Hoje, nós temos duas universidades federais, temos universidades estaduais, estamos em outro campo.
	Mas qual é o grande problema, Sr. Presidente? É o Ministro da Educação, que parece que não entende bem qual é o papel dele nessa situação. 
	Qual foi a primeira coisa que fizeram com a minha profissão? Nós tínhamos uma lei. Por meio dela foi criado o piso nacional, uma luta do meu sindicato em Itapipoca, uma luta da CNTE - Confederação Nacional dos Trabalhadores em Educação. Houve várias greves e movimentos até conseguirmos ter um piso.
	Evidentemente, esse piso não era o suficiente para as necessidades de um professor que trabalha de manhã e de tarde e, no sábado e no domingo, ainda tem que corrigir trabalhos, provas, etc. Mesmo assim, nós tínhamos um piso. Um dos malefícios do Presidente atual foi, nessa enxurrada de retirada de direitos, tirar logo o piso nacional dos professores.
	O Ministro não querer partido nas escolas é um passo... Nós vemos agora uma regressão absurda na educação. Parece que ele esquece que o partido não entra na escola. Quem entra lá são as pessoas. Ele não vai me impedir de, sendo comunista, discutir lá dentro a questão política sob a minha ótica, sob a ótica de quem está no confronto. Os professores perderam o piso, não há dinheiro para a educação, a área está com dificuldade. 
	Sr. Presidente, essa é a perspectiva que nós temos. V.Exa. é político, eu sou político. Este discurso, ""eu vou lutar pela educação, porque a educação é que vai fazer o País se desenvolver, etc."", essa conversa mole não pega mais. O que o atual Governo está fazendo, com esse Ministro da Educação, é atrapalhar o desenvolvimento que nós tínhamos no Governo anterior. Essa é a grande realidade. 
	Um abraço, Sr. Presidente, e um bom fim de semana.
	O SR. PRESIDENTE (JHC) - Obrigado, Deputado Chico Lopes."
2017-04-06T09:10;PEC 287/2016, PROPOSTA DE EMENDA À CONSTITUIÇÃO, REFORMA PREVIDENCIÁRIA (2016), REJEIÇÃO.;BREVES COMUNICAÇÕES;"O SR. CHICO LOPES (PCdoB-CE. Sem revisão do orador.) - Sr. Presidente, Sras. e Srs. Deputados, o grande encontro sobre a Previdência do Brasil está se aproximando.
	Nós sabemos que Meirelles não tem compromisso com o povo brasileiro, mas tem com o povo americano, ele é o administrador dessa imoralidade que é a Previdência que nós temos.
	Primeiro, a Previdência não é uma dádiva; foi uma conquista. O grande Getúlio Vargas criou as leis trabalhistas e também a proteção do trabalhador. E agora o mercado que quer ficar com essa fatia?
	Sr. Presidente, esta Casa deve ser bem-vista quando aprova coisas de interesse do povo, mas quando peita o povo com certas leis nesta Casa, aí o bicho pega. Muitos de nós - não sei os outros - perguntam: ""Você vai votar na Previdência? Você está interessado em votar na Previdência? Você sabe que eu dei voto a você para votar e agora você quer votar contra mim?"".
	Portanto, Sr. Presidente, acho que o Governo vai perder não porque a bancada dele seja falsa a ele, mas porque a pressão da massa está sendo grande.
	Obrigado, Sr. Presidente."
2017-04-10T18:18;"REUNIÃO, SINDICATO, SERVIDOR PÚBLICO,  PODER LEGISLATIVO, TRIBUNAL DE CONTAS DA UNIÃO (TCU), DEBATE, REFORMA PREVIDENCIÁRIA (2016).
SEMINÁRIO, BANCADA PARLAMENTAR, PARTIDO COMUNISTA DO BRASIL (PC DO B), DEBATE, REFORMA PREVIDENCIÁRIA (2016).";BREVES COMUNICAÇÕES;"O SR. CHICO LOPES (PCdoB-CE. Sem revisão do orador.) - Sr. Presidente, quero só comunicar a esta Casa que está terminando uma reunião do SINDILEGIS que debateu a reforma da previdência e um seminário da bancada do PCdoB. As conclusões são nefastas.
A maioria do povo brasileiro vai se aposentar aos 70 anos. Não é possível essa reforma da previdência, que só vai encher os bolsos dos bancos e dos planos de saúde, que não funcionam.
	Portanto, chamamos todos os trabalhadores, dentre eles os servidores públicos, e principalmente as centrais sindicais para fazermos um grande movimento a fim de que esta Casa não aprove esse monstro que é reforma da previdência. 
Na defesa intransigente dos trabalhadores e trabalhadoras, dos funcionários públicos, quero me colocar contra essa reforma.
	Obrigado, Sr. Presidente.
	O SR. PRESIDENTE (Alberto Fraga) - Muito obrigado, Deputado."
2017-04-11T12:12;ORIENTAÇÃO DE BANCADA, REQUERIMENTO DE DISCUSSÃO DE PROPOSIÇÃO POR PARTES, VOTAÇÃO POR ARTIGO, PLP 343/2017, PROJETO DE LEI COMPLEMENTAR, PARTIDO COMUNISTA DO BRASIL (PC DO B), VOTO FAVORÁVEL.;ORIENTAÇÃO DE BANCADA;"O SR. CHICO LOPES (PCdoB-CE. Pela ordem. Sem revisão do orador.) - Sr. Presidente, o PCdoB entende que a discussão artigo por artigo dá melhores condições aos Deputados e às Deputadas de colocarem com mais consciência o seu voto pelo partido. 
Sabemos das dificuldades que estamos passando na economia, na ética e até na moral. Portanto, nós não podemos nos precipitar. Queremos discutir artigo por artigo.
	""Sim""."
2017-04-18T14:20;REPÚDIO, SUBSTITUTIVO, REFORMA TRABALHISTA, PERMISSÃO, GESTANTE, TRABALHO, ATIVIDADE INSALUBRE, RETIRADA, PROTEÇÃO, TRABALHADOR.;BREVES COMUNICAÇÕES;"O SR. CHICO LOPES (PCdoB-CE. Sem revisão do orador.) - Sr. Presidente, cada vez que lemos o texto da reforma trabalhista, temos a impressão de que querem tornar o nosso trabalhador escravo. A lei permite que a mulher grávida possa trabalhar em área insalubre, a lei não protege o trabalhador. Essa lei é contra o trabalhador e a serviço do patrão.
	Em reunião com várias pessoas do mundo do trabalho, ninguém em sã consciência aceita essa lei seja aprovada, sem que haja uma modificação.
	Nós Deputados estamos preocupados e queremos que essa lei seja totalmente modificada porque, da forma como está posta, ela não irá ajudar o trabalhador, mas irá torná-lo escravo. O trabalhador ficará preso a um salário que não corresponde à realidade.
	Sr. Presidente, gostaria que meu pronunciamento fosse divulgado no programa A Voz do Brasil.
	Obrigado."
2017-04-19T17:38;SOLICITAÇÃO, PRESIDENTE DA REPÚBLICA, REVOGAÇÃO, DECISÃO, EXTINÇÃO, PISO SALARIAL, PROFESSOR.;BREVES COMUNICAÇÕES;"O SR. CHICO LOPES (PCdoB-CE. Sem revisão do orador.) - Sr. Presidente, quero agradecer a palavra a V.Exa.
	Um Deputado que me antecedeu disse que o Presidente está levando a educação brasileira a sério. Está interessado em aumentar cada vez mais o seu nome. Eu queria aproveitar a oportunidade para solicitar ao Presidente que revogue a decisão sobre o piso salarial do professor no Brasil, que foi conquistado com muita dificuldade, e que ele, numa canetada só, acabou.
	Portanto, solicito ao Sr. Presidente que faça voltar o piso salarial, para que os professores do interior do Ceará e do Brasil tenham pelo menos esse direito.
	Obrigado, Sr. Presidente."
2017-04-20T09:04;REPÚDIO, PROCEDIMENTO, INCLUSÃO, PAUTA (PROCESSO LEGISLATIVO), MATÉRIA, REJEIÇÃO, DESCUMPRIMENTO, REGIMENTO INTERNO DA CÂMARA DOS DEPUTADOS.;BREVES COMUNICAÇÕES;"O SR. CHICO LOPES (PCdoB-CE. Sem revisão do orador.) - Obrigado.
	Bom dia a todas e a todos.
	Sra. Presidente, Sras. e Srs. Deputados, eu ando muito preocupado. Se o esteio da democracia do País são os Poderes Legislativo, Judiciário e Executivo, este Poder já não tem mais razão de ser: um dia vota uma matéria e não ganha e no outro dia a coloca na pauta novamente. Para que serve o regulamento, a Constituição? Para que servem as leis? O que manda é a vontade soberana de um?
	Sou de origem escrava, mas, quando eu nasci, não havia mais escravos. Estou aqui eleito pelo povo, sem comprar nenhum voto, e acho um desrespeito o que fazia o ex-Presidente da Casa e que o atual continua fazendo. Perde num dia, o Governo chama sua bancada - e sabemos que isso acontece, não tem nada de errado - e oferece o que quer. Mas não podemos desrespeitar o Regimento Interno, porque nós não somos maiores do que ele, nós não somos maiores do que a Constituição, nós não somos maiores do que o credo religioso a que pertencemos. Mas aqui, não! A monarquia se instalou de maneira tal...
	Paciência tem limite. O compromisso com o Regimento Interno também. Sou preto, velho, mas não sou frouxo! Votei no Presidente, sem preocupação com partidos, porque é o administrador que vai conduzir a Casa. Ele pode emitir só um voto, que é o dele. Acho que é um cargo importante, porque o prestígio da Casa depende da sua direção. Virou moda isso aqui? Não. ""Eu, Presidente, declaro que este Requerimento está aprovado por isto, isto, isto. Os senhores não precisam votar"". Basta dizer isso."
2017-04-20T09:40;"PEC 287/2016, PROPOSTA DE EMENDA À CONSTITUIÇÃO, REFORMA PREVIDENCIÁRIA (2016), VOTO CONTRÁRIO.
PL 6787/2016, PROJETO DE LEI ORDINÁRIA, REFORMA TRABALHISTA, VOTO CONTRÁRIO.";PELA ORDEM;"O SR. CHICO LOPES (PCdoB-CE. Pela ordem. Sem revisão do orador.) - Obrigado.
	Sr. Presidente, Sras. e Srs. Deputados, quero declarar de público que a reforma da Previdência e a reforma trabalhista não terão o meu voto, terão minha militância contra onde tenho liderança.
	Getúlio Vargas foi quem começou a criar alguma coisa no sentido de os trabalhadores serem reconhecidos como tal. Ele foi chamado de ""O Pai dos Pobres"". Eu considero que tivemos três bons Presidentes: Getúlio Vargas, Juscelino Kubitschek e Lula.
	O SR. PRESIDENTE (Rômulo Gouveia) - Deputado Chico Lopes, com licença.
	Peço aos convidados da sessão solene requerida pelo Deputado Antônio Jácome que fiquem na lateral, assistindo a estão sessão. Peço à Polícia Legislativa que os ajude.
	Deputado, eu agradeço a V.Exa. Seu tempo será recuperado.
	O SR. CHICO LOPES - Parabenizo os escoteiros, uma entidade centenária que merece todo o nosso carinho.
	Pois bem, Getúlio suicidou-se; a morte de Juscelino até agora não foi esclarecida; parece que Lula cometeu todos os pecados do mundo e agora tem de pagar por eles.
	Com Lula, tivemos o Programa Minha Casa, Minha Vida, o respeito ao trabalhador, o aumento de emprego. Hoje o Líder do Governo reclama dos 13 milhões de desempregados. Parece que ele dormiu e não acordou, porque é essa política deles que está causando desemprego. É essa política deles que vai tornar o trabalhador escravo, sem direito a Fundo de Garantia, a férias, à aposentadoria. Nós estamos voltando à escravidão não oficializada, mas à escravidão da Direita, à escravidão da ausência da lei.
	Tenho a impressão de que o povo brasileiro está insatisfeito, com dificuldades, mas vai compreender que essa é uma ação política de fora para dentro. O patrimônio nacional está sendo todo entregue, a exemplo de uma das empresas mais antigas do País, os Correios. Eu acredito que o Governador do Ceará não vai dar condições de o Banco do Nordeste ser privatizado, um banco de importância para o País, principalmente para o Nordeste, que formou diversos técnicos, ajudou a melhorar as Regiões Norte e Nordeste. Não acredito que ele faça isso agora, pela vontade de um cidadão que tem 10% de votos, que, juntando, não dá para ser Deputado Federal pelo número de votos, mas continua sendo a ""Rainha da Inglaterra"", no Ceará. Quem é o Presidente é o Meirelles. Ele, não, é apenas um despachante, um assinante de decreto. Quem decide o que vai ser privatizado ou não é o Sr. Meirelles, que é um bom representante dos norte-americanos, por quem há muitas pessoas apaixonadas.
	Um bom fim de semana para todos.
	Obrigado."
