dataHoraInicio;keywords;tipoDiscurso;transcricao
2016-03-23T10:28;"COMISSÃO GERAL, DEBATE, CAMPANHA DA FRATERNIDADE, IGREJA CATÓLICA, CONFERÊNCIA NACIONAL DOS BISPOS DO BRASIL (CNBB), ECUMENISMO, SANEAMENTO BÁSICO, DIREITOS FUNDAMENTAIS, DESENVOLVIMENTO SUSTENTÁVEL.
DOM JOÃO BRAZ, CARDEAL, MENSAGEM, PÁSCOA, ELOGIO.";COMISSÃO GERAL;"O SR. DEPUTADO CHICO LOPES - Obrigado, Sr. Presidente. Eu só vou utilizar 1 minuto.
	A imprensa divulga hoje a tradicional mensagem de Páscoa do Cardeal brasileiro D. João Braz, Prefeito da Congregação para os Institutos de Vida Consagrada e as Sociedades de Vida Apostólica do Vaticano, que contém alguns comentários sobre o atual momento político do Brasil. ""Prendam os corruptos e os corruptores, mas deixem a paz continuar"", é mais ou menos o que ele quer dizer.
	Destaco das suas palavras algo muito importante para nós que somos cristãos católicos: paz e justiça. Mas como podemos pensar em paz se há favelados neste País? Como podemos pensar em paz se a nossa juventude está encarcerada ou viciada no crack? Como podemos pensar em justiça quando um tribunal se transforma em partido político e toma posição? Como podemos pensar em paz se não estamos cumprindo a nossa obrigação de pagar os nossos impostos corretamente, sem sonegar?
	A Campanha da Fraternidade tem esse espírito coletivo de respeito ao outro. E não se trata de uma questão de fé, ela é prática também. Devemos praticar o que dizemos aqui, caso contrário seremos falsos, fariseus. É ótima esta Campanha, mas ela tem que se transformar em beleza para aqueles que precisam. Nós, políticos, temos condições de fazer isso.
	Obrigado, Sr. Presidente.
	O SR. PRESIDENTE (Deputado Luiz Carlos Hauly) - Obrigado, Deputado Chico."
2016-03-29T13:04;SEGURANÇA, PARLAMENTAR, OBJETIVO, PRESIDÊNCIA DA CÂMARA DOS DEPUTADOS, PEDIDO.;BREVES COMUNICAÇÕES;"O SR. CHICO LOPES (PCdoB-CE. Sem revisão do orador.) - Sr. Presidente, estou em meu terceiro mandato nesta Casa, além de ter cumprido dois como Deputado Estadual e três como Vereador, e nunca me senti constrangido como hoje - e isso vem ocorrendo há algum tempo - no corredor de acesso ao plenário.
	As pessoas sempre nos pedem para assinar listas, eu assino e tal. Mas, hoje, um cidadão jovem achou por bem me constranger a assinar uma petição dele para ele fazer auditoria nas contas públicas. Eu fui explicar para ele que já há organismos incumbidos disso e que a maneira de fazer é outra. Ele disse: ""Mas, se fosse o FMI, você estaria a favor"". Eu disse: ""Não me agrida, porque eu o estou tratando bem"". Mas ele continuou me agredindo.
	Eu acho que já está em tempo de esta Casa ter uma melhor segurança, pelo menos nos corredores. E digo isso porque ser Deputado, no Brasil, está virando piada, mesmo que as pessoas saibam que você não tem nada a ver com nada.
	Portanto, eu gostaria que fosse...
	(Desligamento automático do microfone.)
	O SR. PRESIDENTE (Carlos Manato) - Muito obrigado, nobre Deputado."
2016-03-29T13:58;"LUIZ BOAVENTURA, PROFESSOR, CEARÁ, FALECIMENTO, HOMENAGEM PÓSTUMA.
TRANSPOSIÇÃO DE ÁGUAS DO RIO SÃO FRANCISCO, CEARÁ, RELEVÂNCIA, COMISSÃO EXTERNA, ATUAÇÃO, EXPECTATIVA.";PELA ORDEM;"O SR. CHICO LOPES (PCdoB-CE. Pela ordem. Sem revisão do orador.) - Obrigado.
	Sr. Presidente, Sras. Deputadas e Srs. Deputados, é com muita tristeza que, neste momento agudo e de tentativa de retrocesso que vive o Brasil, venho a esta tribuna registrar a perda de um grande brasileiro, o Prof. Luiz Boaventura, que se despediu de nós, para tristeza de toda a população cearense.
	Trata-se de um dos maiores nomes da educação no Ceará e no Brasil que contribuiu para a formação de várias gerações e fez a diferença na construção deste País.
	Conheci o Prof. Boaventura quando eu entrei no magistério. Fizemos amizade no centenário do Colégio Justiniano de Serpa. Com uma vasta experiência profissional, ele foi um espelho para quem, como eu, vinha de uma formação técnica.
	Aprendi muito com ele, inclusive a liberdade e a responsabilidade do professor com o alunado. Ele se preocupava não só com a questão do currículo escolar, do conteúdo ensinado, mas também com a defesa dos estudantes e professores, dos quais se tornou uma grande liderança, lutando por melhores salários e condições de trabalho.
	O Prof. Boaventura entra para a história como uma pessoa que se preocupava em formar bem os professores e em garantir a melhoria de qualidade no ensino para todos.
	Minha solidariedade aos seus familiares, amigos e ex-alunos. Que possamos sempre manter vivo o exemplo desse nosso companheiro.
	Por fim, Sr. Presidente, eu quero dizer que fui um dos lutadores pela transposição do Rio São Francisco. Essa luta existe há muito tempo, desde que eu era Vereador, mas só veio acontecer no Governo Lula. E, agora, contamos com a existência de uma Comissão Especial.
	Eu quero agradecer ao Deputado cearense Raimundo Gomes de Matos por estar tentando me incorporar a essa Comissão. Ele sabe da minha luta, da minha disposição em lutar contra aqueles que são contra a transposição principalmente para o Ceará, o único Estado a ser por ela diretamente beneficiado: vai receber 1,4% da água total que vai para o mar.
	Muito obrigado, Sr. Presidente.
	O SR. PRESIDENTE (Carlos Manato) - Muito obrigado, nobre Deputado."
2016-03-31T11:48;IMPEACHMENT, DILMA ROUSSEFF, PRESIDENTE DA REPÚBLICA, ILEGALIDADE, DEFESA, ADVOGADO, AULA, UNIVERSIDADE FEDERAL DO CEARÁ (UFC), AVALIAÇÃO.;BREVES COMUNICAÇÕES;"O SR. CHICO LOPES (PCdoB-CE. Sem revisão do orador.) - Obrigado, Sr. Presidente. Em aula pública que lotou a Faculdade de Direito da Universidade Federal do Ceará - UFC na noite desta quarta-feira, 30 de março, com mais de 800 participantes, advogados cearenses apontaram ilegalidade na tentativa de impeachment da Presidente Dilma Rousseff e disseram ""não"" ao golpe. O evento contou com a participação de expoentes da advocacia cearense, como o Secretário da Justiça e Cidadania do Estado do Ceará, Hélio Leitão, que avaliou que o Juiz Sérgio Moro se tornou um ""aprendiz de golpista"".
	O professor e ex-Vice-Presidente da Ordem dos Advogados do Brasil - OAB, secção Ceará, Martonio Mont'Alverne Barreto; o ex-Diretor da OAB e ex-preso político Benedito Bizerril; o advogado e Vereador João Alfredo, entre inúmeros outros operadores do Direito, participaram da aula pública, acompanhada com atenção e entusiasmo por estudantes de Direito, representantes de movimentos sociais e da população em geral.
	Sr. Presidente, solicito a V.Exa. que este pronunciamento seja divulgado pelo programa A Voz do Brasil.
PRONUNCIAMENTO ENCAMINHADO PELO ORADOR
	Sr. Presidente, Sras. e Srs. Deputados, em aula pública que lotou a Faculdade de Direito da Universidade Federal do Ceará - UFC, advogados cearenses apontaram ilegalidade no processo de impeachment da Presidente Dilma Rousseff e disseram ""não"" ao golpe.
	A aula aconteceu na Faculdade de Direito da UFC na noite desta quarta-feira, 30 de março, com mais de 800 participantes. Advogados cearenses apontaram ilegalidade na tentativa de impeachment e disseram ""não"" ao golpe. O evento contou com a participação de expoentes da advocacia cearense, como o Secretário da Justiça e Cidadania do Estado do Ceará, Hélio Leitão, que avaliou que o Juiz Sérgio Moro se tornou um ""aprendiz de golpista"".
	O professor e ex-Vice-Presidente da Ordem dos Advogados do Brasil - OAB, secção Ceará, Martonio Mont'Alverne; o ex-Diretor da OAB e ex-preso político Benedito Bizerril; o advogado e Vereador João Alfredo, entre inúmeros outros operadores do Direito, participaram da aula pública, acompanhada com atenção e entusiasmo por estudantes de Direito, representantes de movimentos sociais e da população em geral.
	Renomado advogado cearense, o Secretário da Justiça e Cidadania do Estado do Ceará, Hélio Leitão, apontou ilegalidades na conduta do Juiz Sérgio Moro, da Justiça Federal do Paraná. ""Quando o Juiz Sérgio Moro entende de divulgar interceptações telefônicas, resguardadas por sigilo legal, e divulga, inclusive, um diálogo que foi capturado em horário que não estava coberto por decisão judicial, sai da arena jurídica, despe-se da toga e desce ao rés da política mais rasteira"", avaliou. ""Fica a indagação: o que levou o juiz a divulgar essas escutas telefônicas?"", indagou.
	""A essas alturas, o seu patético mea culpa ao Supremo Tribunal Federal - STF, o pedido de desculpas, faz muito pouca diferença. Ainda que se tenha por sincero o mea culpa do Juiz Moro, muito pouca diferença faz. No momento em que ele põe de parte os interesses da Justiça e faz da ação judicial e da magistratura um instrumento a serviço do golpe, ele se torna um aprendiz de golpista"", acrescentou Hélio Leitão, que também apontou grave abuso na condução coercitiva do ex-Presidente Luiz Inácio Lula da Silva e destacou que não esperava ter de retornar à Faculdade de Direito para defender a democracia e combater uma nova tentativa de golpe no Brasil. 
	O SR. PRESIDENTE (Carlos Manato) - V.Exa. será atendido, Deputado Chico Lopes."
2016-04-05T12:34;PUBLICAÇÃO, PORTAL VERMELHO, SÍTIO (INTERNET), RELEVÂNCIA, LEI, CRIAÇÃO, REGIME ESPECIAL DE REGULARIZAÇÃO CAMBIAL E TRIBUTÁRIA (RERCT), REGULARIZAÇÃO, REPATRIAÇÃO, ATIVO FINANCEIRO, RECURSOS, BENS, EXTERIOR, AUSÊNCIA, DECLARAÇÃO, SECRETARIA DA RECEITA FEDERAL DO BRASIL, CRITÉRIO, EXTINÇÃO DE PUNIBILIDADE, CRIME CONTRA A ORDEM TRIBUTÁRIA, EVASÃO DE DIVISAS, CRIME CONEXO, SONEGAÇÃO FISCAL, PRAZO, ADESÃO, TRANSCRIÇÃO, ANAIS, CAMARA DOS DEPUTADOS.;BREVES COMUNICAÇÕES;"O SR. CHICO LOPES (PCdoB-CE. Sem revisão do orador.) - Sr. Presidente, Sras. e Srs. Deputados, eu quero chamar atenção para a grande importância da Lei nº 13.254, de 2016, que fala da repatriação de recursos lícitos que não foram declarados. Eu participei da Comissão que a aprovou. Embora alguns jabutis tenham sido colocados por interesses escusos, a lei, no todo, é todo, porque vai trazer para o Brasil mais de 20 bilhões de reais em declarações líticas que não foram feitas no momento certo.
	Portanto, nós queremos que o Fisco atue perfeitamente para trazer esse dinheiro e resolver pequenos problemas que este País vai atravessando. É uma lei simpática, é uma lei boa para aqueles que retardaram, no passado, a sua apresentação no Imposto de Renda.
	Nós queremos que isso seja divulgado na imprensa.
	Muito obrigado, Sr. Presidente.
	O SR. PRESIDENTE (Vitor Valim) - O.k., Deputado Chico Lopes.

MATÉRIA A QUE SE REFERE O ORADOR
Começa prazo para repatriação de bens e recursos no exterior
O prazo para adesão ao Regime Especial de Regularização Cambial e Tributária (RERCT) começa nesta segunda (4). Conhecida como Lei da Repatriação, ela permite a regularização de recursos, bens ou direitos remetidos ou mantidos no exterior ou repatriados por residentes ou domiciliados no país, que não tenham sido declarados ou que tenham sido declarados incorretamente.
O regime foi estabelecido pela Lei nº 13.254/2016 e regulamentado pela Instrução Normativa nº 1.627. Bens, recursos e direitos devem ser provenientes de atividade lícita, conforme a lei.
Em troca da anistia de crimes relacionados à evasão de divisas, o contribuinte pagará 15% de Imposto de Renda e 15% de multa, totalizando 30% do valor repatriado. No primeiro momento. há uma presunção de boa-fé, mas futuramente, havendo dúvida sobre a origem dos recursos, o contribuinte poderá ser convocado para prestar esclarecimentos. A estimativa de arrecadação é de R$ 21 bilhões neste ano.
A declaração deve ser voluntária e informar fato novo, que não tenha sido objeto de lançamento, e deverá ser preenchida por meio de formulário eletrônico no site da Receita Federal. A data limite para adesão ao regime é 31 de outubro de 2016.
Para esclarecimentos, a Receita Federal divulgou uma lista de perguntas e respostas e orientações. O formulário deve ser preenchido por meio do Centro Virtual de Atendimento (e-CAC). 
 Fonte: Agência Brasil"
2016-04-06T14:28;PLP 257/2016, PROJETO DE LEI COMPLEMENTAR, REFINANCIAMENTO, DÍVIDA PÚBLICA, ESTADO, DISTRITO FEDERAL (BRASIL), AUMENTO, PRAZO, PAGAMENTO, DÍVIDA, REDUÇÃO, DESPESA DE PESSOAL, SERVIDOR PÚBLICO, CONTRARIEDADE.;PEQUENO EXPEDIENTE;"O SR. CHICO LOPES (PCdoB-CE. Sem revisão do orador.) - Sr. Presidente, eu vou, na mesma linha, referir-me ao Projeto de Lei Complementar nº 257, de 2016, que, no ajuste fiscal que faz nos Estados e Municípios, deixa os funcionários sem direito a aumento e sem direito à promoção. Isso tem implicações diretas sobre o bem-estar do serviço público e das pessoas que necessitam desse tipo de serviço.
	Peço ao Governo que mude de opinião e taxe o andar de cima, para não penalizar quem já ganha tão pouco.
	Sr. Presidente, solicito que meu pronunciamento de apoio ao servidor público brasileiro seja divulgado no programa A Voz do Brasil.

PRONUNCIAMENTO ENCAMINHADO PELO ORADOR
	Sr. Presidente, Sras. e Srs. Deputados, em defesa dos direitos dos trabalhadores e da qualidade dos serviços públicos, apresentei 31 emendas modificativas ao Projeto de Lei Complementar nº 257, de 2016, de autoria do Poder Executivo, que estabelece o Plano de Auxílio aos Estados e ao Distrito Federal e medidas de estímulo ao reequilíbno fiscal, por meio ações de controle financeiro e ajuste fiscal para o Governo.
	Avaliando que, da forma como está, a matéria penaliza os servidores públicos com a proibição de reajustes salariais e pode vir a prejudicar a qualidade da prestação dos serviços públicos com a proibição de novos concursos, apresentei propostas de mudança para defender os trabalhadores.
	As emendas apresentadas autorizam reajustes salariais aos servidores, solicitando que sejam preservados os reajustes que estejam dentro do percentual de vanação da inflação, pelo IPCA - Índice de Preços ao Consumidor Amplo. Destaco que o art. 3º do projeto, o mais nocivo, ao estabelecer que durante 24 meses os Estados e o Distrito Federal que celebrarem contrato com a União não poderão conceder vantagem, aumento ou reajuste, ou adequação de remunerações a qualquer título, a não ser por sentença judicial.
	Considero que não é correto que os servidores públicos sejam penalizados enfrentando proibição de reajustes, quando o Governo Federal, nos últimos 14 anos, se empenhou para promover uma política de valorização real anual dos salários, seja no Poder Público, seja na iniciativa privada, aí incluído o valor do salário mínimo.
	O trabalhador não pode pagar essa conta. Defendemos que o ajuste fiscal se dê com a taxação gradativa daqueles que ganham mais e, portanto, podem pagar mais, assim como com o imposto sobre grandes fortunas.
	Assim, as emendas que apresentei asseguram a permanência de reajustes salariais até o limite da inflação pelo IPCA e a continuidade da realização de concursos públicos, conforme a necessidade do Governo Federal, para garantia da qualidade dos serviços.
	Sabemos que a matéria foi acertada pelo Governo Federal com os Governadores, mas reafirmamos a necessidade de defesa dos trabalhadores. Precisamos de um ajste fiscal que não prejudique o lado social, as conquistas dos trabalhadores e do povo brasileiro, nem fira os direitos da categoria dos servidores, que são muito importantes para o avanço do País, também quanto à arrecadação e ao equilíbrio fiscal."
2016-04-13T15:20;"FORTALEZA (CE), ANIVERSÁRIO DE FUNDAÇÃO, HOMENAGEM.
SEGURANÇA PÚBLICA, GUARDA MUNICIPAL, ADMINISTRAÇÃO MUNICIPAL, FORTALEZA (CE), GESTÃO, AVALIAÇÃO POSITIVA.";PEQUENO EXPEDIENTE;"O SR. CHICO LOPES (PCdoB-CE. Sem revisão do orador.) - Sr. Presidente, 290 anos faz a quinta capital do País, Fortaleza, onde há sol o ano inteiro, serve bem quem a procura e é uma cidade da paz, do amor, do carinho, do carnaval, do candomblé, das quadrilhas e de um povo trabalhador. 
	Foi lá no Porto do Mucuripe que se impediu a entrada dos escravos no Brasil. Portanto, não há ódio no coração do povo cearense. Por isso, quero parabenizar todos nós que fazemos o Ceará, seja como político, seja como profissional. 
	Quero parabenizar também o Prefeito da cidade, que vem fazendo um bom trabalho, principalmente na segurança, por meio da Guarda Municipal, que ajuda a polícia, porque, infelizmente, há muita violência em Fortaleza."
2016-04-16T09:56;DCR 1/2015, DENÚNCIA POR CRIME DE RESPONSABILIDADE, DILMA ROUSSEFF, PRESIDENTE DA REPÚBLICA, IMPEACHMENT, COMISSÃO ESPECIAL, PARECER, ADMISSIBILIDADE, REJEIÇÃO.;COMO LÍDER;"O SR. CHICO LOPES (PCdoB-CE. Como Líder. Sem revisão do orador.) - Sr. Presidente, Sras. e Srs. Deputados, este é um momento importante para a vida nacional porque amanhã vamos decidir nesta Casa o destino democrático do nosso País.
	Tenho 30 anos de mandato. Venho do período do regime militar. Estive nos porões da ditadura, sou anistiado, mas há uma coisa que eu não consigo entender: como é que uma simples operação financeira ou contábil se transforma em cassação de mandato? Isso se chama forçação de barra. 
	Eu nunca vi pessoas indiciadas prenderem um delegado. Eu nunca vi pessoas que metem a mão no dinheiro que não é delas terem prestígio na praça e no mundo financeiro. Eu nunca vi as elites deste País terem a coragem de ir para o confronto com o povo. Usaram o regime militar e agora usam segmentos da imprensa deste País, do Judiciário, para promover uma cassação de uma maneira em que só quem sonha em chegar ao poder sem voto fica querido.
	Usar a Bandeira Nacional não é privilégio de nenhum segmento da sociedade, porque ela é do brasileiro, e não de quem é de partido de oposição ou de situação. 
Nós comunistas usamos a Bandeira na defesa intransigente do nosso País. Isso nós enfrentamos durante a Segunda Guerra Mundial. Eu não sei bem se V.Exas. que estão com essa fita ao pescoço têm a coragem de dar a vida na defesa intransigente do nosso País. (Muito bem! Palmas.)
	O dia de amanhã será decisivo. Não nasci ontem: tenho 77 anos, 50 deles na militância comunista. A manifestação não me mete medo, de jeito nenhum!
V.Exas. podem jogar pôquer muito bem, mas estão blefando! As ruas, as praças, o povo está sabendo que este é um golpe barato de pessoas que não têm respeito pela democracia; não têm respeito pela doméstica, que agora é operária; não têm respeito pelo negro, que agora está na universidade; não tem respeito pela prostituta, que continua sendo massacrada por esse tipo de política.
	Por que escolheram a sigla do PT? Antes, o golpe se deu por causa de nós comunistas. Eu me lembro bem de que os comunistas eram responsáveis pela péssima economia, como se a corrupção tivesse sido inventada agora. Mas a prisão de corruptos se deu agora. (Palmas.)"
2016-04-17T14:04;DCR 1/2015, DENÚNCIA POR CRIME DE RESPONSABILIDADE, DILMA ROUSSEFF, PRESIDENTE DA REPÚBLICA, IMPEACHMENT, COMISSÃO ESPECIAL, PARECER, ADMISSIBILIDADE, VOTO CONTRÁRIO.;REGISTRO DE VOTO;"O SR. CHICO LOPES (PCdoB-CE.) - Calma, gente! Eu estou emocionado. Eu pensei que vinha para uma reunião política, mas vim para o encontro de bons maridos e bons pais. Não fala ninguém que é desonesto, mas quando olho a cara, vejo bem uns cabras que já estiveram na Veja, estiveram na Lava-Jato, estiveram na imprensa, só não estiveram nas páginas sociais!
	Portanto, em nome de 54 milhões de brasileiros, eu voto ""não"" contra a ditadura desses cabras. (Palmas.)
	O SR. FELIPE BORNIER - Deputado Chico Lopes, do PCdoB do Ceará, votou ""não"", totalizando 62 votos."
2016-04-28T09:00;;HOMENAGEM;"Ata da 102ª (centésima segunda) Sessão da Câmara dos Deputados, Não Deliberativa Solene, matutina, da 2ª Sessão Legislativa Ordinária, da 55ª Legislatura, em 28 de abril de 2016. Às 9h20, o Sr. Alex Canziani, 4º Secretário, declarou aberta a sessão e deu por dispensada a leitura da ata da sessão anterior. O Sr. Presidente informou que a sessão destinou-se à homenagem aos 50 Anos do Conselho de Reitores das Universidades Brasileiras - CRUB; prestou as devidas homenagens; e convidou para compor a Mesa os Srs. Júlio Gregório Filho, Secretário de Estado de Educação do Distrito Federal e representante do Conselho da Secretaria de Educação - CONSED; Dr. Benedito Guimarães Aguiar Neto, Reitor da Universidade Presbiteriana Mackenzie - UPM e Presidente do CRUB; Minoru Martins Kinpara, Reitor da Universidade Federal do Acre - UFAC e Vice-Presidente do CRUB - Segmento Federal; Adélia Maria Carvalho de Melo Pinheiro, Reitora da Universidade Estadual de Santa Cruz - UESC, Vice-Presidente do CRUB - Segmento Estadual e Municipal, e Presidente da Associação Brasileira de Reitores de Universidades Estaduais e Municipais - ABRUEM; e Mário Cesar dos Santos, Reitor da Universidade do Vale do Itajaí - UNIVALI e Vice-Presidente do CRUB - Segmento Comunitário. O Sr. Presidente convidou todos a ouvir o Hino Nacional e proferiu discurso do Sr. Eduardo Cunha, Presidente da Câmara dos Deputados. Nos termos do § 2º do artigo 18 do Regimento Interno, assumiu a Presidência o Sr. Esperidião Amin e concedeu a palavra ao Sr. Alex Canziani, autor do requerimento. Assumiram, sucessivamente, a Presidência os Srs. Lelo Coimbra, nos termos do § 2º do artigo 18 do Regimento Interno; e Alex Canziani, 4º Secretário. O Sr. Presidente concedeu a palavra aos Srs. Hildo Rocha, pelo PMDB; Vitor Lippi, pelo PSDB; Onyx Lorenzoni, pelo Democratas; Chico Lopes, pelo PCdoB; Edmilson Rodrigues, pelo PSOL; e aos Srs. Júlio Gregório Filho e Benedito Guimarães Aguiar Neto, componentes da Mesa. Usaram da palavra pela ordem os Srs. Izalci, Mauro Pereira, Luiz Carlos Hauly e Lobbe Neto. O Sr. Presidente registrou a presença de convidados, reiterou as homenagens prestadas, agradeceu a presença de todos e, às 10h55, encerrou a sessão.

Carlos Manato
Presidente

Simão Sessim
Secretário

As notas taquigráficas desta Sessão Não Deliberativa Solene poderão ser solicitadas ao Departamento de Taquigrafia, Revisão e Redação - DETAQ."
2016-05-05T10:08;"EDUARDO CUNHA, DEPUTADO FEDERAL, PRESIDENTE DA CÂMARA DOS DEPUTADOS, DECISÃO JUDICIAL, SUPREMO TRIBUNAL FEDERAL (STF), AFASTAMENTO DO CARGO, ELOGIO.
IMPEACHMENT, DILMA ROUSSEFF, PRESIDENTE DA REPÚBLICA, CRIME DE RESPONSABILIDADE, INEXISTÊNCIA.";BREVES COMUNICAÇÕES;"O SR. CHICO LOPES (PCdoB-CE. Sem revisão do orador.) - Sr. Presidente, Sras. e Srs. Deputados, já que o Deputado Eduardo Cunha é pastor, deveria conhecer um pouco da Bíblia. ""Deus escreve certo por linhas tortas"". Estas linhas tortas foram a demora do Supremo Tribunal Federal, que não teve a ligeireza em resolver um problema desta natureza. Pelo menos, tiraram o bode da sala, e nós podemos respirar por algum tempo com a ausência de Eduardo Cunha.
	Não é possível um cidadão, Presidente da Câmara mais importante do País, manipular até Comissões, que dizem respeito a questões de partidos e de Deputados! Ele aprovou o mecanismo de afastamento de uma Presidente que não praticou nenhum crime. Ele é que cometeu diversos crimes! O máximo que ela poderia receber era uma multa, por ter infringido a Lei de Responsabilidade Fiscal.
	Acho que neste momento o povo brasileiro está de alma lavada. O povo brasileiro, que nunca tinha assistido a uma reunião da Câmara dos Deputados, naquele domingo 17, voltou os olhos para esta Casa: viu, mas não gostou.
	É preciso que os Deputados e as Deputadas comecemos a fazer com que esta Câmara volte a ser respeitada na sociedade. Nós não podemos continuar com essa prática de apenas um homem decidir o que tem é bom ou ruim para o povo brasileiro.
	Espero que o afastamento de Eduardo Cunha não seja somente desta Casa, mas também do convívio político, para que não contamine as pessoas que ainda acreditam na política.
	Portanto, com toda a sinceridade da minha alma, digo que hoje é um dia diferente. Hoje é um novo dia. Hoje é o dia em que podemos nos honrar de ser Deputados, de defender o povo, porque aos poucos aqueles que usam esta condição para enriquecer e fazer trampolim para a boa vida vão reconhecendo que a justiça tarda, mas não falha.
	Viva o povo brasileiro! 
Que Eduardo Cunha fique afastado desta Casa por pelo menos cem anos!"
