dataHoraInicio;keywords;tipoDiscurso;transcricao
2015-02-05T10:10;REFINARIA, PETRÓLEO BRASILEIRO (PETROBRAS), CEARÁ, CONSTRUÇÃO, SUSPENSÃO, GOVERNADOR, PROTESTO, SOLIDARIEDADE.;BREVES COMUNICAÇÕES;"O SR. CHICO LOPES (PCdoB-CE. Sem revisão do orador.) - Sr. Presidente, Sras. e Srs. Deputados, bom dia. Quero ser solidário com o Governador do Ceará no que diz respeito à refinaria para o Nordeste, principalmente para o nosso Estado.
	Sr. Presidente, Sr. Deputados, não entendo como a PETROBRAS suspende a construção, já encaminhada, de uma refinaria da PETROBRAS lá no Ceará, simplesmente porque, no balanço do terceiro trimestre, indicam que não é mais possível a construção. No entanto, a Medida Provisória nº 667, de 2015, já coloca trezentos e poucos milhões para a continuidade da nossa obra.
	Portanto, deixo aqui nosso protesto contra a falta de respeito com que fomos tratados no Ceará. Quero manifestar nossa solidariedade ao Governador. Estamos juntos com o Governador para lutar por esse investimento necessário não só para o Ceará, mas para todo o Nordeste, para criar condições...
	(O microfone é desligado.)
	O SR. PRESIDENTE (Carlos Manato) - Muito obrigado, nobre Deputado."
2015-02-09T14:36;UNIÃO NACIONAL DOS ESTUDANTES (UNE), ENCONTRO, RIO DE JANEIRO, REALIZAÇÃO, DEMOCRACIA, DEFESA, REGISTRO.;PEQUENO EXPEDIENTE;"O SR. CHICO LOPES (PCdoB-CE. Sem revisão do orador.) - Sr. Presidente, Sras. e Srs. Deputados, quero ressaltar a 9ª Bienal da União Nacional dos Estudantes - UNE, dos estudantes do Rio de Janeiro. No final das discussões pelas artes e pela participação do jovem na cultura brasileira, com a passeata até o Arpoador, foram colocadas as bandeiras da UNE e o nosso propósito de defender cada vez mais a democracia do nosso País.
	Portanto, parabenizo a direção da UNE, de todos os estudantes deste País, por esse evento da cultura. Nós temos que incentivar cada vez mais a cultura no Brasil, dado o elitismo dos artistas que não chegam ao grande público. 
	Portanto, nossos parabéns à UNE, a grande entidade dos estudantes do Brasil.
	O SR. PRESIDENTE (Carlos Manato) - Concedo a palavra ao Deputado Gonzaga Patriota, do PSB de Pernambuco, o mais patriota de todos. (Pausa.)"
2015-02-09T15:08;PETRÓLEO BRASILEIRO (PETROBRAS), OPERAÇÃO LAVA JATO, INVESTIGAÇÃO, DESVIO, RECURSOS, CORRUPÇÃO, APURAÇÃO, DEFESA, PRIVATIZAÇÃO, CONTRARIO, REFINARIA, PETROLEO, CEARA, INSTALAÇÃO, APOIO.;PELA ORDEM;"O SR. CHICO LOPES (PCdoB-CE. Pela ordem. Sem revisão do orador.) - Sr. Presidente, Sras. e Srs. Deputadas e Deputados, tenho o prazer e a responsabilidade de retornar hoje a esta tribuna para novamente abordar o tema que tem dominado o noticiário neste ano: a situação da PETROBRAS. 
	E o faço, Sr. Presidente, com plena consciência de que neste momento a situação daquela que é a maior empresa brasileira e uma das maiores empresas de todo o planeta vem sendo amplamente abordada e explorada, com interesses diversos, nem sempre em sintonia com as preocupações que são expressas quanto ao bom andamento dos trabalhos da empresa, quanto à solidez da PETROBRAS e à sua missão maior, que vai além da simples lógica de mercado, e alcança a tarefa de garantir recursos energéticos, financeiros e melhores condições de desenvolvimento para o País.
	Estamos atentos, Sr. Presidente, ao jogo político que está em cena neste momento, em que a sociedade reclama, com razão, providências quanto ao presente e ao futuro desse verdadeiro patrimônio do nosso povo, a PETROBRAS. Endossamos a cobrança pela devida apuração de toda a real situação da empresa e dos ataques que contra ela teriam sido desferidos internamente, conforme será apurado, a partir das denúncias que estão sendo feitas e das ações da Polícia Federal. Exigimos transparência nesse processo, que, como já foi dito, pode se estender por alguns anos, até que se tenha concretizada essa apuração, em toda a sua extensão e em toda a sua profundidade.
	Mas não podemos e não vamos, Sr. Presidente, Sras. e Srs. Deputados, permitir que esse debate e essas ações, que são necessárias, venham a dar margem a questionamentos sobre a própria natureza e sobre a própria razão de ser da PETROBRAS. Não assistiremos calados a vozes dos setores conservadores brasileiros se levantarem para propor a privatização da PETROBRAS ou a derrocada do Governo legitimamente eleito pelo povo brasileiro, tendo à frente a Presidenta Dilma Rousseff.
	Embora a Direita neste País tenha dificuldades de se reconhecer como direita e insista em pregar o golpismo, tendo dificuldades de compreender que em eleições não há terceiro turno, não vamos permitir que a PETROBRAS seja utilizada pelos conservadores para servir de pretexto a seus reais interesses: o de retornar ao poder, para desconstruir as impactantes conquistas sociais dos últimos 12 anos em nosso País e para novamente promover uma guinada reacionária, autoritária e neoliberalizante no Brasil.
	A PETROBRAS, conforme bem demonstrou neste domingo o jornal O Povo, publicado no meu Estado do Ceará, tem plena capacidade de se recuperar desta crise e de sair ainda mais fortalecida. Ao longo de tantos anos de atuação, a PETROBRAS passou por vários momentos delicados e desafiadores, em que o preço do petróleo no mercado internacional parecia inviabilizar a atuação da empresa. E este preço não tem nenhuma ligação com o Governo Federal, embora isso nunca seja dito pelos tucanos e demais setores conservadores. Mas a empresa se recuperou, venceu as dificuldades e saiu mais forte após enfrentá-las.
	Do mesmo modo, temos certeza de que este momento de atribulação será superado e que os investimentos e empreendimentos previstos para a ampliação e o fortalecimento da PETROBRAS serão mantidos.
	Eu sei, Sr. Presidente, que não terei tempo de ler todo o meu discurso, mas gostaria que fosse divulgado na íntegra nos órgãos de comunicação e no programa A Voz do Brasil. Nele, reclamo ainda da interrupção da construção da nossa refinaria no Ceará, onde já foram investidos mais de 600 milhões, e de um anúncio falso dizendo que a obra não vai acontecer. Nós queremos refinaria já no Ceará! 
	Obrigado, Sr. Presidente.
	O SR. PRESIDENTE (Carlos Manato) - V.Exa. será atendido, nobre Deputado.

PRONUNCIAMENTO ENCAMINHADO PELO ORADOR
	Sr. Presidente, Sras. e Srs. Deputados, tenho o prazer e a responsabilidade de retornar hoje a esta tribuna, para novamente abordar o tema que tem dominado o noticiário neste ano: a situação da PETROBRAS.
	E o faço, Sr. Presidente, com plena consciência de que neste momento a situação daquela que é a maior empresa brasileira e uma das maiores empresas de todo o planeta vem sendo amplamente abordada e explorada, com interesses diversos, nem sempre em sintonia com as preocupações que são expressas, quanto ao bom andamento dos trabalhos da empresa, quanto à solidez da PETROBRAS e à sua missão maior, que vai além da simples lógica de mercado, e alcança a tarefa de garantir recursos energéticos, financeiros e melhores condições de desenvolvimento para o nosso País.
	Estamos atentos, Sr. Presidente, ao jogo político que está em cena neste momento, em que a sociedade reclama, com razão, providências quanto ao presente e ao futuro desse verdadeiro patrimônio do nosso povo, que é a PETROBRAS. Endossamos a cobrança pela devida apuração de toda a real situação da empresa e dos ataques que contra ela teriam sido desferidos internamente, conforme será apurado a partir das denúncias que estão sendo feitas e das ações da Polícia Federal. Exigimos transparência nesse processo, que, como já foi dito, pode se estender por alguns anos, até que se tenha concretizada essa apuração, em toda a sua extensão e em toda a sua profundidade.
	Mas não podemos e não vamos, Sr. Presidente, Sras. e Sras. Deputados, permitir que esse debate e essas ações, que são necessárias, venham a dar margem a questionamentos sobre a própria natureza e sobre a própria razão de ser da PETROBRAS. Não assistiremos calados a vozes dos setores conservadores brasileiros se levantarem para propor a privatização da PETROBRAS ou a derrocada do Governo legitimamente eleito pelo povo brasileiro, tendo à frente a Presidenta Dilma Rousseff. Embora a Direita neste País tenha dificuldades de se reconhecer como direita e insista em pregar o golpismo, tendo dificuldades de compreender que em eleições não há terceiro turno, não vamos permitir que a PETROBRAS seja utilizada pelos conservadores para servir de pretexto a seus reais interesses: o de retornar ao poder, para desconstruir as impactantes conquistas sociais dos últimos 12 anos em nosso País e para novamente promover uma guinada reacionária, autoritária e neoliberalizante no Brasil.
	A PETROBRAS, conforme bem demonstrou neste domingo o jornal O Povo, publicado no meu Estado, o Ceará, tem plena capacidade de se recuperar desta crise e de sair ainda mais fortalecida. Ao longo de tantos anos de atuação, a PETROBRAS passou por vários momentos delicados e desafiadores, em que o preço do petróleo no mercado internacional parecia inviabilizar a atuação da empresa. E este preço não tem nenhuma ligação com o Governo Federal, embora isso nunca seja dito pelos tucanos, demistas e demais setores conservadores. Mas a empresa se recuperou, venceu as dificuldades, saiu mais forte após enfrentá-las.
	Do mesmo modo, temos certeza de que este momento de atribulação será superado e que os investimentos e empreendimentos previstos para a ampliação e o fortalecimento da PETROBRAS serão mantidos. É o caso da refinaria Premium II, de instalação prevista para o Estado do Ceará, equipamento aguardado há décadas pelo povo cearense e necessário para aumentar a capacidade de refino e de geração de lucros para a PETROBRAS, com produtos de maior valor agregado.
	Como temos ressaltado, apesar do tom que vem predominando no noticiário, que vem utilizando o relatório de balanço trimestral da PETROBRAS, referente ao terceiro trimestre de 2014, como única fonte para se informar que a refinaria não mais séria construída, temos diversos documentos oficiais que apontam em sentido contrário. Entre eles, a própria mensagem enviada pela Presidenta Dilma Rousseff a este Congresso Nacional, no dia 2 de fevereiro deste ano, em cujo texto a Presidenta deixa clara a importância da refinaria cearense para a evolução da PETROBRAS e para o desenvolvimento do Nordeste e de nosso País como um todo. Além disso, a Medida Provisória nº 667, assinada pelo Ministro do Planejamento, Nelson Barbosa, e pela Presidenta Dilma, estabelece liberação de 325 milhões de reais para a refinaria Premium II, no Ceará.
	Ou seja, existem documentos oficiais e recursos liberados para a continuidade do projeto. Por isso, seguiremos defendendo a PETROBRAS e, ao mesmo tempo, cobrando da empresa, do Ministério de Minas e Energia e do próprio Governo Federal um pronunciamento oficial sobre a refinaria do Ceará, empreendimento que continuamos acreditando que se concretizará. Por isso, inclusive, enviamos requerimento de informações à PETROBRAS e vamos promover, assim que possível, uma audiência publica na Comissão de Minas e Energia desta Casa. A refinaria é parte importante da continuidade da trajetória de conquistas da PETROBRAS.
	No plano político mais amplo, nós, que defendemos um Brasil de mercado interno fortalecido, de mais avanços sociais, de mais emprego e renda, mais dinheiro no bolso do cidadão e mais comida na mesa das famílias, de mais caminhos efetivos para a busca de uma vida melhor por meio da educação, estaremos sempre atentos ao real enfrentamento político, àquilo que está em jogo neste momento de tantos e tão variados ataques ao Governo Federal. A PETROBRAS seguirá, como um exemplo para o mundo, a revelar toda a capacidade do povo brasileiro, que com sua expertise e sua dedicação alcançou avanços e conquistas tecnológicas aplaudidas por todos. A Presidenta Dilma seguirá liderando o projeto popular de desenvolvimento, soberania e independência do Brasil, de aprofundamento nas mudanças sociais que conquistamos na última década, de concretização da real democracia, com mais igualdade de oportunidades, menos desequilíbrio e menores diferenças sociais.
	O povo brasileiro, consciente da necessidade de pleno e permanente combate à corrupção, em todas as instâncias, também é senhor do seu destino e das suas escolhas. E escolheu, democraticamente, seguir com a opção pela geração de emprego e renda, pela valorização do trabalho e do trabalhador, pelo aumento real do salário mínimo, pela proteção social que retirou da miséria 40 milhões de brasileiros, pelo acesso à universidade também para os filhos dos trabalhadores, pela melhoria dos serviços públicos, pela presença do Estado que não se furta ao seu papel de fomentar o desenvolvimento e preservar a dignidade humana. É esse novo Brasil, de tanta gente incluída tanto no plano da economia, quanto nos grandes debates da sociedade, que emergiu nos últimos 12 anos e que continuará cobrando, querendo e conquistando mais, avançando na radicalização de nossa democracia, e não seguindo no rumo conservador daqueles que procuram se aproveitar do momento para concretizar seu desejo de retornar ao poder.
	Acreditamos, sem a menor dúvida, que a PETROBRAS segue firme em seu caminho e que sairá ainda mais fortalecida, após este momento. Assim com o Governo Federal, que continuará encampando esse projeto popular e construindo, dia a dia, no campo da política e no campo da gestão, as mudanças pelas quais nossa população votou, as melhorias que nossa gente vem experimentando e que, temos certeza, com a luta de todos, poderemos ampliar e aprofundar, em prol do nosso povo.
	Que o enfrentamento político se faça no lugar certo e com os instrumentos devidos, como aqui, no Parlamento, espaço por excelência do debate de princípios e ações. Temos muito a fazer para buscar as melhorias necessárias, com a reforma política, a reforma tributária, a democratização da comunicação, a diminuição dos juros, o fortalecimento do mercado interno, a valorização da produção e do trabalhador, entre várias outras bandeiras que seguirão erguidas com a mesma coragem, independentemente das investidas conservadoras. Nossa gente não quer andar para trás. Nosso País vai, isto sim, continuar caminhando, a passos cada vez mais largos, rumo a um Brasil de mais justiça social, mais igualdade, mais oportunidades.
	Muito obrigado."
2015-02-11T10:06;DEDÉ DE CASTRO, EDMUNDO DE CASTRO, JORNALISTA, CEARÁ, FALECIMENTO, HOMENAGEM PÓSTUMA, ARTIGO DE IMPRENSA, AUTOR, PAULO VERLAINE, TRANSCRIÇÃO, ANAIS DA CÂMARA DOS DEPUTADOS.;BREVES COMUNICAÇÕES;"O SR. CHICO LOPES (PCdoB-CE. Sem revisão do orador.) - Sr. Presidente, Sras. e Srs. Deputados, agora de manhã, apresentei requerimento para constar nos Anais da Casa o artigo intitulado Dedé de Castro: Desaparece um dos últimos jornalistas românticos, de autoria do jornalista Paulo Verlaine.
	Dedé de Castro era um ex-udenista simpatizante inclusive do antigo partido da União Democrática Nacional - UDN, posteriormente convertido ao marxismo e ao PCB.
	Tivemos bom relacionamento com Dedé de Castro. Eu não era filiado a partido nenhum, mas lutamos pelo fim do regime militar. Depois, nós nos tornamos marxista também.
	Temos no Dedé de Castro um dos jornalistas - independente, não! - ligado sempre às causas populares e à democracia do nosso País.
	Muito obrigado, Sr. Presidente.

ARTIGO ENCAMINHADO PELO ORADOR

	Dedé de Castro - desaparece um dos últimos jornalistas românticos
	Com o falecimento de Edmundo de Castro, ocorrido na madrugada de segunda-feira, desaparece um dos últimos ícones da geração genial e romântica do jornalismo cearense. Para mim, baseado na vivência que tive com cada um deles, os seis grandes foram, por ordem alfabética: Durval Ayres, Edmundo de Castro, Fenelon de Almeida, J. C. de Alencar Araripe, Moraes Né e Odalves Lima. Houve outros grandes jornalistas desse período, claro, mas estou a referir-me apenas aos que tive a honra e o prazer de conviver pessoa Imente.
	Dos seis citados, três - Durval Ayres, Moraes Né e Odalves Lima - eram egressos de O Democrata, jornal do antigo Partido Comunista Brasileiro (PCB) e se consagraram depois no jornal O Povo. A escola da esquerda que ainda pontifica até hoje nesses inglórios tempos de ""nova direita""...
	Dedé de Castro era um ex-udenista (simpatizante do antigo partido União Democrática Nacional-UDN), posteriormente convertido ao marxismo e ao PCB.
	Perambutou (o verbo é esse mesmo, porque ele não era de esquentar lugar e engolir sapos) em todos os jornais de Fortaleza.
	Durval Ayres era também escritor consagrado, membro da Academia Cearense de Letras, editorialista de Gazeta de Notícias e O Povo. Um grande romancista, de espírito aberto e desprendido. Estilo elegante no manuseio do texto.
	Fenelon Almeida, também escritor, era esquerdista cristão e, nos seus últimos anos, voltado mais para a doutrina espírita, sem jamais abandonar a defesa das causas sociais. Com este convivi mais de perto - foi meu chefe no antigo Departamento de Pesquisa de O Povo - e com ele hauri inesquecíveis lições.
	Moraes Né era outro titã do jornalismo cearense. Dotado de impressionante cultura, escrevia sobre qualquer assunto com grande conhecimento de causa. Tinha temperamento explosivo, mas era homem pacato, simples, generoso e sempre disposto a ajudar os que se iniciavam na profissão. Foi o primeiro jornalista cearense a tratar com seriedade do problema do meio ambiente neste Estado. Mas era perfeito em tudo o que fazia.
	Odalves Lima, que se destacava como editorialista também no O Povo, tinha um dos melhores textos do Brasil, sem exagero. Um ás das ""pretinhas"" (gíria usada para designar as letras das velhas, hoje peças de museu, máquinas de escrever).
	J. C. de Alencar Araripe destoa do sexteto em termos ideológicos, não de competência e honradez: era, digamos, um centro-direitista, mas sempre valoroso e íntegro, que sabia reconhecer qualidades nos colegas dos quais ele discordava. Fez toda sua carreira no O Povo. Com ele, meu chefe superior (Feneton era chefe imediato), aprendi ensinamento que nunca esqueço: ""Tudo pode ser dito. Depende da maneira com que você diz"".
	Parafraseio Shakespeare (Júlio César, no discurso de Marco Antônio) e digo: ""Perdoai-me, mas tenho o coração neste momento, no ataúde de Dedé de Castro (Marco Antônio, no texto shakespeariano, referiu-se a César); é preciso calar até que ao peito ele me volte"".
	Conheci Edmundo de Castro antes de eu sonhar em ser jornalista. Em 1968, eu com 18, 19 anos, no meu primeiro emprego: operador de telefones da Empresa Brasileira dos Correios e Telégrafos (ECT), ainda com cara de DCT (Departamento dos Correios e Telégrafos), mas a mudança formal de repartição pública para empresa estatal já havia se realizado.
	Tomei susto ao saber que, a meu lado, trabalhava, na mesma função, um jornalista consagrado, autor de reportagens famosas e ganhador de vários prêmios de jornalismo. Era o Dedé de Castro, na época um quarentão. O setor: a Radiofonia da ECT. Era difícil (como ainda é hoje) sobreviver apenas com salário de jornalista. Não havia discagem direta à distância e as ligações era feitas pelos Correios, em turmas divididas em três turnos: manhã, tarde e noite, ligadas à central no Rio de Janeiro. Éramos da turma da noite. Chamava-me a atenção a maneira altiva com que Dedé tratava os colegas cariocas (alguns, não todos, eram meio boçais), com os quais nos comunicávamos para completar as ligações.
	Reencontrei-o dois anos depois no jornalismo, mais famoso ainda. Passamos então a conviver com mais frequência, principalmente nos bares de Fortaleza. Nas conversas, no meio das quais ele se autodenominava Dedé Beira D 'Água, aprendi a admirar aquele cidadão de Itapipoca, mais precisamente do Córrego dos Cajueiros, lugar que ele sempre fazia questão de citar. Gostava de repetir o verso da canção Argumento, de Paulinho da Viola: ""Sem preconceito, sem mania de passado, sem querer ficar do lado de quem não quer navegar"", que usou como slogan do Unitário, na sua curta e marcante temporada como editor deste jornal dos Diários Associados. Eu vibrava com os prêmios por ele conquistados (foram muitos). Em 1987 ganhou o Prêmio Esso de Jornalismo (o Nobel da imprensa brasileira) com a série ""O Nordeste por trás das grades"", publicada no Diário do Nordeste. Dedé de Castro editou também a revista cultural O Saco, fundada pelo poeta e livreiro Manoel Coelho Raposo, que revelou grandes talentos literários: Nilton Maciel, Carlos Emílio Corrêa Lima, Jackson Coelho, entre outros.
	A convivência se tornou maior quando fundamos, em 1977, o jornal alternativo Mutirão, juntamente com Francis Vale, Célia Guabiraba, Gervásio de Paula, Maria Luiza Fontenele, Rosa da Fonseca, Luiz Carlos Antero, Agamenon Almeida, Silas de Paula e outros. Edmundo de Castro assinava a coluna O Cacete do Dedé. Incomodava muita gente (os poderosos e os coleguinhas petulantes eram seu alvo predileto). Mutirão era mais influenciado pelo pessoal do Partido Comunista do Brasil (PCdoB), embora abrigasse pessoas de outras tendências.
	Em 1985, novo reencontro: desta vez no Diário do Nordeste, onde ele era pauteiro. Dedé foi um mestre do jornalismo, um guru, e nessa condição, teve discípulos, entre os quais eu também me incluo, juntamente com Francisco Bilas (falecido), Carlos Alberto Alencar, Neno Cavalcante, Mozarly Almeida e muitos outros.
	Nesses intervalos de locais de trabalho, sempre frequentava, periodicamente a casa de Dedé de Castro nas Damas, perto da Casa do Português, onde vivia ao lado da esposa, dona Nenen, e do filho Paulo Afonso, quando este era solteiro.
	Dedé de Castro foi e sempre será um dos meus tipos inesquecíveis.
	Adeus, amigo.
	Paulo Verlaine.
	Jornalista."
2015-02-11T11:04;CEARÁ, ENERGIA ELÉTRICA, TARIFA, AGÊNCIA NACIONAL DE ENERGIA ELÉTRICA (ANEEL), REAJUSTE, AVALIAÇÃO NEGATIVA.;PELA ORDEM;"O SR. CHICO LOPES (PCdoB-CE. Pela ordem. Pronuncia o seguinte discurso.) - Sr. Presidente, Sras. e Srs. Deputados, o aumento de tarifa de até 44% nas contas de energia dos consumidores cearenses, proposto pela Agência Nacional de Energia Elétrica - ANEEL, não pode ir adiante.
	Questionamos um reajuste tão alto para os consumidores industriais e uma elevação de 19,5% nas contas para os consumidores de baixa tensão, o que prejudica a economia do Estado, provoca perda de competitividade das empresas cearenses e implica risco de fechamento de postos de trabalho. A Companhia Energética do Ceará - COELCE atende 3,2 milhões de unidades consumidoras.
	Apesar do contexto desfavorável à produção de energia elétrica, o que é um fato, com a seca se tornando um desafio para várias regiões, não se justifica impor à economia cearense reajustes tão altos, que sem dúvida teriam um impacto na produção e no emprego.
	Por mais que o setor produtivo não repasse integralmente um reajuste tão elevado, de 44%, no insumo energia, não haverá como evitar aumento de preços, diminuição de investimento, perda de competitividade para nossas empresas e possível fechamento de postos de trabalho. Isso a sociedade cearense não aceita.
	Nos últimos 8 anos, integrei a Comissão de Defesa do Consumidor, sempre fiscalizando os reajustes e revisões tarifárias da energia elétrica, promovendo audiências públicas e campanhas de mobilização por preço justo da energia e pelo ressarcimento de R$8 bilhões cobrados indevidamente dos consumidores de todo o País.
	Procurando evitar que o novo aumento da tarifa chegue a percentuais tão elevados, vou apresentar requerimento de audiência pública na Comissão de Defesa do Consumidor, para que representantes da COELCE e da ANEEL prestem esclarecimentos sobre os percentuais divulgados para o Ceará. 
	As complicações deste momento com a seca e a geração de energia são conhecidas, mas, infelizmente, a ANEEL mais uma vez demonstra sua tendência em defender o direito das distribuidoras de energia, não o do consumidor.
	Ressalto que a inflação acumulada ao longo de 2014 foi de 6,41%. Assim, a revisão tarifária que a ANEEL defende é de mais de três vezes o percentual da inflação, para consumidores residenciais, e para consumidores industriais chega a mais de sete vezes a inflação.
	Por isso vamos promover audiência pública, chamando a ANEEL e a COELCE para dar explicações sobre essa proposta de aumento tarifário. Não podemos aceitar uma elevação tão grande no preço da energia, em um momento em que o Brasil, especialmente o Ceará, procuram voltar esforços para uma maior geração de emprego e renda, para mais empregos e mais desenvolvimento.
	Sr. Presidente, eu gostaria que este nosso discurso fosse divulgado no programa A Voz do Brasil e nos demais meios de comunicação da Casa. 
	Era o que tinha a dizer."
