dataHoraInicio;keywords;tipoDiscurso;transcricao
2016-10-25T16:22;APOIO, MANIFESTAÇÃO, VAQUEIRO, BRASÍLIA (DF), DEFESA, VAQUEJADA, RELEVÂNCIA, CULTURA NACIONAL.;DISCURSO ENCAMINHADO;"PRONUNCIAMENTO ENCAMINHADO À MESA PARA PUBLICAÇÃO

	O SR. JORGE CÔRTE REAL (Bloco/PTB-PE. Pronunciamento encaminhado pelo orador.) - Sr. Presidente, Sras. e Srs. Deputados, venho à tribuna para declarar meu apoio a uma manifestação cultural e desportiva genuinamente brasileira e nordestina: a vaquejada.
	Nos diversos rincões do nosso querido Nordeste, as vaquejadas são esperadas com muita expectativa pelo povo sertanejo, que vê nesses eventos uma forma de integração comunitária, uma festividade cultural - que hoje também é considerada prática desportiva - e, cabe assinalar, um incontestável meio de circulação de riquezas.
	De acordo com a Associação Brasileira da Vaquejada - ABVAQ, no período 2014-2015, foram movimentados cerca de 600 milhões de reais por ano, gerados 120 mil empregos diretos, 600 mil empregos indiretos e a circulação de 650 milhões de pessoas nos eventos desse porte realizados no País. 
	Nas palavras do maior folclorista brasileiro, Luís da Câmara Cascudo, ""a festa mais tradicional no ciclo do gado nordestino é a vaquejada"". Isso está escrito na página 5 de sua clássica obra A Vaquejada Nordestina e sua Origem, publicada em 1966.
	Se fizermos breve remissão às suas origens, veremos que a vaquejada é expressão cultural com origem na chamada Festa da Apartação, do século XVIII. Esse grande festejo era a ocasião em que os fazendeiros criadores e os vaqueiros se reuniam para separar o gado que havia se dispersado, uma vez que a pecuária extensiva da época ocorria em vastos campos.
	De acordo com o historiador Aírton de Farias, a festa acontecia numa fazenda previamente escolhida, e a pega do gado começava sempre na segunda-feira para ser levado à apartação na sexta-feira. Era essa a grande oportunidade de exibição da coragem e da destreza dos vaqueiros na perseguição e derrubada das reses. Era também momento de diversão e congraçamento entre vaqueiros, admiradores, proprietários e familiares.
	Temos, portanto, que essa antiga expressão cultural brasileira foi formada por meio da identificação de um povo em torno da realidade interiorana e pecuarista. À medida que os vaqueiros começaram a tornar públicas suas habilidades e as de seus cavalos na lida com o gado, os eventos começaram a se tornar cada vez mais populares. Esses hábitos, a convivência com os animais, a vestimenta e diversas outras características foram transmitidos de geração em geração com a força do povo nordestino.
	Se foi fundada como expressão cultural, hoje a vaquejada é também considerada um esporte. O chão de terra batida deu lugar a uma superfície de areia, com limites definidos, regulamento, ranking e distribuição de prêmios.
	Sr. Presidente, Sras. e Srs. Deputados, brasileiros de todo o País, especialmente do meu Nordeste, nesta oportunidade, registro minha aprovação ao grande movimento de mobilização nacional Eu apoio a vaquejada, que está sendo realizado hoje, dia 25 de outubro, aqui em Brasília, com vaqueiros, criadores, espectadores, enfim, todos nós que apoiamos e valorizamos essa honrosa tradição, que é bem histórico-cultural do povo brasileiro e manifestação desportiva de criação nacional.
	A Lei nº 10.220, de 2001, equiparou o vaqueiro ao atleta profissional, o que representou medida importante para a profissionalização do esporte. Precisamos avançar e, para tanto, importante se faz o debate com as diversas instâncias para empreendermos medidas efetivas com vistas à regulamentação, de uma vez por todas, da vaquejada como manifestação desportiva e cultural do nosso País. 
	Aqui desta tribuna, meus caros vaqueiros, quero que saibam que contam com o meu apoio. A vaquejada não pode acabar. Essa luta também é nossa!"
2016-11-29T19:02;ELOGIO, ORGANIZAÇÃO, SALÃO INTERNACIONAL DO AUTOMÓVEL DE SÃO PAULO, SÃO PAULO (SP).;DISCURSO ENCAMINHADO;"PRONUNCIAMENTO ENCAMINHADO À MESA PARA PUBLICAÇÃO

	O SR. JORGE CÔRTE REAL (Bloco/PTB-PE. Pronunciamento encaminhado pelo orador.) - Sr. Presidente, Sras. e Srs. Deputados aqui presentes, com 50 anos de sucesso, o Salão Internacional do Automóvel de São Paulo ainda consegue inovar e trazer um verdadeiro show. 
	No período de 10 a 20 de novembro, foi possível presenciar um espetáculo de lançamentos, atrações, inovações, experiências e interações marcantes para conectar as grandes marcas, quando apaixonados por carros se encontraram para vivenciar esta magia.
	O Salão do Automóvel é o 4º maior evento do mundo e um dos mais importantes eventos na economia brasileira, e contou com a participação de todas as marcas de automóveis comercializados no Brasil.
	Só para termos uma ideia de sua grandiosidade, o evento ocorreu numa área de 90 mil metros quadrados, onde foram expostos mais de 540 veículos. Foram mais de 150 lançamentos, mais de 100 horas de entretenimento, mais de 121 milhões de reais de mídia espontânea e mais de 4.300 profissionais da imprensa nacional e internacional envolvidos.
	Este é um evento que movimenta mais de 280 milhões de reais para a cidade de São Paulo. Gera mais de 30 mil empregos diretos e indiretos. Recebe a presença das principais autoridades do País e conta com o apoio de grandes entidades representativas do setor: a Associação Nacional dos Fabricantes de Veículos Automotores - ANFAVEA e a Associação Brasileira das Empresas Importadoras e Fabricantes de Veículos Automotores - ABEIFA.
	Como breve histórico, podemos relatar que o nascimento da primeira edição do Salão do Automóvel, ocorrida em 1960, reuniu 12 montadoras existentes na época: Willys Overland, DKW-Vemag, General Motors, Ford, FNM, Simca, Volkswagen, Toyota, Romi-Isseta, International Harvester, Scania Vabis e Mercedez Benz. Os destaques foram o Aero Willys, Renault Dauphine, Rural Willys, Kombi, Simca Chambord, FNM 2000 JK e Chevrolet Amazonas.
	Em 1970, foi inaugurado o Parque Anhembi, palco da realização da 7ª edição do Salão. As novidades desta edição foram: para o Ford Landau, o Chevrolet Opala SS, o Dodge Charger e Charger RT, o VW 1500 Fuscão, a VW Variant e o VW Karmann-Ghia TC. Entre os carros especiais, teve sucesso o Puma conversível.
	Em 1978, o 11º Salão celebrou a marca de 2 milhões de veículos fabricados no Brasil e a presença maciça de fabricantes de autopeças.
	Em 1990, o evento se internacionalizou, mostrando uma indústria nacional apta à concorrência mundial. Entre os importados, estavam a Ferrari F-40, o Toyota Crown, o Alfa Romeo 164, além do Thunderbird e a Aerostar, ambos da Ford. As montadoras nacionais apresentaram as novas gerações do Monza, Gol e Voyage, entre outros.
	Em 2000, o 21º Salão Internacional do Automóvel fechou com grandes lançamentos. Entre as novidades do Salão, estava o Audi A2, primeiro carro com carroceria totalmente em alumínio. A vedete da Chrysler foi o PT Cruiser, modelo em estilo retrô. O Citroen Xsara Picasso fez sua pré-estreia no Salão. A Ford apresentou o Focus, a Volvo mostrou o sedã S60, e a Volkswagen lançou o Bora, sucesso nos EUA.
	Em 2010, o 26º Salão Internacional do Automóvel marcou os 50 anos do evento, uma edição pródiga em novidades de todos os segmentos, em design, estilo e motorizações. Mostra o amadurecimento da engenharia brasileira e a maioridade da indústria, no que diz respeito à criatividade, eficiência dos modernos motores, menores índices de emissões de poluentes e rapidez de adaptação às novas e mutantes necessidades mercadológicas - uma grande festa, com um dos grandes vencedores: o cidadão e o consumidor.
	Em 2015, a 28ª edição do Salão do Automóvel foi recorde em visitação. Mais de 750 mil pessoas puderam conhecer mais de 150 incríveis lançamentos automobilísticos. Pela primeira vez, o evento reservou uma área exclusiva para três diferentes test drives. Cerca de 5 mil visitantes tiveram a oportunidade de dirigir diversas máquinas automobilísticas. A réplica do DeLorean utilizada em De Volta para o Futuro, o simulador de Stock Car e a pista da Hot Wheels também foram grandes destaques desta edição.
	Nesta 29ª edição do Salão Internacional do Automóvel, até o domingo 20 de novembro, data do seu encerramento, a feira recebeu mais de 715 mil visitantes, com índice de satisfação de 95% por parte daqueles que compareceram à feira.
	Neste ano, o Salão Internacional do Automóvel mudou de endereço e está sendo exibido no São Paulo Expo Exhibition & Convention Center, que veio para apresentar à comunidade de eventos nacionais e internacionais um dos mais modernos espaços para a realização de eventos da América Latina, numa excelente área, com muito espaço para circulação e exposição, que também conta com ambientes climatizados, oferecendo ao visitante conforto e comodidade.
	Por tudo isso, Sr. Presidente, Sras. e Srs. Deputados, parabenizo a ANFAVEA, a ABEIFA e a Reed Exhibitions Alcântara Machado pela realização de mais este grande evento para o nosso País. 
	Muito obrigado."
2016-11-30T16:58;"OLIMPÍADA DO CONHECIMENTO, 2016, REALIZAÇÃO, BRASÍLIA (DF).
EDUCAÇÃO E FORMAÇÃO PROFISSIONAL, IMPORTÂNCIA, DEFESA, AMPLIAÇÃO.";DISCURSO ENCAMINHADO;"PRONUNCIAMENTO ENCAMINHADO À MESA PARA PUBLICAÇÃO

	O SR. JORGE CÔRTE REAL (Bloco/PTB-PE. Pronunciamento encaminhado pelo orador.) - Sr. Presidente, Sras. e Srs. Deputados, a Olimpíada do Conhecimento 2016, maior competição de educação profissional das Américas, realizada de 10 a 13 de novembro, em Brasília, mostrou ao País a importância da educação profissional e o papel essencial dos profissionais técnicos na sociedade brasileira. 
	Jovens e suas famílias tiveram a oportunidade de conferir as habilidades exigidas pelo mundo do trabalho e confirmar que educação profissional é importante para a construção de uma carreira bem-sucedida. Mais de 118 mil visitantes puderam ver de perto a excelência da educação profissional oferecida nas escolas do Serviço Nacional de Aprendizagem Industrial - SENAI e nos Institutos Federais de Educação na maior competição de educação profissional das Américas.
	A grandiosidade do evento, em sua 9ª edição, demonstrou a importância conferida pelo Sistema Indústria à educação voltada ao mundo do trabalho. A competição voltou à Capital Federal após 15 anos e reuniu 1.200 competidores: alunos do SENAI, dos Institutos Federais, do Serviço Social da Indústria - SESI e de escolas públicas. 
	O novo formato da competição, com desafios individuais e por equipe, criou um ambiente inspirador que aumentou o interesse pelas profissões técnicas e mostrou aos visitantes o futuro do mercado. Além de projetos na área automobilística e da construção civil, em outras cinco áreas tecnológicas, os estudantes também apresentaram soluções e produtos criativos e inovadores para empresas e para a sociedade, em uma demonstração de que nossos jovens, se bem qualificados e estimulados, podem se tornar profissionais de alto nível.
	Profissionais bem formados são mais produtivos e capazes de propor soluções e inovações nas empresas. Por isso, são decisivos para a expansão da indústria e o desenvolvimento econômico e social do País. Realizado também durante a Olimpíada do Conhecimento, o Inova SENAI expôs 30 projetos, elaborados por alunos, professores, consultores e técnicos - uma forma de estimular o espírito empreendedor nos nossos jovens. 
	No Gran Prix de Inovação, outra competição durante o torneio, equipes de estudantes tiveram 72 horas para apresentar soluções inovadoras a problemas reais de quatro grandes empresas brasileiras: Bosch, Grupo Boticário, Renault e Lake's Fish. O objetivo foi desenvolver a capacidade empreendedora e a inovação dos estudantes e aproximar o ambiente inovativo às necessidades do empresariado nacional.
	A Olimpíada do Conhecimento também é uma forma de estimular, desde cedo, o gosto pelas ciências, tecnologias e matemática, um incentivo à formação dos futuros engenheiros que vão revolucionar a indústria no futuro. 
	Durante o evento, o SENAI ainda avaliou, de forma prática, a qualidade de cinco cursos técnicos e três de qualificação. A partir de exames, a instituição pretende adotar medidas para melhorar a gestão e aprimorar seu trabalho pedagógico em todo o País. O SENAI é a primeira instituição a realizar exames de avaliação do ensino técnico no Brasil, desde que o Sistema de Avaliação da Educação Profissional - SAEP foi criado, em 2009. O teste é anual e padronizado nacionalmente. A partir de 2017, o exame prático será aplicado nas escolas do SENAI, também por amostragem, de forma padronizada para todo o Brasil.
	A Olimpíada do Conhecimento é prova de que a educação profissional praticada no Brasil, e especialmente no SENAI, é de excelência. Forma pessoas conectadas com as novas tecnologias e desenvolve as habilidades técnicas e pessoais requeridas pelo mercado de trabalho. Os alunos do SENAI ficaram em primeiro lugar em 2015 na WorldSkills, a competição internacional de profissões técnicas que reuniu 1.189 competidores de 59 países em agosto do ano passado, em São Paulo. Os alunos do SENAI venceram países cuja educação é referência em todo o mundo, como Coreia do Sul, Japão e Alemanha.
	O que falta ao País é eleger a educação profissional como projeto de Estado e expandir a oferta desse tipo de formação. No ano passado, 11% dos jovens brasileiros cursavam o ensino médio junto concomitantemente com algum curso técnico. Em 2008, esse percentual era de 6,6%. Mesmo com o aumento, o Brasil ainda está muito distante das nações desenvolvidas. Nos países da União Europeia, esse número é de 49,9%, em média. Na Áustria, por exemplo, 76,8% dos estudantes do secundário fazem ensino técnico; a Finlândia vem em seguida, com 69,7%, e, depois, a Alemanha, com 51,5%. 
	A educação profissional é uma opção para a construção de uma carreira bem-sucedida pelo jovem. Mais de 80% dos jovens brasileiros não têm acesso à universidade. A educação profissional pode ser um caminho para prepará-los para o mundo produtivo e facilitar, inclusive, que posteriormente sigam para um curso superior. 
	Os jovens brasileiros acreditam que cursos de educação profissional são importante caminho para conseguir o primeiro emprego. É o que aponta a pesquisa Os Jovens, a Educação e o Ensino Técnico, feita em outubro deste ano pelo SENAI. 
	Aliada à educação básica de qualidade, a formação profissional é um dos pilares da inovação e do aumento da produtividade e da competitividade da indústria brasileira. Trabalhadores qualificados são capazes de utilizar e interpretar as novas tecnologias, antecipar tendências e propor novos produtos e processos mais eficientes. 
	Por tudo isso, Sr. Presidente, Sras. e Srs. Deputados, ampliar a base de conhecimentos e a formação profissional dos brasileiros é fundamental para o desenvolvimento do Brasil. Para competirmos no mercado internacional, precisamos superar a pauta de exportação baseada em itens industriais de baixo valor agregado, em favor de um número maior de produtos intensivos em tecnologia. Para isso, é necessário investir na qualificação dos nossos trabalhadores.
	Muito obrigado."
2016-12-13T21:38;MIGUEL ARRAES DE ALENCAR, EX-GOVERNADOR, PERNAMBUCO, ANIVERSÁRIO DE NASCIMENTO, HOMENAGEM.;DISCURSO ENCAMINHADO;"PRONUNCIAMENTO ENCAMINHADO À MESA PARA PUBLICAÇÃO

	O SR. JORGE CÔRTE REAL (Bloco/PTB-PE. Pronunciamento encaminhado pelo orador.) - Sr. Presidente, Sras. e Srs. Deputados aqui presentes, hoje, dia 15 de dezembro, comemoramos o centenário de nascimento do ex-Governador de Pernambuco Miguel Arraes de Alencar, um grande líder político para Pernambuco e para todo o Brasil.
	Miguel Arraes era cearense de nascimento, mas percorreu sua vida e carreira política em Pernambuco, onde foi eleito Deputado Estadual, Deputado Federal, Prefeito do Recife e Governador do Estado.
	Arraes finalizou os estudos na cidade do Crato, no Ceará, pouco antes de se mudar para o Recife, a Capital de Pernambuco. Na nova cidade, Arraes conquistou espaço, fincou raízes. Foi aprovado em concurso público para trabalhar no antigo Instituto do Açúcar e do Álcool (IAA), onde conheceu Barbosa Lima Sobrinho, ex-Presidente do IAA, que o levou para a vida pública.
	Já em 1948, Barbosa Lima, então Governador de Pernambuco, sentindo a sua vocação para a política, convidou Arraes para o cargo de Secretário Estadual da Fazenda.
	Foi nesse momento, caros colegas, que Miguel Arraes começou a sua caminhada política, que o levaria a ocupar os cargos públicos de Deputado Estadual, por 2 mandatos seguidos, Prefeito do Recife, até chegar ao Governo do Estado, em 1962. Arraes fez um Governo voltado ao povo, voltado, principalmente, ao sertanejo, assim como ele próprio.
	Tudo isso, Sr. Presidente, faz com que Arraes ainda hoje seja lembrado pela forma de governar. Diziam que Arraes era o político que melhor sabia administrar o silêncio. E essa frase já diz muito sobre seu jeito de ser e de governar. Arraes tinha uma forma única de administrar. Fazia o trabalho com maestria, ouvindo o povo, sem se importar com classe social, cor, credo. Ouvir, aliás, era o que ele fazia de melhor. Ouvir os problemas do cidadão comum e solucioná-los, de forma que a solução ajudasse o bem maior.
	Assim, sertanejo como era, conseguiu alcançar o topo da política fazendo o que mais sabia fazer: ouvir e administrar as informações assimiladas. O seu Governo foi marcado por programas sociais de destaque na área de educação e principalmente no setor rural.
	Não é por acaso que hoje estamos celebrando o centenário desse político tão importante. As ações de seus primeiros Governos ficaram marcadas até hoje nos Anais da política pernambucana.
	Exemplos para citar temos muitos, mas, de especial, vale lembrar do Acordo do Campo, que regulamentou as relações trabalhistas entre canavieiros e donos de usinas naquela época.
	Ainda durante seu primeiro mandato de Governador, em 1964, no dia 1º de abril, os militares deram início ao regime militar que depôs o Presidente João Goulart. Na ocasião, Arraes foi um dos únicos Governadores que se opuseram ao novo regime, sendo preso no Palácio do Campo das Princesas, sede do Governo de Pernambuco, no centro do Recife. Passou 15 meses preso, no início na Ilha de Fernando de Noronha e posteriormente na cidade do Rio de Janeiro. Após conseguir sair da prisão por intermédio de um habeas corpus, seguiu para o exílio na Embaixada da Argélia.
	Com o clima político se agravando no Brasil, Arraes foi morar, como exilado político, na Argélia. Passou 14 anos morando na Capital do País, Argel, até conseguir voltar ao Brasil, já em 1979, época em que foi decretada a anistia pelos militares.
	De volta a um Brasil renovado, tendendo à redemocratização, Arraes se filiou ao Partido do Movimento Democrático Brasileiro (PMDB). Pelo partido, Arraes foi eleito Deputado Federal em 1982. 
	De volta à vida pública, Miguel Arraes se candidatou ao Governo em 1986, sendo eleito Governador de Pernambuco pela segunda vez. Seu segundo mandato foi, assim como o primeiro, marcado por programas voltadas ao trabalhador rural e ao pequeno agricultor. Entre eles, vale lembrar do Vaca na Corda, programa que financiava a compra do animal pelo pecuarista, e o programa Chapéu de Palha, que ajudava o canavieiro no período entressafra, empregando-os na construção civil e em obras públicas. Novamente Arraes entrava para a história como um dos grandes governantes de Pernambuco.
	Em 1990 ajudou a fundar o Partido Socialista Brasileiro (PSB), tornando-se Presidente Nacional. Pelo PSB, Arraes foi eleito novamente Deputado Federal até 1994. Em 1995, Arraes assume pela terceira vez o cargo de Governador de Pernambuco. Depois de perder a reeleição para o quarto mandato, Arraes se elege mais uma vez como Deputado Federal, que viria a ser seu último cargo público.
	Arraes faleceu em 13 de agosto de 2005, aos 88 anos. É lembrado até hoje, mais de 10 anos após sua morte, como um dos grandes líderes que Pernambuco e o Brasil já tiveram.
	Muito obrigado."
2017-03-15T10:00;;HOMENAGEM;"Ata da 32ª (trigésima segunda) Sessão da Câmara dos Deputados, Não Deliberativa Solene, matutina, da 3ª Sessão Legislativa Ordinária, da 55ª Legislatura, em 15 de março de 2017. Às 10h23, o Sr. Rômulo Gouveia, 4º Secretário, no exercício da Presidência, declarou aberta a sessão e deu por dispensada a leitura da ata da sessão anterior. O Sr. Presidente informou que a sessão destinou-se à homenagem ao Político, Advogado e Professor Marco Maciel; prestou as devidas homenagens; e convidou para compor a Mesa os Srs. Augusto Coutinho, Deputado Federal; Ana Maria Maciel e João Maurício Maciel, esposa e filho do homenageado; José Sarney, ex-Presidente da República; Mendonça Filho, Ministro da Educação; João Lyra Neto, ex-Governador de Pernambuco; Fernando Bezerra e Armando Monteiro Neto, Senadores da República; Jarbas Vasconcelos, Deputado Federal e ex-Governador de Pernambuco; e José Agripino Maia, Senador da República. O Sr. Presidente convidou todos a ouvir o Hino Nacional. Após a exibição do vídeo comemorativo, o Sr. Presidente citou discurso do Sr. Rodrigo Maia, Presidente da Câmara dos Deputados; e concedeu a palavra aos Srs. Augusto Coutinho, autor do requerimento; Guilherme Coelho, pelo PSDB; André de Paula, pelo PSD; Carlos Melles, pelo Democratas; e Mendonça Filho, componente da Mesa. Nos termos do § 2º do artigo 18 do Regimento Interno, assumiu a Presidência o Sr. Augusto Coutinho e concedeu a palavra aos Srs. Heráclito Fortes, pelo PSB; Paes Landim, pelo PTB; Alexandre Baldy, Líder do PTN; Arolde de Oliveira, pelo PSC; Pollyana Gama, pelo PPS; Silvio Costa, pelo PTdoB; e Cleber Verde, Líder do PRB. Usaram da palavra pela ordem os Srs. Jorge Côrte Real, Alex Canziani, Benito Gama, Tadeu Alencar, Rubens Bueno, José Carlos Aleluia, Simão Sessim e Junior Marreca. Usou ainda da palavra a Sra. Ana Amélia, Senadora da República. O Sr. Presidente registrou a presença de convidados, reiterou as homenagens prestadas, agradeceu a presença de todos e, às 12h33, encerrou a sessão.



Carlos Manato
Presidente

Alex Canziani
Secretário

As notas taquigráficas desta Sessão Não Deliberativa Solene poderão ser solicitadas ao Departamento de Taquigrafia, Revisão e Redação - DETAQ."
