dataHoraInicio;keywords;tipoDiscurso;transcricao
2017-04-24T20:00;REALIZAÇÃO, GARANHUNS (PE), FESTA POPULAR, HOMENAGEM, DOMINGUINHOS, CANTOR, PERNAMBUCO.;DISCURSO ENCAMINHADO;"PRONUNCIAMENTO ENCAMINHADO À MESA PARA PUBLICAÇÃO	
	O SR. JORGE CÔRTE REAL (Bloco/PTB-PE. Pronunciamento encaminhado pelo orador.) - Sr. Presidente, Sras. e Srs. Deputados, entre os últimos dias 20 e 22 de abril, foi realizada a quarta edição do festival Viva Dominguinhos, na cidade de Garanhuns, no Agreste pernambucano. 
	Produzido e realizado pela Prefeitura de Garanhuns, na gestão do Prefeito Izaías Régis, o evento não é apenas um grande receptor de capital turístico para o Município, mas também uma justa homenagem a José Domingos de Morais, o nosso Mestre Dominguinhos.
	O evento gratuito é constituído por 3 dias de apresentações, que se iniciaram na noite da quinta-feira e perduraram até a noite do sábado, período em que vários artistas locais e nacionais fizeram releituras das músicas de Dominguinhos, construindo assim uma grande homenagem ao Mestre. Entre os variados ritmos tocados, o forró se sobressaiu, consagrando a reverência à cultura pernambucana entre os cidadãos que prestigiaram os shows. 
	Natural de Garanhuns, Dominguinhos foi um conceituado instrumentista, cantor e compositor. Como sanfoneiro se fez conhecido em todo o território nacional, tendo sido, inclusive, pupilo de Luiz Gonzaga, nosso eterno Rei do Baião. 
	Dominguinhos foi responsável por grandes obras da música pernambucana e nordestina, carimbando sua passagem na história da música brasileira. Suas composições lhe renderam vários prêmios nacionais e internacionais, uma forma justa de demonstrar toda a sua sabedoria sobre a arte.
	Mas a vida de Dominguinhos não começou fácil. Assim como vários nordestinos, teve que abandonar sua casa rumo ao Rio de Janeiro quando ainda era uma criança. Junto com sua família, foi para o Sudeste com apenas 13 anos de idade, período em que se aproximou mais de Luiz Gonzaga. 
	Um pouco antes da ida para o Rio de Janeiro, o Rei do Baião fez uma visita à cidade de Garanhuns, onde conheceu Neném do Acordeom, como era conhecido o jovem Dominguinhos em Garanhuns. Na ocasião, o Rei do Baião identificou o dom natural do garoto e o convidou a ir para o Rio de Janeiro aprender mais sobre música. Já em terras fluminenses, Gonzaga o presenteou com uma sanfona de oitenta baixos. A parceria continuou. Dominguinhos passou a ser aprendiz de Gonzaga, acompanhando-o em shows e apresentações por todo o País. E Dominguinhos não parou por aí. Ele se mostrou tão bom quanto seu mestre e consagrou seu nome como um dos melhores artistas brasileiros.
	Com todo esse histórico de vida e produção musical, Dominguinhos virou referência na música pernambucana. Hoje, por exemplo, não há uma só festa de São João que não toque ao menos uma música de sua autoria. Ele é um símbolo da garra que tem o nordestino, que luta contra todas as dificuldades e vence os desafios.
	Considerei, então, necessário fazer este discurso para parabenizar a Prefeitura de Garanhuns pela realização dessa festa tão bonita. Acredito que essa iniciativa é um exemplo a ser seguido em todo o nosso País. Precisamos sempre relembrar os nossos ídolos e não deixar que suas obras sejam esquecidas.
	Muito obrigado."
2017-08-02T14:36;PARECER CONTRÁRIO, COMISSÃO DE CONSTITUIÇÃO E JUSTIÇA E DE CIDADANIA (CCJC), SIP 1/2017, SOLICITAÇÃO PARA INSTAURAÇÃO DE PROCESSO, AUTORIZAÇÃO, INVESTIGAÇÃO, SUPREMO TRIBUNAL FEDERAL (STF), DENÚNCIA, MINISTÉRIO PÚBLICO FEDERAL (MPF), MICHEL TEMER, PRESIDENTE DA REPÚBLICA, VOTO FAVORÁVEL.;REGISTRO DE VOTO;"O SR. JORGE CÔRTE REAL (Bloco/PTB-PE.) - Sr. Presidente, o que este País precisa é de estabilidade para que se façam, se providenciem as reformas estruturais e passamos a um desenvolvimento sustentável. Para isso, o meu voto é ""sim"".
	O SR. GIACOBO - Deputado Jorge Côrte Real: voto ""sim"". Total: 251 votos."
2017-08-16T15:44;ESTÁGIO CURRICULAR SUPERVISIONADO, ESTAGIÁRIO, DEFESA.;DISCURSO ENCAMINHADO;"PRONUNCIAMENTO ENCAMINHADO À MESA PARA PUBLICAÇÃO
	O SR. JORGE CÔRTE REAL (Bloco/PTB-PE. Pronunciamento encaminhado pelo orador.) - Sr. Presidente, Sras. e Srs. Deputados aqui presentes, em 25 de setembro de 2008, foi sancionada a Lei n° 11.788, que regulamentou o estágio como um ato educativo escolar supervisionado e desenvolvido no ambiente de trabalho.
	Ao estimular a realização de estágios, teremos a certeza de desenvolver futuros profissionais que contribuirão para a competitividade das empresas no País.
	Muitos foram os avanços obtidos com a Lei do Estágio, dentre os quais podemos citar as definições claras das responsabilidades dos direitos e dos deveres das partes envolvidas no estágio, que foram determinantes para tornar profícua a relação de estágio no Brasil. 
	A clareza e o detalhamento apresentados na lei trouxeram várias inovações, a saber: o limite da jornada de estágio, a instituição de recesso para o estagiário, a aplicação da legislação de saúde e segurança no trabalho para o estagiário e a segurança na execução e formalização do estágio. 
	Cito ainda, alguns benefícios que a lei trouxe para o estagiário:
	•	preparação para atuação no mercado de trabalho; 
	•	compreensão melhor da prática real de sua profissão;
	•	apoio na escolha profissional;
	•	complemento da formação acadêmica; 
	•	se tornar um profissional diferenciado, a partir da experiência adquirida no estágio;
	•	desenvolvimento de competências essenciais para o mundo do trabalho.
	Para a empresa:
	•	formação de capital humano; 
	•	atração e retenção de novos talentos; 
	•	absorção de novas ideias e métodos inovadores com a oportunidade de arejar seus processos.
	E, para a instituição de ensino:
	•	auxílio na definição dos currículos das instituições de ensino;
	•	atesta sua importância como difusora do conhecimento e testa a aplicação prática dos conteúdos acadêmicos;
	•	favorece a aplicação prática de novas metodologias desenvolvidas por meio de pesquisas; 
	•	oferece melhor conhecimento do mundo produtivo e suas transformações e demandas. 
	Cabe aqui destacar os serviços prestados pelo o Instituto Euvaldo Lodi - IEL, instituição criada em 1969 pela Confederação Nacional da Indústria (CNI), em conjunto com o Serviço Nacional de Aprendizagem Industrial (SENAI) e o Serviço Social da Indústria (SESI), que participou ativamente dos estudos e discussões para construção dessa lei e, logo após a sua promulgação, em 2009, elaborou a cartilha da Lei do Estágio.
	O programa de estágio se tornou o projeto-símbolo do IEL, que, ao longo dos anos, ampliou sua abrangência. Além de promover a integração somente entre indústrias e universidades, passou a atender também, por meio de seus Núcleos Regionais nos 26 Estados e no Distrito Federal, todos os segmentos empresariais, instituições de ensino e órgãos de Governo.
	O IEL auxilia as empresas como agente de integração na oferta de programas de capacitação de estagiários, apoiando as empresas no desenvolvimento de competências comportamentais dos jovens para o mercado de trabalho, por meio do Programa Foco na Carreira, na atuação padronizada da operação dos programas de estágio em todo o Brasil com os seus clientes e parceiros, na realização de processos de recrutamento e seleção de estagiários, na oferta de autosserviços para estagiários, empresas e instituições de ensino no acompanhamento do estágio via web, pelo Sistema Nacional de Estágio, e na elaboração de programas diferenciados e customizados para atender às necessidades das indústrias.
	Desde 2007, o IEL instituiu o Prêmio IEL de Estágio, que tem como objetivo reconhecer e premiar as melhores práticas de estágio em todo o Brasil.
	Em 2016, o Instituto atendeu cerca de 93 mil estagiários em todo o Brasil, atuando em parceria com 6 mil novas instituições de ensino e 19 mil empresas, totalizando mais de 1,8 milhão de estagiários em todo o País. 
	Em 2017, foram realizados, no primeiro semestre, 46 mil estágios intermediados pelo IEL.
	Todas essas informações corroboraram para que, em 2013, eu propusesse o Projeto de Lei nº 7.012, aprovado nas Comissões de Cultura e de Constituição e Justiça e de Cidadania, instituindo o dia 18 de agosto como o Dia Nacional do Estagiário no Brasil. A proposição tem o objetivo de valorizar a iniciativa de jovens que estudam e, ao mesmo tempo, se dedicam ao estágio como modo de complementar sua formação.
	Estou certo, Sr. Presidente, de que o estágio deve ser valorizado como modo de aperfeiçoamento das competências e das boas práticas profissionais, que formarão jovens diferenciados e mais bem preparados para o mundo do trabalho competitivo.
	Conclamo, então, os nobres Parlamentares desta Casa para, juntos, valorizarmos essa força produtiva dos jovens brasileiros, apoiando-os em sua jornada profissional, e instituindo o Dia Nacional do Estagiário em 18 de agosto, portanto, nesta sexta-feira.
	Muito obrigado!"
2017-08-30T00:00;ORIENTAÇÃO DE BANCADA, VETO 19/2017, VETO PARCIAL, PLV 11/2017, PROJETO DE LEI DE CONVERSÃO, MPV 762/2016, MEDIDA PROVISÓRIA, PARTIDO TRABALHISTA BRASILEIRO (PTB) (1980), VOTO CONTRÁRIO.;ORIENTAÇÃO DE BANCADA;"O SR. JORGE CÔRTE REAL (Bloco/PTB - PE. Para encaminhar. Sem revisão do orador.) - Presidente, essa manutenção da AFRMM é fundamental para as Regiões Norte e Nordeste. Nós não temos uma política de desenvolvimento regional definida neste País, e isso significa uma indução à manutenção da nossa indústria, que produz com dificuldade nessas regiões e também funciona como uma possibilidade boa de instalação de novas indústrias.
Então, nós, absolutamente, não encaramos como subsídio, mas, sim, como um incentivo a diminuir a diferença regional que hoje existe entre o Norte e o Nordeste e outras regiões. 
Conclamamos, então, principalmente as Bancadas do Norte e do Nordeste para que consigamos derrubar esse veto.
O voto é ""não""."
2017-10-25T09:48;RESULTADO, ALUNO, ENSINO PROFISSIONALIZANTE, COMPEONATO, WORLDSKILLS (2017, ABU DHABI (EMIRADOS ÁRABES UNIDOS)).;DISCURSO ENCAMINHADO;"PRONUNCIAMENTO ENCAMINHADO À MESA PARA PUBLICAÇÃO
	O SR. JORGE CÔRTE REAL (Bloco/PTB-PE. Pronunciamento encaminhado pelo orador.) - Sr. Presidente, Sras. e Srs. Deputados, em 19 de outubro de 2017, o Brasil se consagrou na elite da educação profissional do mundo, conquistando o 2º lugar geral na Worldskills, a maior competição de educação profissional do mundo, realizada a cada 2 anos. 
Os melhores alunos de países das Américas, da Europa, da Ásia, da África e do Pacífico Sul disputam medalhas em modalidades que correspondem às profissões técnicas da indústria e do setor de serviço. Os competidores precisam demonstrar habilidades individuais e coletivas para responder aos desafios de suas ocupações dentro de padrões internacionais de qualidade.
	Há mais de 65 anos, a Worldskills reúne jovens qualificados de todo o mundo, selecionados em olimpíadas de educação profissional de seus países, realizadas em etapas regionais e nacionais. O Brasil participa do torneio desde 1983. Nesse tempo, os resultados na disputa melhoraram a cada edição, e tornou-se uma certeza a presença da equipe brasileira entre as cinco melhores equipes do mundial, ao lado de nações que são referência educacional, como Coreia do Sul e Alemanha.
	Neste ano, entre os dias 15 e 18 de outubro, mais de 1.200 jovens de 68 países competiram em 52 ocupações do setor industrial e de serviços em Abu Dhabi, nos Emirados Árabes Unidos. Com um total de 34.901 pontos, o Brasil ficou em 2º lugar geral. Os russos ficaram em primeiro, com 35.461 pontos. 
	A delegação brasileira foi composta por 56 competidores, sendo: 51 alunos e ex-alunos do Serviço Nacional de Aprendizagem Industrial - SENAI e 5 do Serviço Nacional de Aprendizagem Comercial - SENAC, que competiram em 50 ocupações.
	Em Abu Dhabi, o Brasil demonstrou seu padrão de excelência em educação profissional. Estamos entre os melhores países do mundo - China, Coreia do Sul e Suíça. A delegação brasileira recebeu 15 medalhas em Abu Dhabi, sendo 7 de ouro, 5 de prata e 3 de bronze, além de 26 certificados de excelência. As medalhas conquistadas foram:
	Medalha de ouro: Mecatrônica, Eletricidade Industrial, Manufatura Integrada, Tornearia CNC, Polimecânica e Automação, Escultura em Pedra e Tecnologia de Mídia Impressa;
	Medalha de prata: Tecnologia da Moda, Joalheria, Construção de Estruturas Metálicas, Manutenção Industrial e Desenho Mecânico - CAD;
	Medalha de bronze: Marcenaria de Estruturas, Movelaria e Construção de Estruturas para Concreto.
	Sras. e Srs. Deputados, devemos ficar orgulhosos com o resultado alcançado pelos jovens do SENAI e do SENAC que, com muita fibra e talento, representaram o Brasil. O nível de excelência alcançado pelo Brasil dificilmente será reproduzido em outros rankings internacionais, seja de desempenho econômico, seja de competitividade e inovação, seja de educação regular. Em educação profissional, o Brasil tem excelência, tendo alcançado o segundo lugar no total de pontos.
	O 2º lugar na Worldskills, dentre 68 países, demonstra que os investimentos feitos pelo SENAI no ensino técnico têm resultados positivos. O SENAI é o maior complexo de educação profissional e serviços tecnológicos das Américas. Desde 1942, formou mais de 71 milhões de trabalhadores para 28 áreas da indústria brasileira, da iniciação profissional até a graduação e pós-graduação tecnológica. A instituição está presente em todas as regiões do Brasil com 555 escolas e 442 unidades móveis, entre as quais os barcos-escola Samaúma I e Samaúma II, que atendem a Região Amazônica.
	Isso é qualificação gerando renda. Estudo encomendado pelo SENAI com base em dados do suplemento especial, divulgado em março, da Pesquisa Nacional por Amostra de Domicílios - PNAD 2014, do Instituto Brasileiro de Geografia e Estatística - IBGE, mostra que profissionais que fazem cursos técnicos têm um acréscimo na renda de 18%, em média, em relação a pessoas com perfis socioeconômicos semelhantes que concluíram apenas o ensino médio.
	Os feitos aqui expostos representam uma oportunidade para os jovens brasileiros e para a competitividade das nossas empresas.
	Conclamo, então, os nobres Parlamentares desta Casa para, juntos, valorizarmos instituições como o SENAI e a educação profissional no Brasil.
	Muito obrigado."
2017-10-25T14:42;SATISFAÇÃO, RESULTADO, POSIÇÃO,  ESTUDANTE, ENSINO TÉCNICO, BRASIL, WORLDSKILLS (2017, ABU DHABI (EMIRADOS ÁRABES UNIDOS)).;BREVES COMUNICAÇÕES;"O SR. JORGE CÔRTE REAL (Bloco/PTB-PE. Sem revisão do orador.) - Sr. Presidente, Sras. e Srs. Deputados, em 19 de outubro, o Brasil se consagrou na elite da educação profissional do mundo, conquistando o segundo lugar geral do mundial de profissões, a WorldSkills.
	A WorldSkills é a maior competição de educação profissional do mundo, realizada a cada 2 anos. Os melhores alunos de países das Américas, Europa, Ásia, África e Pacífico Sul disputam medalhas em modalidades que correspondem às profissões técnicas da indústria e do setor de serviços. Os competidores precisam demonstrar habilidades individuais e coletivas para corresponderem aos desafios de suas ocupações dentro de padrões internacionais de qualidade.
	Há mais de 65 anos, a WorldSkills reúne jovens qualificados de todo o mundo, selecionados em olimpíadas de educação profissional de seus países, realizadas em etapas regionais e nacionais.
	O Brasil participa do torneio desde 1983. Nesse tempo os resultados da disputa melhoraram a cada edição, e a equipe brasileira tornou-se uma certeza entre as cinco melhores equipes do mundial, ao lado de nações que são referência educacional como Coreia e Alemanha.
	Neste ano, entre os dias 15 e 18 de outubro, mais de 1.200 jovens de 68 países competiram em 52 ocupações do setor industrial e de serviços em Abu Dhabi, nos Emirados Árabes Unidos. Com um total de 34.900 pontos, o Brasil ficou em segundo lugar, e os russos ficaram em primeiro lugar, com 35.461 pontos.
	A delegação brasileira, Sr. Presidente, foi composta por 56 competidores, sendo 51...
	(Desligamento automático do microfone.)"
2017-10-25T14:44;SATISFAÇÃO, RESULTADO, POSIÇÃO,  ESTUDANTE, SERVIÇO NACIONAL DE APRENDIZAGEM INDUSTRIAL (SENAI), SERVIÇO NACIONAL DE APRENDIZAGEM DO COMÉRCIO (SENAC), WORLDSKILLS (2017, ABU DHABI (EMIRADOS ÁRABES UNIDOS)).;PELA ORDEM;"O SR. JORGE CÔRTE REAL (Bloco/PTB-PE. Pela ordem. Sem revisão do orador.) - Concluindo, Sr. Presidente, eu gostaria que meu pronunciamento fosse dado como lido. Os feitos aqui expostos representam uma oportunidade para os jovens brasileiros e para a competitividade de nossas empresas.
	Eu gostaria de fazer uma saudação especial ao SENAI e à CNI pelo exemplo da formação e da capacitação profissional, em face desse sucesso obtido pelos estudantes e professores brasileiros em Abu Dhabi.
	Muito obrigado, Sr. Presidente.

PRONUNCIAMENTO ENCAMINHADO PELO ORADOR
	Sr. Presidente, Sras. e Srs. Deputados aqui presentes, em 19 de outubro de 2017, o Brasil se consagrou na elite da educação profissional do mundo, conquistando o segundo lugar geral no mundial de profissões, a Worldskils.
	A Worldskills é a maior competição de educação profissional do mundo, realizada a cada 2 anos. Os melhores alunos de países das Américas, Europa, Ásia e África e Pacífico Sul disputam medalhas em modalidades que correspondem às profissões técnicas da indústria e do setor de serviço.
	Os competidores precisam demonstrar habilidades individuais e coletivas para responder aos desafios de suas ocupações dentro de padrões internacionais de qualidade.
	Há mais de 65 anos, a WorldSkills reúne jovens qualificados de todo o mundo, selecionados em olimpíadas de educação profissional de seus países, realizadas em etapas regionais e nacionais. O Brasil participa do torneio desde 1983. Nesse tempo, os resultados na disputa melhoraram a cada edição e a equipe brasileira tornou-se uma certeza entre as cinco melhores equipes do mundial, ao lado de nações que são referência educacional, como Coreia do Sul e Alemanha.
	Neste ano, entre os dias 15 e 18 de outubro, mais de 1.200 jovens de 68 países competiram em 52 ocupações do setor industrial e de serviços em Abu Dhabi, nos Emirados Árabes Unidos.
	Com um total de 34.901 pontos, o Brasil ficou em segundo lugar geral. Os russos ficaram em primeiro, com 35.461 pontos. A delegação brasileira foi composta por 56 competidores, sendo: 51 alunos e ex-alunos do -Serviço Nacional de Aprendizagem Industrial  SENAI <http://www.portaldaindustria.com.br/senai> e 5 do Serviço Nacional de Aprendizagem Comercial - SENAC, que competiram em 50 ocupações.
	Em Abu Dhabi, o Brasil demonstrou seu padrão de excelência em educação profissional. Estamos entre os melhores países do mundo - China, Coreia do Sul e Suíça. A delegação brasileira recebeu 15 medalhas em Abu Dhabi, sendo 7 de ouro, 5 de prata e 3 de bronze, além de 26 certificados de excelência. As medalhas conquistadas foram: medalha de ouro - Mecatrônica, Eletricidade Industrial, Manufatura Integrada, Tornearia CNC, Polimecânica e Automação, Escultura em Pedra e Tecnologia de Mídia Impressa; medalha de prata - Tecnologia da Moda, Joalheria, Construção de Estruturas Metálicas, Manutenção Industrial e Desenho Mecânico - CAD; medalha de bronze - Marcenaria de Estruturas, Movelaria e Construção de Estruturas para Concreto.
	Sras. e Srs. Deputados, devemos ficar orgulhosos com o resultado alcançado pelos jovens do SENAI e do SENAC, que, com muita fibra e talento, representaram o Brasil. O nível de excelência alcançado pelo Brasil dificilmente será reproduzido em outros rankings internacionais, seja de desempenho econômico, de competitividade, inovação ou de educação regular. Em educação profissional, o Brasil tem excelência, alcançou o segundo lugar no total de pontos.
	O segundo lugar na WorldSkills, dentre 68 países, demonstra que os investimentos feitos pelo SENAI no ensino técnico têm resultados positivos. O SENAI é o maior complexo de educação profissional e serviços tecnológicos das Américas. Desde 1942, formou mais de 71 milhões de trabalhadores para 28 áreas da indústria brasileira, da iniciação profissional até a graduação e pós-graduação tecnológica. A instituição está presente em todas as regiões do Brasil com 555 escolas e 442 unidades móveis, entre as quais os barcos-escola Samaúma I e Samaúma II, que atendem a Região Amazônica.
	Isso é qualificação gerando renda. Em estudo encomendado pelo SENAI com base em dados do suplemento especial, divulgado em março, da Pesquisa Nacional por Amostra de Domicílios - PNAD 2014, do Instituto Brasileiro de Geografia e Estatística - IBGE, mostra que profissionais que fazem cursos técnicos têm um acréscimo na renda de 18%, em média, em relação a pessoas com perfis socioeconômicos semelhantes que concluíram apenas o ensino médio.
	Os feitos aqui expostos representam uma oportunidade para os jovens brasileiros e para a competitividade das nossas empresas.
	Conclamo, então, os nobres Parlamentares desta Casa para, juntos, valorizarmos essas instituições, como o SENAI e a educação profissional no Brasil.
	Muito obrigado."
2017-10-25T16:50;PARECER CONTRÁRIO, COMISSÃO DE CONSTITUIÇÃO E JUSTIÇA E DE CIDADANIA (CCJC), SIP 2/2017, SOLICITAÇÃO PARA INSTAURAÇÃO DE PROCESSO, AUTORIZAÇÃO, INVESTIGAÇÃO, SUPREMO TRIBUNAL FEDERAL (STF), DENÚNCIA, MINISTÉRIO PÚBLICO FEDERAL (MPF), MICHEL TEMER, PRESIDENTE DA REPÚBLICA, ELISEU LEMOS PADILHA, WELLINGTON MOREIRA FRANCO, MINISTRO DE ESTADO, VOTO FAVORÁVEL.;REGISTRO DE VOTO;"O SR. JORGE CÔRTE REAL (Bloco/PTB-PE.) - Voto com o Relator, Sr. Presidente.
	O SR. GIACOBO - Deputado Jorge Côrte Real: voto ""sim"". Total: 242."
