dataHoraInicio;keywords;tipoDiscurso;transcricao
2016-02-24T12:28;CONSELHO MONETÁRIO NACIONAL (CMN), AUMENTO,TAXA DE JUROS, OPERAÇÃO, FUNDO CONSTITUCIONAL DE FINANCIAMENTO, PREJUÍZO, INVESTIMENTO, REGIÃO NORDESTE, REPÚDIO, BANCADA PARLAMENTAR, ATUAÇÃO, REVISÃO, DECISÃO.;DISCURSO ENCAMINHADO;"PRONUNCIAMENTO ENCAMINHADO À MESA PARA PUBLICAÇÃO
	O SR. JORGE CÔRTE REAL (Bloco/PTB-PE. Pronunciamento encaminhado pelo orador.) - Sr. Presidente, Sras. e Srs. Deputados, uma decisão do Conselho Monetário Nacional (CMN), nos estertores do ano passado, surpreendeu a bancada e, mais ainda, o setor produtivo nordestino, uma determinação lamentável, que não ajudará em nada na recuperação econômica do Nordeste. Nenhum Deputado da Região, com certeza, descansará até que ela seja revertida.
	Em 17 de dezembro, resolução do CMN elevou as taxas de juros das operações não rurais no âmbito dos Fundos Constitucionais de Financiamento, aí incluído o FNE (Fundo Constitucional do Nordeste). Noutras palavras, está mais caro investir no Nordeste. Muito mais caro. No caso das micro, pequenas e médias empresas que buscam crédito para investimento, a taxa chegou a subir de 8,24% para 14,12% ao ano: incremento de 70% em uma única tacada!
	Esse aumento teve o repúdio unânime do setor produtivo nordestino. Uma taxa de juros tão alta afasta o eventual investidor, de quem depende a retomada da atividade econômica.
	Em 2015, os empréstimos do FNE já tinham caído 14,6% em relação a 2014, por causa das incertezas do cenário econômico. Agora, com esse aumento na taxa de juros, a tendência é que eles caiam ainda mais. E, sem investimento, não se pode crescer, gerar emprego, sair da recessão.
	O FNE é a maior fonte de financiamento do Nordeste. De tudo o que o BNB (Banco do Nordeste) empresta, metade tem origem no FNE. Tolher o uso do fundo é como sabotar o desenvolvimento da Região, e isso num momento em que, para além da crise econômica, o Semiárido sofre também com uma das mais longas secas da história.
	O mais frustrante é que, com esse nível de juros, o FNE se desnatura. Ele foi criado pela Constituição para ajudar o Nordeste a se desenvolver, para diminuir a distância em relação ao Centro-Sul. Para isso são fundamentais as condições diferenciadas do crédito oferecido. Agora a taxa de juros do FNE perdeu seu diferencial, praticamente empatou com as praticadas pelo BNDES.
	Está ocorrendo um nivelamento. Enquanto a Taxa de Juros de Longo Prazo (TJLP) do BNDES, de abrangência nacional, subiu só meio ponto percentual (de 7% para 7,5%), as taxas do FNE, específicas para o Nordeste, deram o já mencionado salto de mais de 70%.
	O crédito do FNE é produtivo. Ele fomenta o desenvolvimento em uma Região especialmente pobre. Não se pode sacrificar um instrumento de estímulo regional no altar da política monetária.
	Este que vos fala e, creio, toda a bancada nordestina estamos empenhados em reverter essa decisão infeliz do CMN. O FNE foi uma criação constitucional, para cumprir o objetivo da nossa República de reduzir as desigualdades regionais. O povo da nossa Região precisa de mais investimento, de mais emprego, de mais renda - de mais, não de menos. O CMN precisa rever sua decisão. A nova taxa precisa ser derrubada.
	Muito obrigado."
2016-03-30T15:34;PROGRAMA NACIONAL DE ACESSO AO ENSINO TÉCNICO E EMPREGO (PRONATEC), RELEVÂNCIA.;DISCURSO ENCAMINHADO;"PRONUNCIAMENTO ENCAMINHADO À MESA PARA PUBLICAÇÃO

            O SR. JORGE CÔRTE REAL (Bloco/PTB-PE. Pronunciamento encaminhado pelo orador.) - Sr. Presidente, Sras. e Srs. Deputados, o anúncio da nova etapa do Programa Nacional de Acesso ao Ensino Técnico e Emprego (PRONATEC), com a abertura de 2 milhões de vagas ainda em 2016, é um fato importante, que faço questão de registrar aqui. O Brasil só tem a ganhar investindo nessa área, pois assim multiplica as oportunidades para os trabalhadores e melhora a qualidade dos produtos e serviços ofertados no País.
	Na União Europeia, quase 50% dos estudantes do ensino secundário optam pela educação profissional; no Brasil, apenas 8,4%. Ainda temos, portanto, muito espaço para ampliar a oferta de cursos e qualificar cada vez mais quem já está e quem pretende entrar no mercado de trabalho.
	Criado em 2011, o PRONATEC alcançou, até o ano passado, 9,4 milhões de matrículas, sendo 38% em cursos técnicos e 62% em cursos de qualificação profissional. Cerca de 70% dos alunos são jovens de até 29 anos, e 60%, mulheres. A Região Nordeste responde por um terço do total de matrículas.
	Participam do Programa os Institutos Federais de Educação, Ciência e Tecnologia, as unidades do Sistema S, escolas estaduais e municipais e instituições privadas. Em geral, são ministrados cursos técnicos de maior duração, variando de 1 a 3 anos, e cursos de qualificação profissional de curta duração, entre 3 e 6 meses - todos gratuitos.
	Depois de atingir o recorde de mais de 3 milhões de matrículas em 2014, o PRONATEC sofreu restrições orçamentárias no ano passado, caindo para 1,2 milhão de matrículas.
	Felizmente, no último dia 9, o Ministério da Educação lançou a nova etapa do Programa, assegurando o aumento expressivo do número de vagas e algumas inovações, como o e-PRONATEC, que terá plataformas multimídia para autoestudo, e o PRONATEC EJA, voltado para jovens e adultos que desejam retomar seus estudos.
	A maior parte dos cursos do PRONATEC abrange áreas relacionadas com a indústria, o comércio, a agricultura e os transportes. O setor industrial, que sempre lamentou a carência de mão de obra qualificada, tem sido bastante beneficiado pela capacitação de profissionais em mecatrônica, eletricidade, mecânica de instrumentos e construção civil, por exemplo.
	Aliás, desde 2013 o PRONATEC passou a ter uma modalidade destinada a atender as demandas específicas de empresas contempladas pelo Plano Brasil Maior, cujo objetivo é aumentar a competitividade da indústria nacional. Em 2 anos, mais de 345 mil pessoas foram qualificadas, e o Ministério do Desenvolvimento, Indústria e Comércio Exterior informa que boa parte delas têm facilidade de se empregar nos respectivos setores.
	Por tudo isso, saúdo a nova etapa desse Programa, que propicia, ao mesmo tempo, melhores empregos para os trabalhadores e produção de mais qualidade para o Brasil.
	Muito obrigado."
2016-04-17T14:04;DCR 1/2015, DENÚNCIA POR CRIME DE RESPONSABILIDADE, DILMA ROUSSEFF, PRESIDENTE DA REPÚBLICA, IMPEACHMENT, COMISSÃO ESPECIAL, PARECER, ADMISSIBILIDADE, VOTO FAVORÁVEL.;REGISTRO DE VOTO;"O SR. JORGE CÔRTE REAL (Bloco/PTB-PE.) - Sr. Presidente, que esse meu voto signifique o retorno deste País ao desenvolvimento econômico, gerando emprego, gerando mais renda, gerando condições mais dignas ao brasileiro e à família pernambucana.
	Gostaria de dedicar o meu voto especificamente aos pernambucanos, que me honraram com o mandato, e à minha família, em especial à minha mulher e aos meus netos. 
	O meu voto é ""sim""!	(Manifestação no plenário.)
	O SR. BETO MANSUR - Deputado Jorge Côrte Real, do PTB de Pernambuco: voto ""sim"". Total: 350 votos."
2016-04-27T15:46;PL 4567/2016, PROJETO DE LEI ORDINÁRIA, ALTERAÇÃO, LEI DO PRÉ-SAL, PETRÓLEO BRASILEIRO (PETROBRAS), DIREITO DE PREFERÊNCIA, ATUAÇÃO, OPERADOR, PARTICIPAÇÃO, PERCENTUAL, CONSÓRCIO DE EMPRESAS, EXPLORAÇÃO, PRODUÇÃO, PETRÓLEO, GÁS NATURAL, HIDROCARBONETO, CAMADA PRÉ-SAL, TEMA, ANÁLISE.;DISCURSO ENCAMINHADO;"PRONUNCIAMENTO ENCAMINHADO À MESA PARA PUBLICAÇÃO
	O SR. JORGE CÔRTE REAL (Bloco/PTB-PE. Pronunciamento encaminhado pelo orador.) - Sr. Presidente, Sras. e Srs. Deputados, o pré-sal é um patrimônio brasileiro que precisa ser explorado em benefício do Brasil e de seu povo. Neste momento de crise que o País atravessa, é ainda mais importante que a discussão sobre essa exploração tenha como base critérios técnicos. 
	O polígono do pré-sal, localizado na Plataforma Continental Brasileira, estende-se do litoral do Estado do Espírito Santo até o Estado de Santa Catarina, em área de aproximadamente 149 mil quilômetros quadrados.
	O potencial do pré-sal é muito grande em termos de reservas, que podem ser superiores a 100 bilhões de barris. Por isso, ele precisa ser explorado com alguma celeridade, pois em algumas décadas o petróleo perderá importância e valor.
	Isso pode ocorrer tanto pelo desenvolvimento de novas tecnologias quanto por questões ambientais. Assim sendo, o Brasil não pode perder a grande oportunidade que representa o pré-sal. Dessa oportunidade podem se beneficiar a presente e as futuras gerações de brasileiros.
	A Lei nº 12.351, de 22 de dezembro de 2010, estabeleceu a PETROBRAS como o operador único, sob o regime de partilha de produção, nos blocos do polígono do pré-sal e em áreas estratégicas. Estabeleceu, ainda, uma participação mínima de 30% por parte da estatal em qualquer área do pré-sal.
	O Projeto de Lei nº 4.567, de 2016, em tramitação nesta Casa, elimina parcialmente essas exigências. É hora, então, de fazermos um importante debate técnico na Comissão Especial encarregada da análise da matéria e, posteriormente, no plenário desta Casa.
	De início, importa ressaltar que, de fato, muitas áreas da província do pré-sal não são estratégicas. Em algumas áreas, onde já ocorreram até mesmo descobertas, há indicações de baixos volumes recuperáveis de petróleo. Entretanto, o que é considerado baixo volume por uma empresa pode não ser para outra.
	Em razão da existência de áreas não estratégicas no pré-sal, mas que devem entrar em produção no curto prazo, é fundamental que a atual legislação seja alterada, de modo a permitir que outras empresas possam ser operadoras. Também importante é a dispensa da participação mínima da PETROBRAS de 30% em qualquer consórcio que vença a licitação de blocos nessa província.
	A PETROBRAS, contudo, poderia ser mantida como operadora, por indicação do Conselho Nacional de Política Energética - CNPE a Presidente da República, desde que a área seja objetivamente caracterizada como estratégica.
	O CNPE já autorizou a contratação de cinco áreas do pré-sal sob regime de partilha de produção, todas localizadas na Bacia de Santos.
	O bloco de Libra foi licitado em outubro de 2013. Nesse bloco, antes da licitação, a Agência Nacional do Petróleo, Gás Natural e Biocombustíveis - ANP indicou volumes recuperáveis de 8 a 12 bilhões de barris equivalentes de petróleo.
	Outras quatro áreas autorizadas ficaram exclusivamente com a PETROBRAS. Nessas áreas, onde existem os chamados excedentes da cessão onerosa de Franco, Iara, Nordeste de Tupi e Florim, foram indicados pela ANP volumes recuperáveis de 9,8 a 15,2 bilhões de barris equivalentes de petróleo.
	Em razão dos elevados volumes recuperáveis da carteira da PETROBRAS e do seu alto endividamento, a estatal tem sido muito seletiva na escolha das áreas do pré-sal. O foco das atividades da empresa tem sido em Lula, em Sapinhoá, nas áreas da cessão onerosa e em Libra.
	Nesse contexto, a PETROBRAS tem recorrido a devoluções de áreas, como Parati, Caramba, Bem-Te-Vi e Carioca, e a pedidos de prorrogação da fase de exploração em áreas como Sagitário e Júpiter. Isso faz com que o potencial do pré-sal não seja devidamente aproveitado.
	Além das áreas devolvidas, que podem ser do interesse de outras empresas, também é importante mencionar que existem várias áreas do pré-sal que precisam ser unitizadas, pois as jazidas, onde já foram perfurados vários poços, estendem-se por área da União. Entre essas áreas destacam-se Carcará, Júpiter, Gato do Mato e Tartaruga Verde.
	Segundo o Instituto Brasileiro do Petróleo, Gás e Biocombustíveis - IBP, a questão da unitização pode destravar investimentos de R$ 120 bilhões, devido ao potencial calculado entre 8 e 10 bilhões de barris de petróleo nas áreas unitizáveis. 
	É importante, então, que, em áreas consideradas não estratégicas, a PETROBRAS não seja obrigada a ser operadora. Desse modo, outras empresas poderão ter o direito de serem operadoras. Isso é muito importante, principalmente nas áreas adjacentes às descobertas feitas pela própria PETROBRAS ou por outras empresas.
	A realização de investimentos em áreas de menor potencial, onde a PETROBRAS não tem interesse, pode gerar importante aumento na produção de petróleo no Brasil. Esse aumento gerará, entre outros benefícios, maior arrecadação de tributos e de receitas governamentais do setor petrolífero, tais como royalties, participação especial e excedente em óleo.
	Conclamo, então, os nobres Parlamentares desta Casa para, juntos, promovermos alterações na atual legislação do setor petrolífero para que se possa gerar, no curto prazo, emprego, renda e desenvolvimento para o Brasil. É disso que o País precisa.
	Muito obrigado."
2016-08-31T12:08;"LEI DO ESTÁGIO (2008), IMPORTÂNCIA, BENEFÍCIO, EMPRESA, ESTUDANTE, INSTITUIÇÃO DE ENSINO. 
INSTITUTO EUVALDO LODI (IEL), ATUAÇÃO, ESTÁGIO PROFISSIONAL, ELOGIO. 
PL 7012/2013, PROJETO DE LEI ORDINÁRIA, CRIAÇÃO, DIA NACIONAL DO ESTAGIÁRIO, COMEMORAÇÃO, AGOSTO, JORGE CÔRTE REAL, DEPUTADO FEDERAL, AUTOR, DEFESA, APROVAÇÃO.";DISCURSO ENCAMINHADO;"PRONUNCIAMENTO ENCAMINHADO À MESA PARA PUBLICAÇÃO
	O SR. JORGE CÔRTE REAL (Bloco/PTB-PE. Pronunciamento encaminhado pelo orador.) - Sr. Presidente, Sras. e Srs. Deputados, em 25 de setembro de 2008, foi sancionada a Lei n° 11.788, que regulamentou o estágio como um ato educativo escolar supervisionado e desenvolvido no ambiente de trabalho. Ao estimular a realização de estágios, teremos a certeza de desenvolver futuros profissionais que contribuirão para a competitividade das empresas no País.
	Muitos foram os avanços obtidos com a Lei do Estágio, dentre os quais podemos citar: as definições claras das responsabilidades dos direitos e dos deveres das partes envolvidas no estágio foram determinantes para tornar profícua a relação de estágio no Brasil; a clareza e o detalhamento apresentados na lei trouxeram várias inovações - limite da jornada de estágio, instituição de recesso para o estagiário, aplicação da legislação de saúde e segurança no trabalho para o estagiário e segurança na execução e formalização do estágio.
	Cito ainda, alguns benefícios que a lei trouxe para o estagiário: preparação para atuação no mercado de trabalho; compreensão melhor da prática real de sua profissão; apoio na escolha profissional; complemento da formação acadêmica; tornar-se um profissional diferenciado, a partir da experiência adquirida no estágio; desenvolvimento de competências essenciais para o mundo do trabalho.
	Para a empresa: formação de capital humano; atração e retenção de novos talentos; absorção de novas ideias e métodos inovadores com a oportunidade de arejar seus processos.
	E para a instituição de ensino: auxílio na definição dos currículos das instituições de ensino; importância como difusora do conhecimento e a aplicação prática dos conteúdos acadêmicos; aplicação prática de novas metodologias desenvolvidas por meio de pesquisas; melhor conhecimento do mundo produtivo e suas transformações e demandas.
	Cabe aqui destacar os serviços prestados pelo o Instituto Euvaldo Lodi - IEL, instituição criada em 1969 pela Confederação Nacional da Indústria - CNI, em conjunto com o Serviço Nacional de Aprendizagem Industrial - SENAI e o Serviço Social da Indústria - SESI, que participou ativamente dos estudos e discussões para a construção dessa lei e logo após sua promulgação, em 2009, elaborou a Cartilha Esclarecedora sobre a Lei de Estágio.
	O programa de estágio se tornou o projeto-símbolo do IEL, que ao longo dos anos ampliou sua abrangência, e além de promover a integração somente entre indústrias e universidades, passou a atender também, por meio de seus núcleos regionais nos 26 Estados e no Distrito Federal, todos os segmentos empresariais, instituições de ensino e órgãos de Governo.
	O IEL auxilia as empresas como agente de integração na oferta de programas de capacitação de estagiários, apoiando as empresas no desenvolvimento de competências comportamentais dos jovens para o mercado de trabalho, por meio do Programa Foco na Carreira, na atuação padronizada da operação dos programas de estágio em todo o Brasil com os seus clientes e parceiros, na realização de processos de recrutamento e seleção de estagiários, na oferta de autosserviços para estagiários, empresas e instituições de ensino no acompanhamento do estágio via web pelo Sistema Nacional de Estágio e na elaboração de programas diferenciados e customizados para atender às necessidades das indústrias.
	Desde 2007 o IEL instituiu o Prêmio IEL de Estágio, que tem como objetivo reconhecer e premiar as melhores práticas de estágio em todo o Brasil. Em 2015 o instituto atendeu cerca de 120 mil estagiários em todo o País, atuando em parceria com 9 mil novas instituições de ensino e 22 mil empresas, totalizando mais 1,7 milhão de estagiários. Em 2016, mesmo com o mercado em crise, foram realizados, no primeiro semestre, 78 mil estágios intermediados pelo IEL.
	Todas essas informações corroboraram para que em 2013 eu propusesse o Projeto de Lei n° 7.012, aprovado pela Comissão de Cultura desta Casa, que institui o dia 18 de agosto como o Dia do Estagiário no Brasil. A proposição tem o objetivo de valorizar a iniciativa de jovens que estudam e ao mesmo tempo se dedicam ao estágio como forma de complementar sua formação.
	Estou certo, Sr. Presidente, de que o estágio deve ser valorizado como forma de aperfeiçoamento das competências e boas práticas profissionais, e formarão jovens diferenciados e mais bem preparados para o mundo do trabalho competitivo.
	Conclamo, então, os nobres Parlamentares desta Casa para, juntos, valorizarmos essa força produtiva dos jovens brasileiros, apoiando-os em sua jornada profissional, instituindo o Dia do Estagiário em 18 de agosto.
	Muito obrigado."
2016-09-12T20:24;BRASIL, JOGOS OLÍMPICOS, ATLETA OLÍMPICO, RIO DE JANEIRO (RJ), REALIZAÇÃO, INFRAESTRUTURA, TURISMO, RELEVÂNCIA, ELOGIO.;DISCURSO ENCAMINHADO;"PRONUNCIAMENTO ENCAMINHADO À MESA PARA PUBLICAÇÃO
	O SR. JORGE CÔRTE REAL (Bloco/PTB-PE. Pronunciamento encaminhado pelo orador.) - Sr. Presidente, Sras. e Srs. Deputados, nada melhor do que aproveitar o momento vivido pelo Brasil nesses últimos 17 dias, para exaltarmos o sucesso dos Jogos Olímpicos Rio 2016.
	O sonho de todo atleta é conquistar uma medalha nos Jogos Olímpicos, a maior competição esportiva do planeta. O evento ocorre de 4 em 4 anos, e, a cada edição, uma cidade do mundo é escolhida como sede. 
	Em 2016, o Brasil e a América do Sul tiveram o privilégio de receber pela primeira vez o tão sonhado Jogos Olímpicos. A competição foi realizada na cidade do Rio de Janeiro durante 17 dias e contou com a participação de 11.000 atletas de 206 países. 
	Organizar os Jogos Olímpicos será sempre um grande desafio para qualquer país. Para uma cidade se candidatar a hospedar o evento, ela precisa assumir uma série de responsabilidades na criação da infraestrutura e nas instalações da competição, além de garantir a segurança, o bem-estar e a saúde dos participantes. 
	É comum dizer que esse grande evento deixa um legado para o país que recebe os Jogos. Sediar uma competição desta envergadura pode ser a oportunidade de usar o esporte para gerar uma série de melhorias para a cidade.
	A cidade do Rio de Janeiro foi escolhida como sede do evento em 2009 e teve 7 anos para se preparar. Foram construídos ginásios, parques, prédios e arenas para acomodar os atletas e uma nova infraestrutura de transporte público. O principal investimento foi para o Parque Olímpico, onde foram disputadas 16 modalidades esportivas. Ao final das Olimpíadas, o local será usado para a formação de novos atletas, e algumas instalações serão transformadas em escolas, parques e escritórios. 
	O custo dos Jogos Olímpicos do Rio de Janeiro chegou a R$ 38,2 bilhões. Desse valor, 57% foi custeado por empresas privadas em forma de concessões, associações público-privadas ou projetos totalmente privados. Nenhuma outra cidade sede do evento contou com tanta contribuição desse setor.
	O setor privado assumiu totalmente obras como a Vila Olímpica, o campo de golfe exigido pelo Comitê Olímpico Internacional - COI e toda a infraestrutura do Porto Maravilha, como é conhecido o projeto de revitalização da zona portuária.
	Nesse sentido, podemos destacar algumas obras inovadoras, como: 
	a)	O Veículo Leve sobre Trilhos - VLT com 28 quilômetros e 32 paradas. O VLT vai conectar a região portuária ao Centro e ao Aeroporto Santos Dumont.
	b)	O BRT Transolímpica vai atender 70 mil passageiros por dia e reduzir o tempo de viagem entre a Barra da Tijuca e Deodoro em 54%. Serão 26 quilômetros de extensão - 13 quilômetros de via expressa - e 17 estações.
	c)	A Linha 4 do Metrô - Barra da Tijuca/Ipanema. A previsão é transportar, a partir deste ano, mais de 300 mil pessoas por dia e retirar das ruas cerca de 2 mil veículos por hora. 
	d)	Porto Maravilha. As obras foram iniciadas em junho de 2011, com o objetivo de recuperar a infraestrutura urbana da região portuária, em uma área total de 5 milhões de metros quadrados. Na região, a cidade ganhou o Museu do Amanhã, que é inspirado na natureza brasileira.
	e)	Obras de urbanização no entorno do Estádio do Engenhão e do Complexo de Deodoro; a Arena do Futuro, que recebeu as competições de handball; o Estádio Aquático, com 18 mil lugares, e que será o centro administrativo do Centro Olímpico de Treinamento para atletas de alto rendimento; o Laboratório de Dopagem; o Centro Internacional de transmissão, o IBC; o campo de golfem, entre outras obras de infraestrutura. 
	O Governo Federal espera que a Rio 2016 deixe como legado principal a expansão do turismo no Brasil e o fortalecimento da imagem positiva do Rio de Janeiro. 
	O evento também traz a oportunidade de mostrar a cultura brasileira para o mundo. Ao longo da história dos Jogos Olímpicos, as cerimônias de abertura e de encerramento passaram a ser um convite ao turista para conhecer o país anfitrião, mostrada em espetáculos que unem história, música, dança, tradições e folclore. No Brasil, não foi diferente. As imagens que foram transmitidas pela televisão, pela Internet, por jornais e revistas do mundo todo se traduziram em um brilhante espetáculo, tanto na abertura quanto no encerramento, quando tivemos a oportunidade de mostrar para todo o mundo, sem grandes custos e recursos tecnológicos sofisticados, a potência de um país cheio de fé e esperança: seu povo, seu carisma, sua espontaneidade, a alegria contagiante, a simplicidade, a acolhida que o povo brasileiro teve e tem com todos os povos estrangeiros que para aqui se dirigem. 
	Sr. Presidente, Sras. e Srs. Deputados, as Olimpíadas Rio 2016 entraram para a história do Brasil não só por terem sido a primeira no País - além da primeira na América do Sul -, mas porque, em casa, o time olímpico brasileiro alcançou sua melhor marca em número de medalhas em Jogos Olímpicos. 
	Ao fim das Olimpíadas, a delegação brasileira somou 19 medalhas: 7 de ouro, 6 de prata e 6 de bronze. Podemos destacar, com louvor, os atletas Isaquias Queiroz, na canoagem de velocidade, com duas medalhas de prata e uma de bronze; o ouro de Thiago Braz no salto com vara; o ouro da judoca Rafaela Silva e o bronze de Mayra Aguiar e Rafael Silva; o ouro do Robson Conceição no boxe; o ouro de Alison e Bruno no vôlei de praia; a prata na ginástica artística do Arthur Zanetti e do Diego Hipólito, bem como o bronze de Arthur Nory; a prata no tiro esportivo de Felipe Wu; a prata no vôlei de praia das atletas femininas Ágatha e Bárbara; o ouro das velejadoras Martine Grael e Kahena Kunze; o bronze de Poliana Okimoto na maratona aquática; o bronze de Maicon de Andrade no taekwondo; o ouro no vôlei de quadra masculino e a tão sonhada medalha de ouro de futebol, o único título que faltava à Seleção brasileira.
	Por tudo isso, saudamos e parabenizamos os esportistas brasileiros, bem como o cidadão carioca e todos os atletas estrangeiros que participaram dessa edição dos Jogos Olímpicos Rio 2016, na certeza de que teremos resultados ainda mais profícuos no Jogos de Tóquio em 2020.
	Muito obrigado!"
