dataHoraInicio;keywords;tipoDiscurso;transcricao
2015-04-15T19:36;EMENDA, SENADO FEDERAL, CRITERIO, ENQUADRAMENTO, SERVIDOR PÚBLICO, POLICIAL, EQUIPARAÇÃO SALARIAL, PLV 1/2015, PROJETO DE LEI DE CONVERSÃO, SALÁRIO, VENCIMENTOS, SOLDO, VANTAGEM, SERVIDOR PÚBLICO CIVIL, SERVIDOR PÚBLICO MILITAR, EMPREGADO PÚBLICO, OPÇÃO, INGRESSO, QUADRO (CARREIRA PÚBLICA), EXTINÇÃO, ADMINISTRAÇÃO FEDERAL, POLICIAL MILITAR, BOMBEIRO MILITAR, RONDÔNIA, AMAPÁ, RORAIMA, FAVORÁVEL.;DISCUSSÃO;"O SR. VINICIUS GURGEL (PR-AP. Sem revisão do orador.) - Boa noite, Sr. Presidente! Boa noite, demais Parlamentares! Eu queria aqui pedir o apoio da Casa para essa proposta, que já se arrasta há muito tempo.
	Os ex-Territórios, quando passaram a ser Estados, tinham os mesmos direitos dos demais Estados e do Distrito Federal. Hoje os policiais, que lutam para proteger a vida das pessoas, são importantes para os Estados, mas estão mal remunerados e, com isso, não dão aquela atenção que a sociedade precisa. 
	Hoje, a Emenda nº 2, que veio do Senado e foi reformulada naquela Casa, equipara somente as gratificações dos policiais e dos bombeiros, porque já há uma lei que ampara os salários. Os salários são equiparados, mas as gratificações não vão sendo equiparadas, e, com isso, o salário do Distrito Federal é mais elevado.
	Então, isso não é um ""trem da alegria"", como fala o Governo. Isso é apenas equiparar Rondônia, Roraima e Amapá - porque o Acre já está equiparado - com o Distrito Federal. E são poucos os servidores, aproximadamente 2 mil. É um quadro em extinção. É somente quem entrou nos anos de 1990 a 1993, que era funcionário do Governo Federal e que, nessa transição, acabou indo para o Estado.
	Então, eu queria fazer um apelo, em especial ao partido PR, para que olhe com muito carinho, e à Casa toda, para que vote favorável a essa matéria, que vai mudar a vida dessas famílias e desses policiais e bombeiros.
	Meu muito obrigado."
2016-04-17T14:04;DCR 1/2015, DENÚNCIA POR CRIME DE RESPONSABILIDADE, DILMA ROUSSEFF, PRESIDENTE DA REPÚBLICA, IMPEACHMENT, COMISSÃO ESPECIAL, PARECER, ADMISSIBILIDADE, ABSTENÇÃO (VOTO).;REGISTRO DE VOTO;"O SR. VINICIUS GURGEL (Bloco/PR-AP.) - Por novas eleições, porque trocar seis por meia dúzia não resolve, eu me abstenho. (Palmas.)
	O SR. ALEX CANZIANI - Deputado Vinicius Gurgel, do Bloco/PR, do Amapá: abstenção. Total: 2 votos."
2016-08-09T20:44;PLP 257/2016, PROJETO DE LEI COMPLEMENTAR, REFORMA FISCAL, CRITÉRIO, UNIÃO, REFINANCIAMENTO, DÍVIDA PÚBLICA, ESTADO-MEMBRO, DISTRITO FEDERAL (BRASIL), RETIRADA, MENÇÃO, BANCO NACIONAL DE DESENVOLVIMENTO ECONÔMICO E SOCIAL (BNDES), DEFESA.;PELA ORDEM;"O SR. VINICIUS GURGEL (Bloco/PR-AP. Pela ordem. Sem revisão do orador.) - Sr. Presidente, o Deputado Vinicius Gurgel votou com o partido nas votações anteriores. 
	Eu queria fazer um apelo ao Governo e ao Relator de exclusão, do texto, do art. 2º, a parte que fala em BNDES para que os Estados possam ter permissão de negociar com os bancos públicos, porque Tocantins, Amapá, Estados do Norte e do Nordeste devem muito pouco à União e muito aos bancos públicos.
	Então, eu queria fazer esse apelo para que o Relator pudesse retirar a expressão ""BNDES"" do art. 2º.
	Obrigado."
2017-06-07T18:26;AGRADECIMENTO, PARTIDO POLÍTICO, APOIO, APROVAÇÃO, PEC 199/2016, PROPOSTA DE EMENDA À CONSTITUIÇÃO, SERVIDOR PÚBLICO CIVIL FEDERAL, SERVIDOR PÚBLICO CIVIL MUNICIPAL, POLICIAL CIVIL, POLICIAL MILITAR, PESSOA, VÍNCULO EMPREGATÍCIO, EX-TERRITÓRIO, AMAPÁ, RORAIMA, ENQUADRAMENTO, QUADRO EM EXTINÇÃO, ADMINISTRAÇÃO FEDERAL.;PELA ORDEM;"O SR. VINICIUS GURGEL (PR-AP. Pela ordem. Sem revisão do orador.) - Boa noite, Presidente!
	Eu quero agradecer a todos os partidos e especialmente à bancada dos ex-Territórios, por estarem abraçando essa causa muito nobre. Nós sabemos a dificuldade que os ex-Territórios enfrentam.
	A transferência desses funcionários dos ex-Territórios vai desafogar a folha e dar capacidade aos ex-Territórios de fazer investimentos.
	Eu me sinto muito orgulhoso por V.Exa., membro de um ex-Território, estar presidindo a sessão.
	Muito obrigado.
	Agradeço à bancada do Amapá."
2017-08-02T14:36;PARECER CONTRÁRIO, COMISSÃO DE CONSTITUIÇÃO E JUSTIÇA E DE CIDADANIA (CCJC), SIP 1/2017, SOLICITAÇÃO PARA INSTAURAÇÃO DE PROCESSO, AUTORIZAÇÃO, INVESTIGAÇÃO, SUPREMO TRIBUNAL FEDERAL (STF), DENÚNCIA, MINISTÉRIO PÚBLICO FEDERAL (MPF), MICHEL TEMER, PRESIDENTE DA REPÚBLICA, VOTO FAVORÁVEL.;REGISTRO DE VOTO;"O SR. VINICIUS GURGEL (PR-AP) - Pela estabilidade econômica e pelo meu Estado do Amapá, eu voto ""sim"".
	O SR. GIACOBO - Vinicius Gurgel: voto ""sim"". Total: 32 votos."
2017-10-03T17:52;REGISTRO, PRESENÇA, CÂMARA DOS DEPUADOS, VEREADOR, SANTANA (AP).;PELA ORDEM;"O SR. VINICIUS GURGEL (PR-AP. Pela ordem. Sem revisão do orador.) - Sr. Presidente, o Deputado Vinicius Gurgel votou com o partido na votação anterior. Eu estava em atividades parlamentares fora da Casa durante a sessão anterior.
	Quero também registrar a presença aqui de Vereadores de Santana. Eles estão aqui buscando apoio para o seu Município, no Estado do Amapá. 
	Muito obrigado, Presidente."
2017-11-28T18:50;ORIENTAÇÃO DE BANCADA, REQUERIMENTO DE DESTAQUE DE VOTAÇÃO EM SEPARADO, DESTAQUE DE EXPRESSÃO, PEC 199/2016, PROPOSTA DE EMENDA À CONSTITUIÇÃO, PARTIDO DA REPÚBLICA (PR), VOTO FAVORÁVEL.;PELA ORDEM;O SR. VINICIUS GURGEL (PR-AP. Pela ordem. Sem revisão do orador.) - Sr. Presidente, queria agradecer aos partidos que estão aprovando o texto na íntegra, para que ele não volte ao Senado, porque esse anseio da população de Roraima e principalmente do Amapá é um anseio de mais de 30 anos. Isto vai beneficiar milhares de servidores. Agradeço a todos os partidos e também a V.Exa., por estar conduzindo esta sessão. Agradeço igualmente à bancada do Amapá.
