dataHoraInicio;keywords;tipoDiscurso;transcricao
2015-02-26T19:00;PL 7370/2014, PROJETO DE LEI ORDINÁRIA, NORMAS, DIRETRIZ, PREVENÇÃO, REPRESSÃO, TRÁFICO DE PESSOA, BRASIL, TRÁFICO INTERNACIONAL, APROVAÇÃO, DEFESA.;PELA ORDEM;"A SRA. PROFESSORA DORINHA SEABRA REZENDE (DEM-TO. Pela ordem. Sem revisão da oradora.) - Sr. Presidente, eu gostaria de fazer um apelo.
	Muitas pessoas não sabem da importância deste tema. Eu tive a oportunidade de participar, por mais de 1 ano, da Comissão Especial e depois do grupo que trabalhou com essa legislação. Eu não fazia parte da Comissão e nela entrei pelo caso específico do meu Estado, o caso de uma professora que teve o seu filho roubado na porta da sua casa.
	O Brasil faz parte, sim, da rota do tráfico de pessoas, de crianças. Existem negligências e ausências legais - negligências de autoridades. E a legislação construída aqui pelo Deputado Arnaldo Jordy avança em muitos pontos.
	Eu gostaria de reforçar essa boa vontade que o Presidente demonstra e também o nosso Relator e fazer este apelo. O projeto vai ao Senado, onde poderá sofrer alterações, para o aprimoramento do texto. Nós não estamos fazendo outro tratado. É o ajuste de uma única emenda. Então, faço este apelo pela boa vontade. Repito: o texto vai ao Senado e lá poderá sofrer alterações. O tema é importante. Existe uma legislação que precisa ser alterada e modernizada."
2015-03-26T17:15;"COMISSÃO GERAL, RICARDO BARZOINI, MINISTRO DE ESTADO, MINISTÉRIO DAS COMUNICAÇÕES, ESCLARECIMENTO, APRESENTAÇÃO.
FUNDO DE UNIVERSALIZAÇÃO DOS SERVIÇOS DE TELECOMUNICAÇÕES (FUST), TEMA, PROFESSORA DORINHA SEABRA REZENDE, DEPUTADO FEDERAL, ORADOR, QUESTIONAMENTO.";COMISSÃO GERAL;"A SRA. DEPUTADA PROFESSORA DORINHA SEABRA REZENDE - Boa tarde, Sr. Presidente, Sr. Ministro, Sras. e Srs. Deputados.
	Eu fui Secretária de Educação do Estado de Tocantins por quase 10 anos e Presidente do Conselho Nacional de Secretários de Educação. 
A minha pergunta se refere ao FUST, criado em 2000, com um objetivo extremamente interessante, que tem muito a ver com toda a política, inclusive com a apresentada pelo Ministro, relacionada ao atendimento das pequenas cidades, ao acesso e à melhoria do serviço em escolas, bibliotecas, postos de saúde. Infelizmente, o FUST nunca saiu do papel. 
	Para o ano de 2014 a previsão orçamentária era de 6 bilhões de reais, mas o valor foi totalmente contingenciado. 
Isso não é uma história recente. Ele nunca funcionou, desde que foi criado. Estão aqui vários colegas ex-Secretários, inclusive o nosso Presidente e o Deputado Ságuas Moraes. Nós apelidamos o FUST de ""FRUST"", por causa da expectativa. 
A realidade das escolas já melhorou muito, mas o parque de equipamentos ainda é sucateado, as instalações e o acesso à banda larga são ruins - tudo isso que nós conhecemos.
	Há cerca de 10 dias, nós participamos de uma reunião de trabalho, inclusive com o então Ministro da Educação. Um dos desafios colocados para o grupo foi o de que o Brasil faça um investimento forte em banda larga para as escolas, por tudo o que isso representa em relação à melhoria da qualidade do ensino. Eu gostaria que o Ministro falasse sobre isso. 
Um projeto do Ministro Aloizio Mercadante em relação ao FUST e à regulamentação está pronto para ser votado. O volume de recursos poderia estar à disposição, e é fruto das contribuições de todos nós brasileiros. Todos nós, ao pagarmos pelos serviços, contribuímos com o Fundo, que tem outras fontes, que o Ministro conhece bem. 
	Que expectativa podem ter as escolas, em especial dos Municípios menores, os serviços públicos de saúde e de educação, no que se refere ao FUST sair do papel e se consolidar como uma política real de atendimento à população?
	Muito obrigada."
2015-04-22T20:10;REQUERIMENTO DE DESTAQUE DE VOTAÇÃO EM SEPARADO, EMENDA, CUMPRIMENTO, LEI, COTA, PESSOA COM DEFICIÊNCIA, PL 4330/2004, PROJETO DE LEI ORDINÁRIA, NORMA, CONTRATO, TERCEIRIZAÇÃO, ORIENTAÇÃO DE BANCADA, VOTO FAVORÁVEL, DEM.;ORIENTAÇÃO DE BANCADA;"A SRA. PROFESSORA DORINHA SEABRA REZENDE (DEM-TO. Pela ordem. Sem revisão da oradora.) - O Democratas vota ""sim"", refletindo a posição da Deputada Mara Gabrilli, o cuidado com a pessoa portadora de necessidades especiais, de deficiência. É muito importante a preservação do espaço no mundo do trabalho."
2015-04-23T16:51;"REJEIÇÃO, PL 4330/2004, PROJETO DE LEI ORDINÁRIA, NORMA, CONTRATO, TERCEIRIZAÇÃO, ÁREA FIM, INCLUSÃO, EDUCAÇÃO. 
DEFESA, VALORIZAÇÃO, MAGISTÉRIO, CRIAÇÃO, CARREIRA PROFISSIONAL, MELHORIA, SALÁRIO,  IMPLANTAÇÃO,  PLANO DE EDUCAÇÃO, MUNICIPIO, ESTADO-MEMBRO.";COMUNICAÇÃO PARLAMENTAR;"A SRA. PROFESSORA DORINHA SEABRA REZENDE (DEM-TO. Sem revisão da oradora.) - Muito obrigada, Sra. Presidente.
	Na verdade, eu gostaria de começar pelo projeto da terceirização. Embora o meu partido tenha tomado uma posição muito clara em relação ao apoiamento do projeto, deixou-me à vontade para tomar as decisões que eu entendia melhores para a educação e para o Brasil como um todo. Votei contra a urgência, votei contra o projeto e apresentei uma emenda para a exclusão dos profissionais da educação, dos professores, da possibilidade de terceirização.
	Até onde tenho acompanhado o projeto de terceirização, todo o processo de regulamentação poderia e deveria garantir direitos aos terceirizados das áreas-meio, que precisavam ter seus direitos regulamentados e melhorados. O meu receio e a minha preocupação vieram quando isso se deslocou para a área-fim.
	Por que a minha defesa em relação à exclusão do profissional da educação desse processo? Eu queria chamar a atenção para esse assunto.
	Tive uma conversa com vários Líderes partidários, que apoiaram a minha emenda. Essa emenda, infelizmente, ficou prejudicada. Existia um compromisso do próprio PSDB de apresentar esse destaque para que a emenda pudesse ser votada em separado. O Relator, aqui, na tribuna, mencionou que apoiaria a retirada do profissional da educação do projeto de terceirização. Infelizmente, o PSDB mudou de ideia e não apresentou o meu destaque. E também, com a emenda aglutinativa, o destaque ficou prejudicado. Vou tentar retomar, no Senado, a proposta de exclusão do profissional da educação.
	Entendo que há um comprometimento. A educação pressupõe confiança na relação de aprendizagem. Quero imaginar, numa situação extrema, um professor de alfabetização, que lida com crianças - mas também um professor de Química, de Física ou de Biologia -, passar a não ser, a critério de uma determinada rede de escolas, contratado diretamente pela escola. Há um comprometimento, a meu ver, em relação à carreira desse professor. Ele não tem identidade com aquela escola. A sua carreira pode ficar comprometida.
	E há algo pior. O professor tem uma relação que vai além do trabalho dele em sala de aula; ele participa do projeto pedagógico da escola e, junto com todos os outros profissionais, constrói e define quais serão as prioridades que aquela escola terá, quais serão as prioridades educacionais estabelecidas. Portanto, o profissional da educação, o professor, estabelece dentro da relação ensino-aprendizagem uma relação de proximidade e confiança.
	Eu espero, no Senado, conseguir aprovar essa emenda, da mesma forma que ontem nós conseguimos excluir da terceirização o profissional da guarda que lida diretamente nos portos. Eu entendo que há um apelo também muito importante quanto à exclusão do profissional da educação da possibilidade de terceirização.
	Tenho como bandeira a educação. Apresentei também, agora, uma emenda que propõe, para o professor que ganha até 4 mil reais, uma isenção de Imposto de Renda. É lógico que não é a solução de valorização. A questão da valorização do profissional da educação tem uma sinalização no Plano Nacional de Educação, que estabelece metas direcionadas a uma nova carreira. Estados e Municípios têm 2 anos para construir uma nova carreira docente, com salários que possam atrair os melhores profissionais, com uma política de valorização e de formação.
	A equiparação salarial do profissional de educação aos demais profissionais também é uma sinalização importante. Hoje o professor recebe, em média, 40% menos do que recebem os demais profissionais. Não vejo uma educação de qualidade, a não ser que haja um profissional com dedicação, com valorização e boa formação. Por isso, a isenção do Imposto de Renda nada mais é do que uma ação a mais no processo de valorização desse profissional. O Deputado Rogério Marinho sabe a dificuldade que nós temos de atrair hoje os melhores profissionais para a educação.
	Em relação à emenda e a todo o processo de valorização do professor, entendo que o Brasil tem a responsabilidade de garantir a construção de uma educação pública de qualidade, que seja igual e boa para todos. Essa educação não se concretizará sem a devida valorização do profissional da educação, com uma carreira que seja nacional e que possa atrair os melhores alunos do ensino médio. Que eles não deixem de se dedicar à educação por não considerarem essa uma boa profissão, que lhes garanta um salário que lhes permita sustentar a família com dignidade. Que possamos atrair os melhores alunos do ensino médio. Que os profissionais da educação, que hoje fazem um grande esforço na construção de uma educação de qualidade, possam permanecer na carreira.
	Isso se concretizará na medida em que tivermos valorização, formação profissional e, acima de tudo, uma carreira. E essa carreira precisa ser atrativa e precisa garantir que esse profissional se dedique a uma única escola, tenha uma relação de ensino e aprendizagem com essa escola e participe do seu projeto pedagógico, o que faz diferença nesse processo de construção.
	Temos ainda uma tarefa importante: o Brasil precisa aprovar este ano um plano nacional de formação e de valorização do profissional docente. Aguardamos que o Ministério da Educação apresente a esta Casa o seu projeto de formação, o projeto que vai ser construído junto com os Estados e os Municípios para garantir uma nova formação de professores e uma carreira atrativa.
	Mas esse projeto deve garantir, acima de tudo, uma base nacional curricular, ou seja, um novo currículo nacional. Qual é o professor que nós precisamos, para dar conta dessa tarefa? Um professor alfabetizador que, no seu currículo de formação, não tenha sequer uma disciplina que o prepare para ser um professor alfabetizador? Ele não vai aprender isso de maneira espontânea! Ele precisa ter uma direção do Conselho Nacional de Educação, do próprio Ministério da Educação, das universidades federais e estaduais e também das universidades privadas. São elas que fazem a formação da maioria dos profissionais da educação.
	Para concluir, eu gostaria de dizer que faço parte de duas frentes parlamentares desta Casa. Uma foi instituída na semana passada, a frente parlamentar que vai acompanhar a implementação do Plano Nacional de Educação.
	É muito importante que os Deputados que queiram nos ajudar nos seus Estados criem junto nas Assembleias Legislativas, nas organizações de professores e de gestores da educação processos de acompanhamento e monitoramento dos Planos Municipais de Educação e dos Planos Estaduais de Educação. 
	Compete à União a implementação de várias políticas que já estão definidas com prazos bem determinados, mas cada Município, cada Estado precisa ter a sua prática e o seu plano construído.
	E nós sabemos que, no desenho, no modelo federativo em que vivemos, a educação não acontece aqui no Ministério da Educação, nem na União, a educação acontece de verdade e de fato nas escolas públicas estaduais e municipais espalhadas neste País, nas escolas indígenas, nas escolas rurais, nas escolas de zona urbana, escolas que em muitas situações sequer têm a estrutura mínima de funcionamento, sequer têm quadro na sala de aula, carteira ou material adequado.
	Eu tenho certeza do desafio que é a educação pública de qualidade. E não posso deixar de mencionar o lema que foi assumido e anunciado pela Presidente: Brasil Pátria Educadora. Convidamos o Ministro Mangabeira Unger e o Ministro da Educação para que o apresentem à Comissão de Educação. 
	A Pátria educadora só será concretizada na medida em que cada ente federado assuma sua tarefa e o seu papel; os recursos da educação sejam garantidos e priorizados; e, acima de tudo, o profissional da educação, aquele que faz a educação de verdade e de qualidade, que é o professor, se senta respeitado e valorizado.
	E é por isso que eu tenho certeza de que esta Casa vai acompanhar, monitorar e garantir que os recursos assegurados no Orçamento cheguem e cumpram sua tarefa junto aos Municípios e aos Estados. 
	Brasil Pátria Educadora só será uma ação concreta na medida em que a educação seja respeitada e priorizada. 
	Muito obrigada a todos."
2015-04-29T15:26;EMP 1/2015, EMENDA DE PLENÁRIO, CRIME CONTRA O ORDENAMENTO URBANO E O PATRIMÔNIO CULTURAL, AUMENTO DA PENA, CRIME, PICHAÇÃO, PATRIMÔNIO URBANO, PERDA, BENEFÍCIO ASSISTENCIAL, INCLUSÃO, BENEFÍCIO PESSOAL, CADASTRO DE PESSOA FÍSICA (CPF), PL 985/2015, PROJETO DE LEI ORDINÁRIA, ORIENTAÇÃO DE BANCADA, DEM, VOTO CONTRÁRIO.;ORIENTAÇÃO DE BANCADA;"A SRA. PROFESSORA DORINHA SEABRA REZENDE (DEM-TO. Pela ordem. Sem revisão da oradora.) - Sr. Presidente, o Democratas vota ""não"". E chamo a atenção para o fato de que há programas que estão sendo retirados e não podem ser retirados. São direitos à educação, como PRONATEC, PROUNI, FIES, que são programas de financiamento. É inapropriada a retirada deles."
2015-05-12T20:00;REQUERIMENTO DE DESTAQUE DE VOTAÇÃO EM SEPARADO, EMENDA, PROIBIÇÃO, BANCO NACIONAL DE DESENVOLVIMENTO ECONÔMICO E SOCIAL (BNDES), OPERAÇÃO, FINANCIAMENTO, EMPRESA, CONCENTRAÇÃO, ATIVIDADE ECONÔMICA, MPV 663/2014, MEDIDA PROVISÓRIA, ALTERAÇÃO, CRITERIO, AUTORIZAÇÃO, UNIÃO, CONCESSÃO, SUBVENÇÃO ECONÔMICA, MODALIDADE, EQUALIZAÇÃO DE TAXAS DE JUROS, ORIENTAÇÃO DE BANCADA, VOTO FAVORAVEL, DEM.;ORIENTAÇÃO DE BANCADA;"A SRA. PROFESSORA DORINHA SEABRA REZENDE (DEM-TO. Pela ordem. Sem revisão da oradora.) - Sr. Presidente, o Democratas gostaria de fazer um apelo aos Líderes partidários. 
	Nós temos votado tantas matérias que têm causado prejuízo ao trabalhador. E, neste caso específico do BNDES, o Democratas apresenta um destaque, o Relator diz que o BNDES nunca financiou a formação de cartel. Não é verdade. 
	Temos o histórico de várias empresas, no setor de alimento, no setor de telefonia, financiadas pelo BNDES. E essas empresas saíram pelo Brasil afora comprando as pequenas empresas. Isso impede que o cidadão tenha acesso à concorrência e aos melhores preços. 
	A nossa emenda impede que o dinheiro do BNDES - hoje, só de subsídios são mais de 30 bilhões, mais do que o dinheiro usado para o Bolsa Família - seja usado para formar cartel, truste e fusão.
	Por isso, o Democratas faz este apelo: que os partidos possam rever a sua posição. O dinheiro do povo brasileiro não pode ser usado para interesses estritamente econômicos de fusão e de formação de cartel."
2015-05-14T14:22;LEGISLATIVO, RESERVA, PERCENTUAL, LIMITE MÍNIMO, VAGA, SEXO FEMININO, MULHER, DEFESA.;PELA ORDEM;A SRA. PROFESSORA DORINHA SEABRA REZENDE (DEM-TO. Pela ordem. Sem revisão da oradora.) - Sra. Presidente, eu queria dizer a este Parlamento que os homens estão aqui porque receberam o nosso voto, o voto das mulheres. Somos mais de 51% da população. E, se chegaram aqui, têm a responsabilidade de representar as mulheres que não tiveram o direito de chegar aqui. Não é inconstitucional. Nós temos o direito de estar aqui. Existe uma relação de desigualdade. A cota é para resolver a desigualdade.
