dataHoraInicio;keywords;tipoDiscurso;transcricao
2015-10-28T14:20;JOSÉ BRAZ, EMPRESÁRIO, MURIAÉ (MG), ANIVERSÁRIO, HOMENAGEM.;PEQUENO EXPEDIENTE;"O SR. RENZO BRAZ (Bloco/PP-MG. Sem revisão do orador.) - Sr. Presidente, faço uso da palavra para homenagear um dos maiores empresários brasileiros, o meu avô José Braz, que completou 90 anos de idade neste sábado.
	Nascido em Muriaé, José Braz aprendeu cedo lições de empreendedorismo. Com apenas 24 anos, adquiriu seu primeiro caminhão, fruto de anos de economia. Em pouco tempo, comprou o segundo e o terceiro, iniciando sua vida no ramo de transportes. 
	Em 1957, fundou a transportadora de cargas Rodoviário Líder, dando início ao Grupo Líder, hoje formado por mais de 80 empresas e 5 mil colaboradores. 
	Prefeito por dois mandatos consecutivos em Muriaé, deixou um legado de mais de 1.100 grandes obras, e ainda se sente apto para - quem sabe? - ser candidato em 2016. 
	Apaixonado pela esposa, mandou construir para ela um Cristo Redentor de 32 metros de altura, em Muriaé. 
	Parabéns, vô! Obrigado por tudo. Que Deus conserve nossa família unida para continuarmos trabalhando por um Brasil melhor.
	O SR. PRESIDENTE (Carlos Manato) - Autorizo a divulgação do pronunciamento de V.Exa. no programa A Voz do Brasil. 
	Sou testemunha das empresas de sua família no nosso Estado. Muito sucesso a todos vocês!


PRONUNCIAMENTO ENCAMINHADO PELO ORADOR
Sr. Presidente, Sras. e Srs. Deputados, faço uso da palavra para homenagear um dos maiores empresários brasileiros: meu avô José Braz, que acaba de completar 90 anos de idade. 
Nascido em 24 de outubro de 1925, em Muriaé, Minas Gerais, José Braz sempre deu orgulho aos seus pais Pedro Braz e D. Francina. Como os irmãos, João (falecido), Pedro, Maria Aparecida e Sofia (falecida), foi educado no amor ao trabalho e na responsabilidade de suas obrigações.
Com o pai, aprendeu ainda muito cedo a profissão de marceneiro, que lhes trazia o sustento e também diversão. Isso porque, nas horas vagas, o então menino José Braz fazia, no torno da oficina do pai, peões, máquinas de empinar pipas e patinetes, brinquedos que vendia aos colegas do bairro.
Dividindo-se entre a escola e as obrigações na oficina, ele aprendeu cedo lições sobre empreendedorismo. 
Em dezembro de 1947, José Braz e D. Lédia se tornam marido e mulher. Da união, nascem Braulio, Gilberto (falecido) e Adélia. 
Em março de 1949, com apenas 24 anos, adquire seu primeiro caminhão, fruto de anos de economia. Em pouco tempo compraria o segundo e o terceiro, iniciando a sua vida no ramo dos transportes. 
Mas ser caminhoneiro não era fácil. Na época, poucas estradas eram asfaltadas. Foram várias molas quebradas, várias horas com o caminhão atolado e a comida era aquecida no calor do motor do veículo. 
Sempre forte e muito disposto a trabalhar, José Braz funda, em 1957, o Rodoviário Líder, sua primeira empresa, e assume o compromisso de transportar leite em latões da Cooperativa dos Produtores de Muriaé para o Rio de Janeiro, desafiando estradas mal conservadas e toda sorte de dificuldades.
Com ajuda dos filhos Braulio e Gilberto, que também se destacaram como empreendedores natos, José Braz foi ampliando os negócios. Gilberto assumiu a diretoria do Rodoviário Líder, e Braulio fundou em Muriaé a primeira concessionária da família, a Líder Comércio e Indústria, revendedora da marca Chevrolet. Era o início do Grupo Líder, que possui hoje mais de 80 empresas, entre concessionárias, seguradoras etc, em várias cidades do País, e se destaca como o maior revendedor de automóveis do Brasil, sendo responsável pela venda de 8% da marca  Volkswagem no País. 
Ocupando uma posição de liderança no mercado, as empresas do Grupo Líder cumprem uma importante função social, gerando cerca de 5.800 postos de trabalho e contribuindo decisivamente para o desenvolvimento socioeconômico das regiões em que atua. Empresas familiares, administradas pelos filhos e netos de José Braz, mas sob o olhar atento do patriarca.
Não satisfeito em produzir somente para si e sua família, José Braz decide então entrar para a vida política. Com o objetivo de fazer Muriaé prosperar como suas empresas, elege-se Prefeito Municipal de Muriaé para o mandato de 2005/2008, numa disputa marcante, conseguindo sobre o candidato adversário a maior diferença de votos na história do Município. Era o reconhecimento popular ao seu trabalho e a confiança de passar-lhe às mãos o destino do Município.
Em 2008, mais uma vitória nas urnas e José Braz se torna o primeiro Prefeito reeleito da história de Muriaé, deixando um legado de mais de 1.100 grandes obras públicas.
Em 2012, elege seu sucessor à Administração Municipal, seu Vice-Prefeito, Aloysio Aquino.
De princípios retos, o muriaeense é também reconhecido pela grande dedicação à família. Sempre rodeado pelos 9 netos e 21 bisnetos, José Braz tem um amor incondicional pela esposa, D. Lédia, para quem mandou construir uma réplica do Cristo Redentor de 32 metros de altura, em Muriaé, criando assim mais um ponto turístico para a cidade.
Extremamente ativo, José Braz decide então diversificar o ramo de atuação e coloca em plena execução a Franco Suíço Empreendimentos Imobiliários, construtora responsável pelo maior complexo imobiliário residencial e comercial de Muriaé, além da criação de novos bairros e loteamentos no Município. 
Atualmente, é membro da comitiva nacional do Partido Progressista e se dedica à administração de suas empresas, mas continua trabalhando como importante agente político em Muriaé e região, vislumbrando inclusive, quem sabe?, disputar as eleições municipais de 2016.
Um homem que chega aos seus 90 anos de idade  com muita saúde e disposição para o trabalho, com grande poder de liderança e enorme prestígio conquistado nos cenários político e empresarial do País. Esse é o meu avô, José Braz, quem muito me inspira e a quem tenho como grande exemplo de vida. 
Parabéns, vô! Obrigado por tudo e que Deus conserve nossa família unida e nos dê força para continuar trabalhando por um país melhor!
Muito obrigado."
2015-10-29T11:26;"RECURSOS HÍDRICOS, CRISE, IMPACTO AMBIENTAL, CORRELAÇÃO, MINAS GERAIS, MUNICIPIOS, PREOCUPAÇÃO, REGISTRO.
POÇO, PERFURAÇÃO, COMPANHIA DE SANEAMENTO DE MINAS GERAIS (COPASA), RISCOS (SEGURANÇA), ANÁLISE.";DISCURSO ENCAMINHADO;"PRONUNCIAMENTO ENCAMINHADO À MESA PARA PUBLICAÇÃO
	O SR. RENZO BRAZ (Bloco/PP-MG. Pronunciamento encaminhado pelo orador.) - Sr. Presidente, Sras. e Srs. Deputados, sabemos que a crise hídrica tem causado grandes problemas em muitas cidades brasileiras. Essa é a realidade encontrada, por exemplo, em vários Municípios mineiros, onde a estiagem prolongada é responsável por fortes impactos socioeconômicos e ambientais.
	Estudos recentes demonstram que, na região norte do Estado de Minas Gerais, a falta de chuvas tem deixado pastos secos e sem alimento suficiente para os animais. Inclusive muitos criadores de gado, preocupados com o prolongamento da estiagem, preferem comercializar parte do rebanho, o que causa efeitos negativos na economia de diversas cidades. No setor agrícola, a preocupação em relação ao déficit de chuvas também assume grande proporção. Hoje é comum encontrarmos agricultores abandonando terras ou mesmo não renovando a plantação, tudo para evitar prejuízos financeiros maiores.
	Vemos, portanto, o quanto a produção agropecuária mineira tem sofrido com o permanente quadro de chuvas escassas. E o que ainda é mais grave: essas consequências econômicas refletem diretamente na qualidade de vida da população, sobretudo das famílias dos próprios produtores agropecuários. Diante de índices de produtividade cada vez menores, essas famílias sentem de perto os perversos efeitos da estiagem prolongada e revelam, com intensa nitidez, o lado social dessa preocupante crise hídrica.
	Dados levantados pela Agência Reguladora dos Serviços de Abastecimento de Água e Esgotamento Sanitário de Minas Gerais - ARSEA-MG nos traz a crítica situação enfrentada pelo nosso Estado. Dos 622 Municípios mineiros que têm serviços de saneamento regulados pela ARSEA, 117 já decretaram situação de emergência por causa da seca. Os outros 231 Municípios que têm os serviços de saneamento vinculados às Prefeituras, também já praticam cortes e, em algumas cidades, o racionamento.
	Sr. Presidente, devo lembrar, ainda, que a diminuição nos níveis de vários reservatórios espalhados pelo interior do Estado de Minas Gerais tem feito o sistema de abastecimento de Belo Horizonte bater sucessivos recordes negativos. Ou seja, os problemas decorrentes da estiagem assumiram uma proporção tão elevada que os efeitos já são notados por toda a região mineira.
	Atenta à rápida evolução do problema, a Companhia de Saneamento de Minas Gerais - COPASA, com a crescente perfuração de poços, tem investido na busca de águas subterrâneas. Tal iniciativa, ainda que represente medida de caráter emergencial, pode gerar, para alguns especialistas, risco de superexploração, com consequências ambientais difíceis de serem avaliadas.
	Nobres Parlamentares, a crise hídrica no Estado de Minas Gerais e nos demais Estados brasileiros, pelo dimensionamento alcançado, merece total atenção; atenção voltada não somente para as medidas que podem diminuir os efeitos desse grave problema, mas também para as ações que evitem crises futuras.
	Muito obrigado."
2015-11-19T10:44;BRASIL, ORÇAMENTO PÚBLICO, SONEGAÇÃO FISCAL, DÍVIDA ATIVA, TEMA, ANÁLISE, CORRELAÇÃO, SINDICATO NACIONAL DOS PROCURADORES DA FAZENDA NACIONAL (SINPROFAZ), PESQUISA, REGISTRO.;DISCURSO ENCAMINHADO;"PRONUNCIAMENTO ENCAMINHADO À MESA PARA PUBLICAÇÃO
	O SR. RENZO BRAZ (Bloco/PP-MG. Pronunciamento encaminhado pelo orador.) - Sr. Presidente, Sras. e Srs. Deputados, R$ 258 bilhões é o valor que o Brasil deixou de receber devido à sonegação de impostos somente no primeiro semestre deste ano. No início do mês de novembro, o prejuízo já passava dos R$ 400 bilhões e, até o fim do ano, passará de meio trilhão de reais.
	São números que parecem impalpáveis, difíceis de conceber até mesmo para o cidadão que já se acostumou a ver nos jornais as enormes cifras do déficit brasileiro. Enquanto, por pura ineficiência, o País deixa de arrecadar esses valores, no Congresso Nacional somos obrigados a lidar com a delicada situação de um Orçamento da União deficitário.
	Para tentar resolver o problema, o Governo vende para os brasileiros a ideia de que é necessário se sacrificar. A população, segundo esse discurso, é obrigada a suportar o aumento de impostos e a precarização dos serviços públicos para que o País possa sair da crise econômica em que foi colocado. O que o Governo não conta é que existe outro caminho para fechar essa conta; existem meios que não cobram do cidadão comum a solução para uma crise que não foi ele quem criou. 
	Para mim, são ainda um mistério as razões de o Governo não concentrar esforços no combate à sonegação e na cobrança dos débitos tributários inscritos na Dívida Ativa da União. Se os valores sonegados fossem reavidos pela economia brasileira, não seria necessário aumentar impostos nem cortar investimentos. O montante a ser recuperado supera, e muito, o valor necessário para equilibrar o orçamento e passarmos a ter uma economia superavitária. 
	Senhoras e senhores, a sonegação é o tipo de corrupção que mais sangra a economia brasileira. Em levantamento da TJN - The Justice Network, uma rede internacional pela justiça fiscal, o Brasil ocupa o segundo lugar no ranking de sonegação no mundo. 
	Especialistas afirmam que, por ano, o País recupera cerca de R$ 13 bilhões em impostos sonegados. Considerando que a sonegação anual tem alcançado os R$ 500 bilhões, esse valor é irrisório. Os outros quase R$ 490 bilhões são perdidos para a lavagem de dinheiro, o subfaturamento de exportações, o superfaturamento de importações e outros mecanismos de sonegação. 
	Se estendermos o enfoque para toda a Dívida Ativa da União (DAU), que representa o dinheiro que o Estado brasileiro tem a receber judicialmente de pessoas físicas e jurídicas, chegamos à assustadora cifra de mais de R$ 1 trilhão em débitos tributários até o mês de julho. 
	De acordo com o Sindicato Nacional dos Procuradores da Fazenda Nacional (SINPROFAZ), dois terços dessa dívida são de apenas 12 mil empresas. Esses grandes devedores acabam beneficiados pela ineficiência do Governo em reaver os valores sonegados, enquanto o Brasil enfrenta a recessão com redução de benefícios, paralização das obras do PAC, aumento e criação de impostos, cortes no Orçamento e outras medidas que geram mais impactos negativos na qualidade de vida da população do que impactos positivos nos resultados da economia.
	Iniciativas como a discriminação, na nota fiscal, dos impostos pagos ao adquirir um produto e o Impostômetro, placar que calcula a cada segundo quanto o brasileiro já pagou de impostos naquele ano, já desenvolveram nos cidadãos a consciência de que pagam muito para a manutenção de um Estado que retribui pouco. 
	Essa é uma revolta justa. O brasileiro comum tem seus impostos retidos na fonte e paga um pouco mais a cada compra que realiza. Esses impostos não podem ser sonegados. Os maiores devedores do Estado brasileiro, ao contrário, são grandes empresas que se aproveitam da leniência das leis ou da ineficiência da fiscalização e cobrança do pagamento de impostos.
	O Sonegômetro, ferramenta disponível na internet, mostra os valores perdidos para a sonegação e calcula que, a cada hora, o Brasil deixa de receber tributos suficientes para comprar 735 ambulâncias equipadas, ou para construir 1.690 casas populares de 40 metros quadrados ou, quem sabe, construir 4.287 salas de aula equipadas.
	Portanto, senhoras e senhores, o que a sonegação faz com o Brasil é privar seus cidadãos de uma boa qualidade de vida. Se desde 2013 os brasileiros bradam contra a corrupção e identificam nela a culpada pela péssima qualidade dos serviços públicos, é preciso lembrar que a sonegação está diluída nesse processo. Os brasileiros que quitam seus impostos em dia não podem continuar pagando a conta daqueles que não pagam. E o pior: sem sequer terem consciência de que os valores cobrados são tão altos devido à inadimplência de outros. 
	Muito obrigado."
2015-12-08T17:08;RESPONSABILIDADE, EMPRESA DE MINERAÇÃO, SAMARCO, ROMPIMENTO, BARRAGEM, MARIANA (MG), DEFESA, FISCALIZAÇÃO, PROVIDÊNCIA, REPARAÇÃO, PREJUÍZO, RIO DOCE.;DISCURSO ENCAMINHADO;"PRONUNCIAMENTO ENCAMINHADO À MESA PARA PUBLICAÇÃO
	O SR. RENZO BRAZ (Bloco/PP-MG. Pronunciamento encaminhado pelo orador.) - Sr. Presidente, Sras. e Srs. Deputados, é preciso falar incansavelmente do desastre ocorrido em Mariana. Temos que cobrar providências sérias e emergenciais dos responsáveis por essa tragédia. Não podemos admitir a continuidade do descaso e da irresponsabilidade por parte das empresas e do Governo, que não correspondem ao tamanho do impacto em potencial desse desastre.
	Em seu rastro de destruição, a avalanche de toneladas de terra, lixo e detritos tóxicos, oriunda da barragem de rejeitos rompida, liberou cerca de 60 milhões de metros cúbicos de lama, levou vidas humanas, imóveis e lavouras, na tarde fatídica do último dia 5 de novembro. As imagens são recorrentes e continuam ainda muito vivas, enquanto nos chegam novas cenas da catástrofe. A tragédia continua se desdobrando em vários atos, para além do Distrito de Bento Rodrigues e de toda a região do entorno municipal. Até o último dia 30 de novembro, a lama já havia alcançado o mar a partir do balneário de Regência, em Linhares, Norte do Espírito Santo. Segundo informações divulgadas pelo Instituto Brasileiro do Meio Ambiente - IBAMA, a área marítima atingida pelos rejeitos é de 80 quilômetros quadrados.
	No curso da enxurrada, o Rio Doce foi contaminado, e a biodiversidade, fortemente atingida, com a devastação de populações inteiras de animais e impactos terríveis sobre a flora. Vai levar muito tempo até que a natureza volte a ostentar a mesma exuberância. Na avaliação de especialistas, se nada for feito para recuperar o meio ambiente da Bacia do Rio Doce, a recomposição da vegetação poderá demorar de 20 a 30 anos.
	É um desastre sem precedentes. Porém, ainda mais dramática que os gravíssimos danos ao meio ambiente, mais dramática que as ameaças à saúde pública é a conta dos mortos, dos desaparecidos, dos ilhados, dos desalojados.
	Os relatos de horror e medo dos sobreviventes são chocantes. A lama sepultou esperanças. A economia local foi destroçada, e os prejuízos crescem, à medida que o material tóxico e fétido avança. A atividade pesqueira está inviabilizada, pela morte dos cardumes, e se não fosse isso, pela contaminação.
	Sr. Presidente, as repercussões são, portanto, de ordem humana, social, ambiental e econômica. O que todos nos perguntamos é se tudo isso não poderia ser evitado.
	É claro que as razões técnicas e não técnicas do episódio ainda estão por ser definitivamente esclarecidas. O que, porém, já está fora de dúvida é a responsabilização da Samarco, operadora da barragem. Cabe a ela, liminarmente, a segurança de suas operações. Do ponto de vista ambiental, quem assume direta ou indiretamente o risco de desenvolver determinada atividade deve se responsabilizar pelos efeitos que isso possa acarretar, independentemente da licitude da conduta.
	Outras duas barragens de rejeitos da mesma Samarco estão sob risco, tiveram duas estruturas comprometidas e apresentam fator de segurança abaixo do admitido; podem se romper a qualquer momento. Na barragem de Santarém, o fator de segurança é de 1,37; na de Germano, de 1,22. Esse fator é estabelecido por norma técnica. Para estruturas em condições normais de operação, o fator de segurança é de 1,5, no mínimo; em condições adversas, é admitido 1,3. O índice igual a 1 significa que a estrutura está no limite de equilíbrio.
	Atenta a essa alarmante situação, a Justiça Estadual de Minas Gerais, determinou, em 27 de novembro, o esvaziamento da Usina Hidrelétrica Risoleta Neves, localizada em Santa Cruz do Escalvado, para a contenção de rejeitos de mineração em caso de novos rompimentos das barragens em Mariana. A empresa continua informando que está realizando obras emergenciais nas duas barragens, com o objetivo de aumentar a segurança e, assim, evitar novas catástrofes.
	Mas o que vemos, na realidade, é o descumprimento de todas as medidas estabelecidas, tais como: acatar o prazo de dois dias concedidos pela Justiça para esvaziar a represa de Candonga; proceder à efetivação de um plano de emergência com informações sobre possíveis cenários em caso de rompimentos; e, quem sabe, respeitar os compromissos financeiros com seus funcionários e fornecedores quanto ao prazo estabelecido para depositar a quantia de R$ 292.011.480,07, referente à primeira das duas parcelas do acordo firmado entre a mineradora e o Ministério Público Federal - MPF. A empresa deveria ter disponibilizado R$ 500 milhões até o dia 26 de novembro.
	Para o ocorrido, no entanto, não há mais uma solução de fato reparadora. Resta ao poder público - e isso é o que lhe cumpre fazer - responsabilizar, de forma severa, transparente e exemplar, a Vale, dona da Samarco, juntamente com a anglo-australiana BHP, que também deve ser punida, inclusive com multas pesadas.
	A Justiça já havia determinado, com acerto, a imposição de multa diária de R$ 10 milhões, caso a mineradora não conseguisse obstar a chegada da lama ao mar. Já o Ministério Público Estadual, por seu turno, determinou que a Samarco arque com o abastecimento de água das populações atingidas. Além disso, as empresas terão de arcar com outros custos de atendimento à população, inclusive a reconstrução de casas e estradas.
	Sr. Presidente, a data de 5 de novembro de 2015 estará para sempre marcada na memória dos brasileiros. O que se impõe doravante é a responsabilização dos culpados, além da fiscalização intransigente.
	Que outros dias como esse não se repitam!
	Muito obrigado."
2016-03-02T17:42;FUNDAÇÃO DOS ECONOMIÁRIOS FEDERAIS (FUNCEF), PREVIDÊNCIA FECHADA, DEFICIT, PROTESTO, APOSENTADO, PENSIONISTA, MANIFESTAÇÃO COLETIVA, APOIO, INSTITUTO DE SEGURIDADE SOCIAL DOS CORREIOS E TELÉGRAFOS (POSTALIS), FUNDAÇÃO PETROBRÁS DE SEGURIDADE SOCIAL (PETROS), CAIXA DE PREVIDÊNCIA DOS FUNCIONÁRIOS DO BANCO DO BRASIL (PREVI), GESTÃO, PRECARIEDADE, FISCALIZAÇÃO, DEFESA, COMISSÃO ESPECIAL, FUNDOS DE PENSÃO, PREVIDÊNCIA FECHADA, TRABALHO, EXPECTATIVA.;DISCURSO ENCAMINHADO;"PRONUNCIAMENTO ENCAMINHADO À MESA PARA PUBLICAÇÃO
	O SR. RENZO BRAZ (Bloco/PP-MG. Pronunciamento encaminhado pelo orador.) - Sr. Presidente, Sras. e Srs. Deputados, milhares de brasileiros que passaram décadas trabalhando e contribuindo para fundos de pensão veem agora os recursos de suas aposentadorias ameaçados por déficits bilionários nessas entidades. Em vez de viverem a tranquilidade da aposentadoria, enfrentam as turbulências causadas pela má gestão de um patrimônio que lhes custou muito esforço construir.
	É o caso dos participantes da Fundação dos Economiários Federais - FUNCEF, o fundo de pensão da Caixa Econômica Federal. Aposentados e trabalhadores da ativa convivem com a perspectiva de terem, dentro de pouco tempo, descontos em suas aposentadorias e vencimentos para equacionar o déficit bilionário do fundo. 
	Já foi aprovada pelo comando da entidade uma proposta para cobrir o déficit de R$ 5,1 bilhões de um entre seus quatro planos de benefícios, que vem tendo resultados negativos desde 2012. Quase 2 bilhões de reais deverão ser pagos pelas partes num prazo de 17 anos, a começar em maio deste ano.
	Representados por um grupo de aposentados, os economiários da FUNCEF têm promovido protestos em Brasília em defesa de seus direitos. Os Camisetas Azuis, sempre presentes nas reuniões da CPI dos Fundos de Pensão, reclamam da má gestão do patrimônio da entidade e atribuem os maus resultados a investimentos ruins feitos pela diretoria do fundo.
	Em situação semelhante estão os participantes de outros grandes fundos de pensão, como o POSTALIS, dos Correios; o PETROS, da PETROBRAS; e a PREVI, do Banco do Brasil. De acordo com matéria publicada pelo jornal O Globo, o déficit atuarial desses quatro fundos chega a R$ 46 bilhões, como resultado de má gestão, investimentos arriscados, agravamento da crise econômica e aparelhamento político das entidades.
	O relatório da CPI dos Fundos de Pensão, a ser divulgado nas próximas semanas, deve acabar confirmando a associação de todos esses elementos na crise dos fundos de pensão, e é preciso encontrar soluções para que esses problemas deixem de colocar em risco a aposentadoria de milhares de pessoas.
	Entre as iniciativas já anunciadas pela Superintendência Nacional de Previdência Complementar (PREVIC) para contornar a situação, estão a exigência de qualificação dos dirigentes de fundos de pensão e a realização de convênio com o Banco Central para que o Estado possa impedir a realização de investimentos fadados ao fracasso. A essas medidas é preciso somar o trabalho legislativo e fiscalizatório desta Casa.
	Nesta oportunidade, manifesto meu apoio aos aposentados da FUNCEF que vieram protestar na Câmara dos Deputados, ao passo que reafirmo meu compromisso de trabalhar pelo avanço do tema nas discussões desta Casa.
	Começo por cobrar a continuidade dos trabalhos da Comissão Especial dos Fundos de Pensão, da qual sou membro titular. Criada em meados do ano passado para ""estudar e apresentar propostas com relação à fiscalização das entidades de previdência complementar"", a Comissão Especial poderá dar importantes aportes a essa discussão.
	Tenho certeza de que há entre os nobres colegas membros da Comissão toda a disposição para levar adiante os estudos e propostas sobre o tema. Não podemos ficar inertes frente aos anseios daqueles que, após anos de esforços, veem em risco suas aposentadorias em decorrência da crise dos fundos de pensão.
	Muito obrigado."
