dataHoraInicio;keywords;tipoDiscurso;transcricao
2016-04-19T14:57;"COMPROMISSO, ORADORA, LUTA, INVESTIMENTO PÚBLICO, EDUCAÇÃO. 
DEFESA, VOTO FAVORÁVEL, ADMISSIBILIDADE, IMPEACHMENT, DILMA ROUSSEFF, PRESIDENTE DA REPÚBLICA.";COMO LÍDER;"A SRA. PROFESSORA DORINHA SEABRA REZENDE (DEM-TO. Como Líder. Sem revisão da oradora.) - Boa tarde, Sr. Presidente, Sras. e Srs. Deputados. Eu gostaria de começar a partir de como finalizou a Deputada Erika Kokay: viva a democracia! viva o respeito às divergências! viva o respeito às instituições!
	Sou uma Deputada que tem uma marca muito direcionada e tenho procurado, no meu mandato, consagrar este tema: educação. O Deputado Izalci esteve comigo na luta pelo Plano Nacional de Educação. 
	Eu gostaria de lembrar a esta Nação que quem se manteve firme nos 10% do PIB para a educação foi a Oposição. 
	Lembro ainda que o CAQi deve ser respeitado. Houve inclusive uma emenda de minha autoria que trata dele. Quando a matéria foi ao Senado, foi retirada a contribuição e colaboração da União ao CAQi. E o quê é o CAQi? É o Custo Aluno-Qualidade Inicial. Quanto custa uma boa escola? 
	Com quanto entrarão os Municípios, os Estados e a União, a qual tem a responsabilidade de complementação? Nós enfrentamos uma grande batalha por essa complementação, que deveria vir da União.
	Quero lembrar também que eu, sozinha, inclusive no dia da votação do Orçamento deste ano, mantive a obstrução, para que fosse preservado o orçamento da educação. 
	Lembro que o orçamento do Ministério da Educação veio com um corte significativo de bilhões em relação a 2015, que já tinha sido um ano ruim. 
	A educação infantil, que é uma área estratégica para todos nós da educação, teve um corte superior a 85%; área do transporte escolar, sem o qual as crianças e os jovens não chegam à escola, veio zerada. Isso veio de um governo que diz ter compromisso com uma Pátria Educadora. 
	Sou professora, sim, e tenho orgulho do trabalho que realizo como educadora, mas também das minhas lutas aqui permanentes pelo cumprimento do piso salarial. 
	Quero lembrar que, se muitos professores hoje não têm um piso salarial garantido, é porque a União não faz a sua complementação. Estados e Municípios vêm fazendo a sua parte. Embora a legislação tenha previsão da complementação da União, isso não acontece. Nunca aconteceu em nenhum Estado e em nenhum Município. 
	Por que estou dizendo isso ao falar da educação? Contribuí e vou continuar lutando pela universidade federal do meu Estado e por todas as universidades. 
	Como eu disse no dia da votação do orçamento da educação, nós conseguimos que o Relator Ricardo Barros incluísse os recursos que haviam sido cortados para programas importantes da educação. 
	É muito fácil dizer que a educação é prioridade, que a Pátria é educadora, mas, na hora de consignar recursos, não os assegurar. 
	Por isso, em momento nenhum, eu me envergonho de ter votado ""sim"" no domingo. 
	Faço parte da Comissão de Orçamento, assim como o fiz em 2014 e em 2015. Fui inclusive autora de um voto em separado sobre o Projeto de Lei do Congresso Nacional nº 5, de 2015.
	Quero lembrar que pedaladas fiscais não existem; são crimes fiscais. Hoje inclusive vi uma boa entrevista da jornalista Míriam Leitão falando sobre isso. Na verdade, é proibido operação de crédito em ano de eleição. Mas em outros anos é proibido qualquer tipo de operação de crédito no Banco do Brasil e na Caixa Econômica Federal, que são bancos públicos. 
	Às vezes nós ouvimos, durante o debate, pessoas dizendo que não era empréstimo, que era apenas atraso de pagamento. Atraso de bilhões? O Governo poderia atrasar a parte dos serviços do banco, mas não mandar o banco bancar o programa, e foi isso o que aconteceu. Não são programas sociais, apenas 1,58%. Foram recursos destinados ao BNDES, a operações do Plano Safra e de outra natureza. 
	Quero lembrar a todos que não estamos brincando de trabalhar. Muita gente disse que o voto no domingo mostrou o perfil da Câmara. Quero lembrar que nós tínhamos 10 segundos para dizer ""sim"" ou ""não"". Para isso, debatemos mais de 40 horas. Eu, assim como vários Deputados, tive oportunidade de dizer claramente, em 12 minutos, em nome do meu partido, que o crime fiscal aconteceu, que mais de 55 bilhões comprometeram o funcionamento da Caixa Econômica Federal e do Banco do Brasil. Quem busca hoje um financiamento sabe como a Caixa Econômica teve que mudar suas regras. Isso foi registrado nos balanços dos dois bancos. Isso é proibido; não é empréstimo. Banco público não é boteco, onde se faz uma relação de continhas e depois vai pagar. O dinheiro tem que vir antes, para serem saldados os compromissos. Isso não aconteceu. Ocorreu uma operação ilegal de créditos, ficou muito claro. 
	Eu fui Secretária de Educação e sei como funcionam os decretos de suplementação. Só se pode fazer suplementação se houver recursos disponíveis. Os recursos de suplementação aconteceram mesmo num cenário em que não havia orçamento disponível, em que havia crise fiscal, tanto que a meta foi alterada. 
	Se não é verdade, por que o Projeto de Lei do Congresso Nacional nº 14, de 2015? Se não é verdade que tínhamos problemas fiscais, se não era necessário, se existia condição legal, por que o PLN 5/15?
	Eu continuo na minha responsabilidade como Deputada. Como disse no dia em que falei em nome do meu partido, reconheço os avanços, pois sou da área da educação, que tem políticas significativas no fortalecimento do atendimento à criança e ao jovem, mas não podemos esquecer qual foi a crise que vivemos num ano em que houve ampliação, sim, de atendimento sem que houvesse recursos. Qualquer pai de família sabe que só pode comprar o que tem dinheiro para pagar. Com a União, não é diferente.
	No ano de 2014, houve ampliação absurda, indevida, irregular e ilegal do atendimento em vários programas da educação e em programas sociais, sem que houvesse amparo legal para saldar esses compromissos. 
	Por isso, essas operações de crédito aconteceram de maneira velada, de maneira a ludibriar o Banco Central. Não sou eu que estou dizendo isso.
	Não é verdade também que vários Governadores e Prefeitos fizeram isso. A lei em que existe a previsão é uma lei que regula a União. Além disso, nós somos responsáveis pela União. Quem achar que deve resolver o problema do Governo no seu Estado ou no seu Município deve fazê-lo de maneira formal. A nossa tarefa é cuidar da fiscalização e da responsabilização da União.
	Foi ferida a Lei Orçamentária e a Lei de Responsabilidade Fiscal e há amparo para o processo, senão já teríamos sido paralisados por tantas instituições que têm interesse no assunto. 
	O meu respeito e o meu trabalho continuam, pois votei com seriedade. Não aceitei, mas recebi muitas ofertas. Hoje basta olhar em vários sistemas de comunicação quem votou a favor, como foi privilegiado e que favores obteve. 
	Eu ando de cabeça erguida, porque fiz o meu trabalho e a minha campanha sem estar amarrada a nenhum grupo político. Trabalho com dignidade e procuro honrar os votos da educação e o trabalho que tenho realizado dentro de todas as Comissões. Votei de cabeça erguida, sim.
	Não existe golpe. Golpe é não respeitar uma instituição como a PETROBRAS, que tem uma importância significativa para a geração de recursos e para a manutenção do Plano Nacional de Educação. Não há dinheiro, Sr. Presidente, e não há ação para que se possa arcar com o cumprimento dos 10% do PIB na educação e na saúde. 
	Por isso votei com a cabeça erguida e acredito que de forma correta nesta Casa. Há uma responsabilização que precisa ser enfrentada. Todos nós, enquanto Deputados, vamos responder por isso. Eu respondo porque sei e acredito - isso ficou muito claro para nós na Comissão de Orçamento - que existe crime fiscal e que, portanto, deve haver responsabilização.
	Muito obrigada, Sr. Presidente."
2016-04-27T20:58;REQUERIMENTO DE RETIRADA DE PROPOSIÇÃO, PRC 8/2007, PROJETO DE RESOLUÇÃO DA CÂMARA DOS DEPUTADOS, ALTERAÇÃO, REGIMENTO INTERNO DA CÂMARA DOS DEPUTADOS, CRIAÇÃO, COMISSÃO PERMANENTE, COMISSÃO DOS DIREITOS DA MULHER DO IDOSO DA CRIANÇA E DO ADOLESCENTE DA JUVENTUDE E MINORIAS, ORIENTAÇÃO DE BANCADA, VOTO CONTRARIO, DEMOCRATAS (DEM).;ORIENTAÇÃO DE BANCADA;"A SRA. PROFESSORA DORINHA SEABRA REZENDE (DEM-TO. Pela ordem. Sem revisão da oradora.) - O Democratas quer primeiro, Presidente, esclarecer que a criação dessas Comissões em nada afeta a Secretaria e a Procuradoria da Mulher. São atribuições diferentes, e uma das coisas que nós quisemos assegurar no Colégio de Líderes foi que todas as atribuições e responsabilidades da Secretaria da Mulher e da Procuradoria serão mantidas.
	Então, o Democratas vota ""não""."
2016-06-20T18:20;"PLANO NACIONAL DE EDUCAÇÃO (PNE), ANIVERSÁRIO. 
AUSÊNCIA, CUMPRIMENTO, META, PLANO NACIONAL DE EDUCAÇÃO (PNE).
CÂMARA DOS DEPUTADOS, PRIORIDADE, EDUCAÇÃO, DEFESA,";BREVES COMUNICAÇÕES;"A SRA. PROFESSORA DORINHA SEABRA REZENDE (DEM-TO. Sem revisão da oradora.) - Sr. Presidente, Sras. e Srs. Deputadas, eu gostaria de lembrar a esta Casa e ao nosso País que, neste mês, o Plano Nacional de Educação completará 2 anos.
	Na minha ilusão de que a educação realmente fosse prioridade, eu pensava que o debate do Plano Nacional de Educação seria prioritário no Congresso Nacional. No entanto, após 2 anos da sua aprovação, com várias metas definidas para cumprimento neste ano, nós estamos fechando o segundo ano sem nenhuma meta cumprida integralmente. Isso representa um grave risco para a educação.
	O Plano Nacional de Educação define responsabilidades, metas e estratégias para a União, para os Estados e para os Municípios. Cada ente federado tem seu compromisso assumido, para que nós tenhamos uma carreira decente, que possa atrair os melhores profissionais para a educação. Todas as vezes que nós assistimos às manchetes internacionais colocando o Brasil como um dos piores países avaliados no exame do PISA, as pessoas se perguntam, como se, naturalmente, a educação pública brasileira fosse ruim.
	Eu gostaria de lembrar que nós fazemos os piores investimentos. E, neste momento, em que se discute teto de aplicação, recursos para a saúde, para a educação, quero lembrar que este País não tem o direito de reduzir nenhum centavo da educação. Nós temos ainda crianças estudando em escolas inadequadas, crianças que andam 3 ou 4 ou 5 horas em carros inadequados, correndo risco de vida para chegar à escola. Não adianta termos prédio bonito se não tivermos professor respeitado e valorizado.
	São 2 anos do Plano Nacional de Educação e 10% do PIB para se chegar a um país que tem compromisso com a educação. A nossa luta é encontrar fontes de financiamento, e existem alternativas. Não existe nenhum espaço para que Município, Estado ou a própria União possam reduzir recursos da educação. Existe espaço, sim, para crescimento. O País precisa assumir esse compromisso público, ainda que de maneira temporária. É preciso fazer a diferença e acreditar na educação.
	Quero lembrar que, neste momento, estamos discutindo uma base nacional curricular. O que significa isso, Sras. e Srs. Deputados? Significa dizer ao Brasil, a cada escola, em qualquer um dos Estados, dos Municípios, seja da zona rural, seja da zona urbana, seja das áreas indígenas, que seus alunos têm o direito de aprender. Nós não queremos só vaga, merenda e chegada à escola. Nós queremos que essa escola seja importante para a vida dos brasileiros. Nós queremos garantir a qualidade desse aprender. Isso só será feito com seriedade, com compromisso com uma nova base curricular, com compromisso com a formação de professores.
	E quero fazer um lembrete a todos nós políticos: a educação tem que ser um espaço de dedicação e de responsabilidade. A escolha dos gestores escolares faz diferença. Temos que ter um compromisso de verdade, não só em palanques públicos e políticos, com a educação.
	Eu gostaria de fazer um apelo aos senhores: vamos lutar para que à educação seja dada prioridade, uma prioridade de verdade, com recursos públicos que valorizem a responsabilidade dos nossos professores.
	A educação brasileira de qualidade é um compromisso de cada um de nós, independentemente de partido político, independentemente dos nossos Estados e Municípios. Cada brasileiro deseja ter uma educação de qualidade.
	Obrigada.
	O SR. PRESIDENTE (Carlos Manato) - Muito obrigado, nobre Deputada."
2016-09-13T12:34;DISCUSSÃO,  MPV 729/2016,  MEDIDA PROVISORIA, APOIO.;DISCUSSÃO;"A SRA. PROFESSORA DORINHA SEABRA REZENDE (DEM-TO. Sem revisão da oradora.) - Sr. Presidente, na verdade, essa medida provisória foi reeditada. Ela procura dar uma racionalidade, procura dar mais efetividade aos recursos disponíveis dentro do Programa Brasil Carinhoso.
	O Relator, Senador Cristovam Buarque, acolheu grande parte das emendas, melhorou enormemente o texto, procurando atender aos pequenos Municípios, quanto ao atendimento, e também incorporou uma mudança de redação, garantindo que no mínimo 50% dos recursos sejam transferidos aos Municípios.
	A nossa preocupação é de garantir políticas públicas de incentivo à primeira infância. Os resultados de aprendizagem ao longo da vida têm uma grande diferença em relação ao atendimento da criança na primeira infância.
	Então, na verdade, houve um avanço no relatório. Logicamente, nós queremos mais recursos para a educação infantil, pois temos metas a cumprir tanto no que se refere à creche quanto à pré-escola, inclusive com a universalização.
	Então, na verdade, eu creio que o texto enviado foi melhorado por ambas as Casas, e a nossa expectativa é de que seja votado e de que, realmente, os Municípios possam ter acesso a esses recursos. Poucos Municípios - e alguns deles, inclusive, com dificuldade de acesso -, com a nova legislação, poderão receber recursos para o atendimento das crianças nessa faixa etária."
2016-09-13T12:34;ORIENTAÇÃO DE BANCADA, DESTAQUE PARA VOTAÇÃO EM SEPARADO, ART 2º, ARTIGO (TEXTO LEGISLATIVO), PLV 26/2016, PROJETO DE LEI DE CONVERSÃO, MPV 729/2016, MEDIDA PROVISÓRIA, DEMOCRATAS (DEM), VOTO CONTRARIO.;ORIENTAÇÃO DE BANCADA;"A SRA. PROFESSORA DORINHA SEABRA REZENDE (DEM-TO. Pela ordem. Sem revisão da oradora.) - Sr. Presidente, Sras. e Srs. Deputados, embora compreenda a preocupação do Deputado Ivan Valente com o fato de os recursos da educação infantil poderem financiar também, no caso, as creches comunitárias e filantrópicas, eu gostaria de chamar a atenção porque em muitos lugares isso é impossível. Em muitos Municípios, são as creches confessionais comunitárias, creches que desenvolvem um trabalho filantrópico, que não cobram dos seus alunos. Nós não temos prédios públicos ainda nem serviço público. 
	É lógico que esta permissão é temporária, mas a realidade do Brasil hoje ainda requer em muitos Municípios que as creches ligadas a entidades filantrópicas e comunitárias funcionem. Desde que isso não gere prejuízo para a população, cobrando-se mensalidade, nós somos contrários a este destaque de supressão, pela preocupação com a realidade brasileira. 
	Eu compreendo o espírito de defesa em relação à instituição pública estatal, mas hoje nós não temos condições de fazer isso. As creches comunitárias - muitos de vocês as conhecem - são as únicas presentes em muitos Municípios brasileiros."
2016-10-06T14:00;DEFESA, CELERIDADE, APRECIAÇÃO, PL 6840/2013, PROJETO DE LEI ORDINÁRIA, ALTERAÇÃO, LDB, CRIAÇÃO, TEMPO INTEGRAL, ORGANIZAÇÃO, CURRÍCULO ESCOLAR, ÁREA TEMÁTICA, REFORMA, ENSINO MÉDIO, REGISTRO, HISTÓRICO ESCOLAR, EXAME NACIONAL DO ENSINO MÉDIO.;PEQUENO EXPEDIENTE;"A SRA. PROFESSORA DORINHA SEABRA REZENDE (DEM-TO. Sem revisão da oradora.) - Sr. Presidente, Sras. e Srs. Deputados, quero tratar de um tema importante que está em debate nesta Casa: o ensino médio. 
Eu fui Secretária de Educação - vejo aqui o Deputado Ságuas Moraes, que também foi Secretário de Educação -, e o nosso maior desafio é que o ensino médio tenha uma identidade.
	Hoje, infelizmente, milhares de jovens não conseguem se enxergar na escola, porque ela não os prepara para o mundo do trabalho, ela sequer consegue preparar e qualificar aquele que vai continuar a sua escolarização.
	Quero lembrar que esta Casa vem fazendo esse debate desde 2012. Numa Comissão Especial, por meio de um projeto de lei, finalizou um desenho. É importante corrigir alguns equívocos, um deles seria permitir ao aluno escolher o que vai estudar. O projeto que veio para cá tem grande proximidade com o que ficou acertado com o Conselho Nacional de Secretários de Educação.
	Que escola de ensino médio é essa que queremos? É possível, de acordo com o interesse da juventude, com a necessidade local do ponto de vista econômico, com as empresas ali instaladas que aquela escola tenha um desenho diferenciado? É possível um jovem aprender 19 disciplinas diferentes, com professores muitas vezes não qualificados, uma vez que várias delas foram criadas e estão fora da área deles? Eles têm que juntar várias disciplinas.
	É preciso que esse debate aconteça com urgência. Muitas pessoas dizem: ""Não é preciso ter pressa"". Mas o Brasil tem hoje os piores resultados no ensino médio, são gerações inteiras perdidas. 
	Gostaria que fosse aproveitado todo o trabalho resultante das audiências desde 2012, o trabalho feito pelos Deputados Reginaldo Lopes e Wilson Filho, e que fossem realizadas novas audiências. 
O que a juventude quer? Qual o desenho e qual a proposta da União Nacional dos Estudantes - UNE? Qual a proposta da Confederação Nacional dos Trabalhadores em Educação - CNTE?
	Eu apresentei um requerimento em que convido para virem aqui várias entidades, entre elas a Associação Nacional pela Formação dos Profissionais da Educação - ANFOPE, a Associação Nacional de Pós-Graduação e Pesquisa em Educação - ANPED. Enfim, todos aqueles que lidam com a formação de professores.
	Nós temos um trabalho muito grande ainda fazer: definir a Base Nacional Comum Curricular, ver o que deve ser trabalhado em qualquer escola, que tipo de formação de professores precisamos ter. É preciso mexer em toda a estrutura de formação, na produção de material didático, na parte de suporte, de laboratório.
	Não adianta pensarmos que uma lei que vai mudar o desenho do ensino médio vai dar conta desse desafio da qualidade. Esse é um passo importante, mas é um passo inicial, quanto ao debate sobre a nova formação de professores, a uma carreira atrativa, à produção de material didático e à escola que nós queremos. Escola que tenha somente sala de aula, cadeira, quadro e giz não vai conseguir agregar qualidade, muito menos preparar o jovem para o mundo do trabalho. 
	Eu acho que esse desafio é suprapartidário. Vários Deputados e Deputadas lidam com o tema educação, com o tema trabalho, com o tema cidadania. Eu gostaria que nós déssemos ao assunto a urgência necessária. Não podemos negar ao jovem o direito de aprender, de ocupar o seu espaço. 
O que é importante, Presidente? Esse desenho de escolas com diferentes ênfases é o que queremos? É possível garantir recursos diferenciados? Sem dinheiro diferente para equipar e estruturar as escolas, também não será possível construir esse novo ensino médio. 
A urgência é dada pelos números, pelos resultados do ensino médio, pelo desafio que hoje está nas mãos dos Estados. São eles que cuidam de 90% dos alunos dos nossos Estados e Municípios. As escolas técnicas e os institutos federais têm qualidade, merecem o nosso respeito e homenagem, mas hoje atendem a número muito pequeno de estudantes.
	Gostaria de chamar a todos para participar desse debate e dar suas contribuições. Volto a dizer: a reforma do ensino médio é urgente, sim!
	Sr. Presidente, peço a V.Exa. que o meu discurso seja divulgado no programa A Voz do Brasil.
	Muito obrigada.
	O SR. PRESIDENTE (Izalci) - Muito bem, Deputada Professora Dorinha.
	Acato o pedido de V.Exa."
2016-10-18T10:52;"DIA DO PROFESSOR. 
PROFESSOR, VALORIZAÇÃO, INVESTIMENTO, EDUCAÇÃO, DEFESA.";BREVES COMUNICAÇÕES;"A SRA. PROFESSORA DORINHA SEABRA REZENDE (DEM-TO. Sem revisão da oradora.) - Sr. Presidente, Sras. e Srs. Deputados, gostaria de lembrar a esta Casa que, no dia 15 de outubro, foi comemorado o Dia do Professor. 
Infelizmente, é um tema pouco abordado, com pouca importância no País e pouca importância nesta Casa e até mesmo na legislação que rege a educação.
	Todos em suas campanhas políticas, quando vão à tribuna, dizem que a educação é importante, que o magistério é a profissão mais importante e que engenheiro, médico e dentista não o seriam se não tivessem passado pela mão do professor.
	Mas queria fazer um lembrete. Este País vem esquecendo o professor. O piso salarial dos professores não é cumprido na maioria dos Municípios e Estados. A União jamais complementou 1 centavo para que Estados e Municípios pudessem ter carreira e piso salarial significativos. Temos desafios enormes na formação do professor.
	Hoje o País discute uma base nacional curricular, e com essa base nós precisaremos de novos professores. Mas, quero lembrar a este País que há falta de quase 30 mil professores. Poucos professores deixam seus filhos seguirem a carreira de professor. Lógico, todos nós, como pais, queremos um futuro melhor para os nossos filhos. As pesquisas mostram que o aluno do ensino médio não se interessa pela carreira de professor, e não é por acaso. A carreira é pouco atrativa, tem grandes exigências e precisa, na verdade, ser totalmente redefinida.
	Às vezes, oradores na tribuna, economistas dizem que o Brasil gasta muito com educação. Primeiro, educação não é gasto, é investimento. Segundo, a Organização para a Cooperação e Desenvolvimento Económico - OCDE mostra que o valor que nós investimos por aluno é um nono do que os outros países que participam das avaliações internacionais e são economicamente similares ao Brasil gastam.
	Não teremos educação de qualidade nem um sistema público de qualidade sem termos uma boa educação. Ter uma boa educação implica formação e valorização dos professores. Não defendo valorização sem responsabilidade - vejo aqui os Deputados Átila Lira e Thiago Peixoto, que foram Secretários de Educação e sabem do que estou falando. É preciso haver responsabilização, sim. É preciso que seja responsabilizado o professor que, infelizmente, muitas vezes, está doente para lecionar na escola pública e está bem para lecionar na escola privada.
	Para podermos cobrar cada vez mais desempenho e compromisso, precisamos também garantir investimentos. Lembro a este País que ainda há escolas funcionando em bares, em botecos, debaixo de árvores, enfim, escolas totalmente inadequadas. Além disso, o gasto por aluno no Brasil é um dos menores do mundo, principalmente na educação básica. Sem isso, o nosso País não vai dar salto de qualidade.
	Não consigo enxergar desenvolvimento econômico nem melhoria de crise sem investimento em educação. O meu Estado é um exemplo disso. Às vezes, uma empresa vai para determinada região, e os filhos daquele lugar não conseguem emprego, não têm uma boa formação. A educação, gostando ou não os economistas, é condição para o crescimento econômico, é necessidade para o desenvolvimento econômico.
	O nosso grande desafio é melhorar a formação, tornar a carreira atrativa e responsável e, acima de tudo, melhorar o investimento por aluno na educação básica - de longe, esse é o nosso maior desafio.
	Parabéns aos professores que atuam espalhados no nosso País, nas escolas do campo, nas escolas indígenas, nas escolas que nem poderiam ser chamadas de escolas, escolas que são depósitos de crianças, escolas sem qualidade! Parabéns aos professores do Brasil! 
Muito obrigada."
