dataHoraInicio;keywords;tipoDiscurso;transcricao
2015-10-07T14:48;"PLP 78/2015, PROJETO DE LEI COMPLEMENTAR, HÉLIO LEITE, DEPUTADO FEDERAL, AUTOR, FUNDO PENITENCIÁRIO NACIONAL (FUNPEN), REMUNERAÇÃO, ESTABELECIMENTO PENAL, CORPO DOCENTE, INSTRUTOR DE ENSINO, MONITOR DE ENSINO, COMISSÃO DE EDUCAÇÃO, APROVAÇÃO.
RECURSOS ORÇAMENTÁRIOS, EDUCAÇÃO, REDUÇÃO, PREOCUPAÇÃO.";BREVES COMUNICAÇÕES;"A SRA. PROFESSORA DORINHA SEABRA REZENDE (DEM-TO. Sem revisão da oradora.) - Sr. Presidente, Sras. e Srs. Deputados, eu gostaria de parabenizar o Deputado Hélio Leite, que hoje teve um projeto aprovado na Comissão de Educação, que permite, que incentiva os Estados e Municípios a darem algum tipo de valorização e gratificação aos professores que atuarem no sistema prisional, nas penitenciárias e, em especial, nos centros de atendimento aos jovens e adolescentes.
	Neste contexto de valorização, eu gostaria de fazer um apelo para que o País tivesse um olhar diferenciado para a educação e para os professores. No dia 19, nós vamos realizar uma sessão solene em homenagem aos professores.
	Queria lembrar que hoje milhares de professores espalhados pelo Brasil estão em greve. Na minha cidade de Palmas, os professores da rede municipal declararam greve.
	Este desafio de valorização da educação se torna cada vez mais permanente. E hoje, na Comissão de Educação, a apresentação da consultoria que trata do Orçamento nos chamou muito a atenção. O Orçamento de 2015 já é um orçamento muito duro com a educação, com uma redução de mais de 11 bilhões. O Orçamento de 2016 será ainda pior, com uma redução ainda mais significativa. Os próximos 4 anos mostram que nós não vamos cumprir o que estabelecemos como prioridade no Plano Nacional de Educação.
	Ouvimos dizer que a educação é prioridade. O lema deste País é: Brasil, Pátria Educadora. Se não houver uma atenção diferenciada para esta legislação, que tem uma importância estratégica para o País, para os nossos Municípios, para os nossos Estados, para que o Brasil saia das piores posições nacionais, vamos continuar do mesmo jeito, ocupando as piores posições, com professores desrespeitados, desvalorizados. É uma carreira que está longe de ser atrativa.
	A educação é estratégica para o desenvolvimento do nosso País. Mas, sem valorizar os profissionais de educação, sem garantir condições dignas de trabalho e continuação de programas estratégicos, estaremos longe de cumprir a nossa tarefa de garantia do direito à educação. Não basta ter vaga, não basta ter merenda. Isso é importante, mas a escola tem que cumprir a sua tarefa.
	O nosso desafio no Brasil é o desafio de aprender, de garantir que cada brasileiro, tendo nascido no meu Estado do Tocantins, em São Paulo, em Santa Catarina ou em Brasília, tenha o mesmo direito de ir à escola e que essa escola cumpra a sua tarefa. Essa é uma tarefa de todos nós.
	E quero fazer um apelo para o Congresso Nacional: que tenha uma atenção diferenciada com a educação. Todas as áreas são importantes, mas a educação é a área necessária para o desenvolvimento do trabalho, o desenvolvimento econômico e para garantias de saúde e de segurança. Eu tenho certeza de que o País pode fazer esse esforço diferenciado, valorizando e respeitando o professor.
	Daremos uma atenção especial em uma homenagem que será feita no dia 19, em uma sessão solene.
	Deixo este apelo: que nós possamos ter um olhar diferenciado para a educação.
	Muito obrigada, Sr. Presidente."
2015-10-15T12:36;DESTAQUE, RETIRADA, MESTRADO, PEC 395/2014, PROPOSTA DE EMENDA À CONSTITUIÇÃO, GRATUIDADE, ENSINO PÚBLICO, EDUCAÇÃO BÁSICA, EDUCAÇÃO SUPERIOR, CURSO DE GRADUAÇÃO, DOUTORADO, EXCLUSÃO, EXTENSÃO UNIVERSITÁRIA, DEFESA.;PELA ORDEM;"A SRA. PROFESSORA DORINHA SEABRA REZENDE (DEM-TO. Pela ordem. Sem revisão da oradora.) - Houve um debate na Comissão Especial e, por uma gentileza do Deputado Cleber Verde, eu excluí a figura do professor. Os cursos de formação e de pós-graduação para os professores estão ressalvados. Eles não poderão ser cobrados, nem residência médica. A preocupação nossa era justamente porque empresas podem comprar cursos específicos do seu interesse, mas professor, saúde e educação são prioridade. Então, isso foi ressalvado no texto. 
	Apresentei agora um destaque de supressão de mestrado profissional, se esse for o interesse das entidades, pelo que temos de informação e pela preocupação dessa manutenção. Então, eu já apresentei um destaque supressivo, porque o Relatório já foi votado na Comissão Especial, e agora só resta isso. Então, eu já tenho um destaque apresentado de supressão do termo ""mestrado profissional"".
	O SR. PRESIDENTE (Eduardo Cunha) -  O Democratas defende votar hoje ou adiar?
	A SRA. PROFESSORA DORINHA SEABRA REZENDE - Não. Se tiver quórum, não temos nenhuma questão de ressalvar...
(Desligamento automático do microfone.)"
2015-10-15T12:36;SESSÃO SOLENE, HOMENAGEM, DIA DO PROFESSOR, ANUNCIO, PROFISSIONAL DA EDUCAÇÃO, PLANO DE CARGOS CARREIRAS E SALÁRIOS, CRIAÇÃO, DEFESA.;COMO LÍDER;"A SRA. PROFESSORA DORINHA SEABRA REZENDE (DEM-TO. Como Líder. Sem revisão da oradora.) - Sr. Presidente, Sras. e Srs. Deputados, eu gostaria de lembrar que na segunda-feira, dia 19, realizaremos sessão solene em homenagem aos professores do Brasil.
	Esta Casa aprovou o Plano Nacional de Educação, que procura e tem metas bastante ousadas para a educação pública brasileira. Dentre elas está a obrigatoriedade de Municípios e Estados construírem novos planos de carreira que possam atrair os melhores profissionais para a educação e mudar a direção da nossa juventude.
	Hoje a maioria dos alunos do ensino médio não sonha em ser professor. Existe um déficit significativo de professores, e isso não ocorre por acaso. É uma carreira cujos salários não atraem os melhores. A saúde dos profissionais está sempre debilitada, os espaços físicos não são adequados. Milhares de professores no País têm suas cordas vocais prejudicadas, ficam doentes dia a dia devido ao espaço inadequado. O Presidente da Comissão de Educação, Deputado Saraiva Felipe apresentou proposta de construção de uma política, de um programa que vai cuidar da saúde vocal dos professores.
	Gostaria de lembrar a esta Casa e ao País hoje, quando todo o mundo se lembra do professor, fala da sua importância e reconhece a diferença. Não existe escola boa sem bom professor. Sua valorização é necessária. Uma escola com laboratório, biblioteca, piscina, estrutura física boa é ótimo, faz diferença, mas a qualidade da educação de um país é medida pela qualidade de seus professores. Só teremos boa educação, educação pública de qualidade se os melhores alunos quiserem ser professores.
	Alguns países do mundo fizeram a diferença porque trataram de maneira diferente os professores. Os melhores estão na escola, permanecem na escola.
	Infelizmente, pesquisas mostram que hoje a profissão de professor é passageira. Muitos se tornam professor, mas sonham em sair, porque sonham com uma vida melhor, com melhores condições de vida e trabalho.
	Esta Casa tem em suas mãos a chave. Aprovamos um piso salarial para os professores e temos a responsabilidade de aprovar diretrizes nacionais de carreira. Professor bom precisa ser bem pago, não pode trabalhar em várias escolas; professor bom precisa se sentir respeitado, tem que ficar na escola. Vamos cobrar desempenho deles, mas precisam ser respeitados.
	Gostaria de lembrar ao País que temos milhares de escolas e, na educação básica, mais de 55 milhões de alunos. O futuro deles depende dos professores; o futuro deles depende de um salário digno e de condições de trabalho aos professores. Nós podemos fazer a diferença.
	Infelizmente, a educação, este ano, sofreu corte de 11 bilhões de reais. No Orçamento do próximo ano, terá novo corte de 26%, mais 10 bilhões de reais.
	Os Municípios e os Estados, para cumprirem o piso salarial e construírem carreiras atrativas, precisam de ajuda. A União precisa cumprir sua tarefa de contribuir para o cumprimento do piso, mas, acima de tudo, construir uma educação pública de qualidade.
	Se este País quer ter uma história diferente no desenvolvimento econômico, terá que valorizar e respeitar os professores.
	Parabéns aos professores das escolas rurais, das escolas indígenas, das escolas urbanas; parabéns aos professores que doam sua vida e se dedicam a ensinar outras pessoas, a dividir seu aprendizado e a construir um novo futuro para o Brasil.
	Obrigada a todos."
2015-10-19T09:00;;FALA DO PRESIDENTE OU NO EXERCÍCIO DA PRESIDÊNCIA;"Ata da 315ª (tricentésima décima quinta) Sessão da Câmara dos Deputados, Não Deliberativa Solene, matutina, da 1ª Sessão Legislativa Ordinária, da 55ª Legislatura, em 19 de outubro de 2015. Às 9h36, o Sr. Izalci, nos termos do § 2º do artigo 18 do Regimento Interno, no exercício da Presidência, declarou aberta a sessão e deu por dispensada a leitura da ata da sessão anterior. O Sr. Presidente informou que a sessão destinou-se à homenagem ao Dia do Professor; prestou as devidas homenagens; e convidou para compor a Mesa as Sras. Professora Amábile Pacios, Presidente da Câmara de Ensino Superior da Federação Nacional das Escolas Particulares - FENEPE; Professora Dorinha Seabra Rezende, Deputada Federal, autora do requerimento; e o Sr. Álvaro Moreira Domingues Júnior, Presidente do Sindicato das Escolas Particulares do Distrito Federal - SINEP. O Sr. Presidente convidou todos a ouvir o Hino Nacional executado pelo Duo do Corpo de Bombeiros do DF, Tenente Walter e Subtenente Fernanda. Após proferir discurso do Sr. Eduardo Cunha, Presidente da Câmara dos Deputados, convidou todos para a exibição do vídeo institucional. Nos termos do § 2º do artigo 18 do Regimento Interno, assumiu a Presidência a Sra. Professora Dorinha Seabra Rezende e concedeu a palavra ao Sr. Izalci, autor do requerimento, que fez uso da palavra, ainda, pelo PSDB. Reassumiu a Presidência o Sr. Izalci, e concedeu a palavra à Sra. Professora Dorinha Seabra Rezende, autora do requerimento; e ao Sr. Jose Stédile, pelo PSB. O Sr. Presidente concedeu a palavra à Sra. Professora Amábile Pacios, componente da Mesa. O Sr. Presidente registrou a presença de convidados, reiterou as homenagens prestadas, agradeceu a presença de todos e, às 10h18, encerrou a sessão.
Carlos Manato
Presidente

Delegado Edson Moreira
Secretário

As notas taquigráficas desta Sessão Não Deliberativa Solene poderão ser solicitadas ao Departamento de Taquigrafia, Revisão e Redação - DETAQ."
2015-10-19T09:00;;HOMENAGEM;"Ata da 315ª (tricentésima décima quinta) Sessão da Câmara dos Deputados, Não Deliberativa Solene, matutina, da 1ª Sessão Legislativa Ordinária, da 55ª Legislatura, em 19 de outubro de 2015. Às 9h36, o Sr. Izalci, nos termos do § 2º do artigo 18 do Regimento Interno, no exercício da Presidência, declarou aberta a sessão e deu por dispensada a leitura da ata da sessão anterior. O Sr. Presidente informou que a sessão destinou-se à homenagem ao Dia do Professor; prestou as devidas homenagens; e convidou para compor a Mesa as Sras. Professora Amábile Pacios, Presidente da Câmara de Ensino Superior da Federação Nacional das Escolas Particulares - FENEPE; Professora Dorinha Seabra Rezende, Deputada Federal, autora do requerimento; e o Sr. Álvaro Moreira Domingues Júnior, Presidente do Sindicato das Escolas Particulares do Distrito Federal - SINEP. O Sr. Presidente convidou todos a ouvir o Hino Nacional executado pelo Duo do Corpo de Bombeiros do DF, Tenente Walter e Subtenente Fernanda. Após proferir discurso do Sr. Eduardo Cunha, Presidente da Câmara dos Deputados, convidou todos para a exibição do vídeo institucional. Nos termos do § 2º do artigo 18 do Regimento Interno, assumiu a Presidência a Sra. Professora Dorinha Seabra Rezende e concedeu a palavra ao Sr. Izalci, autor do requerimento, que fez uso da palavra, ainda, pelo PSDB. Reassumiu a Presidência o Sr. Izalci, e concedeu a palavra à Sra. Professora Dorinha Seabra Rezende, autora do requerimento; e ao Sr. Jose Stédile, pelo PSB. O Sr. Presidente concedeu a palavra à Sra. Professora Amábile Pacios, componente da Mesa. O Sr. Presidente registrou a presença de convidados, reiterou as homenagens prestadas, agradeceu a presença de todos e, às 10h18, encerrou a sessão.
Carlos Manato
Presidente

Delegado Edson Moreira
Secretário

As notas taquigráficas desta Sessão Não Deliberativa Solene poderão ser solicitadas ao Departamento de Taquigrafia, Revisão e Redação - DETAQ."
2015-10-21T17:06;REQUERIMENTO DE DESTAQUE DE VOTAÇÃO EM SEPARADO, ART 2º, ARTIGO (TEXTO LEGISLATIVO), JUÍZ, TRIBUNAL, ATENDIMENTO, PREFERÊNCIA, ORDEM CRONOLÓGICA, DESPACHO, SUBSTITUTIVO, PL 2384/2015, PROJETO DE LEI ORDINÁRIA, DISCIPLINAMENTO, ADMISSIBILIDADE, RECURSOS EXTRAORDINÁRIO, RECURSO ESPECIAL, ORIENTAÇÃO DE BANCADA, DEMOCRATAS (DEM), MANUTENÇÃO, VOTO CONTRÁRIO.;ORIENTAÇÃO DE BANCADA;"A SRA. PROFESSORA DORINHA SEABRA REZENDE (DEM-TO. Pela ordem. Sem revisão da oradora.) - Sr. Presidente, o Democratas entende que a palavra ""preferencialmente"" tira, sim, a transparência e o direito.
	Queria lembrar ao Deputado Fernando Coelho que também seria interessante respeitar os prazos. Existem projetos que chegam e, com 1 mês, estão sendo votados; existem projetos importantes em tramitação há vários anos, e não são tratados. O termo ""preferencialmente"" deve ser retirado, mantido o texto que foi debatido através do CPC.
	O Democratas se manifesta pelo voto ""não""."
2015-10-21T17:06;AGRADECIMENTO, APROVAÇÃO, PL 8140/2014, PROJETO DE LEI ORDINÁRIA, OBRIGATORIEDADE, COLOCAÇÃO, DENOMINAÇÃO, MÉDICO, DIPLOMA, CURSO SUPERIOR, PROIBIÇÃO, BACHAREL, MEDICINA.;PELA ORDEM;"A SRA. PROFESSORA DORINHA SEABRA REZENDE (DEM-TO. Pela ordem. Sem revisão da oradora.) - Sr. Presidente, o Deputado Mandetta, neste momento, está em uma audiência com vários médicos no Ministério da Saúde. Ele foi o autor dessa matéria. Na verdade, o objetivo desse projeto é fixar a denominação ""Médico"" como privativa dos diplomados em cursos de graduação em Medicina.
Como algumas universidades têm emitido diplomas com o título de ""Bacharel em Medicina"", alguns países, ao receber o diploma do Brasil com esse título, não o reconhecem. Hoje, com essa padronização, todas as universidades passarão a tratar de maneira homogênea, como foi feito por muitos anos, e o título acadêmico será ""Médico"".
	Quero agradecer, em nome do Deputado Mandetta, à Deputada Raquel Muniz, aos Deputados da Comissão de Educação e a todos os partidos aqui presentes. Na verdade, é uma correção que só facilita e respeita a área médica, que comemorou, no dia 18, o Dia do Médico."
2015-10-21T17:06;REQUERIMENTO DE DESTAQUE DE VOTAÇÃO EM SEPARADO, ART 1º, ARTIGO (TEXTO LEGISLATIVO), QUADRO DE PESSOAL, AGÊNCIA BRASILEIRA GESTORA DE FUNDOS E GARANTIAS (ABGF), GESTÃO, FUNDO DE ESTABILIDADE DO SEGURO RURAL (FESR), PLV 19/2015, PROJETO DE LEI DE CONVERSÃO, MPV 682/2015, MEDIDA PROVISÓRIA, ORIENTAÇÃO DE BANCADA, VOTO CONTRARIO, DEMOCRATAS (DEM).;ORIENTAÇÃO DE BANCADA;"A SRA. PROFESSORA DORINHA SEABRA REZENDE (DEM-TO. Pela ordem. Sem revisão da oradora.) - O Democratas encaminha o voto ""não"" ao texto.
	Eu queria chamar a atenção para o fato de que nós estamos ampliando para 2022 a data de concurso. E, o que é pior, diminuindo o percentual de cargos efetivos de 80% para 50%. É extremamente incoerente a posição, inclusive, do Governo."
2015-10-21T17:06;REQUERIMENTO DE DESTAQUE DE VOTAÇÃO EM SEPARADO, ART 1º, ARTIGO (TEXTO LEGISLATIVO), REMUNERAÇÃO, AGÊNCIA BRASILEIRA GESTORA DE FUNDOS E GARANTIAS (ABGF), GESTÃO, FUNDO DE ESTABILIDADE DO SEGURO RURAL (FESR), PLV 19/2015, PROJETO DE LEI DE CONVERSÃO, MPV 682/2015, MEDIDA PROVISÓRIA, ORIENTAÇÃO DE BANCADA, VOTO CONTRARIO, DEMOCRATAS (DEM).;ORIENTAÇÃO DE BANCADA;"A SRA. PROFESSORA DORINHA SEABRA REZENDE (DEM-TO. Pela ordem. Sem revisão da oradora.) - Sr. Presidente, o Democratas, primeiro, quer lembrar que isso não fazia parte do projeto original. Segundo, nós não somos contrários à gestão da Agência. Nós somos contrários à definição arbitrária pelo Executivo. Isso tem que ser discutido e debatido. Lembrando: essa Agência já existe, já tem equipe e já está em funcionamento, então, é uma atribuição nova de uma empresa que já existe.
	Então, nós somos contrários à definição da remuneração pelo Executivo."
2015-10-21T19:48;REQUERIMENTO DE ENCERRAMENTO DE DISCUSSÃO, PEC 395/2014, PROPOSTA DE EMENDA À CONSTITUIÇÃO, GRATUIDADE, ENSINO PÚBLICO, EDUCAÇÃO BÁSICA, EDUCAÇÃO SUPERIOR, CURSO DE GRADUAÇÃO, MESTRADO, DOUTORADO, EXCLUSÃO, EXTENSÃO UNIVERSITÁRIA, PRIMEIRO TURNO, ENCAMINHAMENTO DE VOTAÇÃO, FAVORAVEL.;ENCAMINHAMENTO DE VOTAÇÃO;"A SRA. PROFESSORA DORINHA SEABRA REZENDE (DEM-TO. Sem revisão da oradora.) - Sr. Presidente, Sras. e Srs. Deputados, eu queria, em primeiro lugar, por justiça ao Deputado Alex Canziani e ao Deputado Cleber Verde, dizer que, na Comissão Especial, houve um grande debate, para o qual as instituições foram convidadas. Nós temos, sim, uma grande dificuldade, porque muitas dessas instituições hoje vieram à Comissão de Educação para dizer que não tomaram posição institucional. 
	Quero dizer que, pela questão do princípio da gratuidade, nós deveríamos proibir todo tipo de cobrança. Nós vivemos num País em que o ensino superior privado, de verdade, é que atende à maioria das cidades e à formação de professores. O ensino superior privado é que está na maioria das cidades. 
	O ensino público e a gratuidade precisam, sim, ser respeitados. Por isso, na Comissão Especial, apresentei um destaque ressalvando a área da educação e a residência médica, porque dificilmente empresas terão interesse em financiar esses estudos e a formação dos professores. O Deputado Cleber Verde acolheu o meu destaque, garantindo a permanência da gratuidade para a formação de professores e a residência médica. 
	Eu gostaria de falar também sobre a realidade do orçamento para a educação. Este ano, nós vivemos um corte bilionário de mais de 11 bilhões de reais. O Orçamento que chegou a esta Casa tem um novo corte, que chega a quase 27%. Na área de pós-graduação, serão 15%, quase 16% a menos. Serão 48%, no geral, do Orçamento da Educação. As instituições de ensino superior colocam a sua angústia em relação ao seu funcionamento. 
	Eu queria lembrar que a PEC do Deputado Alex Canziani permite que as universidades cobrem. Em diversos momentos, nós tratamos da autonomia. Eu queria fazer, na verdade, essa discussão em relação à autonomia universitária. Nós continuamos mantendo o espaço dos conselhos universitários e dos conselhos de formação para deliberar. 
	Quanto ao mestrado profissional, eu apresentei um destaque de supressão, entendendo que seria uma forma de haver um acordo na votação. 
	Nós vamos voltar a esse debate, mas digo: a gratuidade na graduação precisa ser mantida. Se as instituições - e vários aqui se posicionaram contra a cobrança - permitem a cobrança na pós-graduação lato sensu, se vale para a lato sensu, vale para o mestrado profissional também. Eu não tenho meia gravidez, eu não tenho meia gratuidade. Ou vale para tudo ou não vale para nada. Quando eu digo tudo, estou dizendo que a graduação e o mestrado stricto sensu precisam ser preservados. É o fazer da universidade, é a sua dedicação ao ensino e à pesquisa. 
	O princípio do mestrado profissional tinha outra lógica, de formação específica e profissional, mas, mesmo assim, apresentei um destaque e haverá a oportunidade de, o Governo cumprindo o seu acordo, garantir um equilíbrio na distribuição da carga horária dos docentes e um equilíbrio dentro da universidade. Acredito que o mestrado profissional possa ser cobrado de acordo com os interesses, desde que a instituição se mantenha na sua lógica da gratuidade da graduação no stricto sensu e no respeito à área de formação de professores, que é área estratégica deste País, e à área da saúde. 
	Dizer que houve pouco tempo? Não. Acho que houve negligência, sim, de várias instituições que deviam mostrar a sua cara e o que elas defendem. A verdade é que eu ouvi de várias instituições que elas estão sucateadas, não têm laboratório, não têm estrutura de funcionamento, e a cobrança as tem ajudado a se manter. 
	Nós precisamos fazer essa discussão de fundo. O que nós queremos alcançar, no Brasil, com a educação pública, com os 10% do PIB e com o Orçamento? Não vamos fazer de conta. Nós vivemos um grave problema de orçamento e de prioridade para a educação. É o que as instituições dizem.
	Eu acho que a proposta de se votar hoje o primeiro turno é consensual, e nós vamos aguardar o cumprimento do acordo do Governo para sinalizar se vamos retirar ou não o destaque e a votação do segundo turno.
	Por isso o Democratas acha que, neste momento, nós já chegamos ao esgotamento da discussão. Vamos aguardar a Associação Nacional dos Dirigentes das Instituições Federais de Ensino Superior - ANDIFES e as instituições se manifestarem formalmente, descerem do muro e dizerem para o País o que querem, o que precisam e qual será a postura do Brasil no enfrentamento à questão da educação pública e da prioridade de orçamento.
	Se eu digo que vai ser tudo gratuito, tem que mudar o orçamento. Não dá para cortar quase 48%, não dá para tirar todo o dinheiro da educação infantil, como foi tirado. É prioridade ou não? Não pode ser prioridade, mas ""se virem com o orçamento que têm"". Hoje, com o dinheiro que há, os cursos não serão oferecidos. As universidades não têm condições de manter a oferta nem do mestrado stricto sensu, muito menos do profissional, tampouco da graduação lato sensu.
	Muito obrigada."
2015-12-02T13:52;PLN 5/2015, PROJETO DE LEI ORDINÁRIA, CONGRESSO NACIONAL, ALTERAÇÃO, LEI DE DIRETRIZES ORÇAMENTÁRIAS (LDO), LEI ORÇAMENTÁRIA ANUAL (LOA), ORÇAMENTO, SUPERAVIT, RECEITA, GOVERNO FEDERAL, PEDALADA FISCAL, CONTRARIEDADE.;PELA ORDEM;"A SRª PROFESSORA DORINHA SEABRA REZENDE (DEM-TO. Sem revisão da oradora.) - Sr. Presidente, na verdade, o Projeto de Lei do Congresso Nacional nº 5, de 2015, não tem nada que prejudique a universidade ou o funcionamento do País. É a ""assumência"" de um Governo que gastou o que não podia; é uma pedalada fiscal, sim; são recursos que foram desviados dos bancos; são recursos de déficit fiscal. Então, não existe prejuízo para a Nação. É a ""assumência"" de um Governo que gastou como e o que não podia e devia."
2015-12-08T15:40;BRASIL, EDUCAÇÃO, INSTITUTO FEDERAL DE EDUCAÇÃO CIÊNCIA E TECNOLOGIA (IFET), TOCANTINS, FAVORÁVEL, PROJETO DE LEI ORÇAMENTÁRIA, PLANO PLURIANUAL, PLANO NACIONAL DE EDUCAÇÃO (PNE), CORRELAÇÃO, PROFESSORA DORINHA SEABRA REZENDE, DEPUTADO FEDERAL, ORADOR, AUTORIA, EMENDA, APROVAÇÃO, REGISTRO.;PEQUENO EXPEDIENTE;"A SRA. PROFESSORA DORINHA SEABRA REZENDE (DEM-TO. Sem revisão da oradora.) - Sr. Presidente, eu gostaria de destacar que tive a oportunidade de apresentar, na forma de projeto de lei, a proposta de criação de várias estruturas dos institutos federais do meu Estado.
	Hoje eu assegurei no PPA e no relatório do Orçamento - o Relator acolheu uma proposta minha -, a quantia de 45 milhões de reais para o processo de implantação dessas estruturas. Os institutos federais têm uma importância significativa para o trabalho e para o fortalecimento do desenvolvimento regional.
	Eu gostaria ainda de lembrar que o documento em que veio a proposta do Poder Executivo ignorava o Plano Nacional de Educação. Com a atenção do Ministério da Educação e do Relator do Orçamento e do Plano Plurianual - PPA, nós também conseguimos garantir a ligação completa do PPA e do Plano Nacional de Educação. O Plano traz metas da creche à pós-graduação, a garantia e a busca de uma educação de qualidade para o nosso País, inclusive com a aprovação do Custo Aluno Qualidade Inicial - CAQi, que diz respeito aos seguintes aspectos: custo de uma boa escola; investimento necessário para a formação de professores...
	(Desligamento automático do microfone.)
	A SRA. PROFESSORA DORINHA SEABRA REZENDE - Vou concluir, Sr. Presidente.
	O CAQi compreende também a adoção de bons salários e a estrutura das escolas. O que faltar, a partir dos orçamentos de Estados e Municípios, a União vai complementar. Isso se chama CAQi - Custo Aluno Qualidade Inicial, o que é muito importante para a educação no País.
	Muito obrigada."
