dataHoraInicio;keywords;tipoDiscurso;transcricao
2016-11-18T15:00;;HOMENAGEM;"Ata da 297ª (ducentésima nonagésima sétima) Sessão da Câmara dos Deputados, Não Deliberativa Solene, vespertina, da 2ª Sessão Legislativa Ordinária, da 55ª Legislatura, em 18 de novembro de 2016. Às 15h22, o Sr. Herculano Passos, no exercício da Presidência, nos termos do § 2º do artigo 18 do Regimento Interno, declarou aberta a sessão e deu por dispensada a leitura da ata da sessão anterior. O Sr. Presidente informou que a sessão destinou-se à comemoração aos 80 anos da Associação Brasileira da Indústria de Hotéis - ABIH Nacional; prestou as devidas homenagens; e convidou para compor a Mesa a Sra. Magda Mofatto, Deputada Federal; e os Srs. Marx Beltrão, Ministro de Estado do Turismo; Dilson Jatahy Fonseca, Presidente da ABIH Nacional; e Vinicius Lummertz, Presidente do Instituto Brasileiro de Turismo - EMBRATUR. O Sr. Presidente convidou todos a ouvir o Hino Nacional, executado pelo Duo da Banda de Música do Corpo de Bombeiros Militar do Distrito Federal. O Sr. Presidente concedeu a palavra à Sra. Magda Mofatto, que proferiu discurso do Sr. Presidente da Câmara dos Deputados, Rodrigo Maia; e aos Srs. componentes da Mesa, Dilson Jatahy Fonseca, Vinicius Lummertz e Magda Mofatto. Nos termos do § 2º do artigo 18 do Regimento Interno, assumiu a Presidência a Sra. Magda Mofatto e concedeu a palavra ao Sr. Herculano Passos, autor do requerimento. Reassumiu a Presidência o Sr. Herculano Passos e anunciou a homenagem prestada pela ABIH aos Srs. Marx Beltrão, Vinicius Lummertz e ao Sr. Antônio Oliveira Santos, Presidente do Sistema CNC, SESC, SENAC e participante da história da ABIH. Reassumiu a Presidência a Sra. Magda Mofatto. Após ser homenageado, o Sr. Herculano Passos reassumiu a Presidência e anunciou a continuação da homenagem à Sra. Raimunda Helena Rodrigues de Araujo, profissional da hotelaria, representando todos os trabalhadores da hotelaria do Brasil; e aos Srs. participantes da história da ABIH: Eraldo Alves da Cruz, Presidente da ABIH Nacional - 2005 a 2007; Geraldo Castelli, Diretor da Castelli Escola Superior de Hotelaria; José Guilherme Schwam, Jornalista de Turismo; Mariah de Meirelles Fonseca, Presidente do Catussaba Resort Hotel; e Maurício Pinheiro de Medeiros, Jair Corrêa, Paulo César Boechat Lemos e Tadeu Pinto, hoteleiros. O Sr. Presidente concedeu a palavra, também, aos Srs. Raimundo Gomes de Matos, pelo PSDB; e Marx Beltrão, componente da Mesa. Usou da palavra pela ordem o Sr. Carlos Marun. Usaram da palavra, ainda, os Srs. Paulo César Boechat Lemos e Bruno Hideo Omori, Presidente da ABIH do Estado de São Paulo. O Sr. Presidente registrou a presença de convidados, reiterou as homenagens prestadas, agradeceu a presença de todos e, às 17h18, encerrou a sessão.

Marcus Vicente
Presidente

Carlos Manato
Secretário

As notas taquigráficas desta Sessão Não Deliberativa Solene poderão ser solicitadas ao Departamento de Taquigrafia, Revisão e Redação - DETAQ."
2017-04-26T12:22;SAUDAÇÃO, LUZIA MARIA FERREIRA, DEPUTADO FEDERAL.;PELA ORDEM;"A SRA. MAGDA MOFATTO (PR-GO. Pela ordem. Sem revisão da oradora.) - Deputada Luzia, seja bem-vinda!
	Sua presença faz com que a paridade de representação de homens e mulheres cada vez mais esteja presente nesta Casa. É um prazer muito grande saber que mais uma mulher está fazendo parte do Parlamento brasileiro.
	Seja sempre bem-vinda!"
2017-07-04T17:24;"CÉLIA MARIA DE MELLO, MÃE, JORGINHO MELLO, DEPUTADO FEDERAL, FALECIMENTO, PESAMES.
MICHEL TEMER, PRESIDENTE DA REPUBLICA, ATUAÇÃO, ELOGIO.";PELA ORDEM;"A SRA. MAGDA MOFATTO (PR-GO. Pela ordem. Sem revisão da oradora.) - Sr. Presidente, quero falar sobre o falecimento da mãe do nosso querido companheiro de partido Jorginho Mello, a D. Célia Maria de Mello.
	Se V.Exa. me permite, quero tratar de outro assunto, da coragem do Presidente da República, que, com grande maestria, grande dignidade e pulso firme, tem conduzido este País, que recebeu com dívidas, com crise política, com crise econômica, com crise financeira, com uma infinidade, com milhões de desempregados, e hoje consegue manter o seu equilíbrio econômico. Equilíbrio econômico, crescimento econômico quer dizer geração de empregos.
	Sr. Presidente, muito obrigada."
2017-08-02T14:36;PARECER CONTRÁRIO, COMISSÃO DE CONSTITUIÇÃO E JUSTIÇA E DE CIDADANIA (CCJC), SIP 1/2017, SOLICITAÇÃO PARA INSTAURAÇÃO DE PROCESSO, AUTORIZAÇÃO, INVESTIGAÇÃO, SUPREMO TRIBUNAL FEDERAL (STF), DENÚNCIA, MINISTÉRIO PÚBLICO FEDERAL (MPF), MICHEL TEMER, PRESIDENTE DA REPÚBLICA, VOTO FAVORÁVEL.;REGISTRO DE VOTO;"A SRA. MAGDA MOFATTO (PR-GO) - Sr. Presidente, pelo progresso e desenvolvimento do País, voto ""sim"". E pela coragem do nosso Presidente Michel Temer em fazer as reformas necessárias ao País, voto ""sim"" ao relatório.
	O SR. GIACOBO - Deputada Magda Mofatto: voto ""sim"". Total: 85 votos ""sim""."
2017-09-28T09:36;"TURISMO, GOIAS.
CRESCIMENTO ECONOMICO, RETOMADA.";BREVES COMUNICAÇÕES;"A SRA. MAGDA MOFATTO (PR-GO. Sem revisão da oradora.) - Muito obrigada, Sr. Presidente.
	Quero lembrar que ontem foi o Dia Internacional do Turismo. O Estado de Goiás, por ações governamentais, teve avanço e crescimento muito grandes, não só pelas ações de Governo, mas pelas ações da Goiás Turismo também, em cuja agência o jovem Leandro Garcia vem fazendo muito pelo Estado inteiro. Com isso, enquanto outros Estados perdem, Goiás está ganhando.
	Mas eu não poderia deixar de fazer um comentário também muito importante para a economia do País. Ainda há pouco, quando o Deputado Mauro Pereira falava das ações de Governo e da economia do País, eu escutei alguém o chamando de puxa-saco.
	Não é puxa-saco! O País está economicamente estável, economicamente equilibrado, por conta de ações do Governo. Essas ações do Governo têm dado retorno, o País tem se recuperado. Todos os jornais reconhecem isso.
	Temos uma crise política, mas não uma crise econômica. O País está nos trilhos.
	O SR. PRESIDENTE (Carlos Manato) - Muito obrigado, Deputada."
2017-10-25T16:50;PARECER CONTRÁRIO, COMISSÃO DE CONSTITUIÇÃO E JUSTIÇA E DE CIDADANIA (CCJC), SIP 2/2017, SOLICITAÇÃO PARA INSTAURAÇÃO DE PROCESSO, AUTORIZAÇÃO, INVESTIGAÇÃO, SUPREMO TRIBUNAL FEDERAL (STF), DENÚNCIA, MINISTÉRIO PÚBLICO FEDERAL (MPF), MICHEL TEMER, PRESIDENTE DA REPÚBLICA, ELISEU LEMOS PADILHA, WELLINGTON MOREIRA FRANCO, MINISTRO DE ESTADO, VOTO FAVORÁVEL.;REGISTRO DE VOTO;"A SRA. MAGDA MOFATTO (PR-GO.) - Sr. Presidente, o Brasil não pode parar. O meu voto é ""sim"".
	O SR. GIACOBO - Deputada Magda Mofatto: voto ""sim"". Total: 77 votos."
2017-12-14T09:12;"PADRE BERNARDO (GO), FESTA NATALINA, REALIZAÇÃO.
TURISMO, CHAPADA DOS VEADEIROS (GO), ANÁLISE.";BREVES COMUNICAÇÕES;"A SRA. MAGDA MOFATTO (PR-GO. Sem revisão da oradora.) - Obrigada.
	Eu quero parabenizar a cidade de Padre Bernardo, aqui no Entorno de Brasília, que está com uma programação de Natal chamada Natal Luz e Sonhos.
	É uma ação inédita, que envolve toda a sociedade e todas as escolas, para a realização de apresentações com decoração natalina maravilhosa e com a participação dos estudantes do Município.
	Também quero lembrar o incêndio que houve na Chapada dos Veadeiros. A cidade de Alto Paraíso, ponto central da Chapada dos Veadeiros, já começou a se reestabelecer e a fazer ações para recuperar o turismo local. Neste fim de semana, vai realizar um festival gastronômico em parceria com a agência de turismo de Goiânia, a Goiás Turismo, comandada por Leandro Garcia.
	Esse início de recuperação da Chapada dos Veadeiros, quase destruída por um incêndio, realmente começa a dar retorno, mostrando para o País que, por meio de ações positivas, é possível, sim, recuperar toda uma região.
	Muito obrigada, Sra. Presidente."
2018-04-24T16:32;CORA CORALINA, EX-ESCRITOR, DENOMINAÇÃO, HOMENAGEM, PROJETO, CORUMBÁ DE GOIÁS (GO), GOIÁS (GO), VALORIZAÇÃO, LEANDRO GARCIA, PRESIDENTE, AGÊNCIA, TURISMO, GOIÁS, GESTÃO, CONGRATULAÇÃO.;PELA ORDEM;"A SRA. MAGDA MOFATTO (PR-GO. Pela ordem. Sem revisão da oradora.) - Muito obrigada, Sr. Presidente.
	Eu quero parabenizar o Presidente da Goiás Turismo, Agência Estadual de Turismo de Goiás, Leandro Garcia, que, brilhantemente, fez o projeto Caminho de Cora Coralina, que está em funcionamento. Saindo da cidade de Corumbá de Goiás, no percurso de cerca de 300 quilômetros há possibilidade de realização de trilhas a pé e ciclismo, até a nossa querida cidade de Goiás, à casa de Cora Coralina, que hoje é um museu. Com isso mostra porque Goiás é hoje o Estado que mais gera empregos através do turismo.
	Então, ficam registrados a nossa homenagem, o nosso agradecimento e os nossos cumprimentos a esse grande Secretário, que, com o apoio do Governo do Estado, tem feito muito. 
Com esse roteiro das cidades históricas já temos o começo da geração de emprego e renda, inclusive nas fazendas. 
	O SR. PRESIDENTE (Carlos Manato) - Muito obrigado, Deputada. 
	Vamos divulgar o seu pronunciamento no programa A Voz do Brasil."
