dataHoraInicio;keywords;tipoDiscurso;transcricao
2015-11-10T20:16;DILMA ROUSSEFF, PRESIDENTE DA REPÚBLICA, INAUGURAÇÃO, TRECHO, OBRA, TRANSPOSIÇÃO DE ÁGUAS DO RIO SÃO FRANCISCO, ALAGOAS, CRÍTICA, PERDA, VOLUME (MEDIDA), RIO, APREENSÃO.;PELA ORDEM;"O SR. JHC (PSB-AL. Pela ordem. Sem revisão do orador.) - Sr. Presidente, Sras. e Srs. Deputados, Deputado Sibá Machado, na semana passada a Presidenta Dilma esteve em solo alagoano, foi inaugurar mais uma ilusão de ótica. Foram propagar o Canal do Sertão Alagoano como o maior rio de Alagoas.
	Eu quero dizer que o maior rio de Alagoas, o Rio São Francisco, está morrendo. Esse é o verdadeiro canal do Sertão, mas está sendo subutilizado. Não há um projeto de captação de água. Tem gado pastando no meio do Rio São Francisco; tem peixe de água salgada no meio do Rio São Francisco. Então, as águas do Velho Chico não vão mais bater no meio do mar.
	Está lá um projeto que já está se tornando obsoleto, porque não existe energia ao longo do canal e nada brota naquela terra do Sertão alagoano.
	Deixo aqui meu registro. Espero que esse projeto não sirva como mais uma ilusão ao povo brasileiro.
	Muito obrigado."
2015-11-19T17:26;"CONGRATULAÇÃO, PRESENÇA, JOVEM, ESPÍRITO SANTO, SEMINÁRIO, EMPRESA JÚNIOR.
QUESTIONAMENTO, EMPRESA BRASILEIRA DE INFRAESTRUTURA AEROPORTUÁRIA (INFRAERO), FALTA, FUNCIONAMENTO, EQUIPAMENTO, AEROPORTO, MACEIÓ (AL). 
ANIVERSÁRIO, PROALCOOL.
DIA NACIONAL DE ZUMBI E DA CONSCIÊNCIA NEGRA.";BREVES COMUNICAÇÕES;"O SR. JHC (PSB-AL. Sem revisão do orador.) - Sra. Presidenta, Sras. e Srs. Deputados, diversos assuntos me trazem à tribuna no dia de hoje. 
	Primeiro, eu gostaria de parabenizar todos os jovens capixabas que estiveram hoje pela manhã comigo em um seminário para tratar de empresas juniores. As empresas juniores hoje correspondem a uma boa parte dos 30 mil alunos que já se dedicam, nas faculdades e universidades, a prestar serviços ao povo brasileiro e a propagar o empreendedorismo. Então, esta Casa tem o compromisso de regulamentá-las. Fui Relator, na Comissão de Constituição e Justiça, e agora nós vamos dar os passos finais para propor o arcabouço jurídico necessário, uma legislação moderna e eficiente, a fim de que esses jovens possam fomentar cada vez mais o empreendedorismo. 
	Recebi também um ofício da Associação Brasileira das Agências de Viagens de Alagoas, e nós estamos indo agora à INFRAERO para saber o porquê de os fingers lá em Maceió não estarem funcionando. Maceió recebe milhares de turistas. Para dar uma resposta aos consumidores, em termos de melhor acompanhamento e melhor serviço, nós vamos saber por que um aeroporto ainda novo, um aeroporto moderno, está passando por uma crise tamanha em relação à sua infraestrutura, como ar-condicionado e fingers. 
	Nesta semana o PROÁLCOOL completa 40 anos, um projeto que interiorizou a economia do nosso País, um projeto bonito, o da matriz energética renovável. Mas, infelizmente, os combustíveis fósseis ainda tendem a nos rodear sobremaneira para que não revertamos essa matriz energética em um meio de consumo mais barato, mais eficiente e também ambientalmente mais correto.
	Também estamos comemorando o 20 de novembro. Em 1955, na Capitania de Pernambuco, nascia Zumbi dos Palmares, que é alagoano da cidade de União dos Palmares. Foi ele que segurou, até os últimos momentos, o maior quilombo, o Quilombo dos Palmares, que tinha aproximadamente 30 mil homens.
	Por fim, lamento, mais uma vez, pelo Canal do Sertão. A Presidenta Dilma esteve em Alagoas para inaugurar a terceira etapa do Canal do Sertão, mas agora anuncia, pelo Ministério do Planejamento, um corte de 50 milhões de reais. Isso é lamentável. Isso mostra que o programa do Canal do Sertão não veio atender à demanda da população, mas a fins eleitoreiros, ao longo dos anos, o que é lamentável.
	Sra. Presidenta, eu gostaria de agradecer a sua benevolência e dizer que nós estamos à disposição da juventude brasileira e do povo de Alagoas. Peço que o meu discurso seja divulgado pelos meios de comunicação da Casa e no programa A Voz do Brasil.
	Muito obrigado.
	A SRA. PRESIDENTA (Jozi Araújo) - Caro Deputado, determino a divulgação do seu pronunciamento pelos meios de comunicação da Casa."
2015-11-26T17:39;"COMISSÃO PARLAMENTAR DE INQUÉRITO, CRIME CIBERNÉTICO, PACOTE DE DADOS, DEBATE.
COMISSÃO MISTA PERMANENTE SOBRE MUDANÇAS CLIMÁTICAS, SECA, REGIÃO NORDESTE, ALAGOAS, DEBATE.
EXTRA, JORNAL, ALAGOAS, ANIVERSÁRIO, HOMENAGEM.
DIA NACIONAL DA CONSCIÊNCIA NEGRA, ZUMBI DOS PALMARES, SERRA DA BARRIGA, ALAGOAS.
AEROPORTO, MACEIÓ (AL), MELHORIA, PROVIDÊNCIAS, EMPRESA BRASILEIRA DE INFRAESTRUTURA AEROPORTUÁRIA (INFRAERO).
PROJETO DE LEI ORDINÁRIA, DADOS, INFORMAÇÃO, BANCO, EXTRATO DE CONTA BANCÁRIA.";PELA ORDEM;"O SR. JHC (PSB-AL. Pela ordem. Sem revisão do orador.) - Sr. Presidente, Sras. e Srs. Deputados, telespectadores que nos assistem pela TV Câmara, servidores da Casa, nesta semana, na CPI dos Crimes Cibernéticos, se discutiram os pacotes de dados oferecidos pelas operadoras. Efetivamente, o que está acontecendo?
	As operadoras de telefonia, com o advento da Internet, com a chegada dos smartphones, têm conseguido uma forma de arrecadar mais, de lucrar mais. Como? Elas se utilizam deste bem essencial para a vida de cada um de nós, que é a Internet, visando aumentar seus lucros. Chegam a mudar a regra do jogo após ter sido iniciado. Ou seja, os usuários fazem contrato pré-pago ou pós-pago. De repente, aqueles que contrataram determinado pacote de dados são surpreendidos com mensagens como: ""Oitenta por cento dos seus dados já foram utilizados"". A partir daí, os consumidores ficam sem Internet. Isso atinge especialmente os jovens e as pessoas que mais precisam.
	Todos sabemos que o WhatsApp faz ligações. Esse programa democratiza a comunicação. Nós não temos como proibi-lo. Podemos até regulamentá-lo, mas não podemos retroceder em algo que beneficia a população. Eu chamei justamente a atenção para esse fato na presença dos diretores de todas as companhias.
	Ademais, na última concorrência, algumas operadoras do Nordeste ficaram responsáveis por fazer a interiorização desse serviço, disponibilizando sinais de telefonia na zona rural. Porém isso não vem acontecendo e é algo que também vamos cobrar. Nesta Casa temos que nos posicionar quanto a isso. São milhares de pessoas, especialmente jovens, conectadas. Essa geração, a geração Y e agora a geração Z, já nasceu conectada. Nós não podemos retroceder.
	Na Internet, seria a mesma coisa que oferecer um serviço e dizer: ""Olhe, você vai falar ao celular, mas, se você quiser que ele funcione bem, você vai pagar mais, senão você vai falar com uma chiadeira no fim"". Então se fala, mas com chiado. Agora, se quiser falar ao celular com ligação limpa, vai ter que pagar mais.
	Isso é inaceitável. Nós sabemos que existe uma discussão muito forte sobre neutralidade de rede. Nós não podemos pegar essa rede mundial oferecida para toda a população em dimensões planetárias, que é a Internet, para comunicação. Pelo contrário, temos que promover Internet eficiente e rápida e políticas públicas voltadas para isso. Não podemos fazer o que o Governo fez: anunciar um programa nacional de banda larga obsoleto. Nós, que já estamos sendo ultrapassados por outros países, ainda vamos anunciar corte de recursos.
	Então, venho aqui defender a sociedade, os consumidores. Clientes dessas operadoras estão sendo lesados porque seus pacotes de dados sofrem redução de velocidade de conexão, ou então simplesmente não existe esse serviço, não existe Internet.
	Sr. Presidente, nesta semana participamos de reunião na Comissão Mista Permanente sobre Mudanças Climáticas e discutimos tema presente e recorrente: a seca, principalmente no Nordeste brasileiro.
	No início da década de 90, no Governo Geraldo Bulhões, foi idealizado o Canal do Sertão. Há algumas semanas, o Líder do Governo veio a esta Casa dizer que foi inaugurado em Alagoas o maior rio de Alagoas, o Canal do Sertão. O maior rio de Alagoas é o Rio São Francisco, o rio de todos os brasileiros, e está morrendo. Há gado pastando no meio do rio, peixe e água salgada no meio do rio e não há projetos eficientes de revitalização ou de captação dessa água.
	Então os projetos ao longo do Canal do Sertão estão como aquela velha máxima de que as obras no Brasil se tornam obsoletas antes de ficarem prontas, o que é uma pena. É isso que está acontecendo em Alagoas. Já foi inaugurada a terceira etapa do Canal do Sertão - 1 bilhão de reais gastos, dinheiro público, dinheiro nosso, do contribuinte brasileiro -, mas estão fazendo todo o canal sem energia elétrica. Não vai se conseguir captar água do Canal do Sertão para beijar o solo arenoso das terras dos sertanejos.
	Os sertanejos estão em situação de emergência em Alagoas. Como pode haver um programa que visa melhorar a vida de 1 milhão de pessoas em 42 cidades? Hoje 30 cidades em Alagoas estão em estado de emergência? Algo muito estranho está acontecendo. Já há Tomada de Contas Especial do Tribunal de Contas da União para investigar supostas irregularidades nesses aditivos aos contratos da obra do Canal do Sertão, e o Governo Federal já anunciou cortes também nessas obras.
	Nós ficamos a nos perguntar: por que uma obra brilhante, fantástica como essa está servindo apenas para propaganda política? São políticos que fazem discurso sobre a miséria do povo, que não tem água sequer para beber, para produzir, para plantar, para subsistir. É triste essa realidade. Eu falo com profunda tristeza. Nós queremos sim resgatar a esperança do sertanejo.
	Sr. Presidente, eu gostaria ainda de fazer um registro e parabenizar o jornal Extra, de Alagoas, que há 17 anos presta informações com independência e muita coragem, falando muitas vezes o que jornais de Alagoas ficam intimidados de falar. Então, na pessoa de seu idealizador, Fernando Araújo, rendo esta homenagem a todos os profissionais que levam a informação através do jornal Extra, de Alagoas.
	Sr. Presidente, eu gostaria da tolerância de V.Exa. para falar do último dia 20 de novembro, na Serra da Barriga, o ventre da liberdade. Antes mesmo de outros guerreiros, líderes negros, como Nelson Mandela, Martin Luther King, houve no Brasil Zumbi dos Palmares, batizado Francisco, que ajudava nas missas. Ele foi capturado, mas voltou para lutar durante 15 anos pela liberdade. Zumbi comandou o maior quilombo, o Quilombo dos Palmares, com 30 mil quilombolas, à época, resistindo à Coroa Portuguesa, à Capitania de Pernambuco e às fazendas de escravos. Ele não se curvou.
	Precisamos dar maior atenção à Serra da Barriga não só por ser local de peregrinação no dia 20 de novembro, mas sim todos os dias, com sua culinária afro, com sua tradição. Nós temos que movimentar e dar publicidade. Faço um apelo ao Ministério do Turismo e a todos os meios de comunicação para que visitem a Serra da Barriga, conheçam nossa história, na belíssima cidade de União dos Palmares.
	Sr. Presidente, aproveito para agradecer também à INFRAERO por ter nos recebido. O Aeroporto de Maceió receberá milhares de turistas. Só no primeiro bimestre, mais de 500 mil turistas passarão por lá. O Deputado Izalci visita muito nossa Capital, nosso Estado. Faço um convite a todos os Parlamentares. Alagoas é um Estado belíssimo, de riquezas naturais.
	O aeroporto se encontra com as pontes e os fingers paralisados; o aparelho de ar-condicionado estava com problema; não há departamento médico. Nós levamos todas essas reivindicações, que já começaram a acontecer. A INFRAERO já trocou a peça do condicionador de ar e trouxe funcionários. Todos os visitantes da querida Maceió já podem chegar lá com maior conforto e melhor qualidade.
	Essas outras questões, como os fingers, as pontes de embarque e desembarque, já estão indo de Florianópolis para Maceió. As medidas, as providências estão sendo tomadas.
	O SR. PRESIDENTE (Mauro Pereira) - Conclua, Deputado.
	O SR. JHC - Concluo, Sr. Presidente.
	Eu gostaria de agradecer a Solimar, que nos recebeu tão bem.
	Por fim, Sr. Presidente, projeto de nossa autoria trata de dar maior transparência à gestão pública, determinando que os bancos repassem todos os dados ao povo brasileiro através de extratos bancários e não por meio das instituições, medida que conseguimos aprovar na Assembleia Legislativa do Estado de Alagoas.
	Agradeço a benevolência ao Presidente, ao atuante Deputado Izalci e a todos os brasileiros, especialmente à juventude.
	Esta semana, continuaremos com nossa agenda em Alagoas.
	Sr. Presidente, gostaria que ao meu pronunciamento fosse dada publicidade nos meios de comunicação da Casa, especialmente no programa A Voz do Brasil."
2015-12-01T18:26;COMISSÃO PARLAMENTAR DE INQUÉRITO (CPI), BTG PACTUAL, BANCO, INVESTIGAÇÃO, CRIAÇÃO, DEFESA.;PELA ORDEM;"O SR. JHC (PSB-AL. Pela ordem. Sem revisão do orador.) - Sr. Presidente Gilberto Nascimento, venho na tarde de hoje dar conhecimento ao Plenário de uma CPI que nós estamos propondo para investigar o banco BTG Pactual.
	Tivemos uma ótima oportunidade na CPI da PETROBRAS, mas lamentavelmente falhamos na missão. Através da Justiça, começaram a vir as primeiras respostas. Ou seja, mais uma vez esta Casa fica a reboque de outras instituições. Passamos à margem das discussões. Depois somos obrigados a tratar dos mesmos temas, quando lá atrás poderíamos ter utilizado as nossas prerrogativas para, no instrumento da defesa da sociedade, dar as respostas necessárias e pôr luz e transparência no que está obscuro.
	Ocorreu a ascensão desse banco com o seu Presidente, André Esteves. A empresa declarou recentemente que ele entrou como um PHD - poor, hungry and desperate to get rich -, ou seja, pobre, faminto e desesperado para ser rico. Assim, em nosso País, nessa relação generosa com o Estado brasileiro, ele conseguiu fazer o banco, no qual ele imaginava poder produzir sua riqueza, tanto material como profissional, e chegar ao patamar que tanto desejou.
	Nós temos dois instrumentos pelos quais podemos materializar essa CPI. O primeiro é um projeto de resolução em que fique instituída a Comissão Parlamentar de Inquérito, através do art. 55 da Constituição Federal, combinado com o art. 35 do Regimento Interno, para que possamos instalá-la, mesmo havendo cinco CPIs em funcionamento.
	Há outro requerimento também - art. 58 da Constituição Federal, combinado com os arts. 35, 36 e 37 do Regimento Interno.
	Então, eu estou dando conhecimento disso à Casa. Já estão sendo colhidas as assinaturas e não há motivo para a Casa se negar a investigar a ascensão do BTG Pactual.
	Esta Casa, mais uma vez, deve demonstrar sua independência, seu papel isonômico, impessoal, doa em quem doer. Devemos fazer as investigações necessárias para dar as respostas à sociedade, e não esperar que elas venham pela Justiça, Sr. Presidente.
	Mais do que nunca, esta Casa fica obrigada a se manifestar sobre mais esse requerimento de criação de uma Comissão Parlamentar de Inquérito, um instrumento da Minoria, para investigar o caso BTG Pactual.
	Muito obrigado, Sr. Presidente."
2015-12-02T13:52;REPÚDIO, RECONDUÇÃO, AROLDO CEDRAZ,  PRESIDENTE, TRIBUNAL DE CONTAS DA UNIÃO (TCU), DENÚNCIA, ATUAÇÃO, BENEFÍCIO, TIAGO CEDRAZ, FILHO, ADVOGADO.;PELA ORDEM;"O SR. JHC (PSB-AL. Sem revisão do orador.) - Sr. Presidente, Sras. e Srs. Parlamentares, venho aqui registrar a recondução do Presidente do Tribunal de Contas da União, o Sr. Aroldo Cedraz. Na tarde de hoje, o Ministro foi reconduzido à Presidência daquele órgão sob protestos, após várias denúncias de que o seu filho, o advogado lobista Tiago Cedraz, estava envolvido em tráfico de influência e venda de informações dentro daquele Tribunal.
	Tanto a Câmara como o Senado, já que adotamos um sistema bicameral, devem respostas à sociedade brasileira em relação ao Tribunal de Contas da União, que é um órgão auxiliar deste Poder. 
	Então, eu deixo aqui, com toda a veemência, o meu repúdio à sua recondução. 	Quero encorajar o respeitado juiz Sérgio Moro e o Supremo Tribunal Federal a continuar cumprindo o seu dever. Esta Casa, ao não se manifestar, desmoraliza-se e desacredita o próprio Estado Democrático de Direito. Apelo à Polícia Federal: continue firme, contando com a solidariedade do Deputado Jhc. 
	Respeito o Tribunal de Contas da União e o Ministério Público de Contas, que vêm fazendo um louvável trabalho. Mas todas essas denúncias de relação suspeita do Presidente, que precisam ser investigadas, avacalham aquele Tribunal.  É desmoralizante e chega a ser debochado. É um deboche com o povo brasileiro.
	Então, registro a minha indignação, Sr. Presidente."
2015-12-15T16:14;COMISSÃO PARLAMENTAR DE INQUÉRITO (CPI), BTG PACTUAL, BANCO, INVESTIGAÇÃO, CRIAÇÃO, DEFESA.;PELA ORDEM;"O SR. JHC (PSB-AL. Pela ordem. Sem revisão do orador.) - Sr. Presidente, mais uma vez, venho a esta Casa informar que os tentáculos da organização criminosa que está sendo formada no País têm mais fatos novos em relação a essa generosidade do Estado com o Banco BTG Pactual. Eu estou colhendo assinaturas para que possamos fazer uma CPI sobre o BTG Pactual.
	O Bumlai, agora também identificado como um dos operadores do PT na Operação Lava-Jato, vendeu uma fazenda ao BTG Pactual por um valor acima do de mercado. Precisamos nos aprofundar nesse tema. Esta Casa não pode ficar a reboque dessa discussão. Precisamos nos posicionar de forma contundente, para que esta Casa possa resgatar a credibilidade com o povo brasileiro.
	Faço esse apelo para que possamos fazer a CPI do BTG Pactual. Nós sabemos que, quando formou o banco, André Esteves colocou esse nome porque significava ""Back to the Game"", ou seja, de volta ao jogo. Nesse jogo, quem está sendo prejudicado é a população brasileira, é o povo brasileiro. Nós precisamos exercer o mandato de forma transparente nesta Casa, dialogando com a sociedade, para que possamos dar respostas com a celeridade que todos esperam.
	Gostaria que este pronunciamento fosse divulgado nos meios de comunicação da Casa e no programa A Voz do Brasil.
	Muito obrigado.
	O SR. PRESIDENTE (Mauro Pereira) - Muito obrigado, Deputado JHC."
2015-12-15T18:44;CLÁUDIA MARISA DE AQUINO ALARCÃO, SERVIDOR PÚBLICO CIVIL FEDERAL, CÂMARA DOS DEPUTADOS, HOMENAGEM.;PELA ORDEM;"O SR. JHC (PSB-AL. Pela ordem. Sem revisão do orador.) - Sr. Presidente, gostaria também de dizer da minha felicidade de poder ter convivido com esta profícua servidora, a Cláudia. Também tenho o maior respeito, carinho e admiração por sua família - pelo Weiller e pelo Dudu. 
	Fico muito feliz por participar deste momento e por ter tido contato, na minha geração, com pessoas que marcaram a história deste País. A Claudinha estará sempre guardada no nosso coração. Desejo a ela todo o sucesso do mundo. 
	Que Deus a abençoe, Claudinha! Mande um beijo e um abraço para o Dudu, para o Weiller, para todos. Estamos todos muito felizes por tudo o que aconteceu nesta Casa, por tudo o que você fez por este País e continuará fazendo.
	Parabéns!"
2015-12-17T10:56;PLN 6/2015, PROJETO DE LEI ORDINÁRIA, CONGRESSO NACIONAL, PLANO PLURIANUAL (PPA), EMENDA INDIVIDUAL, EDUCAÇÃO, ALAGOAS, BALANÇO.;PELA ORDEM;"O SR. JHC (PSB-AL. Sem revisão do orador.) - Muito obrigado, Sr. Presidente.
	Eu gostaria de fazer um registro, na verdade, sobre o Plano Plurianual, o PPA. Apresentei emendas para o Estado de Alagoas, em que nós priorizamos a educação: foram 180 milhões para o IFAL e para a Universidade Federal de Alagoas, e também para um Centro de Inovação - ao longo desses 4 anos nós poderemos planejar esses recursos para aplicá-los da melhor maneira.
	Também conseguimos aprovar, através da Comissão de Ciência e Tecnologia, uma emenda de minha autoria, que cria Centros de Inovação também no Nordeste, de meio bilhão de reais.
	Então, gostaria de deixar mais esta informação que poderá no futuro ser utilizada pela juventude brasileira.
	Eu fico muito feliz ter podido contribuir, ter dado a minha parcela de contribuição, neste momento em que, na verdade, nós tratamos de suspender a Lei do Bem. O que não é do bem, então é do mal.
	Então, o que esta Casa retirou nós precisamos, de outra maneira, oferecer, com oportunidades para que nós possamos democratizar o acesso à educação de qualidade e que nós possamos investir ainda uma parcela maior do nosso PIB em pesquisa e em inovação.
	Eu presidi, no Senado Federal, um painel em que tratou desse assunto. Estiveram lá pessoas gabaritadas e capacitadas para falar, entre elas doutores, e nós vimos o quanto nós estamos atrasados.
	Enquanto o Brasil fomenta 60 bilhões de reais em inovação, outros países emergentes, como a Índia, investem 1 trilhão em inovação.
	Nós precisamos, desde já, investir ainda mais em educação, inovação, ciência e tecnologia.
	Muito obrigado, Sr. Presidente."
