dataHoraInicio;keywords;tipoDiscurso;transcricao
2017-10-03T15:54;"INTERNET, DEBATE, ROBERT ATKINSON, PRESIDENTE, FUNDAÇÃO DE TECNOLOGIA DA INFORMAÇÃO E INOVAÇÃO, REUNIÃO, JHC, DEPUTADO FEDERAL, ORADOR, ATUAÇÃO PARLAMENTAR.
PL 5130/2016, PROJETO DE LEI ORDINÁRIA, ALTERAÇÃO, MARCO CIVIL DA INTERNET, DIREITOS, CONSUMIDOR, EXCLUSÃO, SANÇÃO, PROVEDOR DE ACESSO, INTERNET, SUSPENSÃO, SOFTWARE APLICATIVO, APLICATIVO DE MENSAGENS MULTIPLATAFORMA, APLICATIVO WHATSAPP, PROIBIÇÃO, ATIVIDADE, INFRAÇÃO, RECUSA, FORNECIMENTO, DADOS, USUÁRIO, TEMA, VOTAÇÃO, EXPECTATIVA.";PELA ORDEM;"O SR. JHC (PSB-AL. Pela ordem. Sem revisão do orador.) - Sr. Presidente, Sras. Deputadas, Srs. Deputados, venho a esta tribuna registrar o comparecimento a esta Casa do Dr. Robert Atkinson. Em parceria com a Embaixada dos Estados Unidos, tivemos a satisfação e o prazer de recebê-lo, ele que é Presidente e fundador da Fundação de Tecnologia da Informação e Inovação. Canadense-americano, o Dr. Robert é um especialista em economia da inovação.
	Durante o debate, discutimos como a tecnologia está moldando a economia global e como ela, em vários países, tem sido um fator de crescimento econômico. Ouso dizer que em poucos anos a tecnologia - aqui se apontando a big data como parte da economia global - será o fator primordial que alavancará a economia mundial.
	Para se ter uma pequena ideia da dimensão dessa revolução, das dez companhias mais valiosas do mundo, nada menos que sete são da área de tecnologia, sendo que as três primeiras, Google, Apple e Amazon, possuem em conjunto o valor de mercado de aproximadamente 330 bilhões de dólares, traduzidos em 1 trilhão e 90 bilhões de reais, ao passo que o PIB brasileiro, a soma de tudo o que o País produz em 1 ano, é de 1,8 trilhão de reais.
	Nesse cenário, Sr. Presidente, os Estados Unidos despontam com uma liderança relativamente confortável. São pioneiros da chamada Internet das Coisas, inteligência artificial e desenvolvimento de aplicações utilizadas ao redor do globo, inclusive por nós brasileiros.
	Há 2 anos, em missão oficial desta Casa, tive a oportunidade de conhecer o Vale do Silício, onde fui à sede do Facebook e do Google, além de ter visitado a Universidade de Stanford, onde pude testemunhar o vibrante ambiente de inovação e desenvolvimento de tecnologias que influenciam o cotidiano de todos da aldeia global. 
	Chamou-me a atenção o clima de liberdade para o investimento em novas tecnologias, e, além disso, o desconhecido - porém importante - papel do Governo americano nesse segmento. Essa importância, no entanto, apresenta-se na forma de founding, ao invés de excessiva regulação. 
E é essa inovação que queremos trazer para o País. Devemos encarar a Internet como um campo infindável de oportunidades para inovar e gerar oportunidades. 
O papel do Estado, apesar de relevante, não pode jamais ser um óbice ao desenvolvimento de tecnologias e pessoas. A cada dia que passa, ficamos mais vinculados à vida digital, e, por isso, mostra-se urgente a necessidade de voltarmos os olhos para o mundo digital, tanto no aspecto de revisão de barreiras - sejam elas estruturais ou tributárias -, quanto no aspecto de priorizar a segurança e a privacidade em rede. 
	Nesse sentido, lembramos do trabalho realizado na Comissão de Crimes Cibernéticos criada na Câmara dos Deputados, que trouxe inovações legislativas, mas que demonstra a necessidade de um trabalho constante, dada a evolução tecnológica e a instabilidade que pode gerar nas redes. 
	Desse modo, temos que outubro é o mês da segurança cibernética nos Estados Unidos, e fica aqui o meu apelo para que as relações com os Estados Unidos, Israel e União Europeia se estreitem, para que priorizemos um plano de políticas públicas para inovar, proteger e transformar a economia brasileira, focando no digital. 
	Para que se possa acompanhar um novo modelo econômico, com redes e infraestruturas de comunicação digital, impulsionado pela Internet, há a necessidade de se incentivar a utilização das tecnologias de informação, o que não é possível sem se referir à urgência em modernizar a administração pública, o que passa pela existência de um Governo com maior visão estratégica sobre o tema, que foque na proteção dos usuários, mas que não comprometa a liberdade para inovar. 
	Um exemplo disso são as mudanças de cenário para investimentos prioritários em programas que envolvam economia digital e bioeconomia, ligados à segurança e defesa cibernética, cidades inteligentes, big data, e Internet das Coisas. 
	Sobre a Internet das Coisas, o Governo deve lançar, ainda este ano, o Plano Nacional de Internet das Coisas, que trará propostas de investimentos para conectar à Internet diversos dispositivos eletrônicos do cotidiano. 
	Esses dispositivos, uma vez conectados à rede, poderão gerar informações que serão processadas e compartilhadas, melhorando o desempenho de negócios, reduzindo desperdícios de recursos e prevenindo erros em processos. 
	Imagine a Internet das Coisas utilizada em prol da saúde, ampliando o acesso da população aos serviços, integrando as informações dos pacientes, facilitando e melhorando os serviços prestados nas unidades de saúde. 
	Também podemos ver melhorias nas cidades, já que a tecnologia estaria voltada para a melhoria da mobilidade urbana, segurança pública e gestão de recursos, como eletricidade e saneamento. 
Sr. Presidente, o Brasil possui natural vocação para várias áreas, especialmente a da agricultura, e ela tem sido o esteio de nossa economia, mesmo durante a atual crise. A Internet das Coisas pode e deve caminhar irmanada à agricultura, aumentando a nossa produtividade e competitividade, seja em setores em que lideramos, como a soja, ou em outros, em que há dificuldade, a exemplo do sucroenergético.
	A Internet tem se tornado cada vez mais indissociável da nossa realidade, e cabe ao Estado e seus agentes, inclusive nós, os formuladores das leis, adaptarmo-nos a essa evolução digital. Nesse passo, temos que priorizar os sistemas de proteção da rede, criando um ambiente cibernético seguro, evitando a recorrência de ataques virtuais pelos quais temos passado.
	Segundo o Fórum Econômico Mundial, estima-se que 65% das crianças que hoje estão no primário trabalharão em empregos que sequer existem hoje. 
	Esse é o desafio, e a ação deve ser imediata, sob pena de amanhã o passado bater às nossas costas e sermos cobrados por essa omissão. 
	Sr. Presidente, faço mais uma vez esse registro, em defesa da Internet livre e sem limites. Faço também um apelo pela votação do Projeto de Lei nº 5.130, de 2016, que trata do bloqueio de provedores de aplicação, assim como o WhatsApp, para fazermos um debate perene e constante nesta Casa, até para...
	(Desligamento automático do microfone.)
	O SR. PRESIDENTE (Rodrigo Maia) - Já lhe dei mais de 1 minuto, Deputado."
2017-10-03T17:52;ACEITAÇÃO, QUESTÃO DE ORDEM, FALTA, APOIAMENTO, ASSINATURA, EMA 4/2017, EMENDA AGLUTINATIVA, MPV 783/2017, MEDIDA PROVISÓRIA.;FALA DO PRESIDENTE OU NO EXERCÍCIO DA PRESIDÊNCIA;"O SR. PRESIDENTE (JHC) - Orientação ""sim"" para toda a base.
	Tenho que fazer um esclarecimento ao Plenário com base no art. 122, que diz de forma taxativa:
Art. 122. As emendas aglutinativas podem ser apresentadas em Plenário, para a apreciação em turno único, quando da votação da parte da proposição ou do dispositivo a que elas se refiram, pelos Autores das emendas objeto da fusão, por um décimo dos membros da Casa ou por Líderes que representem esse número.
	Um décimo dos membros são 52 Parlamentares. Nós só temos apoiamento de 51. A emenda terá que ser inadmitida."
2017-10-17T15:34;JOÃO LUCAS, VALDINHO MONTEIRO, VEREADOR, PENEDO (AL), PLENÁRIO, PRESENÇA.;FALA DO PRESIDENTE OU NO EXERCÍCIO DA PRESIDÊNCIA;"O SR. PRESIDENTE (JHC) - Gostaria de fazer o registro da presença no plenário dos Vereadores João Lucas, campeão de votos pelo PRTB, e Valdinho Monteiro, da cidade de Penedo.
	Dou a eles as boas-vindas e digo que podem contar com o Deputado JHC, com todo o esforço e denoto, para ajudar a belíssima e honrada cidade de Penedo."
2017-10-17T16:10;ALUNO, CURSO (EDUCAÇÃO), CURSO SUPERIOR, DIREITO, DOCTUM, REDE DE ENSINO, VITÓRIA (ES), PLENÁRIO, PRESENÇA.;FALA DO PRESIDENTE OU NO EXERCÍCIO DA PRESIDÊNCIA;"O SR. PRESIDENTE (JHC) - Eu queria fazer o registro da presença neste plenário dos alunos do curso de Direito da Rede de Ensino Doctum, de Vitória, Espírito Santo. A presença de vocês prestigia esta sessão.
	Sejam todos bem-vindos!"
2017-10-18T15:32;WALFRAN FONSECA, PADRE, ALAGOAS, PRESENÇA, PLENARIO, SAUDAÇÃO.;FALA DO PRESIDENTE OU NO EXERCÍCIO DA PRESIDÊNCIA;"O SR. PRESIDENTE (JHC) - Esta Presidência gostaria de fazer um registro todo especial.
Estão presentes no plenário no dia de hoje, o que muito nos honra, o Padre Walfran Fonseca, Vice-Presidente da Federação Recriar - Rede Cristã de Acolhimento e Recuperação de Dependente Químico do Estado de Alagoas, o Sr. Cauê Castro, jovem assessor jurídico, e Ronnie Teixeira, membro da instituição.
Sejam todos bem-vindos a esta Casa! É uma alegria recebê-los aqui."
2017-10-18T16:10;REGISTRO, PRESENÇA, PLENÁRIO, CÂMARA DOS DEPUTDOS, KÁTIA ABREU, SENADOR.;FALA DO PRESIDENTE OU NO EXERCÍCIO DA PRESIDÊNCIA;O SR. PRESIDENTE (JHC) - Faço o registro da presença no plenário da nobre Senadora Kátia Abreu, que está acompanhada de uma comitiva.
2017-10-18T16:50;"COMENTÁRIO, ARTIGO DE REVISTA, EXAME, DESENVOLVIMENTO SUSTENTÁVEL, DESENVOLVIMENTO URBANO, CIDADE. 
NECESSIDADE, PREPARAÇÃO, SOCIEDADE, DEMANDA, CULTURA DIGITAL, INVESTIMENTO, INOVAÇÃO TECNOLÓGICA. 
APRESENTAÇÃO, PROJETO DE RESOLUÇÃO, CRIAÇÃO, COMISSÃO PERMANENTE, FUTURO.";BREVES COMUNICAÇÕES;"O SR. JHC (PSB-AL. Sem revisão do orador) - Agradeço ao Deputado Vitor Valim pela deferência e gostaria de cumprimentar as Sras. Deputadas e os Srs. Deputados.
	Mais uma vez, Sr. Presidente, venho a esta tribuna para tratar de ciência, tecnologia e inovação. Desta vez, trago um exemplar da revista Exame, edição de aniversário, que traz na sua capa os seguintes dizeres: ""Nasce a cidade do futuro. Sustentáveis, inovadoras e boas para viver, trabalhar e empreender. Em todo mundo estão brotando exemplos com essas ideias. Veja o que nossas cidades podem aprender com as experiências globais"".
	Sr. Presidente, Sras. Deputadas e Srs. Deputados, a matéria de capa dessa revista serve como fonte de inspiração àqueles gestores com viés empreendedor e que entendem que a tecnologia é parte da solução das nossas cidades. Assim foi feito em Melbourne e em outras cidades ao redor do mundo. 
	Claro que não queremos comparar a realidade vivida pelo nosso País com a pujança da economia de outros países desenvolvidos. Mas isso serve como fonte de inspiração.
	Recentemente, a convite do Santander e do jornal Valor estive presente à palestra do ex-Presidente Barack Obama, que falou de forma bem clara sobre as novas tecnologias, a economia digital e a preocupação com a automação e a falta de empregos que esse século poderá nos impor, em razão de uma evolução tecnológica. E nós precisamos nos adaptar a esse novo momento. Como? Só há uma forma: através da educação. 	
	Portanto, necessitamos que nossas universidades voltem os olhos, agora, para aqueles que vão manipular ou criar os softwares, para que as máquinas que estão surgindo, para que esses novos serviços da economia digital que estão surgindo, para que possam ser manuseados por homens capacitados.
	Hoje nós falamos de machine learning nós falamos da inteligência artificial, de big data, de proteção de dados, nós falamos da Internet. Eu, como Presidente da Frente Parlamentar pela Internet Livre e sem Limites, algo que transmite informação e conhecimento, digo que nós precisamos também nos preparar para essas novas demandas.
	Cerca de 65% dos novos empregos serão outros, não serão estes empregos que temos hoje. Então, essa nova geração que está no primário deve se capacitar para esses novos desafios.
	Por isso ressalto a importância de deixar aqui o registro também de outras fundações, com a Fundação Lemann, que tem capacitado professores para justamente, nesse modelo inovador de educação, conseguir imprimir em sala de aula esses novos métodos.
	Ou seja, precisamos de uma sala de aula fora desse método já mais enfileirado, militarizado, no bom sentido, precisamos de algo que possa quebrar um pouco mais essa dinâmica do ensino analógico, que traga oportunidade para essas crianças e esses adolescentes poderem estudar em uma sala totalmente interativa, usando essas tecnologias para poder melhorar o aprendizado, melhorar a dinâmica de ensino. E os professores deverão estar capacitados também nesses novos modelos.
	Então, Sr. Presidente, faço aqui, mais uma vez, um apelo para que a tecnologia seja a mola propulsora, o motor de desenvolvimento econômico do nosso País.
	Nós precisamos investir no mínimo 3% em inovação, em ciência e tecnologia no nosso País. Temos startups brotando em todo o País, mas precisamos de uma legislação mais eficaz.
	Temos jovens extremamente competentes, capacitados, gabaritados, que precisam estar presentes no mercado de trabalho da melhor maneira possível. E o Brasil tem tudo para dar certo, com seu povo criativo; com sua juventude cheia de gás, cheia de energia; com pessoas querendo se preparar para viver neste mundo globalizado da tecnologia.
	Concluindo, Sr. Presidente, deixo aqui uma sugestão, já que temos vários gestores aqui em Brasília hoje: que eles tenham acesso a essa edição de aniversário da revista Exame, que fala sobre as cidades modernas. Ela pode servir como fonte de inspiração para esses gestores, que estão agora no mandato, utilizarem a economia criativa, utilizarem a economia digital, utilizarem a tecnologia para a solução das cidades, seja na área da educação, da segurança pública, da mobilidade urbana.
	Assim, conseguiremos devolver a cidade aos cidadãos, promover a inclusão deles e preservar os empregos, agora de uma nova forma.
	Então, precisamos nos preparar apontando para o futuro.
	Propus a esta Casa um projeto de resolução para tratarmos de temas do futuro, especificamente com uma Comissão do Futuro, como existe em outros Parlamentos.
	E eu tenho certeza de que, se for aprovado, será de suma importância não só para nós, mas também para a nova geração de brasileiros, para que possamos dar o melhor de nós e contribuir para o nosso País.
	Sr. Presidente, Sras. e Srs. Deputados, muito obrigado. Que a ciência, a tecnologia e a inovação possam ser a mola propulsora do desenvolvimento econômico e social do nosso País!
	O SR. PRESIDENTE (Vitor Valim) - Parabenizo o Deputado JHC pelo discurso."
2017-10-19T11:02;COMISSÃO GERAL, DEBATE, POLÍTICA PÚBLICA, PRIMEIRA INFÂNCIA.;COMISSÃO GERAL;"O SR. DEPUTADO JHC - Sra. Presidente, Sras. Deputadas e Srs. Deputados, convidados presentes a esta Comissão Geral, pessoas que nos acompanham pela TV Câmara e pela Internet, eu gostaria de saudar todos na pessoa do Ministro Osmar Terra.
	Vale destacar o trabalho dedicado não só dos Parlamentares que aqui estão, mas de outros que também estão engajados nessa luta na Câmara dos Deputados e no Senado Federal e de todos aqueles que foram a Harvard estudar, aprimorar seu conhecimento sobre primeira infância e de outros que tiveram a experiência exitosa, através da Fundação Maria Cecilia, a qual agradeço profundamente a oportunidade, um divisor de águas em termos de primeira infância na nossa atuação nesta Casa.
	Vale destacar também o trabalho já reconhecido do Deputado Felipe Bornier, do jovem Deputado Pedro Cunha Lima e de todos que, irmanados na causa da primeira infância, começam a colocar o tijolo necessário para que esse alicerce, o cérebro, possa ser sólido e forte não só nessas crianças de zero a 6 anos, mas em uma nova geração de brasileiros.
	Nós estamos tratando aqui de futuro, nós estamos falando de uma nação que precisa de um norte, de um rumo. Investir na primeira infância significa dizer que estamos investindo na principal fase do ser humano.
	Nós temos nossas carências sociais, nós temos os nossos problemas. Mas recentemente tive a oportunidade de acompanhar uma palestra do ex-Presidente Barack Obama e me chamou muita atenção sua sensibilidade com o tema da primeira infância, destacando sua importância e apostando nesta nova geração de seres humanos que vêm ao mundo. Eles precisam dessa oportunidade, desse contato com as políticas públicas para se desenvolverem cognitiva e emocionalmente e serem adultos mais produtivos.
	Deputado Pedro Cunha Lima, senhores convidados, Ministro, Senador, Deputada Mariana Carvalho, a quem faço referência por conduzir esta Comissão Geral que trata de tema tão importante, este é um dia marcante para todos nós, um dia especial para a primeira infância.
	O Brasil, como todos sabem, está passando por um momento de dificuldades. Mas é no momento da adversidade que encontramos soluções e apontamos rumos. O trabalho que está sendo feito, delineado e desenhado hoje, as diretrizes que estão sendo traçadas para a primeira infância são animadoras. Nós sabemos que há dificuldade de orçamento, nós sabemos que o cobertor é curto. Mas com boa vontade política vamos conseguir vencer essa batalha.
	Estava eu em minhas andanças por Alagoas muito preocupado com a realidade das 386 mil crianças que estão na primeira infância no meu Estado, que é muito carente, muito pobre. Sessenta por cento delas estão desassistidas. Isso significa que de cada dez seis crianças estão em situação de vulnerabilidade e precisam ser protegidas. Essa que é a fase mais importante e precisa de toda a atenção, de todo um alicerce, infelizmente, está sendo negligenciada.
	A partir de uma discussão profunda como esta, com técnicos da área, com pessoas extremamente gabaritadas, capacitadas, com o debate que estamos fazendo hoje nesta Comissão Geral, mostrando para todo o Brasil a importância da primeira infância, é que começamos a plantar uma semente.
	Quando cheguei à Câmara dos Deputados, o tema da primeira infância eu não conhecia em profundidade. Hoje posso dizer que, além de estudar cada vez mais, também sou um propagador da primeira infância e faço esse trabalho dentro da minha realidade de legislador. Mas espero um dia ter a oportunidade de, no Executivo, também poder implementar políticas públicas e materializá-las da melhor maneira.
	Agradeço à Deputada Mariana Carvalho, a todos os Deputados aqui presentes, ao nosso Senador, ao nosso Ministro e, especialmente, a cada um dos convidados a presença. Sejam todos muito bem-vindos. Viva a primeira infância! (Palmas.)
	A SRA. PRESIDENTA (Deputada Mariana Carvalho) - Muito obrigada, Deputado JHC."
2017-10-24T17:02;PARECER CONTRÁRIO, COMISSÃO DE CONSTITUIÇÃO E JUSTIÇA E DE CIDADANIA (CCJC), SIP 2/2017, SOLICITAÇÃO PARA INSTAURAÇÃO DE PROCESSO, AUTORIZAÇÃO, INVESTIGAÇÃO, SUPREMO TRIBUNAL FEDERAL (STF), DENÚNCIA, MINISTÉRIO PÚBLICO FEDERAL (MPF), MICHEL TEMER, PRESIDENTE DA REPÚBLICA, ELISEU LEMOS PADILHA, WELLINGTON MOREIRA FRANCO, MINISTRO DE ESTADO, ESCLARECIMENTO.;FALA DO PRESIDENTE OU NO EXERCÍCIO DA PRESIDÊNCIA;"O SR. PRESIDENTE (JHC) - Esta Presidência esclarece que, no intuito de manter a organização dos trabalhos e evitar tumulto na Mesa, as inscrições das Sras. Deputadas e dos Srs. Deputados para a discussão e encaminhamento do parecer da Comissão de Constituição e Justiça e Cidadania sobre a Solicitação para a Instauração do Processo nº 2, de 2017, excepcionalmente serão realizadas nas bancadas.
	Os oradores favoráveis ao parecer deverão se dirigir ao lado direito do plenário, à esquerda da Presidência, e os oradores contrários ao parecer ao lado esquerdo do plenário, à direita da Presidência.
	Ressalto que as inscrições são pessoais e intransferíveis. Em nenhuma hipótese, serão admitidas inscrições feitas por terceiros. Somente as listas de inscrição sob a guarda da Secretaria-Geral da Mesa serão consideradas válidas.
	As portas do plenário serão abertas às 7 horas, mas as inscrições só serão realizadas ao início da sessão.
Está suspensa a sessão.
	(A sessão é suspensa.)"
2017-10-24T17:02;LEITURA, OFÍCIO, CONGRESSO NACIONAL, ENCAMINHAMENTO, MPV 785/2017, MEDIDA PROVISÓRIA.;FALA DO PRESIDENTE OU NO EXERCÍCIO DA PRESIDÊNCIA;"O SR. PRESIDENTE (JHC) - Antes de dar prosseguimento à sessão, esta Mesa dá conhecimento ao Plenário do seguinte
	Ofício n°493-CN 
	Brasília, em 11 de outubro de 2017
	Senhor Presidente,
	Encaminho a Vossa Excelência, nos termos do § 8° do art. 62 da Constituição Federal, com a redação dada pela Emenda Constitucional nº 32, o processo da Medida Provisória n° 785, de 2017, que ""Altera a Lei n° 10.260, de 12 de julho de 2001, a Lei Complementar n° 129, de 8 de janeiro de 2009, a Medida Provisória n° 2.156-5, de 24 de agosto de 2001, a Medida Provisória n° 2.157-5, de 24 de agosto de 2001, a Lei n° 7.827, de 27 de setembro de 1989, a Lei n° 9.394, de 20 de dezembro de 1996, a Lei n° 8.958, de 20 de dezembro de 1994, e dá outras providências"". 
À Medida foram oferecidas 278 (duzentas e setenta e oito) emendas e a Comissão Mista emitiu o Parecer n° 1, de 2017 (CM MPV nº 785, de 2017), que conclui pelo PLV nº 34, de 2017.
Esclareço a Vossa excelência que o texto da matéria foi disponibilizado, em meio digital, por intermédio do autenticador no sítio dessa Casa.
Atenciosamente, 
Senador Cássio Cunha Lima.
Primeiro Vice-Presidente do Senado Federal"
2017-10-25T09:48;ENCERRAMENTO, ATIVIDADE, COMISSÃO, INÍCIO, ORDEM DO DIA.;FALA DO PRESIDENTE OU NO EXERCÍCIO DA PRESIDÊNCIA;"O SR. PRESIDENTE (JHC) - Agradeço ao Deputado Bonifácio de Andrada.
Antes de conceder a palavra ao Sr. Eduardo Pizarro Carnelós, representante do Presidente da República, esta Presidência gostaria de fazer um comunicado. 
Estamos na fase da Ordem do Dia, e o art. 46 do Regimento Interno determina o seguinte:
		Art. 46. As Comissões reunir-se-ão na sede da Câmara, em dias e horas prefixados (...).
		§ 1º Em nenhum caso, ainda que se trate de reunião extraordinária, o seu horário poderá coincidir com o da Ordem do Dia da sessão ordinária ou extraordinária da Câmara ou do Congresso Nacional.
	Por ora, é o que acontece no plenário da Câmara dos Deputados. Como estamos no período da Ordem do Dia, pedimos que se encerrem todas as reuniões das Comissões."
2017-10-25T09:48;ORIENTAÇÃO DE BANCADA, REQUERIMENTO DE ADIAMENTO DA VOTAÇÃO, PARECER CONTRÁRIO, COMISSÃO DE CONSTITUIÇÃO E JUSTIÇA E DE CIDADANIA (CCJC), SIP 2/2017, SOLICITAÇÃO PARA INSTAURAÇÃO DE PROCESSO, AUTORIZAÇÃO, INVESTIGAÇÃO, SUPREMO TRIBUNAL FEDERAL (STF), DENÚNCIA, MINISTÉRIO PÚBLICO FEDERAL (MPF), MICHEL TEMER, PRESIDENTE DA REPÚBLICA, ELISEU LEMOS PADILHA, WELLINGTON MOREIRA FRANCO, MINISTRO DE ESTADO, PARTIDO SOCIALISTA BRASILEIRO (PSB) (1987), OBSTRUÇÃO PARLAMENTAR.;ORIENTAÇÃO DE BANCADA;"O SR. JHC (PSB-AL. Pela ordem. Sem revisão do orador.) - Sr. Presidente, peço a palavra para orientar pelo PSB.
	O PSB orienta ""obstrução"", assim como os partidos de oposição, ou seja, aqueles Parlamentares que estão para ser orientados pela base de oposição, estamos em obstrução. Então não precisam vir votar - em português claro.
	A corda está sendo esticada, o contorcionismo já está sendo muito grande. Nós precisamos ter essa decisão, mas não da forma como está sendo dada. 
Portanto, Sr. Presidente, não adianta requerimento de forma açodada como a última carta na manga, sendo que já está claro, está evidente que não houve quórum.
	Portanto, os partidos de oposição orientam ""obstrução"", assim como o meu partido, o PSB."
2017-10-25T16:50;ORIENTAÇÃO DE BANCADA, REQUERIMENTO DE RETIRADA DE PAUTA, PARECER CONTRÁRIO, COMISSÃO DE CONSTITUIÇÃO E JUSTIÇA E DE CIDADANIA (CCJC), SIP 2/2017, SOLICITAÇÃO PARA INSTAURAÇÃO DE PROCESSO, AUTORIZAÇÃO, INVESTIGAÇÃO, SUPREMO TRIBUNAL FEDERAL (STF), DENÚNCIA, MINISTÉRIO PÚBLICO FEDERAL (MPF), MICHEL TEMER, PRESIDENTE DA REPÚBLICA, ELISEU LEMOS PADILHA, WELLINGTON MOREIRA FRANCO, MINISTRO DE ESTADO, PARTIDO SOCIALISTA BRASILEIRO (PSB) (1987), OBSTRUÇÃO PARLAMENTAR.;ORIENTAÇÃO DE BANCADA;"O SR. JHC (PSB-AL. Pela ordem. Sem revisão do orador.) - Sr. Presidente, nós permanecemos em obstrução, assim como a Oposição.
	Nós gostaríamos de mais uma vez, nessa linha, dizer àqueles que hoje estão da Casa que possam não necessariamente votar, porque nós estamos num processo de obstrução.
Eu gostaria que fosse indicada no painel a obstrução também dos partidos de Oposição."
2017-10-25T16:50;PARECER CONTRÁRIO, COMISSÃO DE CONSTITUIÇÃO E JUSTIÇA E DE CIDADANIA (CCJC), SIP 2/2017, SOLICITAÇÃO PARA INSTAURAÇÃO DE PROCESSO, AUTORIZAÇÃO, INVESTIGAÇÃO, SUPREMO TRIBUNAL FEDERAL (STF), DENÚNCIA, MINISTÉRIO PÚBLICO FEDERAL (MPF), MICHEL TEMER, PRESIDENTE DA REPÚBLICA, ELISEU LEMOS PADILHA, WELLINGTON MOREIRA FRANCO, MINISTRO DE ESTADO, VOTO CONTRARIO.;REGISTRO DE VOTO;"O SR. JHC (PSB-AL.) - Sr. Presidente, defendo o império da lei. Não há soberanos: ou somos implacáveis contra a corrupção ou será difícil prever o futuro da minha e das novas gerações.
	Portanto, eu voto ""não"", contra o Relator e a favor das investigações.
	Deputado JHC: voto ""não"". Total: 230 votos."
