dataHoraInicio;keywords;tipoDiscurso;transcricao
2016-11-22T16:48;"DIREITO À PRIVACIDADE, INTERNET, PROTEÇÃO, PRIVACIDADE, DADOS DIGITAIS.
CRÍTICA, PODER JUDICIÁRIO, BLOQUEIO, APLICATIVO WHATSAPP.";PELA ORDEM;"O SR. JHC (PSB-AL. Pela ordem. Sem revisão do orador.) - Sr. Presidente, Sras. e Srs. Parlamentares, gostaria hoje de fazer um apelo aos Líderes e ao Presidente Waldir Maranhão. Encontra-se sobre a mesa um requerimento de urgência para um projeto muito importante, que trata justamente da suspensão e do bloqueio da Internet. Os nossos aplicativos comumente têm sido bloqueados, a exemplo do WhatsApp.
	O que nós queremos é defender uma Internet livre e sem limites. Como Presidente da Frente Parlamentar Mista pela Internet Livre e Sem Limites, nós hoje fazemos esse apelo até para os nossos intérpretes. Existem vários projetos tramitando na Casa. Há o projeto do Deputado João Arruda, há o projeto deste Deputado - JHC -, que justamente orientam, balizam os nossos juízes para poder aplicar essa medida, ou seja, aplicar a legislação da melhor maneira possível, observando os princípios do Marco Civil da Internet.
	Hoje também, com muita satisfação e muita alegria, tivemos a reunião inaugural da Comissão Especial que trata da proteção de dados em meio virtual. O Relator, o Deputado Orlando Silva, apresentou todo o roteiro de trabalho dessa importante Comissão.
	Hoje, o volume de dados que corre no meio virtual é enorme. Mas nós precisamos ter a nossa privacidade garantida.
	Nós tivemos o caso do Edward Snowden, que trabalhava na NSA, nos Estados Unidos, e acusou o Governo americano de usar informações do Facebook e de outros conteúdos de aplicação para ter acesso a informações.
	Então, até como questão de soberania, devemos discutir inclusive a criptografia das informações que nós utilizamos em nossos celulares, revelando também um momento diferente pelo qual nós estamos passando. Antes se falava no Big Brother de George Orwell, que falava sobre o Estado controlando e vigiando tudo. Hoje, nós temos essas informações nas mãos das empresas.
	Nós precisamos ter a observância de que há um comércio por trás disso, porque os nossos dados, as nossas informações circulam em todos os momentos, seja em que área for. Hoje, está tudo em meio digital, em meio virtual, inclusive um procedimento médico. Enfim, está tudo isso em meio virtual. É preciso fazer essa discussão.
	Na próxima semana, nós vamos, junto com a Comissão, ao Vale do Silício para buscar todas essas informações e saber como são protegidas, como são guardadas essas informações, para que possamos aprimorar a nossa legislação e preparar um texto de lei compatível com a legislação vigente. E sempre observando os princípios, ou seja, os conceitos de governança na Internet, o Direito Digital, que se comunica com diversos ramos do Direito, para que possamos neste novo momento em que estamos vivendo, em que o mundo está cada vez mais interativo, conectado e globalizado, fazer essa discussão da melhor maneira possível.
	Esta Casa não pode ficar no analógico, e a sociedade, no digital. Nós temos que diminuir esse descompasso e fazer com que a sociedade possa acompanhar, com transparência e com alegria, os trabalhos que são elaborados e produzidos nesta Casa.
	Portanto, apelo para todos os Líderes, a fim de que aprovemos hoje o requerimento de urgência para esse projeto tão importante.
	Muito obrigado, Sr. Presidente."
2016-12-15T11:20;PRC 21/2015, PROJETO DE RESOLUÇÃO, ALTERAÇÃO, REGIMENTO INTERNO DA CÂMARA DOS DEPUTADOS, CRIAÇÃO, SECRETARIA DA JUVENTUDE, DEFINIÇÃO, COMPOSIÇÃO, COMPETÊNCIA, DEFESA, APROVAÇÃO, AGRADECIMENTO.;PELA ORDEM;"O SR. JHC (PSB-AL. Pela ordem. Sem revisão do orador.) - Sr. Presidente, Sras. e Srs. Deputados, senhoras e senhores que assistem à sessão pela TV Câmara e internautas, hoje é um dia histórico para a juventude brasileira.
	Antes de proferir meu discurso, gostaria de agradecer ao Deputado Rubens Pereira Júnior e ao Deputado Waldir Maranhão pelo relatório muito bem elaborado e muito bem feito. A juventude brasileira, que já passa dos 50 milhões, agradece. Temos preocupações importantes. Esta Casa, que representa o povo brasileiro, tem que tomar conta do futuro do País.
	Muitas reformas estão por vir, estão por acontecer; muitos remédios serão amargos, haja vista que está batendo à nossa porta a grande preocupação com a reforma da Previdência. A pirâmide está se invertendo, e nós jovens, Deputado Rafael Motta, é que, lá na frente, vamos nos aposentar.
	Nós temos que tomar conta do futuro do nosso País agora. E a juventude brasileira precisa ser ouvida, precisa ter voz. Nós não podemos chegar a postos de destaque quando nós já estivermos obsoletos, anacrônicos.
	Nós falamos a linguagem da juventude, assim como V.Exa., Deputado Rafael Motta, e a Deputada Mariana Carvalho, que está aqui - esta brava guerreira, que nos acompanha e luta pela juventude brasileira e pela educação. Temos que discutir o presente, para garantir um futuro melhor para todos nós.
	E, nesta toada, perseguindo o melhor e o mais justo País para todos, agradeço imensamente a colaboração de todos. Quando nós falamos em juventude, nós falamos em pluralidade, em vigor, em oxigenar as ideias, em inovar, em renovar.
	O Deputado Felipe Bornier fez um trabalho brilhante, ao longo desses anos, com os Programas Estágio-Visita e Estágio Participação. Nós temos o Projeto Politeia e a Câmara Mirim. Nós temos que preparar essa criançada, os nossos adolescentes, para poderem pensar a política, e não tratar a política como ambiente hostil.
	Então, nós vamos promover políticas públicas para que este Parlamento fuja desse modelo anacrônico, para que ele possa se atualizar, através de iniciativas da própria Secretaria. E que possamos diminuir o descompasso entre a juventude brasileira e as questões que são discutidas aqui.
	Nós temos o Parlamento Jovem, que dá oportunidade aos jovens brasileiros de virem aqui e exercem a sua cidadania, sendo jovens parlamentares. A partir daquele momento, eles passam a ser defensores desta Casa.
	Nós precisamos materializar esse exército digital que nós temos, inquieto, a todo o momento, nas mídias sociais, para que tenham por esta Casa todo o respeito e saiam daqui com a imagem que devem ter e representem, efetivamente, a Casa do Povo e os interesses da sociedade.
	E que nós possamos assim fazer uma discussão maior sobre o nosso País. Disto que nós estamos precisando: uma discussão suprapartidária.
	Façamos dessa Secretaria o esteio, a base para que nós promovamos o planejamento de um horizonte de um Brasil 20, 30 anos à frente.
	Nós precisamos da ajuda de cada um, dos mais experientes.
	Por isso, Deputada Mariana, eu lhe agradeço todo o esforço, toda a atenção e por estar sempre acompanhando e realizando este sonho conosco. 	Agradeço à Deputada Shéridan também, ao Deputado Rafael Motta, a todos os integrantes da bancada da Internet, ao Deputado Wilson Filho, que foi o Relator do Estatuto da Juventude, enfim, há tantos outros Parlamentares importantes aqui!
	Concluo, Sr. Presidente, sem me esquecer de agradecer a V.Exa., que deixa no seu mandato, na sua passagem à frente da Câmara dos Deputados, um marco para a juventude brasileira. deixa esse legado.
	Tenho a certeza de que, com instituições e fundações sérias em nosso País, nacionais e internacionais, vamos buscar parcerias para melhorar a relação do nosso Parlamento com a juventude, com a sociedade, para que possamos ser, realmente, o futuro do Brasil, o futuro que nós todos merecemos.
	Queria agradecer a cada um dos Srs. Parlamentares, a cada um que nos ajudou, nos acompanhou. Queria agradecer aos Relatores, àqueles membros da CCJC, também, pela aprovação e por todo o trâmite. Queria agradecer, também, ao corpo técnico desta Casa, que sempre nos recebe com tanto carinho e com tanta atenção e a todos os partidos aqui presentes.
	Muito obrigado. Que Deus proteja todos nós e a juventude brasileira!"
2016-12-15T11:20;"QUESTÃO DE ORDEM, USO DA PALAVRA, DEPUTADO FEDERAL.
PRC 21/2015, PROJETO DE RESOLUÇÃO, ALTERAÇÃO, REGIMENTO INTERNO DA CÂMARA DOS DEPUTADOS, CRIAÇÃO, SECRETARIA DA JUVENTUDE, DEFINIÇÃO, COMPOSIÇÃO, COMPETÊNCIA, DEFESA, APRECIAÇÃO.";QUESTÃO DE ORDEM;"O SR. JHC (PSB-AL. Questão de ordem. Sem revisão do orador.) - A questão de ordem é com base no art. 73, VI:
		Art. 73. ............................................................
		VI - a nenhum Deputado será permitido falar sem pedir a palavra e sem que o Presidente a conceda (...) 
	Aqui se ganha no grito, Presidente. Queremos falar, e não conseguimos. Por isso, a juventude quer ter voz neste Parlamento. Por isso, é importante aprovar o projeto relativo à Secretaria da Juventude. O PRC 21 está sobre a mesa. Já há consenso. O PT retirou a obstrução. Eu gostaria da benevolência de V.Exa. para votarmos e avançarmos na pauta."
2016-12-20T14:18;"SECRETARIA DA JUVENTUDE, CRIAÇÃO, CÂMARA DOS DEPUTADOS, AVALIAÇÃO POSITIVA.
ANO-CALENDÁRIO, CELEBRAÇÃO, FESTA NATALINA, FAVORÁVEL, EXPECTATIVA.";PELA ORDEM;"O SR. JHC (PSB-AL. Pela ordem. Sem revisão do orador.) - Sr. Presidente, mais uma vez, gostaria de nesta última sessão deliberativa parabenizar a Casa por uma deliberação recente: a criação da Secretaria da Juventude.
	Cada vez mais, estou convencido de que esta Casa, de forma acertada, criou uma secretaria, um espaço específico para a juventude.
	Hoje estive com o Secretário Nacional de Juventude, Bruno Julio, que já anunciou algumas iniciativas interessantes, como o Inova Jovem, um fundo garantidor para que a juventude possa fomentar o empreendedorismo e a inovação por meio de startups; o CEPOD, que será um centro para a juventude com cursos preparatórios, pré-vestibulares e acesso à Internet; e o ID Jovem, em que os jovens poderão ter carteira estudantil gratuita. Também haverá meia-entrada e passagens interestaduais para estudantes de baixa renda. 
	Sr. Presidente, quero desejar a todos os colegas e a todos os servidores desta Casa boas festas e um feliz Ano-Novo.
	Muito obrigado."
2017-03-08T14:00;"DIA INTERNACIONAL DA MULHER, HOMENAGEM.
BENEDITA DA SILVA, DEPUTADO FEDERAL, PRESIDÊNCIA, SESSÃO PLENÁRIA, REGISTRO.";FALA DO PRESIDENTE OU NO EXERCÍCIO DA PRESIDÊNCIA;"O SR. PRESIDENTE (JHC) - No início de mais uma sessão deliberativa, registro que hoje é uma data especial, em que se comemora o Dia Internacional da Mulher. 
	Portanto, gostaria de fazer referência a todas as mulheres brasileiras ao iniciar mais uma sessão em que serão debatidos direitos e garantias das mulheres, numa pauta hoje discutida mais cedo pelo Colégio de Líderes.
	Faço uma referência toda especial à Deputada Benedita da Silva, que está presente aqui conosco no plenário. Quero desde já, convidá-la para tomar assento à mesa e, posteriormente, também presidir esta sessão. 
	Da mesma forma, as Deputadas mulheres que forem chegando ao plenário da Casa poderão ter oportunidade de presidir a sessão e participar de mais este dia histórico."
2017-03-08T14:02;"MULHER, DIA INTERNACIONAL DA MULHER, HOMENAGEM.
RAQUEL MUNIZ, DEPUTADO FEDERAL, ATUAÇÃO PARLAMENTAR, HOMENAGEM.";FALA DO PRESIDENTE OU NO EXERCÍCIO DA PRESIDÊNCIA;O SR. PRESIDENTE (JHC) - Vejo aqui a Deputada Raquel Muniz, a quem também rendo as minhas homenagens.
2017-03-09T14:36;DIA INTERNACIONAL DA MULHER, HOMENAGEM.;FALA DO PRESIDENTE OU NO EXERCÍCIO DA PRESIDÊNCIA;"O SR. PRESIDENTE (JHC) - Quero parabenizar a Deputada Professora Marcivania, já que estamos na semana da mulher.
	V.Exa. pode contar conosco, aqui na Mesa Diretora e na Câmara dos Deputados, para garantir ainda mais direitos para todas as mulheres brasileiras.
	Ontem, houve uma sessão histórica nesta Casa. Nós tivemos a oportunidade de ouvir vários pronunciamentos emocionantes. Isso mostra a qualidade das nossas Parlamentares. Nós ficamos felizes e honrados em fazer também parte desta Legislatura, com a Deputada Professora Marcivania.
	Muito obrigado, Deputada."
2017-04-05T14:28;SAUDAÇÃO, MEMBRO, ESCOLA DE APERFEIÇOAMENTO DE OFICIAIS DO EXÉRCITO BRASILEIRO, PRESENÇA, CÂMARA DOS DEPUTADOS.;FALA DO PRESIDENTE OU NO EXERCÍCIO DA PRESIDÊNCIA;"O SR. PRESIDENTE (JHC) - Desejamos dar as boas-vindas à comitiva da Escola de Aperfeiçoamento de Oficiais, do Exército Brasileiro, sediada na cidade do Rio de Janeiro.
	Sejam todos bem-vindos a esta Casa Legislativa."
2017-04-06T11:40;SOLICITAÇÃO, LIDERANÇA PARTIDÁRIA, PREPARAÇÃO, PAUTA (PROCESSO LEGISLATIVO).;FALA DO PRESIDENTE OU NO EXERCÍCIO DA PRESIDÊNCIA;O SR. PRESIDENTE (JHC) - Sobre a proposição do Deputado Efraim Filho, de encerramento desta sessão e convocação de outra sessão para a votação de três projetos, que tratam de propriedade industrial, repressão ao contrabando e acordo de defesa com a Suécia, gostaria que os eminentes Líderes se reunissem, para que esta Mesa possa conduzir a pauta da próxima sessão.
2017-04-06T11:44;REGISTRO, PRESENÇA, CÂMARA DOS DEPUTADOS, ESTUDANTE, SÃO PAULO (SP).;FALA DO PRESIDENTE OU NO EXERCÍCIO DA PRESIDÊNCIA;"O SR. PRESIDENTE (JHC) - Gostaríamos de dar boas-vindas e de cumprimentar os estudantes de ensino médio da Escola Britânica do Brasil, de São Paulo, presentes nas galerias.
De forma especial, queremos abraçá-los e dizer que agora nós contamos também com a Secretaria da Juventude nesta Casa, para que o diálogo com a juventude brasileira possa acontecer de forma permanente, para que vocês possam estar mais perto e nos sugerir novas ideias. (Palmas nas galerias.) Parabéns por terem vindo a esta Casa! Sintam-se acolhidos por todos nós.
	Vamos passar a palavra ao Líder do Partido dos Trabalhadores, Deputado Carlos Zarattini, ao Deputado Luiz Sérgio e depois consultaremos novamente os Líderes, para podermos encerrar esta sessão e iniciar outra."
2017-04-06T11:56;ANÚNCIO, ENCERRAMENTO, PRAZO, RECURSO (PROPOSIÇÃO LEGISLATIVA), PARECER DO RELATOR, PLP 343/2017, PROJETO DE LEI COMPLEMENTAR.;FALA DO PRESIDENTE OU NO EXERCÍCIO DA PRESIDÊNCIA;"O SR. PRESIDENTE (JHC) - Esta Presidência informa que o prazo para apresentação de recursos contra o parecer do Relator, que concluiu pela inadequação financeira e orçamentária, pela inconstitucionalidade e injuridicidade das emendas ao Projeto de Lei Complementar nº 343, de 2017, está encerrado.
	Está cancelada a Ordem do Dia."
2017-05-04T14:39;COMISSÃO DE ÉTICA PÚBLICA, APURAÇÃO, CORRUPÇÃO, GOVERNO FEDERAL, DEFESA.;PEQUENO EXPEDIENTE;"O SR. JHC (PSB-AL. Sem revisão do orador.) - Agradeço, Sr. Presidente.
	Hoje, viemos até a tribuna para tratar de um assunto que nos tem incomodado bastante. Nós sabemos que o Brasil está vivendo um momento muito difícil e precisamos que as instituições e seus órgãos estejam funcionando de forma eficaz e efetiva.
	Eu venho aqui, Sr. Presidente, para tratar justamente da Comissão de Ética Pública da Presidência da República. Esse órgão foi criado para proteger, fiscalizar, apurar e dar as orientações necessárias ao Poder Executivo, um órgão de esperança do povo brasileiro. Mas o que nós estamos vendo é, na verdade, uma falta de informação, justamente pela gestão desse órgão junto ao primeiro escalão do Governo. 
	Portanto, fazendo da nossa atividade fiscalizadora e legiferante um protagonismo dentro desta Casa é que nós buscamos a Comissão de Fiscalização Financeira e Controle, para podermos, justamente, propor a essa Comissão que faça junto ao órgão uma fiscalização e verifique como está se dando seu funcionamento e por que não dá as respostas satisfatórias ao povo brasileiro.
	Nós ficamos sabemos, através de uma matéria da Folha de S.Paulo, que, recentemente, em um caso muito menor, o Sr. Mauro Menezes, Presidente daquela Comissão, resolveu abrir um processo junto ao Secretário de Comunicação da Presidência da República, mas, posteriormente, outras denúncias envolvendo o primeiro escalão vieram à tona e não houve a mesma postura.
	Aí nós ficamos a nos questionar: por que, mais uma vez, essa omissão? É a falta de autonomia? Está havendo algum tipo de intervenção por parte do Poder Executivo? Ou será que não mais essa Comissão de Ética está assistindo a telejornais, como Jornal da Globo, Jornal Nacional, Band, Globo News? Não está mais vendo os blogs de grande notoriedade, como O Antagonista, Diário do Poder? Não está lendo mais revistas, como Veja, Época, ISTOÉ? 
	O questionamento que nós fazemos agora é justamente para que esta Casa possa, através de seus instrumentos de fiscalização e controle, cobrar também desse órgão, vinculado ao Poder Executivo, que dê uma resposta ao povo brasileiro.
	Portanto, o Deputado JHC, com esta preocupação, é que vem fazer esta provocação, para que possamos fazer essa auditoria operacional nesse órgão. Ora, não é razoável que, num momento como este que nós estamos vivendo, não haja uma resposta efetiva por parte da Comissão de Ética Pública da Presidência da República, haja vista que já estão estampadas em todos os principais jornais, de forma reiterada, de forma farta, matérias vinculando o primeiro escalão do Governo. Nós precisamos ter uma postura mais altiva quanto aos Poderes, porque senão nós vamos viver sempre aquela ideia de que o Judiciário está praticando ativismo, quando, na verdade, existe uma omissão, uma negligência por parte dos órgãos de fiscalização e controle vinculados a esses Poderes.
	Portanto, nós precisamos cumprir com a nossa parte. Por isso faço, de forma institucional, esse pedido à Comissão de Fiscalização Financeira e Controle. Nós vamos pedir celeridade. O Brasil precisa ser passado a limpo.
	Nós estamos passando por uma crise ética e moral, e a nova geração de brasileiros faz essa exigência, assim como todo o povo brasileiro, porque nós não aguentamos mais.
	Portanto, Sr. Presidente, venho à tribuna, na tarde de hoje, justamente para cobrar, com toda a veemência e contundência, que esse órgão possa dar maiores esclarecimentos sobre a postura vacilante que adota quanto à fiscalização dos atos do primeiro escalão da Presidência da República.
	Muito obrigado, Sr. Presidente.
	O SR. PRESIDENTE (Heitor Schuch) - Muito obrigado, Deputado JHC."
2017-05-09T16:00;HOMICÍDIO, VIOLÊNCIA, JOVEM, AUMENTO, ALAGOAS, GOVERNO MUNICIPAL, GOVERNO ESTADUAL, GOVERNO FEDERAL, PROVIDÊNCIA, SOLICITAÇÃO.;PEQUENO EXPEDIENTE;"O SR. JHC (PSB-AL. Sem revisão do orador.) - Sr. Presidente, venho trazer à Casa alguns números revelados sobre a violência, aos quais tive acesso pelo blog do jornalista Ricardo Mota. Em Alagoas, a violência é galopante. Nós temos dados de hoje divulgados que entristecem a todos nós, especialmente por se tratar da juventude, da nova geração de alagoanos, que está praticamente sem rumo e sendo exterminada pelo mundo da criminalidade e do tráfico de drogas.
	Os números, só no mês passado, mostraram 163 assassinatos, ou seja, por mês, cai um Boeing no Estado de Alagoas. O total, de janeiro até agora, é de 765 assassinatos, contra 613 assassinatos no mesmo período do ano passado.
	Foram 107 adolescentes mortos. Outra informação gravíssima: quatro crianças de até 11 anos de idade foram assassinadas em Alagoas. Outro dado também gritante são as mortes aos domingos, que é o dia de lazer, que ocorre em todo o mundo e é consagrado para todos nós. Foram 148 mortes aos domingos. 
	Sr. Presidente, com uma geração sendo exterminada no Estado de Alagoas, nós não podemos nos omitir nem negligenciar esses fatos. Faço um apelo a todos os organismos que possam contribuir, em nível federal, estadual e municipal, no sentido de que se posicionem, por favor. Depois faremos um pronunciamento mais detalhado sobre a violência galopante no Estado de Alagoas, que nos entristece.
	Muito obrigado."
2017-05-09T17:12;VIOLÊNCIA, JOVEM, AUMENTO, ALAGOAS, CRÍTICA, GOVERNO ESTADUAL, ATUAÇÃO, SEGURANÇA PÚBLICA.;PELA ORDEM;"O SR. JHC (PSB-AL. Pela ordem. Sem revisão do orador.) - Sr. Presidente, Sras. e Srs. Deputados, venho tratar de um tema muito sensível para o nosso honrado Estado de Alagoas, a violência. Há criminalidade galopante lá. Desde o meu mandato de Deputado Estadual, esse tema persegue a mim e à população alagoana. 
	Nós sabemos que a criminalidade é um problema em todo o País, mas em Alagoas é algo mais acentuado e vitimiza especialmente aqueles mais vulneráveis, que são as nossas crianças e os nossos adolescentes. 
	Tenho em mão matéria do jornalista Ricardo Mota. A matéria é muito impactante e revela alguns dados que comovem a todos nós. Está-se esterilizando uma geração de alagoanos - e, consequentemente, de brasileiros -, que estão sendo perdidos no mundo da marginalidade, do tráfico e das drogas. 
	Eu fico a me perguntar: por que a tentativa falida do Governo de sempre utilizar o nosso dinheiro, recursos públicos, para propagar de forma farta que a violência em Alagoas está diminuindo, como se estivesse de fato? Trata-se de propaganda cara, paga com o nosso dinheiro. 
	Eu questiono o Governo de Alagoas sobre qual é o método de combate à violência utilizado. Utiliza assistência social, o emprego e a renda, a educação? Indago isso porque o que estamos vendo lá é um projeto sem nenhuma transparência. Indago se é um método parecido com o que foi utilizado pelo Pacto pela Vida, em Pernambuco; se é o método Koban, utilizado pelos japoneses; se é o método de Rudolph Giuliani, do Tolerância zero; se é algum sistema parecido com o de Bogotá. Não, nós não sabemos qual é o método utilizado, portanto fica difícil para a população ajudar, engajar-se, saber quem está por trás do plano cartesiano daquelas mortes, daqueles números.
	No mês passado, é como se tivesse caído um Boeing em Maceió, com o número de assassinatos, e 50% desses assassinatos são de jovens, estando entre eles 4 crianças de até 11 anos e 107 adolescentes mortos. Nós já temos o número de 765 assassinatos, só este ano!
	Foi para Alagoas o Programa Brasil Mais Seguro. Gastaram 200 bilhões de reais no Brasil Mais Seguro, em Alagoas. A violência não diminuiu. Nós tivemos várias tentativas de se diminuir a violência com o Programa Crack, é Possível Vencer, com comunidades acolhedoras, mas também não foi possível vencer a violência no Estado de Alagoas. 
	A minha preocupação é maior porque não vejo perspectiva e esperança para esses indivíduos que hoje nascem em Alagoas, que tentam sobreviver e ter uma oportunidade no futuro.
	Então, faço um apelo ao Governo do Estado de Alagoas e à Prefeitura Municipal, para que possam efetivamente dar à Guarda Municipal a autonomia de que precisa em Maceió, que tem o maior índice de violência do País. E que toda a bancada federal, os Municípios e o Governo do Estado de Alagoas possam socorrer esses jovens que agonizam pelas calçadas no nosso querido Estado.
	Era o que eu tinha a dizer, Sr. Presidente. Esses dados revelam a triste realidade do nosso povo. Eu estou aqui, mais uma vez, consternado, esforçando-me para dar a resposta que o povo de Alagoas merece.
	Nós precisamos agir com firmeza. Nós precisamos agir com contundência, sem nos omitir, sem negligenciar esses números que são revelados hoje para nós. Precisamos saber quem são essas vítimas da violência e quem é que está por trás desses números.
	Meu muito obrigado, Sr. Presidente!
	O SR. PRESIDENTE (Alberto Fraga) - Eu é que agradeço a V.Exa."
