dataHoraInicio;keywords;tipoDiscurso;transcricao
2015-02-05T10:52;LÍDER DO PARTIDO, ATUAÇÃO, CRITICA.;RECLAMAÇÃO;"O SR. JHC (Bloco/SD-AL. Reclamação. Sem revisão do orador.) - Sr. Presidente, nós estamos baseados no art. 9º, combinado com o art. 12 do Regimento Interno.
	Sr. Presidente, o art. 9º diz, de forma clara e taxativa, que:
""Art.9º
................................................................
§ 2º A escolha do Líder será comunicada à Mesa, no início de cada legislatura, ou após a criação de Bloco Parlamentar, em documento subscrito pela maioria absoluta dos integrantes da representação."" 
	O art. 12, também no § 2º, deixa bem claro que:
""Art.12 ..................................................................
§ 2º As Lideranças dos Partidos que se coligarem em Bloco Parlamentar perdem suas atribuições e prerrogativas regimentais."" 
	Até agora, eu pelo menos não tenho conhecimento se a Mesa da Casa já recebeu o Líder deste bloco. Nós já estamos falando aqui desde o início da Legislatura, nós hoje já lemos a criação da CPI, nós temos também a PEC da Reforma Política, para a qual será criada a Comissão. E eu queria até questionar a legitimidade e a legalidade também dessas indicações, porque, se continuarmos dessa forma, seria até caso de pedir a própria nulidade delas. E a quem serviria a judicialização de um processo que o Brasil inteiro está esperando que se inicie nesta Legislatura?
	Nós temos que ter a observância da norma regimental referente ao bloco de que fazemos parte, no qual temos 217 Parlamentares. Só aí dariam exatamente 54 Vice-Líderes, ou seja, para cada quatro Parlamentares, um Vice-Líder. Então, nós estamos desta forma: quando assumimos a posição de bloco, os Líderes perderam as suas prerrogativas. E o que nós estamos vendo aqui, Sr. Presidente, é que os Líderes continuam ainda a falar pelos seus partidos, tendo superpoderes.
	Então, quem vai fazer as indicações? A quem serve essa nulidade? E eu queria questionar até mesmo a legitimidade e a legalidade desse processo. Há formações de blocos aqui presentes que foram dissolvidas em 3 dias. Nem que fossem bloco de carnaval! Pelo menos esperassem para dissolver o bloco daqui a 2 semanas. Então, qual é a finalidade desse bloco? 
	Nós estamos discutindo uma reforma política. Será que vamos ter que fazer uma reforma interna também? Todos nós sabemos dessa prática. Inclusive com relação ao próprio Colégio de Líderes, o Regimento Interno deixa claro também no art. 20 - vou mais além - que, no Colégio de Líderes, as reuniões têm de ser feitas com a presença dos Líderes da Maioria, da Minoria, dos partidos, dos blocos parlamentares - ele fala em blocos parlamentares.
	O SR. PRESIDENTE (Eduardo Cunha) - Conclua, Deputado.
	O SR. JHC - Sr. Presidente, mostro aqui, de forma clara, minha preocupação com esse vício de formalidade. 
	Então, gostaria de deixar, até em respeito àqueles Parlamentares que também apoiaram a tramitação da PEC, que também apoiaram a criação da CPI, esta questão de ordem, justamente para questionar, baseado nos arts. 9º e 12 do Regimento Interno, a legitimidade e a legalidade desses atos.
	O SR. PRESIDENTE (Eduardo Cunha) - Para concluir, Deputado.
	O SR. JHC - Porque, senão, nós estaríamos servindo a quem, já iniciando um processo que é passível de nulidade?
	Muito obrigado, Sr. Presidente."
2015-02-05T15:18;"JHC, DEPUTADO FEDERAL, ELEIÇÃO, ELEITOR, IBATEGUARA, UNIÃO DOS PALMARES, ARAPIRACA, PALMEIRA DOS ÍNDIOS, PENEDO, TRAIPU, ALAGOAS, AGRADECIMENTO.
ASSEMBLEIA LEGISLATIVA, ALAGOAS, CORRUPÇÃO, CRÍTICA, INVESTIGAÇÃO, ANÚNCIO.";PEQUENO EXPEDIENTE;"O SR. JHC (Bloco/SD-AL. Sem revisão do orador.) - Sr. Presidente, Sras. e Srs. Deputados, membros da imprensa, telespectadores da TV Câmara, vim de um mandato na Assembleia Legislativa de Alagoas e ocupo agora esta tribuna, que também já foi ocupada pelo meu pai, o Deputado Federal João Caldas. Com muita honra chego a esta Casa para também contribuir da melhor forma. Sob a ótica da juventude de um novo Brasil, com novos conceitos, vamos lutar de forma altiva, independente e contundente, para atender aos anseios do povo brasileiro.
	Sras. e Srs. Deputados, eu tive a honra, no Estado de Alagoas, de ser o Deputado Federal mais votado, com quase 136 mil votos, fazendo uma mobilização digital daqueles que estavam presentes nas mídias sociais, um verdadeiro exército em prol de uma campanha limpa, transparente, objetiva e propositiva. Agora, do alto desta tribuna, nós estamos a olhar também pelo meu Estado de Alagoas.
	Quero agradecer especialmente à população do meu Município, Ibateguara, e à dos Municípios de União dos Palmares, Arapiraca, Palmeira dos Índios, Penedo e Traipu, nos quais tive votação expressiva. Em nome dessas cidades, vou representar de uma ponta à outra o meu Estado.
	Nós temos que continuar aqueles feitos do meu Estado, assim como fiz quando Deputado Estadual, quando abrimos a caixa-preta da Assembleia Legislativa e revelamos um escândalo de mais de 500 milhões de reais. A Assembleia Legislativa, lamentavelmente, no apagar das luzes, no final da Legislatura, levou mais um duodécimo, deixando, assim, milhares de famílias sem o que comer no final do ano.
	Agora, estou aqui com as minhas prerrogativas ampliadas. Nós vamos trabalhar junto aos órgãos federais de controle - Controladoria-Geral da União, Polícia Federal e Ministério Público Federal - para combater esse grande esquema de corrupção montado em Alagoas, entre a Assembleia Legislativa e o Tribunal de Contas, que hoje funciona como um puxadinho da Assembleia Legislativa.
	Lá em Alagoas, como prêmio, depois de ser denunciado em um grande esquema de corrupção, o Deputado vira representante do Tribunal de Contas, para justamente zelar pela probidade da aplicação dos recursos públicos, o que é lamentável.
	Peço que este pronunciamento seja publicado nos órgãos oficiais da Casa e divulgado no programa A Voz do Brasil.
	Muito obrigado, Sr. Presidente. Muito obrigado pela compreensão de todos.
	O SR. PRESIDENTE (Rômulo Gouveia) - Defiro o pedido de V.Exa. e o cumprimento. Sou grande amigo do ex-Deputado João Caldas, que ocupou a Mesa Diretora desta Casa. Dou as boas-vindas a V.Exa., que é do Estado de Alagoas."
2015-03-09T18:54;FRENTE PARLAMENTAR DOS FUNDOS DE PENSÃO, CRIAÇÃO, COMUNICADO.;PELA ORDEM;"O SR. JHC (SD-AL. Pela ordem. Sem revisão do orador.) - Muito obrigado, Presidente Izalci. 
Eu quero apenas registrar, Sr. Presidente, que nós estamos instalando e criando a Frente Parlamentar dos Fundos de Pensão. Gostaria de deixar registrado que vamos fazer esse acompanhamento da melhor maneira possível, dando a publicidade devida com o acompanhamento da sociedade e dos servidores.
	Muito obrigado, Presidente."
2015-03-26T17:12;"COMISSÃO GERAL, RICARDO BARZOINI, MINISTRO DE ESTADO, MINISTÉRIO DAS COMUNICAÇÕES, ESCLARECIMENTO, APRESENTAÇÃO, AGRADECIMENTO.
REGIÃO NORDESTE, SUBCOMISSÃO, COMISSÃO DE CIÊNCIA E TECNOLOGIA, COMUNICAÇÃO E INFORMÁTICA (CCTCI), CRIAÇÃO, JHC, DEPUTADO FEDERAL, ORADOR, REGISTRO.
TELEFONIA MÓVEL, COBERTURA, ZONA RURAL, DEFESA.
INCLUSÃO DIGITAL, DEFESA.";COMISSÃO GERAL;"O SR. DEPUTADO JHC - Sr. Presidente, Sras. e Srs. Deputados, gostaria que fosse considerado o tempo da Liderança, cujo requerimento se encontra na Mesa.
	Agradeço ao Sr. Ministro por estar presente nesta Casa, para podermos fazer um debate democrático, que está sendo assistido e acompanhado por milhares de brasileiros, especialmente pela minha juventude, que quer ver neste País oportunidades iguais para todos. Oportunidades iguais para todos significa democratizar o acesso à informação neste mundo globalizado e competitivo em que vivemos hoje.
	Tive a honra - e desde já agradeço - de contar com o apoio de Parlamentares que subscreveram e aprovaram o meu requerimento de criação da Subcomissão de Ciência, Tecnologia e Comunicação, no âmbito da Comissão de Ciência e Tecnologia, Comunicação e Informática, para tratar dos assuntos relacionados ao Nordeste brasileiro.
	Nós temos uma defasagem muito grande em relação a outras regiões, a outros grandes centros do País. Quando falamos que apenas 30% dos lares do Nordeste têm acesso à Internet, significa dizer que o Nordeste parece um ponto fora da curva. Nós temos de inserir, dentro da nossa lógica de Federação, o desenvolvimento igual para todos. 
Desde já, gostaria de fazer um convite ao Sr. Ministro: que acompanhasse e participasse da instalação dessa Subcomissão, que será de suma importância para o povo brasileiro.
	Parabenizo o Ministro pela modernização dos telefones públicos, o que venho acompanhando, e pelos incentivos fiscais do programa de banda larga, que acompanhei quando era Deputado Estadual da Assembleia Legislativa de Alagoas. Os Estados poderiam aderir ao convênio com o CONFAZ, para dar esse incentivo. Lamentavelmente, o Estado de Alagoas não aderiu ao programa. Fiz o meu apelo, que não foi atendido, e conto com a sensibilidade do atual Governo.
	Vamos discutir também uma forma de levar a cobertura da telefonia móvel à zona rural. Nós sabemos que o campo precisa estar conectado, nós sabemos que a nossa juventude precisa estar totalmente conectada. Vários povoados do Estado de Alagoas e do Nordeste brasileiro também precisam dessa cobertura para se comunicar com o mundo.
	Nós precisamos fazer a inclusão digital, nós precisamos democratizar o acesso à informação e à comunicação, como forma de dar transparência e de dar publicidade ao que acontece no nosso País e no mundo. Isso significa conectar o cidadão, significa que o jovem que, a partir daí, pode também ter acesso à educação, ficar bem preparado, respaldado para enfrentar as adversidades e os desafios contemporâneos de um mundo globalizado.
	Gostaria, mais uma vez, de agradecer pela presença ao Sr. Ministro.
Muito obrigado pela tolerância, Sr. Presidente.
Também quero agradecer a todos os colegas que aprovaram o requerimento de instalação da Subcomissão de Ciência, Tecnologia e Comunicação no âmbito da Comissão de Ciência e Tecnologia da Casa. 
	Muito obrigado, Ministro."
2015-03-26T18:30;FRENTE PARLAMENTAR, FUNDOS DE PENSÃO, CRIAÇÃO, OBTENÇÃO, ASSINATURA, ANÚNCIO.;PELA ORDEM;"O SR. DEPUTADO JHC - Sr. Presidente, vou fazer uma rápida comunicação, devido ao adiantado da hora e como a sessão está se encerrando, coincidentemente sobre o mesmo assunto: hoje nós conseguimos assinaturas mais do que as necessárias para criar, Sr. Ministro, a Frente Parlamentar dos Fundos de Pensão, em defesa e pelo fortalecimento dos trabalhadores. 
Acreditamos, sim, que é possível fazer um trabalho transparente e modernizar a nossa legislação. Para isso, é necessário que tenhamos nesta Casa uma porta de entrada para essas discussões e, assim, desmistificar alguns tabus. Os fundos de pensão do mundo inteiro movem a economia e é isso que precisa ser despertado no cidadão brasileiro. 
Com certeza, Ministro, V.Exa. é conhecedor da área e poderá também colaborar com essa Frente Parlamentar. Vamos discutir de forma transparente e democrática esse assunto. 
Desde já, faço o convite aos colegas a fim de desenvolvermos um trabalho profícuo para que os contribuintes, aquele que colabora e, aquele que está gerindo esses fundos sintam-se protegidos e tenham retorno da melhor qualidade.
	Ao fazer este registro, deixo os nossos agradecimentos aos nobres Parlamentares pela criação nesta Casa da Frente Parlamentar dos Fundos de Pensão.
	Sr. Presidente, agradeço a oportunidade.
	Muito obrigado."
2015-03-30T15:12;DIA MUNDIAL DA JUVENTUDE, PRC 21/2015, PROJETO DE RESOLUÇÃO, ALTERAÇÃO, REGIMENTO INTERNO DA CÂMARA DOS DEPUTADOS, CRIAÇÃO, SECRETARIA DA JUVENTUDE, DEFINIÇÃO, COMPOSIÇÃO, COMPETÊNCIA, DEFESA.;PEQUENO EXPEDIENTE;"O SR. JHC (SD-AL. Sem revisão do orador.) - Sr. Presidente, hoje é comemorado o Dia Mundial da Juventude, que foi instituído pelo Papa João Paulo II, em 1985.
	Nós queremos registrar nesta Casa que protocolamos um projeto de resolução para criar a Secretaria da Juventude. Nós temos 27 Deputados com menos de 30 anos. E é importante, para nós planejarmos o futuro deste País, que a juventude brasileira possa ter voz nesta Casa também.
	Então, eu gostaria de deixar para a juventude brasileira a nossa expectativa de boas novas neste mandato.
	Agradeço a V.Exa., Sr. Presidente, por me deixar fazer esse registro à juventude brasileira."
2015-04-23T14:42;"COMISSÃO GERAL, DEBATE, CRISE, SETOR SUCROALCOOLEIRO. 
VAZAMENTO,  USINA HIDRELÉTRICA DE PAULO AFONSO, COMPANHIA HIDROELÉTRICA DO SÃO FRANCISCO (CHESF), APREENSÃO.";PEQUENO EXPEDIENTE;"O SR. JHC (SD-AL. Sem revisão do orador.) - Sr. Presidente Zé Silva, gostaria de dar publicidade a um assunto que também é do interesse de V.Exa. 
Nós temos aprovada nesta Casa uma Comissão Geral para debater a crise do setor sucroenergético no País. O Estado de V.Exa., Minas Gerais, os Estados de São Paulo, Rio de Janeiro e Pernambuco, o Nordeste brasileiro, o meu querido Estado de Alagoas estão todos envolvidos. Então, vamos fazer uma grande mobilização, quarta-feira, dia 10 de junho, a Comissão Geral, para podermos debater a crise no setor sucroenergético. 
	Outro ponto para o qual quero chamar a atenção diz respeito a um vazamento na Usina Paulo Afonso, da CHESF. Nós precisamos chamar a atenção do Ministério Público Federal, pois o próprio IBAMA liberou as comportas. Já há uma mancha no Rio São Francisco de mais 35 quilômetros. Mais de sete Municípios foram afetados. Eu gostaria de dar publicidade ao assunto, para que o Ministério Público Federal pudesse também se debruçar sobre a investigação de mais esse crime ambiental no Rio São Francisco.
	Gostaria também, Sr. Presidente, que fosse dada publicidade ao meu discurso pelos órgãos de comunicação da Casa. 
	Muito obrigado, Presidente Zé Silva.
	O SR. PRESIDENTE (Zé Silva) - Agradeço ao Deputado JHC."
