dataHoraInicio;keywords;tipoDiscurso;transcricao
2016-11-30T16:58;SISTEMA CARCERÁRIO, BARRACÃO (PR), RESULTADO, AVALIAÇÃO POSITIVA, ELOGIO.;PELA ORDEM;"O SR. DIEGO GARCIA (PHS-PR. Pela ordem. Sem revisão do orador.) - Obrigado, Deputado José Carlos Aleluia. Minha fala é sobre um importante encontro do qual participei nos últimos dias 19 e 20 de novembro, na cidade de Barracão, no sudoeste do Paraná.
	Nós já ouvimos diversas vezes nesta Casa discursos de Parlamentares e de especialistas afirmando que nosso sistema prisional está falido e perdido, mas o que eu vi acontecer na cidade de Barracão, no fim de semana dos dias 19 e 20, mostra justamente o oposto.
	O que está acontecendo na cidade de Barracão é uma resposta ao País e ao mundo. É uma mostra de que existe solução, sim, para o sistema prisional. A solução é o método APAC, que se iniciou numa cidade do interior do Estado de São Paulo e hoje está espalhado por diversas cidades do Estado de Minas Gerais. No Paraná, há pouco mais de 1 ano e meio, estava presente em apenas duas cidades: Barracão e Pato Branco.
	Agora, porém, a Dra. Branca Bernardi, Juíza da Comarca de Barracão, vem desenvolvendo um excelentíssimo trabalho de humanização e de valorização da pessoa humana e de reinserção dos condenados, pessoas que aguardam julgamento presas. Ela vem fazendo um trabalho diferenciado. 
	Sr. Presidente, Deputado José Carlos Aleluia, o que eu presenciei na cidade de Barracão foi nada mais, nada menos do que o encontro com a esperança. Hoje, os índices mostram que mais de 80% dos que passam pelo sistema prisional brasileiro retornam à criminalidade e, mais tarde, retornam às cadeias e presídios do nosso País. 
	No método APAC, não! Noventa por cento dos que passam por este método não retornam à criminalidade, muito pelo contrário. Retornam à sociedade já trabalhando. No método APAC, eles trabalham, têm cursos técnicos que ajudam na redução da pena, são valorizados como seres humanos e recebem tratamento completamente diferenciado e humanizado. 
	Eu pude presenciar o trabalho extraordinário realizado pela Dra. Branca Bernardi e pela equipe competente da APAC de Barracão, que se espalha agora por todo o Estado do Paraná, com a possibilidade de implantação em cerca de 30 cidades do Estado, nos próximos meses. 
	Nós estamos apostando todas as nossas fichas no método APAC, acreditando que este método, sim, recupera, reinsere na sociedade e valoriza a pessoa humana. Por isso, estamos dando todo o apoio para que a APAC seja implementada no País inteiro.
	Hoje nossos presos custam para os cofres públicos cerca de 4 salários mínimos, Deputado José Carlos Aleluia, enquanto no método APAC os presos custam para os cofres públicos apenas 1 salário mínimo. Isso representa uma redução drástica daquilo que hoje, em nosso País, nós gastamos para manter os presos. 
	Por que o método APAC permite isso? Porque os presos que ali estão não só trabalham, mas cozinham e cuidam das suas celas, cuidam da limpeza, cuidam de toda a manutenção do presídio onde cumprem pena. Portanto, este é um método diferenciado.
	No encontro promovido pelo Movimento da Renovação Carismática Católica no domingo, estive não apenas com os presos, mas também com as famílias dos presos, famílias que anseiam por receber em seus lares novos cidadãos, novos homens, homens recuperados e prontos para retornar ao mercado de trabalho com dignidade, algo que se perdeu ao longo das suas histórias por n motivos. 
No presídio do Município de Barracão, a dignidade está sendo resgatada, recuperada, graças à competência da Dra. Branca Bernardi e de todos os funcionários que trabalham na APAC.
	Muito obrigado, Deputado José Carlos Aleluia.
	O SR. PRESIDENTE (José Carlos Aleluia) - Parabéns, Deputado Diego Garcia! Cada vez que V.Exa. mencionava o nome da cidade de Barracão, eu me recordava de que meu avô paterno, Domingos Lins da Costa, nasceu na Bahia, em uma cidade chamada Barracão, mas que hoje se chama Rio Real.
	Passo a palavra ao Deputado Jones Martins, do PMDB do Rio Grande do Sul, último orador inscrito, a quem agradeço por ter esperado pacientemente."
2016-11-30T16:58;PL 4850/2016, PROJETO DE LEI ORDINÁRIA, INICIATIVA POPULAR, MEDIDA, CONTRA, CORRUPÇÃO, APROVAÇÃO, CAMARA DOS DEPUTADOS, ABUSO DE AUTORIDADE, RETOMADA, PEÇA ORIGINAL, EXPECTATIVA, AGILIZAÇÃO, APRECIAÇÃO, SENADO FEDERAL, CRITICA.;COMO LÍDER;"O SR. DIEGO GARCIA (PHS-PR. Como Líder. Sem revisão do orador.) - Sr. Presidente, estamos vendo acontecer agora no Senado Federal o mesmo que aconteceu na semana passada aqui no plenário da Câmara dos Deputados. Refiro-me à pressa, à celeridade para votar o Projeto de Lei das 10 Medidas contra a Corrupção.
	Na semana passada, as minhas reações aqui no plenário não impediram que o processo avançasse e fosse apreciado na noite de ontem e na madrugada de hoje. Infelizmente, o projeto, ao seu final, foi completamente desconstruído. E muito nos estranha essa celeridade por parte do Senado Federal agora, e não será de se estranhar se ele for ainda mais desconstruído, através dessa possível votação que poderá ocorrer a qualquer instante no Senado Federal.
	As reações em todo o Brasil são nítidas, são claras. Muitos Deputados estão sofrendo e apanhando muito. E apanhando por quê? Porque estamos aqui como representantes do povo, e não das nossas vontades, para representar 200 milhões de brasileiros que não aguentam mais tanta corrupção, tanta sujeira, envolvendo principalmente a classe política - não podemos deixar aqui de falar dela.
	Temos que lutar para mudar esta triste realidade, a fim de que não se repita o que vimos acontecer na madrugada de ontem durante a realização dos trabalhos da Câmara dos Deputados. Nós temos que trabalhar para mudar esta realidade.
	Aproxima-se agora o momento de as mudanças acontecerem, com as eleições para Deputado Federal. Na minha opinião, a única forma de mudar é o povo brasileiro fazer bem suas escolhas, escolher bem seus representantes, porque o resultado da votação de ontem foi reflexo das escolhas de 2014.
	Por escolhermos mal, estamos sofrendo, e sofrendo muito. E quem paga o preço, Deputado Dr. Sinval, são os mais necessitados, os pobres, aqueles que sofrem devido ao comportamento de pessoas que querem continuar enriquecendo à custa do povo, à custa do dinheiro público, pessoas sem caráter que, na madrugada de ontem, se posicionaram até com zombaria, que não têm vergonha quando se trata daquele motivo pelo qual foram escolhidos e eleitos: para serem exemplo e referência, na prática, de verdade."
2016-11-30T16:58;AUDIÊNCIA PÚBLICA, COMISSÃO DE DEFESA DOS DIREITOS DAS PESSOAS COM DEFICIÊNCIA, ANÚNCIO, DEBATE, AÇÃO DIRETA DE INCONSTITUCIONALIDADE, ASSOCIAÇÃO NACIONAL DOS DEFENSORES PÚBLICOS, ABORTO, LEGALIZAÇÃO, GESTANTE, CONTAMINAÇÃO, ZIKA VÍRUS.;PELA ORDEM;"O SR. DIEGO GARCIA (PHS-PR. Pela ordem. Sem revisão do orador.) - Sr. Presidente, Sras. e Srs. Deputados, o Deputado Eduardo Bolsonaro, Presidente da Comissão de Defesa dos Direitos das Pessoas com Deficiência, que trata de todos os projetos relacionados à pessoa com deficiência, marcou uma reunião para a próxima terça-feira. 
	S.Exa. acolheu o requerimento de minha autoria para que fosse debatida a ação direta de inconstitucionalidade referente à Associação Nacional dos Defensores Públicos, que busca a legalização do aborto no caso de gestantes que tenham contraído o zika vírus, com o único argumento de que o bebê nasceria com alguma deficiência. 
	Então, na próxima terça-feira, nós faremos esse debate na Comissão. Será uma discussão ampla, com a presença de especialistas, de pessoas de diversas áreas e de diversos segmentos.
	É importante a participação dos Parlamentares, porque está prestes a haver uma decisão do Supremo que pode legalizar o aborto, abrindo precedentes para sua legalização no caso de fetos com deficiência.
	Isso seria muito ruim para o nosso País, principalmente neste ano das Paraolimpíadas, em que os nossos atletas paraolímpicos se tornaram um orgulho nacional. Milhares de pessoas retornaram às práticas esportivas motivadas pelos nossos medalhistas e por aquilo que viram na televisão. 
	Nós estamos analisando tudo o que está acontecendo no nosso País e vendo com muita tristeza essas decisões do Supremo Tribunal Federal."
2016-12-01T12:20;"REGISTRO, NOTA, CONFERÊNCIA NACIONAL DOS BISPOS DO BRASIL (CNBB), DEFESA, DIREITO À VIDA, CONTRÁRIO, DECISÃO, SUPREMO TRIBUNAL FEDERAL (STF), DESCRIMINALIZAÇÃO, ABORTO, INÍCIO, GRAVIDEZ.
REALIZAÇÃO, DEBATE, COMISSÃO DE DEFESA DOS DIREITOS DAS PESSOAS COM DEFICIÊNCIA, AÇÃO DIRETA DE INCONSTITUCIONALIDADE, LEGALIZAÇÃO, ABORTO, PESSOA COM DEFICIÊNCIA.";PELA ORDEM;"O SR. DIEGO GARCIA (PHS-PR. Pela ordem. Sem revisão do orador.) - Sr. Presidente, Sras. e Srs. Deputados, venho a esta tribuna para anunciar aqui uma importante nota divulgada hoje pela Conferência Nacional dos Bispos do Brasil (CNBB), referente à decisão tomada por um dos colegiados do Supremo Tribunal Federal de que o aborto, até o terceiro mês, não é crime. A CNBB assim se pronuncia em sua nota:
		""Propus a vida e a morte; escolhe, pois, a vida"" (cf. Dt. 30,19)
		A Conferência Nacional dos Bispos do Brasil - CNBB, por meio de sua Presidência, manifesta sua posição em defesa da integralidade, inviolabilidade e dignidade da vida humana, desde a sua concepção até a morte natural (cf. Constituição Federal, art. 1°, III; 3°, IV, e 5°, caput).
		A CNBB respeita e defende a autonomia dos Poderes da República. Reconhece a importância fundamental que o Supremo Tribunal Federal - STF desempenha na guarda da Constituição da República, particularmente no momento difícil que atravessa a nação brasileira. Discorda, contudo, da forma com que o aborto foi tratado num julgamento de habeas corpus no STF.
		Reafirmamos nossa incondicional posição em defesa da vida humana, condenando toda e qualquer tentativa de liberação e descriminalização da prática do aborto.
		Conclamamos nossas comunidades a rezarem e a se manifestarem publicamente em defesa da vida humana, desde a sua concepção.
		Nossa Senhora, Mãe de Jesus e nossa Mãe, interceda por nós, particularmente pelos nascituros.
		Brasília, 1º de dezembro de 2016.""
	Essa é a nota e o posicionamento da CNBB, importante neste momento. Na data de ontem, o Deputado Eduardo Bolsonaro, que está na Mesa, Presidente da Comissão de Defesa dos Direitos das Pessoas com Deficiência, acolheu um requerimento de minha autoria e marcou para a próxima terça-feira um debate importante sobre a temática do aborto, que acontecerá na Comissão. Sob a Presidência do Deputado Eduardo Bolsonaro, nós falaremos não só sobre essa decisão do Supremo Tribunal Federal, mas sobre a próxima decisão, que o Supremo está prestes a tomar também, já com audiência marcada para o dia 7 de dezembro. 
	Essa audiência no Supremo vai discutir a Ação Direta de Inconstitucionalidade relacionada à Associação Nacional dos Defensores Públicos, que quer a legalização do aborto nos casos que envolvam pessoas com deficiência. A Associação alega e justifica esse posicionamento embasada na questão das mulheres grávidas que tenham contraído o vírus do zika. Isso é inadmissível para o nosso País. Nós não podemos compactuar com isso. 
	Eu reforço aquilo que a CNBB divulgou em nota pública, que, com certeza, será lida em todas as paróquias, em todas as igrejas deste País neste final de semana, para que a nossa Nação, que em sua grande maioria é contra a legalização do aborto, se manifeste, vá para as ruas e se posicione em defesa da vida. 
	Sr. Presidente, Deputado Carlos Manato, eu peço só mais alguns segundos para concluir a minha fala. Faço uso da tribuna para reforçar a importância da vida desde a concepção. O Supremo Tribunal Federal, com essa decisão, está dizendo que o feto, até o terceiro mês, Deputado, não tem vida, não é um ser humano.
	Eu estou aqui, Deputado Carlos Manato, com um áudio. Peço aos técnicos que subam um pouquinho o som para que todos possam ouvi-lo. (Reprodução de áudio.) São 156 batimentos por minuto.
	Esse áudio é do exame que a minha esposa fez recentemente do meu próximo filho, Pedro, que está sendo gestado e formado, com muito amor e carinho, por nós e pela nossa família, justamente com 3 meses de vida, no ventre da minha esposa, Beatriz. Está a médica relatando 156 batimentos por minuto.
	Nós não podemos compactuar com isso, não podemos tirar o direito dessas pessoas de terem vida e dignidade. Oxalá - queira Deus - um dia possam estar ocupando, quem sabe, uma dessas cadeiras em nosso lugar.
	Muito obrigado, Presidente, pela compreensão. Faço esse reforço para que o País se una contra o aborto, contra a decisão do Supremo Tribunal Federal. O Supremo não pode ser maior do que este Parlamento, que está tratando dessa temática, sim, com diversas audiências, com diversos projetos de lei que estão em tramitação nesta Casa. Nós queremos que esse debate seja feito aqui, e não pela decisão de apenas 11 homens deste País.
	Muito obrigado.
	O SR. PRESIDENTE (Carlos Manato) - Eu é que agradeço, nobre Deputado."
2016-12-08T09:00;;HOMENAGEM;"Ata da 327ª (tricentésima vigésima sétima) Sessão da Câmara dos Deputados, Não Deliberativa Solene, matutina, da 2ª Sessão Legislativa Ordinária, da 55ª Legislatura, em 08 de dezembro de 2016. Às 09h16, o Sr. João Campos, no exercício da Presidência, nos termos do § 2º do artigo 18 do Regimento Interno, declarou aberta a sessão e deu por dispensada a leitura da ata da sessão anterior. O Sr. Presidente informou que a sessão destinou-se à Homenagem ao Dia da Bíblia; prestou as devidas homenagens; e convidou para compor a Mesa os Srs. Josimar Santos Rosa, Presidente do Sínodo de Brasília, representando o Reverendo Roberto Brasileiro, Presidente do Supremo Concílio da Igreja Presbiteriana do Brasil; Jamilson Santos, Presidente do Núcleo de Pastores de Valparaíso de Goiás; Jessé Pereira da Silva, Secretário Regional da Sociedade Bíblica do Brasil; Gessé de Roure Filho, Presidente do Ministério ""Parlamento e Fé Brasil""; Josué Bengtson, Deputado Federal; Lourival Dias Neto, Pastor da Igreja Assembleia de Deus de Sobradinho - DF; e Apóstolo Fadi Faraj, suplente do Senador da República Reguffe e Presidente da Comunidade Cristã Ministério da Fé. O Sr. Presidente convidou todos a ouvir o Hino Nacional. Após a exibição do vídeo institucional, o Sr. Presidente concedeu a palavra ao Sr. Josué Bengtson, que proferiu discurso do Sr. Presidente da Câmara dos Deputados, Rodrigo Maia; e à Sra. Patrícia Nunes, Presidente do Diretório Distrital da Sociedade Bíblica do Brasil. Após a apresentação do Coral Evangélico de Brasília, acompanhado pela pianista Leila de Carvalho, sob a regência de Emilio de Cesar e Rita de Conde, interpretando a música ""Um Vaso Novo"", o Sr. Presidente concedeu a palavra ao Sr. Josué Bengtson, pelo PTB; e Benedita da Silva, pelo PT. Usou da palavra pela ordem o Sr. Luiz Carlos Hauly. Após a apresentação do Coral Evangélico de Brasília, acompanhado pela pianista Leila de Carvalho, sob a regência de Emilio de Cesar e Rita de Conde, interpretando as músicas ""Digno de Ser Louvado"" e ""A Majestade e Glória de Teu Nome"", o Sr. Presidente concedeu a palavra aos Srs. Hildo Rocha, pelo PMDB; Roberto de Lucena, pelo PV; Dr. Sinval Malheiros, pelo PTN; Givaldo Carimbão, pelo PHS; Silas Câmara, pelo PRB; Ronaldo Fonseca, pelo PROS; Sóstenes Cavalcante, pelo Democratas; Gilberto Nascimento, pelo PSC; e ao Sr. Fadi Faraj, componente da Mesa. Usaram da palavra pela ordem a Sra. Conceição Sampaio e os Srs. Ronaldo Martins e Diego Garcia. O Sr. Presidente leu discurso do Sr. Pastor Eurico, Deputado Federal. Usou da palavra pela ordem o Sr. Cabo Daciolo. O Sr. Presidente convidou a todos a assistir à apresentação das cantoras Rebeca Schneider e Priscila Litti interpretando as canções ""Tua Palavra"" e ""Já Vem perto do Natal"". Usaram da palavra pela ordem os Srs. Rômulo Gouveia e Deley. O Sr. Presidente registrou a presença de convidados, reiterou as homenagens prestadas, agradeceu a presença de todos e, às 11h52, encerrou a sessão.

					Carlos Manato
Presidente

Luiz Couto
Secretário

As notas taquigráficas desta Sessão Não Deliberativa Solene poderão ser solicitadas ao Departamento de Taquigrafia, Revisão e Redação - DETAQ."
2016-12-19T21:16;"PARANÁ, MUNICIPIOS, FAVORÁVEL, ATUAÇÃO, KELE CRISTIANE DIOGO BAHENA, PROMOTOR DE JUSTIÇA, CONGRATULAÇÃO.
TRANSPARÊNCIA PÚBLICA, ADMINISTRAÇÃO MUNICIPAL, TEMA, MINISTÉRIO PÚBLICO ESTADUAL, PARANÁ, AUTORIA, EVENTO, REALIZAÇÃO, SANTO ANTÔNIO DA PLATINA (PR), REGISTRO.";BREVES COMUNICAÇÕES;"O SR. DIEGO GARCIA (PHS-PR. Sem revisão do orador.) - Sr. Presidente, obrigado.
	Eu quero fazer o registro, nesta noite, do importante trabalho que está sendo desenvolvido e realizado pelo Ministério Público do Estado do Paraná e do encontro promovido na cidade de Santo Antônio da Platina, com a presença de mais de 500 Prefeitos, Vice-Prefeitos e Vereadores eleitos, de alguns que estão deixando o mandato à frente da administração pública e de outros que estão assumindo pela primeira vez. 
	Os trabalhos são conduzidos pela Dra. Kele, Promotora que faz um trabalho importantíssimo e tem dado uma contribuição gigantesca aos Municípios do norte do Estado do Paraná, o Norte Pioneiro.
 O objetivo desse encontro foi o de fortalecer a formação do conhecimento dos novos gestores, dos Prefeitos eleitos da região norte do Paraná - mais de 60 cidades ali estiveram representadas - e de apresentar-lhes mecanismos para administrar e conduzir os trabalhos à frente dos Municípios com maior transparência, com seriedade, sem fazer da administração, da gestão pública um cabide de empregos.
	A Dra. Kele conseguiu, nos últimos anos, através do seu trabalho e do Ministério Público do Estado do Paraná, no norte do Paraná, sanar inúmeros problemas que se alastravam há anos na nossa região. Por exemplo: em algumas cidades, há cerca de 20 anos não se realizava um concurso público sequer; havia muitos cargos comissionados em alguns Municípios, todo mundo era chefe em alguns Municípios; cargos inexistentes, inoperantes: pessoas passaram em concurso público para um cargo específico e nunca exerceram a função para a qual foram designadas, para a qual passaram no concurso público. 
Esses problemas relacionados a Municípios do norte do Paraná, com o trabalho do Ministério Público do Estado, estão sendo sanados.
	Nós parabenizamos a Dra. Kele pelo excelente trabalho que vem realizando em nome do Ministério Público no Estado do Paraná e pela promoção desse encontro, que, com certeza, serve de alerta para os novos gestores da nossa região, do querido Norte Pioneiro, para o fato de que é possível, sim, fazer uma gestão séria e transparente. Aqueles que não quiserem contribuir para isso, deverão arcar com as suas responsabilidades.
	Muito obrigado, Presidente."
2016-12-20T14:18;ORIENTAÇÃO DE BANCADA,PARECER FAVORÁVEL,  DISPOSITIVO LEGAL, SUBSTITUTIVO, SENADO FEDERAL, PLP 257/2016, PROJETO DE LEI COMPLEMENTAR, PARTIDO HUMANISTA DA SOLIDARIEDADE (PHS), VOTO FAVORÁVEL.;ORIENTAÇÃO DE BANCADA;"O SR. DIEGO GARCIA (PHS-PR. Pela ordem. Sem revisão do orador.) - O PHS vota ""sim"", Sr. Presidente. Parabenizo V.Exa. pela condução dos trabalhos e o Deputado Esperidião Amin, que, com maestria, construiu um acordo que possibilitou a todos os partidos e todas as bancadas votarem ""sim"", dando condições aos Estados de sobreviverem e se reencontrarem economicamente.
	Parabéns ao Deputado Esperidião Amin e a todos os Deputados que permaneceram aqui para votar esta importante matéria para o nosso País!"
2017-03-08T17:46;PL 3170/2015, PROJETO DE LEI ORDINÁRIA, OBRIGATORIEDADE, HOSPITAL PÚBLICO, HOSPITAL PRIVADO, ACOMPANHAMENTO, ORIENTAÇÃO, AMAMENTAÇÃO, MÃE, APROVAÇÃO, DEFESA.;PELA ORDEM;"O SR. DIEGO GARCIA (Bloco/PHS-PR. Pela ordem. Sem revisão do orador.) - Obrigado, Presidente.
	Neste dia tão importante, 8 de março, quando comemoramos o Dia Internacional das Mulheres, estou também muito feliz, porque esse é um projeto que nasceu com a indicação, com uma conversa e também com o sofrimento da minha esposa. Ele já foi apreciado pela Comissão de Seguridade Social e Família e terá apreciados hoje sua urgência e mérito. Eu me refiro ao Projeto de Lei nº 3.170, de 2015, que trata do direito a acompanhamento e orientação à mãe com relação à amamentação.
	Nós conversamos com as líderes da bancada feminina e fizemos um acordo para que seja feita uma emenda de plenário apenas para o aperfeiçoamento do texto e para que as mães, nos primeiros dias de vida do bebê e de internação tenham direito a essa orientação e ao acompanhamento de uma profissional de saúde. Ele será uma boa orientação para que o leite materno, tão importante, a primeira e maior de todas as vacinas do recém-nascido, possa ser assegurado a milhares de mães, que hoje acabam desistindo de amamentar pela falta de orientação. Elas acabam desanimando e desistindo de amamentar pela falta de orientação de um profissional.
	Então, estou muito feliz e quero agradecer o apoio que tive hoje no Colégio de Líderes para a apreciação desse projeto de lei, no dia 8 de março, Dia Internacional das Mulheres, que com certeza vai ajudar a salvar a vida de milhares de crianças em todo o território nacional.
	Obrigado."
2017-03-08T18:36;AGRADECIMENTO, ROSANGELA GOMES, DULCE MIRANDA, DEPUTADO FEDERAL, BANCADA FEMININA, ATUAÇÃO, APROVAÇÃO,  PL 3170/2015, PROJETO DE LEI ORDINÁRIA.;PELA ORDEM;"O SR. DIEGO GARCIA (Bloco/PHS-PR. Pela ordem. Sem revisão do orador.) - Sra. Presidente, enquanto a Deputada se dirige à tribuna, quero agradecer à Deputada Rosangela Gomes e à Deputada Dulce Miranda, que foi a Relatora da mesma matéria na Comissão de Seguridade Social e Família. Eu inclusive fiz a indicação do Projeto de Lei nº 3.452, de 2015, da Deputada Dulce Miranda, que será apreciado em instantes no plenário da Câmara dos Deputados.
	Também quero agradecer o apoio de toda a bancada feminina neste dia importantíssimo. Esta é uma vitória de todas as mulheres do nosso País.
	Deputada Rosangela Gomes, parabéns! A sua contribuição, com certeza, interferirá numa melhor qualidade de vida para milhares de brasileiros, com a melhor de todas as vacinas, o leite materno.
	Obrigado, Sra. Presidente."
2017-03-08T18:36;"AGRADECIMENTO, ROSANGELA GOMES, DEPUTADO FEDERAL, PARECER FAVORÁVEL, PL 3170/2015, PROJETO DE LEI ORDINÁRIA, OBRIGATORIEDADE, HOSPITAL PÚBLICO, PARTICULAR, ACOMPANHAMENTO, ORIENTAÇÃO, AMAMENTAÇÃO, MÃE.
DENÚNCIA, HOSPITAL FILANTRÓPICO, PROIBIÇÃO, MÃE, AMAMENTAÇÃO, PREMATURO, UNIDADE DE TERAPIA INTENSIVA NEONATAL.";PELA ORDEM;"O SR. DIEGO GARCIA (Bloco/PHS-PR. Pela ordem. Sem revisão do orador.) - Sra. Presidente, eu gostaria de agradecer à Deputada Rosângela pelo seu parecer ao Projeto de Lei nº 3.170, de 2015, e relatar a importância deste projeto a todas as mulheres nesta Casa.
	No dia 3 de março deste ano, no Hospital e Maternidade Santa Joana, em São Paulo, aconteceu um fato terrível: uma mãe que teve o nascimento do seu filho de forma prematura foi proibida de amamentar na UTI neonatal porque era horário de visitas.
	Então, aprovarmos esta matéria é importante porque estaremos fomentando, incentivando o aleitamento materno, que é a primeira, a maior e a melhor de todas as vacinas que o recém-nascido pode receber.
	Esta proposta, inclusive, é de iniciativa da minha esposa, Beatriz, a quem parabenizo pelo dia de hoje. E nesta data simbólica peço o apoio de todos os pares para a aprovação deste projeto de lei importante para o Brasil e que não traz nenhum custo, nenhum ônus para o Estado ou para os hospitais em todo o território nacional.
	Obrigado, Presidente."
