dataHoraInicio;keywords;tipoDiscurso;transcricao
2017-09-05T11:50;ORIENTAÇÃO DE BANCADA, REQUERIMENTO DE DESTAQUE DE VOTAÇÃO EM SEPARADO, EMENDA, SENADO FEDERAL, PLV 24/2017, PROJETO DE LEI DE CONVERSÃO, MPV 776/2017, MEDIDA PROVISÓRIA, PARTIDO HUMANISTA DA SOLIDARIEDADE (PHS), VOTO CONTRÁRIO.;ORIENTAÇÃO DE BANCADA;"O SR. DIEGO GARCIA (PHS-PR. Pela ordem. Sem revisão do orador.) - Sr. Presidente, da mesma forma que foi encaminhado pelo partido PPS, o PHS orienta o voto ""não"".
	Está claro aos Parlamentares desta Casa que este texto nada tem a ver com aquele que nós apreciamos e votamos aqui. Esta emenda que veio do Senado demonstra claramente ser um jabuti que nos foi apresentado.
	Por isso, o PHS está encaminhando o voto contrário, para a rejeição desta emenda, para a retirada disto do texto, visto que não há clareza de quais serão esses serviços que vão ser prestados pelos cartórios. Não sabemos se é venda de chip de celular. Que tipo de serviço é esse? É venda de sorvete, de picolé? Ainda podem celebrar parcerias com o poder público. Nós estamos avaliando com muita preocupação...
	(Desligamento automático do microfone.)"
2017-09-05T11:50;ORIENTAÇÃO DE BANCADA, REQUERIMENTO DE RETIRADA DE PROPOSIÇÃO DA ORDEM DO DIA, PEC 282/2016, PROPOSTA DE EMENDA À CONSTITUIÇÃO, PARTIDO HUMANISTA DA SOLIDARIEDADE (PHS), VOTO CONTRÁRIO.;ORIENTAÇÃO DE BANCADA;"O SR. DIEGO GARCIA (PHS-PR. Pela ordem. Sem revisão do orador.) - Sr. Presidente, nós entendemos que essa reforma não reforma nada, mas, ao mesmo tempo, não podemos esticar esse debate. Temos que concluí-lo através do voto, definir de fato que textos que saíram da Comissão a Câmara quer votar. 
	Fui membro da Comissão que discutia a PEC 282/16, que foi instalada em meados de junho. Naquela Comissão, houve apenas duas audiências públicas, em que foram aprovados mais de 20 requerimentos, ou seja, não ouvimos a sociedade, não ouvimos especialistas e também não podemos ser falsos com a população ao dizer que esta é a reforma de que o Brasil precisa. 
	Por isso, neste momento, nós vamos encaminhar o voto...
	(Desligamento automático do microfone.)
	O SR. PRESIDENTE (André Fufuca) - Peço que conclua, Deputado. 
	O SR. DIEGO GARCIA - Nós vamos encaminhar o voto ""não"", mas ao texto, visto o que a Deputada mencionou, que os acordos feitos na Comissão não foram cumpridos. E nós queremos também deixar claro que não participamos de nenhum acordo, não fomos chamados para nenhuma reunião. 
	Por isso, vamos encaminhar contra a matéria e contra o mérito também."
2017-09-05T17:14;ORIENTAÇÃO DE BANCADA, SUBSTITUTIVO, PEC 282/2016, PROPOSTA DE EMENDA À CONSTITUIÇÃO, PARTIDO HUMANISTA DA SOLIDARIEDADE (PHS), VOTO FAVORÁVEL.;ORIENTAÇÃO DE BANCADA;"O SR. DIEGO GARCIA (PHS-PR. Pela ordem. Sem revisão do orador.) - Sr. Presidente, primeiramente eu gostaria de parabenizar V.Exa. pela condução dos trabalhos aqui na Casa: um jovem Parlamentar brilhante, que está muito bem conduzindo os trabalhos nesta tarde, nesta noite. Quero parabenizar também a Deputada Shéridan, outra jovem Parlamentar que representa essa oxigenação da nossa política brasileira.
	O PHS, da mesma forma, vai orientar o voto ""sim"" a favor deste acordo que foi feito e firmado na tarde de hoje entre diversos partidos, resgatando em outro momento o texto que foi, em outra hora, apresentado pela Deputada Shéridan, com relação ao fim de coligações para 2020. Entendemos que o fim de coligações para 2018 é muito precipitado.
	Portanto, vamos orientar o voto ""sim""."
2017-09-13T18:32;ORIENTAÇÃO DE BANCADA, REQUERIMENTO DE RETIRADA DE PROPOSIÇÃO DA ORDEM DO DIA, PEC 77/2003, PROPOSTA DE EMENDA À CONSTITUIÇÃO, PARTIDO HUMANISTA DA SOLIDARIEDADE (PHS), VOTO CONTRARIO.;ORIENTAÇÃO DE BANCADA;"O SR. DIEGO GARCIA (PHS-PR. Pela ordem. Sem revisão do orador.) - Sr. Presidente, o PHS vai encaminhar o voto ""não"", porque entende que a sociedade não aguenta mais essa discussão em torno da reforma política.
	Agora, é bom ressaltar que o PHS também não vai acompanhar favoravelmente nenhuma emenda que venha agora de Plenário, emenda aglutinativa, tentando fazer passar o Fundo de Financiamento da Democracia junto com o distritão e, assim, impossibilitando os destaques.
	Nós queremos votar conforme o que já foi definido pelo próprio Plenário em sessões passadas, seguir a ordem de votação dos destaques e esgotar essa discussão. Somos contra a aprovação do distritão e contra o fundo.
	O PHS encaminha o voto ""não"" ao requerimento de retirada de pauta."
2017-09-13T18:32;CONSULTA, PRESIDÊNCIA, CUMPRIMENTO, ACORDO, LIDERANÇA PARTIDÁRIA, PROCEDIMENTO, VOTAÇÃO, PEC 77/2003, PROPOSTA DE EMENDA À CONSTITUIÇÃO, REFORMA POLÍTICA.;PELA ORDEM;"O SR. DIEGO GARCIA (PHS-PR. Pela ordem. Sem revisão do orador.) - Sr. Presidente, gostaria de fazer uma pergunta a V.Exa.: vai ser respeitado por V.Exa. o acordo de procedimentos para votação da PEC 77, como já havia sido definido ainda na semana passada pelos Líderes? Esse acordo foi feito pela grande maioria dos Líderes para a votação da PEC ainda na data de ontem. Isso vai ser respeitado ou pode ainda haver mudança com relação ao processo de votação da PEC?
	O SR. PRESIDENTE (Rodrigo Maia) - Depende de haver apresentação de alguma emenda aglutinativa. Não havendo, a ordem é votar o sistema eleitoral primeiro, como aprovado por este Plenário naquele requerimento do PP, acho eu.
	(Pausa.)"
2017-09-13T18:32;CONTRARIEDADE, DESCUMPRIMENTO, ACORDO, VOTAÇÃO, PEC 77/2003, PROPOSTA DE EMENDA À CONSTITUIÇÃO, REFORMA POLÍTICA.;PELA ORDEM;"O SR. DIEGO GARCIA (PHS-PR. Pela ordem. Sem revisão do orador.) - Sr. Presidente, na semana passada, nós nos reunimos, diversos Líderes, e foi feito um acordo para a votação da PEC 77, no plenário da Câmara dos Deputados, seguindo uma ordem de votação. 
	Tudo indica, como o Deputado Júlio já muito bem salientou, que esse acordo acabou. E vem aí um grande jabuti, um monstro, algo que nós não sabemos o que é, porque ainda não tem cara, não tem nome, e não conseguimos nem sequer ter a dimensão do vem no texto.
	O Plenário tem que entender que virá tudo junto nesse pacotão, principalmente a possibilidade de adoção de um distritão com legenda, o que seria um retrocesso ainda maior. 
	O distritão só existe em quatro países no mundo, entre eles, o Afeganistão, o maior deles, e as Ilhas Pitcairn, que tem 50 mil habitantes. Com certeza, esse não é o sistema que o povo brasileiro, que a sociedade brasileira quer. 
	E o distritão com legenda, com todo o respeito aos Parlamentares do PT, beneficia o PT, beneficia o PSDB, beneficia o PMDB, mas prejudica a grande maioria dos partidos da Casa. 
	Essa proposta tem um enfoque e uma razão muito claros: fazer com que a quantidade de legendas que hoje existe na Casa não exista mais e tudo se concentre em apenas três, quatro ou cinco partidos. 
	Por isso, Sr. Presidente, a posição do PHS é clara: nós não vamos aceitar nenhum descumprimento daquilo que já foi feito em termos de acordo de procedimentos para a votação. E o estabelecimento desse acordo não significa apoio a proposta A, B, C ou D. Trata-se tão somente de acordo para a votação, porque nós queremos votar e esgotar esta matéria hoje. Mas, repito, não vamos aceitar essas medidas. 
	E outra coisa: nessa emenda viria também o Fundo de Financiamento da Democracia, sem valor, sem limite. O valor será estabelecido depois, podendo ser muito maior do que os 3 bilhões e 600 milhões de reais previstos anteriormente. 
	A nossa denúncia aqui é para que o Plenário esteja atento, a fim de que, na hora da votação, nós possamos rejeitar essa emenda aglutinativa que será apresentada. Ela não é aquilo que o povo anseia e espera de uma reforma política, de maneira alguma. Essa proposta que está nos bastidores, que nem sequer sabemos qual é nem sabemos quem é o dono, quem é o autor, vem para, mais uma vez, ferir esta Casa, ferir os Parlamentares sérios, jogar a população brasileira contra o Parlamento e contra os Parlamentares que, de fato, atuam em defesa do povo e da sociedade brasileira.
	O PHS é contra, vai se posicionar contra e não vai aceitar essas emendas que serão apresentadas no plenário."
2017-09-13T18:32;EMENDA AGLUTINATIVA, PEC 77/2003, PROPOSTA DE EMENDA À CONSTITUIÇÃO, REFORMA POLÍTICA, FINANCIAMENTO PUBLICO, CAMPANHA ELEITORAL, FUNDO ESPECIAL DE FINANCIAMENTO DA DEMOCRACIA (FFD). SISTEMA ELEITORAL, DISTRITÃO, CONTRARIEDADE.;COMO LÍDER;"O SR. DIEGO GARCIA (PHS-PR. Como Líder. Sem revisão do orador.) - Sr. Presidente, Sras. e Srs. Deputados, se esta não é a reforma ideal, por que vamos aprová-la? Olhem a incoerência no discurso e na fala: dizem que são contra uma coisa, mas vão votar a favor dessa coisa. Não dá para entender mais nada!
	Está sendo desrespeitado o acordo já feito para o procedimento desta votação. Está sendo apresentado para votação nesta noite no plenário da Câmara dos Deputados não um jabuti, mas um monstro, assinado por dois partidos: PT e PSDB.
	Ora, o PT, que arduamente subiu a esta tribuna aqui para se posicionar contra o teto de gastos, dizendo que este iria tirar dinheiro da saúde, da educação, da classe trabalhadora, agora é a favor de um fundo ilimitado! Está aqui escrito, só não enxerga quem não quer: ele é ilimitado! Como os Deputados do PT agora irão se explicar?
	Eu acredito na coerência, acredito que os Deputados não vão acompanhar isso nesta votação. Vamos derrubar essa emenda aglutinativa e vamos votar destaque por destaque, fazendo aqui a discussão.
	Da mesma forma, questiono o PSDB. Grande parte dos Deputados do PSDB - para não dizer a maioria - foi a público, gravou vídeos, publicou nas redes sociais que é contra o Fundo de Financiamento da Democracia. Agora eles vão votar a favor desta proposta?! Esse é o grande questionamento!
	Nós não podemos aceitar uma proposta que só vai beneficiar dois grandes partidos. Veio aqui um de seus autores dizer que ela foi amplamente discutida na Comissão. Isso é mentira, é uma falácia! Essa proposta está sendo apresentada agora, na calada da noite, para colocar nas nossas costas, nas costas dos Parlamentares, mais uma vez, o ônus da aprovação de uma reforma que não reforma nada - nada!
	Como os Deputados do PT, que subiram inúmeras vezes à tribuna para se posicionar contra o distritão, vão fazer a defesa agora? Como justificar a votação de S.Exas.?
	Se a votação desta emenda aglutinativa acontecer, ela tem que ser, sim, derrubada por este Plenário, apesar de entendermos que existem outras emendas que teriam prioridade para votação. E não importa se vamos ter que entrar na madrugada aqui discutindo ponto a ponto esta reforma! 
	Qual é o medo? Vamos para o voto! Vamos deixar as nossas digitais e vamos mostrar para a sociedade como o Parlamento pensa e o que o Parlamento quer para o nosso País!
	Essa é a minha posição."
2017-09-13T22:48;"REPÚDIO, ACORDO, LIDERANÇA PARTIDÁRIA, VOTAÇÃO, REFORMA POLÍTICA, SISTEMA ELEITORAL, DISTRITÃO. 
DEFESA, RENOVAÇÃO, REPRESENTAÇÃO POLÍTICA.";COMO LÍDER;"O SR. DIEGO GARCIA (PHS-PR. Como Líder. Sem revisão do orador.) - Sr. Presidente, Sras. e Srs. Deputados, esta sessão é verdadeiramente uma sessão histórica, sim. Histórica porque nós vimos, na noite de hoje, algo que poucas vezes nós vimos aqui na Casa: PT concordando com PSDB; PMDB e PP no grupo, sustentando.
	E agora eles têm consciência da vergonha e do vexame que seria se essa votação continuasse com esse sistema que está sendo proposto, que só existe no Afeganistão, em Vanuatu, nas Ilhas Pitcairn e na Jordânia. E fazem discurso dizendo que é disso que o País precisa, é do que a sociedade precisa, é a inovação de que o povo brasileiro precisa.
	Nós temos que deixar de hipocrisia, de falsidade, e assumir o que esta proposta é de verdade. Ela nada mais é do que a nova lista fechada. Impedir a oxigenação na política, dizer que esse sistema não dá certo... Ora, será que estamos esquecendo que votamos esse sistema em 2015? Mas estamos dizendo que não dá certo, porque houve em 2016 uma renovação gigantesca com partidos como o PHS, partido que mais cresceu no Brasil. E vai continuar crescendo. Mas querem impedir essa oxigenação.
	Hoje, no meu Estado do Paraná, o Prefeito da Capital é de um partido cujo nome nem está aqui no painel. Mas isso só foi permitido por conta do sistema atual.
	Nós temos, sim, que propor mudanças, mas não essas mudanças na calada da noite, não essas mudanças que saem da gaveta de pessoas que não têm interesse de votar a favor do País, a favor da sociedade.
	Ora, que interessante! Hoje, não houve ""pixuleco"", nem houve os donos da mala aqui. Não houve brigas. Não houve confusão. Foi tudo paz e amor. Mas não conseguiram por conta da coerência dos Deputados, da maioria dos Deputados, que eu não tenho dúvida de que votariam contra a orientação de suas bancadas nesta noite, porque eles têm consciência do que de fato é o bom para o nosso País.
	Nós temos que dar um basta a essas falácias de que essa proposta de reforma política é, de fato, o que País quer, o que o País sonha, de que o País precisa. Não é isso de forma alguma. Essa discussão tem que ser feita e ampliada nos Estados. Essa discussão tem que continuar e não pode ser votada da forma que está querendo ser votada aqui no plenário da Câmara.
	Por isso, o PHS é contra a criação desse sistema no modelo do distritão, que só existe em país que não tem prestígio nenhum, que não tem sequer o que argumentarmos aqui usando como exemplo que isso beneficiou essas nações, muito pelo contrário. As Ilhas Pitcairn só têm 50 mil habitantes. É um absurdo querermos votar isso.
	Por isso, o PHS encaminha o voto ""não"", é contra, mas infelizmente pelo jeito a obstrução vai impedir...
	(Desligamento automático do microfone.)"
2017-09-20T17:36;ORIENTAÇÃO DE BANCADA, REQUERIMENTO DE RETIRADA DE PROPOSIÇÃO DA ORDEM DO DIA, PEC 282/2016, PROPOSTA DE EMENDA À CONSTITUIÇÃO, PARTIDO HUMANISTA DA SOLIDARIEDADE (PHS), VOTO CONTRÁRIO.;ORIENTAÇÃO DE BANCADA;"O SR. DIEGO GARCIA (PHS-PR. Pela ordem. Sem revisão do orador.) - Sr. Presidente, o PHS vai encaminhar o voto ""não"".
Nós queremos apreciar esta matéria hoje, queremos votar o destaque do PPS e ver a retomada do texto original, apresentado pela Deputada Shéridan na Comissão que discutiu a PEC 282.
	O PHS encaminha o voto ""não""."
2017-09-26T21:00;ORIENTAÇÃO DE BANCADA, REQUERIMENTO DE DESTAQUE DE VOTAÇÃO EM SEPARADO, EMC 16/2017, EMENDA DE COMISSÃO, MPV 782/2017, MEDIDA PROVISORIA, PARTIDO HUMANISTA DA SOLIDARIEDADE (PHS), VOTO FAVORAVEL.;ORIENTAÇÃO DE BANCADA;"O SR. DIEGO GARCIA (PHS-PR. Pela ordem. Sem revisão do orador.) - Sr. Presidente, como autor desta emenda, uma emenda simples, gostaria de explicá-la ao Plenário e pedir a todos os Líderes que orientem favoravelmente a ela. A emenda trata de alteração no art. 36 da medida provisória, quando fala sobre a competência do Ministério de Direitos Humanos. A emenda que proponho é justamente para que o Ministério adote como diretriz o pacto assinado em 1969 e ratificado em 1992 pelo nosso País.
	Na data de ontem, nós celebramos 25 anos da celebração desse acordo. Ministros do STF que se posicionaram com relação ao tema gostariam de dar ao Pacto de São José status constitucional, mas acabou que prevaleceu o status supralegal, ou seja, o Pacto tem poder abaixo da Constituição e acima das leis.
	Como disse, trata-se de uma emenda simples. Conversei com diversos Líderes. Respeito a posição, se houver, dos Líderes contrários, mas gostaria de pedir o encaminhamento favorável de todos a esta proposição."
2017-09-27T21:14;PL 8703/2017, PROJETO DE LEI ORDINÁRIA, ALTERAÇÃO, LEI DAS ELEIÇÕES (1997), CRIAÇÃO, FUNDO ESPECIAL DE FINANCIAMENTO DE CAMPANHA (FEFC), TEMA, CONTRÁRIO, REGISTRO.;COMO LÍDER;"O SR. DIEGO GARCIA (PHS-PR. Como Líder. Sem revisão do orador.) - Sr. Presidente, Sras. e Srs. Deputados, o Plenário da Câmara não pode, em hipótese alguma, ser enganado com relação a esta votação e a esta matéria. Eu peço a atenção dos pares, dos colegas para esta proposta que chegou aqui e está em nossas mãos.
A proposta de criação desse fundo vai tirar dinheiro, sim, de áreas nobres e essenciais. Eu ouvi alguns Parlamentares aqui falando de cerca de 1 bilhão de reais. Vai ser muito mais, porque esta nova proposta já passa de 2 bilhões de reais. E são 2 bilhões de reais do dinheiro público!
Ora, não há dinheiro para a Previdência. Esse é o grande discurso neste momento. A Previdência está deficitária. Mas, na hora que querem, arrumam um jeito para achar recursos para financiar as nossas campanhas e as campanhas dos candidatos a Deputado Estadual, Senador, Presidente da República e Governador.
O PHS é contra a criação desse fundo. O PHS é contra a criação de qualquer tipo de fundo com esse objetivo. Mas não somos contra o remanejamento desses recursos para outras áreas essenciais para a governança no nosso País. 
Temos que acabar com esse discurso falacioso e parar de vir aqui fazer as orientações rapidamente, como se tudo estivesse normal. 
	Os Deputados têm que estar atentos ao que estão votando. São mais de 40 páginas! São mais de 40 páginas! Nós não podemos, por maioria simples, neste plenário, aprovar uma medida como esta. Isso é um absurdo!
	É importante que os Parlamentares estejam atentos e, na hora da votação, votem contra, votem ""não"". Essa é a resposta que temos que dar para a sociedade, para o povo brasileiro.
	Quem está advogando a favor do fundo é porque está desesperado, não sabe o que fazer, não sabe como vai fazer campanha. Está desesperado, porque não fez o dever de casa, não fez o corpo a corpo e quer manter as grandes estruturas nas suas campanhas.
	Faça campanha usando o seu celular. Faça campanha gastando a sola do sapato. Faça campanha fazendo o corpo a corpo na sua base. Faça campanha mostrando a cara e dando uma resposta hoje, nesta votação aqui no plenário da Câmara, votando contra esta medida.
	Pelo amor de Deus! Nós temos que pôr a mão na consciência! Eu estou rodando o Estado do Paraná todo, visitando entidades, hospitais, APAEs, Santas Casas. Todas estão com dificuldades! Todas estão passando por sofrimentos! Todas estão vivendo com ausência de recursos! E nós vamos, neste momento de crise, deslocar esses recursos para financiar campanhas políticas?! Pelo amor de Deus!
	Já existe um fundo milionário para isso, o fundo partidário. Nós não podemos aprovar esta medida. Por isso, peço aos Parlamentares que votem contra."
2017-10-02T21:02;MUSEU DE ARTE MODERNA DE SÃO PAULO (MAM), ATOR, NUDEZ, CRIANÇA, PEDOFILIA, CONVOCAÇÃO, COMISSÃO DE SEGURIDADE SOCIAL E FAMÍLIA (CSSF), COMISSÃO DE CULTURA (CCULT), ANÚNCIO, PAIS, CRÍTICA.;PELA ORDEM;"O SR. DIEGO GARCIA (PHS-PR. Pela ordem. Sem revisão do orador.) - Sr. Presidente, quero falar sobre o lamentável vídeo que se viralizou nas redes sociais, na Internet.
	No Museu de Arte Moderna de São Paulo, um ator - para mim, não é ator, mas um pedófilo, um criminoso - fez uma performance nu, expondo-se na frente de diversas crianças. Essa atitude tem que ser duramente punida no País. É um desrespeito à Constituição, à legislação vigente, ao Estatuto da Criança e do Adolescente.
	Nós vamos convocar esse cidadão, esse pedófilo às Comissões de Seguridade Social e Família e de Cultura, para que dê explicações, os responsáveis pelas instituições envolvidas e aqueles que financiaram essa chamada performance, que, na verdade, é uma afronta as nossas crianças, à sociedade brasileira, é um ataque à família.
	Nós temos que combater esse mal. Nós temos que combater esse pedófilo. O lugar dele é na cadeia. Eu quero ver esse pedófilo na cadeia fazendo sua apresentação, fazendo sua belíssima performance dentro de uma cela. Eu quero ver como ele vai se dar diante dos seus companheiros. O lugar onde ele tem que estar é na cadeia.
	Por isso, vamos convocar esse pedófilo para vir à Câmara dos Deputados. Quero ver se ele vai ter coragem de enfrentar esta Casa, de enfrentar o Congresso Nacional e de ouvir umas verdades, porque é isso que merece.
	Os pais têm que ser responsabilizados e punidos também duramente. Eu falo com propriedade, como pai que sou de duas crianças. Tenho uma filha com 2 anos e meio. Jamais, em hipóteses alguma, eu permitiria que ela passasse por uma situação dessas, dentro ou fora da minha casa.
	O que aconteceu nesse museu de arte não pode passar em branco. Está tudo normal. Daqui a pouco, malucos vão defender sexo com crianças, com esses pequeninhos, esses coitados, porque é tudo normal. Nós não podemos compactuar, concordar com esse absurdo que está acontecendo, manchando a sociedade brasileira. É um ataque à família.
	Obrigado, Sr. Presidente."
2017-10-03T17:52;ORIENTAÇÃO DE BANCADA, REQUERIMENTO DE URGÊNCIA, PL 8703/2017, PROJETO DE LEI ORDINÁRIA, PARTIDO HUMANISTA DA SOLIDARIEDADE (PHS), VOTO CONTRARIO, FUNDO ESPECIAL DE FINANCIAMENTO DE CAMPANHA (FEFC), CRIAÇÃO.;COMO LÍDER;"O SR. DIEGO GARCIA (PHS-PR. Como Líder. Sem revisão do orador.) - Presidente, peço que acrescente o tempo de Líder à orientação.
	Obviamente, nós do PHS, como há mais de 1 mês temos feito no plenário da Câmara, vamos orienta o voto ""não"".
	Quero dizer aos Deputados que nos antecederam, e que até chamaram quem está votando contra de hipócrita por conta do Fundo Partidário, que o PHS não tem dificuldade nenhuma de acatar a proposta que V.Exas. estão fazendo, até porque o PHS recebe sim uma quantia significativa através do Fundo Partidário. Mas os partidos que mais arrecadam com o Fundo Partidário não incluem o PHS. São o PT, PMDB, PSDB.
	Essa contribuição, se for aprovada aqui, vai ser um grande ganho para a sociedade brasileira, porque esse recurso que seria utilizado para a manutenção dos partidos e outras coisas, e para financiar também campanhas, vai agora poder ser utilizado em áreas nobres.
	Quero dizer aos Parlamentares que estão sugerindo essa proposta para avançarmos com ela: por que não? Esta sim será uma proposta positiva para a sociedade brasileira que está nos assistindo: acabar com o Fundo Partidário neste momento de crise do nosso País.
	Ora, nós não somos tolos. A sociedade não é tola. É bom alertar este Plenário sobre o quórum para esta votação, que é maioria simples. Para esta urgência o quórum é maioria simples. Se passar, seja qual for o resultado quando o Presidente encerrar a votação, vamos entrar na discussão do mérito desta proposta que cria um fundo que ultrapassa 2 bilhões de reais. Dois bilhões de reais, Deputado Givaldo Carimbão, que poderiam sim ser utilizados em áreas nobres do Sertão de Alagoas, no meu Estado, o Paraná, ou em diversas áreas, como saúde e educação. Trata-se de dinheiro sim que está saindo do bolso do trabalhador, do assalariado.
	O PHS é contra a criação desse fundo irresponsável com a nossa Nação, com o povo que sofre, que está cada vez mais desacreditando numa classe política que legisla em causa própria. Aconteceu hoje na votação da MP e agora acontece de novo na criação desse fundo de financiamento da democracia, que de democrático não tem nada.
	É importante derrotarmos esta urgência. É importante impedir a criação desse fundo. É importante impedir, para o bem do País e para mostrarmos à sociedade brasileira que há Deputados que não estão preocupados se vai ou não haver dinheiro para financiar suas campanhas.
	Quem faz o trabalho corpo a corpo, na rua, na sola do sapato, quem está fazendo o dever de casa em suas cidades, em seus Municípios não está preocupado com dinheiro. Só está preocupado com dinheiro quem compra votos, quem quer comprar eleitor, quem quer comprar lideranças. Essa é a verdade. Quem está preocupado com o País vai votar ""não"" a esta urgência, para dar uma resposta ao povo brasileiro de que não vamos aprovar esse absurdo na noite de hoje nesta Casa."
2017-10-03T17:52;"ORIENTAÇÃO DE BANCADA, REQUERIMENTO DE DESTAQUE DE VOTAÇÃO EM SEPARADO, EMC 270/2017, EMENDA DE COMISSÃO, MPV 783/2017, MEDIDA PROVISÓRIA, PARTIDO HUMANISTA DA SOLIDARIEDADE (PHS), VOTO CONTRÁRIO.
MUSEU DE ARTE MODERNA (MAM), SÃO PAULO (SP), APOLOGIA DE CRIME, PEDOFILIA, DENÚNCIA.";ORIENTAÇÃO DE BANCADA;"O SR. DIEGO GARCIA (PHS-PR. Pela ordem. Sem revisão do orador.) - Sr. Presidente, o PHS vai encaminhar o voto ""não"".
	Com relação à performance que aconteceu no Museu de Arte Moderna de São Paulo, alguns falaram aqui sobre apologia. Quero deixar claro que quem está defendendo esse pedófilo está fazendo apologia à pedofilia aqui também, no plenário. Foi um absurdo o que aconteceu na cidade de São Paulo, foi um absurdo o que aconteceu no Museu de Arte Moderna.
	Nós acreditamos na Justiça brasileira e temos certeza de que muito em breve esse cidadão vai fazer a sua performance na cadeia, na cela. Lá não vai haver criancinha para acariciar ele.
	Nós encaminhamos o voto ""não"", mas repudiamos as falas em defesa desse pedófilo, desse criminoso...
	(Desligamento automático do microfone.)"
