dataHoraInicio;keywords;tipoDiscurso;transcricao
2015-02-05T15:00;"DIEGO GARCIA, DEPUTADO FEDERAL, AGRADECIMENTO, ELEIÇÃO, ELEITOR, PARANÁ.
MANDATO PARLAMENTAR, RESGATE, CREDIBILIDADE, DEFESA. 
SERVIDOR PÚBLICO, CÂMARA DOS DEPUTADOS, RECEBIMENTO, DEPUTADO FEDERAL, ELOGIO.
REFORMA POLÍTICA, APOIO.";PEQUENO EXPEDIENTE;"O SR. DIEGO GARCIA (Bloco/PHS-PR. Sem revisão do orador.) - Sr. Presidente, é uma alegria poder falar pela primeira vez nesta tribuna, agradecer a Deus pela oportunidade que Ele me dá de ser um dos 513 Parlamentares que aqui representam a voz do povo, representam os seus Estados e este País. É uma alegria. E tenho que agradecer muito a Deus pelo dom da vida, a oportunidade que Ele me dá de fazer parte desta 55ª Legislatura.
	Agradeço também aos amigos, aos familiares e a todas as pessoas que se empenharam nesta última eleição para que eu pudesse hoje ocupar este espaço. Tive a graça de receber o apoio de 61.063 eleitores, que confiaram num projeto que nasceu dentro do movimento da Renovação Carismática Católica, da Igreja Católica, Ministério Fé e Política.
	Fui eleito em uma campanha limpa. Fui eleito em uma campanha em que não dei um real sequer em troca do voto. Mas contei com a ajuda e com o apoio de pessoas que se doaram de maneira consciente, dando o que restava do seu tempo para que pudessem ir às ruas, batendo de casa em casa e pedindo apoio a minha pessoa e a outras pessoas que faziam parte desse projeto também.
	Fui eleito Deputado Federal com a ajuda desses paranaenses, que depositaram a sua confiança em mim e que esperam de mim uma atuação também aqui nesta Casa transparente, digna e que não envergonhe em nada o nome dos demais Parlamentares.
	Ainda ontem, Sr. Presidente, quando chegava ao hotel, uma pessoa me abordou. Eu chegava com uma mala de mão, e ele me questionou dizendo assim, sem me conhecer: ""Essa mala que o senhor traz contém o nosso dinheiro? Essa mala que o senhor traz está com o dinheiro do povo?"" 
	São situações como essa que penso que não só eu como outros Parlamentares têm passado ao saírem desta Casa, situações que muitas vezes nos deixam constrangidos, envergonhados. E eu quero, com a graça de Deus e a força do Espírito Santo, poder honrar o apoio que tive nas urnas e resgatar a credibilidade dos Parlamentares, que se perdeu por culpa de alguns. Não quero aqui generalizar, mas sei que nós podemos durante esses próximos anos ter muitas surpresas ainda.
	Por isso, compete a nós que estamos iniciando agora este novo tempo, esta nova Legislatura, caminhar com dignidade, com transparência, fazendo uso de tudo aquilo que esta Casa tem a nos proporcionar, para que cada trabalho, cada projeto de lei apresentado tenha participação popular também.
	Quero também, como o fez o nobre Deputado que falou antes de mim, parabenizar todos os servidores desta Casa. Verdadeiramente posso afirmar e dizer que me sinto na minha casa. Fui aqui muito bem acolhido pelos servidores, que nos dão toda atenção, amor e carinho. Eu agradeço a cada um deles por essa acolhida, por nos darem essa segurança e essa certeza da realização de um grande mandato.
	Sr. Presidente, para encerrar, eu quero também manifestar aqui e colocar o meu apoio à discussão da reforma política dentro desta Casa. Trago aqui a reforma que penso eu ser a mãe de todas as reformas e que foi proposta pela CNBB, pela OAB e por mais de cem entidades que se uniram, não fazendo uso apenas de uma ideia, mas abrindo mão de muitas outras ideias, abrindo mão de interesses pessoais, que se uniram apresentando uma proposta. Não quero aqui afirmar e dizer que será a melhor de todas, mas eu penso que para este momento é uma proposta que vem ao encontro daquilo que a população, daquilo que a nossa sociedade está pedindo e clamando: mudança e justiça.
	Eu aqui quero defendê-la e vou trabalhar para que ela seja, sim, apresentada a todos os nobres Parlamentares e possa, quem sabe, tornar-se uma realidade para o nosso País.
	Muito obrigado, Sr. Presidente. É uma alegria poder fazer uso desta tribuna e agradecer aos eleitores e a todos os paranaenses que depositaram em mim a sua confiança."
2015-03-20T15:00;;HOMENAGEM;"Ata da 41ª (quadragésima primeira) Sessão da Câmara dos Deputados, Não Deliberativa Solene, vespertina, da 1ª Sessão Legislativa Ordinária, da 55ª Legislatura, em 20 de março de 2015. Às 15h10, o Sr. Marcelo Aro, no exercício da Presidência, nos termos do § 2º do artigo 18 do Regimento Interno, declarou aberta a sessão e deu por dispensada a leitura da ata da sessão anterior. O Sr. Presidente informou que a sessão destinou-se à homenagem ao 18º Aniversário de Fundação do Partido Humanista da Solidariedade - PHS; prestou as devidas homenagens; e convidou para compor a Mesa os Srs. Eduardo Machado, Presidente do PHS Nacional; Cláudio Maciel, Vice-Presidente do PHS Nacional; Belarmino Sousa, 2º Vice-Presidente do PHS Nacional; e Luiz França, Secretário-Geral Nacional do PHS. Tomou posse e prestou compromisso regimental o Sr. Roberto Freire, representante do estado de São Paulo, eleito pela Coligação PSDB, Democratas, PPS. O Sr. Presidente convidou todos a ouvir o Hino Nacional. Após assistir ao vídeo institucional e proferir o discurso do Sr. Eduardo Cunha, Presidente da Câmara dos Deputados, o Sr. Presidente concedeu a palavra aos Srs. Eduardo Machado, Cláudio Maciel, Luiz França e Belarmino Sousa. Assumiu a Presidência, nos termos do § 2º do artigo 18 do Regimento Interno, o Sr. Adail Carneiro e concedeu a palavra ao Sr. Marcelo Aro, autor do requerimento. O Sr. Presidente convidou para compor a Mesa os Srs. Kaio Maniçoba, Carlos Andrade e Diego Garcia, Deputados Federais. Reassumiu a Presidência o Sr. Marcelo Aro e concedeu a palavra ao Sr. Eduardo Machado, que prestou homenagem com a Medalha Solidarista aos Srs. Adail Carneiro, Carlos Andrade, Diego Garcia, Kaio Maniçoba e Marcelo Aro, Deputados Federais; e ao Sr. Lira, Deputado Distrital. O Sr. Presidente convidou para compor a Mesa os Srs. Lira; Clélia Gomes, Deputada Estadual de São Paulo; e Mariana Carvalho, Deputada Federal. O Sr. Presidente concedeu a palavra aos Srs. Adail Carneiro; Diego Garcia; Kaio Maniçoba; Carlos Andrade; Lira; Souza Neto, Deputado Estadual do Rio Grande do Norte; Clélia Gomes; Carlinhos Florêncio, Deputado Estadual do Maranhão; Dirceu Ribeiro, Deputado Estadual de Minas Gerais; Eduíno de Brito, Deputado Estadual de Pernambuco; Marcos Miller, Deputado Estadual do Rio de Janeiro; e Manoel Roque, Presidente Estadual do PHS do Acre. Assumiu a Presidência o Sr. Kaio Maniçoba, nos termos do § 2º do artigo 18 do Regimento Interno, e concedeu a palavra ao Sr. Marcos André Omena, Presidente Estadual do PHS de Alagoas. Reassumiu a Presidência o Sr. Marcelo Aro e concedeu a palavra aos Srs. Wilker Barreto, Presidente Estadual do PHS do Amazonas; Júnior Muniz, Presidente Estadual do PHS da Bahia; Cristian Viana, Presidente Estadual do PHS do Distrito Federal; Rogério Pinheiro, Presidente Estadual do PHS do Espírito Santo; Murilo Oliveira, Presidente Estadual do PHS de Goiás; José Guilherme, Presidente Estadual do PHS de Minas Gerais; Igor Normando, Presidente Estadual do PHS do Pará; Álvaro Galdêncio, Presidente Estadual do PHS da Paraíba; Valter Viana, Presidente Estadual do PHS do Paraná; Cida, Presidente Estadual do PHS do Piauí; Marcelo Piuí, Presidente Estadual do PHS do Rio de Janeiro; Leandro Prudêncio, Presidente Estadual do PHS do Rio Grande do Norte; Izabel Paludo, Presidente Estadual do PHS do Rio Grande do Sul; Samir Albuquerque, Presidente Estadual do PHS de Rondônia; Cincinato Mello, Presidente Estadual do PHS de Sergipe; Laércio Benko, Vereador por São Paulo; e Eduardo Machado. O Sr. Presidente registrou a presença de convidados, reiterou as homenagens prestadas, agradeceu a presença de todos e, às 17h52, encerrou a sessão.

Erika Kokay
Presidente

Luiz Couto
Secretário

As notas taquigráficas desta Sessão Não Deliberativa Solene poderão ser solicitadas ao Departamento de Taquigrafia, Revisão e Redação - DETAQ."
2015-04-29T15:26;"DIEGO GARCIA, DEPUTADO FEDERAL, RECEBIMENTO, CONCESSÃO HONORÍFICA, UNIVERSIDADE ESTADUAL DO NORTE DO PARANÁ, AGRADECIMENTO.
GOVERNADOR, PARANÁ, REPRESSÃO, VIOLÊNCIA, MANIFESTAÇÃO, PROFESSOR, ESTADO-MEMBRO, CONTRA, POLÍTICA PÚBLICA, REDUÇÃO, DIREITO DO TRABALHO, FUNDOS DE PENSÃO, REPÚDIO, GOVERNO FEDERAL, INTERVENÇÃO, DEFESA.";COMO LÍDER;"O SR. DIEGO GARCIA (Bloco/PHS-PR. Como Líder. Sem revisão do orador.) - Sr. Presidente, Sras. e Srs. Deputados, no dia de ontem, recebi uma homenagem da Universidade Estadual do Norte do Paraná, com a qual estou muito feliz. Mas, no dia de ontem, começou um verdadeiro massacre dos profissionais de educação, de centenas de servidores que estão hoje na Capital do Estado do Paraná.
	Aqui, eu não quero falar de questão de partido, de questão ideológica. Nós estamos falando aqui de pessoas que trabalham e que lutam no dia a dia para promover a educação neste País. São trabalhadores que estão lutando pelos seus direitos.
	Sr. Presidente, essas são as cenas do massacre que está acontecendo em Curitiba neste momento. (Mostra fotografias.) São centenas de trabalhadores que estão, neste momento, sendo atendidos com muitas limitações, porque nem as ambulâncias conseguem chegar até eles. Há alguns Deputados Estaduais que estão pedindo para que se pare de jogar bombas. Bombas estão sendo jogadas através do uso de helicópteros na Capital, Curitiba. É uma vergonha! É uma vergonha!
	Então, aqui eu falo em nome de todos os paranaenses, pedindo a intervenção, pedindo que algo aconteça em âmbito federal, porque o que está acontecendo no Paraná é um verdadeiro massacre. Estou aqui usando da palavra para uma Comunicação de Liderança em apoio também ao Deputado Enio Verri, à Deputada Christiane de Souza Yared e ao Deputado Aliel Machado. Todos nós aqui estamos unidos por essa causa. 
	O povo paranaense está clamando pelos seus direitos, não está reivindicando nada além disso. E o que está acontecendo no Estado do Paraná é uma verdadeira vergonha.
	Governador, pare com esse massacre que você está realizando em nosso Estado contra profissionais que dão a vida pela educação. Suspenda essa votação, pelo amor de Deus! Pare com o que está acontecendo! Pare e se abra para o diálogo, para a discussão. É isso o que os profissionais e os servidores públicos querem neste momento. Eles querem dialogar, eles querem ser ouvidos.
	Sr. Presidente, peço a V.Exa., que sempre se compadeceu, porque é um homem humano, que sempre esteve à frente e que representa este País também, que dê a sua posição sobre essa situação dos nossos professores, dos nossos servidores públicos do Estado do Paraná.
	O SR. PRESIDENTE (Eduardo Cunha) - Conclua, Deputado.
	O SR. DIEGO GARCIA - Estão aqui as fotos, está aqui o registro das imagens. (Mostra fotografias.)
	É um verdadeiro massacre o que acontece no Paraná e a que se tem que dar um basta hoje. Chega! O povo paranaense já não aguenta mais! (Palmas.)"
2015-08-18T20:00;SUBSTITUTIVO, PL 4566/2008, PROJETO DE LEI ORDINÁRIA, ALTERAÇÃO, LEI DO FGTS, FUNDO DE GARANTIA DO TEMPO DE SERVIÇO, CORREÇÃO MONETÁRIA, POUPANÇA, APLICAÇÃO DE RECURSOS, REPASSE, PERCENTUAL, FUNDO DE GARANTIA DO TEMPO DE SERVIÇO, ORIENTAÇÃO DE BANCADA, PHS, VOTO FAVORÁVEL.;ORIENTAÇÃO DE BANCADA;"O SR. DIEGO GARCIA (Bloco/PHS-PR. Pela ordem. Sem revisão do orador.) - Sr. Presidente, Sras. e Srs. Deputados, eu quero agradecer, em primeiro ao lugar, ao Relator, Deputado Rodrigo Maia, por ter acatado o PL nº 1.469, de 2015, de minha autoria. Com certeza, é um avanço para a classe trabalhadora, é uma grande vitória que estamos dando aos trabalhadores do nosso País, nesta noite, nesta Casa. 
	Quero dizer aos trabalhadores, que aqui representam os trabalhadores de todo o País, que o PHS vota ""sim"". 
(Manifestação nas galerias.)"
2015-08-20T11:44;"DENÚNCIA, MANIPULAÇÃO, RESULTADO, PESQUISA DE OPINIÃO,  INTERNET, DEFINIÇÃO, FAMÍLIA, CASAL, HOMEM, MULHER, SOLICITAÇÃO, PRESIDÊNCIA DA CÂMARA DOS DEPUTADOS, DIVULGAÇÃO, ESCLARECIMENTO, APRECIAÇAO, PL 6583/2013, PROJETO DE LEI ORDINÁRIA, CRIAÇÃO, ESTATUTO DA FAMÍLIA. 
SOLICITAÇÃO,";PELA ORDEM;"O SR. DIEGO GARCIA (Bloco/PHS-PR. Pela ordem. Sem revisão do orador.) - Sr. Presidente, eu gostaria de fazer uma reclamação a respeito de algo que está acontecendo no portal da Câmara dos Deputados.
	Está aqui o Deputado Ronaldo Fonseca, ex-Relator do Estatuto da Família. Eu sou o atual Relator.
	Saiu no Portal da Câmara dos Deputados uma enquete com a seguinte pergunta: ""Você concorda com a definição de família como núcleo formado a partir da união entre homem e mulher, prevista no projeto que cria o Estatuto da Família?""
	A minha reclamação é a seguinte, Presidente: muitos sites estão divulgando o resultado da enquete. E o resultado da enquete é este: 51,62% de votos para ""não"" e 48,09% para ""sim"". 
	Mas, consultando a administração da Casa, pedi um levantamento a respeito de onde estavam vindo esses votos e consegui a informação de que mais de 3 milhões de votos vieram de apenas 66 computadores. Mais de 3 milhões de votos foram manipulados, mais de 3 milhões de votos para a resposta ""não"".
	Sr. Presidente, 1,6 milhão de votos vieram de um único IP, ou seja, de um único computador. Houve 122 mil votos em um único dia, para uma única opção, na cidade de Garanhuns, em Pernambuco. Só que há um detalhe, Presidente: a cidade só possui 112 mil habitantes. Outro detalhe: foram 60 mil votos, em um único dia, para uma única opção, em uma cidade, nos Estados Unidos, com uma população de 8.500 pessoas. Sessenta mil votos em uma cidade com uma população de 8.500 pessoas!
	Então, Sr. Presidente, como Relator da Comissão Especial que trata do Projeto de Lei nº 6.583, de 2013, sobre o Estatuto da Família, eu peço à administração da Casa que publique uma nota no Portal da Câmara dos Deputados, informando os dados reais, dando essas informações à população brasileira. E que não sejam considerados, na enquete, os votos que vieram de apenas um computador. Se isso acontecer, Sr. Presidente, estaremos falando de um resultando de 67% de votos ""sim"" e 33% de votos ""não"".
	Quero deixar registrado que estou pronto para, nos próximos dias, apresentar o meu parecer, que espero seja colocado em votação e aprovado por esta Casa de Leis.
	Muito obrigado, Sr. Presidente.
	O SR. PRESIDENTE (Eduardo Cunha) - Deputado, a Presidência vai determinar as providências legais para verificar a reclamação de V.Exa. e, se for o caso, determinar até mesmo o estabelecimento de sindicância. E o seu resultado será disponibilizado de forma pública. Certamente, se esses dados que V.Exa. está citando forem verdadeiros, isso será constatado, e alguma providência haverá de ser tomada.
	O SR. DIEGO GARCIA - Muito obrigado, Sr. Presidente."
2015-09-22T17:24;HUMBERTO LEAL VIEIRA, EX-PRESIDENTE, ASSOCIAÇÃO NACIONAL PRÓ-VIDA, HOMENAGEM PÓSTUMA.;PELA ORDEM;"O SR. DIEGO GARCIA (Bloco/PHS-PR. Pela ordem. Sem revisão do orador.) - Sr. Presidente, eu gostaria de deixar registrado nesta Casa de Leis que faleceu ontem o Prof. Humberto Leal Vieira, fundador e ex-Presidente da Associação Nacional Pró-Vida e Pró-Família, uma das mais antigas entidades defensoras da vida - desde a concepção até a morte natural - e da família, constituída por homem e mulher, conforme a lei natural e a moral objetiva. 
	O Prof. Humberto nasceu em 20 de janeiro de 1938. Completou, este ano, 54 anos de casado. Tinha 11 filhos, netos e uma bisneta.
	O Prof. Humberto Leal Vieira prestou relevantes serviços em defesa, especialmente, do nascituro, na luta contra o aborto, trazendo informações aos Parlamentares, denunciando as fundações internacionais e Organizações Não Governamentais - ONGs feministas que pressionam há décadas os governos da América Latina para a legalização do aborto...
	O SR. PRESIDENTE (Delegado Edson Moreira) - Peço que conclua, Deputado.
	O SR. DIEGO GARCIA - ...contrariando a maioria do povo brasileiro, que é contra o aborto e a favor da vida.
	Deixamos aqui a nossa homenagem a esse grande brasileiro, nossas orações por sua alma e por sua família.
	Certamente, há muito a fazer, principalmente nesta Casa de Leis, com a aprovação do Estatuto do Nascituro, para garantir a proteção da vida desde a concepção, pois a vida é o primeiro e principal de todos os direitos humanos.
	Sr. Presidente, peço o registro do meu pronunciamento no programa A Voz do Brasil.
Muito obrigado.
	O SR. PRESIDENTE (Delegado Edson Moreira) - Deferido o pedido de V.Exa.

PRONUNCIAMENTO ENCAMINHADO PELO ORADOR
	Sr. Presidente, gostaria de deixar registrado nesta Casa de Leis que faleceu ontem o Prof. Humberto Leal Vieira, fundador e ex-Presidente da Associação Nacional Pró-Vida e Pró-Família, uma das mais antigas entidades defensoras da vida - desde a concepção até a morte natural - e da família, constituída por homem e mulher, conforme a lei natural e a moral objetiva.
	O Prof. Humberto nasceu em 20 de janeiro de 1938. Completou este ano 54 anos de casado. Tinha 11 filhos, netos e uma bisneta.
	O Prof. Humberto Leal Vieira prestou relevantes serviços em defesa, especialmente, do nascituro, na luta contra o aborto, trazendo informações aos Parlamentares, denunciando as fundações internacionais e ONGs feministas que pressionam há décadas os governos da América Latina para a legalização do aborto, contrariando a maioria do povo brasileiro, que é contra o aborto e a favor da vida. Com sua luta, convenceu muitas mães a não abortar e acolher os filhos, tendo inspirado - e ajudado também - a criação da Associação Guadalupe, que atende e acolhe muitas gestantes que assumem a maternidade, recebendo suporte e apoio para isso.
	O Prof. Humberto Leal Vieira foi o primeiro brasileiro a se tornar membro permanente da Pontifícia Academia para a Vida, no Vaticano, tendo trabalhado muitos anos em conjunto com outros organismos pró-vida e pró-família internacionais, especialmente a Human Life International. Hoje a Associação Nacional Pró-Vida e Pró-Família é presidida pelo Prof. Hermes Rodrigues Nery, que continuará o trabalho do Prof. Humberto.
	Deixamos aqui a nossa homenagem a esse grande brasileiro, nossas orações por sua alma e por sua família.
	Certamente há muito que fazer, principalmente nesta Casa de Leis, como a aprovação do Estatuto do Nascituro, para garantir a proteção da vida desde a concepção, pois a vida é o primeiro e principal de todos os direitos humanos.
	Muito obrigado."
2015-09-29T17:02;PL 6583/2013, PROJETO DE LEI ORDINÁRIA, CRIAÇÃO, ESTATUTO DA FAMÍLIA, OBSERVÂNCIA, DIREITO DE FAMÍLIA, POLÍTICA PÚBLICA, VALORIZAÇÃO, ENTIDADE FAMILIAR, COMISSÃO ESPECIAL, APROVAÇÃO, PARECER DO RELATOR, ESCLARECIMENTO.;PELA ORDEM;"O SR. DIEGO GARCIA (Bloco/PHS-PR. Pela ordem. Sem revisão do orador.) - Sr. Presidente, eu gostaria de fazer o registro, neste momento, da importante matéria que está em discussão nesta Casa desde o ano de 2013, o PL 6.583, de 2013, que trata do Estatuto da Família. Foi criada uma Comissão Especial. Nessa Comissão, eu fui indicado Relator dessa importante matéria. Na quinta-feira passada, o Estatuto da Família foi aprovado, com 17 votos favoráveis contra apenas 5 contrários. Foi um grande debate, mais de 4 horas de discussão dentro da Comissão. A maioria absoluta aprovou o meu relatório e aprovou também o substitutivo apresentado ao texto do projeto original.
	Eu gostaria, Sr. Presidente, de fazer o registro aqui de algo com que eu estou muito indignado, que vem sendo replicado por veículos de expressão de grande circulação, em nível nacional, e que vem sendo replicado também pelas redes sociais, tentando jogar a sociedade contra o projeto de lei que trata do Estatuto da Família, trazendo inúmeras mentiras, falácias, coisas que não são verdade, através de atitudes desonestas, utilizadas por alguns Parlamentares que, lá na Comissão, se posicionaram contrariamente, tentando, assim, jogar a sociedade contra o Estatuto da Família.
	O primeiro ponto, Sr. Presidente, que eu gostaria de registrar aqui é que o Estatuto da Família não define nada, como os veículos de comunicação estão divulgando. O Estatuo da Família não determina o que é família, não define o que é família. Isso é uma mentira!
	Está no texto aprovado, na forma do meu substitutivo ao Estatuto da Família, art. 2º: ""Para os fins desta Lei, reconhece-se como família, base da sociedade, credora de especial proteção, em conformidade com o art. 226 da Constituição Federal"". 
	Sr. Presidente, há uma diferença muito grande entre definir e reconhecer. Há uma diferença muito grande entre ambas as palavras. Infelizmente, isso vem sendo distorcido até mesmo pelos Anais aqui desta Casa, até mesmo pelo próprio Portal da Câmara.
	Eu gostaria de fazer esse registro, para que a verdade pudesse prevalecer sobre a mentira, pois o Estatuto da Família cria políticas públicas que tratam da família de uma forma especial, de uma maneira especial; que dão à família, base da sociedade, essa especial proteção.
	Essa lei, Sr. Presidente, é uma inovação. Por quê? Muitos andaram dizendo que o Estatuto da Família vai tirar direitos até mesmo dos homossexuais. Eu gostaria que me mostrassem onde está escrito isso no substitutivo. É uma mentira! É mais uma falácia! O Estatuto da Família não tira direitos. Se ele fosse tirar algum direito, estaria dentro do texto da lei que o Estatuto da Família altera algum direito já assegurado aos nossos cidadãos brasileiros. Muito pelo contrário, o Estatuto da Família é uma inovação, cria o Conselho de Família, fortalece a família como base da sociedade, credora de especial proteção. É isso o que nós trazemos para dentro do projeto.
	Não há ataque a ninguém, a nenhum outro arranjo familiar. Chegaram a ponto de dizer, Sr. Presidente, que este Relator afirmou que avô não é família, que tio não é família, que primo não é família, que cunhado não é família. Eu não seria maluco de escrever isso. Isso é uma falácia, uma mentira, uma tentativa de impedir que esse projeto de lei seja aprovado por esta Casa. 
	Sr. Presidente, peço que seja publicado este pronunciamento no programa A Voz do Brasil, para que a sociedade brasileira procure o parecer, que está disponível no Portal da Câmara dos Deputados, e o leia. Ali não há ataque aos homossexuais, ali não há ataque aos demais arranjos familiares, ali não há ataque a ninguém, ali só se cria a proteção à família, base da sociedade, a única capaz de dar continuidade à civilização no nosso País. 
	Obrigado. 
	O SR. PRESIDENTE (Gilberto Nascimento) - Deputado Diego Garcia, do Paraná, o pedido de V.Exa. será atendido. Nós vamos solicitar à assessoria da Casa que dê toda a divulgação ao seu pronunciamento nos seus órgãos oficiais."
2015-10-28T09:00;;HOMENAGEM;"Ata da 328ª (tricentésima vigésima oitava) Sessão da Câmara dos Deputados, Não Deliberativa Solene, matutina, da 1ª Sessão Legislativa Ordinária, da 55ª Legislatura, em 28 de outubro de 2015. Às 9h10, o Sr. Alex Canziani, 4º Secretário, declarou aberta a sessão e deu por dispensada a leitura da ata da sessão anterior. O Sr. Presidente informou que a sessão destinou-se à homenagem ao aniversário de 10 anos da Universidade Tecnológica do Paraná - UFTPR; prestou as devidas homenagens; e convidou para compor a Mesa o Sr. Carlos Eduardo Cantarelli, Reitor da Universidade Tecnológica Federal do Paraná - UTFPR. O Sr. Presidente convidou todos a ouvir o Hino Nacional. Após a exibição do vídeo institucional, o Sr. Presidente proferiu discurso do Sr. Eduardo Cunha, Presidente da Câmara dos Deputados. Nos termos do § 2º do artigo 18 do Regimento Interno, assumiu a Presidência o Sr. Mauro Pereira e concedeu a palavra ao Sr. Alex Canziani, autor do requerimento. Reassumiu a Presidência o Sr. Alex Canziani e concedeu a palavra aos Srs. Carlos Eduardo Cantarelli, componente da Mesa; Ricardo Barros, pelo PP; Rubens Bueno, Líder do PPS; Enio Verri, pelo PT; Diego Garcia, pelo PHS, e Edmar Arruda, pelo PSC. Usou da palavra pela ordem o Sr. Dilceu Sperafico. O Sr. Presidente registrou a presença de convidados, reiterou as homenagens prestadas, agradeceu a presença de todos e, às 10h15, encerrou a sessão.

Delegado Edson Moreira
Presidente

Capitão Augusto
Secretário

As notas taquigráficas desta Sessão Não Deliberativa Solene poderão ser solicitadas ao Departamento de Taquigrafia, Revisão e Redação - DETAQ."
