dataHoraInicio;keywords;tipoDiscurso;transcricao
2016-06-29T15:00;"CADASTRO ÚNICO PARA PROGRAMAS SOCIAIS DO GOVERNO FEDERAL (CADÚNICO), IRREGULARIDADE, TRIBUNAL DE CONTAS DA UNIÃO (TCU), AVALIAÇÃO.
EDUARDO PELICIOLLI, VEREADOR, PASSO FUNDO (RS), PRESENÇA, PLENÁRIO DA CÂMARA DOS DEPUTADOS, SAUDAÇÃO.";COMO LÍDER;"O SR. CAJAR NARDES (PR-RS. Como Líder. Sem revisão do orador.) - Boa tarde, Sr. Presidente, Sras. e Srs. Deputados.
	Sr. Presidente, venho falar de um assunto que aflige a mim e a milhões de brasileiros.
	Gostaria de dar como lido pronunciamento que agora faço no sentido de dar publicidade à análise realizada pelo Tribunal de Contas da União - TCU acerca do sistema do Cadastro Único para Programas Sociais - CadÚnico.
	O Programa Bolsa Família cumpre um importante papel na inclusão social das famílias em situação de pobreza e extrema pobreza no País. Com a modesta renda que recebem por meio do programa, muitos brasileiros ficam menos vulneráveis à fome e passam a ter mais acesso a direitos como saúde e educação.
	É por saber da importância do programa para uma parcela da população brasileira que a existência de erros e fraudes na concessão do benefício detectada por auditoria do Tribunal de Contas da União é motivo para indignação.
	Em um trabalho de fiscalização contínua, o Tribunal auditou o Cadastro Único para Programas Sociais, que guarda informações das famílias e pessoas de baixa renda para seleção de beneficiários dos programas sociais do Governo Federal. O Programa Bolsa Família é o principal usuário das informações do cadastro, e, para que possa ser efetivo e atender as pessoas em situação de fragilidade social, é imprescindível que os dados registrados no CadÚnico sejam confiáveis e livres de fraudes.
	Infelizmente, não foi o que o Tribunal de Contas da União encontrou ao comparar as informações do cadastro com aquelas presentes em outras bases de dados, como a Relação Anual de Informações Sociais e o banco de dados dos pagamentos do INSS. 
	Sr. Presidente, segundo os achados da auditoria, mais de 160 mil famílias receberam o benefício, mesmo tendo renda mais de 4 vezes maior que o estabelecido pelo Bolsa Família. 
	Isso significa que, somente no mês cujos dados o TCU verificou, cerca de 16 milhões de reais foram entregues a pessoas que não tinham direito ao benefício. Extrapolando os dados para o período de 1 ano, seriam 195 milhões de reais saindo dos cofres públicos indevidamente.
	Através do cruzamento de dados disponibilizados pela Secretaria Nacional de Renda de Cidadania, pelo Tribunal Superior Eleitoral, pela Receita Federal e pelos Tribunais de Contas, o Ministério Público Federal identificou irregularidades de 2,5 bilhões de reais no Bolsa Família, abrangendo aproximadamente 1,4 milhão de beneficiários. 
	As inconformidades dizem respeito a: pessoas já falecidas, 49 mil beneficiários; servidores públicos, 584 mil beneficiários; doadores de campanha, 89 mil beneficiários; proprietários e responsáveis por empresas em atividade, 318 mil beneficiários; indivíduos sem CPF; beneficiários com múltiplos CPFs vinculados a um mesmo Número de Identificação Social cadastrado no CadÚnico.
	Quero dizer que a correção desses problemas é necessária e urgente para que o Bolsa Família possa cumprir, sem desvirtuamentos ou gastos indevidos, o seu objetivo de combater a pobreza.
	O Ministério do Desenvolvimento Social, ao qual a Secretaria Nacional de Renda de Cidadania é vinculada, informou que realiza rotinas de controle anuais de seus cadastros. É um trabalho essencial que, como vimos, deve ser aprimorado para garantir a manutenção do foco do Bolsa Família nos mais vulneráveis pela condição de pobreza.
	Esperamos que o esforço conjunto entre os órgãos responsáveis pelo CadÚnico e por seu controle interno e externo, a partir de uma nova e competente liderança, contribua para que os programas sociais que utilizam esses dados sejam livres de erros e fraudes, pelo bem da população que verdadeiramente precisa do apoio desses benefícios e que não pode aceitar que haja desperdício de recursos.
Gostaria, Sr. Presidente, de registrar que está aqui comigo o Vereador Eduardo Peliciolli, da cidade de Passo Fundo, do meu querido Rio Grande do Sul.
Sr. Presidente, peço que este pronunciamento seja divulgado pelos órgãos de comunicação desta Casa.
	Muito obrigado."
2016-08-30T11:26;CRÍTICA, ATRASO, REVITALIZAÇÃO, CAIS MAUÁ, PORTO, PORTO ALEGRE (RS), ATUAÇÃO, TARSO GENRO, EX-GOVERNADOR, RIO GRANDE DO SUL.;COMO LÍDER;"O SR. CAJAR NARDES (PR-RS. Como Líder. Sem revisão do orador.) - Deputado José Fogaça, fiz questão de falar neste momento em que V.Exa. preside a Mesa, porque o assunto que trago diz respeito ao nosso Estado do Rio Grande do Sul. Trata-se de uma preocupação que quero manifestar e deixar registrada nos Anais da Casa.
	Sr. Presidente, Sras. e Srs. Deputados, hoje subo à tribuna para falar da minha indignação com o atraso nas obras de revitalização do Cais Mauá, localizado na minha amada e querida Porto Alegre, Capital do meu Estado, o Rio Grande do Sul.
	O projeto se arrasta desde 2010, quando o consórcio Cais Mauá do Brasil S/A venceu a concorrência para a revitalização do local e anunciou que investiria cerca de R$ 500 milhões na remodelação do porto da Capital.
	Desde então, o grupo acumula dívidas, cobranças judiciais e apontamento de problemas por parte do Tribunal de Contas do Estado, como ausência de comprovação financeira para a execução da obra.
	É importante lembrar que o primeiro sinal de instabilidade financeira foi dado ao Governo do Estado em 2010, na gestão do ex-Governador Tarso Genro, quando o consórcio não comprovou ter a capacidade financeira exigida no edital de licitação e no contrato de arrendamento da área firmado com a Superintendência de Portos e Hidrovias. A questão foi apontada em inspeção especial do Tribunal de Contas do Estado, em 2013, e absolutamente nada foi feito pelo Governo do Estado para a resolução do caso.
	Tamanho descaso por parte do Governo do Estado escancarou a ausência de uma governança responsável na condução das obras de revitalização do Cais Mauá. De fato, a empresa vive uma situação que coloca em dúvida sua capacidade de revitalizar a área, mas o Governo deveria ter acompanhado o processo com o intuito de se precaver quanto a possíveis impactos negativos sobre a execução do projeto. Apesar de o Governo ter conhecimento do processo, a busca de uma solução para o problema foi negligenciada.
	O Governo do Estado não se valeu de elementos essenciais da governança pública, tais como estratégia e controle, para avaliar, direcionar e monitorar a gestão, buscando a condução de uma política pública de resultado. Além disso, o descumprimento de itens do edital de licitação e do contrato de arrendamento entre a  concessionária e o Governo do Estado motivaram ações populares pela rescisão do acordo.
	E faço coro às reivindicações da população porto-alegrense acerca desse projeto, que não envolve tão somente um espaço bem localizado para a exploração comercial, mas também uma das maiores belezas da nossa Capital. O Cais Mauá é o nosso cartão postal!
	Empregos não estão sendo gerados, tributos não estão sendo arrecadados, e a beleza do Cais Mauá não está sendo valorizada. Sua revitalização ensejaria melhora da autoestima da população, que está cansada de enxergar e ouvir apenas coisas que diminuem nossa grande Porto Alegre.
	Por isso tudo, reafirmo minha convicção de que só tornaremos o setor público mais eficiente e ético se reforçarmos padrões de boa governança, com ênfase na eficiência e na eficácia dos serviços públicos.
	Finalmente, Sr. Presidente, defendo a realização de um grande pacto pela governança pública, de modo a se atender aos anseios da população brasileira por políticas públicas mais efetivas.
	O povo gaúcho, o povo brasileiro não aguenta mais tanto descaso!
	Muito obrigado."
2017-02-07T14:24;PEDÁGIO, GUAÍBA (RS), PORTO ALEGRE (RS), REDUÇÃO, VALOR, DEFESA.;PEQUENO EXPEDIENTE;"O SR. CAJAR NARDES (Bloco/PR-RS. Sem revisão do orador.) - Sr. Presidente, Srs. Deputados, venho aqui falar hoje de um assunto muito importante, que é a questão do pedágio próximo ao Município de Guaíba.
	Hoje, os munícipes de Guaíba, uma cidade da Grande Porto Alegre, que fica a cerca de 20 quilômetros da capital, pagam 12 reais e 60 centavos de pedágio para chegar à cidade. Eles pagam 12 reais e 60 centavos para percorrer 20 quilômetros. Isso está causando um grande transtorno na comunidade. Esse contrato de concessão expira dia 4 de julho deste ano.
	Como Parlamentar, como representante do povo do Rio Grande do Sul, como representante do povo de Guaíba, vamos fazer um trabalho para que seja minimizado o custo desse pedágio.
	O SR. PRESIDENTE (Carlos Manato) - Nobre Deputado, nós vamos mandar divulgar o seu discurso no programa A Voz do Brasil. Daqui a pouco haverá outro período, e V.Exa. poderá falar por mais 3 minutos. Vai ser uma honra ouvir V.Exa."
2017-02-15T20:00;LIZIANE BAYER, DEPUTADO ESTADUAL, RIO GRANDE DO SUL, CÂMARA DOS DEPUTADOS, PRESENÇA, REGISTRO.;BREVES COMUNICAÇÕES;O SR. CAJAR NARDES (PR-RS. Sem revisão do orador.) - Sr. Presidente, quero apenas anunciar a presença da Deputada Estadual Liziane Bayer, 1ª Vice-Presidente da Assembleia Legislativa do Rio Grande do Sul.
2017-02-16T17:03;"PEDÁGIO, RODOVIA FEDERAL, VALOR, CONTRÁRIO, POPULAÇÃO, RIO GRANDE DO SUL, REGISTRO.
PEDÁGIO, RODOVIA FEDERAL, CONCESSÃO, RIO GRANDE DO SUL, DEBATE, AUDIÊNCIA PÚBLICA, EXPECTATIVA.";COMUNICAÇÃO PARLAMENTAR;"O SR. CAJAR NARDES (PR-RS. Sem revisão do orador.) - Sr. Presidente, antes de mais nada, gostaria de dar como lido e pedir a comunicação pelos órgãos de imprensa da Casa deste nosso pronunciamento que fala sobre as rodovias federais do Estado do Rio Grande do Sul.
	Milhares de gaúchos são obrigados a conviver com a exorbitância dos valores de pedágios cobrados no nosso Estado. Podemos fazer uma comparação entre a Autopista Litoral Sul, que opera no Paraná e em Santa Catarina, e a Triunfo Concepa, que opera entre Osório e Guaíba: na primeira, roda-se 19,45 quilômetros por real pago em pedágios; já na segunda, rodamos somente 3,92 quilômetros por real pago. Ou seja, no Rio Grande do Sul, rodamos 5 vezes menos pelo mesmo preço pago às concessionárias. Isso é um absurdo!
	Além do contraste entre Santa Catarina e Rio Grande do Sul, existe um problema ainda mais grave entre nosso próprio povo. Amigos e amigas gaúchos, em especial aqueles que moram no Município de Guaíba, a Triunfo Concepa detém um contrato de 20 anos para administrar 121 quilômetros de rodovias federais na BR-290 e BR-116. Ao longo deste trecho concedido há a presença de 3 pedágios, cujos preços variam entre R$ 6,90, em Gravataí, a R$ 13,80, em Santo Antônio da Patrulha e Eldorado do Sul.
	Guaíba é uma cidade com cerca de 100 mil habitantes e que, por sua proximidade com a capital gaúcha, mantém um fluxo diário de milhares de veículos no trecho da BR-116 concedido ao consórcio, movimentando trabalhadores e mercadorias milhares, fundamentais para o crescimento econômico.
	Pela estrada, Guaíba fica afastada pouco mais de 20 quilômetros de Porto Alegre, mas a maior distância entre essas duas cidades é imposta pelo pedágio, cujo valor é de R$ 13,80! Esse valor é claramente desproporcional e impõe um peso diário no bolso do povo de Guaíba muito maior do que o imposto ao cidadão que vai da Capital para o litoral Norte somente no final de semana. Nesse exemplo, em viagens de ida e volta, o povo de Guaíba roda 2,89 quilômetros por real pago, e o segundo roda 7,67 quilômetros por real pago, uma diferença de 165%!
	Foi divulgado o novo plano de concessão de rodovias federais no Rio Grande do Sul, que, apesar de prever a desativação do pedágio de Eldorado do Sul, também planeja a cobrança de R$ 36,10 por um trecho de somente 200 quilômetros da BR-386, entre Tio Hugo e Montenegro. Não podemos descansar. Essa batalha está somente começando!
	No dia 4 de julho, encerra-se a vigência do contrato da concessão firmado entre a Agência Nacional de Transportes Terrestres e a Triunfo Concepa. Isso faz com que agora seja a melhor hora para nos posicionarmos e exigirmos isonomia e justeza nas próximas concessões. Temos audiências públicas marcadas para o dia 23 de fevereiro aqui em Brasília. 
Tenham a certeza de que a voz de Guaíba será ouvida! A população de Guaíba pode contar conosco e com o nosso empenho em relação a essa dificuldade causada pelo pedágio.
	Muito obrigado."
2017-03-21T19:38;DEFESA, UNIÃO, BANCADA PARLAMENTAR, RIO GRANDE DO SUL, BUSCA, LIBERAÇÃO, RECURSOS ORÇAMENTÁRIOS, CONCLUSÃO, RODOVIA FEDERAL, BR-116.;BREVES COMUNICAÇÕES;"O SR. CAJAR NARDES (PR-RS. Sem revisão do orador.) - Sr. Presidente, quero dizer ao Deputado Afonso Hamm que é aquilo mesmo que ele afirmou. Com o apoio da nossa bancada, acredito que este é o momento de o Rio Grande do Sul dar as mãos porque a importância da BR-116 para o crescimento econômico, para o desenvolvimento social é fundamental.
	Estaremos todos juntos, abraçados em relação a essa causa, o pessoal da Costa Doce, o pessoal da região sul do Estado, irmanados, com essa grande força para finalizarmos a BR-116, com o apoio do nosso Governo Federal, com o apoio do nosso Ministro dos Transportes, Maurício Quintella Lessa."
