dataHoraInicio;keywords;tipoDiscurso;transcricao
2017-05-04T14:48;"SINDICATO, AUMENTO, SUPERMERCADO, SANTO ÂNGELO (RS), AVALIAÇÃO, REFORMA TRABALHISTA, APOIO.
REDE SOCIAL.
PEC 287/2016, PROPOSTA DE EMENDA À CONSTITUIÇÃO, REFORMA PREVIDENCIÁRIA (2016), ALTERAÇÃO, DEFESA.
FRENTE PARLAMENTAR EM DEFESA DA CONCLUSÃO DAS OBRAS DE DUPLICAÇÃO DA BR 116, TRECHO GUAÍBA-PELOTAS/RS, BALANÇO, AGRICULTURA, DEFESA.
PL 6003/2016, PROJETO DE LEI ORDINÁRIA, REGULAÇÃO, PRESTAÇÃO DE SERVIÇO, ANIMAL DOMÉSTICO, ESTABELECIMENTO COMERCIAL, DEFESA.";GRANDE EXPEDIENTE;"O SR. CAJAR NARDES (PR-RS. Sem revisão do orador.) - Sr. Presidente, Deputado Heitor Schuch, Sras. e Srs. Deputados, atualmente, o Brasil conta com cerca de 17 mil sindicatos com cadastro ativo no Cadastro Nacional de Entidades Sindicais. Desse total, cerca de 12 mil são sindicatos profissionais, enquanto os outros 5 mil são sindicatos patronais. No Reino Unido, por exemplo, o número total de sindicatos é de 168, e na Argentina esse número não passa de 100 sindicatos.
	Na semana passada, vimos por este País manifestações com a participação de muitos sindicalistas e poucos trabalhadores. Estariam mesmo esses manifestantes preocupados com o interesse coletivo no âmbito profissional? Estariam esses dirigentes de entidades sindicais preocupados com a condição social dos trabalhadores?
	Eu tenho como característica a objetividade, o pragmatismo. Quero usar um exemplo prático e verdadeiro para ilustrar como um sindicato pode não representar o verdadeiro interesse da maioria dos trabalhadores que, em tese, deveria defender.
	O exemplo vem de uma cidade gaúcha com cerca de 80 mil habitantes, minha cidade natal, Santo Ângelo, que, durante muito tempo, teve supermercados abertos aos domingos. Num sistema de escala, os funcionários desses estabelecimentos tinham todos os direitos garantidos, com todas as folgas a que tinham direito, além do pagamento de adicionais pelo trabalho aos domingos. 
	Muitas pessoas da cidade trabalhavam durante toda a semana e tinham o domingo para ir às compras. Famílias iam juntas ao mercado para comprar a carne fresca do churrasco gaúcho. A economia desse Município girava. 
	Mas o que fez um sindicato? Encontrou uma forma de não permitir mais o funcionamento dos supermercados aos domingos, apesar de protestos e manifestações dos próprios trabalhadores afetados com a medida. Sim, senhoras e senhores, os próprios trabalhadores protestaram contra o sindicato que os deveria representar. Pessoalmente, ouvi depoimentos desses trabalhadores. Disseram-me que, antes da medida, a sua realidade de trabalho era melhor, que tinham melhores ganhos. 
	Imaginem se médicos, enfermeiros, frentistas, jornalistas e outros tantos profissionais não trabalhassem aos domingos? Nas grandes cidades do País, essa condição e realidade são diferentes, mas, em cidades médias, o exemplo que dei realmente existe.
	Por fim, nessa cidade gaúcha de 80 mil habitantes, onde ocorreu o exemplo que relatei, funcionários de supermercados foram demitidos porque os supermercados não abrem mais aos domingos. Vagas de trabalho foram fechadas.
	Que luta por direitos e garantias este sindicato ofereceu? Que representatividade é essa? O protagonismo que deveria existir por parte de muitos sindicatos desaparece, justamente porque muitos não têm a capacidade de pautar uma agenda mais favorável ao trabalhador.
	Na esteira deste tema, quero chamar a atenção para a superficialidade das interpretações, a falta de aprofundamento e o olhar raso para grandes questões do momento em nosso País. Nas redes sociais, principalmente, há uma enxurrada de posicionamentos pequenos, equivocados e baseados em visões absolutamente simplistas e individualizadas.
	No ano passado, o jornal britânico The Independent publicou um artigo relacionado, com dois estudos recentes na área da Psicologia que se debruçam sobre a ""tese da superficialização"" ou a teoria de que o desenvolvimento das tecnologias da comunicação - as mensagens de texto e as redes sociais - tem conduzido a um sério declínio do pensamento reflectivo.
	Como nos acostumamos progressivamente a formas de comunicação cada vez mais curtas e rápidas, os nossos cérebros também se tornaram mais aptos a transmissões rápidas e curtas. Testes recentes indicam que o declínio do pensamento reflectivo se correlaciona com o declínio da importância com que se encara a moralidade e o aumento da importância com que se encara apenas a imagem. Em resumo, nós damos mais atenção a mensagens instantâneas, não nos aprofundando nos temas, não nos especificando naquilo que nos interessa.
	O Sr. Valdir Colatto - V.Exa. me concede um aparte?
	O SR. CAJAR NARDES - Concedo-lhe um aparte, Deputado Valdir Colatto.
	O Sr. Valdir Colatto - Deputado Cajar Nardes, parabéns pelo pronunciamento! V.Exa. toca em um ponto importante em que o Brasil precisa se aprofundar, que é a questão sindical brasileira, a questão trabalhista. Nós começamos com a reforma trabalhista. E aí está um exemplo que V.Exa. coloca, que aprovamos na lei trabalhista, que é o acordado acima do legislado. Ora, se as partes têm vontade de fazer, por que não acontecer? V.Exa. fala do seu Rio Grande do Sul, eu falo da minha Santa Catarina, e, realmente, temos problemas lá com os sindicatos que não permitem que, no final de semana, os trabalhadores que querem trabalhar desempenhem seu ofício. Estes entram inclusive numa lista voluntariamente para poder trabalhar e não conseguem, porque sindicatos radicais não permitem. Então, eu acho que nós temos que aprofundar este processo. Devemos louvar os bons sindicatos e os bons sindicalistas que existem no Brasil e realmente respeitar a vontade do trabalhador com o empreendedor. Que se faça valer o contrato feito na área do trabalho! Assim deve ser com outro contrato qualquer, em que se faz o contrato e, concluídas as tarefas e as obrigações dos dois lados, se encerra o contrato, acabam as demandas judiciais. Hoje, quem faz o contrato na área trabalhista sai com uma mochila de passivo trabalhista nas costas, para poder entrar 2 anos, 3 anos ou 5 anos depois na Justiça. Eu acho que nós temos que trabalhar isso e ajustar essa questão trabalhista. E os sindicatos têm que ir para os eixos. Devemos deixar os bons sindicatos funcionar. Esse aprofundamento que V.Exa. coloca é bom para o Brasil saber o que está acontecendo. Temos que ter coragem de mexer nessa ferida e de buscar solução. Temos que louvar os bons sindicatos, mas temos que tirar aqueles que estão voltados apenas para benefícios pessoais, porque são sindicatos de fachada. Obrigado. Parabéns pelo seu pronunciamento.
	O SR. CAJAR NARDES - Obrigado, Deputado.
	O Sr. Mauro Pereira - Deputado Cajar Nardes, permita-me um aparte?
	O SR. CAJAR NARDES - Sim.
	O Sr. Mauro Pereira - Deputado Cajar Nardes, em primeiro lugar eu gostaria de dizer que, na condição de Deputado Federal da Serra Gaúcha e do PMDB, quero parabenizar V.Exa. pelo trabalho desenvolvido nesta Casa, não só na questão trabalhista, mas em todos os assuntos de interesse do Estado do Rio Grande do Sul. V.Exa. está sempre pronto para ajudar o nosso Estado e o nosso Brasil. Isso é muito importante e se chama responsabilidade. V.Exa. votou a favor da renegociação da dívida dos Estados, que vai dar um alívio ao Estado, e agora apoia o Governo e o Brasil nas reformas que são necessárias, para que o Brasil realmente volte a gerar empregos e a dar segurança às pessoas, em especial aos 14 milhões de desempregados que precisam de apoio. Quero dizer ainda que a reforma trabalhista vai ao encontro disso, de modo que o empreendedor gere empregos com satisfação, com alegria, sabendo que amanhã ou depois ele não vai se ver diante de uma ação penal ou de uma ação trabalhista contra ele. Pelo contrário: ele vai ter orgulho em gerar empregos. Ao mesmo tempo, a pessoa que está desempregada vai saber que todos os seus direitos estão garantidos, e isso é muito importante. Esse foi um trabalho nosso. V.Exa., por nenhum segundo ficou pensando; pelo contrário, foi na veia, para fazer com que as coisas acontecessem. Eu não tenho dúvida nenhuma de que essa contribuição que todos os trabalhadores são obrigados a fazer todos os anos, daqui para frente, assim que a reforma for aprovada no Senado, deixará de ser compulsória. O trabalhador vai poder continuar contribuindo, desde que o sindicato mereça; desde que o sindicato esteja fazendo jus àquela contribuição. Esse ponto da reforma trabalhista já é de extrema importância. O trabalhador agora vai poder decidir se dá o dinheiro ao sindicato ou não. Era isso que eu queria dizer. Quero parabenizar V.Exa. pelo discurso e também pela amizade, pelo respeito aos colegas, porque isso é muito importante. Boa sorte a V.Exa. no mandato.
	O SR. CAJAR NARDES - Muito obrigado, Deputado. 
	Eu estava falando sobre o pensamento reflectivo: o declínio da importância com que se encara a moralidade e o aumento da importância com que se encara apenas a imagem. As pessoas, hoje, são movidas por aquele ato reflexo, por aquela primeira imagem, não se introduzindo no assunto, não mergulhando no tema, para que maiores informações lhes sirvam de base para tirarem suas conclusões. 
	O Brasil precisa ser modernizado, com leis que incentivem o empreendedorismo dos pequenos e microempresários, que flexibilizem as relações de trabalho e que libertem nosso País das amarras do passado. 
	Já no campo da Previdência, observo que o substitutivo da Proposta de Emenda à Constituição nº 287, de 2016, contém pontos a serem avaliados, discutidos e interpretados. 
	Em tempos de superficialidade e de pensamento raso, da pós-verdade, não podemos ficar naquilo que se chama lá no Rio Grande do Sul de ""grenalização"", ou seja, se eu estou de um lado, não quero nem saber o que o outro tem a dizer, ou que o outro não presta em nada. 
	O filósofo, escritor, educador, palestrante e professor universitário Mano Sergio Cortella diz que devemos prestar muita atenção nas pessoas que não concordam conosco. Estes nos obrigam a transformar, a inovar e a mudar. O que nos perturba, na verdade, nos ajuda.
	Neste sentido, lembro que nós Parlamentares temos o compromisso de sermos incansáveis, de estarmos bem informados e de sermos os verdadeiros representantes dos diversos segmentos que compõem esta Nação. Como Republicano, sigo na minha determinação e no meu comprometimento com o regime democrático, numa sociedade livre, pluralista e participativa.
	Na semana passada foi instalada aqui na Câmara dos Deputados a Frente Parlamentar em Defesa da Conclusão das Obras de Duplicação da BR- 116.
	Sou Vice-Presidente desta Frente Parlamentar, presidida pelo colega Deputado Afonso Hamm. Nosso grupo tem como objetivo intensificar a mobilização para assegurar a integralidade dos recursos para a conclusão da obra.
	Essa rodovia é estratégica para o desenvolvimento do Rio Grande do Sul e o principal corredor de escoamento da produção gaúcha. Nesse momento de safra, ela está saturada pelo volume de tráfego, principalmente de caminhões, oferecendo mais risco à segurança e à vida das pessoas.
	Depois de nossa reunião, realizamos uma audiência com o Ministro dos Transportes, Portos e Aviação Civil, meu amigo Maurício Quintella, para pedir que não haja contingenciamento para as obras da BR-116. Segundo o Ministro, o orçamento de 2017 destinou 80 milhões de reais para a obra, dos quais 39 milhões de reais foram liberados na semana passada pelo Governo Federal. Seguimos determinados nessa luta e vamos nos reunir com o Ministro do Planejamento, Desenvolvimento e Gestão para tentar conseguir mais 12 milhões de reais para a duplicação da BR-116, entre Guaíba e Pelotas.
	Minha atuação nesta Casa está pautada em temas que vão além da questão da infraestrutura, como é o caso que citei há pouco em relação à BR- 116. Aliás, a infraestrutura é uma condição mínima para a melhoria do bem-estar da população e do desenvolvimento da economia de qualquer país.
	Refiro-me também à agricultura, setor a que minha família é ligada há muito tempo, que precisa de total atenção do setor público e, no momento, segura o PIB brasileiro, já que vivemos uma safra recorde de grãos, movimentando nossa economia e alimentando a população.
	Por fim, quero falar sobre outra grande bandeira do meu mandato, a causa animal. Apresentei nesta Casa o Projeto de Lei nº 6.003, de 2016, que dispõe sobre os serviços de higienização e outros serviços que impliquem a guarda de animais de estimação e que obriga que os estabelecimentos que atendem animais de estimação instalem circuito interno de vídeo que permitam aos donos dos animais o acesso para vistoriar esses serviços.
	Dados do IBGE de 2015, que naturalmente hoje são superiores, apontam que a população estimada de cachorros era de 52,2 milhões e a de gatos, de 11,5 milhões. Os números mostram que nós brasileiros gostamos muito de nossos animais.
	As pessoas deixam seus pets em estabelecimentos comerciais imaginando que serão bem tratados, mas infelizmente, em alguns casos, isso não ocorre. Precisamos combater os maus tratos. A tramitação do projeto está na fase de apreciação das Comissões.
	Reitero aos gaúchos que sou um lutador. Meu trabalho é diário e ininterrupto. Durante a semana, aqui em Brasília, estou sempre disposto a encaminhar demandas dos diversos Prefeitos que me procuram, acompanhando projetos, cobrando responsáveis por seus andamentos, discutindo caminhos e encontrando alternativas. 
	Nos finais de semana, como os meus colegas, estou sempre em algum ponto do meu querido Estado para ouvir as pessoas exatamente nos rincões onde vivem, verificando suas necessidades e prestigiando seu trabalho junto às comunidades.
	Quem me conhece sabe que minha luta é para melhorar a vida das pessoas e buscar também o respeito aos animais. Sou um médico-veterinário preocupado em trabalhar pelo consumo consciente, pela dignidade e pela qualidade de vida.
	Muito obrigado."
2017-07-10T14:18;SAÚDE, ASSISTENTE SOCIAL, CRACK, DEPENDENTE QUÍMICO, IGREJA MUNDIAL DO PODER DE DEUS, IGREJA EVANGÉLICA, ATUAÇÃO, SÃO PAULO (SP), ANÁLISE.;PEQUENO EXPEDIENTE;"O SR. CAJAR NARDES (PR-RS. Sem revisão do orador.) - Boa tarde, Sr. Presidente. Boa tarde, Deputado Mauro Pereira, parceiro do Rio Grande do Sul, Sras. e Srs. Deputados. 
	Venho aqui hoje falar sobre um problema endêmico que há muito tempo vem causando grandes estragos na nossa sociedade. Neste momento, quero alertar, principalmente, para a utilização do crack e das famosas balas, essa droga degenerativa, essa droga que bate diretamente na família brasileira. Trata-se de uma droga que as pessoas que a utilizam o fazem de forma discreta, e a sociedade e a família não sabem que a pessoa a está utilizando. Então quero deixar esse alerta.
	Dentro desse assunto, meu caro Presidente, quero dizer que estive ontem em um grande culto da Igreja Mundial do Poder de Deus, em São Paulo, e vi o trabalho que está sendo feito com drogados, com pessoas que se recuperam do vício em drogas, problema que mais afeta a sociedade brasileira. Então, quero deixar minha palavra aqui em homenagem ao grande trabalho que a Igreja Mundial está realizando no nosso País nessa questão das drogas.
	O Estado se vê incompetente na gestão desse problema. Então nós precisamos, sim, dessas organizações da sociedade na ajuda ao Estado, porque o viciado, a pessoa que tem dificuldade nessa área é doente e, acima de tudo, precisa de atenção. A necessidade dessas pessoas não é só de ordem material, é também de atenção humana, de pessoas que as amparem e as ajudem a sair desse vício.
	Peço a divulgação do meu pronunciamento no programa A Voz do Brasil, meu caro Presidente.
	Muito obrigado."
2017-08-02T14:36;PARECER CONTRÁRIO, COMISSÃO DE CONSTITUIÇÃO E JUSTIÇA E DE CIDADANIA (CCJC), SIP 1/2017, SOLICITAÇÃO PARA INSTAURAÇÃO DE PROCESSO, AUTORIZAÇÃO, INVESTIGAÇÃO, SUPREMO TRIBUNAL FEDERAL (STF), DENÚNCIA, MINISTÉRIO PÚBLICO FEDERAL (MPF), MICHEL TEMER, PRESIDENTE DA REPÚBLICA, VOTO FAVORAVEL.;REGISTRO DE VOTO;"O SR. CAJAR NARDES (PR-RS) - Sr. Presidente, trocar de Governo agora quebraria muitas milhares de micro e pequenas empresas, acarretando uma grande perda de empregos para o nosso País.
	O SR. PRESIDENTE (Rodrigo Maia) - Como vota, Deputado? ""Sim"", ""não"" ou ""abstenção""?
	O SR. CAJAR NARDES - O cidadão Michel Temer responderá pelos seus atos no dia 1º de fevereiro de 2019. Portanto, eu voto ""sim"".
	O SR. GIACOBO - Cajar Nardes: voto ""sim"". Total: 8 votos."
2017-10-25T16:50;PARECER CONTRÁRIO, COMISSÃO DE CONSTITUIÇÃO E JUSTIÇA E DE CIDADANIA (CCJC), SIP 2/2017, SOLICITAÇÃO PARA INSTAURAÇÃO DE PROCESSO, AUTORIZAÇÃO, INVESTIGAÇÃO, SUPREMO TRIBUNAL FEDERAL (STF), DENÚNCIA, MINISTÉRIO PÚBLICO FEDERAL (MPF), MICHEL TEMER, PRESIDENTE DA REPÚBLICA, ELISEU LEMOS PADILHA, WELLINGTON MOREIRA FRANCO, MINISTRO DE ESTADO, VOTO FAVORÁVEL.;REGISTRO DE VOTO;"O SR. CAJAR NARDES (PODE-RS.) - Sr. Presidente, no dia 5 de janeiro de 2019, todos responderão por seus atos. Em defesa do emprego e da economia do País, eu voto ""sim"".
	O SR. GIACOBO - Deputado Cajar Nardes: voto ""sim"". Total 9 votos."
2018-04-05T09:00;;HOMENAGEM;"Ata da 63ª (sexagésima terceira) Sessão da Câmara dos Deputados, Não Deliberativa Solene, matutina, da 4ª Sessão Legislativa Ordinária, da 55ª Legislatura, em 5 de abril de 2018. Às 9h15, o Sr. Izalci Lucas, no exercício da Presidência, nos termos do § 2º do artigo 18 do Regimento Interno, declarou aberta a sessão e deu por dispensada a leitura da ata da sessão anterior. O Sr. Presidente informou que a sessão se destinou à homenagem aos 164 anos da Secretaria de Patrimônio da União - SPU; prestou as devidas homenagens; e convidou para compor a Mesa os Srs. Sidrack de Oliveira Correia Neto, Secretário da SPU; Fabiana Cristina Tavares Torquato, Superintendente da SPU/DF; Robson Tuma, Superintendente da SPU/SP; Lucimara Rodrigues Cordeiro Tavares, Superintendente da SPU/MT; e Mauro Pereira, Raimundo Gomes de Matos e Marcelo Squassoni, Deputados Federais. O Sr. Presidente convidou todos a ouvir o Hino Nacional, celebrado pela Banda da Aeronáutica sob a regência do Suboficial músico Adil Francisco Silva. O Sr. Presidente proferiu discursos dos Srs. Rodrigo Maia, Presidente da Câmara dos Deputados; e Nilson Leitão, autor do requerimento. Nos termos do § 2º do artigo 18 do Regimento Interno, assumiu a Presidência o Sr. Mauro Pereira e concedeu a palavra ao Sr. Izalci Lucas, autor do requerimento. Reassumiu a Presidência o Sr. Izalci Lucas e concedeu a palavra aos Srs. Flaviano Melo, pelo PMDB; Cajar Nardes, pelo Podemos; e aos Srs. Mauro Pereira, Lucimara Rodrigues Cordeiro Tavares, Robson Tuma, Fabiana Cristina Tavares Torquato e Sidrack de Oliveira Correia Neto, componentes da Mesa. Usaram da palavra pela ordem os Srs. Antonio Bulhões, Laercio Oliveira, Soraya Santos, Celso Russomanno, Vinicius Carvalho e Hugo Leal. O Sr. Presidente registrou a presença de convidados, reiterou as homenagens prestadas, agradeceu a presença de todos e, às 10h48, encerrou a sessão.
Miro Teixeira
Presidente

Mauro Pereira
Secretário
As notas taquigráficas desta Sessão Não Deliberativa Solene poderão ser solicitadas ao Departamento de Taquigrafia, Revisão e Redação - DETAQ."
