dataHoraInicio;keywords;tipoDiscurso;transcricao
2016-05-25T14:33;COMPROMISSO, MANDATO PARLAMENTAR, ORADOR, POPULAÇÃO, BRASIL, ALAGOAS.;PEQUENO EXPEDIENTE;"O SR. VAL AMÉLIO (PRTB-AL. Sem revisão do orador.) - Boa tarde a todos. Quero agradecer e dizer que muito me honra ser empossado pelo decano desta Casa, Deputado Mauro Benevides. Muito obrigado, Deputado.
	Quero apenas reafirmar aqui o compromisso que tenho com o povo brasileiro, principalmente com o povo do meu querido Estado de Alagoas. 
	Agradeço ao Presidente do PRTB, Levy Fidelix, pela confiança e parceria, pois ele tem caminhado conosco. 
Quero dizer que vou agir com hombridade, responsabilidade e, acima de tudo, maturidade, por ser, nesta atual Legislatura, o Deputado Federal mais jovem, com 22 anos.
	Quero agradecer a todos e, principalmente, a V.Exa., Sr. Presidente. 	Muito obrigado. (Palmas.)
	O SR. PRESIDENTE (Mauro Benevides) - Mais uma vez cumprimento o nobre Deputado Val Amélio por essas palavras iniciais, que caracterizam sua disposição, como Deputado representante de Alagoas, de defender os interesses do seu Estado, do Nordeste e do País, sobretudo os sentimentos de democracia e a programática do seu partido, o PRTB.
	Portanto, os cumprimentos da Casa a V.Exa., extensivos ao dirigente máximo do PRTB, que prestigia esta Casa junto com os eminentes integrantes do Diretório Nacional."
2016-07-05T16:50;BRUNO TOLEDO, DEPUTADO ESTADUAL, ALAGOAS, PRESENÇA, PLENÁRIO DA CÂMARA DOS DEPUTADOS, SAUDAÇÃO.;PELA ORDEM;"O SR. VAL AMÉLIO (PRTB-AL. Pela ordem. Sem revisão do orador.) - Sr. Presidente, eu gostaria de registrar que se faz presente hoje, na Casa, um representante do Poder Legislativo do Estado de Alagoas, o Deputado Estadual Bruno Toledo. 
	Muito obrigado."
