dataHoraInicio;keywords;tipoDiscurso;transcricao
2018-03-15T15:24;"MANIFESTAÇÃO DE PESAR, HOMICÍDIO, MARIELLE FRANCO, VEREADOR, RIO DE JANEIRO (RJ).
APOIO, INTERVENÇÃO FEDERAL, SEGURANÇA PÚBLICA, RIO DE JANEIRO (ESTADO). 
ANÚNCIO, MOBILIZAÇÃO, PROFESSOR, POLÍCIA MILITAR, AMAZONAS, REAJUSTE SALARAILA. 
APRESENTAÇÃO, INC 4974/2018, INDICAÇÃO, AMPLIAÇÃO, COMPLEMENTAÇÃO, FUNDO DE MANUTENÇÃO E DESENVOLVIMENTO DA EDUCAÇÃO BÁSICA E DE VALORIZAÇÃO DOS PROFISSIONAIS DA EDUCAÇÃO (FUNDEB).";PELA ORDEM;"O SR. PROF. GEDEÃO AMORIM (PMDB-AM. Pela ordem. Sem revisão do orador.) - Terei imenso prazer, Sra. Presidenta.
	Srs. Parlamentares, num primeiro momento, venho a esta tribuna falar de algo bem lamentável, que decepcionou o Brasil inteiro: a morte da Vereadora Marielle Franco, uma jovem militante entusiasta, uma brasileira dessas raras, que vinha se destacando no cenário do Rio de Janeiro e que teve sua vida covardemente ceifada.
	O que é mais lamentável é que este não é um fato isolado. Casos como o da Vereadora se repetem todos os dias em muitos lugares deste País, muitos deles anonimamente, sem sequer constarem das estatísticas oficiais dos órgãos de Segurança do Brasil afora.
	Nós temos muito a lamentar, porque parece que o Brasil perdeu sua condição de Estado. Não é possível assistir a estes desmandos, a esta irresponsabilidade com o que está acontecendo. 
	Eu quero acreditar que a intervenção das forças nacionais, da força do Exército na segurança do Estado do Rio de Janeiro seja eficaz e possa servir para nós começarmos a acabar com tão grandes índices de criminalidade, mas não creio que a criminalidade possa ser combatida pura e simplesmente por uma política de repressão. 
	Acho que há condições causais que nos colocam neste patamar. Nós não podemos conviver com um Brasil com mais de 15 milhões de desempregados. Não é possível convivermos em paz nessas condições. Não é possível vivermos num País com tão altos índices de falta de moradia. Não é possível convivermos neste País com tão fracos, tão deficientes serviços públicos necessários. Enquanto nós não tivermos um Estado capaz de cuidar dessas condições, eu diria, infraestruturais, nós não teremos como combater a criminalidade. 
	Não é possível continuarmos assim. Alguma coisa tem que ser feita. Nossas esperanças recaem fortemente no processo eleitoral deste ano. Deus ajude!
	À parte o lamento pela morte da nossa Vereadora no Rio de Janeiro, eu gostaria de comunicar, também não muito satisfatoriamente, que no Estado do Amazonas, o qual represento nesta Casa, hoje nós estamos com movimentações de uma série de categorias, dentre elas a mobilização da Polícia Militar e a de professores do Estado e de alguns Municípios. 
	Suas reivindicações são justas e se referem a déficits e prejuízos que vêm se acumulando já há algum tempo. Não quero formular juízo de culpabilidade do atual Governador, que, afinal, praticamente acabou de receber o Governo. Não é da responsabilidade de um Parlamentar tomar partido de A ou B. Reputo que ele, com bom senso e a experiência que tem, deverá mediar essas questões. É preciso que se resolva a situação. Isso é o que nós queremos.
	Além disso, quero me reportar a requerimento que fiz ao Ministério da Educação tratando do FUNDEB. Como sabemos, o FUNDEB é um fundo de financiamento da educação pública no Brasil regulamentado por lei editada a cada 15 anos. Foi criado em 2006 e, naquele momento, já ficou preceituado que em 2007 a União participaria com 2 bilhões de reais; em 2008, com 3 bilhões de reais; em 2009, com 4,5 bilhões de reais e, a partir daí, esta participação começaria a evoluir até o montante de 10%, equivalente…
	(Desligamento automático do microfone.) 
	O SR. PROF. GEDEÃO AMORIM - ...Brasil como um todo. 
	O que ocorre é que nunca se chegou ao mínimo de 10%, como prevê a lei, e já em 2020, portanto, daqui a 2 anos, a regulamentação atual do FUNDEB prescreverá. 
	É de bom alvitre que o Sr. Ministro da Educação este ano demande esforços para incluir no Orçamento de 2019 o montante que ainda falta, a fim de que, nesta passagem de governo, o Ministério possa consignar um arejamento financeiro, uma oxigenação, para melhorar consideravelmente as condições de funcionamento da educação ¯ desde as condições físicas e ambientais das escolas até as condições salariais dos professores ¯,  enquanto não forem atingidas determinadas metas do Plano Nacional de Educação.
	Sra. Presidente, senhoras e senhores, era o que eu tinha a dizer.
	Muito obrigado."
2018-03-15T16:08;REGISTRO, PRESENÇA, CÂMARA DOS DEPUTADOS, ESTUDANTE, ESCOLA PRIVADA, BRASÍLIA (DF).;FALA DO PRESIDENTE OU NO EXERCÍCIO DA PRESIDÊNCIA;"O SR. PRESIDENTE (Prof. Gedeão Amorim) - Quero registrar com bastante alegria a presença da turma do 8º ano da Escola Leonardo da Vinci, da Asa Norte. Agradeço ao coordenador da turma pela presença. Sejam muito bem-vindos.
	Neste momento, a Câmara já está um pouquinho esvaziada, porque estamos chegando ao final das atividades parlamentares, e a Câmara funciona assim, não necessariamente com os Deputados presentes aqui. Isso depende das matérias, mas eles estão nos gabinetes, em agendas externas, em Câmaras, em Comissões, etc.
	Muito obrigado pela presença. Até logo."
2018-03-15T16:08;RUBEM TADEU DE CASTRO ALVES, MAJOR DA POLÍCIA MILITAR, ITACOATIARA (AM), HOMENAGEM.;PELA ORDEM;"O SR. PROF. GEDEÃO AMORIM (PMDB-AM. Pela ordem. Sem revisão do orador.) - Sra. Presidente, quero aproveitar este tempo no final das atividades da Câmara, hoje à tarde, para, depois de todas essas polêmicas ocorridas aqui hoje, prestar uma homenagem rara neste mundo tão convulsionado, exatamente pela natureza do homenageado.
	Eu quero homenagear o Major PM Castro Alves, Comandante do 2º Batalhão de Polícia Militar de Itacoatiara, no Amazonas. Este é um Município da Região Metropolitana de Manaus. Itacoatiara é a terceira cidade mais populosa do Estado, com cerca de 100 mil habitantes, segundo o IBGE, nas estatísticas de 2017.
	À frente da Companhia Independente de Polícia Militar, do Município do Rio Preto da Eva, o Major foi aclamado pela população pelos resultados concretos na área de segurança. O Major Castro Alves recebeu diversos diplomas de honra ao mérito pelo mérito pessoal dedicado ao trabalho e ao bom relacionamento com a comunidade. Recebeu a Medalha Ação Policial Militar pelo empenho abnegado, coragem e destreza no cumprimento das missões e das operações; recebeu a Medalha Tiradentes por ter se tornado digno de reconhecimento pela Polícia Militar do Estado do Amazonas; recebeu a Medalha do Mérito Policial Militar por não ter nota desabonadora de sua idoneidade moral e por ter prestado o serviço à causa pública.
	O Major Castro Alves tem quase 20 anos de atuação na Polícia Militar amazonense, possui graduação superior em Segurança Pública, em Língua Portuguesa e em Direito, além de mais três especializações suplementares em Segurança Pública, em Língua Portuguesa e em Estudos de Criminalidade.
	Na Polícia Militar, já assumiu cargos de comando e subcomando de unidades, como no 5º Batalhão da Polícia Militar de Coari, além de chefiar seções da Diretoria de Apoio Logístico, comandar a 3ª Companhia Independente de Polícia Militar do Rio Preto da Eva, dentre outros cargos. 
	Realizou uma verdadeira transformação na área de segurança pública no Município de Itacoatiara recentemente. O Major Castro Alves realizou projetos sociais como o Dia com a Polícia Militar, que envolve mais de 300 crianças, de 6 a 12 anos de idade, e o projeto de inclusão social da Polícia Militar, no Clube da Terceira Idade. 
	Um abraço grande ao estimado companheiro, Major Castro Alves. Receba a nossa homenagem e o nosso reconhecimento e o agradecimento sincero que tenho a fazer, em nome do povo do Estado do Amazonas.
	Homenageando o Major Castro Alves, faço referência ao Comandante da Polícia, um jovem corajoso, que tem feito da Polícia Militar uma melhoria considerável na segurança local. Eu me refiro ao Comandante David Brandão. E a homenagem que presto ao Major Castro Alves deve ser estendida àqueles oficiais que igualmente trabalham dessa maneira e com essa natureza no nosso Estado e pelo Brasil afora.
	Muitíssimo obrigado, Sra. Presidente. 
	A SRA. PRESIDENTA (Erika Kokay) - Eu queria parabenizar o Deputado Prof. Gedeão Amorim e solicitar que o seu pronunciamento possa ter repercussão no programa A Voz do Brasil e também ampla divulgação nos meios de comunicação da Casa."
2018-03-21T15:40;SAÚDE, GETÚLIO VARGAS, HOSPITAL UNIVERSITÁRIO, MANAUS (AM), QUADRO DE PESSOAL, MINISTÉRIO DA EDUCAÇÃO, PEDIDO.;BREVES COMUNICAÇÕES;"O SR. PROF. GEDEÃO AMORIM (PMDB-AM. Sem revisão do orador.) - Sr. Presidente, Sras. e Srs. Deputados, eu quero aproveitar este minuto para registrar uma visita que fiz na segunda-feira ao Hospital Universitário Getúlio Vargas, em Manaus. 
	O velho hospital universitário de Manaus, vinculado à Universidade Federal do Amazonas, deu lugar, agora, a uma nova construção, um prédio que está sendo edificado. O primeiro bloco já está concluído, com 8 andares, totalmente equipado - os equipamentos estão todos comprados -, e outro bloco ainda está em construção.
	Mesmo assim, com essa construção parcial, o Hospital Getúlio Vargas vem atendendo em média a 380 cirurgias por mês e a cerca de 7.400 pessoas todos os dias nos seus ambulatórios e tem realizado cerca de 30 mil exames por mês.
	O hospital, para funcionar plenamente, já com a sua capacidade instalada, precisa neste momento de quadro de pessoal, e é por isso que eu estou fazendo um apelo ao Ministério da Educação para que possa prover aquele hospital dessas condições.
	O Hospital Getúlio Vargas é, na verdade, uma esperança para a população do Estado do Amazonas como um todo.
	Eu quero parabenizar o seu Superintendente, Dr. Júlio Mário, e o Vice-Reitor da universidade, Dr Jacob Cohen, que nos acompanharam nesta visita.
	Muito obrigado."
2018-03-22T11:44;"MARIELLE FRANCO, EX-VEREADOR, RIO DE JANEIRO (RJ), HOMICÍDIO, ANÁLISE, HOMENAGEM PÓSTUMA.
PROFESSOR, CATEGORIA PROFESSOR, AMAZONAS, GREVE.";PELA ORDEM;"O SR. PROF. GEDEÃO AMORIM (PMDB-AM. Pela ordem. Sem revisão do orador.) - Bom dia, senhores e senhoras, Presidente, Deputados e Deputadas.
	Venho a esta tribuna hoje primeiramente para me referir ao hediondo crime praticado contra a Vereadora do Rio de Janeiro.
	Na verdade, esse evento, essa covardia de mais um crime contra as mulheres - e, desta feita, contra a Vereadora Marielle - é, para nós, a síntese de um momento de extrema gravidade. Não é o caso dela puro e simples, mas o que representa esse fenômeno diante de toda a criminalidade que ocorre no Brasil contra as mulheres. Este é o momento em que a Nação brasileira precisa fazer uma profunda reflexão.
	E, aproveitando que estamos nos preocupando com a segurança do Brasil, é preciso que cuidemos dele com mais carinho. Sei que não vamos resolver a questão da violência com repressão, mas é preciso que o Brasil comece a cuidar das suas causas estruturais: a falta de emprego, a falta de educação para as crianças e para a juventude. É preciso que o Brasil cuide das moradias das pessoas que vivem hoje nas periferias das grandes cidades. Elas são vítimas; elas praticaram o êxodo, mas não por deliberação própria, senão por força de consequência da própria vida moderna.
	Quero também me referir, Sr. Presidente, à grande mobilização dos professores do Estado do Amazonas neste momento. Na Capital, Manaus, e nos Municípios, quase todos estão paralisados.
	Eu gostaria muito de me solidarizar com todos os professores e pedir a compreensão do Exmo. Sr. Governador Amazonino, que é experiente, para que nós possamos superar essa dificuldade, porque este é mais um daqueles problemas sociais que só prejudicam a população, principalmente a classe estudantil.
	Obrigado.
	O SR. PRESIDENTE (Vinicius Carvalho) - Agradeço ao Deputado Prof. Gedeão Amorim.

PRONUNCIAMENTO ENCAMINHADO PELO ORADOR
	Sr. Presidente, Sras. e Srs. Deputados, nesta quinta-feira, milhares de professores da rede estadual de ensino do Amazonas, cerca de 10 mil, já estão reunidos em um ato pró-greve em frente à sede do Governo do Estado, motivo este que me traz hoje a esta tribuna.
	Como professor, entendo e respeito essa iniciativa dos meus nobres colegas de profissão. Sabemos da necessidade de investimentos para a educação e, consequentemente, da grande importância de valorizar essa categoria.
	De acordo com os organizadores da greve, pelo menos 160 escolas da Capital e 60 do interior do Estado já aderiram à paralisação dos educadores. 
	Segundo os meios de comunicação do Amazonas, as paralisações iniciaram com o fomento dos membros do Sindicato dos Professores e Pedagogos de Manaus (ASPROM) e do Sindicato dos Trabalhadores em Educação do Estado do Amazonas (SINTEAM). Todavia, posteriormente conquistaram a adesão natural dos educadores que não possuem ligações políticas.
	A categoria pede reajuste salarial de 35%, sendo 30% de reposição da inflação referente ao período de abril de 2014 a março de 2018 e 5% de ganho real.
	Recentemente, o Governador do Estado propôs o pagamento da data-base referente ao ano de 2017 no percentual de 4,57%; um acréscimo de R$ 200 no vale-alimentação dos docentes que estão em sala de aula, totalizando R$ 420 - atualmente o vale é de R$ 220; promoções verticais de 3.516 professores que concluíram cursos de graduação; e a extinção da taxa de 6% do vale-transporte. Contudo, a proposta foi rechaçada pelo ASPROM.
	A proposta do Governador também inclui a manutenção do plano de saúde dos professores, com a rede Hapvida, que deve ser definida pelos próprios servidores. Na prática, os próprios professores vão pagar pelo plano, quando antes o valor era pago pela SEDUC - o equivalente a R$ 5 milhões ao mês. De acordo com Amazonino, os professores do interior do Estado não eram beneficiados com o plano, uma vez que a rede hospitalar não atende nos Municípios, e, se a categoria decidir pela manutenção, ele permitirá a continuidade. Caso contrário, o Estado pagará o valor referente ao plano ao professor, e o sindicato decidirá qual plano vai seguir.
	Sabemos que ainda não há acordo entre o Governo e os professores, e obviamente, são os nossos estudantes que estão e continuarão sendo prejudicados com este impasse, uma vez que as atividades estão suspensas por tempo indeterminado.
	Registro a minha preocupação com essa situação de greve no Amazonas e espero que essa questão seja solucionada o mais breve possível. O professor é um instrumento essencial para o futuro dos nossos jovens e, consequentemente, de toda a Nação, e precisa ser valorizado pelo desenvolvimento do seu trabalho.
	Era o que tinha a dizer.
	Muito obrigado."
2018-03-26T19:20;CENTRAIS ELÉTRICAS BRASILEIRAS (ELETROBRAS), AMAZONAS, EXCLUSÃO, PRIVATIZAÇÃO, CONTRARIO.;BREVES COMUNICAÇÕES;"O SR. PROF. GEDEÃO AMORIM (PMDB-AM. Sem revisão do orador.) - Sr. Presidente, Sras. e Srs. Deputados, mais do nunca, neste momento, eu quero me referir ao sentimento do povo do Amazonas em relação ao processo de preparação para a desestatização da ELETROBRAS.
	Na semana passada, ao fim do prazo para apresentação de emendas à Comissão que está tratando dessa matéria na Casa, apresentei uma emenda no sentido de que se pudesse excluir da relação do leilão para a desestatização a ELETROBRAS Amazonas Energia, primeiro porque constatamos que há ainda necessidade de se fazer um desmembramento que convencionamos chamar aqui de desverticalização, separando a Amazonas Energia Geração da Amazonas Energia Distribuição. Esse é o trato que o Governo Federal vem dando na preparação para a desestatização propriamente dita.
	Segundo, esse sentimento de amazonenses, de amazônidas - porque a geração e distribuição não compreende apenas o Amazonas - é maior, é na Região Norte como um todo.
	Como sabemos, a Região Norte, a Região da Amazônia, é um complexo geopolítico diferenciado do restante do Brasil. Há que se distinguir que a Grande Manaus, a Região Metropolitana de Manaus está muito bem servida, está inclusive interligada ao circuito nacional de energia através do Linhão de Itaipu. O óleo diesel de seu parque de geração de termelétricas é quase todo convertido para gás natural, provido pelo Gasoduto Coari-Manaus. Portanto, há ali um mercado consolidado para a distribuição, para a privatização, para os interesses de qualquer empresa que venha, enfim, a comprar esse espólio.
	Mas, no restante do Amazonas - e o Amazonas tem 1 milhão e 500 mil quilômetros quadrados -, há pequenas comunidades, pequenos Municípios onde os parques geradores são fundamentalmente termelétricas movidas a óleo diesel. Não há, convenhamos, interesse de qualquer empresa do mundo, qualquer empresa que, mercadologicamente, possa se interessar por isso.
	O nosso sentimento é de temor por sabermos que estamos no final de um governo, de uma gestão do Governo Federal e também dos Estados, e não sabemos o que virá no futuro. Seria de bom alvitre que pudéssemos, neste momento, ultrapassar essa crise, essa dificuldade e ampliar o diálogo com as populações amazônidas, a fim de tratarmos de um planejamento mais dialogado, mais consolidado.
	Isso nos dará a segurança de que não perderemos, de que não teremos um retrocesso, com o conforto da energia elétrica fornecida pelos serviços públicos do Brasil.
	Muito obrigado, Sr. Presidente.
	O SR. PRESIDENTE (Carlos Manato) - Muito obrigado, nobre Deputado."
2018-03-28T15:08;"SEMANA SANTA, HOMENAGEM.
SEGURANÇA PÚBLICA, VIOLÊNCIA, ANÁLISE.";PEQUENO EXPEDIENTE;"O SR. PROF. GEDEÃO AMORIM (PMDB-AM. Sem revisão do orador.) - Sr. Presidente, Sras. e Srs. Deputados, hoje é quarta-feira da Semana Santa, uma semana de profundas reflexões e, segundo a doutrina cristã, tempo de renascimento, tempo de preparação para a renovação do espírito.
	No Brasil, notadamente, nós precisamos muito dessa reflexão, seja do ponto de vista coletivo, seja como uma atitude de cada brasileiro, pois cada um de nós pode contribuir para este País melhorar e para sairmos deste fosso onde nos encontramos.
	Eu quero me reportar a uma questão que tem sido batida e rebatida nesta Casa e em todos os recantos do Brasil. Todos os brasileiros, em quaisquer que sejam os lugarejos do nosso território, estão se debatendo com a violência, com o medo de conviver com as pessoas. Temos assistido a verdadeiros espetáculos de barbárie. Nós assistimos ao caso da Vereadora do Rio de Janeiro, Marielle Franco, que tomou conta de todos os nossos olhares. 
	Como se não bastasse, as coisas não refluíram, continuaram do mesmo jeito: assistimos antes de ontem ao assassinato de um casal de policiais de Santa Catarina, que estava passeando em Natal, no Rio Grande do Norte. O crime foi fruto de uma atitude desatada, absolutamente grosseira, sem nenhuma racionalidade.
	Eu fico preocupado com a atitude que tomou o Governo Federal - e nós aqui também, porque terminou que nós aprovamos a intervenção das Forças Armadas no Rio de Janeiro e estamos esperançosos que a iniciativa seja um bom começo para retomarmos a questão da segurança no Brasil. Mas não nos iludamos, pois a questão da segurança no Brasil não pode ser tratada de forma estanque, de modo que, agindo no Rio de Janeiro, resolveríamos o problema do território nacional como um todo.
	Portanto, eu quero falar para todos que nos escutam, e essa reflexão se dirige principalmente aos dirigentes dos Estados, dos Municípios, do Governo Federal. Nós temos que ter uma política de segurança nacional que coíba, de norte a sul, de leste a oeste...
	(Desligamento automático do microfone.)
	O SR. PROF. GEDEÃO AMORIM - Obrigado.
	Não é possível resolvermos o problema da segurança com intervenções pontuais e cirúrgicas. É necessário que tenhamos o olhar completo de uma política pública contundente no País como um todo.
	E eu sei, pela idade que tenho, pela experiência que tenho, todos nós Parlamentares sabemos, todas as pessoas de bom senso sabem disso: o problema da segurança não se resolve apenas com repressão. A segurança é a outra ponta: quando nós descuramos da questão da educação; quando nós descuramos da questão do emprego, das moradias, das condições humanas de vida da nossa população; quando as pessoas se sentem desgarradas, desprotegidas e sem condições de vida, resta o estado de anomia, essa brutalidade com a qual nós convivemos.
	Era a isso que eu queria me reportar...
	(Desligamento automático do microfone.)
	O SR. PROF. GEDEÃO AMORIM - Desejo uma Feliz Páscoa a todos.
	Peço que esta nossa fala possa ser transmitida pelos veículos de comunicação da Casa.
	O SR. PRESIDENTE (Onyx Lorenzoni) - Está bem, Deputado Prof. Gedeão Amorim, sua solicitação será atendida."
