dataHoraInicio;keywords;tipoDiscurso;transcricao
2018-06-05T14:24;INDIGNAÇÃO, PUBLICAÇÃO, DECRETO PRESEIDENCIAL, ALTERAÇÃO, TABELA DE INCIDÊNCIA DO IMPOSTO SOBRE PRODUTOS INDUSTRIALIZADOS (TIPI), PREJUÍZO, INDÚSTRIA, REFRIGERANTE, ZONA FRANCA DE MANAUS (ZFM).;PEQUENO EXPEDIENTE;"O SR. PROF. GEDEÃO AMORIM (MDB-AM. Sem revisão do orador.) -Sr. Presidente Carlos Manato, Sras. e Srs. Deputados, todos os que nos acompanham neste momento em todo o Brasil, boa tarde.
	Venho manifestar minha indignação com a publicação do Decreto nº 9.394, de 30 de maio de 2018, publicado pelo Presidente da República, que altera a Tabela de Incidência do Imposto sobre Produtos Industrializados - TIPI. A medida poderá causar perdas de crédito para a indústria de concentrados de refrigerantes na Zona Franca de Manaus. 
	Este é um alerta da Secretaria da Fazenda do Amazonas, por se tratar de uma medida que retira a competitividade das empresas produtoras de concentrados instaladas na Zona Franca de Manaus. 
	A ação do Governo é uma forma de compensar a dívida contraída pela União com os subsídios ofertados para a queda nos preços do óleo diesel. Isso resultou em grandes reivindicações e na paralisação dos caminhoneiros.
	O SR. PRESIDENTE (Carlos Manato) - Obrigado, Deputado.

PRONUNCIAMENTO ENCAMINHADO PELO ORADOR
	Sr. Presidente, Sras. e Srs. Deputados, venho manifestar minha indignação com a publicação do Decreto nº 9.394, de 30 de maio de 2018, publicado pela Presidência da República, que altera a Tabela de Incidência do Imposto sobre Produtos Industrializados - TIPI. A medida poderá causar perdas de crédito para a indústria de concentrados de refrigerantes na Zona Franca de Manaus (ZFM). Este é um alerta feito pela Secretaria da Fazenda do Amazonas - SEFAZ.
	""Esta medida retira a competitividade das empresas produtoras de concentrados instaladas na ZFM."" A ação do Governo é uma forma de compensar a dívida contraída pela União com o subsídio ofertado para a queda nos preços do óleo diesel, a maior reivindicação que provocou a paralisação dos caminhoneiros. Temos que nos preocupar com o desenvolvimento econômico do Amazonas e com a manutenção das indústrias e a geração de empregos no Polo Industrial - PIM.
	A decisão do Presidente faz parte do conjunto de medidas adotadas para compensar o subsidio de 9,5 bilhões de reais ao diesel, negociado com os caminhoneiros. Acontece que, para tapar a lacuna deixada pelo alto valor dos combustíveis, abre-se uma nova brecha, que impacta a economia local e nacional, já que a produção de concentrados de refrigerantes feita em Manaus abastece vários Estados brasileiros e poderá causar demissões em massa, prejudicando a indústria instalada na área da Zona Franca, que corresponde a um terço do faturamento do Polo Industrial, porque o principal incentivo da Zona Franca de Manaus - ZFM é a isenção do IPI - Imposto sobre Produtos Industrializados. Com certeza, essas empresas vão repensar se continuam investindo no Estado. 
	Ressaltamos que, não havendo mais competitividade com os outros Estados, o povo do Amazonas vai pagar a conta decorrente do privilégio da PETROBRAS, que tem primazia sobre quaisquer setores, para manter suas políticas de preços e metas de lucros.
	Diante do exposto, a bancada federal do Amazonas foi mobilizada pela governança do Estado para esboçar uma reação intransigente, a fim de não sacrificar ainda mais a indústria, o Governo e o povo do Amazonas.
	Era o que tinha a dizer. 
Muito obrigado."
2018-06-20T09:00;;FALA DO PRESIDENTE OU NO EXERCÍCIO DA PRESIDÊNCIA;"Ata da 160ª (centésima sexagésima) Sessão da Câmara dos Deputados, Não Deliberativa Solene, matutina, da 4ª Sessão Legislativa Ordinária, da 55ª Legislatura, em 20 de junho de 2018. Às 9h35, o Sr. Diego Garcia, no exercício da Presidência, nos termos do § 2º do artigo 18 do Regimento Interno, declarou aberta a sessão e deu por dispensada a leitura da ata da sessão anterior. O Sr. Presidente informou que a sessão se destinou à homenagem à Rede Pelo Bem; prestou as devidas homenagens; e convidou para compor a Mesa os Srs. João Henrique, fundador da Comunidade Aliança de Misericórdia; Roger Araújo, sacerdote, jornalista e colaborador da Comunidade Canção Nova; Tadeu Roxsander, consagrado na Comunidade Aliança Renascidos Pentecostes, co-fundador do Grupo de Oração Cenáculo Ventre Santo, professor e policial civil; Mariglauci (Thuka) Machado Wegermann, psicóloga, líder da Organização Save na Igreja Batista Capital de Brasília; Izaias de Souza Carneiro, fundador da Associação Pública de Fiéis Coração Novo e presidente da Conferência Internacional Somos Um; Maria José da Silva, Coordenadora Nacional da Rede Nacional em Defesa da Vida e da Família; e Fábio Trad, Deputado Federal. O Sr. Presidente convidou todos a ouvir o Hino Nacional. Após a exibição do vídeo institucional, o Sr. Presidente proferiu discurso do Sr. Rodrigo Maia, Presidente da Câmara dos Deputados, e concedeu a palavra aos Srs. João Henrique, Roger Araújo, Tadeu Roxsander, Mariglauci (Thuka) Machado Wegermann, Izaias de Souza Carneiro e Maria José da Silva, componentes da Mesa. Nos termos do § 2º do artigo 18 do Regimento Interno, assumiu a Presidência o Sr. Fábio Trad e concedeu a palavra ao Sr. Diego Garcia, autor do requerimento. Nos termos do § 2º do artigo 18 do Regimento Interno, assumiu a Presidência o Sr. Prof. Gedeão Amorim. Reassumiu a Presidência o Sr. Diego Garcia. Usou da palavra pela ordem o Sr. Domingos Sávio. O Sr. Presidente registrou a presença de convidados, reiterou as homenagens prestadas, agradeceu a presença de todos e, às 10h47, encerrou a sessão.

Rodrigo Maia
Presidente

Delegado Edson Moreira
Secretário

As notas taquigráficas desta Sessão Não Deliberativa Solene poderão ser solicitadas ao Departamento de Taquigrafia, Revisão e Redação - DETAQ."
2018-06-20T11:28;REGISTRO, REALIZAÇÃO, FESTIVAL FOLCLÓRICO DE PARINTINS  (2018), AMAZONAS, CONCLUSÃO, CURSO DE FORMAÇÃO, ESTUDANTE, PROGRAMA SOCIAL, PREVENÇÃO, UTILIZAÇÃO, ENTORPECENTE, ITACOATIARA (AM).;BREVES COMUNICAÇÕES;"O SR. PROF. GEDEÃO AMORIM (MDB-AM. Sem revisão do orador.) - Sr. Presidente, Sras. e Srs. Deputados, bom dia a todos. Quero desejar a todo o Brasil um dia de muita paz, especialmente à população do meu Estado, o Amazonas. Com as circunstâncias muito complicadas e tumultuadas que estamos vivendo no Brasil, sob todos os aspectos, a vida nacional anda numa grande expectativa de que possamos renovar nossas instituições a partir das eleições gerais deste ano.
	Mas eu quero em particular, neste momento, me referir a dois eventos que estão sendo realizados no Estado do Amazonas. O primeiro é o Festival de Parintins, uma festa tradicional, a maior festa da cultura do norte do Estado do Amazonas, que se realiza sempre nos últimos três dias do final do mês de junho. Neste ano, será realizada nos dias 29 e 30 de junho e 1º de julho. É uma festa fantástica, que destaca sobretudo os valores dos nossos ancestrais, a história de vida dos povos que habitaram a Amazônia em tempos mais remotos.
	Quero também dar destaque ao Programa Educacional de Resistência às Drogas e à Violência - PROERD, que é promovido e desenvolvido na Amazônia pela Polícia Militar. Na próxima terça-feira, dia 26, no Município de Itacoatiara, uma turma de aproximadamente 600 alunos na faixa de 6 a 17 anos irá se formar, sob o comando do Major Castro Alves, que tem se revelado um excelente comandante daquele batalhão, reconhecido em toda a região do Médio Amazonas.
	Portanto, queria fazer esses registros. Peço ao Exmo. Sr. Presidente que os faça ser divulgados nos meios de comunicação da Casa.
	O SR. PRESIDENTE (Chico Lopes) - Solicito que o referido discurso seja divulgado nos meios de comunicação da Casa.

PRONUNCIAMENTO ENCAMINHADO ORADOR
	Sr. Presidente, Sras. e Srs. Deputados, nos próximos dias o meu Estado, o Amazonas, vai ser palco de um dos maiores eventos folclóricos brasileiros: o Festival de Parintins, que todos os anos reúne milhares de pessoas na Ilha Tupinambarana, a 420 quilômetros de Manaus, durante três noites, para que assistam à disputa entre os blocos do Boi Garantido e do Boi Caprichoso.
	A festa acontece sempre no último final de semana de junho, mas os preparativos começam meses antes, com a produção das alegorias e das fantasias, a escolha das músicas, os ensaios. As alegorias e fantasias funcionam como figurinos e cenários de uma peça teatral, pois cada apresentação dos blocos conta uma história ligada ao folclore e à cultura da Amazônia.
	Os dois bois dançam e cantam por um período de 2 horas e meia a cada noite, alternando-se na primazia de entrada na arena. Ao longo das 3 noites cada agremiação apresenta em torno de 20 toadas, como são chamadas as músicas. Parte delas é escolhida em concursos disputadíssimos realizados ao longo de todo o ano - já houve certames com a marca de 250 toadas inscritas.
	Sr. Presidente, nobres Colegas, o Festival Folclórico de Parintins é uma festa muito antiga, que acontece desde 1966. Ela só virou uma atração turística de grandes proporções, no entanto, quando passou a ser transmitida pela televisão, a partir de meados da década de 1990.
	A primeira emissora a comprar os direitos de transmissão do festival, em 1994, foi a TV Amazonas, então afiliada da Rede Globo. Em 2008, aconteceu a primeira transmissão nacional, pela TV Bandeirantes, e em 2012 a emissora paulista exibiu o evento a 130 países, por meio de seu canal internacional.
	Graças à divulgação televisiva, o interesse pelo Festival de Parintins extrapolou as fronteiras do Amazonas e hoje atrai turistas do mundo inteiro. A cada noite, cerca de 35 mil pessoas lotam o Bumbódromo para assistir à festa e torcer por um dos blocos. As duas torcidas se sentam em locais separados e se mantêm no mais absoluto silêncio durante a apresentação do bloco adversário.
	Senhoras e senhores, o Festival Folclórico de Parintins é a maior vitrine da cultura amazonense e só perde, em magnitude, para o carnaval da Marquês de Sapucaí. Ao longo das 3 noites de duração da festa, graças à sua riqueza musical e cenográfica, é possível conhecer um pouco mais sobre a vigorosa mescla cultural resultante do convívio entre as comunidades indígenas e os povos ribeirinhos da Amazônia.
	Quero, pois, saudar os participantes desta festa extraordinária. E aproveito a oportunidade para convidar todos os nobres colegas Deputados a irem um dia a Parintins assistir à disputa entre o Boi Caprichoso e o Boi Garantido. Tenho a certeza de que os senhores e as senhoras voltarão muito impressionados com a grandeza, a beleza e a riqueza do Festival de Parintins.
	Obrigado."
2018-06-25T16:40;LEI ANTIDROGAS (2006), ALTERAÇÃO.;BREVES COMUNICAÇÕES;"O SR. PROF. GEDEÃO AMORIM (MDB-AM. Sem revisão do orador.) - Sr. Presidente, Sras. Deputadas e Srs. Deputados, população do Brasil de um modo geral, espero que nossas festas estejam acontecendo da melhor maneira por todo o nosso território.
	Venho a esta tribuna apresentar um projeto de lei que altera a Lei nº 11.343, de agosto de 2006, e trata de medidas preventivas ao uso das drogas.
	Como é sabido, nós, no Brasil, temos convivido com bastante violência, que envolve a juventude, sobretudo, no uso, na comercialização e no tráfico de drogas.
	Por isso, essa proposta pretende ser mais um instrumento pedagógico para fazer a prevenção, uma espécie de chamamento, uma rearticulação, um resgate na verdade, da instituição escola, família, comunidade, com outros órgãos de Estado. Não podemos deixar de lado os profissionais da saúde. Não podemos deixar de lado entidades religiosas, igrejas, organismos sociais voluntários existentes no Brasil.
	Portanto, essa proposta de lei tem essa finalidade, para que, nessa alteração, com os projetos pedagógicos, possa haver a prevenção, com o desenvolvimento de inclusão da família e da comunidade na escola.
	É preciso que nos aproximemos. A escola não pode ser uma ilha na sociedade, a quem creditamos a possibilidade de salvar toda a nossa juventude.
	É necessário fazer a integração das ações dos órgãos e entidades públicas e privadas na área da saúde, com temas sobre sexualidade, planejamento familiar, educação, trabalho, assistência social, Previdência Social, habitação, cultura, desporto e lazer; promover uma ampla participação social na sua formulação. Não é possível que esta temática seja tratada isoladamente, sobretudo, neste momento em que parece que a família brasileira se desestruturou muito, principalmente nas camadas sociais menos abastadas e menos esclarecidas.
	Além disso, é preciso desenvolver a capacitação de profissionais de educação para a prevenção do uso de drogas; habilitar professores e profissionais da saúde a identificar sinais relativos à ingestão abusiva de álcool e outras drogas no seu devido encaminhamento; valorizar as parcerias com instituições religiosas, associações e organizações não governamentais para o planejamento e a execução de campanhas de prevenção.
	E, finalmente, é necessário fazer as avaliações periódicas, a fim de que possamos aferir o progresso, a fim de que possamos avaliar o desempenho dessas ações, estabelecendo novas metas no caminho do aperfeiçoamento, no caminho de restabelecimento da família nacional."
2018-06-25T17:00;"FOLCLORE, FESTA POPULAR, PARINTINS (AM), REALIZAÇÃO.
JOSÉ AZEVEDO, EX-EMPRESÁRIO, HOMENAGEM PÓSTUMA.";PELA ORDEM;"O SR. PROF. GEDEÃO AMORIM (MDB-AM. Pela ordem. Sem revisão do orador.) - Sr. Presidente, Sras. e Srs. Deputados, ao voltar a esta tribuna, queria aproveitar a oportunidade para dar conhecimento ao Brasil inteiro e a quem nos acompanha através da TV Câmara do espetáculo cultural que acontece neste fim de semana no Município de Parintins, no Amazonas. Trata-se de uma verdadeira ópera, uma festa fantástica, a maior organização de festa cultural da nossa região.
	Mas trago, em contraponto, uma notícia um tanto quanto triste. Cada vez, meus senhores, que nós perdemos um homem ou uma mulher de relevância em nosso País, em qualquer que seja o lugar, em qualquer Município ou Estado, o Brasil perde muito. E nós temos hoje o dever de comunicar o nosso pesar e a nossa solidariedade pela perda do Comendador José Azevedo, empresário, português de nascimento, que veio para o Brasil ainda muito novo e se tornou um amazonense desses ilustres, um brasileiro de alma grande. Nós o perdemos no sábado passado, aos 80 anos de idade.
	O Dr. José Azevedo, Comendador, título que lhe foi outorgado pelo seu país de nascimento, era um empresário bem-sucedido, um homem de trabalho. Ainda com essa idade, há poucos dias estivemos com ele, porque ele não faltava aos grandes eventos sociais do nosso Estado, da nossa Capital.
	Sua empresa, o grupo TV Lar, atuava nos ramos de eletrodomésticos, móveis, telefonia, imagem, som, informática, motocicletas, motores náuticos e materiais de construção. O Dr. José Azevedo deixou uma cadeia de 42 lojas, com cerca de 3 mil empregos gerados diretamente no Amazonas.
	Nós registramos o nosso sentimento de pesar pela perda do estimado José Azevedo, querido por todos nós do Amazonas, e nossa solidariedade principalmente à esposa dele, D. Zuila Azevedo, e aos quatro filhos, que irão agora continuar a tocar os negócios tão bem-sucedidos que ele desenvolveu no Estado."
2018-07-03T14:48;"PROF. GEDEÃO AMORIM, DEPUTADO FEDERAL, PARTICIPAÇÃO, COMITIVA, AMAZONINO MENDES, GOVERNADOR, AMAZONAS, VISITA, URUCARÁ (AM), NHAMUNDÁ (AM), PARINTINS (AM). 
URGÊNCIA, APRECIAÇÃO, PLP 137/2015, PROJETO DE LEI COMPLEMENTAR, EMANCIPAÇÃO, MUNICÍPIO.";BREVES COMUNICAÇÕES;"O SR. PROF. GEDEÃO AMORIM (MDB-AM. Sem revisão do orador.) - Sr. Presidente, Sras. e Srs. Deputados, neste fim de semana estive acompanhando a comitiva do Sr. Governador Amazonino Mendes, do Amazonas, a três Municípios no Baixo Amazonas. 
No primeiro, Urucará, nós inauguramos um centro de educação de tempo integral, com uma arquitetura moderna, no meio do Amazonas. Em seguida, nós fomos a Nhamundá fazer um convênio com o Prefeito para recapeamento viário da cidade. Nós também inauguramos a nova sede do IPAAM, o Instituto de Proteção Ambiental do Amazonas.
Depois, nós participamos da primeira noite do Festival Folclórico de Parintins, um espetáculo fantástico. Cerca de 100 mil pessoas prestigiaram a festa. Lá o nosso grande embate é entre dois bois, o Caprichoso e o Garantido. O resultado final foi a vitória do Boi Garantido de Parintins.
	Eu gostaria de pedir à Mesa toda a atenção, para que pudéssemos dar consecução ao Projeto de Lei Complementar nº 137, de 2015. Há muito tempo estamos recebendo visitas de comissões do Brasil inteiro clamando pela emancipação de algumas comunidades, e esta Câmara ainda não conseguiu colocar a matéria em pauta em definitivo. Eu gostaria que ela fosse colocada em pauta com a maior brevidade possível."
2018-07-03T15:44;"VACINAÇÃO, EFICIÊNCIA, RELEVÂNCIA, SAÚDE PÚBLICA, POLIOMIELITE, VACINA, VACINAÇÃO, REDUÇÃO, PREOCUPAÇÃO.
REGIÃO NORTE, VACINAÇÃO, DIFICULDADE, OPERAÇÃO GOTA, CONTRA, SARAMPO.";PELA ORDEM;"O SR. PROF. GEDEÃO AMORIM (MDB-AM. Pela ordem. Sem revisão do orador.) - Sr. Presidente, subo a esta tribuna para falar sobre um dos problemas mais pertinentes do Brasil.
	A imunização é uma das mais bem-sucedidas e eficientes intervenções de saúde pública, segundo a Organização Mundial de Saúde.
	O procedimento previne anualmente entre 2 e 3 milhões de mortes por difteria, tétano, coqueluche e sarampo. E poderia evitar a morte de mais 1,5 milhão com a aplicação da cobertura mundial de imunização.
	A política pública de imunização existe no Brasil, de forma abrangente, estruturada e nacional, desde 1973, com o desenvolvimento do Programa Nacional de Imunizações - PNI, que tem uma história exitosa. Se, no início, eram quatro as vacinas oferecidas, hoje estão disponíveis 44 imunobiológicos em 35 mil postos de vacinação em todo o território nacional.
	É preciso, contudo, persistir e avançar no programa de imunização brasileiro. Vejamos o caso da poliomielite, cujas primeiras vacinas chegaram até nós já na década de 50. A partir do investimento, da priorização e do planejamento de um programa nacional de vacinação, pôde ser erradicada do território nacional, sendo o último caso registrado em 1989. Nada obstante, desde 2007, assistimos a uma tendência de queda no número de vacinas contra a pólio. Em 2016, a taxa de vacinação, de 84%, foi a menor em 12 anos.
	Lembremos o sarampo em Pernambuco e no Ceará nos anos de 2013 e 2014. Após 1 década de elevados índices de vacinação, houve, em 2013, um forte declínio. No mesmo ano, teve início um surto de sarampo, com mais de 2 mil casos da doença confirmados nos dois Estados. Desde 2000, não ocorria um episódio de sarampo autóctone no Brasil. Menciono esses dados para sublinhar a importância de manter forte a política de imunização entre nós, com amplas campanhas de divulgação para a população.
	Eu gostaria de direcionar o discurso para o Norte, que apresenta grandes desafios para uma efetiva política de vacinação. Com efeito, a região, com área de quase 4 milhões de quilômetros quadrados, que corresponde a 45% do território nacional, e extensa cobertura florestal, possui populações que vivem em áreas remotas, isoladas, com acesso muito difícil.
	Para cumprir a difícil tarefa de imunizar essas áreas, foi criada a Operação Gota em 1993, suscitada por um surto de sarampo em populações indígenas das regiões do Purus, Juruá e Solimões.
	Hoje, a Operação Gota, executada mediante parceria entre os Ministérios da Saúde e da Defesa e os Estados e Municípios envolvidos, é uma ação permanente e imprescindível para a saúde dessas populações. Em 2018, cerca de 12.500 doses de vacinas serão aplicadas em 785 localidades dos Estados de Amazonas, Acre, Amapá e Pará.
	No Amazonas, serão 485 localidades atendidas nos Municípios de São Gabriel da Cachoeira, Barcelos, Santa Isabel do Rio Negro, Eirunepé, Carauari, Tefé, Lábrea, Boca do Acre e Pauini.
	Assim, Sr. Presidente, eu gostaria de cumprimentar todos os envolvidos na Operação Gota pelo excelente serviço que prestam à saúde dos nossos irmãos brasileiros residentes nos locais remotos do Norte do País.
	Quero encerrar, reiterando a importância da imunização para o combate de doenças e alertando as autoridades da área de saúde no Brasil, especialmente o Ministério da Saúde, para que não se descuidem, não baixem a guarda. Devemos elevar as taxas de vacinação entre nós, a fim de proteger a saúde do nosso povo.
	Era o que tinha a dizer.
	Sr. Presidente, solicito que este discurso seja transmitido pelo programa A Voz do Brasil.
	O SR. PRESIDENTE (JHC) - O pedido de V.Exa. será atendido."
2018-08-07T14:40;PLP 137/2015, PROJETO DE LEI COMPLEMENTAR, PROCEDIMENTO, CRIAÇÃO, INCORPORAÇÃO, FUSÃO, DESMEMBRAMENTO, MUNICÍPIO, TEMA, APROVAÇÃO, DEFESA.;BREVES COMUNICAÇÕES;"O SR. PROF. GEDEÃO AMORIM (MDB-AM. Sem revisão do orador.) - Sr. Presidente, Sras. e Srs. Deputados, boa tarde!
	Decidido esse período das composições, das coligações para as chapas de Presidente, para as chapas de Governadores e suas coligações parlamentares, entramos numa nova fase. Sei que será um momento muito importante para o Brasil, e a Nação brasileira, depois de tanto sofrimento, depois de crise tão profunda, saberá expressar o seu voto de escolha para os principais dirigentes do País.
	Nesta oportunidade - e sei que as circunstâncias não são muito oportunas - quero trazer uma demanda especial do meu Estado, sobretudo dos dirigentes da Federação das Associações de Desenvolvimento Distrital Emancipalista do Amazonas - FADDEAM, responsáveis pelo movimento de emancipação de determinados distritos, que há muito vêm nesta Casa correndo com o processo da Projeto de Lei Complementar nº 137, de 2015. Até agora não conseguimos votá-lo.
	Eu não posso deixar de fazer este registro, porque sei que é muito importante. Sei que há aspirações talvez não muito viáveis para todos que estão inscritos e pleiteando, mas é necessário que esta Casa dê resposta. É necessário que o Congresso Nacional, começando pela Câmara dos Deputados, faça o seu papel e delegue os poderes às Assembleias Estaduais. E que eles sigam os critérios que serão emanados daqui.
	Na verdade, há muita gente falando que isso vai onerar o serviço público, etc. Se for sem critérios, onera. Contudo, se for criteriosamente bem organizado, nós teremos um grande crescimento pelo Brasil afora, principalmente no Amazonas, onde, de um Município para outro, muitas vezes distam muitos quilômetros. As pessoas ficam isoladas naquele grande espaço amazônico!
	Muito obrigado.
	Peço a V.Exa. que registre o meu pronunciamento no programa A Voz do Brasil.
	O SR. PRESIDENTE (Pedro Uczai) - Que se dê publicidade, no programa A Voz do Brasil, do pronunciamento do Deputado Prof. Gedeão Amorim."
2018-09-04T10:46;INCENDIO, MUSEU NACIONAL (BRASIL), RIO DE JANEIRO (RJ).;BREVES COMUNICAÇÕES;"O SR. PROF. GEDEÃO AMORIM (MDB - AM. Sem revisão do orador.) - Sr. Presidente, Srs. Deputados, Sras. Deputadas, bom dia a todos. Saúdo a população brasileira, em especial o povo do Amazonas, Estado do qual faço parte e que represento como Deputado.
Eu quero lamentar profundamente o que aconteceu com o Museu Nacional, no Rio de Janeiro. Na verdade, foi um descaso do serviço público do Brasil com a nossa memória, com aquilo que há de mais importante, com as raízes da nossa história. É inadmissível que isso possa estar acontecendo pelo descaso com a manutenção dos nossos museus, e serve de alerta.
Aliás, tem sido assim: toda vez que acontece um grande sinistro, nós vamos dar atenção a determinado setor. Eu espero que, desta vez, possamos cuidar dos demais museus e da cultura do Brasil, de modo geral.
Quero também aproveitar a oportunidade para lamentar por muitos projetos que não passaram por esta Casa, como foi o caso do projeto da emancipação dos Municípios e de algumas coisas relacionadas à privatização da ELETROBRAS, à qual somos absolutamente contrários neste momento.
Um abraço a todos.
Muito bom dia."
