dataHoraInicio;keywords;tipoDiscurso;transcricao
2018-02-06T15:32;PROF. GEDEÃO AMORIM, DEPUTADO FEDERAL, ATUAÇÃO PARLAMENTAR, EDUCAÇÃO, BALANÇO.;PEQUENO EXPEDIENTE;"O SR. PROF. GEDEÃO AMORIM (PMDB-AM. Sem revisão do orador.) - Sr. Presidente, muito boa tarde.
	Boa tarde, Sras. Deputadas e Srs. Deputados. 
Como já foi anunciando, eu cheguei hoje a esta Casa para substituir o Deputado Sabino Castelo Branco, que ainda se encontra enfermo e ao qual desejo pronto restabelecimento.
	Eu não poderia começar as minhas entranças e saídas aqui sem me apresentar. Sou um velho professor, com 40 anos de trabalho na educação pública do Estado do Amazonas. Sou professor aposentado da Universidade Federal do Amazonas. Tenho larga experiência na gestão pública. Entre os tantos empreendimentos que realizei pelo Estado, fui Secretário de Educação durante 7 anos, no período em que nós conseguimos deslocar o Amazonas da 26ª posição no IDEB - Índice de Desenvolvimento da Educação Básica para o 8º lugar entre as escolas pública do Brasil. Também na condição de Secretário de Educação, tive a oportunidade de promover um case mundial, ao criar um centro de mídias, através de satélite, para oferecer educação básica nos lugares mais distantes do Amazonas.
	Tive a oportunidade de melhorar a nossa educação com planejamento, com qualidade, de promover incentivos para a obtenção de méritos, como o 14º, às vezes o 15º e até o 16º salários para cada educador, para cada profissional da educação que atingisse determinado índice. Isso foi um grande avanço no Amazonas.
	Hoje, depois de ter exercido outras funções na FUNASA - Fundação Nacional de Saúde, como dirigente de hospital etc., sou Vereador da cidade de Manaus. Mas, nesta condição de suplente, tive que vir para cá, para usufruir desta nova experiência, do convívio das senhoras e dos senhores.
Trago uma série de preocupações, daquelas que todos nós políticos do Estado temos, com os nossos déficits históricos de infraestrutura, serviços públicos, educação básica, saúde, de desenvolvimento propriamente dito, sobretudo com a subtração dos incentivos, com as dificuldades que temos, neste momento de crise na economia, no Distrito Industrial de Manaus. 
Trago também uma imensa capacidade de contribuir com o debate, para fazer com que o Amazonas possa se integrar de vez ao Brasil.
	O SR. PRESIDENTE (Pedro Uczai) - Obrigado, Deputado.

PRONUNCIAMENTO ENCAMINHADO PELO ORADOR
	Sr. Presidente, Sras. e Srs. Deputados, é com muita honra que eu subo hoje a esta tribuna para fazer o meu primeiro discurso como Deputado Federal pelo Amazonas. 
De início, quero expressar a minha gratidão por estar aqui hoje, representando cada cidadão amazonense. Destaco que não medirei esforços para lograr grandes resultados para o Amazonas e para todo o País no desenvolvimento do meu trabalho nesta Casa. Pretendo usar a minha experiência de mais de 30 anos na gestão pública para efetivar esse trabalho. 
Para os que ainda não me conhecem, sou professor, formado em Filosofia, especializado em Antropologia Amazônica pela Universidade Federal do Amazonas (UFAM) e Mestre em Administração, na área de Políticas e Gestão Institucional, pela Universidade Federal de Santa Catarina.
Minha principal área de atuação é a educação, que inclusive considero fator principal para o avanço do País. Durante 7 anos fui Secretário da SEDUC (Secretaria de Educação) do Amazonas, no período de 2005 a 2012. Na minha gestão, consegui elevar a posição do Amazonas no Índice de Desenvolvimento da Educação Básica (IDEB), do 26º lugar para o 8º lugar, e logrei colocar o meu Estado em 3º lugar no ranking de melhor rendimento salarial do professor, com o valor de R$ 2.440,00 para um regime de 40 horas semanais. Também fui o autor do projeto Centro de Mídias de Educação do Amazonas, desenvolvido atualmente pelo Governo do Estado. Implantei ainda o 14º, o 15º e o 16º salários para os professores que conseguissem destaque em suas áreas.
No período de 1993 a 1997, estive na direção do Instituto de Ciências Humanas e Letras (ICHL) da Universidade Federal do Amazonas (UFAM), no qual também criei o Programa Especial de Formação Docente (PEFD-UFAM). De 1997 a 2001, exerci a função de pró-reitor de extensão e viabilizei essa mesma proposta na Universidade do Estado do Amazonas (UEA) com o Programa de Formação e Valorização de Profissionais da Educação (Proformar - UEA), cuja ação graduou mais de 16 mil professores da educação em nível superior.
Também atuei em outra área extremamente relevante: a saúde pública. 
Assumi o cargo de Diretor do Hospital Universitário Francisca Mendes, em 1998 e concretizei ações de modernização do hospital e a implantação de um projeto de humanização no atendimento aos pacientes.
Nos anos de 2013 a 2014, comandei a Fundação Nacional de Saúde (FUNASA). Nos 7 meses à frente da FUNASA/AM, visitei 55 Municípios. Levamos assessoria técnica para a elaboração de projetos de saneamento básico para essas cidades e também dobramos a adesão de Municípios ao Programa de Aceleração do Crescimento na segunda etapa (PAC 2).
Em 2014 fui agraciado com 62.999 votos para o cargo de Deputado Federal pelo Amazonas. Em 2016, fui eleito Vereador pela cidade de Manaus.
E agora, neste Parlamento, quero destacar as prioridades durante a minha atuação como representante do meu Estado. Afirmo que vou trabalhar intensamente na defesa da Zona Franca de Manaus, que é o nosso Polo Industrial. 
Também pleitearei recursos para projetos de saneamento básico no Amazonas, pois somente 22% da nossa Capital, Manaus, têm saneamento básico. E isso é na teoria, porque na prática não enxergamos essa realidade. Se na capital é assim, imaginem como é no interior do Estado. Não podemos aceitar que essa situação continue como está. 
Também irei trabalhar pela concretização da BR-319, que liga Manaus a Porto Velho. 
Como já mencionei anteriormente, a minha principal bandeira é a educação. Com a implantação do Novo Ensino Médio, quero cobrar o investimento na formação permanente dos professores e o investimento em equipamentos, para que os alunos possam ter uma escola de qualidade. Na educação infantil, precisamos reavaliar o valor do repasse do FUNDEB para o custeio das creches. Também lutarei pela ampliação das escolas de tempo integral.
Posteriormente abordarei de forma minuciosa o desenvolvimento do meu trabalho nesta Casa. Muito obrigado, nobres Deputados, pela atenção. 
Agradeço, principalmente, ao povo amazonense pela grande oportunidade de representá-lo no Congresso Nacional. Eu me comprometo a continuar agindo com honestidade e honradez. Conte com este Deputado para lutar por você nesta Casa. 
Era o que tinha a dizer.
Muito obrigado."
2018-02-07T12:52;REESTRUTURAÇÃO, ESTADO BRASILEIRO.;BREVES COMUNICAÇÕES;"O SR. PROF. GEDEÃO AMORIM (PMDB-AM. Sem revisão do orador.) - Bom dia a todos os presentes. Sr. Presidente, Sras. e Srs. Deputados, chegando agora a esta Casa, trago uma imensa preocupação com a arquitetura do Estado brasileiro.
	Na verdade, parece que nós perdemos a unidade de Estado. Segundo a teoria de Thomas Hobbes, se não cuidarmos do Estado politicamente e permanecermos no estado de natureza, o homem vira o lobo do próprio homem. Parece que nós retrocedemos, parece que o Estado brasileiro voltou da modernidade e caiu nos tempos bárbaros.
	Por isso, acho que nós temos necessidade de reestruturar o nosso Estado, o Estado nacional. Nós temos trabalhado muito no varejo, muito nos fragmentos, temos cuidado de ilhas de preocupações.
	Quase todos os Parlamentares que vêm a esta tribuna se referem à questão da insegurança dando o exemplo do Rio de Janeiro, mas o problema não é apenas esse. O Rio de Janeiro é a grande emblemática, mas em todo o País, inclusive nos pequenos Municípios, as pessoas convivem com altos índices de criminalidade, de violência e de barbaridade.
	Penso que há um grande equívoco em cuidarmos apenas da questão da criminalidade, fazendo grandes investimentos em penitenciárias, em custeio de policiamento, etc., e não cuidarmos da outra ponta. A outra ponta da criminalidade é questão da estrutura do Estado, das condições básicas de organização da população, do seu povo.
	Eu penso que nós temos políticas públicas indispensáveis a serem tratadas. Não é possível que, no século XXI, não cuidemos bem das crianças, não tenhamos educação básica.
	O SR. PRESIDENTE (Delegado Edson Moreira) - Obrigado, Prof. Gedeão Amorim."
2018-02-21T18:48;AMAZONAS DISTRIBUIDORA DE ENERGIA, CENTRAIS ELÉTRICAS BRASILEIRAS (ELETROBRAS), DEMISSÃO, MICHEL TEMER, PRESIDENTE DA REPÚBLICA, GOVERNO FEDERAL, DECISÃO, REVISÃO, NECESSIDADE.;PELA ORDEM;"O SR. PROF. GEDEÃO AMORIM (PMDB-AM. Pela ordem. Sem revisão do orador.) - Sr. Presidente, trago uma manifestação de desagrado do povo amazonense, especialmente dos trabalhadores da ELETROBRAS Amazonas Energia, que acabou de receber um aviso do seu presidente de que haverá demissão em massa dos funcionários daquela companhia.
	Penso sinceramente que este não é o momento para se tratar disso dessa maneira, levando-se em consideração os altos índices de desemprego que já assolam o Brasil inteiro. Em Manaus e no Amazonas não é diferente. Serão colocados na rua cerca de 700 servidores - alguns trabalham na empresa há 25, 30 anos - e estes ficarão sem oportunidade de trabalho.
	Penso que o Governo tem que repensar essas medidas, a fim de evitar que engrossemos muito mais as dificuldades das famílias e das comunidades do Brasil e do Amazonas em particular."
2018-02-27T17:00;"DEMISSÃO, PRIVATIZAÇÃO, DESESTATIZAÇÃO, CENTRAIS ELÉTRICAS BRASILEIRAS (ELETROBRAS), AMAZONAS, CRÍTICA.
COMBUSTÍVEL, PREÇO, PETRÓLEO BRASILEIRO (PETROBRAS), ANÁLISE.";PELA ORDEM;"O SR. PROF. GEDEÃO AMORIM (PMDB-AM. Pela ordem. Sem revisão do orador.) - Sr. Presidente, Sras. e Srs. Deputados, novamente volto a falar sobre certo terrorismo que está sendo praticado pela Eletrobras Distribuição Amazonas. 
	Estão tratando da privatização da ELETROBRAS, mas, antes que isso aconteça, já estão antecipando avisos para dispensar os trabalhadores. Profissionais especializados que trabalham há cerca de 30 anos, agora com idade entre 40 e 50 anos, estão sendo informados de que serão demitidos.
	Penso que especialmente o setor público tem que ser um pouco mais responsável. Não se pode expor cerca de 700 profissionais e suas famílias a esta condição de desemprego e absoluta ausência de expectativa, para continuar a vida profissional.
	De outro lado, quero chamar a atenção para aquilo que tantos companheiros já lembraram neste plenário. Refiro-me à flutuação de preço dos combustíveis. Nós sabemos que o custo operacional da produção de combustíveis varia entre 28% e 50%. Nós entramos nesta política de correção e temos agora uma verdadeira instabilidade: nós não sabemos qual será o preço da gasolina ou do óleo diesel amanhã. Isso não é algo isolado.
	O SR. PRESIDENTE (Luiz Couto) - Deputado, temos um orador na tribuna que tem preferência. V.Exa. já extrapolou o tempo que lhe foi concedido. Caso queira falar no período das breves comunicações, terá 3 minutos.
	
PRONUNCIAMENTO ENCAMINHADO PELO ORADOR
	Sr. Presidente, Sras. e Srs. Deputados, venho a esta tribuna tratar das razões pelas quais os combustíveis automotivos são tão caros no Brasil e sugerir medidas que possam concorrer para a redução dos preços destes produtos.
	Antes de mais nada, é preciso esclarecer que são livres, há bastante tempo, os preços das seguintes parcelas integrantes dos preços ao consumidor de combustíveis: preço de faturamento de gasolina e óleo biodiesel nas refinarias; preço nas unidades produtoras de álcool etílico combustível e de biodiesel; fretes; margens de distribuição e de revenda.
	Não se pode perder de vista, outrossim, que a gasolina comercializada no Brasil é, na realidade, uma mistura de 73% de gasolina pura (a denominada gasolina A) e 27% de álcool etílico anidrocombustível, em razão de comando legal e de resolução do Conselho Interministerial do Açúcar e do Álcool - CIMA. 
Analogamente, o diesel comercializado em nosso País é uma mistura de diesel mineral e biodiesel, sendo o percentual obrigatório de adição desse componente ao óleo diesel igual a 8%, também por força de lei.
	É necessário ter em conta, ainda, que os preços de faturamento da gasolina e do óleo diesel nas refinarias respondem por 28% e 50% do preço médio ao consumidor nas principais capitais, respectivamente. Ademais, não se pode olvidar que é a tributação que responde pela maior parcela dos preços desses combustíveis, a saber: 45% no caso da gasolina e 30% no caso do diesel. Isto mesmo, Sr. Presidente, quase metade do preço da gasolina refere-se a tributos, com destaque para o ICMS, de competência estadual.
	Então, pode-se concluir que não há como atribuir os aumentos verificados nos preços nos postos revendedores exclusivamente à nova política de preços desses derivados de petróleo da PETROBRAS. 
	A propósito, registre-se que esta política, introduzida em outubro de 2016, considera os seguintes fatores: preço de paridade internacional do combustível; margem de remuneração dos riscos inerentes à operação e nível de participação da PETROBRAS no mercado interno. 
Em julho de 2017, a PETROBRAS informou revisão de sua política de preços de gasolina e óleo diesel, com o objetivo de aumentar a frequência dos ajustes, de sorte a melhor acompanhar a variação da taxa de câmbio e as cotações dos derivados de petróleo.
	Para combater os reajustes excessivos dos combustíveis automotivos em algumas localidades, é preciso resistir à tentação de soluções ilusórias. O retorno do controle de preços é um exemplo. A experiência mostra que existe grande assimetria de informações entre os agentes econômicos e o Governo, o que acaba, mais cedo ou mais tarde, por gerar contencioso judicial, com invariável prejuízo para o Erário e para os consumidores.
	Ademais, o tabelamento de preços não se afigura conveniente para um País que busca atrair novos investidores para incrementar sua produção de petróleo e gás natural, bem como sua capacidade de refino de petróleo.
	A solução definitiva para o problema dos elevados preços de combustíveis automotivos em várias cidades vai demandar certo tempo e passa pela adoção de algumas ou todas as seguintes medidas: aprimoramento dos mecanismos de repressão a cartéis e outras formas de restrição à livre concorrência; estabelecimento de punições mais rigorosas para condutas anticompetitivas por parte de agentes econômicos; revisão da regulamentação do setor de combustíveis, com o objetivo de introduzir mais concorrência na comercialização de combustíveis; redução da carga tributária. Naturalmente, isso deve ser feito de forma gradual e compatível com a situação fiscal da União e dos Estados. 
	Assim procedendo, fiquem certos, Sras. e Srs. Deputados, de que estaremos dando expressiva contribuição para a redução dos preços dos combustíveis e para a expansão da infraestrutura do setor energético nacional e, por via de consequência, para o desenvolvimento do Brasil. 
Muito obrigado."
2018-02-28T12:04;ANIVERSÁRIO DE FUNDAÇÃO, ZONA FRANCA DE MANAUS (ZFM).;PELA ORDEM;"O SR. PROF. GEDEÃO AMORIM (Bloco/PMDB-AM. Pela ordem. Sem revisão do orador.) - Sr. Presidente, Srs. Deputados e Deputadas, hoje é um dia muito importante para os amazônidas e especialmente para os amazonenses, porque estamos comemorando 51 anos de criação da Zona Franca de Manaus.
	Quando foi criado aquele projeto, o Norte do Brasil era uma região totalmente isolada do País, e a Zona Franca de Manaus tem sido a mola propulsora de desenvolvimento daquela região.
	É verdade que passamos por alguns momentos de dificuldade, sobretudo com a crise da economia, mas ainda alimentamos mais de 80 mil empregos diretos e quase 500 mil empregos indiretos.
	Hoje, sob nova gestão, agora tendo o Dr. Apio Tolentino como Superintendente, a Zona Franca de Manaus, através da SUFRAMA, vem desenvolvendo atividades em todos os Estados da Região Norte na sua área de influência.
	Sr. Presidente, eu queria fazer esse registro nos Anais da Casa para dizer da importância da Zona Franca de Manaus não só para a sua região como para todo o Brasil. Ela é um fator de integração e de desenvolvimento nacional."
2018-02-28T19:28;"ZONA FRANCA DE MANAUS (ZFM), AMAZONAS, ANIVERSÁRIO DE FUNDAÇÃO, HOMENAGEM. 
SUPERINTENDÊNCIA DA ZONA FRANCA DE MANAUS (SUFRAMA), ATUAÇÃO, ELOGIO, VALORIZAÇÃO, DEFESA.";DISCURSO ENCAMINHADO;"PRONUNCIAMENTO ENCAMINHADO À MESA PARA PUBLICAÇÃO

	O SR. PROF. GEDEÃO AMORIM (Bloco/PMDB-AM. Pronunciamento encaminhado pelo orador.) - Sr. Presidente, Sras. e Srs. Deputados, hoje o motivo que me traz a esta tribuna é de extrema importância não somente para o Amazonas, mas também para todo o Brasil: o aniversário de 51 anos da nossa Zona Franca de Manaus, da sua criação e implantação no Amazonas. 
	A SUFRAMA é a mais bem-sucedida estratégia de desenvolvimento regional do País, com números expressivos de movimentação econômica, que abrange diversos Estados, além do Amazonas, atuando também no Acre, em Roraima, no Amapá e em Rondônia. 
	Prezados, hoje, em especial, peço a atenção de todos os senhores, porque lamentavelmente nossa Zona Franca de Manaus vem sofrendo constantes ataques, nesta Casa e no Governo Federal. 
	A SUFRAMA deve ser respeitada, valorizada e reconhecida não somente pelos manauaras, como também por todo o País, já que contribui de forma grandiosa: é o terceiro maior PIB do Brasil, com 17,1% para a economia nacional, ficando atrás somente dos Estados de São Paulo (17,5%) e Espírito Santo (17,5%). 
	Só o nosso Polo Industrial de Manaus (PIM) gera mais de 500 mil empregos diretos e indiretos, através de mais de 600 indústrias instaladas na região, oferecendo incentivos fiscais e administrativos, principalmente nos segmentos de eletroeletrônicos, duas rodas e químicas. 
	Para aclarar ainda mais, sobre a relevância da ZFM, só no ano passado, o Polo Industrial de Manaus (PIM) registrou faturamento de 81,7 bilhões de reais, o que equivale a um crescimento nominal de 9,41% em relação ao montante obtido em 2016 (74,7 bilhões de reais). Esta evolução do faturamento representa uma recuperação gradativa do desempenho das empresas do PIM, que vinha sendo observado até o ano de 2014 (87,4 bilhões de reais). Convertendo para dólar, são 25,58 bilhões de dólares alcançados em 2017, o que representa um acréscimo de 16,62% na comparação com o ano anterior (21,93 bilhões de dólares). Na moeda americana, também houve aumento de 6,54% no volume de exportação, na comparação entre o total de 2017 com o de 2016.
	Estes dados, disponibilizados pela SUFRAMA, demonstram que, mesmo com a crise que avassalou o Brasil, a ZFM continua evoluindo economicamente e contribuindo para a geração e manutenção de empregos, sendo de crucial relevância para o Amazonas e para todo o País. 
	Ressalto, ainda, que o grande triunfo deste modelo é o resultado entre desenvolvimento e preservação da natureza na região amazônica, um projeto empresarial que consegue manter 98% das nossas florestas intactas, prestando um serviço ambiental ao mundo. 
	Aliás, a ZFM foi reconhecida pelo jornal Financial Times como a melhor Zona Franca das Américas, tendo como desafio a regionalização do desenvolvimento, com o advento de empresas brasileiras, produzindo itens com matéria-prima regional.
	Deste modo, podemos avaliar e concluir o quão importante é a Zona Franca de Manaus para o Amazonas e para o Brasil. Mesmo sendo conhecedores desta relevância, ela continua sendo atacada, muitas vezes, pelo próprio Governo Federal, que é o grande beneficiado da sua existência. 
	Nesta data de comemoração, registro meu protesto contra os ataques que a Zona Franca de Manaus vem sofrendo e reitero meu compromisso com todos os amazonenses de continuar protegendo, na Câmara dos Deputados, nossa ZFM.
	Podem contar com este representante aqui, na defesa dos interesses do nosso Polo Industrial de Manaus e de todos os amazonenses. 
	Parabéns, Zona Franca de Manaus, orgulho do Amazonas! 
	Era o que tinha a dizer, Sr. Presidente. 
Muito obrigado."
2018-03-14T17:20;CASTRO ALVES, MAJOR DA POLÍCIA MILITAR, BATALHÃO DE POLÍCIA, MANAUS (AM), ATUAÇÃO, ELOGIO.;DISCURSO ENCAMINHADO;"PRONUNCIAMENTO ENCAMINHADO À MESA PARA PUBLICAÇÃO
	O SR. PROF. GEDEÃO AMORIM (PMDB-AM. Pronunciamento encaminhado pelo orador.) - Sr. Presidente, Sras. e Srs. Deputados, é com satisfação que eu subo hoje a esta tribuna para fazer uma homenagem a um homem que vêm trabalhando muito pelo Amazonas, o Major PM Castro Alves, Comandante do 2º Batalhão, em Itacoatiara, Região Metropolitana de Manaus.
	Itacoatiara é a terceira cidade mais populosa do Estado, com quase 100 mil habitantes, de acordo com estimativas do IBGE de 2017. Itacoatiara possui um importante porto fluvial, responsável por uma grande quantidade de transporte de cargas.
	Infelizmente, como tem acontecido no Brasil inteiro, o desenvolvimento se fez acompanhar de muitos percalços no campo da segurança pública. E é justamente por este motivo, por reconhecer o trabalho inigualável desse honrado Comandante do 2º Batalhão da Polícia Militar do Amazonas, que presto minha homenagem ao Major PM Castro Alves.
	Os serviços que esse senhor vem desenvolvendo no nosso Estado já foram reconhecidos nas diversas cidades por que passou.
	À frente da 3ª Companhia Independente de Polícia Militar, no Município de Rio Preto da Eva, o major foi aclamado pela população pelos resultados concretos na área da segurança, gerando a verdadeira sensação de segurança, por meio de um trabalho efetivo, eficiente e eficaz.
	Por seu prestimoso trabalho durante sua carreira de oficial, o Major Castro Alves recebeu diversos Diplomas de Honra ao Mérito (pelo mérito pessoal, dedicação ao trabalho e o bom relacionamento com om público), Medalha Ação Policial Militar (pelo empenho, abnegação, coragem, destreza no cumprimento das missões e operações), Medalha Tiradentes (por ter se tornado digno de reconhecimento pela Polícia Militar do Amazonas), Medalha do Mérito Policial Militar (por não ter nota desabonadora de sua idoneidade moral e por ter prestado serviço a causa pública).
	Nobres colegas, em tempo em que estamos presenciando um decreto de intervenção na segurança pública do Estado do Rio de Janeiro, vejo que honrar os serviços deste policial militar, o Major PM Castro Alves, eleva mais ainda a importância da corporação para todo o povo brasileiro.
	Castro Alves tem quase 20 anos de atuação na Polícia Militar amazonense, possui graduação superior em Segurança Pública, em Língua Portuguesa e Direito, além de mais três especializações suplementares (Segurança Pública, Língua Portuguesa e Estudos de Criminalidade), estas realizadas em Goiás, Rio Grande do Norte e Minas Gerais. Na PMAM, já assumiu cargos de comando e subcomando de unidades, como no 5º Batalhão de Polícia Militar, em Coari, além de chefiar seções na Diretoria de Apoio Logístico (DAL), comandar a 3ª CIPM Rio Preto da Eva, dentre outros cargos.
	Em 2017, antes da chegada do Major Castro Alves, a cidade de Itacoatiara passou por uma situação crítica, para não dizer caótica, na segurança pública, com um índice de criminalidade de invejar as capitais mais violentas. No trânsito, foram mais de 2.500 acidentes, tendo vítimas lesionadas e fatais em alguns casos. Quanto aos roubos e furtos, foram mais de 3.600 casos.
	No comando do Major PM Castro Alves, verificou-se um choque de ordem e de gestão, com ações bem-sucedidas nos serviços prestados à população, que passou a experimentar a sensação de segurança tão esperada. Em virtude do poder de ação dos policiais militares, Itacoatiara passou a vivenciar novos ares e, ao final do mês de janeiro de 2018, foram registrados apenas três acidentes de trânsito, uma redução de quase 100%, e de 19 ocorrências de roubo e furtos, reduções significativas. Uma vitória incontestável da população itacoatiarense.
	Ao longo de sua brilhante trajetória, em todas as unidades por que passou, o major realizou projetos sociais, como o projeto social Um Dia com a Polícia Militar, que envolveu mais de 300 crianças de 6 a 12 anos, e o projeto de inclusão social Polícia Militar e Clube da Terceira Idade, projetos esses que visam humanizar ainda mais a PM do Amazonas.
	Nobres colegas, esta minha fala na tribuna não é apenas de reconhecimento a um homem que vem fazendo a diferença na segurança pública no nosso Estado, mas sim a todo o efetivo da Polícia Militar amazonense, que todos os dias se debruça sobre os mais variados problemas para garantir nossa segurança.
	Um abraço, Major Castro Alves! Receba esta homenagem e meu agradecimento sincero. Que o senhor continue nos honrando e sendo motivo de grande orgulho para todos nós.
	Era o que tinha a dizer.
	Muito obrigado.
	Peço que este discurso fique registrado nos anais da Casa e seja publicado pelo programa A Voz do Brasil."
