dataHoraInicio;keywords;tipoDiscurso;transcricao
2018-04-04T11:36;"CRISE FINANCEIRA, INSTITUIÇÃO DE ENSINO SUPERIOR (IES), AMAZONAS. 
GOVERNO FEDERAL, INVESTIMENTO, EDUCAÇÃO, CIÊNCIA E TECNOLOGIA, AMAZONAS.";BREVES COMUNICAÇÕES;"O SR. PROF. GEDEÃO AMORIM (PMDB-AM. Sem revisão do orador.) - Sr. Presidente, Sras. Deputadas e Srs. Deputados, nós temos uma referência ético-política num regime democrático sobre o qual existem essas profundas crises de ordem econômica e social. Mas nós não podemos, mesmo sob o manto da pressão dessas crises, preterir algumas instituições que são essenciais para a manutenção das populações, para o desenvolvimento da educação, da ciência e da tecnologia. Estou me referindo a uma profunda crise que se abate sobre as instituições de ensino superior e de pesquisa na Amazônia, em especial no Estado do Amazonas. 
	Nós temos algumas instituições que são singulares, como o Instituto Nacional de Pesquisa da Amazônia, a Universidade Federal do Amazonas - UFAM, o Instituto Federal do Amazonas - IFAM, a Fundação Oswaldo Cruz - FIOCRUZ, a Empresa Brasileira de Pesquisa Agropecuária - EMPBRAPA.
	Essas instituições estão sofrendo gravemente, a ponto de muitas vezes não conseguirem fazer manutenção de água e de energia nas suas instalações. Perdem quadros importantes de servidores, de cientistas, de contratados, haja vista que, no ano passado, nós tivemos um orçamento de cerca de 42 milhões de reais, que já era bastante reduzido. Para este ano de 2018, este orçamento foi reduzido em 40%. Portanto, serão apenas 25 milhões de reais, o que é insuficiente, por exemplo, para uma organização como o Instituto Nacional de Pesquisas da Amazônia, pela responsabilidade que tem.
	Eu quero, neste pronunciamento, sensibilizar o Governo Federal, na pessoa do Sr. Ministro de Ciência e Tecnologia, para que leve em consideração essas questões. Nós não podemos descuidar do nosso regime político. Isso está atrelado, é uma rede, é uma teia que existe na sociedade. Nós não podemos, em nome de qualquer fracasso, dispensar os cuidados com essas atividades que são essenciais para o desenvolvimento do povo e da nossa Nação.
Obrigado a todos.

PRONUNCIAMENTO ENCAMINHADO PELO ORADOR
	Sr. Presidente, Sras. e Srs. Deputados, o motivo que me traz hoje a esta tribuna é de extrema relevância e preocupação para o meu Estado. Recentemente, os meios de comunicação do Amazonas divulgaram a situação de penúria que os institutos de pesquisa do Estado estão atravessando. Órgãos como o Instituto Nacional de Pesquisas da Amazônia (INPA), a Universidade do Estado do Amazonas (UEA), o Instituto Federal do Amazonas (IFAM), a Fundação Osvaldo Cruz (FIOCRUZ), o Instituto Nacional da Colonização e Reforma Agrária (INCRA), a Empresa Brasileira de Pesquisa Agropecuária (EMBRAPA) e o Museu Paraense Emílio Goeldi estão sofrendo de forma brutal com a redução de recursos nos seus orçamentos.
	Colegas Parlamentares desta Casa, vou expor de forma minuciosa o que realmente está ocorrendo em relação a essa questão no meu Estado, uma vez que a situação é tão grave, que chega a ser inacreditável!
	As informações divulgadas revelaram que o Instituto Nacional de Pesquisas da Amazônia (INPA), que é considerado uma das maiores entidades de biologia tropical do mundo, está sem recursos até para comprar combustível, desde o mês de novembro do ano passado, e que também não consegue contratar novos motoristas para transportar pesquisadores nos trabalhos de campo. Uma das unidades do INPA chegou a ficar sem água por mais de uma semana, por problemas na bomba de água, e o conserto desse equipamento teve que ser pago por um pesquisador, que tirou recursos do próprio bolso no valor de R$ 5 mil, para resolver o problema.
	É verdadeiramente lamentável termos que ler e propagar uma notícia como esta, não obstante isso se faça necessário neste momento, para que se encontrem soluções.
	A informação é que o corte no orçamento do INPA é catastrófico, já que nos últimos 2 anos a redução foi de 40%. Em 2017, a Lei Orçamentária Anual (LOA) disponibilizou o montante de R$ 42,33 milhões, que caiu para R$ 25,56 milhões em 2018.
	Pesquisadores do INPA afirmam que o Instituto está em situação de calamidade. De acordo com a Dra. Sônia Alfaia, há grande necessidade de revitalização do quadro de pessoal, uma vez que todo o trabalho é realizado por 600 servidores, mas ocorre a efetivação de cinco aposentadorias por mês, já havendo a previsão de 50 aposentadorias para o final de 2018 (quase 10% do quadro). Segundo a Dra. Sônia, não havendo novos concursos para suprir as vagas em aberto e para ampliar o quadro, o INPA ficará extremamente debilitado para a execução dos seus objetivos.
	O Sindicato dos Servidores Públicos Federais no Estado do Amazonas acredita que a sinalização para a contratação de pessoal, por meio de concurso público, poderá salvar o INPA. A necessidade real da instituição é de 461 pessoas, sendo a mínima é de 242 novos servidores, num universo de 790 servidores que o Instituto pode ter. Se aprovada a solicitação, a previsão é que o concurso seja realizado no primeiro semestre de 2018. O Ministério da Ciência, Tecnologia, Inovação e Comunicações (MCTIC) solicitou junto ao Ministério do Planejamento cerca de 1.400 vagas.
	O pior de tudo é que essa escassez de recursos atingiu diversas entidades de pesquisas na região, como como o IFAM, a FIOCRUZ, a EMPBRAPA, o Museu Emílio Goeldi e até mesmo as nossas universidades federal e estadual. Sr. Presidente, a situação realmente é gravíssima! 
	A Sociedade Brasileira para o Progresso da Ciência (SBPC) e mais cinco entidades nacionais representativas das comunidades científica, tecnológica e acadêmica e dos sistemas estaduais de ciência, tecnologia e inovação (CT&I), enviaram uma carta conjunta ao Presidente Michel Temer em fevereiro deste ano. Manifestaram-se contra possíveis contingenciamentos na área em 2018. 
	O orçamento de 2018 destinou apenas R$ 4,7 bilhões de reais para custeio e investimento no Ministério da Ciência, Tecnologia, Inovações e Comunicações (MCTIC), 25% a menos do que o aprovado para o orçamento de 2017 e cerca de um terço de anos anteriores. 
	Destarte, reitero os motivos que me trouxeram hoje a esta tribuna. E falo como professor que reconhece a extrema importância desses institutos como ferramenta para a evolução da pesquisa, da ciência e tecnologia e da educação como um todo. Mas falo também como Deputado Federal, representante do Amazonas, que pleiteia soluções urgentes para esse problema que prejudica o meu Estado e o seu desenvolvimento.
Faço este apelo ao Governo Federal e informo que vou tomar providências nesta Casa. Inclusive solicitarei audiência com o Ministro da Educação, Mendonça Filho, para tratar do tema. Vou lutar por mais investimentos na educação, pelo desenvolvimento científico e tecnológico do Amazonas e de todo o Brasil.
	Era o que tinha a dizer.
Muito obrigado."
2018-04-11T16:04;CENTRAIS ELÉTRICAS BRASILEIRAS (ELETROBRAS), PRIVATIZAÇÃO, CONTRARIO.;DISCURSO ENCAMINHADO;"PRONUNCIAMENTO ENCAMINHADO À MESA PARA PUBLICAÇÃO
O SR. PROF. GEDEÃO AMORIM (PMDB-AM. Pronunciamento encaminhado pelo orador.) - Sr. Presidente, Sras. e Srs. Deputados, venho aqui manifestar minha posição favorável a mantermos sob controle da União a ELETROBRÁS e suas subsidiárias, incluindo as distribuidoras de eletricidade, especialmente aquelas da Região Norte.
Ressaltamos que as empresas que constituem a ELETROBRÁS foram criadas pelo Estado brasileiro com o propósito de aumentar a capacidade de produção de energia elétrica, permitindo a expansão do acesso à eletricidade e a industrialização do País. Também contribuiu para a integração energética em nosso continente, com Itaipu e outras interligações com a Argentina e o Uruguai. Ademais, por intermédio do Centro de Pesquisas de Energia Elétrica, o CEPEL, lidera as pesquisas concernentes ao setor elétrico.
Não há como negar que a estratégia de elevar a oferta de eletricidade foi muito bem-sucedida, pois hoje o fornecimento de energia elétrica é o serviço público mais universalizado no Brasil, trazendo enormes benefícios à grande maioria da população. Além disso, com energia elétrica abundante e barata, suprida pelas usinas da ELETROBRÁS, foi possível erguer um importante parque industrial, o maior de toda a América Latina.
A ELETROBRÁS é a maior empresa do setor de energia elétrica no Brasil, com uma capacidade de geração de 48 gigawatts, correspondente a 31% do total instalado no País. A companhia participa de 233 usinas, sendo 48 hidrelétricas, 112 termelétricas, duas termonucleares, 70 eólicas e uma solar, situadas em todas as regiões do País.
Em transmissão, a companhia possui 72 mil quilômetros de linhas, detendo nada menos que 49% da rede básica do Sistema Interligado Nacional, permitindo a interligação das usinas hidrelétricas de todo o País aos centros de consumo.
Sr. Presidente, acreditamos que o caráter estatal foi determinante na construção de todo esse conjunto de ativos e continua a ser fundamental nos dias de hoje. A ELETROBRÁS sob controle da União é necessária para a realização de novos investimentos estratégicos que garantam a segurança no abastecimento do mercado e para atuar decisivamente em momentos de crise energética que eventualmente acorram.
São exemplos dessa categoria de empreendimentos os grandes projetos de geração hidrelétrica na Amazônia, assim como os sistemas de transmissão a elas associados, como é o caso das usinas de Belo Monte e do Rio Madeira, que tiveram participação determinante das subsidiárias da ELETROBRÁS. É bom lembrar que, em todos os países que possuem relevante parque hidrelétrico, essas usinas são controladas majoritariamente por entidades estatais, como é o caso do Canadá, da China, da Noruega, e dos Estados Unidos, onde 73% da capacidade hidrelétrica está sob controle estatal. A implantação do linhão de interligação entre a hidrelétrica de Tucuruí e a cidade de Manaus foi outra obra estratégica, erguida, heroicamente, por 1.800 quilômetros de densa floresta. Cabe aqui alertar que ainda falta concluir uma parte relevante do projeto original, concernente à desafiadora linha de transmissão que ligará Manaus a Boa Vista, única capital estadual não atendida pelo Sistema Interligado Nacional.
A ELETROBRÁS também atua na atividade de distribuição de energia elétrica, controlando seis empresas que prestam esse serviço público a 4,4 milhões de consumidores em 476 Municípios. Essas empresas são a Amazonas Energia, a ELETROACRE, a CERON, a Boa Vista Energia, a CEAL e a CEPISA.
Quanto à distribuição de energia elétrica, é preciso lembrar que a realidade que ainda persiste nas áreas de atuação dessas empresas federais é bastante difícil, especialmente na Região Norte, pois, com exceção das capitais, na maior parte do território da Amazônia, prevalecem sistemas isolados e fornecimento precário. Essas localidades, em geral, apresentam baixos índices de desenvolvimento humano e índices de universalização insatisfatórios.
Nesse cenário, acreditamos que a prestação dos serviços de distribuição de energia elétrica, com a realização dos investimentos necessários para alterar a realidade econômica e social desfavorável, dificilmente será capaz de gerar retorno financeiro suficiente para atrair as concessionárias privadas. Assim julgamos que os serviços de distribuição de energia elétrica devem ser supridos por empresas sob controle estatal, com o objetivo primordial de atendimento ao interesse público, o que produzirá extraordinário retorno para toda a sociedade, permitindo melhores condições de vida para a população em aspectos como saúde, educação, comunicação e incremento da produtividade, com aumento da renda.
Apesar de todos esses argumentos, infelizmente a ELETROBRÁS decidiu não solicitar a renovação das concessões das distribuidoras sob seu controle. Vencido o prazo das outorgas, o Ministério de Minas e Energia designou essas distribuidoras para continuar prestando os serviços, de forma precária e temporária, até que novo concessionário seja selecionado por meio de licitação.
Por sua vez, a Lei nº 13.360, de 2016, autorizou a União a licitar as concessões não prorrogadas simultaneamente à venda do controle das distribuidoras federais para os vencedores dos certames.
Por meio dessa sistemática, restaram somente duas possibilidades, de acordo com a legislação atual. A primeira seria a privatização das distribuidoras, adquiridas pelo novo concessionário. A segunda, ainda pior, seria a terrível liquidação dessas empresas. Como não acreditamos que nenhum desses caminhos seja o melhor para o bem comum, entendemos que é preciso construir uma solução alternativa. Sugerimos aqui uma opção, no sentido de que a União explore diretamente os serviços de distribuição de energia elétrica nos locais em que já atuam as estatais sob seu controle, em conformidade com o previsto no artigo 21, inciso XII, alínea ""b"", da Constituição Federal.
Por fim, faço ainda uma ressalva, lembrando que, no caso da Amazonas Energia, existe uma dificuldade adicional para sua privatização. O problema refere-se à conclusão da desverticalização da empresa, com a transferência das atividades de geração e transmissão da Amazonas Energia Distribuição para a Amazonas Geração e Transmissão, que passaria a ser controlada diretamente pela ELETROBRÁS. Ocorre que a dívida da distribuidora Amazonas Energia decorrente da aquisição de gás natural para geração de energia elétrica está dificultando a transferência do contrato de fornecimento do combustível para a Amazonas GT, impedindo a conclusão da desverticalização e, assim, praticamente inviabilizando a privatização da empresa.
Diante de todo o exposto, solicito dos nobres pares desta Casa uma atenção especial com essa questão da ELETROBRÁS e suas subsidiárias, de modo que possamos adotar as medidas que sejam as mais apropriadas para reverter a deficiência na prestação dos serviços de energia elétrica que ainda persiste em vastas áreas do território nacional.
Muito obrigado."
2018-04-12T09:00;;HOMENAGEM;"Ata da 72ª (septuagésima segunda) Sessão da Câmara dos Deputados, Não Deliberativa Solene, matutina, da 4ª Sessão Legislativa Ordinária, da 55ª Legislatura, em 12 de abril de 2018. Às 9h25, a Sra. Maria do Rosário, no exercício da Presidência, nos termos do § 2º do artigo 18 do Regimento Interno, declarou aberta a sessão e deu por dispensada a leitura da ata da sessão anterior. A Sra. Presidente informou que a sessão se destinou à homenagem aos dez anos de criação dos Institutos Federais de Educação, Ciência e Tecnologia; prestou as devidas homenagens; e convidou para compor a Mesa os Srs. Roberto Gil Rodrigues Almeida, Presidente do Conselho Nacional das Instituições da Rede Federal de Educação Profissional, Científica e Tecnológica (CONIF) e Reitor do Instituto Federal do Triângulo Mineiro; Eline Neves Braga Nascimento, Secretária de Educação Profissional e Tecnológica do Ministério da Educação; José Maria da Luz Palheta Júnior, Coordenador da Federação Nacional dos Estudantes do Ensino Técnico; Fátima Bezerra, Senadora da República e Coordenadora da Frente Parlamentar Mista em Defesa do Ensino Profissionalizante; Benedita da Silva, Deputada Federal; e Camila Tenório Cunha, Professora do IFB DF, Coordenadora Docente no SINASEFE DF. A Sra. Presidente convidou todos a ouvir o Hino Nacional, executado pela professora Juliana Rocha de Faria Silva  (Instituto Federal de Brasília), acompanhada pelo grupo musical composto por Jefferson Luiz dos Santos Cruz, João Pedro Correia Garcia Mariano e Wallyson dos Santos Soares. Após a exibição do vídeo institucional, a Sra. Presidente convidou o Sr. Carlos Manato para proferir discurso do Sr. Rodrigo Maia, Presidente da Câmara dos Deputados. A Sra. Presidente concedeu a palavra à Sra. Margarida Salomão, pelo PT; aos Srs. Professor Victório Galli, pelo PSL; Átila Lira, pelo PSB; Alice Portugal, pelo PCdoB; e ao Sr. Roberto Gil Rodrigues Almeida, componente da Mesa. Nos termos do § 2º do artigo 18 do Regimento Interno, assumiu a Presidência a Sra. Benedita da Silva e concedeu a palavra à Sra. Maria do Rosário, autora do requerimento; e ao Sr. Paulo Teixeira, pela Minoria. Reassumiu a Presidência a Sra. Maria do Rosário, e concedeu a palavra aos Srs. Pauderney Avelino, pelo Democratas; Izalci Lucas, pelo PSDB; Prof. Gedeão Amorim, pelo PMDB; Chico Alencar, pelo PSOL; e Erika Kokay, pela Oposição; e às Sras. Eline Neves Braga Nascimento, Benedita da Silva e Fátima Bezerra, e ao Sr. José Maria da Luz Palheta Júnior, componentes da Mesa. Usaram da palavra pela ordem os Srs. Edmilson Rodrigues, Helder Salomão, Glauber Braga, Simão Sessim, Ezequiel Fonseca, Jô Moraes, Celso Pansera e Waldir Maranhão. Usou ainda da palavra a Sra. Carla Comerlato Jardim, Reitora do Instituto Federal Farroupilha. A Sra. Presidente registrou a presença de convidados, reiterou as homenagens prestadas, agradeceu a presença de todos e, às 12h04, encerrou a sessão.

Augusto Carvalho
Presidente

Fábio Trad
Secretário

As notas taquigráficas desta Sessão Não Deliberativa Solene poderão ser solicitadas ao Departamento de Taquigrafia, Revisão e Redação - DETAQ."
2018-04-17T15:00;FESTA DO CACAU (2018, URUCURITUBA (AM)), FESTA DO CUPUAÇU (2018, PRESIDENTE FIGUEIREDO (AM)).;PEQUENO EXPEDIENTE;"O SR. PROF. GEDEÃO AMORIM (PMDB-AM. Sem revisão do orador.) - Sr. Presidente, Sras. e Srs. Deputados, eu aproveito esta oportunidade para registrar duas festas culturais em Municípios amazonenses.
Uma delas será realizada em Urucurituba, nos dias 27, 28 e 29 deste mês. É uma festa famosa, que homenageia a produção dos cacaueiros do Município, organizada pelo Prefeito José Claudenor de Castro.
E a outra é a Festa do Cupuaçu, no Município de Presidente Figueiredo, que será realizada nos dias 27, 28, 29 e 30 deste mês. Será uma realização do Prefeito Romeiro Mendonça.
	Sr. Presidente, faço este registro para que todos os amazonenses possam prestigiar tais festas.
	Obrigado.
	
PRONUNCIAMENTOS ENCAMINHADOS PELO ORADOR
	Sr. Presidente, Sras. e Srs. Deputados, nos dias 27, 28 e 29 de abril, será realizada a XV Festa do Cacau no Município de Urucurituba pelo meu amigo Prefeito José Claudenor de Castro Pontes.
	Essa será uma grande festa, com shows nacionais e regionais, nesse Município tão querido.
	Deixo aqui o registro, aproveitando para convidar toda a população amazonense.

	Sr. Presidente, Sras. e Srs. Deputados, convido a todos vocês para participar da 28ª Festa do Cupuaçu no Município de Presidente Figueiredo, que será realizada nos dias 27, 28, 29 e 30 de abril, na área central da cidade e na corredeira de Urubuí. O evento contará com a presença de artistas nacionais. 	Deixo aqui o meu grande abraço ao Prefeito dessa estimada cidade, Romeiro José Costeira de Mendonça."
2018-04-17T15:32;CRISE FINANCEIRA, PESQUISA CIENTÍFICA.;PELA ORDEM;"O SR. PROF. GEDEÃO AMORIM (PMDB-AM. Pela ordem. Sem revisão do orador.) - Sra. Presidente, Deputada Raquel Muniz, quero agradecer à Deputada Benedita da Silva e dizer que é rápida a minha comunicação.
	Sras. e Srs. Deputados, há poucos dias, estive aqui relatando a situação de penúria em que se encontram os órgãos de pesquisa do Norte do Brasil. Não falo de todos porque não sei a situação de cada Região, mas me refiro a órgãos importantes que pesquisam as epidemias das doenças tropicais que estão batendo às portas, como o Instituto Nacional de Pesquisas da Amazônia - INPA, as universidades públicas, o INCRA, a FIOCRUZ, a EMPRAPA e o Museu Paraense Emílio Goeldi, em Belém. São entidades com focos bastante distintos em pesquisa.
	Dito isso, eu venho hoje requerer a realização de uma audiência pública para a qual convidaremos representantes do Ministério da Ciência e Tecnologia, Inovações e Comunicações, da Comissão de Educação da Câmara dos Deputados e dos diversos institutos de pesquisa aos quais me referi.
	Muitíssimo obrigado, Deputada Benedita da Silva."
