dataHoraInicio;keywords;tipoDiscurso;transcricao
2016-06-09T15:39;MARCELO CALERO, MINISTRO DE ESTADO, MINISTÉRIO DA CULTURA, VISITA, CAMARA DOS DEPUTADOS, AVALIAÇÃO.;PELA ORDEM;"O SR. MAURO BENEVIDES (Bloco/PMDB-CE. Pela ordem. Sem revisão do orador.) - Sr. Presidente, são apenas 30 segundos, em atendimento à solicitação do meu Líder, Deputado Baleia Rossi, para informar à Casa que ontem nós tivemos o privilégio de receber a visita do novo Ministro da Cultura, Marcelo Calero, que demonstrou interesse de discutir conosco aquelas linhas mestras que nortearão o seu programa à frente daquela importante pasta ministerial.
	Como nós estávamos naquele momento com a responsabilidade de votar em sucessivos instantes a DRU, e nos desincumbimos exemplarmente dessa tarefa, não nos foi possível ouvir detidamente uma exposição que seria feita pelo Ministro. Isso ocorrerá, segundo se espera, na próxima terça-feira.
	Então, o próprio Líder Baleia Rossi nos convocou, o Ministro aquiesceu, e aqui trará, sem dúvida, aquele lineamento básico que haverá de nortear a ação daquele ilustre integrante da equipe ministerial na gestão do Presidente Michel Temer. Portanto, é algo importante para todos nós, já que a cultura será, basilarmente, uma das tarefas perseguidas insistentemente pelo Governo Michel Temer.
	Muito obrigado, Sr. Presidente."
2016-06-14T14:24;CONDECORAÇÃO, MEDALHA, MAX CÂMARA, CIDADÃO, FORTALEZA (CE),;PEQUENO EXPEDIENTE;"O SR. MAURO BENEVIDES (Bloco/PMDB-CE. Sem revisão do orador.) - Sr. Presidente, Sras. e Srs. Deputados, por iniciativa do próprio Presidente da Câmara Municipal de Fortaleza, Vereador Salmito Filho, o Comodoro Max Câmara, do Iate Clube de nossa Capital, estará sendo galardoado com a Medalha Boticário Ferreira, em razão, sobretudo, do seu excelente desempenho à frente daquela prestigiosa instituição socioesportiva de nossa metrópole.
	A condecoração da conceituada entidade já me foi entregue pelas mãos do jornalista Edilmar Norões, falecido há cerca de 1 ano, o que consternou a sociedade de nossa Unidade Federada, já que o ilustre filho de Barbalha sempre foi figura das mais prestigiadas dos círculos sociais, notadamente por seu realce na mídia, como dirigente da TV Verdes Mares e do Diário do Nordeste.
	Quanto a Max Câmara, ele é reconhecido pelo seu empenho para que o Iate Clube cumpra, cabalmente, o seus objetivos institucionais, o que tem concorrido para ampliar o círculo de profissionais que merecidamente desfrutam de prestígio entre os nossos coestaduanos.
	O SR. PRESIDENTE (Carlos Manato) - Muito obrigado, nobre Deputado.

PRONUNCIAMENTO ENCAMINHADO PELO ORADOR
	Sr. Presidente, Sras. e Srs. Deputados, por iniciativa do próprio Presidente da Câmara Municipal de Fortaleza, Vereador Salmito Filho, o Comodoro Max Câmara, do Iate Clube de nossa Capital, estará sendo galardoado com a Medalha Boticário Ferreira, em razão, sobretudo, do seu excelente desempenho à frente daquela prestigiosa instituição socioesportiva de nossa metrópole.
	Recordo, com profunda emoção que, há exatamente 1 ano, em solenidade presidida pelo próprio Max Câmara, recebi condecoração da conceituada entidade das mãos do saudoso jornalista Edilmar Norões, falecido há cerca de 1 ano, o que consternou a sociedade de nossa Unidade Federada, já que o ilustre filho de Barbalha sempre foi figura dos mais prestigiados dos nossos círculos sociais, notadamente por seu realce na mídia, como dirigente da TV Verdes Mares e do Diário do Nordeste.
	Quanto a Max Câmara, é reconhecido o seu empenho para que o Iate Clube cumpra, cabalmente, os seus objetivos institucionais, o que tem concorrido para ampliar o círculo de profissionais que merecidamente desfrutam de prestígio entre os nossos coestaduanos.
	Daí a iniciativa do Vereador Salmito Filho, chancelada pela unanimidade de seus colegas, o que merece, de minha parte, aplausos entusiásticos pela justeza de que se reveste a horaria do Legislativo de nossa Capital, por onde iniciei a minha trajetória na vida pública brasileira.
	Daí o registro que deliberei realçar, fazendo-o desta tribuna, num endosso à distinção conferida a um verdadeiro líder de nossa comunidade."
2016-06-14T14:58;TRANSPOSIÇÃO DE ÁGUAS DO RIO SÃO FRANCISCO, OBRA, CONCLUSÃO, COMPROMISSO, HELDER BARBALHO, MINISTRO DE ESTADO, MINISTÉRIO DA INTEGRAÇÃO NACIONAL, REGISTRO.;PELA ORDEM;"O SR. MAURO BENEVIDES (Bloco/PMDB-CE. Pela ordem. Sem revisão do orador.) - Sr. Presidente, já me reportei, desta tribuna, aos constantes atrasos ocorridos no projeto de transposição do Rio São Francisco, reclamando do Poder Executivo o descumprimento de prazos contratuais.
	Agora, em recente visita, no final de semana, ao nosso Estado, o Ministro da Integração Nacional, Helder Barbalho, afirmou, de maneira peremptória, que a postulada obra será entregue em dezembro vindouro. 
	Durante a inspeção, o titular da Pasta constatou que 87,4% do projeto estão concluídos, e o restante já possui recursos disponibilizados para a respectiva ultimação. 
	Vale destacar que 12 milhões de pessoas serão beneficiadas em 390 Municípios dos Estados de Pernambuco, Ceará, Paraíba e Rio Grande do Norte.
	Espero, portanto, que neste ano não sejamos decepcionados após mais essa manifestação do Governo Federal, através do Ministério da Integração Nacional.
	O SR. PRESIDENTE (Carlos Manato) - Muito obrigado, Deputado.

PRONUNCIAMENTO ENCAMINHADO PELO ORADOR
	Sr. Presidente, Sras. e Srs. Deputados, já me reportei, desta tribuna, sobre os constantes atrasos ocorridos no projeto de Transposição do São Francisco, reclamando do Poder Executivo o descumprimento de prazos contratuais por parte das empreiteiras incumbidas de levar a efeito aquela importante iniciativa, iniciada ainda no exercício de 2008.
	Agora, em recente visita, no final de semana, ao nosso Estado, o Ministro da Integração Nacional, Helder Barbalho, afirmou, de maneira peremptória, que a postulada obra será entregue em dezembro vindouro.
	Durante a inspeção, o titular da Pasta constatou que 87,4 do projeto estão concluídos, e o restante já possui recursos disponibilizados para a respectiva ultimação.
	Vale destacar que 12 milhões de pessoas serão beneficiadas em 390 Municípios dos Estados de Pernambuco, Ceará, Paraíba e Rio Grande do Norte, erradicando-se, assim, a fácies de uma área geográfica, periodicamente, como agora, acossada pela absoluta carência de água.
	Além disso, o ciclo das visitas prometidas pelo Ministro e o Governador Camilo Santana alcançam partes estratégicas, a exemplo da Barragem de Jati, em nosso Estado, além do Túnel Cuncas I, na Paraíba, demonstrando, enfaticamente, que não mais se constatariam protelações, enervantes, uma vez que o próprio Presidente Michel Temer está consciente da relevância de algo que beneficiará apreciável faixa ambiental do nosso País.
	Confiamos, assim, em que não mais nos defrontaremos com protelações sequenciadas que desacreditem a eficiência dos governos, que sempre prometem, como sem falta, e não faltará, como sem dúvida."
2016-06-14T15:58;MARIA JOSÉ GIRÃO, DESEMBARGADOR, POSSE, TRIBUNAL REGIONAL DO TRABALHO (TRT), CEARÁ, REGISTRO.;PELA ORDEM;"O SR. MAURO BENEVIDES (Bloco/PMDB-CE. Pela ordem. Sem revisão do orador.) - Sr. Presidente, eu queria encaminhar à Mesa, para que V.Exa. acolhesse como lido, pronunciamento em que registro a posse da Desembargadora Maria José Girão na Presidência do Tribunal Regional do Trabalho do Estado do Ceará. 
	Ela é uma magistrada integérrima e vai dirigir aquela Corte para dirimir pendências entre trabalhadores e patrões.
	Muito obrigado, Sr. Presidente.
	O SR. PRESIDENTE (Ricardo Tripoli) - É regimental a solicitação de V.Exa. A Presidência encaminhará o seu pronunciamento.

PRONUNCIAMENTO ENCAMINHADO PELO ORADOR
	Sr. Presidente, Sras. e Srs. Deputados, o Tribunal Regional do Trabalho, com sede em Fortaleza, empossou, na última sexta-feira, em sessão das mais prestigiadas, a Desembargadora Maria José Girão como Presidente daquela Corte, sucedendo, ali, o Desembargador Tarcísio Lima Verde Junior, que, ali, desempenhou o seu mandato com incomparável competência, dirimindo as pendências entre patrões e empregados, tarefa primordial dos seus integrantes.
	Na passada gestão, o rendimento dos julgados revelou a celeridade do trâmite processual, graças à clarividência e ao descortino dos seus eminentes membros, todos detentores de extrema competência para decidir pendências de alçada do Colegiado.
	Passa a exercer a Vice-Presidência da Egrégia Corte o Desembargador Jefferson Quesado Júnior, a quem cabe coadjuvar a Presidente, ensejando que a movimentação processual seja efetivada em maior celeridade.
	Tendo sido anteriormente agraciado, em 1992, com a mais elevada de suas condecorações na esfera do Mérito, situado na Grã-Cruz, jamais deixei de acompanhar o proficiente afã de seus preclaros dirigentes, sem deixar de reconhecer o concurso valioso do quadro de pessoal, dos mais qualificados em termos de Direito de Trabalho.
	Ao realçar o magno acontecimento, desejo augurar à Desembargadora Maria José Girão uma performance inspirada na legislação pertinente e no amparo de farta jurisprudência decorrente de decisões por seu Plenário composto de Magistrados integérrimos."
2016-06-15T09:00;;HOMENAGEM;"Ata da 148ª (centésima quadragésima oitava) Sessão da Câmara dos Deputados, Não Deliberativa Solene, matutina, da 2ª Sessão Legislativa Ordinária, da 55ª Legislatura, em 15 de junho de 2016. Às 9h49, o Sr. Carlos Manato, no exercício da Presidência, nos termos do § 2º do artigo 18 do Regimento Interno, declarou aberta a sessão e deu por dispensada a leitura da ata da sessão anterior. O Sr. Presidente informou que a sessão destinou-se à comemoração ao Dia Mundial de Conscientização da Violência contra a Pessoa Idosa; prestou as devidas homenagens; e convidou para compor a Mesa as Sras. Flávia Morais, Presidente da Frente Parlamentar Mista do Envelhecimento Ativo; Maria do Rosário, Deputada Federal; Dra. Silvana Nunes Ferreira, Delegada da Polícia Civil do Estado de Goiás, Especialista em Segurança Pública pela Faculdade Albert Einstein e Especialista em Políticas Públicas para o Envelhecimento; e os Srs. Eros Biondini, Deputado Federal; e Roberto de Lucena, Presidente da Comissão dos Direitos e Defesa da Pessoa Idosa. O Sr. Presidente convidou todos a ouvir o Hino Nacional. Após proferir discurso do Sr. Waldir Maranhão, 1º Vice-Presidente, no exercício da Presidência, concedeu a palavra à Sra. Flávia Morais, autora do requerimento. Nos termos do § 2º do artigo 18 do Regimento Interno, assumiu a Presidência a Sra. Flávia Morais e concedeu a palavra aos Srs. Márcio Marinho, pelo PRB; Weverton Rocha, pelo PDT; Silvana Nunes Ferreira e Roberto de Lucena, componentes da Mesa. Usou da palavra pela ordem o Sr. Mauro Benevides. Nos termos do § 2º do artigo 18 do Regimento Interno, assumiu a Presidência o Sr. Roberto de Lucena e concedeu a palavra à Sra. Maria do Rosário, pelo PT. Nos termos do § 2º do artigo 18 do Regimento Interno, assumiu a Presidência a Sra. Maria do Rosário e concedeu a palavra aos Srs. João Marcelo Souza, pelo PMDB; Carmen Zanotto, pelo PPS; e Eros Biondini, componente da Mesa. Usou da palavra pela ordem o Sr. Carlos Gomes. A Sra. Presidente registrou a presença de convidados, reiterou as homenagens prestadas, agradeceu a presença de todos e, às 11h02, encerrou a sessão.

Maria do Rosário
Presidente

Carlos Manato
Secretário

As notas taquigráficas desta Sessão Não Deliberativa Solene poderão ser solicitadas ao Departamento de Taquigrafia, Revisão e Redação - DETAQ."
2016-06-15T14:30;SESSÃO SOLENE, CONGRESSO NACIONAL, HOMENAGEM PÓSTUMA, JARBAS PASSARINHO, EX-SENADOR, EX-MINISTRO DE ESTADO.;HOMENAGEM;"O SR. MAURO BENEVIDES (Bloco/PMDB-CE. Pronuncia o seguinte discurso. Sem revisão do orador.) - Sr. Presidente, nobre Senador Flexa Ribeiro, nobre Senador Fernando Collor de Mello, Sr. Major-Brigadeiro-do-Ar Rui Chagas Mesquita, Sr. Contra-Almirante Eduardo Machado Vazquez, Sr. Ministro aposentado do Superior Tribunal de Justiça Aldir Passarinho Junior, magistrado integérrimo que substituiu seu ilustre pai nos Tribunais Superiores do País, quero saudar os demais membros da Mesa que aqui estão, sobretudo o meu colega Deputado Joaquim Passarinho, que poderia aqui representar todos nós que compomos a outra Casa do Parlamento brasileiro.
	Quero cumprimentar ainda os representantes da família Passarinho, aqui representada por todas as suas filhas, os seus filhos, e quero, portanto, testemunhar, diante de todos eles, o afeto e o carinho que desfrutávamos, minha mulher e eu, na convivência com Ruth e Jarbas Passarinho. 
	Portanto, é uma relembrança que faço, neste instante, com profunda emoção, uma emoção que se justifica porque, por tantos anos afastado desta tribuna, a ela chego neste momento por um dever imperativo de consciência, para homenagear um homem público verdadeiramente digno, honrado, corajoso, intrépido que tive o privilégio, vindo lá do Ceará, da minha Assembleia Legislativa, de encontrar aqui, no Senado Federal, num momento de efervescência política, em que os 16 Senadores que aqui chegaram, do MDB de então, vieram trazer uma mensagem que seria, naquele momento, da imediata recomposição da vida institucional brasileira.
	Então, cheguei aqui e iniciei meu trabalho, ouvindo aquelas figuras que lá, no nosso Estado, nós nos acostumáramos a ver como figuras ""paradigmais"" da vida pública brasileira.
	Portanto, neste momento, homenageia-se a memória do grande Jarbas Passarinho, aquele Jarbas Passarinho que, na intimidade, no convívio que mantínhamos, era por mim chamado de ""Jarbas Gonçalves"", enquanto ele me chamava de ""Mauro Benevides"". 
	Sr. Presidente, demais membros da Mesa, eu assomo a esta tribuna para relembrar, como já disse, a figura do ex-Senador Jarbas Passarinho, cujo falecimento ocorreu no penúltimo domingo em Brasília, já que fui seu colega nesta Casa, como mencionei, desde quando aqui cheguei, em 1975, no embalo do espontâneo sufrágio dos meus conterrâneos, permitindo alçar-me ao Congresso Nacional para servir ao meu Estado e à Nação brasileira.
	Na condição de representante do Pará, desde logo - sim, desde logo - o preclaro extinto patenteava a sua cultura polimorfa, sendo partícipe constante dos grandes debates que aqui se travavam, sob os mais variados enfoques, particularmente aquele que dizia respeito ao inadiável restabelecimento da normalidade institucional, que tanto almejávamos ardentemente.
	Arenista convicto, sempre foi um dos mais fervorosos defensores dos governos militares, o que ensejou a sua justa ascensão ao Poder Executivo, quando, sucessivamente, ocupou diversos Ministérios, a exemplo dos da Educação, do Trabalho, da Previdência Social e da Justiça - este último quando titular da Chefia da nossa Nação o hoje Senador Fernando Collor de MeIlo.
	Todos os Presidentes do Senado, a exemplo de Magalhães Pinto, Petrônio Portella, Luiz Viana Filho, sempre a ele deferiram o maior respeito, num reconhecimento ao seu espírito público e à condição do mais qualificado - do mais qualificado, sim - patroneador do lineamento doutrinário, em consonância com os termos do movimento que eclodiu a 31 de março de 1964, fazendo cessarem os direitos políticos e garantias individuais, indispensáveis ao pleno exercício da cidadania.
	Relembro, neste instante, o encontro que ele promoveu, em sua própria residência, no Lago Norte, entre mim e o então Presidente Fernando Collor de Mello - relembro esse fato em todos os detalhes -, quando foram discutidas, à exaustão, questões relevantes, ocasião em que expus ao primeiro mandatário, hoje Senador da República, as linhas mestras de minha atuação, respaldadas no princípio constitucional da plena harmonia entre os três Poderes da República.
	Naquela ocasião, ao ouvir embasamento do meu programa de trabalho - caso viesse a eleger-me titular da Presidência de nossa Mesa Diretora -, atuaria, imparcialmente, em tudo quanto dissesse respeito aos superiores interesses do País.
	Preocupado em inserir o Brasil no chamado Primeiro Mundo - essa é a verdade, Sr. Senador, que relembro agora para homenagear a sua tradição naqueles instantes que me permitiram conhecer e aquilatar os projetos que foram idealizados para implantação durante o seu Governo -, o então Presidente não desejaria que o Congresso negasse apoio a um projeto de Governo reputado por ele como de clara e incontestável significação para os destinos do País.
	Senhoras e senhores convidados da família Passarinho, amigos que admiravam Jarbas Passarinho pelas suas lutas, pela forma febricitante com que aceitava missões dificeis de ser cumpridas integralmente, quer como Governador, Senador, quer como Ministro de Estado, Jarbas Passarinho portou-se, inflexivelmente, dentro de suas arraigadas convicções, com as vistas voltadas para o ideário que ele considerava habilmente formulado, naquela complexa conjuntura, para os destinos da nacionalidade.
	Todos nós, os seus colegas na época e os fraternais amigos que possuía, tudo isso faz-nos render-lhe hoje o preito de nossa homenagem, reconhecendo os seus méritos incontáveis, o que o situa - atentem bem os senhores presentes - entre os homens públicos de maior evidência da sua geração. 
É certo que, em reiteradas oportunidades, nós, do PMDB, nos contrapusemos às decisões governamentais que Passarinho, ardentemente, endossara, sem que isso afrontasse em nenhum momento o respeito recíproco diante de posições ideológicas reconhecidamente antagônicas.
	Quando as discussões tornavam-se mais acaloradas, a intermediação de um hábil e saudoso Petrônio Portela buscava superar impasses perdurantes entre bancadas que, democraticamente, se digladiavam na tribuna de um Plenário acrescido habitualmente por Deputados, todos aqui atentos ao desenrolar de discussões que ultrapassavam os horários regulares das sessões ordinárias. 
	Senhoras e senhores presentes nesta sessão de tanta significação, que emociona a todos nós, oradores, e àqueles que participam deste encontro, o testemunho que ora empresto, na condição de representante da Liderança do PMDB, deve ser interpretado como a busca de algo que melhor realçasse o nosso debate habitual, emoldurando-o com o enfático realismo do pensamento de cada bancada que melhor se posicionasse por entre críticas e opiniões expostas, muitas vezes, com veemência e incisividade, no aceso de discordâncias acentuadas.
	O Pará, que Jarbas Passarinho governou - e governou tão bem - durante o período militar; o Congresso, este Congresso, no qual ele pontificou como uma das figuras de maior preeminência; e o País a que serviu com devotamento e espirito público inexcedíveis, rendem-lhe, também por meu intermédio, porque todos os oradores que me antecederam também o fizeram, rendem-lhe por meu intermédio, neste instante, o preito de profunda saudade, reconhecendo-lhe o talento fulgurante e o espírito público incontestável que exornaram a sua personalidade de escol. 
	Muito obrigado, Sr. Presidente. (Palmas.)"
2016-06-15T16:42;EXPECTATIVA, APROVAÇÃO, SENADO FEDERAL, PL 4254/2015, PROJETO DE LEI ORDINÁRIA, ALTERAÇÃO, LEI FEDERAL, AUMENTO, REMUNERAÇÃO, SERVIDOR PÚBLICO, ADVOGADO DA UNIÃO.;PELA ORDEM;"O SR. MAURO BENEVIDES (Bloco/PMDB-CE. Pela ordem. Sem revisão do orador.) - Sr. Presidente, já se acha no âmbito do Senado Federal, aprovado que foi por esta Casa, o Projeto de Lei nº 4.254, de 2015, defendido, pela justeza de que se reveste, por parte da Associação Nacional dos Advogados Públicos Federais, matéria sobre a qual já me manifestei nesta Casa. 
	Espero que o Senado delibere sobre esse projeto, que trata da importante profissão dos advogados públicos da União. 
	Muito obrigado.
	O SR. PRESIDENTE (Giacobo) - Muito bem, Deputado. Está registrado.

PRONUNCIAMENTO ENCAMINHADO PELO ORADOR
	Sr. Presidente, Sras. e Srs. Deputados, já se acha no âmbito do Senado Federal, aprovado que foi nesta Casa, na semana anterior, o Projeto de Lei nº 4.254, de 2015, defendido, pela justeza de que se reveste, por parte da Associação Nacional dos Advogados Públicos Federais, matéria sobre a qual já me manifestei nesta Casa, expressando o meu integral acolhimento e esperando que o Congresso Nacional chancele a matéria, ensejando o seu envio à sanção do Presidente Michel Temer.
	Dois dias após a aprovação por esta Casa, o autógrafo respectivo foi encaminhado ao exame dos Senadores, com distribuição às Comissões regimentalmente incumbidas de apreciar tão importante proposição.
	Há absoluta convicção dos interessados de que o trâmite, ali, não venha a sofrer protelações, uma vez que o aludido projeto não implica impacto orçamentário, o que o torna perfeitamente ajustável à realidade financeira do Erário nesta fase de compressão de despesas e consequente ajuste nas contas públicas, sob o crivo severo do Ministro da Fazenda, Henrique Meirelles.
	Tudo isso, pois, indica que os Senadores não obstaculizarão o acolhimento do texto elaborado com pequenas alterações, dando lugar a que se conclua nas Comissões e no Plenário a unânime chancela por parte dos ilustres membros daquele plenário, que já presidi, em década passada, mantendo-o em sintonia com as aspirações do povo brasileiro.
	Pelo que sei, os líderes da carreira já mantiveram contato direto com as bancadas que ali tomam assento, recolhendo definições favoráveis, o que nos permite vaticinar uma decisão satisfatória para algo que servirá de redobrado esforço, a fim de que a máquina estatal funcione, com reiterado empenho, para garantir mais ponderáveis recursos para o Tesouro Nacional.
	Fica, pois, daqui desta tribuna, o meu apelo ao Presidente Renan Calheiros e aos seus pares no sentido de que respaldem a deliberação da Câmara, ensejando o término de uma tramitação que remonta ao passado exercício."
2016-06-16T14:39;LIVRO, BRUNO PEDROSA, AUTOR, INSTITUTO DO CEARÁ, LANÇAMENTO, EDNILO SOÁREZ, PRESIDENTE, ELOGIO.;PEQUENO EXPEDIENTE;"O SR. MAURO BENEVIDES (PMDB-CE. Sem revisão do orador) - Sr. Presidente, Sras. e Srs. Deputados, o Instituto Histórico, Geográfico e Antropológico do Ceará, ou simplesmente Instituto do Ceará, presidido pelo nobre Deputado Ednilo Soárez, estará promovendo hoje o lançamento, às 20 horas, do livro intitulado O Povo de São José, memória genealógica de uma família sertaneja, de autoria do escritor Bruno Pedrosa.
	O Instituto Histórico do Ceará é considerado a Casa do Barão de Studart. Eu tenho a honra de pertencer àquele sodalício, que, na composição das entidades literárias, é aquela que antecedeu a própria Academia Cearense de Letras, que, por sua vez, foi fundada 2 anos antes da Academia Brasileira de Letras. Sou membro de ambas as instituições, tanto do Instituto do Ceará quanto da Academia Cearense de Letras, o que me foi permitido pela generosidade dos meus pares. 
	Na impossibilidade de comparecer a esse evento hoje, eu quis registrá-lo, pela expressividade da rememoração de um fato histórico. Assim, desejo registrar desta tribuna este evento significativo, do qual estarei ausente, porque estarei cumprindo aqui os meus deveres de representante do povo do Ceará.
Ao exaltar a iniciativa do Instituto, quero destacar também o trabalho que ali vem empreendendo o Presidente Ednilo Soárez, um homem de cultura polimorfa que tem impulsionado significativamente aquela instituição, considerada como a Casa do Barão de Studart. E o mais humilde e modesto dos seus integrantes é exatamente este representante que fala ao povo brasileiro, da tribuna da Câmara dos Deputados.
Muito obrigado.
	O SR. PRESIDENTE (Mauro Pereira) - Muito obrigado, Deputado Mauro Benevides."
