dataHoraInicio;keywords;tipoDiscurso;transcricao
2016-08-25T14:15;DECLARAÇÃO, HENRIQUE MEIRELLES, MINISTRO DE ESTADO, MINISTRO DA FAZENDA, IMPORTÂNCIA, REFORMA FISCAL, DESENVOLVIMENTO ECONÔMICO.;PELA ORDEM;"O SR. MAURO BENEVIDES (Bloco/PMDB-CE. Pela ordem. Pronuncia o seguinte discurso.) - Sra. Presidente Erika Kokay, Sras. e Srs. Deputados, em seguidos contatos com Parlamentares desta Casa, o Ministro Henrique Meirelles expôs a real situação do Erário, apontando como inadiável um reajuste fiscal que possa ensejar a retomada do desenvolvimento, como anseiam os servidores e empregados, bem assim todos os segmentos conscientizados da sociedade civil organizada, especialmente o empresariado, através de suas entidades mais representativas.
	Anteontem, no salão de conferências do próprio Ministério, Henrique Meirelles expôs a realidade enfrentada pelo atual Governo, sequenciado pelo Ministro Geddel Vieira, ali representando o próprio titular do Planalto, o Michel Temer, prestes a tornar-se efetivo na Esplanada, após decisão aguardada no âmbito do Senado Federal, hoje reunido para sequenciar o procedimento de impeachment.
	Ontem, nesta Casa, novamente o titular da Fazenda voltou a debater essa temática, num elogiável esforço de conscientizar os Parlamentares quanto à necessidade de se enquadrar a Nação no quadro de dificuldades prementes, a se necessitar daí um esforço hercúleo para ultrapassar um momento dos mais delicados da conjuntura nacional.
	Ao expor com clareza os percalços da presente e árdua conjuntura, Henrique Meirelles clamou aos Parlamentares presentes que apoiassem as reformas em curso, sem o que o Brasil não ultrapassará, com segurança, essa fase de incontestável preocupação para o Poder Executivo Federal.
	As interpelações que foram a ele dirigidas tiveram prontas e satisfatórias considerações, esperando o Governo que as medidas propostas sejam capazes de obter a chancela indispensável das duas Casas do nosso Parlamento.
	É possível, pois, que novas propostas cheguem a esta Casa para exame e decisão, dentro do apelo formalizado empenhadamente pelo titular da Fazenda, enfático na argumentação expendida com clareza e precisão.
	Muito obrigado, Sra. Presidente.
	A SRA. PRESIDENTA (Erika Kokay) - Obrigada, Deputado Mauro Benevides."
