dataHoraInicio;keywords;tipoDiscurso;transcricao
2016-07-11T14:33;ANDRÉ FRANCO MONTORO, EX-GOVERNADOR, SÃO PAULO (ESTADO), HOMENAGEM PÓSTUMA.;COMO LÍDER;"O SR. MAURO BENEVIDES (Bloco/PMDB-CE. Como Líder. Sem revisão do orador.) - Sr. Presidente, Sras. e Srs. Deputados, não poderia o Congresso Nacional deixar de reverenciar, hoje, um vulto notável da vida pública brasileira, André Franco Montoro, com relevantes serviços prestados ao País, notadamente na esfera das conquistas sociais e das liberdades democráticas.
	Com ele convivi muito de perto, a partir de 1975, quando aqui cheguei como Senador da República, sendo por ele escolhido como seu 1º Vice-Líder, já que possuía um modestíssimo lastro de experiência parlamentar com quatro mandatos de Deputado Estadual, período em que ascendi à Presidência da Assembleia Legislativa do Ceará, em um dos momentos ominosos de nossos fastos historiográficos.
	Recorde-se que a ele coube articular, nacionalmente, o triunfo dos 16 novos Senadores, sinalizando o nosso inabalável propósito de batalhar pela normalização de nossa vida republicana, interrompida com a edição do Ato Institucional nº 1 e a suspensão dos direitos constitucionais.
	Ao lado dele estavam, dentre outros, colegas da estirpe de Paulo Brossard, Marcos Freire, Roberto Saturnino, Lázaro Barbosa, Evilásio Vieira, Dirceu Cardoso, Orestes Quércia - este considerado campeão de votos, alçado que fora ao Congresso como detentor de 6 milhões de sufrágios. 	Respeitado por sua hombridade e cultura polimorfa, Montoro patroneava como causa maior a normalização da nossa estrutura política, já que as urnas denotavam, clara e insofismavelmente, ser essa a grande e inconspurcável aspiração dos nossos compatrícios.
	Antes, professor universitário de incontestável competência, Presidente da Câmara Municipal paulistana e da própria Assembleia Legislativa do Estado, e agora ao lado da liderança senatorial, tudo isso contribuiu, decididamente, para que ele se elegesse Governador do seu Estado, quando ali empreendeu gestão profícua, com a colaboração de Bresser Pereira, José Serra, João Sayad, Fernando Millier, do saudoso Gilbert Duppas, de Tito Henrique da Silva Neto, além de muitos outros que compuseram equipe de alto nível, inteiramente sintonizada com as diretrizes basilares de sua programação administrativo-financeira.
	A inspiradora de sua árdua porfia, D. Lucy Montoro, coadjuvou, no campo da assistência social, com metas delineadas para aquele nevrálgico setor, enquanto os filhos projetavam-se por seus próprios méritos, empenhados na construção de uma gestão modelo, que passasse a servir de paradigma aos seus sucessores.
	Montoro teve como colega nas lides universitárias o ex-Presidente desta Casa Michel Temer, alçado agora à Primeira Magistratura da Nação, e que compunha grupo qualificado na USP, ao lado de Geraldo Ataliba, Bandeira de Mello, Reale Júnior, José Carlos Dias e tantos outros, e começava a despontar por seu talento fulgurante, até chegar à fase atual, em que a sua experiência excepcional fê-lo ser o detentor de condição para a ultrapassagem da fase aziaga que atravessamos, sobretudo na esfera econômico-financeira, com reflexos na estrutura social.
	Reverencio, sim, Sr. Presidente, com profunda emoção, aquele que nos legou lições sapientíssimas de dignidade e honradez, com que sempre timbrou o seu afã em prol de um País essencialmente democrático, no qual se respeitassem os direitos fundamentais da pessoa humana.
	Nem a atual nem a porvindoura das nossas gerações olvidarão alguém que se transformou em legenda inapagável de dignidade, inspirada na defesa intransigente dos direitos fundamentais de cidadania.
	Sr. Presidente, Sras. e Srs. Deputados, senhoras e senhores que nos acompanham através da TV Câmara, há um trecho veemente de discurso proferido por Montoro contra a eleição indireta para Governador proposta pelo então Presidente Emílio Garrastazu Médici. Esse trecho fiz questão de inserir neste discurso. Afirmou Montoro àquela época, com brilho e estridência, algo que ora insiro nesta homenagem que presto neste limitado espaço regimental:
""É impossível não haver nessas palavras o reconhecimento de que a democracia é o próprio oxigênio renovado e humanizado da vida pública nas nações culturais e civilizadas. Daí a presteza, o desaponto, a ênfase veemente a essa emenda que vem, agora, retirar do povo o direito de participar da escolha de seus governantes.""
	A incisividade do inesquecível homem público passou a ser um brado de contundente protesto a um esbulho imposto aos eleitores brasileiros.
	Sr. Presidente, Sras. e Srs. Deputados, senhoras e senhores telespectadores da TV Câmara, assim era André Franco Montoro, intrépido na reação a tudo quanto desestabilizasse o processo democrático entre nós!
	Esta é a homenagem que a bancada do PMDB nesta Casa, através de mim próprio, por orientação do Líder Baleia Rossi, presta hoje à memória imperecível do grande brasileiro André Franco Montoro, que, se vivo fosse, estaria completando hoje 100 anos de existência.
	Ele foi um bravo que contribuiu para o desenvolvimento e, sobretudo, para a consolidação da democracia entre nós."
2016-07-11T15:15;65ª EXPOSIÇÃO AGROPECUÁRIA (EXPOCRATO), CRATO (CE), ANUNCIO.;PELA ORDEM;"O SR. MAURO BENEVIDES (Bloco/PMDB-CE. Pela ordem. Sem revisão do orador.) - Sr. Presidente, eu peço a V.Exa. que acolha como se lido fosse o registro que faço da EXPOCRATO, exposição agropecuária que já se instalou ontem na cidade do Crato, no sul do Estado do Ceará. 
	A 65ª Exposição Agropecuária EXPOCRATO é um grande acontecimento. Eu peço que V.Exa., acolhendo meu discurso, também permita que se registre nos Anais desta Casa a realização dessa festa a que comparecem por volta de 70 mil nordestinos, não apenas de Crato, mas também das regiões circunvizinhas. 
	Muito obrigado, Sr. Presidente.
	O SR. PRESIDENTE (Mauro Pereira) - Muito obrigado, Deputado Mauro Benevides. 
	Com certeza, as equipes competentes do programa a Voz do Brasil e da TV Câmara também vão divulgar o importante trabalho e essa importante festa nessa região.

PRONUNCIAMENTO ENCAMINHADO PELO ORADOR
	Sr. Presidente, Sras. e Ss. Deputados, como tradicionalmente ocorre a cada ano, no mês de julho, iniciou-se ontem, na cidade de Crato, a 65ª Exposição Agropecuária conhecida como EXPOCRATO, um dos concorridos eventos do Nordeste, considerada uma das maiores feiras agropecuárias do Nordeste do País.
	Recordo que seguidas vezes ali tenho comparecido, a exemplo da época em que presidi o Banco do Nordeste, quando me vi instado a ampliar, a instâncias de produtores rurais, a dotação destinada à realização de negócios, cada ano mais crescente pelo número de demandas dos que buscam adquirir animais e a fazer outras modalidades de transações, com a participação de agricultores e pecuaristas daquela faixa territorial do chamado Polígono das Secas.
	Entidades creditícias privadas, igualmente, compõem o elenco de organizações financeiras, com postulações que se sucedem durante os 7 dias da concorrida promoção.
	Correlatamente, as reservas em hotéis da região cresceram significativamente, pelo volume expressivo de visitantes que ali assistem aos shows de artistas famosos em cada noite do evento, com a presença de milhares de visitantes, todos prestigiando aquela realização, que conta também com o decidido apoio do Governo Estadual e da Prefeitura de Crato, pela relevância do expressivo acontecimento.
	Os fatos políticos aqui registrados na passada semana impediram-me de deixar a Capital da República, sendo provável que ali esteja durante o encerramento, quando recolherei, pessoalmente, uma visão precisa de algo considerado um dos maiores acontecimentos no gênero naquela faixa geográfica do País.
	Em entrevista que concedi a uma das emissoras do Cariri, voltei a aplaudir a EXPOCRATO por seu significado socioeconômico, sempre prestigiado pelos Governos Estadual e Municipal, num respaldo endossado por estabelecimentos bancários oficiais e privados, dando suporte às transações efetivadas durante a megapromoção."
2016-07-11T16:09;"DEPARTAMENTO NACIONAL DE OBRAS CONTRA AS SECAS (DNOCS), GESTÃO, HÉLDER BARBALHO, MINISTRO DE ESTADO, MINISTÉRIO DA INTEGRAÇÃO NACIONAL, REUNIÃO, MAURO BENEVIDES, DEPUTADO FEDERAL, ORADOR, ATUAÇÃO PARLAMENTAR.
RECURSOS HÍDRICOS, SECA, CRISE, REGIÃO NORDESTE, REGISTRO.";BREVES COMUNICAÇÕES;"O SR. MAURO BENEVIDES (Bloco/PMDB-CE. Sem revisão do orador.) - Sr. Presidente Mauro Pereira e nobre Deputado Edinho Bez, que acaba de proferir desta tribuna um brilhante discurso em que focaliza aspectos do seu Estado de Santa Catarina, sempre com discussões que objetivam a solução de problemas que afligem aquele grande Estado do Sul do País.  
	Ocupo neste instante a tribuna, Sr. Presidente, Sras. e Srs. Deputados, senhoras e senhores telespectadores da TV Câmara, para me reportar a uma reunião realizada na quarta-feira passada em uma das salas das Comissões da Casa. Naquele ensejo, discutiu-se a situação do Departamento Nacional de Obras Contra as Secas - DNOCS, entidade secular instituída em 1904, tendo à sua frente Arrojado Lisboa, seu idealizador, e tantos outros idealistas que na época tudo fizeram para que nos arregimentássemos para combater o problema cíclico da seca inclemente que já assolava o Nordeste àquela época. Naturalmente, nos 5 últimos anos, tem tido uma repercussão danosa sem quedas pluviométricas de qualquer natureza, levando, portanto, os rurícolas a uma situação insustentável. 
	Daí por que a bancada coordenada pelo Deputado Chico Lopes entendeu de se reunir com a representante do Ministério da Integração Nacional, com outros técnicos e, sobretudo, com Parlamentares nordestinos. Esta Comissão buscou exatamente debater a temática, que foi a da seca, que foi também retransmitida aos funcionários do DNOCS no Estado do Ceará, a fim de que agora, sob a égide do Governo do Presidente Michel Temer, encontremos a alternativa capaz de equacionar esse problema do DNOCS, que é verdadeiramente dramático e já foi objeto de pronunciamentos na Legislatura passada. Não foram poucas as vezes em que ocupei essa tribuna com esse objetivo. Lamentavelmente, decorreu todo esse lapso de tempo sem que se visualizasse algo de positivo em favor daquela autarquia que tem 106 anos de existência. Portanto, um acervo extraordinário de bons serviços prestados ao povo nordestino. 
Diria, Sr. Presidente, que há 2 anos foi elaborado um plano de restruturação do DNOCS, a fim de que o órgão tivesse mais eficácia para atender aos apelos constantes, apelos que são realmente patéticos em algumas regiões, para que os representantes do povo buscássemos no Parlamento brasileiro aquelas alternativas que vitalizassem o Departamento Nacional de Obras contra as Secas.
Agora, o próprio Ministério da Integração Nacional, que tem à sua frente o Ministro Hélder Barbalho, está empenhado em dar uma solução para o problema da seca e, obviamente, terá que o dar dessa autarquia, uma autarquia secular que merece realmente apoio, ajuda e solidariedade por uma extensão natural do próprio Presidente da República.
	Diria, neste instante, que na passada gestão houve a elaboração de um projeto que salvaria o DNOCS de um quadro realmente dramático na sua sobrevivência, relativamente ao atendimento dos seus objetivos institucionais. Foi elaborado um organograma que recompunha o DNOCS e daria aos seus departamentos agilidade ainda maior para atender às demandas do chamado Polígono das Secas. Mas lamentavelmente os recursos que seriam disponibilizados para cumprir este projeto não foram liberados pelo Ministério do Planejamento. Mantivemos contato no próprio gabinete da Presidência com a Ministra Belchior, que, àquela época, à testa do Ministério do Planejamento, mas não obtivemos o assentimento indispensável daquela pasta para o projeto de reenquadramento dos servidores do DNOCS e, naturalmente, um funcionamento mais correto e eficaz de setores vitais para o departamento. 
	Nada disso se conseguiu até hoje. Daí o encontro que foi promovido - acredito que o primeiro deles -, outros deverão vir, para cristalizar entre a bancada nordestina este sentimento de sobrevivência do DNOCS dentro de padrões de funcionamento que atendam efetivamente à nossa região.
	São 5 anos, Sr. Presidente, sem chuva no Nordeste, e o DNOCS sem condições ideais de enfrentar este problema, que é crucial e que reclama ajuda substancial e incisiva do Poder Executivo, naturalmente, a instâncias desses apelos, apelos dramáticos que me dispus a transmitir neste instante. 
	Sei que V.Exa. se encontra realmente preocupado com o tempo, porque já há um orador que aguarda assumir a tribuna para também trazer problemas relevantes. Mas o que estou falando diz respeito à sobrevivência de nordestinos que estão morrendo de fome e de sede. Só não estão morrendo, porque os Governos Estaduais, num sacrifício enorme, estão tentando salvar aquelas nossas pessoas atingidas no Sertão dessa carência de quedas pluviométricas, e não há nenhuma perspectiva de que nas próximas horas tenhamos um aceno que possa restabelecer a confiança e as esperanças do povo nordestino.
Por isso, vim fazer este apelo, dramaticamente, com a veemência que não me é peculiar, mas o quadro nordestino é daqueles que não admitem tergiversação dos homens públicos em diferença daqueles que dirigem o País, enfim, daqueles que podem oferecer uma solução para minimizar o sofrimento dos nossos irmãos do Nordeste. 
	 Muito obrigado, Sr. Presidente. 
Muito obrigado, Sras. e Srs. Deputados. 
	O SR. PRESIDENTE (Edinho Bez) - Parabéns, Deputado Mauro Benevides! 

PRONUNCIAMENTO ENCAMINHADO PELO ORADOR
	Sr. Presidente, Sras. e Srs. Deputados, em uma das salas de Comissão desta Casa, sob a coordenação do Deputado Chico Lopes e com a presença, entre outros, da Secretária Executiva do Ministério da Integração Nacional, Dra. Emília Maria Ribeiro Curi, foi realizado em debate, transmitido ao vivo para a sede do Departamento Nacional de Obras Contra as Secas - DNOCS em Fortaleza, com análise das atividades vivenciadas por aquela secular autarquia, a fim de que a pasta, dirigida hoje pelo nosso correligionário Hélder Barbalho, possa, afinal, realizar a reestruturação do tradicional órgão - aspiração amplamente discutida na passada Legislatura, mas sem condição capaz de ensejar uma ação mais eficaz de prestigiada entidade, sem condições, presentemente, de cumprir cabalmente os seus objetivos no que tange à eficaz assistência aos rurícolas da região.
	Nestes 5 anos de estiagem, o DNOCS, mesmo em meio à precariedade de recursos, empenhou-se para atender às demandas dos rurícolas, limitando-se à abertura de poços, quando existiam poucas perfuratrizes disponíveis, à falta de disponibilidades de recursos, para assegurar a compra de maquinaria necessária a uma ação eficaz, como todos ardentemente desejavam, sobretudo o Deputado Eudes Xavier, injustiçado na manifestação das urnas, já que obteve votação bem inferior ao que lhe fora dado fazer em prol do povo de nossa Unidade Federada.
	A reestruturação procedida, competentemente, pelo Ministério não contou com o respaldo financeiro do Ministério do Planejamento, com cuja titular, em duas audiências, mantivemos contatos, sem que lográssemos êxito naquela cruzada em prol de um órgão criado em 1904 pelo saudoso Arrojado Lisboa e seus colaboradores no século passado.
	Espero que agora, sob a liderança do Deputado Chico Lopes, até quando eu estiver neste lapso de mandato, estarei à disposição para coadjuvá-lo nesta nova empreitada para vitalizar o DNOCS, a fim que ele efetivamente possa voltar a ser uma autarquia prestigiada e eficiente, em condições favoráveis de servir ao Polígono das Secas."
2016-07-12T14:24;BRASIL, REGIÃO NORDESTE, SECA, RECURSOS HÍDRICOS, CRISE, COMBATE, HENRIQUE MEIRELLES, MINISTRO DE ESTADO DA FAZENDA, MICHEL TEMER, VICE-PRESIDENTE NO EXERCÍCIO DA PRESIDÊNCIA DA REPÚBLICA, PROVIDÊNCIAS, EXPECTATIVA.;PEQUENO EXPEDIENTE;"O SR. MAURO BENEVIDES (Bloco/PMDB-CE. Sem revisão do orador.) - Sr. Presidente, Sras. e Srs. Deputados, depois de audiência na passada semana com o Presidente Michel Temer, os Governadores do Nordeste mantiveram contato direto com o Ministro da Fazenda, Henrique Meirelles, para a formulação do plano de atendimento ao chamado Polígono das Secas, ora vivenciando a crise mais devastadora dos últimos 50 anos, com baixíssimos índices de quedas pluviométricas, o que torna obrigatória uma assistência bem maior às unidades federadas ali localizadas, para efetivar as demandas dos Municípios mais cruelmente atingidos pela escassez d'agua até para o consumo humano.
	Em relato ao primeiro mandatário do País, os dirigentes estaduais testemunharam a gravidade do panorama nordestino, sensibilizando o Chefe de nossa Nação a adotar as imediatas providências de apoio, na efetivação das quais estará o titular das finanças, dando curso às medidas prometidas por Michel Temer.
	Na ocasião, todos aguardaram que Henrique Meirelles apontasse as ações programadas por sua Pasta para amenizar o quadro delicado vivenciado pelos dirigentes do Polígono das Secas, diante da enorme responsabilidade de buscar apoio para minorar a situação de um panorama caótico, comparado à seca de 1877, que compeliu o Imperador Pedro II a declarar, pateticamente, que venderia a última joia da coroa, mas não permitiria que os habitantes do Nordeste permanecessem à mingua, sem ajuda daquele que antecedeu o advento da República.
	O relato que, terça-feira, o Governador Camilo Santana fez à bancada federal foi algo estarrecedor, já que até reservatórios de maior capacidade, como o Castanhão, davam sinais alarmantes pela impossibilidade de dispor de água suficiente para atender aos que demandariam os seus escassos recursos, já em nível intranquilizador.
	Coube, entretanto, ao Ministro Henrique Meirelles apontar soluções financeiras para os Estados nordestinos, buscando as disponibilidades possíveis para atender a uma postulação das mais angustiantes, detalhadas pelos titulares dos Executivos Estaduais.
	Confiamos em que as determinações do Primeiro Mandatário serão executadas, dentro de um cronograma pautado em prazos privilegiados, que não encontrem obstáculos nos órgãos oficiais, nessa cruzada de lances inenarráveis, pela penúria perdurante na região que representamos nesta Casa.
	O SR. PRESIDENTE (Delegado Edson Moreira) - O seu pronunciamento será divulgado no programa A Voz do Brasil e nos meios de comunicação da Casa, Deputado."
2016-07-12T15:06;REVITALIZAÇÃO, RIO SÃO FRANCISCO, DEBATE, TRIBUNAL DE CONTAS DA UNIÃO (TCU), ELOGIO.;PELA ORDEM;"O SR. MAURO BENEVIDES (Bloco/PMDB-CE. Pela ordem. Sem revisão do orador.) - Sr. Presidente, o Tribunal de Contas da União, sob a coordenação do Ministro Augusto Nardes, realizará, a partir de 11 de agosto, o evento Diálogo Público: Revitalização do São Francisco, para o qual recebi convite. Ali desejo estar presente por reconhecer a relevância do tema, que possui, hoje, vínculo muito próximo com o Nordeste brasileiro, pelo processo de transposição em via de ser concluído, ensejando auspiciosa etapa na luta para corrigir a secular estiagem naquela faixa do Polígono das Secas.
	Portanto, Sr. Presidente, é um diálogo importante. Espero que V.Exa., ao receber o meu discurso como lido na íntegra, reforce a importância da presença dos nossos Parlamentares do Nordeste nesta reunião do Tribunal de Contas da União, sob a coordenação do Ministro Augusto Nardes.
	Muito obrigado, Sr. Presidente.

PRONUNCIAMENTO ENCAMINHADO PELO ORADOR
	Sr. Presidente, Sras. e Srs. Deputados, o Tribunal de Contas da União, sob a coordenação do Ministro Augusto Nardes, realizará, a partir de 11 de agosto, um diálogo público sobre a revitalização do Rio São Francisco, para o qual recebi convite e ali desejo estar presente, por reconhecer a relevância do tema, que possui, hoje, vínculo muito próximo ao Nordeste brasileiro, pelo processo de transposição em via de ser concluído, ensejando auspiciosa etapa na luta secular contra a estiagem naquela faixa do Polígono das Secas.
	A busca da sustentabilidade socioambiental no território da bacia hidrográfica será um dos enfoques centrais do diálogo público, que contará, certamente, com a participação de técnicos abalizados, aptos a oferecer alternativas, em condições de ampliar as perspectivas de viabilização do Velho Chico em favor do nosso País, no amplo percurso alcançado por suas águas outrora caudalosas.
	Como não poderia deixar de ser, esse diálogo público recolherá opiniões de estudiosos competentes, em condições de viabilizar soluções, com o indispensável apoio do Poder Central, hoje confiado ao Presidente Michel Temer, sensível a uma temática dessa grandiosidade.
	É de supor, pois, que esta Casa, formalmente, faça-se representar no magno evento, garantindo, desta forma, o apoio do Parlamento Nacional a uma discussão de alta significação para os destinos de algumas Unidades da Federação, inclusive o Ceará.
	Cumprimento, pois, o TCU, através do nosso ex-colega e hoje Ministro daquela Corte, por tão palpitante promoção, a qual será acompanhada, certamente, por outros órgãos, a exemplo do próprio Ministério da Integração e outras entidades técnicas que se identificam com uma agenda de tamanha relevância."
2016-07-12T18:36;PRESIDÊNCIA DA CÂMARA DOS DEPUTADOS, ELEIÇÃO, EXPECTATIVA, CONSEQUÊNCIA, EDUARDO CUNHA, DEPUTADO FEDERAL AFASTADO, RENÚNCIA, REGISTRO.;BREVES COMUNICAÇÕES;"O SR. MAURO BENEVIDES (Bloco/PMDB-CE. Pronuncia o seguinte discurso.) - Sr. Presidente, esta Casa deverá, amanhã, escolher seu novo Presidente, em razão de renúncia do Deputado Eduardo Cunha, suscitando disputa consequente que envolve cerca de dez prováveis aspirações à direção máxima desta Casa do Parlamento Nacional, integrada por legítimos representantes do povo.
	Não me recordo de que, em nenhum dos últimos 40 anos, a competição haja ensejado tão ferrenho embate. Daí por que considero inusitada a pletora de aspirantes à vaga, embora todos possuam requisito legal para postulá-la, numa pretensão considerada justa pelos que sonham em dirigir pares, num contexto de 513 membros.
	Há quem preveja um delongamento dos trabalhos eleitorais. Alguns vaticinam que a votação alcançará a madrugada, dando lugar a que, em seguida, todos possam seguir para os seus Estados, a fim de desfrutar o recesso, previsto no Regimento Interno, que pauta o nosso trabalho.
	O eleito, compulsoriamente, terá que ficar na Capital da República, reorganizando gabinetes e se predispondo para reiniciar as atividades dentro da mais absoluta normalidade.
	O preferido da maioria terá, como responsabilidade fundamental, superar o clima de adversidade entre partidos no acirramento que remanesce desde o impeachment, a fim de que as discussões processem-se em clima respeitoso, rigorosamente sob a égide do nosso Regimento Interno.
	O reerguimento, sem delongas, do prestígio da Câmara deve ser obrigação prioritária, com debates veiculados em meio a clima de respeito máximo, como convém ao nosso procedimento ético, sempre prevalecente na tradição do Congresso Nacional.
	Já com 14 legislaturas, predispus-me a fazer este discurso, nesta antevéspera da disputada competição, convicto de que o avigoramento do nosso prestígio deve conglobar esforço comum, com vistas a vitalizar a retomada do clima de harmonia, num panorama de disputa normal, no que tange à prática do Regimento e da Carta Magna de 5 de outubro, que preceitua, como norma básica, o respeito integral aos direitos de cidadania, dos quais esta Casa é instrumento basilar."
