dataHoraInicio;keywords;tipoDiscurso;transcricao
2016-04-14T15:18;"RESULTADO, AUDIÊNCIA PÚBLICA, COMISSÃO DE MEIO AMBIENTE E DESENVOLVIMENTO SUSTENTÁVEL (CMADS), COMISSÃO DE MINAS E ENERGIA (CME), DEBATE, DESENVOLVIMENTO, ENERGIA SOLAR.
PRESIDENCIALISMO, ANÁLISE.";PELA ORDEM;"O SR. ÁTILA LIRA (PSB-PI. Pela ordem. Sem revisão do orador.) - Sr. Presidente, Sras. e Srs. Parlamentares, realmente estamos vivendo um momento histórico na vida brasileira. Falo da crise econômica, da crise política, da crise que afeta a todos nós.
	Venho a esta tribuna dizer que a Comissão de Meio Ambiente realizou recentemente um debate sobre energia solar e incentivos para uma política de desenvolvimento do Brasil. Foi um debate importante, que contou com a participação de representantes das agências do Governo que tratam da matéria, de especialistas e de Parlamentares.
	O Brasil é um País que tem tudo para alterar a matriz energética por meio da introdução da energia solar, uma novidade no âmbito de energias renováveis.
	O Piauí é um Estado que hoje tem todas as condições para isso, visto que já tem uma expansão de energia eólica. Concomitantemente aos investimentos de energia eólica, deveremos ter também a implantação das primeiras unidades de energia solar.
	Portanto, eu acredito que o Brasil poderá dar um exemplo e uma grande contribuição para o seu povo e para o mundo, ao assumir o compromisso de trabalhar com a energia solar.
	Em relação à crise que estamos vivendo, ela poderia ter sido menos traumática. O sistema presidencialista leva a crises permanentes entre o Executivo, o Legislativo e o Judiciário.
	O exemplo das democracias parlamentaristas demonstra que qualquer crise governamental tem superação dentro da normalidade do dia a dia do país. Ao contrário do Brasil, que trabalhou uma Constituição toda parlamentarista e adotou o regime presidencialista, que hoje também contribui para essa instabilidade.
	Creio que nos próximos dias vamos completar um debate elevado, democrático, e procurar tomar uma decisão que dê uma perspectiva de estabilidade para a sociedade e para a economia, que está muito prejudicada pela própria desaceleração dos negócios no Brasil, uma vez que a ação pública é responsável pelo andamento e pela confiança dos investimentos privados.
Entre nós, o risco Brasil hoje se acentua justamente por causa desses embates, por causa de uma crise interminável que está acelerando o processo de desorganização da economia.
	Portanto, urge que tomemos a decisão mais adequada para o País, mas na perspectiva de buscar um debate e uma mudança no sistema de governo, para que o Brasil possa enfrentar as crises dentro da normalidade democrática.
	Muito obrigado, Sr. Presidente.

PRONUNCIAMENTO ENCAMINHADO PELO ORADOR
	Sr. Presidente, Sras. e Srs. Deputados, a presente audiência pública, com o tema Potencial de Energia Solar e os Incentivos para o seu Desenvolvimento no Brasil, é de extrema importância no atual debate sobre matrizes energéticas alternativas. Realizado em conjunto com a Comissão de Minas e Energia, este evento reforça, uma vez mais, a estreita conexão entre progresso econômico e proteção ambiental.
	As tecnologias de aproveitamento de energia, no diálogo estabelecido com práticas sustentáveis, amplificam tal conexão e comprovam, de forma inequívoca, que a utilização de tecnologias menos agressivas ao meio ambiente representa fator estratégico para o desenvolvimento nacional.
	Especificamente em relação à energia solar fotovoltaica, não podemos esquecer o nosso grande potencial de crescimento, potencial infelizmente subutilizado, pois o Brasil, apesar de ser um dos países com maior irradiação solar, ainda convive com baixo aproveitamento desta importante matriz energética. Fortalecê-la significa, inclusive, melhorar nossas políticas industriais, com impacto positivo na cadeia produtiva vinculada ao setor.
	Há mais! Ao aprofundarmos o debate sobre os sistemas fotovoltaicos, seguramente abordaremos temas como a redução de impactos socioambientais, limites ecossistêmicos, desenvolvimento sustentável e matrizes energéticas alternativas, abordagens que ganham destaque sobretudo no atual cenário de preocupante crise no setor elétrico, que torna ainda mais urgente a ampliação da produção energética nacional associada à sustentabilidade.
	Múltiplas são as razões para investirmos no desenvolvimento da energia solar fotovoltaica no País, alternativa energética renovável, limpa e sustentável.  Reitero: no caso do Brasil, que recebe grande incidência de raios solares, este tipo de aproveitamento torna-se cada vez mais necessário.
	A Comissão de Meio Ambiente e Desenvolvimento Sustentável - no trabalho conjunto com a Comissão de Minas e Energia - tem a certeza de que esta audiência pública, com a valiosa participação de renomados especialistas, demonstrará os diversos pontos de intersecção entre modelos possíveis de racionalidade econômica e o direito ao meio ambiente ecologicamente equilibrado. As matrizes energéticas alternativas certamente contribuem para diversificarmos tais pontos de intersecção.
	Sejam bem-vindos!
	Muito obrigado."
2016-04-16T23:56;GILBERTO NASCIMENTO, DEPUTADO FEDERAL, PRESIDENTE, SESSÃO, ATUAÇÃO, ELOGIO.;PELA ORDEM;"O SR. ÁTILA LIRA (PSB-PI. Pela ordem. Sem revisão do orador.) - Sr. Presidente, eu quero cumprimentar V.Exa. pela condução dos trabalhos no momento em que esta Casa está tomando a decisão histórica de fazer uma mudança política, uma mudança constitucional na direção do nosso País. 
	O Brasil está democraticamente maduro para encaminhar uma solução majoritária, pelos interesses da Nação.
	É nesse sentido que estamos aqui para votar, junto com o povo brasileiro, em favor do impeachment, acompanhando o Partido Socialista do Brasil.
	O SR. PRESIDENTE (Gilberto Nascimento) - Registro também o meu agradecimento aos funcionários dos gabinetes parlamentares, que, com firmeza, têm assessorado muito bem os Deputados aqui na Casa, principalmente nesta sessão tão longa, de 40 horas."
2016-04-17T14:04;DCR 1/2015, DENÚNCIA POR CRIME DE RESPONSABILIDADE, DILMA ROUSSEFF, PRESIDENTE DA REPÚBLICA, IMPEACHMENT, COMISSÃO ESPECIAL, PARECER, ADMISSIBILIDADE, VOTO FAVORÁVEL.;REGISTRO DE VOTO;"O SR. ÁTILA LIRA (PSB-PI.) - Sr. Presidente, Sras. e Srs. Parlamentares, este é um momento, creio, difícil para todos nós. A minha decisão é pela renovação de esperanças para o nosso País, para todos nós. Pelo meu Estado do Piauí, pelo meu País, ""não vamos desistir do Brasil"", voto ""sim"". (Palmas.)
	O SR. BETO MANSUR - Deputado Átila Lira, do PSB, do Estado do Piauí: voto ""sim"". Total: 261 votos acumulados."
2016-05-11T16:24;APRESENTAÇÃO, REQUERIMENTO DE AUDIÊNCIA DE COMISSÃO, COMISSÃO DE EDUCAÇÃO, ANÁLISE, EDUCAÇÃO A DISTÂNCIA.;PELA ORDEM;"O SR. ÁTILA LIRA (PSB-PI. Pela ordem. Sem revisão do orador.) - Cumprimento o Sr. Presidente, o Deputado Alberto Fraga e todos aqui presentes.
	Eu quero registrar, companheiros Parlamentares, Deputado Ságuas Moraes, da Comissão de Educação, que hoje dei entrada em um requerimento de audiência pública para que a Comissão de Educação e, em seguida, a Câmara possam examinar com maior nitidez a questão da expansão do ensino a distância, sobretudo em áreas não tradicionais, como laboratórios de engenharia e de enfermagem.
	Nesse sentido, nós pedimos uma audiência pública com representantes de vários segmentos para que possamos esgotar o assunto e auxiliar o Ministério da Educação a rever a sistemática de expansão do ensino a distância em áreas que exigem laboratório.
	Muito obrigado, Sr. Presidente. E agradeço ao Deputado Alberto Fraga, que me concedeu esse minuto."
2016-05-17T16:58;EDUCAÇÃO A DISTÂNCIA, EDUCAÇÃO SUPERIOR, ENFERMAGEM, EXPANSÃO, DEFESA.;PELA ORDEM;"O SR. ÁTILA LIRA (PSB-PI. Pela ordem. Sem revisão do orador.) - Sr. Presidente, Sras. e Srs. Deputados, apresentamos requerimento de realização de audiência pública na Comissão de Educação para debater a oferta de cursos superiores a distância, em especial nas áreas de Engenharia e Enfermagem.
	A oferta de cursos superiores a distância está sendo ampliada para diversas áreas, causando temores entre as profissões, especialmente nas áreas de Engenharia e Enfermagem, que requerem atenção especial quando se trata da oferta de cursos de graduação a distância.
	Em virtude da natureza e da complexidade do tema, torna-se necessária a realização dessa audiência pública para o debate de Parlamentes, Ministério da Educação e Conselho Nacional de Educação sobre essa modalidade, que está sendo muito criticada pela fragilidade, sobretudo em áreas de laboratório, como Enfermagem e Engenharia, que tradicionalmente são áreas de ensino presencial.
	Está havendo uma expansão muito grande da educação a distância, comprometendo a qualidade do ensino superior nessas duas áreas, nessas duas profissões tradicionais, sobretudo porque uma cuida da estrutura das construções e a outra, da vida.
	Sr. Presidente, era o que eu gostaria de dizer.
	Muito obrigado.
	O SR. PRESIDENTE (Mauro Pereira) - Muito obrigado, Deputado Átila Lira, do PSB do Piauí.
PRONUNCIAMENTO ENCAMINHADO PELO ORADOR
	Sr. Presidente, Sras. e Srs. Deputados, ocupo a tribuna neste momento para expor o requerimento que apresentei para a realização de audiência pública da Comissão de Educação para debater a expansão da oferta de cursos superiores a distância, em especial nas áreas de Engenharia e Enfermagem.
	A oferta de cursos superiores a distância está sendo ampliada para diversas áreas, causando temores entre os órgãos de representação de algumas profissões, especialmente nas áreas de Engenharia e Enfermagem, que requerem atenção especial quando se trata da oferta de cursos de graduação a distância, em virtude da natureza e da complexidade do tema.
	Por isso, torna-se bastante oportuna a realização da audiência pública proposta nesse requerimento, no qual sugerimos que o debate envolva atores relevantes para o aprofundamento do tema.
	A realização da audiência pública é igualmente relevante porque tramita nesta Casa, pronto para inclusão na pauta da Comissão de Educação, o Projeto de Lei nº 2.891, de 2015, do Deputado Orlando Silva, que obriga a formação em enfermagem em cursos exclusivamente presenciais.
	Ademais, há a novidade da recentíssima homologação do Parecer nº 564/2015, convertido na Resolução nº 1, de 11 de março de 2016, que ""estabelece diretrizes e normas nacionais para a oferta de programas e cursos de educação superior na modalidade a distância"".
	Não podemos negligenciar a qualidade do ensino, seja na modalidade presencial ou a distância. O Ministério da Educação precisa estar atento ao quadro brasileiro atual para acompanhar e averiguar as condições dos cursos superiores a distância e traçar as mudanças necessárias, com a atenção merecida para essas nobres profissões.
	Muito obrigado."
2016-05-18T16:16;"ÁTILA LIRA, PRESIDENTE DE COMISSÃO, ORADOR, COMISSÃO DE MEIO AMBIENTE E DESENVOLVIMENTO SUSTENTÁVEL (CMADS), ATUAÇÃO PARLAMENTAR.
BRASIL, POLÍTICA, EQUIPE DE TRANSIÇÃO, MINISTÉRIO, MICHEL TEMER, VICE-PRESIDENTE NO EXERCÍCIO DA PRESIDÊNCIA DA REPÚBLICA, SAUDAÇÃO.";PELA ORDEM;"O SR. ÁTILA LIRA (PSB-PI. Pela ordem. Sem revisão do orador.) - Sr. Presidente, Sras. e Srs. Parlamentares, eu encerrei o meu mandato como Presidente da Comissão de Meio Ambiente e Desenvolvimento Sustentável, por escolha de todos os partidos e por indicação do PSB. Apresentei o relatório, e creio que cumprimos com as minhas atribuições.
	Portanto, Sr. Presidente, solicito a V.Exa. que dê como lido o meu discurso e que o faça constar nos Anais da Casa.
	Aproveito esta oportunidade para cumprimentar o novo Governo, na pessoa do Presidente da República Michel Temer e toda a sua equipe, especialmente os Ministros da Educação e Cultura, das Relações Exteriores, do Meio Ambiente e de Minas e Energia, o Ministro indicado pelo PSB, nosso amigo e Líder, Deputado Fernando Coelho Filho.
	Nós queremos hoje cumprimentar a nova equipe. Temos esperança de que ela possa dar maior confiança à administração pública do País e à economia, para que o Brasil consiga retomar o crescimento econômico.
	Muito obrigado e meus agradecimentos a todos os Parlamentares.
	O SR. PRESIDENTE (Gilberto Nascimento) - O.k.

PRONUNCIAMENTO ENCAMINHADO PELO ORADOR
	Sr. Presidente, Sras. e Srs. Deputados, a Comissão de Meio Ambiente e Desenvolvimento Sustentável, na primeira Sessão Legislativa da quinquagésima quinta Legislatura, ficou a cargo do Partido Socialista Brasileiro - PSB, em decorrência da composição do Bloco Parlamentar PSDB/PSB/PPS/PV na escolha das Comissões Técnicas da Câmara dos Deputados, e representada na pessoa do Deputado Átila Lira, do Estado do Piauí.
	Este órgão técnico-legislativo, como prevê o art. 22 do Regimento Interno da Câmara dos Deputados, tem por finalidade apreciar os assuntos ou proposições submetidos ao seu exame e sobre eles deliberar. Ele é constituído por dezoito Deputados titulares e dezoito Deputados suplentes, todos compondo uma força política de setores e visões diferenciados, mas, nos embates políticos mais acirrados, exigiu dos Parlamentares um maior comprometimento com o desenvolvimento sustentável e um esforço superior de negociação, na busca da mediação, em prol das soluções para aos problemas apresentados.
	O meio ambiente talvez seja um dos assuntos com maior leque de diversidades temáticas e, portanto, com maior propensão a eventualidades e discussões.
	O Brasil, devido à sua dimensão territorial e à maior variedade ambiental do planeta, constantemente é alvo de fiscalizações e questionamentos. Dentro desse prisma observa-se a importância desta Comissão. Apesar da atuação de outros órgãos nessa esfera, é da nossa obrigação e competência procurar diuturnamente medidas que diminuam a ação impactante ao meio ambiente, assim como aprimorar a legislação vigente.
	O esforço parlamentar desta Comissão resultou na análise de 106 projetos de lei, sendo 65 aprovados e 41 rejeitados, além da aprovação de 96 requerimentos. Foram realizadas 42 audiências públicas, dez seminários, duas representações externas e um curso de legislação ambiental. Foram criadas três subcomissões especiais: a Subcomissão do Bem-Estar Animal (Requerimento 14/2015); a Subcomissão COP 21 (Requerimento 8/2015) e a Subcomissão de Recursos Hídricos (Requerimento 2/2015).
	A Comissão também aprovou a destinação, em forma de emendas à Lei Orçamentária Anual para o exercício de 2016, de 187 milhões e 500 mil reais para a gestão de política nacional de resíduos sólidos, do Ministério de Meio Ambiente; 55 milhões para a implementação da política nacional de recursos hídricos, da Agência Nacional de Águas; 80 milhões para o apoio à criação, gestão e implementação das unidades de conservação federais, do Instituto Chico Mendes; e 100 milhões para o fomento a projetos de conservação e manejo da biodiversidade, do Fundo Nacional de Meio Ambiente.
	Desta forma, apresentamos as atividades realizadas pela Comissão de Meio Ambiente e Desenvolvimento Sustentável durante a minha gestão.
	Vale ressaltar a importante colaboração e o apoio da Mesa Diretora - Deputado Rodrigo Martins, 1º Vice-Presidente; Deputado Ricardo Izar, 2º Vice-Presidente; e Deputado Stefano Aguiar, 3º Vice-Presidente - e de todos os Parlamentares membros deste órgão, sem os quais não seria possível obter um saldo tão positivo e promissor.
	Destacamos também a colaboração do Departamento de Comissões, da Consultoria Legislativa e de todo o corpo técnico da Comissão.
	Muito obrigado."
2016-06-20T19:52;INC 2314/2016, INDICAÇÃO (PROPOSIÇÃO LEGISLATIVA), MENDONÇA FILHO, MINISTRO DE ESTADO, MINISTÉRIO DA EDUCAÇÃO, PROCESSO, CONSELHO NACIONAL DE EDUCAÇÃO (CNE), INDEFERIMENTO, PRAZO, REAPRESENTAÇÃO, REDUÇÃO.;BREVES COMUNICAÇÕES;"O SR. ÁTILA LIRA (PSB-PI. Sem revisão do orador.) - Sr. Presidente, eu estou apresentando hoje uma indicação ao Ministro Mendonça Filho em que solicito uma alteração no decreto que trata de regulação e supervisão de instituições de ensino superior.
	O propósito dessa sugestão é diminuir o tempo de reintrodução de processos que são indeferidos pelo Ministério da Educação, que normalmente é de 2 anos. Nós estamos sugerindo que passe para 6 meses. Isso vai diminuir o número de processos que se acumulam tanto no Ministério da Educação como no Conselho Nacional de Educação.
	Muito obrigado.
	Sr. Presidente, peço que a indicação seja enviada ao MEC."
2016-06-21T15:14;"EDUCAÇÃO A DISTÂNCIA, CURSO SUPERIOR DE FORMAÇÃO ESPECÍFICA, SAUDE, PROIBIÇÃO, CONSELHO NACIONAL DE SAÚDE (CNS), ELOGIO.
INSTITUIÇÃO DE ENSINO SUPERIOR PRIVADA, FUSÃO, OLIGOPOLIO, APREENSÃO.";PELA ORDEM;"O SR. ÁTILA LIRA (PSB-PI. Pela ordem. Sem revisão do orador.) - Sr. Presidente, Srs. Parlamentares, o Conselho Nacional de Saúde, em reunião deliberativa, aprovou uma resolução que recomenda ao Ministério da Educação a não aprovação de cursos de ensino a distância para a área da saúde.
	Houve uma expansão muito grande nessa área, sem a participação do Conselho na avaliação desses processos. Essa resolução também foi aprovada pelo novo Ministro da Saúde. Ela foi aprovada por unanimidade.
	Sr. Presidente, nós também apresentamos, na Comissão de Educação, requerimento solicitando que se debata a questão da fusão das organizações privadas no setor de ensino superior, da formação de oligopólio e da necessidade de uma política para proteger as escolas isoladas.
	Era isso o que eu tinha a registrar.
	Muito obrigado."
2016-07-05T14:26;"PIRIPIRI (PI), ANIVERSÁRIO DE FUNDAÇÃO, HOMENAGEM.
BRASIL, EDUCAÇÃO, TEMA, DEBATE, NECESSIDADE.";PEQUENO EXPEDIENTE;"O SR. ÁTILA LIRA (PSB-PI. Pela ordem. Sem revisão do orador.) - Sr. Presidente, Srs. Parlamentares, quero registrar que ontem, 4 de julho, Piripiri completou 106 anos. É uma cidade importante do Piauí, pela sua economia na agricultura, na indústria de confecção e por ser um polo de saúde e de educação. Sou representante e filho de Piripiri. Eu e o Deputado Heráclito Fortes fomos eleitos com votos dessa querida cidade. Nesse sentido, quero parabenizar toda sua população e todos que trabalham e lutam pelo seu crescimento.
	Sras. e Srs. Deputados, agora vamos a um debate com o Ministro da Educação sobre a política de educação do Governo Michel Temer e sua perspectiva para o País.
	Muito obrigado.
	O SR. PRESIDENTE (Carlos Manato) - Obrigado, Deputado."
2016-07-11T16:18;BRASIL, EDUCAÇÃO A DISTÂNCIA, PLANO NACIONAL DE EDUCAÇÃO (PNE), TEMA, ANÁLISE, COMISSÃO DE EDUCAÇÃO, AUDIÊNCIA PÚBLICA, PEDIDO.;BREVES COMUNICAÇÕES;"O SR. ÁTILA LIRA (PSB-PI. Sem revisão do orador.) - Meu caro Presidente Edinho Bez, companheiro de longa jornada nesta Câmara dos Deputados, Sras. e Srs. Parlamentares, inicio esta fala para levantar um questionamento sobre o ensino a distância no Brasil. 
	O ensino a distância é uma alternativa da modalidade presencial do ensino superior, decorre, sobretudo, das mudanças da tecnologia e da informática, mas está sendo utilizado no Brasil de forma distorcida.
	O Governo Federal, sobretudo o Ministério da Educação, utilizou nos últimos anos o ensino a distância para ampliar a estatística de atendimento do ensino superior, com o propósito de cumprir as metas do Plano Nacional de Educação - PNE. 
	Sr. Presidente, eu já chamei a atenção, na Comissão de Educação, para a necessidade de que o novo Ministro da Educação faça uma revisão nos parâmetros do ensino a distância, para que seja oferecido um rigor de qualidade, a exemplo do que faz a Universidade Federal Fluminense ou a universidade da terra de V.Exa., Santa Catarina, que tem um curso de engenharia a distância, ou a Universidade de São Carlos, que tem adequados parâmetros e indicadores de acompanhamento e validação dos estudos. 
	Não se pode utilizar aleatoriamente a tecnologia, sem o rigor acadêmico. Hoje, ao lado de cada escola de ensino presencial, há um polo de ensino a distância de qualidade discutível. 
	É por isso que nós solicitamos a realização de audiência pública na Comissão de Educação da Câmara para debater e analisar, com o Ministério da Educação, a resolução do Conselho Nacional de Educação e as normativas do Ministério que permitem que haja uma expansão desordenada de instituições de ensino a distância sem qualidade. 
	Neste sentido, estamos aqui para chamar a atenção para a necessidade de discutirmos e criarmos normativas que possam dar rigor qualitativo, do ponto de vista acadêmico, ao ensino a distância, que deve ser uma alternativa dentro da escola de ensino presencial. 
	Ainda, seria melhor que a instituição de ensino a distância não precisasse passar por uma autorização demorada do Ministério da Educação, que não tem condições nem capacidade de supervisionar essa quantidade de unidades que foram implantadas no Brasil. 
	Muito obrigado, Sr. Presidente. 
	O SR. PRESIDENTE (Edinho Bez) - Parabéns, Deputado Átila Lira, representante do Piauí e um dos Deputados ligados à educação! Parabéns a V.Exa. pela pronunciamento!"
2016-08-16T14:39;BRASIL, EDUCAÇÃO A DISTÂNCIA, COMISSÃO DE EDUCAÇÃO, TEMA, DEBATE, RELEVÂNCIA, REGISTRO.;PEQUENO EXPEDIENTE;"O SR. ÁTILA LIRA (PSB-PI. Sem revisão do orador.) - Sr. Presidente, Srs. Parlamentares, a Comissão de Educação está discutindo uma questão muito importante, que é o ensino à distância. A esse respeito, existe um projeto de autoria do Deputado Orlando Silva, que altera o regramento do ensino à distância, sobretudo nas áreas de saúde. 
	Nós chamamos a atenção dos Parlamentares para esse debate, tendo em vista que o ensino à distância e o ensino presencial são modalidades distintas. Sobretudo na área de saúde, existe a questão dos laboratórios e da prática do ensino. Não se pode nem conceber a ideia de que se forme à distância uma enfermeira, uma nutricionista ou um bioquímico.
	Nesse sentido, eu chamo a atenção dos Parlamentares da Comissão e do Plenário para que o debate tenha a preocupação de dar seriedade e qualidade à educação do ensino superior no Brasil."
2016-08-16T15:12;TERESINA (PI), ANIVERSÁRIO DE FUNDAÇÃO, HOMENAGEM.;PELA ORDEM;"O SR. ÁTILA LIRA (PSB-PI. Pela ordem. Sem revisão do orador.) - Sr. Presidente, Sras. e Srs. Parlamentares, quero registrar no plenário da Câmara dos Deputados a data comemorativa de fundação de Teresina, Capital do Estado do Piauí, do qual sou representante. 
Teresina é a cidade que me acolheu. Eu sou de Piripiri, que fica perto do Município de Sete Cidades. Hoje Teresina tem uma população de 844 mil habitantes. Banhada pelos Rios Parnaíba e Poti, Teresina se destaca hoje pelos serviços de educação de primeira qualidade, com conceito nacional, e pelos serviços de saúde, que também servem a todo o interior do Maranhão. Esta tradição, aliada ao comércio, dá uma força econômica às atividades de serviços. 
Quero cumprimentar a população de Teresina; o Prefeito Firmino Filho; o Vice-Prefeito, Ronney; os Vereadores; assim como a equipe do Prefeito, que muito tem trabalhado para que Teresina tenha bons serviços públicos. 
Muito obrigado.

PRONUNCIAMENTO ENCAMINHADO PELO ORADOR
	Sr. Presidente, Sras. e Srs. Deputados, ocupo a tribuna neste momento para parabenizar a Capital do meu querido Piauí, a cidade de Teresina, que hoje completa 164 anos. Não poderia deixar de homenagear esta cidade tão querida e acolhedora na data de hoje, 16 de agosto de 2016.
 	Primeira capital planejada do Brasil, nossa eterna cidade verde cresce a cada ano, destacando-se na prestação de serviços, como saúde e educação. Em Teresina, encontram-se os melhores médicos do País e uma rede de ensino avançada, orgulho do nosso Estado. Com uma economia diversificada, Teresina tem destaque no artesanato, com a cerâmica e a arte santeira, reconhecida internacionalmente; crescimento na área industrial e vasta rede de outras atividades comerciais e de serviços.
	Nobres colegas Deputados, cumprimento o Prefeito Firmino Filho e os Vereadores. Não poderia deixar de homenagear, acima de tudo, o povo de Teresina, que luta todos os dias, se esforça com dedicação ao trabalho e aos estudos, para fazer da nossa Capital uma cidade melhor para se viver. Um povo honrado, alegre, acolhedor, como já diz o hino de Teresina.
 	Esta cidade de que tanto gosto e quero ver ainda mais desenvolvida, com todas as suas potencialidades e destaques, é realmente fruto do labor da gente simples, cidade que cresce a cada dia. 
Teresina, que hoje completa 164 anos, tem muito a comemorar e muita energia para seguir em frente, com garra e determinação."
