dataHoraInicio;keywords;tipoDiscurso;transcricao
2015-04-28T14:54;"LOTÁRIO WEBER, PADRE, HOMENAGEM PÓSTUMA.
JAIME TOMÁS DE AQUINO, EMPRESÁRIO, HOMENAGEM PÓSTUMA.";PEQUENO EXPEDIENTE;"O SR. ÁTILA LIRA (PSB-PI. Sem revisão do orador.) - Sr. Presidente, Srs. Parlamentares, eu quero aproveitar este momento também para registrar que a fala da Deputada Iracema Portella, sobre a expansão da energia eólica no Piauí e no Brasil, refere-se a uma contribuição do setor privado, sobretudo para enfrentar o aquecimento global. O sucesso da energia alternativa eólica hoje é o que mais tem contribuído para as nações enfrentarem o problema do aquecimento global.
	Mas eu quero, neste momento, prestar homenagem a dois grandes homens públicos que se dedicaram ao nosso Estado. Um, da Igreja Católica, é o Padre Lotário Weber, que deixou a Alemanha nos anos 60 e se dedicou ao Estado do Piauí.
	Padre Lotário fez doutorado em Filosofia e tornou-se uma liderança em evangelização em nosso Estado. Dedicou-se às prelazias de Parnaíba, Cajueiro da Praia, São João da Fronteira, Pedro II e Batalha. Realizou uma grande obra na área de educação, tendo sido o pioneiro da educação básica na região norte do Estado. Enfim, o Padre dedicou, dos seus 60 anos de sacerdócio, mais de 50 anos ao Estado do Piauí.
	Nesse sentido, queremos, como Parlamentar e representante do Estado, prestar homenagem à Igreja, ao Padre e a todos que se dedicaram a sua obra social.
Quero também registar aqui uma homenagem a um empreendedor do Ceará que se dedicou ao nosso Estado, Jaime Tomás de Aquino.
 	Jaime Aquino foi um industrial e um homem voltado também para a agricultura. Ele foi o pioneiro da cultura moderna do caju em nosso Estado. Fez com que o Piauí e o Ceará se tornassem exportadores do caju como fruta e como produto industrializado. Ele foi um modernizador da região, empregador, homem dedicado, grande empresário que reconhecidamente cumpria toda a legislação trabalhista, homem humano, homem que dedicou sua vida a empreender o progresso nos Estados do Piauí e do Ceará.
	Nesse sentido, queremos homenagear esses dois grandes líderes, um no campo da religião e o outro no campo da iniciativa privada, que ajudaram o Piauí a se desenvolver, sobretudo nos campos da educação, da ação social e do empreendimento, para dar emprego e oportunidade a todos.
	Portanto, Sr. Presidente, venho aqui hoje fazer esta homenagem do nosso Estado ao Dr. Jaime Tomás de Aquino e ao Padre Lotário Weber, que dedicou a sua vida sacerdotal de humanização, de educação e de ação social ao povo da região norte do Estado do Piauí, às prelazias de Parnaíba, Pedro II, São João da Fronteira e Batalha.
	Muito obrigado.

PRONUNCIAMENTO ENCAMINHADO PELO ORADOR
	Sr. Presidente, Sras. e Srs. Deputados, ocupo a tribuna nesta terça-feira para lamentar o falecimento do Padre Lotário Weber, ocorrido no dia 20 deste mês, no Município de Parnaíba. Lotário nasceu em Langenberg, na Alemanha, mas realizou um grande trabalho social, religioso e educacional no Piauí, principalmente nos Municípios de Pedro II, Cajueiro da Praia e São João da Fronteira.
	Em sua terra natal iniciou os primeiros estudos. No mês de março de 1950, entrou no Seminário Maior em Bonn, na Alemanha. Fez o doutorado em Filosofia e foi ordenado padre em fevereiro de 1955. Inicialmente trabalhou em paróquias na sua Diocese de origem. Durante o Concílio Vaticano II, o então Bispo de Parnaíba, Dom Paulo Hipólito de Sousa Libório, fez contatos com os Bispos da Alemanha apresentando a necessidade de ter um clero mais numeroso.
	Lotário Weber queria ir a uma terra de missão na África, quando foi convidado para vir ao Brasil. Chegou à Diocese de Parnaíba, onde lhe foi confiada a Paróquia de Nossa Senhora da Conceição, em Pedro II. 
	Monsenhor Lotário Weber faleceu aos 91 anos de idade e, além de um grande trabalho de evangelização, realizou também muitos trabalhos de promoção humana, como a construção de hospitais e escolas. 
	Quero lamentar também, Sr. Presidente, o falecimento do empresário Jaime Tomás de Aquino, fundador da Companhia Industrial de Óleos do Nordeste (CIONE), maior exportadora de castanha de caju do Brasil. Faleceu no dia 16 de abril, aos 91 anos, em Fortaleza. 
	O Brasil perdeu um empresário diferenciado, um dos maiores em seu setor, responsável por uma empresa que gera milhares de empregos diretos no Ceará, além de um líder sindical ativo. Jaime atuou no Sindicato das Indústrias de Beneficiamento de Castanha de Caju e Amêndoas Vegetais do Estado do Ceará (SINDICAJU) e na Federação das Indústrias do Estado do Ceará (FIEC) e foi agraciado com diversos prêmios, como o de Produtor Modelo, pelo Ministério da Agricultura, e a Medalha do Mérito Industrial, pela FIEC. Jaime deixa o exemplo de empreendedor responsável e comprometido.
	Meus sinceros sentimentos aos familiares e amigos de ambos."
2015-04-29T15:26;EMENDA AGLUTINATIVA, PL 2833/2011, PROJETO DE LEI ORDINARIA, TIPICIDADE, CRIME, VIOLÊNCIA, CACHORRO, GATO, ATENTADO, VIDA, SAÚDE, INTEGRIDADE FÍSICA, ANIMAL, MORTE, ABANDONO, ORIENTAÇÃO DE BANCADA, VOTO FAVORAVEL, PSB.;ORIENTAÇÃO DE BANCADA;"O SR. ÁTILA LIRA (PSB-PI. Pela ordem. Sem revisão do orador.) - O PSB cumprimenta o Deputado Ricardo Tripoli pela iniciativa de propor normas legais para criminalizar condutas inadequadas em relação a cães e gatos. Neste sentido, nós votamos ""sim""."
2015-06-01T10:00;;FALA DO PRESIDENTE OU NO EXERCÍCIO DA PRESIDÊNCIA;"Ata da 133ª (centésima trigésima terceira) Sessão da Câmara dos Deputados, Não Deliberativa Solene, matutina, da 1ª Sessão Legislativa Ordinária, da 55ª Legislatura, em 01 de junho de 2015.  Às 10h26, o Sr. Átila Lira, nos termos do § 2º do artigo 18 do Regimento Interno, no exercício da Presidência, declarou aberta a sessão e deu por dispensada a leitura da ata da sessão anterior. O Sr. Presidente informou que a sessão destinou-se à homenagem ao Dia Mundial do Meio Ambiente; prestou as devidas homenagens; e convidou para compor a Mesa os Srs. Penna, Deputado Federal, Presidente do Partido Verde e representante da Frente Parlamentar Ambientalista, representando o Sr, Sarney Filho, autor do requerimento da presente sessão; Carlos Gomes, Deputado Federal e Presidente da Frente Parlamentar da Cadeia Produtiva da Reciclagem; Edmilson Rodrigues, Deputado Federal; Cláudio Maretti, Presidente do Instituto Chico Mendes de Conservação da Biodiversidade - ICMBio, representando a Ministra do Meio Ambiente, Izabella Teixeira; Marilene Ramos, Presidente do Instituto Brasileiro do Meio Ambiente e dos Recursos Naturais Renováveis - IBAMA; Angelim, Deputado Federal; Aldem Bourscheit Cezarino, Especialista em Políticas Públicas da Organização Não Governamental WWF-Brasil; Iara Beltrão, representando a Diretoria-Geral da Câmara dos Deputados; e André Lima, Secretário de Meio Ambiente do Governo do Distrito Federal. O Sr. Presidente convidou todos a ouvir o Hino Nacional. Após assistir ao vídeo institucional e proferir o discurso do Sr. Eduardo Cunha, Presidente da Câmara dos Deputados, o Sr. Presidente concedeu a palavra aos Srs. Penna, representando o autor do requerimento; e Mauro Pereira, pelo PMDB. O Sr. Presidente convidou todos a assistir a apresentação do Bloco da Cachoeira, composto por Alexandre, Lícia, Jô e Samanta, executando ""O Carcará Voou"" e ""Onde Mora o Sol"". O Sr. Presidente concedeu a palavra aos Srs. Nilto Tatto, pelo PT; Antonio Carlos Mendes Thame, pelo PSDB; Zé Silva, pelo Solidariedade; Leandre, pelo PV; e ao Sr. Angelim, componente da Mesa. Nos termos do § 2º do artigo 18 do Regimento Interno, assumiu a Presidência o Sr. Penna e concedeu a palavra aos Srs. Edmilson Rodrigues, pelo PSOL e Carlos Gomes, pelo PRB; aos Srs. André Lima, Iara Beltrão, Cláudio Maretti e Aldem Bourscheit Cezarino, componentes da Mesa. Usaram ainda da palavra a Sra. Erika Kokay, Deputada Federal; os Srs. Átila Lira, Deputado Federal e Presidente da Comissão de Meio Ambiente e Desenvolvimento Sustentável - CMADS; João Daniel, Raquel Muniz e Evandro Gussi, Deputados Federais; e Victor Sarno, Presidente da Associação Nacional dos Servidores da Carreira de Especialistas de Meio Ambiente. O Sr. Presidente registrou a presença de convidados, reiterou as homenagens prestadas, agradeceu a presença de todos e, às 12h47, encerrou a sessão.

Carlos Manato
Presidente

Paulo Feijó
Secretário

As notas taquigráficas desta Sessão Não Deliberativa Solene poderão ser solicitadas ao Departamento de Taquigrafia, Revisão e Redação - DETAQ."
2015-06-01T10:00;;HOMENAGEM;"Ata da 133ª (centésima trigésima terceira) Sessão da Câmara dos Deputados, Não Deliberativa Solene, matutina, da 1ª Sessão Legislativa Ordinária, da 55ª Legislatura, em 01 de junho de 2015.  Às 10h26, o Sr. Átila Lira, nos termos do § 2º do artigo 18 do Regimento Interno, no exercício da Presidência, declarou aberta a sessão e deu por dispensada a leitura da ata da sessão anterior. O Sr. Presidente informou que a sessão destinou-se à homenagem ao Dia Mundial do Meio Ambiente; prestou as devidas homenagens; e convidou para compor a Mesa os Srs. Penna, Deputado Federal, Presidente do Partido Verde e representante da Frente Parlamentar Ambientalista, representando o Sr, Sarney Filho, autor do requerimento da presente sessão; Carlos Gomes, Deputado Federal e Presidente da Frente Parlamentar da Cadeia Produtiva da Reciclagem; Edmilson Rodrigues, Deputado Federal; Cláudio Maretti, Presidente do Instituto Chico Mendes de Conservação da Biodiversidade - ICMBio, representando a Ministra do Meio Ambiente, Izabella Teixeira; Marilene Ramos, Presidente do Instituto Brasileiro do Meio Ambiente e dos Recursos Naturais Renováveis - IBAMA; Angelim, Deputado Federal; Aldem Bourscheit Cezarino, Especialista em Políticas Públicas da Organização Não Governamental WWF-Brasil; Iara Beltrão, representando a Diretoria-Geral da Câmara dos Deputados; e André Lima, Secretário de Meio Ambiente do Governo do Distrito Federal. O Sr. Presidente convidou todos a ouvir o Hino Nacional. Após assistir ao vídeo institucional e proferir o discurso do Sr. Eduardo Cunha, Presidente da Câmara dos Deputados, o Sr. Presidente concedeu a palavra aos Srs. Penna, representando o autor do requerimento; e Mauro Pereira, pelo PMDB. O Sr. Presidente convidou todos a assistir a apresentação do Bloco da Cachoeira, composto por Alexandre, Lícia, Jô e Samanta, executando ""O Carcará Voou"" e ""Onde Mora o Sol"". O Sr. Presidente concedeu a palavra aos Srs. Nilto Tatto, pelo PT; Antonio Carlos Mendes Thame, pelo PSDB; Zé Silva, pelo Solidariedade; Leandre, pelo PV; e ao Sr. Angelim, componente da Mesa. Nos termos do § 2º do artigo 18 do Regimento Interno, assumiu a Presidência o Sr. Penna e concedeu a palavra aos Srs. Edmilson Rodrigues, pelo PSOL e Carlos Gomes, pelo PRB; aos Srs. André Lima, Iara Beltrão, Cláudio Maretti e Aldem Bourscheit Cezarino, componentes da Mesa. Usaram ainda da palavra a Sra. Erika Kokay, Deputada Federal; os Srs. Átila Lira, Deputado Federal e Presidente da Comissão de Meio Ambiente e Desenvolvimento Sustentável - CMADS; João Daniel, Raquel Muniz e Evandro Gussi, Deputados Federais; e Victor Sarno, Presidente da Associação Nacional dos Servidores da Carreira de Especialistas de Meio Ambiente. O Sr. Presidente registrou a presença de convidados, reiterou as homenagens prestadas, agradeceu a presença de todos e, às 12h47, encerrou a sessão.

Carlos Manato
Presidente

Paulo Feijó
Secretário

As notas taquigráficas desta Sessão Não Deliberativa Solene poderão ser solicitadas ao Departamento de Taquigrafia, Revisão e Redação - DETAQ."
2015-09-01T11:00;;HOMENAGEM;"Ata da 247ª (ducentésima quadragésima sétima) Sessão da Câmara dos Deputados, Não Deliberativa Solene, matutina, da 1ª Sessão Legislativa Ordinária, da 55ª Legislatura, em 1º de setembro de 2015.  Às 11h20, o Sr. Silas Freire, nos termos do § 2º do artigo 18 do Regimento Interno, no exercício da Presidência, declarou aberta a sessão e deu por dispensada a leitura da ata da sessão anterior. O Sr. Presidente informou que a sessão destinou-se à homenagem ao Sistema Meio Norte de Comunicação; prestou as devidas homenagens; e convidou para compor a Mesa a Sra. Lívia Guimarães Pacheco, Diretora do Sistema Meio Norte de Comunicação; e os Srs. Marcus Vinícius Furtado Coêlho, Presidente Nacional da Ordem dos Advogados do Brasil - OAB; Themistocles Filho, Presidente da Assembleia Legislativa do Estado do Piauí; Paulo Guimarães, Diretor da TV Meio Norte de Comunicação; Daniel Guimarães, Diretor do Sistema Meio Norte de Comunicação; Sebastião Wrias Moura, Diretor da TV Meio Norte de Comunicação; e Wellington Dias, Governador do Estado do Piauí. O Sr. Presidente convidou todos a ouvir o Hino Nacional e deu como lido o discurso do Sr. Eduardo Cunha, Presidente da Câmara dos Deputados. Nos termos do § 2º do artigo 18 do Regimento Interno, assumiu a Presidência o Sr. Júlio Cesar e concedeu a palavra ao Sr. Silas Freire, autor do requerimento. Reassumiu a Presidência o Sr. Silas Freire. Após a exibição do vídeo institucional, o Sr. Presidente concedeu a palavra aos Srs. Júlio Cesar, pelo PSD; Átila Lira, pelo PSB; Weverton Rocha, pelo PDT; Mainha, pelo Solidariedade; Josi Nunes, pelo PMDB; e aos Srs. Marcus Vinícius Furtado Coêlho, Wellington Dias e  Daniel Guimarães, componentes da Mesa. Usaram da palavra pela ordem os Srs. Heráclito Fortes, Assis Carvalho, Cabo Sabino, Marcelo Castro, Mariana Carvalho e André Fufuca. Usou ainda da palavra o Sr. Alexandre Almeida, Deputado Estadual do Maranhão. O Sr. Presidente registrou a presença de convidados, reiterou as homenagens prestadas, agradeceu a presença de todos e, às 12h58, encerrou a sessão.

Silas Freire
Presidente

Sarney Filho
Secretário

As notas taquigráficas desta Sessão Não Deliberativa Solene poderão ser solicitadas ao Departamento de Taquigrafia, Revisão e Redação - DETAQ."
2015-09-16T14:54;MANOEL LIRA, EX-PADRE, HOMENAGEM PÓSTUMA.;PEQUENO EXPEDIENTE;"O SR. ÁTILA LIRA (PSB-PI. Sem revisão do orador.) - Sr. Presidente, eu quero registrar o falecimento do Padre Lira, um grande educador religioso do Semiárido, nascido na região de Bom Jesus. Ele foi Prefeito de São Raimundo Nonato e fundador da cidade de Dom Inocêncio. Foi, sobretudo, um grande educador. Registro o seu passamento e transmito à família e ao Estado do Piauí as nossas homenagens.
	
PRONUNCIAMENTO ENCAMINHADO PELO ORADOR 
	Sr. Presidente, Sras. e Srs. Deputados, ocupo a tribuna nesta terça-feira para lamentar o falecimento do Padre Manuel Lira Parente, ocorrido na manhã do dia 13 deste mês, na cidade de Teresina. 
Padre Lira foi fundador do Município de Dom Inocêncio, localizado a 589 quilômetros da Capital piauiense. Foi o primeiro Prefeito do Município, sendo reeleito por mais duas vezes. Realizou ali grande trabalho social, religioso e educacional.
	Foi ordenado em 1945. Fundou o ginásio Dom Inocêncio, em São Raimundo Nonato, onde foi professor. Foi Prefeito no ano de 1954. 
	A Fundação Ruralista, entidade idealizada e criada por Padre Lira no início da década de 1960, foi o berço e a sede de tudo - uma das mais bem-sucedidas obras sociais do Brasil. O Município de Dom Inocêncio nasceu lá, e houve a possibilidade de abertura de escolas, construção de estradas e chegada de água para a população, que sofre com a seca todos os anos. Essa Fundação foi o embrião de tudo. Padre Lira e sua Fundação fizeram, sem nenhuma dúvida, ""brotar uma flor de um galho seco"". 
Em 2001, o projeto Bordados da Caatinga projetou as ações da Fundação pelo País, formando mais de mil artesãs. A fé do Padre Lira nas pessoas e no que elas poderiam fazer de bom produziu, na sequidão de Dom Inocêncio, trabalhos como o de 400 bordadeiras, cujos feitos, de tão bem feitos e originais, ganharam uma exposição no Serviço Social do Comércio - SESC, em Pinheiros, São Paulo.
Graças às suas importantes ações de ajuda à população do Semiárido, a Fundação Ruralista ganhou notoriedade nacional e internacional, o que possibilitou a ela receber ajuda de países como a Inglaterra e a Austrália. Além disso, suas ações realizadas no Semiárido inspiraram o livro Um Homem Contra a Seca - Luta e Realização no Brasil, da escritora inglesa Peggie Benton, que se tornou uma grande amiga do clérigo. 
	Padre Lira faleceu aos 96 anos de idade. Além de um grande trabalho de evangelização, realizou também muitos trabalhos de promoção humana, como a construção de hospitais e escolas.
Meus sinceros sentimentos aos familiares - D. Conceição Leal e Inocêncio Lira, Dr. Lourival, Marcos e Elvas Parente -, amigos e a toda a população de Dom Inocêncio, que teve nesse homem benfeitor e humano um verdadeiro exemplo de vida. Por isso, terá sua memória guardada para sempre.
	Muito obrigado."
2015-09-17T11:58;RELEVÂNCIA, REALIZAÇÃO,  SEMINÁRIO BIOMA CERRADO, DEFINIÇÃO, POLÍTICA PÚBLICA.;DISCURSO ENCAMINHADO;"PRONUNCIAMENTO ENCAMINHADO À MESA PARA PUBLICAÇÃO
	O SR. ÁTILA LIRA (PSB-PI. Pronunciamento encaminhado pelo orador.) - Sr. Presidente, Sras. e Srs. Deputados, estamos realizando hoje o Seminário Bioma Cerrado.
	O bioma Cerrado é o segundo maior do Brasil, ocupando, originalmente, uma área de 2 milhões de quilômetros quadrados, equivalentes a cerca de 24% do território brasileiro e a 1,2% da superfície continental da Terra. A maior parte do Cerrado estende-se por planaltos sedimentares ou cristalinos, os quais formam grandes blocos separados entre si por depressões periféricas ou interplanálticas. É comum a formação de chapadas, isto é, extensas superfícies planas a suavemente onduladas, ladeadas por áreas serranas e vales fluviais alongados.
	Localizado em sua maior parte sobre as terras altas do Planalto Central, o Cerrado constitui um grande divisor de águas do território nacional e é considerado ""o berço das águas"" das grandes regiões hidrográficas brasileiras. Como um imenso nascedouro, uma rede incontável de riachos, ribeirões e pequenos lagos do bioma verte águas em profusão para o restante do País. 
	O Cerrado é importante área de recarga de seis das oito grandes regiões hidrográficas brasileiras: Amazônica, Tocantins, Atlântico Norte, Nordeste e Leste, São Francisco, Paraná e Paraguai. O bioma cobre parte considerável dessas regiões hidrográficas, especialmente a do Araguaia-Tocantins, a do Paraná-Paraguai e a do São Francisco. 
	Assim, o Cerrado abrange 78% da área da bacia do Araguaia-Tocantins e contribui com 71% da sua produção hídrica, bem como 48% da área da bacia do Paraná-Paraguai e 71% da sua produção hídrica. Em relação à bacia do São Francisco, o Cerrado abrange 47% de sua área e é responsável por 94% da sua produção hídrica. Acrescente-se o fato de que o balanço hídrico na Região Semiárida é, muitas vezes, negativo. Por conseguinte, a bacia do São Francisco e toda a área da Região Nordeste que dele se abastece são, do ponto de vista hidrológico, totalmente dependentes do Cerrado, pois é a vegetação nativa que garante a infiltração lenta da água no solo até os mananciais hídricos.
	O importante botânico alemão Von Martius, em sua divisão florística para o Brasil, denominou o Cerrado de ""Oréades"", que, na mitologia grega, representa as ninfas que habitavam e protegiam as cavernas e grutas e, embora fossem mortais, tinham vida longa e possuíam o poder de curar, profetizar e nutrir. Trata-se de uma bela e justa homenagem ao bioma considerado a formação savânica mais rica do Planeta.
	Essa riqueza está relacionada tanto à diversidade paisagística quanto de espécies. O bioma é formado por um mosaico contínuo de fisionomias vegetais, compostos por formações campestres a florestais, ligadas ou não à presença de água. 
	Quanto às espécies, o Cerrado tem biodiversidade comparável à da Amazônia. Mais de 20% das espécies brasileiras ocorrem no Cerrado, havendo, também, alto grau de endemismos, ou seja, de espécies que ocorrem somente no bioma, sobretudo as vegetais. 
	Por outro lado, o Cerrado é, também, a formação savânica mais ameaçada do Planeta. Até o século XVIII, a região do Cerrado foi dominada por povos nômades. Posteriormente, chegaram os tupis, vindos do litoral pelo rio São Francisco, refugiados da ocupação portuguesa. Entre os séculos XVI e XVIII, a região foi atravessada por inúmeras bandeiras, para apresamento de índios e busca de pedras e metais preciosos. A mineração durou cerca de 150 anos - entre os séculos XVIII e XIX -, em frentes não simultâneas em Minas Gerais, Goiás e Bahia, e contribuiu para o povoamento e a formação de inúmeros núcleos urbanos. A pecuária extensiva antecedeu a mineração e, quando esta entrou em decadência, tornou-se a atividade principal. 
	A maior parte da região viveu em regime de marginalidade econômica, entre o declínio da mineração e a década de 1950. Esse regime deu origem a uma cultura peculiar, do ""homem cerratense"", nas palavras do historiador Paulo Bertran, ainda encontrada em regiões mais remotas, que vivem principalmente de atividades extrativistas e agricultura de subsistência. 
	Entretanto, a partir de meados do século XX, a transferência da Capital do litoral para o interior e a construção de grandes rodovias favoreceram a integração econômica da região e o fluxo migratório para Brasília. A partir da década de 1970, as políticas oficiais de crédito agrícola e de difusão tecnológica estimularam o desenvolvimento da agricultura mecanizada na região. 
	A pecuária e a agricultura intensiva levaram à expansão das fronteiras de ocupação. O resultado é que, atualmente, o bioma conta com menos de 50% de sua cobertura original. 
	Não se trata de se opor aos agricultores ou ao desenvolvimento da região. Trata-se, isto sim, de contrabalançar o desenvolvimento econômico com a conservação do bioma, garantindo-se a continuidade dos serviços ambientais que ele presta para o Brasil e para o mundo.
	No limiar do terceiro milênio, não se pode conceber uma política de crescimento econômico pautada na degradação ambiental. Este Seminário será fundamental para a divulgação da importância ecológica e hidrológica do Cerrado e deve contribuir para a definição de uma política voltada para a conservação e o uso sustentável desse importante bioma. 
	Sucesso a todos! Muito obrigado."
2015-09-17T15:06;"GOVERNO FEDERAL, MEDIDA, CRIAÇÃO, IMPOSTO, DISCORDÂNCIA
PAULO SKAF, PRESIDENTE, FEDERAÇÃO DAS INDÚSTRIAS DO ESTADO DE SÃO PAULO (FIESP), TEXTO, JORNAL DO SENADO, CONTRA, AUMENTO, CARGA TRIBUTÁRIA.";PELA ORDEM;"O SR. ÁTILA LIRA (PSB-PI. Pela ordem. Sem revisão do orador.) - Sr. Presidente, muito agradecido pela atenção à minha reclamação, que vamos transformar em projeto. 
	Sr. Presidente, na primeira fase do ajuste fiscal do Governo Federal, eu votei nas alterações da questão previdenciária. Votei sem solicitação de ninguém, por convicção mesmo, pensando na necessidade de corrigir as distorções que nós tínhamos no sistema. 
O segundo ajuste vem com outra proposta, e eu quero deixar bem claro que não vou participar da criação de nenhum imposto para financiar as desorganizações das contas públicas. Eu quero reafirmar meu compromisso com meu Estado de não criar mais impostos no nosso País.
	Quero registrar o que disse o Presidente da Federação das Indústrias do Estado de São Paulo, o Sr. Paulo Skaf, em visita ao Senado Federal, apontando que o ajuste aumenta a carga tributária, que já está em quase 40%. Essa fala do Sr. Paulo Skaf é objeto de uma nota em matéria do Jornal do Senado sobre a volta da CPMF. 
Nós estamos aqui para trabalhar num ajuste que possa realizar-se com o corte nos gastos públicos, e não criando mais impostos para o contribuinte.

NOTA A QUE SE REFERE O ORADOR
Fiesp alega que ajuste aumenta carga tributária
O presidente da Federação das Indústrias do Estadado de São Paulo (Fiesp), Paulo Skaf, pediu ao presidente do Senado, Renan Calheiros, que os parlamentares não aprovem elevação da carga tribútária. Em visita ontem, ele não poupou críticas ao pacote apresentado pelo governo.
- Esse ajuste virou miragem porque o governo, ao invés de reduzir gastos, melhorar a gestão, reduzir impostos e juros, faz o contrário. O governo tenta aumentar impostos fazendo com que a sociedade pague o pato mais uma vez. E a sociedade não está a fim - declarou Skaf.
Na avaliação do presidente da Fiesp, os cortes significam apenas transferência de fonte de recursos.
- O que era do Tesouro passou para o FGTS. O que era do Tesouro foi para as emendas parlamentares. Mais uma vez o governo não tomou as medidas que tinham que ser tomadas, como a redução de gastos públicos."
