dataHoraInicio;keywords;tipoDiscurso;transcricao
2016-08-22T15:06;ELOGIO, SARNEY FILHO, MINISTRO DE ESTADO, MINISTÉRIO DO MEIO AMBIENTE (MMA), AUXÍLIO FINANCEIRO, PARQUE NACIONAL DA SERRA DA CAPIVARA, PIAUÍ.;PEQUENO EXPEDIENTE;"O SR. ÁTILA LIRA (PSB-PI. Sem revisão do orador.) - Sr. Presidente, Sras. e Srs. Parlamentares, quero registrar o nosso reconhecimento à ação do Ministro do Meio Ambiente Sarney Filho no sentido de reorganizar da Fundação que trabalha no Parque Nacional da Serra da Capivara, reconhecido mundialmente, que permanentemente sofre dificuldades na obtenção de  recursos financeiros para sua manutenção.
	Quando eu era Presidente da Comissão de Meio Ambiente desta Casa, nós debatemos essa questão e pedimos à Ministra de então que tomasse providências com o objetivo de dar uma solução duradoura para o problema, e não uma solução como a que têm dado o Governo Federal e as instituições locais. Nossa preocupação é com que a solução apresentada pelo Ministro Sarney Filho, do Governo Temer, seja mais duradoura e estrutural, para que não tenhamos que recorrer permanentemente a medidas emergenciais para socorrer o Parque Nacional da Serra da Capivara.
	O SR. PRESIDENTE (Delegado Edson Moreira) - O.k."
2016-09-12T10:00;;HOMENAGEM;"Ata da 217ª (ducentésima décima sétima) Sessão da Câmara dos Deputados, Não Deliberativa Solene, matutina, da 2ª Sessão Legislativa Ordinária, da 55ª Legislatura, em 12 de setembro de 2016. Às 10h13, o Sr. Izalci, no exercício da Presidência, nos termos do § 2º do artigo 18 do Regimento Interno, declarou aberta a sessão e deu por dispensada a leitura da ata da sessão anterior. O Sr. Presidente informou que a sessão destinou-se à homenagem ao Dia do Administrador; prestou as devidas homenagens; e convidou para compor a Mesa os Srs. Hildo Rocha, autor do requerimento da Sessão Solene; Sebastião Luiz de Mello, Presidente do Conselho Federal de Administração; Sergio Pereira Lobo, Vice-Presidente do Conselho Federal de Administração; Mônica Cova Gama, Presidente do Conselho Regional de Administração do Distrito Federal; Carlos Alberto Ferreira Junior, Diretor da Câmara de Desenvolvimento Institucional do Conselho Federal de Administração; Átila Lira e Mauro Benevides, Deputados Federais. O Sr. Presidente convidou todos a ouvir o Hino Nacional, executado pelo Duo do Corpo de Bombeiros Militar do Distrito Federal, e proferiu discurso do Sr. Rodrigo Maia, Presidente da Câmara dos Deputados. Após a exibição do vídeo institucional, assumiu a Presidência o Sr. Hildo Rocha e concedeu a palavra aos Srs. Izalci, autor do requerimento, e Mauro Benevides. Reassumiu a Presidência o Sr. Izalci e concedeu a palavra aos Srs. Hildo Rocha, autor do requerimento, Átila Lira, Carlos Alberto Ferreira Junior, Mônica Cova Gama e Sebastião Luiz de Mello, componentes da Mesa; Mauro Pereira, pelo PMDB; e Carmen Zanotto, pelo PPS. O Sr. Presidente registrou a presença de convidados, reiterou as homenagens prestadas, agradeceu a presença de todos e, às 11h45, encerrou a sessão.

Delegado Edson Moreira
Presidente

João Daniel
Secretário

As notas taquigráficas desta Sessão Não Deliberativa Solene poderão ser solicitadas ao Departamento de Taquigrafia, Revisão e Redação - DETAQ."
2016-09-20T15:39;PLN 8/2016, PROJETO DE LEI ORDINÁRIA, CONGRESSO NACIONAL, FUNDO DE FINANCIAMENTO ESTUDANTIL (FIES), CRÉDITO SUPLEMENTAR, ABERTURA, VOTAÇÃO, SESSÃO CONJUNTA, ENCERRAMENTO, PROTESTO.;PELA ORDEM;"O SR. ÁTILA LIRA (PSB-PI. Pela ordem. Sem revisão do orador.) - Sr. Presidente, Sras. e Srs. Parlamentares, eu queria registrar um acontecimento que não poderia ter ocorrido aqui no Congresso, que foi a sessão de ontem. Toda aquela crise por conta da matéria que estava sendo discutida, com relação à anistia de gastos com caixa dois, atrapalhou a realização da sessão do Congresso e impediu que se aprovasse o PLN que destinava recursos para o FIES. Consequentemente, nós temos hoje 2 milhões de alunos sem matrícula no Brasil, desde julho, por falta de recursos orçamentários. 
	Então, é lamentável que uma matéria como essa tenha sido tratada de forma negligente. E isso vai comprometer as instituições, que vão ter que recorrer a bancos e pagar essas taxas de juros inaceitáveis que nós temos hoje no mercado financeiro. 
	Portanto, errou o Congresso, errou o Governo em não ter sido diligente, no sentido de colocar os seus Parlamentares para aprovar uma matéria tão importante como essa. 
	Muito obrigado, grande Presidente Izalci. Agradeço também e a esse delegado especial de Minas Gerais."
2016-10-05T13:04;SOLICITAÇÃO, PRESIDENTE DA CÂMARA DOS DEPUTADOS, DEPUTADO FEDERAL, APRECIAÇÃO, MATÉRIA, LIBERAÇÃO, RECURSOS FINANCEIROS, FUNDO DE FINANCIAMENTO ESTUDANTIL (FIES).;PELA ORDEM;"O SR. ÁTILA LIRA (PSB-PI. Pela ordem. Sem revisão do orador.) - Sr. Presidente, eu queria apelar para V.Exa. e para os Parlamentares por essas matérias do Ministério da Educação que estão pendentes de apreciação. Os alunos do FIES estão sem matrícula e sem aditivo, e as escolas sem o financeiro. Portanto, eu pediria a atenção de V.Exa., do Senador Renan Calheiros e dos demais Parlamentares. 
	Obrigado.
	O SR. PRESIDENTE (Rodrigo Maia) - Deputado Átila, é por isso que eu disse ao Deputado Afonso Florence que não vou esperar todo o tempo do mundo aqui. Depois disso, vamos ter que começar a votação do pré-sal, para então entregar o plenário, a fim de que o Congresso Nacional vote os projetos desses créditos, que são certamente urgentes e relevantes.
	Tem a palavra o Deputado Hildo Rocha."
2016-10-19T11:36;HOMENAGEM, ANIVERSÁRIO, PIAUÍ.;BREVES COMUNICAÇÕES;"O SR. ÁTILA LIRA (PSB-PI. Sem revisão do orador.) - Sr. Presidente, Sras. e Srs. Parlamentares, hoje nós registramos a data de criação do Estado do Piauí. 
	Hoje, o Estado do Piauí tem uma população de mais de 2 milhões de habitantes, é uma economia ainda de base primária, com forte setor de serviços, mas tem também uma estrutura de saúde que é das melhores da região, entre os Estados do Maranhão e do Ceará, e um setor educacional que prima pela aprovação nos melhores indicadores de ensino do País, tanto na educação básica quanto no ensino superior. 
	O Estado, meu caríssimo Presidente, é governado pela terceira vez pelo Dr. Wellington Dias, um grande Governador, membro do Partido dos Trabalhadores, que tem a responsabilidade de conduzir os destinos do nosso Estado, com a nossa colaboração. 
	Quero homenagear V.Exa. que preside esta sessão memorável, que também está ao lado do Governador Wellington Dias na luta por mais recursos, sobretudo nesta crise econômica que estamos atravessando. 
	Como sabe V.Exa., a colonização do Piauí se deu do interior para a costa...
	(Desligamento automático do microfone.)
O SR. ÁTILA LIRA - ... dos bandeirantes.
No Piauí se desenvolveu inicialmente a economia do couro, baseada no gado, que evoluiu para a produção de cera de carnaúba e depois para a indústria. Hoje, o setor de serviços do Estado é um dos maiores de toda a região integrada por Maranhão e Ceará. E a educação é o seu maior êxito. 
	O Piauí tem como Capital a cidade de Teresina, e Teresina tem um grande Prefeito, que é Firmino Filho, eleito com o nosso apoio, um grande projeto político para o nosso Estado.
Então, eu quero homenagear o povo do nosso Estado, sobretudo aqueles que trabalham pelo seu desenvolvimento.
	Muito obrigado.
Tenham um bom dia."
2016-11-16T14:46;TERESINA (PI), HOMENAGEM, ELVIRA RAULINO, JORNALISTA, ANIVERSÁRIO DE NASCIMENTO.;BREVES COMUNICAÇÕES;"O SR. ÁTILA LIRA (PSB-PI. Sem revisão do orador.) - Sr. Presidente, Sras. e Srs. Deputados, quero fazer um registro sobre a homenagem que o nosso Estado presta hoje à jornalista Elvira Raulino.
	Elvira Raulino, jornalista pioneira em nosso Estado, trabalhou no rádio, na televisão, na imprensa escrita e hoje está na Internet. Foi Prefeita do Município de Altos. É mãe de família, tem uma família numerosa. É uma pessoa de bem, dedicada às causas sociais.
	Neste dia, quero me associar à homenagem que todos fazemos em Teresina, em todo o Estado do Piauí a essa grande jornalista, que completou 70 anos de idade e mais de 40 anos de carreira na imprensa do Piauí.
	Muito obrigado."
2016-11-29T17:26;"REGISTRO, PRESENÇA, CÂMARA DOS DEPUTADOS, MAJOR PAULO ROBERTO, VEREADOR, PARTIDO SOCIALISTA BRASILEIRO (PSB) (1987), TERESINA (PI). 
SOLIDARIEDADE, POPULAÇÃO, CHAPECÓ (SC), ACIDENTE AÉREO, TIME ESPORTIVO, FUTEBOL, ASSOCIAÇÃO CHAPECOENSE DE FUTEBOL.
ANÚNCIO, APRESENTAÇÃO, PARECER DO RELATOR, COMISSÃO MISTA, MPV 745/2016 , MEDIDA PROVISÓRIA, REFORMA, ENSINO MÉDIO. 
CONTRARIEDADE, CELERIDADE, VOTAÇÃO, PL4850/2016, PROJETO DE LEI ORDINÁRIA, MEDIDA, COMBATE, CORRUPÇÃO.";BREVES COMUNICAÇÕES;"O SR. ÁTILA LIRA (PSB-PI. Sem revisão do orador.) - Sr. Presidente, Sras. e Srs. Parlamentares, quero registrar a presença no plenário do Vereador Major Paulo Roberto, do PSB, que está com o Deputado Júlio Cesar. Sejam bem-vindos!
	Eu tenho três pontos a considerar. 
	Primeiramente, presto solidariedade ao Município de Chapecó, a sua população, aos familiares dos jogadores, dos atletas, dos jornalistas e da delegação, que passaram por essa tragédia que enluta todo o Brasil.
	Em segundo lugar, quero registrar que o Relator da matéria sobre a reforma do ensino médio, atendendo justamente às emendas, apresentou o relatório. Estamos agora em fase de debates. S.Exa. introduziu as modificações principais, como o alongamento do prazo de implantação da reforma. Também incluiu disciplinas consideradas essenciais, que foram excluídas na primeira apresentação, como Filosofia, Psicologia, Artes e Educação Física. O projeto vai ser debatido e deve ser votado, creio, nesta semana, contribuindo muito para melhorar o ensino médio.
	Meu caro Presidente, chamo a atenção dos colegas Deputados para o fato de que vamos hoje iniciar o processo de votação do projeto originado das 10 Medidas contra a Corrupção, tratadas na Comissão Especial e cujo Relator é o Deputado Onyx Lorenzoni.
	Eu acho um anacronismo - temos que pensar duas vezes - votarmos essa matéria com uma pressa desnecessária, quando todas as matérias de relevo passam por Comissão Especial. E nós vamos votar essa matéria de forma açodada para atender a um clamor, às vezes, populista.
	Nesse sentido, eu quero registrar que vou votar, porque tenho que acompanhar o partido, mas estou insatisfeito com a forma pela qual foi encaminhada essa matéria.
	O SR. PRESIDENTE (Expedito Netto) - Ouvimos o Deputado Átila Lira, do Piauí."
2016-11-30T15:44;MPV 746/2016, MEDIDA PROVISÓRIA, ALTERAÇÃO, LEI DE DIRETRIZES E BASES DA EDUCAÇÃO NACIONAL (1996), REFORMA, ENSINO MÉDIO, ORGANIZAÇÃO, CURRÍCULO ESCOLAR, BASE NACIONAL COMUM CURRICULAR (BNCC), AMPLIAÇÃO, CARGA HORÁRIA, IMPLEMENTAÇÃO, EDUCAÇÃO EM TEMPO INTEGRAL, EDUCAÇÃO E FORMAÇÃO PROFISSIONAL, CRIAÇÃO, POLÍTICA DE FOMENTO À IMPLEMENTAÇÃO DE ESCOLAS DE ENSINO MÉDIO EM TEMPO INTEGRAL, REPASSE, RECURSOS, UNIÃO, ESTADO, DISTRITO FEDERAL, MINISTÉRIO DA EDUCAÇÃO, CRITÉRIO, TEMA, COMISSÃO MISTA, RELATÓRIO, AVALIAÇÃO POSITIVA.;PEQUENO EXPEDIENTE;"O SR. ÁTILA LIRA (PSB-PI. Sem revisão do orador.) - Sr. Presidente, Srs. Parlamentares, registro que, hoje, a Comissão Mista que examina a Medida Provisória nº 746, de 2016, que trata da reforma do ensino médio, Comissão essa presidida pelo Deputado Izalci e com o Senador Pedro Chaves como Relator, concluiu o relatório, apresentou projeto com as alterações sugeridas pela comunidade educacional, e o Senador Pedro Chaves atendeu a uma solicitação nossa, através de emenda, reincluindo no relatório e no projeto de conversão da medida provisória a oferta da Língua Espanhola de caráter optativo.
	Portanto, em um primeiro momento, havia sido excluída a Língua Espanhola. Agora, depois de muitos debates, atendendo não só à minha indicação, mas atendendo aos Parlamentares e à comunidade educacional, o Relator fez as modificações para melhorar o projeto.
	O projeto vem para a Câmara e para o Senado, e aqui nós vamos concluir a sua tramitação e aprovar um projeto melhor para a educação, no ensino médio.
	Muito obrigado."
2016-12-14T19:48;TRECHO, RODOVIA FEDERAL, BR-235, SANTA FILOMENA (PI), GILBUÉS (PI), MONTE ALEGRE (PI), INAUGURAÇÃO, ELOGIO.;BREVES COMUNICAÇÕES;"O SR. ÁTILA LIRA (PSB-PI. Sem revisão de orador.) - Sr. Presidente, Srs. Parlamentares, eu quero registrar um evento que ocorreu recentemente em nosso Estado, que foi a inauguração pelo Ministro dos Transportes, Dr. Quintella, do trecho da BR-235 que compreende Santa Filomena, Gilbués e Monte Alegre. 
	Ajudei a dar início à obra em 1994, e agora ela está sendo entregue. Foi concluída com recursos do Governo Federal e com o trabalho do Governo do Estado, tanto na gestão de Wilson Martins como na de Wellington Dias. 
	É uma obra, Sr. Presidente, que também teve a colaboração da comunidade, do Prefeito Esdras Avelino, do ex-Prefeito Quirino Lustosa, do Deputado Fernando Monteiro. Nós estávamos numa luta de mais de 30 anos para que essa estrada viesse a se consolidar.
	Essa obra é importante para o Piauí, para o Maranhão e para a economia rural de toda a região.
	Obrigado.
	O SR. PRESIDENTE (Carlos Manato) - Muito obrigado, Deputado.

PRONUNCIAMENTO ENCAMINHADO PELO ORADOR
	Sr. Presidente, Sras. e Srs. Deputados, ocupo a tribuna neste momento para ressaltar a alegria de recebermos no meu Estado, o Piauí, a inauguração das obras de implantação e pavimentação asfáltica da rodovia BR-235, no trecho entre os Municípios de Santa Filomena, Gilbués e Monte Alegre, realizada na última sexta-feira, dia 9 de dezembro.
	Essa é a conclusão de uma jornada que se iniciou em 1994 e que finalmente vemos concluída através do empenho do Governo Federal e do Governo Estadual. Alegra-me poder dizer que também contribuí para essa realização. Gostaria de parabenizar o ex-Prefeito da cidade de Santa Filomena, Quirino Avelino, que iniciou essa luta conosco; o ex-Prefeito Lustosa e o atual Prefeito da cidade, Esdras Avelino.
	Destaco a importância de obras como esta para desenvolvimento da região Piauí e Maranhão, levando prosperidade aos comerciantes locais, além de facilitar a vida dos cidadãos e de quem possa usufruir da nova rodovia. 
	Ainda temos um longo caminho a percorrer, levando mais dignidade aos cidadãos piauienses, mas, lutando por um Piauí, melhor conseguiremos avançar cada vez mais.
	Muito obrigado."
2017-03-07T16:18;"CIMENTO, NASSAU, FÁBRICA, FECHAMENTO, POSSIBILIDADE, PIAUÍ, ANÁLISE.
ECONOMIA, RECUPERAÇÃO, BANCO NACIONAL DE DESENVOLVIMENTO ECONÔMICO E SOCIAL (BNDES), APOIO, POLÍTICA ECONÔMICA, EXPECTATIVA.";PELA ORDEM;"O SR. ÁTILA LIRA (PSB-PI. Pela ordem. Sem revisão do orador.) - Sr. Presidente, Srs. Parlamentares, registro o encerramento das atividades da Cimento Nassau no Piauí, a maior fábrica de cimento no Estado, do grupo pernambucano João Santos. Eram 500 empregos diretos, sem considerar toda a cadeia de negócios que funciona em torno da indústria cimenteira.
	Nós lamentamos esse fato, que é uma consequência da situação econômica do País. Já apelamos para o Governador, para a Presidência da República e para os bancos de desenvolvimento, a fim de que ajudem a Cimento Nassau em sua recuperação econômica, para que possa voltar a produzir em nosso Estado, dada a importância que essa indústria representa do ponto de vista econômico e social.
		Peço apoio ao Governo Federal para que o Ministro da Fazenda, adepto de política econômica muito ortodoxa, olhe para a questão da recuperação da economia através das empresas que precisam do apoio do poder público via BNDES.
	O SR. PRESIDENTE (Capitão Augusto) - Obrigado, Deputado."
2017-03-28T10:00;;HOMENAGEM;"Ata da 48ª (quadragésima oitava) Sessão da Câmara dos Deputados, Não Deliberativa Solene, Matutina, da 3ª Sessão Legislativa Ordinária, da 55ª Legislatura, em 28 de março de 2017. Às 10h01min, o Sr. Assis Carvalho, no exercício da presidência, nos termos do § 2º do art. 18 do Regimento Interno, declarou aberta a sessão e deu por dispensada a leitura da ata da sessão anterior. O Sr. Presidente informou que a sessão destinou-se à homenagem à Batalha de Jenipapo; prestou as devidas homenagens; e convidou para compor a Mesa os Srs. Átila Lira, Coordenador da Bancada do Piauí no Congresso; José de Ribamar Carvalho, Prefeito do Município de Campo Maior - PI; Elmano Férrer, Senador da República; Regina Sousa, Senadora da República e Presidente do Partido dos Trabalhadores no Estado do Piauí; e Wellington Dias, Governador do Estado do Piauí. O Sr. Presidente convidou todos a ouvir o Hino Nacional. Após a exibição de vídeo institucional, o Sr. Presidente proferiu discurso do Sr. Rodrigo Maia, Presidente da Câmara dos Deputados. Nos termos do § 2º do art. 18 do Regimento Interno, assumiu a presidência o Sr. Átila Lira e concedeu a palavra aos Srs. Assis Carvalho, autor do requerimento; e Hildo Rocha, pelo PMDB. Reassumiu a Presidência o Sr. Assis Carvalho e concedeu a palavra aos Srs. Silas Freire, pelo PR, Átila Lira, Elmano Férrer, Regina Sousa, José de Ribamar Carvalho e Wellington Dias, componentes da Mesa. Usaram da palavra pela ordem os Srs. Maia Filho, Carlos Henrique Gaguim, Erika Kokay e Carlos Zarattini. Usaram ainda da palavra os Srs. Aluísio Martins, Deputado Estadual do Piauí; e Paulo Martins, Secretário do Esporte do Estado do Piauí. O Sr. Presidente convidou todos a ouvir o Hino do Piauí; registrou a presença de convidados; reiterou as homenagens prestadas; agradeceu a presença de todos; e, às 12h14min, encerrou a sessão.

Carlos Manato
Presidente

Laura Carneiro
Secretária

As notas taquigráficas desta Sessão Não Deliberativa Solene poderão ser solicitadas ao Departamento de Taquigrafia, Revisão e Redação - DETAQ."
2017-03-28T10:00;;FALA DO PRESIDENTE OU NO EXERCÍCIO DA PRESIDÊNCIA;"Ata da 48ª (quadragésima oitava) Sessão da Câmara dos Deputados, Não Deliberativa Solene, Matutina, da 3ª Sessão Legislativa Ordinária, da 55ª Legislatura, em 28 de março de 2017. Às 10h01min, o Sr. Assis Carvalho, no exercício da presidência, nos termos do § 2º do art. 18 do Regimento Interno, declarou aberta a sessão e deu por dispensada a leitura da ata da sessão anterior. O Sr. Presidente informou que a sessão destinou-se à homenagem à Batalha de Jenipapo; prestou as devidas homenagens; e convidou para compor a Mesa os Srs. Átila Lira, Coordenador da Bancada do Piauí no Congresso; José de Ribamar Carvalho, Prefeito do Município de Campo Maior - PI; Elmano Férrer, Senador da República; Regina Sousa, Senadora da República e Presidente do Partido dos Trabalhadores no Estado do Piauí; e Wellington Dias, Governador do Estado do Piauí. O Sr. Presidente convidou todos a ouvir o Hino Nacional. Após a exibição de vídeo institucional, o Sr. Presidente proferiu discurso do Sr. Rodrigo Maia, Presidente da Câmara dos Deputados. Nos termos do § 2º do art. 18 do Regimento Interno, assumiu a presidência o Sr. Átila Lira e concedeu a palavra aos Srs. Assis Carvalho, autor do requerimento; e Hildo Rocha, pelo PMDB. Reassumiu a Presidência o Sr. Assis Carvalho e concedeu a palavra aos Srs. Silas Freire, pelo PR, Átila Lira, Elmano Férrer, Regina Sousa, José de Ribamar Carvalho e Wellington Dias, componentes da Mesa. Usaram da palavra pela ordem os Srs. Maia Filho, Carlos Henrique Gaguim, Erika Kokay e Carlos Zarattini. Usaram ainda da palavra os Srs. Aluísio Martins, Deputado Estadual do Piauí; e Paulo Martins, Secretário do Esporte do Estado do Piauí. O Sr. Presidente convidou todos a ouvir o Hino do Piauí; registrou a presença de convidados; reiterou as homenagens prestadas; agradeceu a presença de todos; e, às 12h14min, encerrou a sessão.

Carlos Manato
Presidente

Laura Carneiro
Secretária

As notas taquigráficas desta Sessão Não Deliberativa Solene poderão ser solicitadas ao Departamento de Taquigrafia, Revisão e Redação - DETAQ."
2017-04-06T11:12;BACIA HIDROGRÁFICA, RIO PARNAÍBA, RETOMADA OBRA, DEFESA.;BREVES COMUNICAÇÕES;"O SR. ÁTILA LIRA (PSB-PI. Sem revisão do orador.) - Sr. Presidente, Srs. Parlamentares, estivemos no Ministério do Meio Ambiente, tratando com o Ministro Sarney Filho justamente da finalização da implantação do Comitê da Bacia do Rio Parnaíba, um projeto já legalmente criado e que está sendo desenvolvido pelos Governos e comunidades do Maranhão, do Piauí e do Ceará. 
	A implantação desse comitê será fundamental para a preservação e revitalização do Rio Parnaíba e seus afluentes. Ele conta com investimentos do Governo Federal e de instituições até internacionais e irá permitir o planejamento do saneamento e a recuperação de matas ciliares, sobretudo cuidando desses rios que alimentam o Rio Parnaíba e o Rio Poti.
	O SR. PRESIDENTE (Carlos Manato) - Muito obrigado, Deputado. Vamos divulgar o pronunciamento de V.Exa. no  programa A Voz do Brasil.

PRONUNCIAMENTO ENCAMINHADO PELO ORADOR
	Presidente, Sras. e Srs. Deputados, ocupo a tribuna neste momento para tratar sobre a importância de criação do Comitê da Bacia Hidrográfica do Rio Parnaíba e a importância de conseguirmos recursos para a revitalização do Rio Parnaíba.
	Considerada a segunda mais importante do Nordeste, a bacia do Parnaíba é uma das 12 grandes regiões hidrográficas do Brasil, com enorme importância social e econômica, que se estende por uma área de 331.441 quilômetros quadrados, abrangendo os Estados do Maranhão, Piauí e Ceará.
	O Rio Parnaíba é um rio genuinamente nordestino e tem relevância na Região Nordeste, servindo como meio de sobrevivência para milhões de pessoas que vivem às suas margens.
	A cidade de Teresina, Capital do Estado do Piauí, é a principal área habitada da bacia hidrográfica. Apesar da extensão do Parnaíba e seus afluentes, a área caracteriza-se por índices críticos de abastecimento de água, rede de saneamento básico e tratamento de esgoto. Tal déficit de abastecimento de água á geralmente citado como fator principal do escasso desenvolvimento da área da bacia.
	Com a criação do comitê da Bacia Hidrográfica do Rio Parnaíba, vamos dispor de um órgão gestor de recursos hídricos com corpo técnico capacitado, integrado pelo poder público, representantes da sociedade civil e de empresas usuárias de água.
	O comitê definirá ações para recuperação da bacia, garantindo que os recursos oriundos de programas de apoio à região sejam aplicados prioritariamente na recuperação de áreas degradadas, relacionadas à conservação dos recursos hídricos.
	O momento atual é muito importante para a gestão de recursos hídricos em todo o mundo. Somos conscientes de que devemos cuidar dos recursos naturais, garantindo seu uso para as gerações futuras. A criação desse Comitê será muito importante para o desenvolvimento sustentável do nosso Estado. 
	Reforço também o empenho da bancada, do Governo do Estado e de organizações não governamentais na busca por recursos para o projeto de revitalização de toda a bacia do Rio Parnaíba.
	Contamos com o apoio do Ministro do Meio Ambiente, o Sarney Filho, e do Governador do Estado do Piauí, o Wellington Dias, nessa luta. Vamos trabalhar para recuperar áreas e garantir uma água de qualidade que possa servir a muitas gerações, Afinal, hoje a questão do meio ambiente é a pauta número um, sobretudo na política nacional. 
	Muito obrigado."
2017-04-10T18:00;JOSÉ LINCOLN DE SOUSA MENESES, PREFEITO, SÃO JOÃO DA FRONTEIRA (PI), HOMENAGEM PÓSTUMA.;BREVES COMUNICAÇÕES;"O SR. ÁTILA LIRA (PSB-PI. Sem revisão do orador.) - Sr. Presidente, Srs. Parlamentes, eu quero registrar e lamentar o falecimento do Prefeito de São João da Fronteira, o Dr. José Lincoln de Sousa Meneses, um grande Prefeito, engenheiro, professor e produtor de cera de carnaúba. Esse grande homem público foi um exemplo na região. Era Prefeito pela segunda vez. Veio a falecer agora. Estive presente e registrei o lamento geral da população. Foi uma comoção o seu falecimento. 
	Muito obrigado.
	O SR. PRESIDENTE (Alberto Fraga) - Eu que agradeço, Deputado.

PRONUNCIAMENTO ENCAMINHADO PELO ORADOR
	Sr. Presidente, Sras. e Srs. Deputados, ocupo a tribuna nesta segunda-feira para lamentar o falecimento do Prefeito de São João da Fronteira, José Lincoln de Sousa Meneses, conhecido como Zé Lincoln, ocorrido na manhã do último domingo, dia 9 de abril, em Teresina.
	Formado em Engenharia de Agrimensura e professor da Universidade Federal do Piauí, Zé Lincoln teve grande destaque na área política. Foi Vereador em Piracuruca e o primeiro Prefeito de São João da Fronteira, com mandato de 1997 a 2000. Tendo sido reeleito em 2001, assumindo novamente o mandato em janeiro de 2017, mostrou que seu trabalho foi reconhecido pelos serviços prestados em prol dessa população.
	Também foi produtor comercial de extrativismo de cera da palha da carnaúba, atuando como grande exemplo de empreendedorismo e incentivador das riquezas do nosso Estado, como esse produto natural da nossa terra.
	Meus sinceros sentimentos aos familiares e amigos de Zé Lincoln nesse momento de dor e luto. Esse é um momento em que todas as homenagens se fazem necessárias. 
	Muito obrigado."
