dataHoraInicio;keywords;tipoDiscurso;transcricao
2017-05-17T14:30;"SAUDAÇÃO, PREFEITO, PIAUÍ, MARCHA A BRASÍLIA EM DEFESA DOS MUNICÍPIOS (20:2017).
MENDONÇA FILHO, MINISTRO DE ESTADO, MINISTÉRIO DA EDUCAÇÃO, PRESENÇA, COMISSÃO DE EDUCAÇÃO, APRESENTAÇÃO, BALANÇO, GESTÃO.
REFORMA, ENSINO MÉDIO, DEFESA.";BREVES COMUNICAÇÕES;"O SR. ÁTILA LIRA (PSB-PI. Sem revisão do orador.) - Sr. Presidente, Srs. Parlamentares, é um prazer estar sob a presidência do grande companheiro JHC.
	Eu quero cumprimentar os Prefeitos pela realização da XX Marcha a Brasília em Defesa dos Municípios, bem como o Presidente da Associação Piauiense de Prefeitos Municipais e os Prefeitos do Estado do Piauí que participaram da marcha.
	Quero ainda aproveitar este momento para registrar que hoje nós tivemos uma audiência pública com a presença do Ministro da Educação, oportunidade em que ele apresentou um relato do ano de exercício à frente do Ministério da Educação. Na ocasião, nós registramos a importância da aprovação da reforma do ensino médio.
	Muito obrigado."
2017-05-24T19:12;MANIFESTAÇÃO DE PESAR POR FALECIMENTO, FRANCISCO FERREIRA RAMOS, MÉDICO, PIAUÍ.;PELA ORDEM;"O SR. ÁTILA LIRA (PSB-PI. Pela ordem. Sem revisão do orador.) - Sr. Presidente, Sras. e Srs. Parlamentares, eu queria registrar o falecimento de um médico piauiense, do Dr. Francisco Ferreira Ramos, que foi Deputado Estadual do PSB, um grande médico, formado pela Faculdade Nacional de Medicina do Rio de Janeiro, e, durante vários anos, professor na Universidade Federal do Piauí.
	Quero registrar os nossos sentimentos à família, aos descendentes, por sua história de médico exemplar.

PRONUNCIAMENTO ENCAMINHADO PELO ORADOR
	Sr. Presidente, Sras. e Srs. Deputados, ocupo a tribuna neste momento para lamentar o falecimento de Francisco Ferreira Ramos, conhecido como Dr. Chico Ramos, pioneiro na área de Neurologia do Piauí.
Dr. Chico foi médico do Hospital Getúlio Vargas (HGV) por 50 anos, destes tendo sido diretor por 20 anos e responsável pela fundação da Clínica Neurológica do hospital e pela ampliação de vários setores.
Além de médico, exerceu os cargos de Deputado Estadual, Vereador e Professor Titular de Neurocirurgia do Departamento de Medicina da UFPI. 
Deixa um legado de conhecimento e experiência, um exemplo na Medicina e na vida, sendo querido por todos os que o conheceram e compartilharam de sua sabedoria.
	Natural de Valença do Piauí, de família pobre, encontrou nos estudos de Medicina a oportunidade de crescer na vida e ajudar todos os que precisavam, com disciplina, respeito, moral e ética, sendo reconhecido pela sua dedicação profissional e pessoal. 
	Meus sinceros sentimentos aos familiares e amigos do Dr. Chico Ramos neste momento de dor e luto. Este é um momento em que todas as homenagens se fazem necessárias. 
	Muito obrigado."
2017-06-20T16:20;ACIDENTE DE TRÂNSITO, BR-135, RODOVIA FEDERAL, PIAUÍ, APREENSÃO.;PELA ORDEM;"O SR. ÁTILA LIRA (PSB-PI. Pela ordem. Sem revisão do orador.) - Sr. Presidente, Srs. Parlamentares, eu queria registrar um fato lamentável. Falo dos acidentes que estão ocorrendo permanentemente na BR-135, na região Sul do Estado do Piauí.
	Queríamos que o Ministério tomasse providências, inclusive enviando o Diretor do DNIT para visitar a região. Só nesta semana já morreram mais de dez pessoas.
	Nesse sentido, nós pedimos providências imediatas do Ministério. A bancada como um todo deseja uma solução e precisa disso."
2017-07-10T14:12;EDUCAÇÃO, OLIMPÍADA BRASILEIRA DE MATEMÁTICA DAS ESCOLAS PÚBLICAS (OBMEP), DENOMINAÇÃO, EVENTO, COCAL DOS ALVES (PI), AVALIAÇÃO POSITIVA.;PEQUENO EXPEDIENTE;"O SR. ÁTILA LIRA (PSB-PI. Sem revisão do orador.) - Sr. Presidente, Srs. Parlamentares, eu quero registrar hoje um fato relevante na área da educação.
	Tradicionalmente, o Brasil realiza todo ano a Olimpíada Brasileira de Matemática das Escolas Públicas. E o fato relevante é que uma escola do Estado do Piauí coleciona medalhas e já acumula, desde 2006, 131 medalhas de Matemática ao longo desses anos. 
	Isso ocorre numa escola chamada Augustinho Brandão, no interior do Estado, numa cidade conhecida como Cocal dos Alves. É uma cidade que tem 6 mil habitantes, um IDH de 0,498, mas abriga uma escola que tem atingido os melhores resultados na Olimpíada, mesmo com um perfil socioeconômico inadequado. No ano passado, da turma de 18 alunos do 3º ano, 15 entraram pelo vestibular em instituições públicas. 
	Essa Olimpíada é uma iniciativa de estudiosos da Matemática no Brasil, professores e universidades. No Piauí, a iniciativa se desenvolveu por intermédio de um professor de Matemática, hoje Mestre em Matemática, chamado Antônio Cardoso do Amaral. Ele dirigiu a Escola Augustinho Brandão e, ao longo de 10 anos, preparou os alunos para que tivessem gosto pela Matemática. Isso fez com que a escola passasse a ser líder no Brasil. Esse é o aspecto fenomenal. A escola é líder no Brasil em medalhas em relação ao aproveitamento em Matemática.
	Quero destacar que essa escola recebeu o nosso apoio, quando Secretário de Educação. Ajudamos no seu desenvolvimento, dando-lhe todo o apoio para que os professores, os alunos e o Município continuassem nesse trabalho de fazer com que a Matemática se estenda como área de interesse não só daquela escola, naquele Município, mas também de escolas em todo o Estado."
2017-07-10T14:45;"EDUCAÇÃO A DISTÊNCIA, MINISTÉRIO DA EDUCAÇÃO, REGULAMENTAÇÃO, CURSO (EDUCAÇÃO), EDUCAÇÃO SUPERIOR, GRADUAÇÃO, PÓS-GRADUAÇÃO, NÚMERO, AMPLIAÇÃO. 
COMISSÃO DE EDUCAÇÃO, PROJETO DE LEI ORDINÁRIA, NÚMERO, EXISTÊNCIA, REGULAMENTAÇÃO, RESTRIÇÃO, CURSO (EDUCAÇÃO), ÁREA, SAÚDE.";PELA ORDEM;"O SR. ÁTILA LIRA (PSB-PI. Pela ordem. Sem revisão do orador.) - Sr. Presidente, Srs. Parlamentares, o Ministério da Educação regulamentou a educação a distância em todo o território nacional. Trata-se de modalidade de ensino que cresce no País, justamente pelo desenvolvimento da tecnologia. Isso já é comum nos principais países da Europa, nos Estados Unidos, na China e no Japão. E, no Brasil, está ganhando espaço cada vez maior.
	Essa nova regulamentação permite que as instituições de ensino superior possam ampliar a oferta de cursos superiores de graduação e pós-graduação, com a criação de polos de ensino a distância, com credenciamento, com autonomia, levando em consideração, sobretudo, a experiência educacional das instituições já credenciadas.
	Essa nova regulamentação tem sido muito bem recebida no setor. Mas, na Comissão de Educação, nós temos vários projetos de lei que buscam regulamentar de forma mais rígida os cursos de ensino a distância da área de saúde.
	A área de saúde tem, através das instituições de defesa profissional ligadas a médicos, enfermeiros, nutricionistas, veterinários, bioquímicos, apresentado propostas para que o ensino a distância, na área da saúde, tenha rigidez muito maior no que diz respeito ao uso de tecnologias e de laboratórios.
	Nós estamos discutindo com o Ministério da Educação esse novo decreto e propondo regulamentação complementar que possa contemplar essa preocupação que a sociedade reclama. Ou seja, o ensino a distância, em determinadas áreas, é muito mais viável. Na área da saúde, deve haver maior rigor, justamente por lidar com seres vivos, com as pessoas, o que nos leva a manter uma discussão muito maior dentro do Congresso e junto ao Ministério da Educação e à sociedade.
	Muito obrigado.
	O SR. PRESIDENTE (Mauro Pereira) - Obrigado, Deputado Átila Lira. Parabéns pelo trabalho de V.Exa."
2017-08-02T14:36;PARECER CONTRÁRIO, COMISSÃO DE CONSTITUIÇÃO E JUSTIÇA E DE CIDADANIA (CCJC), SIP 1/2017, SOLICITAÇÃO PARA INSTAURAÇÃO DE PROCESSO, AUTORIZAÇÃO, INVESTIGAÇÃO, SUPREMO TRIBUNAL FEDERAL (STF), DENÚNCIA, MINISTÉRIO PÚBLICO FEDERAL (MPF), MICHEL TEMER, PRESIDENTE DA REPÚBLICA, VOTO FAVORAVEL.;REGISTRO DE VOTO;"O SR. ÁTILA LIRA (PSB-PI.) - Sr. Presidente, eu sou um advogado do estado mínimo, e, nesse sentido, nós já estamos vivendo a retomada da economia, que, com a estabilidade política, é fator essencial para o crescimento. Portanto, eu voto com o relatório da CCJC. Eu voto ""sim"".
	O SR. GIACOBO - Deputado Átila Lira: voto ""sim"". Total: 179 votos."
2017-08-10T10:12;"REPÚDIO, CRIAÇÃO, FUNDO PÚBLICO, FINANCIAMENTO PÚBLICO, CAMPANHA ELEITORAL. 
DEFESA, CLÁUSULA DE BARREIRA, REFORMA POLÍTICA.";BREVES COMUNICAÇÕES;"O SR. ÁTILA LIRA (PSB-PI. Sem revisão do orador.) - Sr. Presidente, Srs. Parlamentares, a Comissão Especial da Reforma Política começou a tomar uma série de decisões em relação a essa grande reforma que nós precisamos fazer aqui. A alguns pontos sou favorável - fim da vinculação, cláusula de barreira -, mas ela tomou uma decisão em relação à qual eu me posiciono contrariamente.
	Já falei para os companheiros do Rio Grande do Sul e de Pernambuco que eu sou contra fundo público para financiar campanha eleitoral. Campanha eleitoral tem que ser financiada por contribuição de partido, de filiado de partido e pessoa física, dentro dos limites estabelecidos pela lei. Nada de usarmos dinheiro público para financiar qualquer partido. E já foi abolida a contribuição empresarial.
	Este é o meu voto: contrário a qualquer financiamento público de campanha eleitoral. 
Financiamento zero!"
2017-08-10T11:16;"FUNDO DE FINANCIAMENTO ESTUDANTIL (FIES), MEDIDA PROVISÓRIA, COMISSÃO MISTA, INSTALAÇÃO.
EDILSON BATISTA DE SOUSA, VEREADOR, SÃO LUIS DO PIAUÍ (PI), CÂMARA DOS DEPUTADOS, VISITA.";PELA ORDEM;"O SR. ÁTILA LIRA (PSB-PI. Pela ordem. Sem revisão do orador.) - Sr. Presidente, Srs. Parlamentares, eu presidi agora, no Senado Federal, a instalação da Comissão Mista que vai examinar a medida provisória que reformula o Fundo de Financiamento Estudantil.
	O FIES tem grande importância para a educação, para o acesso à educação, e para ele há a proposta de uma nova legislação, com três modalidades de financiamento.
	O Senador Dalirio Beber presidirá essa Comissão, e o Deputado Alex Canziani será o Relator dessa matéria. Eu participarei como membro da Comissão, para aperfeiçoar esse projeto.
	Aproveito para registrar a presença do Vereador Edilson, que preside a Câmara Municipal do Município de São Luis do Piauí. Ele, sua esposa e um assistente estão visitando a nossa Casa democrática, que vive seu maior momento de debate e de busca de soluções deste Brasil querido, que precisa crescer mais ainda.
	Muito obrigado.
	Bom dia.
	O SR. PRESIDENTE (Leonardo Monteiro) - Seu pronunciamento será registrado, Sr. Deputado."
2017-08-14T19:54;ÁTILA LIRA, DEPUTADO FEDERAL, PARTICIPAÇÃO, ANIVERSÁRIO, EMANCIPAÇÃO POLÍTICA, PARNAÍBA (PI).;BREVES COMUNICAÇÕES;"O SR. ÁTILA LIRA (PSB-PI. Sem revisão do orador.) - Sr. Presidente, Srs. Parlamentares, eu quero registrar hoje o aniversário da cidade de Parnaíba, no Estado do Piauí, que completa 173 anos de emancipação política.
	Estivemos hoje na solenidade de festejo desse grande dia, com o Prefeito Mão Santa que já foi Governador do Estado por duas vezes e é Prefeito daquela grande cidade. Nesse sentido, nós estivemos participando e reafirmando com vários colegas Parlamentares o apoio à administração desse grande Prefeito da segunda maior cidade do Estado do Piauí e a cidade que deu o grito de independência do reinado de Portugal.
	Muito obrigado."
2017-08-17T09:20;TERESINA (PI), ANIVERSÁRIO, EMANCIPAÇÃO POLÍTICA, COMEMORAÇÃO, FIRMINO FILHO, PREFEITO, GESTÃO, ELOGIO.;BREVES COMUNICAÇÕES;"O SR. ÁTILA LIRA (PSB-PI. Sem revisão do orador.) - Sr. Presidente, Sras. e Srs. Parlamentares, ontem, dia 16 de agosto, a cidade de Teresina, Capital do meu Estado, o Piauí, completou 165 anos de emancipação.
	Teresina é hoje uma cidade que tem uma população em torno de 800 mil habitantes, é a maior cidade da região na prestação de serviços de saúde e educação e tem uma organização urbana planejada e serviços coletivos de boa qualidade.
	A Prefeitura de Teresina é dirigida, pela quarta vez, pelo jovem Prefeito Firmino Filho, do PSDB, cuja gestão é aprovada, sobretudo, pelos indicadores da educação. Entre as capitais do Nordeste, Teresina tem o melhor padrão educacional da região e, na área de saúde, tem serviços públicos de boa qualidade.
	Portanto, eu quero registrar esta importante data, em que nós não só festejamos o aniversário da cidade, mas, sobretudo, destacamos o trabalho administrativo realizado pela Prefeitura de Teresina.
	Muito obrigado, Sr. Presidente."
2017-08-22T17:06;CENTRAIS ELÉTRICAS BRASILEIRAS (ELETROBRAS), PRIVATIZAÇÃO, APOIO.;BREVES COMUNICAÇÕES;"O SR. ÁTILA LIRA (PSB-PI. Sem revisão do orador.) - Sr. Presidente, com todo o respeito ao companheiro Deputado Júlio Delgado, esse não é o pensamento geral. O meu pensamento é de aplauso à decisão do Ministério de Minas e Energia de privatizar uma empresa ineficiente, que não serve mais ao País, a não ser às corporações e aos partidos políticos.
	Portanto, sou favorável à privatização da ELETROBRAS assim como de outras empresas que pertencem ao poder público, cuja função não é essa.
	O SR. PRESIDENTE (Carlos Manato) - Muito obrigado."
2017-08-23T11:20;MONALYSA ALCÂNTARA, MODELO DE PASSARELA, PIAUI, DISCRIMINAÇÃO RACIAL, REPUDIO.;BREVES COMUNICAÇÕES;"O SR. ÁTILA LIRA (PSB-PI. Sem revisão do orador.) - Sr. Presidente, Srs. Parlamentares, eu queria registrar hoje um fato lamentável que ocorreu esses dias, de discriminação de origem e de cor, que foi a escolha do Miss Brasil.
	Nesse concurso Miss Brasil, foi eleita uma piauiense, afrodescendente, de nome Monalysa - o nome é lindo, a moça é linda. E as redes sociais passaram a tecer comentários preconceituosos.
	É lamentável que ainda ocorra essa discriminação, que eu relaciono não só à questão da cor, mas também ao fato de ela ter nascido no Piauí. Até hoje isso ainda ocorre. 
Eu estudei aqui na terra deste grande Deputado, em Minas Gerais, e lá ficavam admirados porque eu era do Piauí e sabia falar e ainda era um dos melhores alunos de lá. Foi por isso que eu superei esses preconceitos, destaquei-me, trabalhei, e hoje sou Parlamentar pela sétima vez.
	Estou aqui justamente reprovando a atitude de algumas pessoas que discriminaram a nossa Miss Piauí, que é belíssima e que ganhou não só pela beleza, não; ganhou pela desenvoltura, pela forma de se comunicar e por mostrar que pode representar o Brasil.
	O SR. PRESIDENTE (Carlos Manato) - Muito obrigado, Sr. Deputado. Só quero dizer que a capixaba ficou em terceiro lugar (Risos.)"
2017-08-29T09:00;;HOMENAGEM;"Ata da 236ª (ducentésima trigésima sexta) Sessão da Câmara dos Deputados, Não Deliberativa Solene, matutina, da 3ª Sessão Legislativa Ordinária, da 55ª Legislatura, em 29 de agosto de 2017. Às 9h12, o Sr. Assis Carvalho, no exercício da Presidência, nos termos do § 2º do artigo 18 do Regimento Interno, declarou aberta a sessão e deu por dispensada a leitura da ata da sessão anterior. O Sr. Presidente informou que a sessão se destinou à homenagem ao aniversário de trezentos anos da cidade de Oeiras; prestou as devidas homenagens; e convidou para compor a Mesa os Srs. Fábio Novo, Secretário da Cultura do Estado do Piauí; José Raimundo de Sá Lopes, Prefeito da cidade de Oeiras; Átila Lira, Deputado Federal, Coordenador da Bancada do Piauí; José Alberto Pinheiro, Presidente da Câmara de Vereadores de Oeiras; Regina Sousa, Senadora da República; e Wellington Dias, Governador do Estado do Piauí. O Sr. Presidente convidou todos a ouvir o Hino Nacional. Após a exibição do vídeo institucional, o Sr. Presidente proferiu discurso do Sr. Rodrigo Maia, Presidente da Câmara dos Deputados, e concedeu a palavra aos Srs. Rodrigo Martins, pelo PSB; Silas Freire, pelo PODE; Marcelo Castro, pelo PMDB; Maia Filho, pelo PP; e aos Srs. componentes da Mesa, José Raimundo de Sá Lopes, José Alberto Pinheiro, Fábio Novo, Regina Sousa e Átila Lira. Nos termos do § 2º do artigo 18 do Regimento Interno, assumiu a Presidência o Sr. Átila Lira e concedeu a palavra ao Sr. Assis Carvalho, autor do requerimento. Reassumiu a Presidência o Sr. Assis Carvalho e concedeu a palavra à Sra. Erika Kokay, pelo PT; e ao Sr. Wellington Dias, componente da Mesa. Usou da palavra pela ordem o Sr. Heráclito Fortes. Após a apresentação dos ""Bandolins de Oeiras"", interpretando o hino da cidade de Oeiras e as canções O Trenzinho do Caipira, Pra Não Dizer Que Não Falei das Flores e Refazenda, o Sr. Presidente registrou a presença de convidados, reiterou as homenagens prestadas, agradeceu a presença de todos e, às 11h09, encerrou a sessão.

Carlos Manato
Presidente

Keiko Ota
Secretária

As notas taquigráficas desta Sessão Não Deliberativa Solene poderão ser solicitadas ao Departamento de Taquigrafia, Revisão e Redação - DETAQ."
2017-08-29T09:00;;FALA DO PRESIDENTE OU NO EXERCÍCIO DA PRESIDÊNCIA;"Ata da 236ª (ducentésima trigésima sexta) Sessão da Câmara dos Deputados, Não Deliberativa Solene, matutina, da 3ª Sessão Legislativa Ordinária, da 55ª Legislatura, em 29 de agosto de 2017. Às 9h12, o Sr. Assis Carvalho, no exercício da Presidência, nos termos do § 2º do artigo 18 do Regimento Interno, declarou aberta a sessão e deu por dispensada a leitura da ata da sessão anterior. O Sr. Presidente informou que a sessão se destinou à homenagem ao aniversário de trezentos anos da cidade de Oeiras; prestou as devidas homenagens; e convidou para compor a Mesa os Srs. Fábio Novo, Secretário da Cultura do Estado do Piauí; José Raimundo de Sá Lopes, Prefeito da cidade de Oeiras; Átila Lira, Deputado Federal, Coordenador da Bancada do Piauí; José Alberto Pinheiro, Presidente da Câmara de Vereadores de Oeiras; Regina Sousa, Senadora da República; e Wellington Dias, Governador do Estado do Piauí. O Sr. Presidente convidou todos a ouvir o Hino Nacional. Após a exibição do vídeo institucional, o Sr. Presidente proferiu discurso do Sr. Rodrigo Maia, Presidente da Câmara dos Deputados, e concedeu a palavra aos Srs. Rodrigo Martins, pelo PSB; Silas Freire, pelo PODE; Marcelo Castro, pelo PMDB; Maia Filho, pelo PP; e aos Srs. componentes da Mesa, José Raimundo de Sá Lopes, José Alberto Pinheiro, Fábio Novo, Regina Sousa e Átila Lira. Nos termos do § 2º do artigo 18 do Regimento Interno, assumiu a Presidência o Sr. Átila Lira e concedeu a palavra ao Sr. Assis Carvalho, autor do requerimento. Reassumiu a Presidência o Sr. Assis Carvalho e concedeu a palavra à Sra. Erika Kokay, pelo PT; e ao Sr. Wellington Dias, componente da Mesa. Usou da palavra pela ordem o Sr. Heráclito Fortes. Após a apresentação dos ""Bandolins de Oeiras"", interpretando o hino da cidade de Oeiras e as canções O Trenzinho do Caipira, Pra Não Dizer Que Não Falei das Flores e Refazenda, o Sr. Presidente registrou a presença de convidados, reiterou as homenagens prestadas, agradeceu a presença de todos e, às 11h09, encerrou a sessão.

Carlos Manato
Presidente

Keiko Ota
Secretária

As notas taquigráficas desta Sessão Não Deliberativa Solene poderão ser solicitadas ao Departamento de Taquigrafia, Revisão e Redação - DETAQ."
2017-10-03T12:34;CARLOS BURLAMAQUI, ENGENHEIRO CIVIL, PIAUÍ, EX-SECRETÁRIO DE ESTADO DE OBRAS PÚBLICAS, FALECIMENTO, HOMENAGEM PÓSTUMA.;BREVES COMUNICAÇÕES;"O SR. ÁTILA LIRA (PSB-PI. Sem revisão do orador.) - Sr. Presidente, Srs. Parlamentares, eu registro o passamento do engenheiro civil Carlos Burlamaqui, que foi um grande homem público. Ele foi Secretário de Obras Públicas do Estado do Piauí, Secretário de Administração. Foi também um grande professor de Física, um dos fundadores do Departamento de Física da Universidade Federal do Piauí.
	Neste momento, eu quero prestar uma homenagem à memória desse grande companheiro, amigo, funcionário exemplar do nosso Estado.
Manifesto a minha solidariedade aos seus familiares e registro os nossos sentimentos de saudade por esse grande homem público e grande amigo que tive em meu Estado.
	O SR. PRESIDENTE (Carlos Manato) - Obrigado, nobre Deputado.

PRONUNCIAMENTO ENCAMINHADO PELO ORADOR
	Sr. Presidente, Srs. Parlamentares, ocupo a tribuna nesta terça-feira para lamentar o falecimento de um grande homem e grande amigo, o engenheiro civil e professor da Universidade Federal do Piauí - UFPI Carlos Burlamaqui.
	Carlos Burlamaqui foi fundador e professor aposentado do Departamento de Física da Universidade Federal do Piauí e muito contribuiu para essa área da educação no nosso Estado. Além disso, foi Secretário de Obras Públicas do Governo Dirceu Arcoverde (1975-1979); de Administração na gestão Freitas Neto (1991-1994) e Presidente da então PRODEPI, atual ATI - Agência de Tecnologia da Informação do Estado do Piauí. Seu trabalho e legado permanecerão para sempre.
	Neste momento de dor, deixo meu carinho aos seus familiares e amigos, partilhando da saudade que o nosso amigo deixa não só em mim, mas também  em todos que tiveram suas vidas tocadas por ele.
	Era o que tinha a dizer.
	Obrigado."
2017-10-10T13:42;ENCAMINHAMENTO, ANÁLISE, FRANCISO SOARES, PROFESSOR, CRISE, PLANO DE SAÚDE, SERVIDOR PÚBLICO CIVIL FEDERAL.;BREVES COMUNICAÇÕES;"O SR. ÁTILA LIRA (PSB-PI. Sem revisão do orador.) - Sr. Presidente, Sras. e Srs. Deputados, eu queria encaminhar ao Ministério da Previdência Social e ao Ministério da Saúde uma exposição de motivos do Prof. Francisco Soares, um ambientalista e lutador das causas dos servidores públicos, em que demonstra que os planos de saúde dos servidores federais se encontram em crise, entre eles o CAPESAÚDE, que é o plano de saúde da Caixa de Previdência e Assistência dos Servidores da Fundação Nacional de Saúde - CAPESESP, e a Geap. 
	Dentre seus filiados estão os servidores da Fundação Nacional de Saúde - FUNASA e do Instituto Nacional do Seguro Social - INSS, que estão em vias de desfiliação.
O Prof. Soares apresenta uma série de ideias e de recomendações para a recuperação da Geap, que é o maior plano de saúde dos servidores públicos federais. 
	Nesse sentido, vou encaminhar essa exposição de motivos aos dois Ministérios e à Geap."
2017-10-17T10:00;;HOMENAGEM;"Ata da 306ª (tricentésima sexta) Sessão da Câmara dos Deputados, Não Deliberativa Solene, matutina, da 3ª Sessão Legislativa Ordinária, da 55ª Legislatura, em 17 de outubro de 2017. Às 10h05, o Sr. Carlos Manato, 4º Suplente de Secretário, no exercício da Presidência, declarou aberta a sessão e deu por dispensada a leitura da ata da sessão anterior. O Sr. Presidente informou que a sessão se destinou à homenagem ao 195º aniversário da Adesão do Piauí à Independência do Brasil - Dia do Piauí; prestou as devidas homenagens; e convidou para compor a Mesa os Srs. Assis Carvalho, Deputado Federal; Átila Lira, Coordenador da Bancada Federal do Piauí; Alexandra Vieira, Presidente da Associação Cultural dos Amigos do Piauí; Elmano Férrer, Senador da República; Regina Sousa, Senadora da República; e Wellington Dias, Governador do Estado do Piauí. O Sr. Presidente convidou todos a ouvir o Hino Nacional. Após a apresentação do Hino do Estado do Piauí, cantado por Myriam Eduardo, o Sr. Presidente proferiu discurso do Sr. Rodrigo Maia, Presidente da Câmara dos Deputados, e concedeu a palavra ao Sr. Assis Carvalho, autor do requerimento. Nos termos do § 2º do artigo 18 do Regimento Interno, assumiu a Presidência o Sr. Assis Carvalho e concedeu a palavra aos Srs. Paes Landim, pelo PTB; Júlio Cesar, pelo PSD; Silas Freire, pelo Podemos; Heráclito Fortes, pelo PSB; Maia Filho, pelo PP; Chico Alencar, pelo PSOL; Alexandra Vieira, Regina Sousa, Átila Lira, Elmano Férrer e Wellington Dias, componentes da Mesa. Usaram da palavra pela ordem os Srs. Lincoln Portela, Luiz Carlos Hauly, Edmilson Rodrigues e Benedita da Silva. O Sr. Presidente registrou a presença de convidados, reiterou as homenagens prestadas, agradeceu a presença de todos e, às 12h21, encerrou a sessão.

Carlos Manato
Presidente

Delegado Edson Moreira
Secretário

As notas taquigráficas desta Sessão Não Deliberativa Solene poderão ser solicitadas ao Departamento de Taquigrafia, Revisão e Redação - DETAQ."
2017-10-17T15:34;"ÁTILA LIRA, DEPUTADO FEDERAL, VISITA, PIRIPIRI (PI), FESTA RELIGIOSA, PARTICIPAÇÃO, ANIVERSÁRIO, COMEMORAÇÃO. 
LEITE, PRODUTOR RURAL, PREOCUPAÇÃO, IMPORTAÇÃO, PREÇO, QUESTIONAMENTO.";BREVES COMUNICAÇÕES;"O SR. ÁTILA LIRA (PSB-PI. Sem revisão do orador.) - Sr. Presidente, agradeço ao Deputado Heitor Schuch, que abre mão do seu espaço para que possamos registrar um acontecimento. 
	Nós estivemos em Piripiri, minha cidade natal, no Piauí, a terceira maior cidade do Estado, onde participamos da festa da padroeira, Nossa Senhora dos Remédios. Outubro é o mês de aniversário da cidade de Piripiri, comemorado no dia 4. 
	A cidade tem uma pecuária de corte e uma pecuária de leite. O que foi falado aqui em defesa do preço do leite hoje nos aflige naquela região. 
	O problema da importação de leite compromete todo o mercado nacional, atingindo inclusive as menores localidades. A fixação do preço somente num lugar se generaliza.
	Portanto, nós estamos aqui trabalhando juntos na defesa dos interesses daqueles que representamos no País.
	Parabenizo o povo de Piripiri e todos os fiéis que participaram das festividades de Nossa Senhora dos Remédios.
	Muito obrigado."
