dataHoraInicio;keywords;tipoDiscurso;transcricao
2016-03-23T09:28;"COMISSÃO GERAL, DEBATE, CAMPANHA DA FRATERNIDADE, SANEAMENTO BÁSICO.
PLANEJAMENTO FAMILIAR, AUSÊNCIA, CRÍTICA.";COMISSÃO GERAL;"O SR. DEPUTADO JAIR BOLSONARO - Em respeito aos convidados, gostaria de dizer que, com o assunto em si, logicamente todo mundo está preocupado. Mas, nessa linha, gostaria de incluir outro assunto que, mais cedo ou mais tarde, nós vamos ter que discutir.
	Prezadas senhoras e senhores, falta uma política de planejamento familiar no Brasil.
	Se nós olharmos para o mundo, veremos que, em 2011, havia 7 bilhões de habitantes. Em 2025, haverá 8 bilhões de habitantes. Essa mudança terá se dado em apenas 14 anos.
	O Brasil cresce um pouco mais de 2 milhões de habitantes por ano. Atingimos 205 milhões agora; em 1970, éramos 90 milhões de habitantes.
	Por melhores que sejam os Prefeitos - e há bons Prefeitos -, é quase impossível atingirem essas metas, porque o crescimento populacional está muito além de suas possibilidades de atender à população.
	O SR. PRESIDENTE (Deputado Luiz Carlos Hauly) - Conclua, Excelência.
	O SR. DEPUTADO JAIR BOLSONARO - Vou concluir, Sr. Presidente.
	Eu sei o que é a CNBB - eu sou católico -, mas Deus nos deu inteligência para saber que falta ao Brasil uma política de planejamento familiar. 
	Muito obrigado, Sr. Presidente.
	O SR. PRESIDENTE (Deputado Luiz Carlos Hauly) - Eu é que agradeço."
2016-03-29T13:40;BRASIL, DILMA ROUSSEFF, PRESIDENTE DA REPÚBLICA, IMPEACHMENT, FAVORÁVEL, VITÓRIA (ES), EVENTO, JAIR BOLSONARO, DEPUTADO FEDERAL, ORADOR, PARTICIPAÇÃO, CARLOS MANATO, DEPUTADO FEDERAL, CONVITE, AGRADECIMENTO.;BREVES COMUNICAÇÕES;"O SR. JAIR BOLSONARO (Bloco/PSC-RJ. Sem revisão do orador.) - Deputada, a Direita vem aí! Capitão Bolsonaro vem aí! V.Exas. não vão ter paz em 2018, não!
	Prezado Deputado Carlos Manato, quero cumprimentar V.Exa., que está presidindo os trabalhos, pelo convite que me fez para visitar seu Estado nas próximas quinta-feira e sexta-feira.
	Às 19h30min, estaremos pousando no aeroporto. Depois, teremos um grande ato pelo impeachment, na Praia de Camburi.
	É um ato que não é meu nem seu, mas do povo brasileiro, do povo capixaba, que não aguenta mais tanta roubalheira patrocinada pelo PT, não aguenta mais tanta incompetência, não aguenta mais um Governo que quer nos levar para uma ditadura cubana - esta, sim, ditadura. 
	Na sexta-feira, também teremos uma série de atividades em Vitória. Todos os capixabas estão convidados para esses atos, cujo roteiro divulgaremos agora à tarde, na nossa página no Facebook.
	Pode ter certeza, prezado Deputado Manato, de que o trabalho que V.Exa. vem fazendo no Espírito Santo será ainda mais reconhecido com essa iniciativa, patrocinada por V.Exa., de nos levar ao Estado para realizarmos esse grande ato pró-impeachment.
	Esse ato mostra que o povo capixaba não aguenta mais tanta incompetência e tanta roubalheira, patrocinadas por esse partido ironicamente chamado de Partido dos Trabalhadores. Eles trabalham, realmente, mas para assaltar os cofres públicos do nosso País.
	O povo brasileiro será vitorioso! Até quinta-feira! Se Deus quiser, às 19h30min estaremos pousando no Aeroporto de Vitória, onde começará esse grande ato pró-impeachment, ao qual convidamos antecipadamente toda a população a comparecer.
	Parabéns, Manato! Até lá! E até a vitória, se Deus quiser, com o impedimento dessa incompetente chamada Dilma Rousseff.
	O SR. PRESIDENTE (Carlos Manato) - Muito obrigado, nobre Deputado. 
	É uma honra recebê-lo em nosso Estado. V.Exa. vai ver o que é o carinho do povo capixaba. E digo mais: no Espírito Santo, V.Exa. não tem eleitor; V.Exa. tem fã. Todo o mundo gosta de V.Exa."
2016-03-30T09:00;;HOMENAGEM;"Ata da 60ª (sexagésima) Sessão da Câmara dos Deputados, Não Deliberativa Solene, matutina, da 2ª Sessão Legislativa Ordinária, da 55ª Legislatura, em 30 de março de 2016. Às 9h23, o Sr. Eduardo Cunha, Presidente, declarou aberta a sessão e deu por dispensada a leitura da ata da sessão anterior. O Sr. Presidente informou que a sessão destinou-se à homenagem ao aniversário de 50 anos do Partido do Movimento Democrático Brasileiro - PMDB; prestou as devidas homenagens; e convidou para compor a Mesa os Srs. Newton Cardoso Jr, Osmar Serraglio, Lelo Coimbra, Luiz Carlos Hauly e Saraiva Felipe, Deputados Federais; Eliseu Padilha, fundador do MDB/PMDB; e Ibsen Pineiro, ex-Deputado Federal. O Sr. Presidente convidou todos a ouvir o Hino Nacional; proferiu discurso de sua autoria; e concedeu a palavra aos Srs. Newton Cardoso Jr, autor do requerimento; Edinho Araújo, pelo PMDB; e Carlos Marun, Deputado Federal. Nos termos do § 2º do artigo 18 do Regimento Interno, assumiu a Presidência o Sr. Newton Cardoso Jr e concedeu a palavra aos Srs. Luiz Carlos Hauly, pelo PSDB; Danilo Forte, pelo PSB; José Carlos Aleluia, pelo Democratas; Rubens Bueno, Líder do PPS; Goulart, pelo PSD; Evair de Melo, Líder em exercício do PV; Carlos Henrique Gaguim, pelo PTN; Beto Mansur, pelo PRB; Marcondes Gadelha, pelo PSC; Arnaldo Faria de Sá, pelo PTB; e Orlando Silva, pelo PCdoB. O Sr. Presidente convidou ainda para compor a Mesa o Sr. Mauro Benevides, ex-Deputado Federal, e concedeu a palavra aos Srs. componentes da Mesa, Eliseu Padilha, Ibsen Pinheiro e Mauro Benevides. Usaram da palavra pela ordem os Srs. Carlos Bezerra, Saraiva Felipe, Mandetta, Mauro Pereira, Josi Nunes, Baleia Rossi, Vitor Valim, Sóstenes Cavalcante, Soraya Santos, Heráclito Fortes, Lelo Coimbra, Delegado Edson Moreira, Marco Tebaldi, Darcísio Perondi, Luiz Carlos Hauly, João Marcelo Souza, Leonardo Picciani, Edinho Bez, Alceu Moreira, Ronaldo Benedet, Jair Bolsonaro, Valdir Colatto, Leonardo Quintão e Rogério Peninha Mendonça, Deputados Federais; e o Sr. Bruno Júlio, Presidente Nacional da Juventude do PMDB. O Sr. Presidente registrou a presença de convidados, reiterou as homenagens prestadas, agradeceu a presença de todos e, às 13h04, encerrou a sessão.

Beto Mansur
Presidente

                Delegado Edson Moreira
Secretário

As notas taquigráficas desta Sessão Não Deliberativa Solene poderão ser solicitadas ao Departamento de Taquigrafia, Revisão e Redação - DETAQ."
2016-03-30T18:38;"QUESTIONAMENTO, PARTIDO DOS TRABALHADORES (PT), ÓDIO, DEMOCRACIA. 
ELOGIO, APOIO, ORDEM DOS ADVOGADOS DO BRASIL (OAB), GOLPE DE ESTADO (1964), IMPEACHMENT, FERNANDO COLLOR, EX-PRESIDENTE DA REPÚBLICA, DILMA ROUSSEFF, PRESIDENTE DA REPÚBLICA.";BREVES COMUNICAÇÕES;"O SR. JAIR BOLSONARO (Bloco/PSC-RJ. Sem revisão do orador.) - Sr. Presidente, meus companheiros, tenho uma pergunta: por que o PT tem tanto ódio da democracia? Por que o PT odeia tanto a nossa liberdade? Por que o PT odeia tanto a classe média, que sobrevive às suas custas e não depende de nada do Governo? Por que o PT odeia tanto as minorias e joga umas contra as outras?
	Meus companheiros, quando o PT diz que não vai ter golpe, o recado que o PT está dando para os seus militantes é o seguinte: ""Caso venham cassar a Dilma Rousseff, vale tudo contra aqueles que a cassaram"".
	O PT odeia a lei.
	Quanto a essa questão do vale tudo, eu tenho ouvido aqui, agora, Deputados do PT, do PCdoB e alguns do PSOL dizerem até que vai ter luta dentro do Congresso Nacional.
	O que vocês querem com isso?
	Eu quero aqui, agora, elogiar a OAB. Em 1964, ela esteve ao lado do povo pela cassação de João Goulart. Ela esteve ao lado do povo pela cassação de Collor de Mello. E, agora, mesmo estando aos 48 minutos do segundo tempo, a OAB também entrou nessa luta pela cassação de Dilma Rousseff, que escancarou a porta de estatais para que pudessem assaltá-las à vontade, desde que apoiassem projetos nesta Casa que visavam, em última análise, a chegada ao poder absoluto do PT.
	O PT é um partido que não respeita ninguém. O PT tem seus representantes setoriais que odeiam as minorias - repetindo, odeiam as mulheres. Há Deputada aqui que defende estuprador menor de idade. Nós temos Parlamentares aqui que odeiam os negros e que os jogam todo o tempo contra os brancos; odeiam os homossexuais, e os jogam contra os heterossexuais.
	Esta é a política do PT: a política do ódio.
	Eles têm um grande exército, sim - não aos moldes de Caxias, que só tem um e que estará sempre ao lado dos interesses nacionais -, que nos poderá lançar a uma aventura muito pior do que a bomba no aeroporto de Guararapes em meados de 1966. Eles podem novamente mergulhar o Brasil nas trevas, com a luta armada, para preservar o seu poder. Não pensem vocês que o PT sairá do poder de forma apenas democrática. Eles vão fazer muito mais que o diabo para se manter no poder. Por isso desarmaram o povo brasileiro e implementam a política de ódio entre nós."
2016-03-31T09:00;;HOMENAGEM;"Ata da 63ª (sexagésima terceira) Sessão da Câmara dos Deputados, Não Deliberativa Solene, matutina, da 2ª Sessão Legislativa Ordinária, da 55ª Legislatura, em 31 de março de 2016. Às 9h22, o Sr. Silas Freire, no exercício da Presidência, nos termos do § 2º do artigo 18 do Regimento Interno, declarou aberta a sessão e deu por dispensada a leitura da ata da sessão anterior. O Sr. Presidente informou que a sessão destinou-se à homenagem à TV Cidade Verde; prestou as devidas homenagens; e convidou para compor a Mesa os Srs. Elmano Férrer, Senador; Jesus Tajra, Presidente da TV Cidade Verde; José Tajra Filho, Vice-Presidente da TV Cidade Verde; José Tajra Sobrinho, empresário; e Wellington Dias, Governador do Estado do Piauí. O Sr. Presidente convidou todos a ouvir o Hino Nacional. Após a exibição do vídeo institucional, assumiu a Presidência o Sr. Átila Lira, nos termos do § 2º do artigo 18 do Regimento Interno, e concedeu a palavra ao Sr. Silas Freire, autor do requerimento. Reassumiu a Presidência o Sr. Silas Freire. Após proferir discurso do Sr. Eduardo Cunha, Presidente da Câmara dos Deputados, o Sr. Presidente concedeu a palavra aos Srs. Jesus Tajra, Wellington Dias e Elmano Férrer, componentes da Mesa; e aos Srs. Heráclito Fortes, pelo PPS; Átila Lira, pelo PV; Rodrigo Martins, pelo PSB; e Assis Carvalho, pelo PT. Reassumiu a Presidência o Sr. Átila Lira e concedeu a palavra aos Srs. Flavio Nogueira, pelo PDT; Jair Bolsonaro, pelo PSC; Mainha, pelo PP; Zé Augusto Nalin, pelo PMDB; e Jesus Tajra Filho, componente da Mesa. Usaram ainda da palavra, pela ordem, os Srs. Simão Sessim, Deputado Federal; Regina Sousa e Ciro Nogueira, Senadores da República. O Sr. Presidente registrou a presença de convidados, reiterou as homenagens prestadas, agradeceu a presença de todos e, às 11h07, encerrou a sessão.

Eduardo Cunha
Presidente

Beto Mansur
Secretário

As notas taquigráficas desta Sessão Não Deliberativa Solene poderão ser solicitadas ao Departamento de Taquigrafia, Revisão e Redação - DETAQ."
2016-03-31T11:18;BRASIL, DILMA ROUSSEFF, PRESIDENTE DA REPÚBLICA, IMPEACHMENT, FAVORÁVEL, MANIFESTAÇÃO, VITÓRIA (ES), JAIR BOLSONARO, DEPUTADO FEDERAL, ORADOR, PARTICIPAÇÃO, REGISTRO.;BREVES COMUNICAÇÕES;"O SR. JAIR BOLSONARO (Bloco/PSC-RJ. Sem revisão do orador.) - Sr. Presidente, prezado Deputado Carlos Manato, amanhã eu vou participar de uma reunião partidária em Vitória. E, aproveitando a oportunidade, registro que aceitei, de bom grado e com muita satisfação, o convite de V.Exa. para participar de alguns eventos em Vitória, não só no dia de hoje, mas também no dia de amanhã.
	Hoje, às 19h30min, pousaremos no aeroporto de Vitória. Depois iremos até a Praia de Camburi, onde será realizado um grande ato pró-impeachment de Dilma Rousseff, que contará, com toda a certeza, com a participação maciça do povo capixaba. O remédio para este momento difícil que a Nação vive é o afastamento dessa senhora, que não tem as mínimas condições de governabilidade.
	Deputado Carlos Manato, pode ter certeza de que o ato, que começa no aeroporto de Vitória, às 19h30min, e termina na Praia de Camburi, é creditado a V.Exa. No dia seguinte, também haverá muitas atividades em Vitória. Eu agradeço o convite mais uma vez e registro o prestígio de V.Exa. junto ao povo capixaba, entre o qual já é um sucesso. 
	Parabéns, meu irmão, meu amigo, Deputado Carlos Manato! Parabéns ao povo capixaba! Antecipadamente, eu agradeço todas as manifestações de apoio e consideração que estamos recebendo na mídia social. 
	Até as 19h30min de hoje, Deputado Carlos Manato, se Deus quiser! Um abraço e felicidades!
	O SR. PRESIDENTE (Carlos Manato) - Deputado Jair Bolsonaro, eu agradeço em nome do povo capixaba. Todos nós estamos muito ansiosos pela presença de V.Exa. Realmente vai ser uma festa da democracia."
2016-03-31T11:52;GOLPE DE ESTADO (1964), FORÇAS ARMADAS, ATUAÇÃO, HOMENAGEM.;PELA ORDEM;"O SR. JAIR BOLSONARO (Bloco/PSC-RJ. Pela ordem. Sem revisão do orador.) - Sr. Presidente, o que está acontecendo no Brasil não se vai encerrar numa votação dentro deste plenário. Este recado do vale-tudo está vindo do Partido dos Trabalhadores. E hoje a data é emblemática.
	Primeiro, quero saudar o PT e o PCdoB pelo dia de amanhã, o Dia da Mentira. Sem mentira, vocês não existem. Sem enganação, sem roubalheira, sem corrupção, vocês não existem.
	Eles estão dando sinais de que vão para o tudo ou nada. Estes movimentos de rua não são movimentos que nascem do sentimento popular. São movimentos que vêm sendo bancados por recursos públicos, arrebanhando cada vez mais gente que não tem nenhum conhecimento de política.
	Eu quero, Sr. Presidente, saudar o 31 de março de 1964, segunda data da independência do nosso Brasil. Não quero saudar apenas os militares das Forças Armadas. Quero saudar todo o povo brasileiro, que naquela época foi às ruas pedir o afastamento do comunista João Goulart.
	O Congresso, ouvindo a voz das ruas, este Congresso que aqui está, no dia 2 de abril de 1964, cassou o mandato de João Goulart.
	Esse pessoal da Esquerda é tão descarado, tão sem caráter, que no ano retrasado votou um projeto de decreto legislativo anulando a sessão de 2 de abril de 1964, como o ídolo deles, Lenin, que apagava fotografias.
	A ""esquerdalha"" no Brasil, que não tem compromisso com a verdade, com a democracia nem com a liberdade, simplesmente apaga fatos. É uma vergonha essa Esquerda do Brasil! É uma máquina do ódio e da mentira.
	Sr. Presidente, trago três manchetes de jornais da época. Veja que manchete atualíssima na capa do Correio da Manhã de 31 março de 1964: ""O Brasil já sofreu demasiado com o Governo atual. Agora, basta!""
	Agora, basta, Dilma! Basta, PT! Basta, PCdoB! Basta, PSOL! Chega de roubar da Nação brasileira! Chega de enganar os mais humildes!
	Manchete do jornal O Globo de 4 de abril de 1964: ""Ressurge a Democracia. Vive a Nação dias gloriosos"".
	Nós vamos chegar lá. Nós vamos afastar esse corpo estranho chamado PT. Quero dizer ao Líder do PT, que há pouco passou por esta tribuna, que presidencialismo de coalizão não é vale-tudo, não! Não é jogar Ministério para cima e enfiar dinheiro na cueca de assessor Parlamentar, não! O seu irmão, até pouco tempo, estava no xilindró. O grande defensor da democracia, preso no regime militar e na democracia de vocês, estava cumprindo pena na Papuda por corrupção.
	A última manchete, Sr. Presidente, é do Jornal do Brasil de 6 de abril de 1964. Pontes de Miranda, respeitado até hoje, enunciou: ""As Forças Armadas violaram a Constituição para poder salvá-la"".
	Meus senhores, com base no art. 142 da Constituição Federal, as Forças Armadas estão à disposição da soberania nacional, tenham certeza! De acordo com o art. 142, as Forças Armadas cumprirão seu papel constitucional. As Forças Armadas nunca foram intrusas na política. Sempre estiveram subordinadas à vontade nacional, e assim será.
	Não vai ser um Ministro comunista, do PCdoB, Aldo Rebelo, que vai dar qualquer ordem às Forças Armadas para defender um Governo corrupto, canalha, imoral, que não tem nenhum compromisso com a democracia ou com a nossa liberdade.
	Muito obrigado.
	Salve o dia 31 de março de 1964!
	O SR. PRESIDENTE (Carlos Manato) - Muito obrigado, nobre Deputado."
2016-04-05T17:04;DILMA ROUSSEFF, PRESIDENTE DA REPÚBLICA, IMPEACHMENT, CORRELAÇÃO, PAULO SKAF, PRESIDENTE, FEDERAÇÃO DAS INDÚSTRIAS DO ESTADO DE SÃO PAULO (FIESP), ATUAÇÃO, SOLIDARIEDADE, REGISTRO.;PELA ORDEM;"O SR. JAIR BOLSONARO (Bloco/PSC-RJ. Pela ordem. Sem revisão do orador.) - Sr. Presidente, peço a V.Exa. que faça retirar das notas taquigráficas as palavras chulas proferidas pelo Deputado Silvio Costa.
	O SR. SILVIO COSTA - Não retiro nenhuma! Eu retiraria se fosse em relação a.... (O microfone é desligado.)
	O SR. PRESIDENTE (Carlos Henrique Gaguim) - Deputado Sílvio Costa, o Deputado Jair Bolsonaro está com a palavra.
	O SR. JAIR BOLSONARO - Sr. Presidente, eu nunca conversei com o Dr. Paulo Skaf, mas quero cumprimentá-lo por estar à frente da FIESP, federação de um Estado que representa 40% do PIB nacional. A classe empresarial é que gera impostos para que aqueles que Sílvio Costa defende agora recebam os benefícios, em nome de projetos ditos sociais, que na verdade são assistencialistas. Se o Dr. Paulo Skaf - ele não precisa de mim, não! - quiser visitar este plenário, será meu convidado.
	Muito obrigado, Sr. Presidente. (Palmas.)"
2016-04-16T05:04;DCR 1/2015, DENÚNCIA POR CRIME DE RESPONSABILIDADE, DILMA ROUSSEFF, PRESIDENTE DA REPÚBLICA, IMPEACHMENT, COMISSÃO ESPECIAL, PARECER, ADMISSIBILIDADE, APROVAÇÃO, FAVORÁVEL, REGISTRO.;DISCUSSÃO;"O SR. JAIR BOLSONARO (Bloco/PSC-RJ. Sem revisão do orador.) - Sr. Presidente, fui obrigado a ouvir que foice e martelo são símbolos de democracia. Símbolos esses que mataram mais de 100 milhões de inocentes pelo mundo.
	Mas vou diretamente ao assunto aqui, Sr. Presidente, que é extremamente grave e completamente diferente do que foi tratado até agora. Eu estou com um livro aqui de Pepe Mujica, um dos integrantes do Foro de São Paulo, juntamente com as FARC, bem como com Fidel Castro, dentre tantos outros. O livro é Uma ovelha negra no poder: confissões e intimidades de Pepe Mujica.
	Esse livro não vai chegar ao Brasil. Já está há 8 meses no Uruguai, Mujica o botou no mercado, mas ele não vai chegar aqui. Eu recomendo que vocês leiam esse livro. Ele não é do Cel. Carlos Alberto Brilhante Ustra, não é do Cel. Lício Ribeiro Maciel, mas de um elemento integrante do Foro de São Paulo, amigo de Lula e Dilma.
	Vamos lá. Do livro cito aqui duas passagens apenas. Uma reunião secreta de Mujica com as FARC em Cuba e logo depois a mesma reunião entre Mujica e as FARC, só que em Brasília, com Lula e Dilma presentes. Vamos continuar, porque o final é estarrecedor. Outro episódio do livro do Mujica foi o caso da Venezuela adentrar o MERCOSUL. O Brasil queria que a Venezuela adentrasse o MERCOSUL. Mas havia um problema: tinham que convencer o Mujica a afastar o Paraguai, que estava contra também, para a Venezuela poder entrar.
	E, quando foi marcada a reunião, dias antes aconteceu um fato inusitado: o impeachment de Lugo, no Paraguai. Dilma não poderia viajar para o Uruguai e nem Mujica poderia viajar para o Brasil. O que ela fez, então? Mandou um avião da Força Aérea Brasileira, segundo o livro, buscar o que seria o Marco Aurélio Garcia de Mujica. E assim foi feito. O avião da Força Aérea Brasileira foi lá e voltou.
	Dentro do Palácio do Planalto, Dilma começou a falar, e esse preposto, Marco Aurélio Garcia, emissário de Mujica, começou a anotar. Dilma falou: ""Essa reunião não existiu"". Dilma entrega para esse representante de Mujica uma série de documentos, fotografias e captações telefônicas, levantadas pelas inteligências - prestem atenção - cubana e venezuelana e pela ABIN. 
	E assim foi feito. O avião da FAB retornou para o Uruguai. Dias depois, conseguiram fazer com que a Venezuela entrasse no MERCOSUL. 
	Está claro aqui: Dilma Rousseff toma decisões de Estado ouvindo as inteligências cubana e venezuelana.
	Vamos em frente. Aconteceu por esses dias, e todo o mundo ficou sabendo: ""ABIN confirma a autenticidade de ameaça terrorista contra o Brasil"". Isso não é de graça. Isso não é por acaso. E o linguajar vazado pela ABIN? ""Podemos atacar esse país de merda"". Esse não é o linguajar do Estado Islâmico. O ataque seria feito pelo Estado Islâmico. Esse não é o linguajar deles. E mais ainda: a característica do terrorismo é a surpresa. Não manda recado. Mas nós vamos chegar ao final dessa linha.
	A ABIN, no passado, era vinculada à Casa Militar - que foi extinta -, ao Gabinete de Segurança Institucional, GSI. Recentemente, Dilma recriou a Casa Militar, mas a ABIN ficou lá na Secretaria de Governo, de Ricardo Berzoini - ou seja, uma inteligência política -, o que não ocorreria em um país sério, onde estaria ligada às Forças Armadas.
	O que é importante agora, Sr. Presidente e colegas Deputados? Dilma Rousseff, Lula e o PT não entregarão o Governo por uma votação na Câmara e no Senado. O que eles teriam que fazer para justificar não o entregarem? Ato terrorista. ""Ah, foi o Estado Islâmico!"" Um ato terrorista justificaria o decreto já rascunhado por ela e denunciado por mim. Depois, o jornalista Reinaldo Azevedo, que não gosta de mim, fez uma brilhante matéria nesse sentido, e vazou - verdade ou não - que os comandantes militares não cumpririam o decreto do Ministério da Defesa redigido nos moldes elaborados por Dilma Rousseff. Agora, havendo um ato terrorista de proporções razoáveis, as Forças Armadas seriam aspiradas, seriam obrigadas a entrar, a respeitar e a tomar providências nas questões relacionadas ao estado de defesa. E mais ainda: esta Casa e aquela outra ali ao lado teriam o prazo de 10 dias para votar o decreto do estado de defesa.
	Eu duvido que, nessas condições, estas duas Casas não votem favoráveis ao decreto do estado de defesa.
	Os fatos estão aí, comprovados rapidamente por gente deles, do Foro de São Paulo, gente que não tem qualquer amor à democracia ou à liberdade, gente que faz o diabo para chegar ao poder e fará muito mais que o diabo para não deixá-lo. Só não entende quem não quer.
	Quando ainda estava na Presidência, Lula, na Colômbia, sugeriu que as FARC criassem um partido político, como o PT aqui fez. Vale lembrar que o Foro de São Paulo nasceu em 1990, integrado, entre outros, por Cuba, FARC e Brasil, por Dilma e Lula naquele momento. Em 2002, as FARC se desfiliaram, para dizer que não estavam mais juntos. Mas estão sim. Dentro do Brasil existem mais de 14 mil cubanos. Existe aqui gente do Estado Islâmico, senegaleses. Não estou chamando todo senegalês de bandido. Existem haitianos, e é a mesma coisa. Mas há muita gente aqui disposta a fazer mais que o diabo para o PT não sair do poder.
	Por que isso também?
	A ditadura cubana é financiada com o dinheiro brasileiro, já que 1 bilhão e 300 milhões de reais por ano vão para Cuba em nome desse programa conhecido como Mais Médicos. Alguém acha que o PT está preocupado com o pobre, que está preocupado com a saúde do povo brasileiro? É muita inocência acreditar que essa facção criminosa chegou ao poder para fazer algo pelo nosso País.
	Sr. Presidente e meus amigos, tomem as devidas providências de defesa. Eu sou obrigado a falar que a minha preocupação é enorme pelo próximo domingo. Vários comissionados de petistas que estavam em seus Estados vieram para cá e confeccionaram os seus novos crachás. O Cavalo de Tróia está aqui dentro. Para eles, não existem limites. Para nós, são a Constituição e a lei. Concordo com isso. Vejo colegas com a bandeira do Brasil e tiras de cores verde e amarela no pescoço, mas as armas da esquerda não são essas.
	O Brasil está na iminência de mergulhar em um banho de sangue. Os fatos estão aí. Eles não chegaram para brincar. Conhecem a vida pregressa de Dilma Rousseff? Conhecem os grupos terroristas que ela integrou, os assassinatos, as execuções praticadas por integrantes de seus grupos? Conhecem Carlos Araújo, conhecem Cláudio Galeno, conhecem Franklin Martins e o agente cubano José Dirceu? Este, inclusive, quando foi apeado da Casa Civil por corrupção, recebeu Dilma Rousseff com grito: ""Companheira em armas!"".
	Meus amigos, esperem o pior. Esta Casa cassou João Goulart, no dia 2 de abril de 1964. Eles dizem que foi golpe. Depois, cassou Collor de Mello por outro motivo. Mas lá todos queriam a saída de João Goulart, porque estávamos praticamente dentro do comunismo. A mesma coisa agora acontece, mas, ouso dizer, é muito mais grave que o pré-64. Quando Pinochet assumiu, em 1973, havia dentro do Chile mais de 30 mil cubanos. Maduro agora conta, dentro da Venezuela, com mais de 80 mil cubanos.
	Esses carrapatos, esses vermes não vão nos largar após uma simples votação do impeachment nesta Casa. Peço a Deus para estar errado.
	Muito obrigado, meus companheiros. (Palmas.)"
