dataHoraInicio;keywords;tipoDiscurso;transcricao
2016-08-22T20:22;MPV 723/2016, MEDIDA PROVISÓRIA, PRORROGAÇÃO, PROGRAMA MAIS MÉDICOS, ENCAMINHAMENTO DE VOTAÇÃO, CONTRARIO.;ENCAMINHAMENTO DE VOTAÇÃO;"O SR. JAIR BOLSONARO (Bloco/PSC-RJ. Sem revisão do orador.) - Sr. Presidente, pelo que tudo indica, esse caso do ""Mais Médicos Cubanos"" vai ficar com o futuro Presidente da República.
	Deixo bem claro que eu seria favorável a esse programa com algumas condições. Primeiro, o exame REVALIDA - que não seja aplicado nos níveis atualmente vistos no Brasil! Seria, desculpem-me aqui o exagero, o REVALIDA light. Seria favorável ao programa, também, se os cubanos pudessem trazer as suas famílias para cá. Quanto aos homens que estão aqui, ditos médicos, suas esposas e filhos estão em Cuba; para as mulheres vale a mesma coisa, seus maridos e filhos estão em Cuba também.
	O Governo deixou bem claro, por ocasião da primeira discussão desse assunto aqui, que aquele cubano que porventura pedir asilo será simplesmente deportado para Cuba.
	Outra questão é o salário, que faz parte da minha emenda aqui. Hoje em dia, em torno de 80%, ou seja, 8 mil reais, vão para Cuba. Multiplicando isso pelo número de cubanos que nós temos aqui, dá em torno de 1 bilhão e 300 milhões de reais para a ditadura cubana. A cada acordo desses firmado e prorrogado, são 4 bilhões de reais para a ditadura cubana, a cada ciclo de 3 anos.
	Agora a minha suspeita - suspeita apenas, petistas, por favor; eu tenho certeza, mas vou falar em suspeita - é que uma parte dessa grana volta para cá. Com toda a certeza, volta para cá uma parte dessa grana! Ou o tribunal de contas de Fidel e Raúl Castro está preocupado com isso? É uma maneira de abastecer indiretamente o foro de São Paulo. 
	Assim sendo, Sr. Presidente, lamentavelmente fizeram um acordão. Está aí o novo Governo Temer, que chegou para deixar tudo como está.
	Com este programa, V.Exas. estão botando dentro da sua cozinha uma cascavel. Já foi levantado que há militares e agentes cubanos neste programa. V.Exas. podem ser surpreendidos, mais cedo ou mais tarde, com ações desta gente aqui no Brasil. Com um simples exame REVALIDA, light que fosse, teríamos como levantar quem realmente tem noções de Medicina e quem é agente aqui em nosso País.
	V.Exas. estão entregando o Brasil para pouco mais de 12 mil agentes cubanos. Que isso fique bem claro! A tradição de Cuba é exportar mercenários e tratar questões externas dessa maneira. E o Governo tudo fará para não deixar de graça a sua possível saída, com o cartão vermelho, agora, do Senado.
	Reflitam sobre o ato antipatriótico que V.Exas. estão fazendo agora, aceitando esta medida provisória na forma original, como Dilma editou!"
2016-08-22T20:22;DEFESA, EMC 3/2016, EMENDA DE PLENÁRIO, PROIBIÇÃO, MÉDICO, CONTRATAÇÃO, PROGRAMA MAIS MÉDICO, ENVIO, REMUNERAÇÃO, CUBA, MPV 723/2016, MEDIDA PROVISÓRIA, ENCAMINHAMENTO DE VOTAÇÃO, VOTO FAVORÁVEL.;ENCAMINHAMENTO DE VOTAÇÃO;"O SR. JAIR BOLSONARO (Bloco/PSC-RJ. Sem revisão do orador.) - Falarei rapidamente, Sr. Presidente. 
Se não for acolhida a minha emenda, estaremos contrariando a Constituição. A forma de contratarmos estrangeiros tem que ser a mesma ao contratarmos brasileiros.
	A cada período de 3 anos, nós estamos mandando 4 bilhões de reais para a ditadura cubana. Esses médicos estão sendo escravizados no nosso Brasil, além de não poderem trazer a família para o nosso País. Não temos qualquer comprovação se são médicos ou não. 
Por que o PT é contra sabermos se são médicos, se são enfermeiros, se são militares ou se são agentes cubanos agindo aqui dentro? Não podemos deixar esse tipo de gente aqui dentro. Ainda mais, há a suspeição ou quase certeza de que parte dessa grana volta para o PT, volta para cá, dinheiro para o fórum de São Paulo que vem para cá.
	Peço apoio a esta emenda, Sr. Presidente, até porque é um crime um médico trabalhar por apenas 2 mil reais por mês."
2016-09-14T12:28;COMISSÃO GERAL, VIOLÊNCIA CONTRA A MULHER, ESTUPRO, IMPUNIDADE, COMBATE, CORRELAÇÃO, POLÍTICA PÚBLICA, NECESSIDADE, TEMA, JAIR BOLSONARO, DEPUTADO FEDERAL, ORADOR, PARTICIPAÇÃO, REGISTRO.;COMISSÃO GERAL;"O SR. DEPUTADO JAIR BOLSONARO - Sr. Presidente, V.Exa. deu a uma oradora um tempo a mais de 3 minutos. Só quero isso, nada além. Quero 5 minutos mais 3 minutos.
	Primeiramente, vou falar sobre a acusação de apologia ao estupro. O fato ocorreu em 2003: a Deputada Maria do Rosário foi ao Salão Verde defender o estuprador Champinha, à época menor de idade, e eu fui lá dizer que ele sabia o que estava fazendo e que, para o futuro, deveríamos aprovar a redução da maioridade penal. A Deputada perdeu o debate e me chamou de estuprador. Quanto ao resto, todos sabem o que veio a acontecer. 
	No final de 2014, revivi esse fato na tribuna da Câmara. A Sra. Ela Wiecko apresentou denúncia contra mim, numa armação da Sra. Ideli Salvatti, à época Secretária de Direitos Humanos. Aproveitando-se da amizade com a Deputada Maria do Rosário, bem como do fato de o Dr. Rodrigo Janot não estar no Brasil, ela foi ao Supremo Tribunal Federal e apresentou uma queixa-crime contra a minha pessoa.
	Mais recentemente, fizeram pressão junto ao Ministro Luiz Fux, para que o processo fosse instaurado e eu, declarado réu - isso como uma forma de dar uma resposta ao estupro coletivo ocorrido do Rio de Janeiro.
	Ou seja, eu estava defendendo a vítima do estupro, enquanto a Deputada Maria do Rosário estava defendendo o estuprador. No entanto, o réu passou a ser eu.
	Há poucas semanas, essa mesma Ela Wiecko, Subprocuradora da República, foi flagrada em Portugal fazendo manifestação político-partidária contra o Presidente Michel Temer e foi defenestrada da Subprocuradoria. Esse é o tipo de gente que me denunciou.
	Vamos agora aos fatos. Esta sessão está sendo um desserviço à mulher vítima de violência. De início, um representante do Ministério Público do Distrito Federal afirmou que não se garantem direitos humanos violando-se direitos humanos. Ou seja, como ele mesmo disse aqui, ele é contra a castração química, por defender os direitos humanos do estuprador - a estuprada que se exploda!
	Há pouco tempo atrás, a Sra. Deborah Duprat, em nota técnica para a Câmara, posicionou-se contra o Programa Escola Sem Partido. Diz ela no arrazoado que defende que se opine em sala de aula sobre questões de ideologia de gênero. Ou seja, criancinhas de 6 anos de idade passam agora a ser massificados, de acordo com a vontade da Sra. Duprat, de que o menino não nasceu menino e de que a menina não nasceu menina. Ao estimular o sexo, homo ou hetero, precocemente, a Sra. Deborah Duprat está escancarando as portas para a pedofilia.
	Também nesta Comissão Geral, uma assistente social da Secretaria da Criança do DF afirmou que estupro é cultura. Obviamente ela não disse, mas se conclui, que pedofilia é patologia. Desde o tempo em que a Sra. Maria do Rosário estava na Secretaria de Direitos Humanos, o site http://www.humanizaredes.gov.br/ era bem claro no sentido de que pedofilia é tabu, é mito.
	Isso quer dizer que o marmanjo que for encontrado introduzindo o pênis no ânus de um menino de 3 anos ou introduzindo o pênis na vagina de uma menina de 1 ano tem que ser levado a um hospital e, caso venha a ser atestado por laudo psiquiátrico que ele sofre de transtorno, ele não será punido, mas sim tratado.
	São as pessoas que defendem essas ideias que vêm aqui falar contra a pedofilia.
	Outra das senhoras que se pronunciaram aqui, a Sra. Ana Cláudia, representante do Coletivo Lésbico Coturno de Vênus - ""que lindo!"" -, disse que, desmilitarizando a Polícia Militar, estaríamos ajudando a defender a mulher vítima de violência.
	Para completar, Sra. Deputada Maria do Rosário, já que falamos sobre estupro, quero relembrar aqui o caso do seu cunhado. Sei que V.Exa. não é responsável por ele, nem pelo que seu irmão, sua irmã, seu pai, sua mãe ou seu filho maior de idade fazem - todos são responsáveis por si -; menciono o caso apenas a título de exemplo. Em 2003, V.Exa., então integrante da CPI da Pedofilia, programou um flagrante em Porto Alegre para combater a pedofilia. Ao se fazer o flagrante de estupro de vulnerável, quem sai do carro? Saem um barbado e uma menina de 13 anos de idade. Quem era o barbado, Deputada Maria do Rosário? O seu cunhado.
	(Desligamento automático do microfone.)
	A SRA. PRESIDENTA (Deputada Maria do Rosário) - Eu vou lhe conceder mais 1 minuto, para que V.Exa. possa concluir seu pronunciamento. Farei o mesmo com todos os Parlamentares.
	O SR. DEPUTADO JAIR BOLSONARO - Então, vamos dar o exemplo. Não vamos apenas acusar o coronel do Rio de Janeiro encontrado com uma menina de 2 anos - infelizmente não há pena de morte no Brasil, senão eu mesmo puxaria o cadafalso para ele ser enforcado.
	Fale sobre o seu cunhado, Deputada. Mostre que V.Exa. quer realmente combater a violência contra mulheres e a pedofilia dando o exemplo de casa, não buscando aqui outros exemplos. Afinal de contas, como disse aqui a Sra. Beatriz Kicis, não há, no Brasil, a cultura do estupro - há a cultura da impunidade. Explique, Deputada, por que V.Exa. votou contra a PEC da redução da maioridade penal para menores praticantes de estupro. A verdade é que V.Exa. tem defendido o menor estuprador - essa tem sido sua vida pregressa.
	Foi uma vergonha...
	(Desligamento automático do microfone.)
	(Palmas.)
	A SRA. PRESIDENTA (Deputada Maria do Rosário) - Está encerrado o tempo de V.Exa.
	Eu não farei uso do meu direito de resposta porque estou na condução dos trabalhos. Farei questão, contudo, de  e isso me impossibilita, mas eu faço questão de, depois, juntar o que foi dito aos autos dos processos que movo."
2016-09-19T16:42;GOVERNO, PARTIDO DO MOVIMENTO DEMOCRÁTICO BRASILEIRO (PMDB), VENDA, JAZIDA, NIÓBIO, INVESTIDOR ESTRANGEIRO, CHINA, REPÚDIO.;BREVES COMUNICAÇÕES;"O SR. JAIR BOLSONARO (Bloco/PSC-RJ. Sem revisão do orador.) - Sr. Presidente, eu gostaria falar sobre outros assuntos, em especial sobre cubanos, mas o momento é extremamente crítico. Quero seguir a linha do saudoso Enéas Carneiro, não obviamente com o conhecimento que ele tinha sobre o assunto. Foi uma pessoa ímpar, que infelizmente o Brasil perdeu muito cedo. Falarei sobre a questão do nióbio. Eu peço que prestem atenção ao que vou falar aqui, ou só ao final.
	Nós sabemos que o nióbio gera cobiça internacional. Ele é voltado para a indústria de alta tecnologia e é utilizado em uma série de produtos, como em aços especiais resistentes a corrosão e altas temperaturas, em chassis de automóveis, também, na Alemanha, em turbina de aviões, em gasoduto - a China acabou fazer um gasoduto de 9 mil quilômetros de extensão -, na indústria aeroespacial, bélica e nuclear, em lentes ópticas, em lâmpadas de alta intensidade e até mesmo em bijuterias, como existem no Japão, além de uma série de outras utilizações que nós não sabemos, que estão em fase de pesquisa lá fora, aqui dentro não.
	Digo que 90% do nióbio negociado no mundo vem do Brasil e o restante, basicamente do Canadá. O nióbio pesa na balança comercial deles; aqui o peso é praticamente insignificante.
	No Brasil, nós temos jazidas em Minas Gerais - exploradas em Araxá -, Amazonas e Goiás. Nós sabemos que os países do Primeiro Mundo colocam o nióbio como oferta crítica ou até mesmo ameaçada. E ninguém gosta de depender apenas de um país.
	Em 2011, empresas da China, do Japão e da Coreia do Sul compraram, por 4 bilhões de dólares, 30% das ações da Companhia Brasileira de Metalurgia e Mineração - CBMM.
	Agora, falarei sobre algo que é grave e crítico, Sr. Presidente. É crítico e inacreditável! Mas logicamente se acredita, porque vem do PT. Só para que não haja dúvida, eu vou ler uma matéria que foi publicada em alguns jornais de 15 de setembro, não com um tom crítico, mas apenas como informação - não houve nada favorável ou contrário por parte da imprensa, sempre omissa nessas questões:
		""O setor vem atraindo interesse nacional e internacional. Em 2015 - no Governo Dilma Rousseff -, a China investiu R$ 1,5 bilhão para adquirir áreas com potencial de nióbio em Goiás - com toda a certeza, na região de Catalão. É para a China que o secretário-executivo do PPI, Moreira Franco, viaja sábado em road show, apresentando o Projeto Crescer.""
	Ou seja, começou com o PT, e o PMDB agora vai vender nossas jazidas de nióbio para a China. Isso é um crime de lesa-pátria. Como se criou a Organização dos Países Exportadores de Petróleo - OPEP, aproximadamente 40 anos atrás, podemos fazer a mesma coisa para o nióbio, só que não precisamos de uma organização, pois o nióbio basicamente só existe no Brasil.
	O que podemos fazer? Primeiro, eu peço o apoio dos colegas, em especial o dos colegas desses Estados citados. Nós não podemos deixar a China entrar aqui, comprar áreas para explorar nióbio, como se estivesse retirando minério de ferro ou qualquer outro mineral. Não. Estão retirando um mineral que não existe em outro lugar no mundo. Só existe aqui, nobre Presidente Deputado Delegado Edson Moreira, como existe, por exemplo, no seu Estado. Nós devemos nos preocupar com isso! 
	Agora, fica-se fazendo economia em cima do desgraçado do aposentado ou do teto para o servidor, e deixamos vazar bilhões de dólares entregando riquezas minerais para os chineses!
	Obrigado, Sr. Presidente.
	O SR. PRESIDENTE (Delegado Edson Moreira) - Seu pronunciamento será divulgado no programa A Voz do Brasil e nos meios de comunicação da Casa."
2016-10-17T16:20;CMPROMISSO, ORADOR, NEGOCIAÇÃO, COMPATIBILIDADE, TRATAMENTO, MILITAR, REFORMA PREVIDENCIÁRIA, PEC 241/2016, PROPOSTA DE EMENDA À CONSTITUIÇÃO, CRIAÇÃO, NOVO REGIME FISCAL, PROIBIÇÃO, CONCESSÃO, VANTAGEM PECUNIÁRIA, SERVIDOR PÚBLICO MILITAR.;BREVES COMUNICAÇÕES;"O SR. JAIR BOLSONARO (Bloco/PSC-RJ. Sem revisão do orador.) - Sr. Presidente, Deputados Alberto Fraga e Sóstenes Cavalcante, quero apenas dar um recado aqui: o Plano Cruzado não deu certo porque aqueles que fabricavam determinado produto e mantiveram o preço lá em cima tiveram gordura para queimar, enquanto os que produziam produto semelhante e não tiveram gordura para queimar foram à bancarrota. 
	A questão do teto do funcionalismo é a mesma coisa: os militares das Forças Armadas não têm gordura para queimar. Eu sou obrigado a partir para a negociação. Sendo um ou dois, com o meu filho, três ou mais, somando o Deputado Alberto Fraga, o Deputado Sóstenes Cavalcante e seja quem for, nós temos que partir para as negociações.  É preciso que fique bastante claro para o Governo que os militares das Forças Armadas não são corporativistas. Eles simplesmente não têm como suportar a situação de congelamento ou possível reforma na Previdência.
	Então, a negociação está aberta, Sr. Presidente. Estamos fazendo o possível para chegarmos a bom termo. Não se trata de livrarmos os militares das Forças Armadas, mas de darmos a eles um tratamento compatível nessas questões que se avolumam aqui, como o teto e a reforma da Previdência, cuja importância reconhecemos. 
V.Exa., nobre Deputado Delegado Edson Moreira, que serviu o Exército brasileiro e é nosso parceiro aqui, conhece as dificuldades em que nos encontramos. 
	E digo mais ainda: o Estado Democrático de Direito só se sustenta com fundamento no trabalho das Forças Armadas. Elas não podem agora simplesmente ser jogadas para escanteio, nesta situação econômica grave em que o Brasil se encontra.
	Obrigado, Sr. Presidente.
	O SR. PRESIDENTE (Delegado Edson Moreira) - Somos nós que agradecemos, Deputado."
2016-10-17T19:42;CONGRATULAÇÃO, ALBERTO FRAGA, DEPUTADO FEDERAL, RECONHECIMENTO, SUBTENENTE, ATUAÇÃO, APROVAÇÃO, MPV 737/2016, MEDIDA PROVISÓRIA.;PELA ORDEM;"O SR. JAIR BOLSONARO (Bloco/PSC-RJ. Pela ordem. Sem revisão do orador.) - Prezado Presidente Waldir Maranhão, sou grato pela deferência.
	Eu quero cumprimentar meus irmãos da Polícia Militar e do Corpo de Bombeiros Militar do DF na pessoa do Tenente Alberto Fraga, o qual conheci em 1982, quando cursamos juntos a Escola de Educação Física do Exército.
	Ele, como oficial, reconheceu a questão da última graduação dos praças - no caso, subtenentes -, dando-lhes mais uma oportunidade para concorrer não com os mais modernos, porque obviamente eles seriam preteridos, com toda a certeza, ou parte deles pelo menos. Ao garantir isso a esses subtenentes, ele está reconhecendo efetivamente o trabalho dos praças.
	Parabéns, Deputado Fraga, e parabéns a todos os que estão presentes hoje aqui, apoiando essa medida. (Palmas nas galerias.)"
2016-10-18T11:12;"DIA DO MÉDICO, HOMENAGEM.
PROGRAMA MAIS MÉDICOS, PARTICIPAÇÃO, CUBA, FORMAÇÃO ACADÊMICA, APREENSÃO.
MOVIMENTO DOS TRABALHADORES RURAIS SEM-TERRA (MST), INVASÃO, COLÉGIO PEDRO II (CPII), APREENSÃO.";BREVES COMUNICAÇÕES;"O SR. JAIR BOLSONARO (Bloco/PSC-RJ. Sem revisão do orador.) - Sr. Presidente, a minha formação é militar, mas eu queria cumprimentar os médicos por seu dia e dizer o seguinte: no que depender de mim, no futuro, podem ter certeza, vocês serão reconhecidos, primeiramente, com o envio de volta para Cuba dos 12 mil contratados que estão aqui, sem termos qualquer garantia de que conheçam minimamente a medicina.
	Afinal de contas, o Programa Mais Médicos existe mesmo é para enviar anualmente 1,3 bilhão de reais como forma de continuar financiando a ditadura cubana, cujo governo não respeita aquilo que tanto afirma defender: os direitos humanos. Estão aqui os ""médicos"" - entre aspas -, mas seus familiares, esposas, esposos e filhos estão reféns naquela ilha. 
	Gostaria muito que eles fossem submetidos ao exame Revalida - sei que não existe isto, mas que fosse até um Revalida light -, para mostrarem que sabem o mínimo de medicina. Mas, na verdade, não sabem absolutamente nada! 
Tivemos, há pouco tempo, informações concretas de que havia entre eles um capitão cubano. Infelizmente, seguindo a linha da Esquerda aqui no Brasil, o então Ministro Jaques Wagner informou à imprensa que se tratava de um capitão cubano que havia pedido demissão. Não é verdade. É mentira! 
Nós estamos com este problema aqui: há 12 mil cubanos no País, que, no meu entender, em sua maioria, são agentes e militares ainda a serviço do governo que estava no poder até pouco tempo atrás.
	No meu ponto de vista é necessária a valorização da classe dos médicos. Esses recursos, que somam mais de cem milhões de reais por mês, que gastamos para financiar a ditadura cubana, poderiam ser aplicados na medicina em nosso País.
	Sr. Presidente, no 1 minuto que me resta, aproveito para cumprimentar o Deputado Sóstenes Cavalcante, que tocou num assunto extremamente grave. Não é uma exceção, Deputado Sóstenes, é um balão de ensaio o que estão fazendo no Colégio Pedro II, no Rio de Janeiro, totalmente tomado por marginais do MST.
	Nós conhecemos a máxima de Lenin de que não se tomem quartéis, mas sim escolas. Eles agora estão mostrando realmente a que vieram, estão ocupando escolas e, lá dentro, um verdadeiro bunker, estão promovendo o desrespeito à constituição, o desrespeito à família, baseado na ideologia de gênero.
	Não é apenas, como o Deputado Sóstenes Cavalcante bem disse aqui, questão de meninos ocuparem banheiros, mas também de ocuparem vestiários, um crime que cometem contra a inocência das criancinhas em sala de aula. Afinal de contas, isso é PT, o partido da balbúrdia, o partido da corrupção, o partido que se caracterizou por tudo o que há de ruim em nosso País. Isso tem que mudar.
	Se Deus quiser, brevemente farei uma visita ao Colégio Pedro II.
	Obrigado, Sr. Presidente."
2016-10-26T10:00;;HOMENAGEM;"Ata da 277ª (ducentésima septuagésima sétima) Sessão da Câmara dos Deputados, Não Deliberativa Solene, matutina, da 2ª Sessão Legislativa Ordinária, da 55ª Legislatura, em 26 de outubro de 2016. Às 10 horas, o Sr. Hiran Gonçalves, no exercício da Presidência, nos termos do § 2º do artigo 18 do Regimento Interno, declarou aberta a sessão e deu por dispensada a leitura da ata da sessão anterior. O Sr. Presidente informou que a sessão destina-se à comemoração dos 65 anos de fundação do Conselho Federal de Medicina - CFM; prestou as devidas homenagens; e convidou para compor a Mesa os Srs. Lelo Coimbra, Deputado Federal; Carlos Vittal, Presidente do Conselho Federal de Medicina; Aldemir Humberto Soares, representante da Associação Médica Brasileira; Otto Baptista, Presidente da Federação Nacional dos Médicos; Waldir Cardoso, Presidente da Federação Médica Brasileira; Marcos Ávila, representando o Conselho Brasileiro de Oftalmologia; e Simão Sessim, Deputado Federal. O Sr. Presidente convidou todos a ouvir o Hino Nacional. Após a exibição de vídeo institucional, o Sr. Presidente proferiu discurso do Sr. Rodrigo Maia, Presidente da Câmara dos Deputados. Nos termos do § 2º do artigo 18 do Regimento Interno, assumiu a Presidência o Sr. Lelo Coimbra e concedeu a palavra ao Sr. Hiran Gonçalves, autor do requerimento. Reassumiu a Presidência o Sr. Hiran Gonçalves e concedeu a palavra aos Srs. componentes da Mesa, Simão Sessim, Marcos Ávila, Lelo Coimbra, Otto Baptista, Waldir Cardoso e Carlos Vittal e aos Srs. Tadeu Alencar, pelo PSB; Dr. João, pelo PR; Mandetta, pelo DEM; Dr. Jorge Silva, pelo PHS; e Eros Biondini, pelo PROS. Usaram da palavra pela ordem os Srs. Jair Bolsonaro, Mauro Pereira, Carmen Zanotto, Edinho Bez, Domingos Sávio, Benito Gama, Luiz Carlos Hauly, Izalci e Arnaldo Faria de Sá. Usaram da palavra ainda os Srs. Ricardo Barros, Ministro da Saúde; Pedro Henrique Souza Tavares, Secretário-Geral da Associação Nacional dos Estudantes de Medicina do Brasil; Naiara Balderramas, Presidente da Associação Nacional dos Médicos Residentes; e Brito Bezerra, Deputado Estadual da Assembleia Legislativa de Roraima. O Sr. Presidente registrou a presença de convidados, reiterou as homenagens prestadas, agradeceu a presença de todos e, às 12h47, encerrou a sessão.		
					
João Campos
Presidente

As notas taquigráficas desta Sessão Não Deliberativa Solene poderão ser solicitadas ao Departamento de Taquigrafia, Revisão e Redação - DETAQ."
2016-10-26T11:48;"SESSÃO SOLENE, COMEMORAÇÃO, ANIVERSÁRIO DE FUNDAÇÃO, CONSELHO FEDERAL DE MEDICINA (CFM).
PROGRAMA MAIS MÉDICOS, CONTRATAÇÃO, MÉDICO, CUBA, CRÍTICA.";HOMENAGEM;"O SR. JAIR BOLSONARO (Bloco/PSC-RJ. Sem revisão do orador.) - Sr. Presidente, obrigado pela deferência em me dar este 1 minuto.
	Quero primeiro cumprimentar o Dr. Roberto D'Ávila que faz aniversário hoje, assim como o do seu antecessor. (Palmas.) Foi meu colega R2 de Cavalaria, como ao meu lado aqui há um colega que serviu o Exército Brasileiro como médico.
	Prezado Presidente Dr. Carlos Vital, V.Sa. esteve comigo aqui naquela questão do Mais Médicos. Confesso - nunca neguei - que estive ao seu lado muito mais por questão ideológica do que médica. Na época - não sei se V.Sa. participou da conversa -, nós queríamos um Revalida light. Desculpem-me o termo. Por exemplo, eu faria a prova Revalida light, porque nós temos certeza de que há militares e agentes cubanos aqui no Brasil. 
Estão agora sendo substituídos a toque de caixa, mas esse discurso com dados, números e provas será à tarde. Proporei que escrevam benzetacil endovenosa, intramuscular ou oral. Já ficaria satisfeito no tocante a isso. 
Sr. Presidente, estamos financiando a ditadura cubana, mandando para lá 1 bilhão e 300 milhões de reais por ano. Não pensem que estamos pacificados com a questão política. A crise ainda nem começou. A crise não começou em 1964, começou em 1966, mas é um assunto para poucos minutos à tarde.
	A minha formação é diferente da de V.Sas., que estão aí para salvar brasileiros. A minha formação é para salvar o Brasil, e a verdade sai daquela tribuna ali, que é o meu tanque de guerra! A minha munição são as minhas palavras muitas vezes incompreendidas! 
A imunidade parlamentar eu não tenho mais, porque sou réu no Supremo Tribunal Federal. Sem querer desafiar quem quer que seja, continuarei usando a minha imunidade daquela tribuna. Para mim é motivo de honra e de satisfação - e muito mais honra e satisfação é estar ao lado de pessoas tão importantes como os senhores, neste momento, bem como muitos a que estão nos assistindo agora.
	Meu Presidente e meus amigos, muito obrigado. Agradeço a Deus por estar aqui no meu sétimo mandato como Deputado Federal.
	Deixo o meu grito de guerra: Brasil acima de tudo, Deus acima de todos!	Fiquem com Deus! Um abraço carinhoso a todos.
	Parabéns por exercerem essa tão importante e sacrificada profissão que é a de médico!
	Muito obrigado. (Palmas.)
	O SR. PRESIDENTE (Hiran Gonçalves) - Obrigado, Deputado Jair Bolsonaro."
