dataHoraInicio;keywords;tipoDiscurso;transcricao
2006-03-09T15:26;GOVERNO ESTADUAL, TO, MARCELO MIRANDA, GOVERNADOR, ATUAÇÃO, GASTOS PÚBLICOS, DESTINAÇÃO, RECURSOS ORÇAMENTÁRIOS, SECRETARIA DE ESTADO, AVALIAÇÃO, CRÍTICA.;PEQUENO EXPEDIENTE;"O SR. EDMUNDO GALDINO (PDT-TO. Pronuncia o seguinte discurso.) - Sr. Presidente, Sras. e Srs. Deputados, telespectadores da TV Câmara, venho alertar o povo tocantinense para o fato de que o atual Governador do Tocantins pretende gastar este ano 331 milhões de reais com a área política e mordomias palacianas, em detrimento dos investimentos e benefícios sociais necessários ao bem-estar do povo tocantinense.
A previsão orçamentária para o exercício de 2006 propõe um gasto de 287 milhões de reais com a governadoria e suas entidades vinculadas, que, comparados ao mesmo gasto no exercício de 2002, último ano do Governo Siqueira Campos, demonstra limitação falta de visão administrativa do Sr. Marcelo Miranda.
Para atender a mordomias palacianas, gastos de pessoal, prestadores de serviços, consultorias, só em seu Gabinete o Governador gastará o montante de 39 milhões e 259 mil reais, que, se comparados ao que foi despendido em 2002, no último ano do Governo Siqueira Campos (13 milhões e 138 mil reais), revelam aumento um gigantesco de 198%.
O Orçamento de 2006, do atual Governo, prevê despesas com secretarias de governo e articulação política, com pessoal, prestadores de serviços e consultores, no valor de 17 milhões e 651 mil reais - um assombroso aumento de 1.891%, eis que em 2002, no Governo Siqueira Campos, essas mesmas despesas foram de apenas 886 mil e 500 reais. 
A área de cultura tem e terá, em seu orçamento, para patrocinar os megashows, festas, carnaval e outros eventos, de propaganda do faz-de-conta governamental, o valor de 9 milhões e 500 mil reais.
A Secretaria da Juventude tem previsto despesas da ordem de 11 milhões e 500 mil reais, mas que se trata de dinheiro sem destino e não de aplicação nas políticas públicas, pois não existe, por parte dessa Secretaria, planejamento de programas e projetos que venham beneficiar a juventude tocantinense, pois sua atuação se restringirá à contratação de centenas de amigos e empresas para realizar pesquisas obscuras,  sobre ""o que o jovem precisa"".
Além disso, a Secretaria de Comunicação terá 23 milhões e  200 mil reais disponíveis para cuidar da imagem, fazer propaganda e divulgar as inexistentes obras de um governo limitado e sem rumo.
Todo esse dinheiro público apoderado pela Governadoria e suas Secretarias irá trazer conseqüências devastadoras para o processo político, para a democracia e, principalmente, para a economia do Estado, que chegará ao final do ano transformado em terra arrasada, porque os setores essenciais e vitais ao desenvolvimento estarão sendo perversamente prejudicados e sacrificados.
O total de recursos para investimentos em infra-estrutura do Sr. Marcelo Miranda, no orçamento de 2006, é de 820 milhões e 500 mil reais, o que equivale a 25,5% do orçamento total, enquanto que no governo de 2002, na gestão Siqueira Campos, na mesma rubrica, o percentual aplicado era de 41%, ocorrendo, portanto, no atual e tresloucado Governo, um decréscimo de aproximadamente 38% nos investimentos do Estado, o que demonstra o total desinteresse governamental pelo desenvolvimento do Tocantins.
Ao compararmos o montante astronômico de recursos, no valor de 331 milhões e 200 mil reais, destinado para a área política, para a Governadoria, para as Secretarias de Atuação Política do Governo, Juventude, Comunicação e Divulgação, verificamos que ele supera, em muito, todos os recursos que serão aplicados em áreas vitais, para o desenvolvimento do Tocantins, conforme discriminação a seguir:
Industria e Comércio 				R$22.500.000,00 
Ciência e Tecnologia 				R$  1.000.000,00
Agricultura 						R$87.500.000,00  
Planejamento e Meio Ambiente 			R$49.000.000,00
Cidadania e Justiça 				R$16.400.000,00  
Segurança Pública 					R$88.000.000,00
TOTAL  GERAL 					R$264.400.000,00
	Existe, assim, uma diferença de 66 milhões e 800 mil reais a favor da área política, em um ano eleitoral, que poderia ser revertida em obras e benfeitorias para a população do Estado.
Para se ter uma idéia mais clara sobre o que estamos dizendo, todos esses recursos (da ordem de 331 milhões de reais) destinados às áreas políticas e mordomias da corte palaciana, dariam para fazer:
• mil quilômetros de estradas pavimentadas, a 330 mil reais o quilômetro;
• 51 mil casas populares, no valor de 6 mil e 500 reais cada, que beneficiariam 204 mil pessoas, considerando-se que uma família, em média, é composta por casal e 2 filhos;
• 500  escolas públicas de bom padrão, no valor de 662 mil reais cada;
• 150 hospitais públicos de médio porte, no valor de 2 milhões e 200 mil reais cada;
• aquisição de 1 bilhão de litros de leite anual, no valor de 33 centavos o litro; ou seja, 2 milhões e 739 mil reais em litros diários, numa média de quase 3 litros diários para cada habitante, adulto, idoso ou criança, do Tocantins, de todas as classes e camadas sociais;
• aquisição de 5 milhões e 500 quinhentas mil cestas básicas anuais, na base de 60 reais cada uma, o que significaria a aquisição de 460 mil cestas mensais, para atender às famílias tocantinenses;
• aquisição de 15 mil carros populares, no valor de 22 mil reais cada um, o que daria uma fila indiana de 60 quilômetros, distância quase igual a de Palmas a Porto Nacional;
• custear 92 mil bolsas de estudos anuais, no valor mensal de 300 reais cada uma, sendo que o nosso Estado possui menos de 30 mil universitários.
É aqui que estão as repostas sobre a falta de grandes e médias obras em nosso Estado, o que vem causando o desaquecimento de uma economia promissora. O setor de obras públicas é o que gera mais empregos e dinamiza o comércio local, e sem elas nossos índices de desemprego só aumentaram. Nossa indústria está estagnada pela falta de seriedade com que as coisas públicas são tratadas em nosso Estado, onde protegem apadrinhados, causando desconfiança e temor nos investidores externos.
Nosso setor de segurança pública está um caos. Houve no atual Governo um aumento vertiginoso da violência, com a incidência cada vez maior de assaltos, roubos, furtos, assassinatos, sem que o poder público tomasse as providências cabíveis. A impunidade campeia por todos os rincões do Tocantins, nas grandes e pequenas cidades, principalmente na zona rural. Já temos um cemitério lotado de gente assassinada em nosso Estado; e os autores e culpados dos crimes nunca são encontrados, a polícia não prende ninguém. É total a inoperância, a falência do sistema de segurança pública!
E a piada do orçamento destinado à área de ciência e tecnologia? Comunidade universitária e científica: abram os olhos. Somente 1 milhão de reais para custear projetos e pesquisas científicas e técnicas é brincar com nossa razão! O Tocantins é hoje um polo universitário em desenvolvimento, com 2 universidades, com faculdades e institutos de ensino superior espalhados em nossas grandes cidades e não merece esse descaso. Como será nosso futuro, se não temos pesquisas para auxiliar o crescimento agrícola, para incrementar o aumento de nossas criações animais, sendo a economia do Tocantins predominantemente da agroindústria? E, se tivermos novas endemias, como a que assolou o Rio Araguaia, que contaminou centenas de pessoas e cegou outras dezenas nas proximidades de Araguatins? A poluição do rio também causou a morte de dezenas de crianças indígenas das aldeias localizadas às suas margens. Certamente, com esses parcos recursos só nos restará rezar para que menos mortes aconteçam. Este será o verdadeiro legado do Sr. Marcelo Miranda ao Estado. Seu nome ficará na história como o ""governador das pragas e doenças endêmicas do Tocantins"".
Infelizmente, o Governador do Tocantins entrará para a história como o único governador estadual no Brasil que, nos primeiros 2 anos de mandato, teve seus parentes próximos (irmãs, cunhados, tios, tias etc.) enriquecidos; esses familiares do Governador construíram verdadeiras mansões, avaliadas, em média, em mais de 1 milhão de reais!
Também esse Governador fará parte da história por ter contratado, por 12 milhões de reais, uma empresa de taxi aéreo, sem licitação, para prestar serviços exclusivos à governadoria, somente para este ano. Isto significa que pelo menos 20 aviões teriam que permanecer no ar 24 horas por dia, 365 dias do ano.
Sr. Presidente, Sras. e Srs. Deputados, telespectadores que me ouvem: parafraseando o dito popular, ""os números não mentem jamais""!
O Sr. Governador atual tem jogado o Orçamento Público pelo ralo, ou no bolso dos amigos, pois o que aumentou, o que cresceu no orçamento do seu Governo foi o gasto com prestadores de serviços e com pessoal, onerando a folha de pagamento estadual com a contratação de parentes, amigos, apadrinhados, cabos eleitorais, que recebem altas gratificações.
Fatos como esse envergonham nosso povo, que fica à míngua, sem proteção de um governo que ele elegeu para melhorar sua vida, mas que a cada dia que passa os deixa mais pobre e infeliz.
Mas vox populis vox Deo. Em outubro, todos nós do Tocantins (empresários, trabalhadores, estudantes e professores, servidores públicos, agricultores, e o povo em geral) assinalaremos nossa revolta, nossa angústia, votando maciçamente na mudança, devolvendo o Sr. Marcelo Miranda à sua verdadeira vocação: ""empresário do ramo dos amigos"".
Por fim alerto o Ministério Público, Estadual e Federal, o Tribunal Regional Eleitoral, o Tribunal de Contas, a OAB-TO, e conclamo todas as entidades representativas do sociedade civil a não se omitirem, não aceitarem mais esse quadro aterrorizador que aqui mostrei.
Sr. Presidente, Sras. e Srs. Deputados, prezados telespectadores, era o que eu tinha a denunciar. Muito obrigado."
2006-03-16T16:32;PROPOSTA, EMENDA CONSTITUCIONAL, CRIAÇÃO, FUNDO PARA A REVITALIZAÇÃO HÍDRICA AMBIENTAL ECONÔMICA E SOCIAL, BACIA DO RIO ARAGUAIA, APRESENTAÇÃO.;PELA ORDEM;"O SR. EDMUNDO GALDINO (PDT-TO. Pela ordem. Sem revisão do orador.) - Sr. Presidente, Sras. e Srs. Deputados, ilustres visitantes, usamos o horário da Liderança do PDT, na condição de Vice-Líder, para apresentar à Casa proposta de emenda à Constituição que acrescenta artigo ao Ato das Disposições Constitucionais Transitórias e institui fundo para revitalização hídrica, ambiental, econômica e social da bacia do Rio Araguaia.
	Muito obrigado, Sr. Presidente.
	O SR. PRESIDENTE (Adelor Vieira) - Esta Presidência acolhe o projeto."
