dataHoraInicio;keywords;tipoDiscurso;transcricao
2006-02-02T15:00;DOENÇA, OLHOS, CEGUEIRA, MORTE, CRIANÇA, MUNICÍPIO, ARAGUATINS, TO, RESERVA INDÍGENA, APINAJÉ, PROVIDÊNCIA, GOVERNO ESTADUAL, MS, ASSISTÊNCIA MÉDICA.;PEQUENO EXPEDIENTE;"O SR. EDMUNDO GALDINO (PDT-TO. Pronuncia o seguinte discurso.) - Sr. Presidente, Sras. e Srs. Deputados, o Brasil precisa estar atento à situação calamitosa enfrentada na área da saúde pelos habitantes da região norte do Estado do Tocantins. Na cidade de Araguatins e imediações, uma doença ocular, provavelmente transmitida por parasita, já atingiu centenas de pessoas, causando cegueira irreversível em várias delas. Na reserva indígena apinajé, várias crianças estão morrendo e dezenas apresentam sintomas de um mal cuja origem ainda é desconhecida.
	Situada a 640 quilômetros da Capital do Estado, às margens do Rio Araguaia, e com população aproximada de 30 mil habitantes, Araguatins costuma atrair um bom número de visitantes para sua temporada de praias. Não apenas Araguatins, mas as cidades ribeirinhas do Rio Araguaia atraem turistas de todos o Brasil e até mesmo de fora. 
Os sintomas da doença são semelhantes aos da conjuntivite, ou seja, coceira e ardência nos olhos, e a causa mais provável, segundo a Secretaria Estadual da Saúde, é a contaminação pelo parasita trematóide, encontrado em caramujos à beira do rio.
Conforme o Jornal do Tocantins e outros órgãos de imprensa, 12 moradores de Araguatins estão cegos, sendo 5 deles crianças, e no total 262 foram afetados. Além disso, há casos suspeitos nos Municípios de Pau D'Arco e Xambioá, entre outros.
O impacto da notícia de que as águas do Rio Araguaia estão cegando as pessoas trouxe imenso prejuízo ao Estado do Tocantins. 
A Secretaria de Vigilância do Ministério da Saúde foi notificada do problema pelas autoridades estaduais no início de novembro, e desde então têm sido realizados exames nos pacientes e encontros de técnicos para analisar a questão. Grupos de trabalho foram formados para cuidar do atendimento clínico, da vigilância epidemiológica e da avaliação ambiental.
Oficialmente, a Secretaria de Vigilância em Saúde informa que, após avaliação clínica, 197 pessoas foram consideradas casos prováveis da doença. De 3 pacientes inicialmente notificados como casos de cegueira, 2 tiveram, de fato, diagnóstico clínico de baixa de visão progressiva, e já se submeteram à cirurgia em Belo Horizonte.
Quanto à origem do problema, o órgão federal admite que parece estar relacionada com o banho no Rio Araguaia, mas as análises realizadas ainda não forneceram dados conclusivos.
Assim, Sr. Presidente, com dúvidas sobre o número de pacientes, o alcance e até a causa desse mal, permanece em Araguatins e nos Municípios próximos um clima de incerteza, provocando justificada tensão entre os moradores. É preciso que a ação dos responsáveis pela saúde pública nos diversos níveis seja rápida, eficiente e esclarecedora, de modo a evitar o surgimento de novos casos e tranqüilizar em definitivo a população.
Da mesma forma, pretendo chamar a atenção dos Governos Federal e Estadual para o que está ocorrendo na reserva indígena apinagé, onde, em apenas um mês, uma doença não identificada provocou a morte de 6 crianças, debilitadas por diarréia, vômitos, febre e gripe. Outras 60 crianças da tribo estão apresentando sintomas semelhantes, e 8 delas já foram internadas em hospitais de Araguaína e Tocantinópolis.
As notícias indicam que a Fundação Nacional de Saúde enviou uma equipe à reserva, e que está procurando adotar as medidas mais urgentes para enfrentar a situação.
Diante de um quadro tão grave, providências emergenciais são, realmente, o primeiro passo, mas queremos muito mais do que isso; queremos um trabalho efetivo para assegurar a saúde dos povos indígenas, prevenindo episódios como os que hoje estão abalando a reserva apinagé. Esta é uma responsabilidade da qual o Poder Público não se pode eximir, seja em  âmbito federal, seja em âmbito estadual.
Partindo-se do conceito de que ""saúde pública é a ciência e a arte de evitar doenças, prolongar a vida e desenvolver a saúde física e mental e a eficiência, através de esforços organizados da comunidade para o saneamento do meio ambiente, o controle de infecções na comunidade, a organização de serviços médicos e paramédicos para o diagnóstico precoce e o tratamento preventivo de doenças, e o aperfeiçoamento da máquina social que irá assegurar a cada indivíduo, dentro da comunidade, um padrão de vida adequado à manutenção da saúde"", como definiu Maria Zélia Rouquayrol, em 1994, venho a esta tribuna exigir das autoridades brasileiras a verdadeira promoção da saúde em nosso País, que caracterize um nível de atenção da medicina preventiva, com um enfoque centrado no indivíduo, com uma projeção para a família ou grupos, passando a associar-se a medidas preventivas sobre o ambiente físico e estilos de vida. 
Sr. Presidente, Sras. e Srs. Deputados, lamento o fato de que a saúde da população seja muitas vezes tratada como assunto de menor importância. As autoridades do Estado do Tocantins e do Governo Federal não seguem essa imprescindível política de prevenção, permitindo, assim, casos epidemiológicos que resultam em morte e doenças dos cidadãos deste País. E, sobretudo, estou decidido a acompanhar de perto esses 2 episódios que tanto estão inquietando meus conterrâneos do norte do Tocantins.
Para encerrar, quero, nesta oportunidade, alertar as autoridades de saúde do Estado e o Governador, que abandonou o setor, que deixou de lado a preocupação básica com a prevenção, sucateando os órgãos de saúde, para que tomem providências, a fim de evitar que esse mal se alastre. É preciso também que o Ministro da Saúde, por meio dos órgãos competentes, tome medidas no sentido de acudir a população do Bico do Papagaio, mais precisamente da cidade de Araguatins. Quase 300 pessoas foram contaminadas, estão cegas, e cerca de 60 crianças indígenas estão morrendo de diarréia, vômito, entre outros males, vítimas de uma doença ainda não conhecida.
Muito obrigado."
2006-02-09T16:56;PROJETO DE DECRETO LEGISLATIVO,  APROVAÇÃO, TEXTO,  ACORDO INTERNACIONAL, GOVERNO BRASILEIRO, GOVERNO, PAÍS ESTRANGEIRO, FRANÇA, CONSTRUÇÃO, PONTE INTERNACIONAL, RIO OIAPOQUE, LIGAÇÃO, AP, PAÍS ESTRANGEIRO, GUIANA FRANCESA, VOTO FAVORÁVEL, PARTIDO POLÍTICO, PDT.;ORIENTAÇÃO DE BANCADA;O SR. EDMUNDO GALDINO (PDT-TO. Pela ordem. Sem revisão do orador.) - Sr. Presidente, o PDT encaminha favoravelmente à matéria e faz apelo ao Líder do PFL para que retire o pedido de verificação da votação.
2006-02-09T18:12;CRIANÇA, MUNICÍPIO, ARAGUATINS, TO, PARASITA, RIO ARAGUAIA, CEGUEIRA, ARTIGO DE IMPRENSA, JORNAL DO TOCANTINS, AUTORIA, EDUARDO GOMES, DEPUTADO FEDERAL.;PELA ORDEM;"O SR. EDMUNDO GALDINO (PDT-TO. Pela ordem. Sem revisão do orador.) - Sr. Presidente, Sras. e Srs. Deputados, semana passada, usei da palavra para relatar o triste quadro que vem ocorrendo na cidade de Araguatins, envolvendo principalmente crianças, que estão sendo vítimas do verme trematódeo, causador de cegueira. 
	Ocupo a tribuna para pedir que seja registrado nos Anais da Casa artigo escrito pelo eminente Deputado Eduardo Gomes, do PSDB do Tocantins, publicado no Jornal do Tocantins, edição de hoje, com o título O Rio Araguaia tem Sede.  Gostaria de acrescentar a este artigo um segundo título: ""O Rio Araguaia pede socorro"". 
	Com essa preocupação e tendo em vista a oportunidade e a profundidade com que o assunto foi tratado nesse artigo, solicito a V.Exa. que determine seu registro nos Anais da Casa e sua divulgação nos meios de comunicação da Câmara dos Deputados. 
ARTIGO A QUE SE REFERE O ORADOR"
2006-02-23T16:27;GADO LEITEIRO, PECUÁRIA, LEITE, CRISE, ANÁLISE, MODERNIZAÇÃO, DEFESA, GOVERNO FEDERAL, AUXÍLIO, SOLICITAÇÃO.;COMO LÍDER;"O  SR.  EDMUNDO GALDINO (PDT-TO. Como Líder. Pronuncia o seguinte discurso.) - Sr. Presidente, Sras. e Srs. Deputados, ocupo a tribuna para apresentar-lhes uma breve reflexão sobre o drama da pecuária de leite. Falo em termos gerais, mas a análise aplica-se, de modo especial, ao meu Estado, o Tocantins.
Primeiro, destaco a importância do leite para a saúde da população, principalmente para as crianças e idosos. Conforme dados da EMBRAPA, o leite é um alimento natural de grande valor nutritivo, com maior concentração de cálcio, essencial para a formação e manutenção dos ossos. As proteínas do leite são completas, propiciando a formação e manutenção dos tecidos humanos.
Além da vitamina A, o leite contém as vitaminas B1, B2 e minerais, que favorecem o crescimento e a manutenção de uma vida saudável. A indústria de laticínios tem potencializado o valor nutritivo do produto. Existem no mercado uma série de bebidas lácteas enriquecidas com vitaminas, minerais e ômegas, assim como leites especiais para as pessoas que não conseguem digerir a lactose.
Além da importância nutritiva, o leite está entre os 6 produtos mais importantes da agropecuária brasileira. O agronegócio do leite e seus derivados desempenham um papel relevante no suprimento de alimentos e na geração de emprego e renda para a população.
O Brasil é o sexto maior produtor de leite do mundo e cresce a uma taxa anual de 4%, superior à de todos os países que ocupam os primeiros lugares. Respondemos por 66% do volume total do leite produzido nos países que compõem o MERCOSUL. Pelo faturamento de alguns produtos da indústria brasileira de alimentos na última década, pode-se avaliar a importância relativa do produto lácteo no contexto do agronegócio nacional, registrando 248% de aumento contra 78% de todos os demais segmentos. No Tocantins, somente na região de Araguaína, são produzidos mais de 300 mil litros de leite por dia.
Contudo é relevante destacar, Sr. Presidente, que os preços do leite estão desvalorizados. À primeira vista, o problema se resume aos baixos preços pagos aos produtores. Começaram a cair na entressafra, justamente quando os custos de produção estavam em seu ponto mais alto. Por causa desse desequilíbrio entre preço e custos, algumas centenas de milhares de pessoas em todo o País estão passando por dificuldades. A situação é ainda pior no Estado do Tocantins.
Todavia, o problema da pecuária leiteira vai muito além de um desequilíbrio conjuntural entre preços e custos. O problema é estrutural: não desaparecerá sem uma bem focada intervenção do Poder Público, ou sem uma forte mobilização de todos os elos da cadeia produtiva. Caso nada seja feito, a tendência é o agravamento da crise.
Na falta de segurança aos investimentos, a atividade é condenada à estagnação e ao atraso tecnológico. Chama atenção o fato de a pecuária leiteira ser a atividade que mais dificuldades tem tido em acompanhar o notável progresso da agropecuária brasileira. Será que se pode explicar por que a produção brasileira de milho - só para citar uma lavoura que, como o leite, é difundida por todo o território nacional - modernizou-se a ponto de competir com qualquer outro país, e a produção de leite não? Eis aí uma anomalia que clama por explicação.
Obviamente, a produção leiteira só sobreviverá se conseguir acompanhar o desenvolvimento do restante da agropecuária. O desafio é alcançar esse objetivo sem marginalizar a vasta maioria dos produtores no processo. Para atingir tal meta, existem propostas alternativas entre empresários, produtores e Governo que melhoram, consideravelmente, os rendimentos dos produtores de pequeno, médio e grande porte.
Como exemplos, podemos citar os programas sociais que oferecem à população de baixa renda o consumo diário de leite. Tais projetos já estão sendo viabilizados no Distrito Federal e nos Estados do Paraná, Rio Grande do Norte, Ceará, entre outros.
Diante desse quadro, Sras. e Srs. Deputados, era de se esperar que o Governo desse ao leite a prioridade que sua importância estratégica lhe confere. Infelizmente, não é isso que vemos. No Tocantins, por exemplo, os produtores de leite de Araguaína já fizeram diversas propostas ao Governo Estadual para viabilizar a aquisição de leite, por meio dos programas sociais, movimentando assim a economia dos produtores e cooperativas no Estado. 
Além disso, os produtores de leite sugeriram a implantação de escolas técnicas no Estado, que atenderão a necessidade de aperfeiçoamento na produção de leite. Tal alternativa evitaria, contudo, a produção de leite de pouca qualidade, que não seja valorizado no mercado nacional e internacional; evitaria também que os nossos produtos prejudicassem a saúde da população.
Os produtores de leite do Tocantins também solicitaram ao Governo Estadual a criação de um centro tecnológico, o melhoramento nas estradas rurais, a implantação de assistência técnica voltada para as propriedades rurais, a intensificação da fiscalização que impeça o transporte e a comercialização de leite clandestino.
Apesar dessas propostas, dessas alternativas, até o momento o Governo do Tocantins não respondeu ou implantou projeto algum nesse setor em nosso Estado. Portanto, Sr. Presidente, sem idéias e sem liderança, não há iniciativa que prospere.
Vale destacar também que a estagnação da demanda funciona como um freio ao aumento da produtividade e à modernização. Inovações que se fazem acompanhar de aumentos de produção levam inexoravelmente à queda de preços e ao retrocesso tecnológico, principalmente na forma da deterioração das propriedades genéticas do rebanho leiteiro. 
Contudo, ainda assim, a produção, por assim dizer, ""extrativista"", com base na exploração sazonal de pastagens nativas e cultivadas, é uma das únicas que se mantém viável economicamente. O IBGE contou 1,8 milhão de produtores, em todo o Brasil, no último Censo Agropecuário. São tão numerosos que é impossível organizá-los. 
Mas a dicotomia entre esses dados é séria. Há produtores, em geral médios e grandes, que operam no mercado formal, e há a multidão dos que estão no mercado informal, ou que produzem para subsistência. Aqueles que produzem leite de qualidade razoável a boa não chegam a ser objeto de preocupação. Hoje, 64% da produção de leite provém do mercado formal; 22%, do mercado informal, e 14% são consumidos na fazenda.
A indústria é tão heterogênea como os produtores. Há poucas - em geral, as maiores - na linha de frente da tecnologia, e há muitas a quem pouco importa a qualidade da matéria-prima, desde que seja barata, é claro. As características da demanda também não ajudam. Diz-se, no jargão econômico, que a demanda de leite é inelástica ao preço e à renda. 
Em outras palavras, leite é definido como ""bem inferior"". Suas qualidades como alimento não importam. O que importa é que, quando a renda aumenta, os consumidores compram telefones celulares ou ingerem mais cerveja, e não dão mais leite às crianças.
Sr. Presidente, nobres colegas, a dura realidade é que, nas circunstâncias atuais, produzir leite não é um bom negócio. Mas, ao mesmo tempo, a atividade é das mais importantes não só em relação à segurança alimentar da população, mas também ao número de pessoas que ocupa. O leite produz um alto fluxo de renda no País. Somente no ano passado, o Brasil produziu 25 bilhões de litros de leite, gerando mais de 10 bilhões de reais em renda para os produtores, segundo matéria da Folha de S.Paulo. Tais recursos sustentam o parque industrial brasileiro de produtos veterinários, rações animais, equipamentos e insumos em geral. Em um país onde o crédito é caro e restrito, a renda do leite é indispensável tanto à sobrevivência da família quanto à manutenção da fazenda. Sem essa renda, boa parte da agropecuária não sobrevive. O leite é um produto estratégico.
O Governo Federal tomou 2 medidas de impacto: promulgou a Instrução Normativa nº 51 e criou a Câmara Setorial do Leite. As 2 medidas foram importantes. Trouxeram esperança - quase nada mais que esperança.
A Instrução Normativa nº 51 definiu padrões mínimos de qualidade do leite e tornou esses padrões obrigatórios. Ninguém pode opor-se a que se exija a substancial melhoria da qualidade do leite vendido à população. Alimento de má qualidade é problema de saúde pública. Sem melhoria da qualidade do leite, os mercados externos continuarão restritos. O problema, do qual o Governo não se deu conta, é que definir padrões de qualidade é uma coisa, mas, daí a fazer com que as pessoas cumpram a lei, a distância é grande. Para atender ao que a Instrução Normativa nº 51 determina, o leite deve ser refrigerado na fazenda. E se não houver energia elétrica na fazenda nem em comunidade vizinha? E se o suprimento de eletricidade não for confiável? Além disso, o produtor encontra-se no dilema entre produzir com prejuízo ou cair na ilegalidade. Que caminho escolher? 
Sr. Presidente, Sras. e Srs. Deputados, modernizar a produção de leite sem alijar do processo a vasta maioria dos produtores é um gigantesco desafio. Esta é a pergunta que não quer calar: estará o Governo à altura do desafio? Quando olho ao redor, principalmente em meu Estado, nada indica que a resposta a essa indagação seja positiva.
	Sr. Presidente, solicito a V.Exa. que este pronunciamento seja divulgado pelos meios de comunicação da Casa.
Meus cumprimentos a V.Exa. pelo brilhante exercício à frente da presidência dos nossos trabalhos.
Muito obrigado.
O SR. PRESIDENTE (Manato) - Nobre Deputado Edmundo Galdino, V.Exa. é motivo de orgulho para o PDT. Sua solicitação será atendida."
2006-03-08T12:30;MULHER, DIREITOS, DISCUSSÃO, DIA INTERNACIONAL, REUNIÃO, COMISSÃO GERAL, HOMENAGEM.;PELA ORDEM;"O SR. DEPUTADO EDMUNDO GALDINO - Sra. Presidente, Sras. e Srs. Deputados, hoje, dia 08 de março, comemora-se o Dia Internacional da Mulher. Para mim, é uma imensa satisfação participar desta sessão solene em homenagem ao ser mais sublime da face da terra, a mulher.
	Sou consciente de que as palavras jamais serão suficientes para retratar momento tão majestoso e importante como este. Por isso, peço permissão para declamar um poema do consagrado escritor Victor Hugo, que, a meu ver, expressa melhor este momento.
Tal poema teve seus primeiros versos mencionados pela Deputada Federal Maria Lúcia Cardoso, do PMDB de Minas Gerais. É para mim uma honra concluí-lo nesta solenidade, naturalmente, com a permissão da ilustre Deputada.
	""O Homem e a Mulher
O homem é a mais elevada das criaturas;
a mulher, o mais sublime dos ideais.
Deus fez para o homem um trono;
para a mulher fez um altar.
O trono exalta e o altar santifica.
O homem é cérebro; a mulher, coração.
O cérebro produz a luz; o coração produz amor.
A luz fecunda; o amor ressuscita.
O homem é o gênio, a mulher, o anjo.
O gênio é imensurável; o anjo é indefinível.
 	A aspiração do homem é a suprema glória; a aspiração da mulher é a virtude extrema.
A glória promove a grandeza, e a virtude, a divindade.
O homem tem a supremacia; a mulher, a preferência.
A supremacia significa força; a preferência representa o direito.
O homem é forte pela razão; a mulher invencível pelas lágrimas. 
A razão convence, e as lágrimas comovem.
O homem é capaz de todos os heroísmos; a mulher, de todos os martírios. 
O heroísmo enobrece, e o martírio purifica. 
O homem pensa, e a mulher sonha. 
Pensar é ter uma palavra no cérebro; sonhar é ter na fronte uma auréola. 
O homem é a águia que voa; a mulher, o rouxinol que canta.
Voar é dominar o espaço, e cantar é conquistar a alma.
Enfim, o homem está colocado onde termina a terra; a mulher, onde começa o céu.
	Sra. Presidenta, Sras. e Srs. Deputados, nesse poema, Victor Hugo, ao ressaltar as diferenças entre homens e mulheres, longe de querer diminuir a condição feminina, somente a engrandece, ao destacar de maneira extraordinária as qualidades femininas exatamente naqueles pontos em que os homens não são capazes ou ainda não foram capazes de crescer.
	Portanto, finalizo, rendendo minha homenagem a todas as mulheres presentes neste plenário, bem como a todas as mulheres do Brasil e, em particular, do meu Estado, o Tocantins.
	Rogo a Deus e a todos os anjos do universo que conservem, por toda eternidade, a beleza, a meiguice, a ternura, a sensibilidade, a sabedoria e os demais dons inerentes à mulher, como a maternidade e, sobretudo, a valentia santa com que enfrentam o preconceito, a opressão, a desigualdade e os demais desafios da vida.
	Muito obrigado."
